,CMP,CRAN,CREATIS,CRIL,CRISTAL,DI ENS,CROSSING (IRL),ETIS,FILOFOCS (UMI),GIPSA-Lab,GREYC,G-SCOP,HEUDIASYC,I3S,ICUBE,IDRIS,IPAL  (IRL),IRIF,IRISA,IRIT,ISIR,JFLI,L2S,LAAS,LABRI,LAB-STICC,LAMIH,LAMSADE,LIG,LIGM,LIMOS,LIP,LIP6,LIPN,LIRIS,LIRMM,LIS,LISN,LIX,LMF,LORIA,LS2N,LMF-LSV,MDLS,RELAX,ROOT (IRL),STMS,TIMA,TIMC IMAG,VERIMAG
Universidade Federal do Rio Grande do Sul [Porto Alegre],0,4,1,0,3,0,0,0,0,13,0,11,0,20,2,0,0,0,7,14,0,0,7,18,11,4,1,0,121,2,0,9,10,0,3,17,13,8,0,0,5,0,0,0,0,0,0,10,2,0
Universidade Federal do Tocantins,0,0,0,0,0,0,0,0,0,0,0,0,0,0,0,0,0,0,3,0,0,0,0,0,0,0,0,0,0,0,0,0,0,0,0,0,0,0,0,0,0,0,0,0,0,0,0,0,0,0
"Universidade La Salle [Canoas, Brasil]",0,0,0,0,0,0,0,0,0,0,0,0,0,0,0,0,0,0,0,0,0,0,0,0,0,0,0,0,0,0,0,0,0,0,0,1,0,0,0,0,0,0,0,0,0,0,0,0,0,0
Universidade Paulista [São Paulo],0,0,0,0,0,0,0,0,0,1,0,0,0,0,0,0,0,0,0,0,0,0,0,0,0,0,0,0,0,0,0,0,0,0,0,0,1,0,0,0,0,0,0,0,0,0,0,0,0,0
Universidade Positivo,0,0,0,0,0,0,0,0,0,0,1,0,0,0,0,0,0,0,0,0,0,0,0,0,0,0,0,0,0,0,0,0,0,0,0,0,0,0,0,0,0,0,0,0,0,0,0,0,0,0
Universidade Presbiteriana Mackenzie,0,0,0,0,0,0,0,0,0,0,0,0,0,1,0,0,0,0,0,1,0,0,0,0,0,0,0,0,0,0,0,0,0,0,0,0,2,0,0,0,0,0,0,0,0,0,0,0,0,0
Universidade Regional de Blumenau,0,0,0,0,0,0,0,0,0,0,0,0,0,0,0,0,0,0,0,0,0,0,0,0,0,0,0,0,0,0,0,0,0,0,0,1,0,0,0,0,0,0,0,0,0,0,0,0,0,0
Universidade Regional do Noroeste do Estado do Sul [Ijuí],0,0,0,0,0,0,0,0,0,0,0,0,0,0,0,0,0,0,0,0,0,0,0,0,0,0,0,0,7,0,0,0,0,0,0,0,0,0,0,0,0,0,0,0,0,0,0,0,0,0
Universidade Tecnológica Federal do Paraná [Curitiba],0,5,0,0,0,0,0,0,0,0,0,0,3,0,0,0,0,0,1,0,0,0,0,0,1,0,1,0,2,0,0,0,0,0,0,2,0,0,0,0,0,0,0,0,0,0,0,0,0,0
Universidade de Brasilia [Brasília],0,1,0,0,0,0,0,0,0,6,0,0,0,1,1,0,0,0,1,7,0,0,0,1,1,0,0,1,1,0,0,1,0,0,0,22,0,9,0,0,7,0,0,0,0,0,0,0,0,0
Universidade de Caxias do Sul,0,0,0,0,0,0,0,0,0,0,0,0,0,0,0,0,0,0,0,0,0,0,0,1,0,0,0,0,0,0,0,0,0,0,0,0,0,0,0,0,0,0,0,0,0,0,0,0,0,0
Universidade de Fortaleza Endereço,0,0,0,0,0,0,0,0,0,0,0,0,0,1,0,0,0,0,0,0,0,0,0,0,0,0,0,0,0,0,0,0,0,0,0,0,0,0,0,0,0,0,0,0,0,0,0,0,0,0
Universidade de Mogi das Cruces = University of Mogi das Cruzes,0,0,0,0,0,0,0,0,0,0,0,0,0,0,1,0,0,0,0,0,0,0,0,0,0,0,0,0,0,0,0,0,0,0,0,0,0,0,0,0,0,0,0,0,0,0,0,0,0,0
Universidade de São Paulo,0,3,0,0,1,0,0,1,0,1,1,0,2,8,1,0,0,0,40,0,0,0,3,4,3,12,0,1,28,1,0,0,7,1,1,4,2,8,1,0,3,2,0,0,0,0,0,1,0,0
Universidade do Estado de Mato Grosso,0,0,0,0,0,0,0,0,0,0,0,0,0,0,0,0,0,0,0,0,0,0,0,0,0,0,0,0,0,0,0,0,0,0,0,0,0,0,0,0,2,0,0,0,0,0,0,0,0,0
Universidade do Estado do Rio Grande do Norte,0,0,0,0,0,0,0,0,0,0,0,0,0,0,0,0,0,0,1,0,0,0,0,0,0,0,0,0,0,0,2,0,0,0,0,0,0,0,0,0,0,0,0,0,0,0,0,0,0,0
Universidade do Estado do Rio de Janeiro [Rio de Janeiro],0,0,0,0,1,0,0,0,0,0,0,1,1,0,0,0,0,0,0,1,0,0,1,2,2,0,1,0,0,0,0,0,4,0,0,5,0,0,0,0,0,0,0,0,0,0,0,0,0,0
Universidade do Vale do Itajaí,0,0,0,0,0,0,0,0,0,0,0,0,0,0,0,0,0,0,0,0,0,0,0,0,0,1,0,0,0,0,0,0,0,0,0,10,0,0,0,0,0,0,0,0,0,0,0,0,0,0
Universidade do Vale do Rio dos Sinos,0,0,0,0,0,0,0,0,0,0,0,0,0,0,0,0,0,0,0,0,0,0,0,0,0,0,0,0,0,0,0,1,0,0,0,0,0,0,0,0,0,0,0,0,0,0,0,0,0,0
University of Brasilia [Brazil],0,3,0,0,0,0,0,0,0,2,0,0,0,0,0,0,0,0,0,0,0,0,0,0,1,0,0,0,0,0,0,0,0,0,0,0,0,0,0,0,3,0,0,0,0,0,0,0,0,0
"University of Minnesota, Department of Computer Science and Engineering",0,0,0,0,0,0,0,0,0,0,0,0,0,0,0,0,0,0,0,0,0,0,0,0,0,0,0,0,0,0,0,0,0,0,0,0,0,1,0,0,0,0,0,0,0,0,0,0,0,0
University of Southern Santa Catarina [Florianopolis],0,0,0,0,0,0,0,0,0,0,0,0,0,0,0,0,0,0,0,0,0,0,0,0,0,0,1,0,0,0,0,0,0,0,0,0,0,0,0,0,0,0,0,0,0,0,0,0,0,0
University of São Paulo,0,0,0,3,0,2,0,0,0,1,12,0,3,0,0,0,0,1,16,3,0,0,1,3,1,6,0,0,11,2,0,0,6,0,1,2,1,2,1,0,0,2,0,0,0,0,0,0,0,0
"Université Fédérale de Joao Pessoa, Centre de Technologie, Paraiba, Brazil",0,0,0,0,0,0,0,0,0,0,0,4,0,0,0,0,0,0,0,0,0,0,0,0,0,0,0,0,0,0,0,0,0,0,0,0,0,0,0,0,0,0,0,0,0,0,0,0,0,0
Université de San Paolo,0,0,0,0,0,0,0,0,0,2,0,0,0,0,0,0,0,0,0,0,0,0,0,0,0,0,0,0,0,0,0,0,0,0,0,0,0,0,0,0,0,0,0,0,0,0,0,0,0,0
Ustore,0,0,0,0,0,0,0,0,0,0,0,0,0,0,0,0,0,0,0,0,0,0,0,0,0,0,0,0,0,0,0,0,2,0,0,0,0,0,0,0,0,0,0,0,0,0,0,0,0,0
Western Parana State University [Cascavel],0,0,0,0,0,0,0,0,0,0,0,0,0,0,0,0,0,0,0,0,0,0,0,0,0,0,0,0,0,0,0,0,5,0,0,0,0,0,0,0,0,0,0,0,0,0,0,0,0,0
Zoetis Brazil,0,0,1,0,0,0,0,0,0,0,0,0,0,0,0,0,0,0,0,0,0,0,0,0,0,0,0,0,0,0,0,0,0,0,0,0,0,0,0,0,0,0,0,0,0,0,0,0,0,0
