,eid,doi,pii,pubmed_id,title,subtype,subtypeDescription,creator,afid,affilname,affiliation_city,affiliation_country,author_count,author_names,author_ids,author_afids,coverDate,coverDisplayDate,publicationName,issn,source_id,eIssn,aggregationType,volume,issueIdentifier,article_number,pageRange,description,authkeywords,citedby_count,openaccess,freetoread,freetoreadLabel,fund_acr,fund_no,fund_sponsor
779,2-s2.0-85050245899,10.1109/CoDIT.2018.8394954,,,Actuator Fault Detection for Vehicle Lateral Dynamics,cp,Conference Paper,Alaridh I.,,Université de Lille,Lille,France,,,,,2018-06-22,22 June 2018,"2018 5th International Conference on Control, Decision and Information Technologies, CoDIT 2018",,21100868896,,Conference Proceeding,,,,1110-1116,,,0,0,,,,,
780,2-s2.0-85050483955,10.1145/3206004.3206021,,,Facing the cover-source mismatch on JPHide using training-set design,cp,Conference Paper,Borghys D.,,Koninklijke Militaire School - Ecole Royale Militaire,Brussels,Belgium,,,,,2018-06-14,14 June 2018,IH and MMSec 2018 - Proceedings of the 6th ACM Workshop on Information Hiding and Multimedia Security,,21100869845,,Conference Proceeding,,,,17-22,,,6,0,repositoryvor,Green,,,
781,2-s2.0-85048321020,10.1186/s12859-018-2215-1,,29890948,DiNAMO: Highly sensitive DNA motif discovery in high-throughput sequencing data,ar,Article,Saad C.,,Université de Lille,Lille,France,,,,,2018-06-11,11 June 2018,BMC Bioinformatics,,17929,14712105,Journal,19,1,223,,,,2,1,repositoryvor,Green,,,
782,2-s2.0-85049154975,10.1109/WCNC.2018.8377070,,,Aggregation of multi-armed bandits learning algorithms for opportunistic spectrum access,cp,Conference Paper,Besson L.,,"CentraleSupélec - Campus de Rennes;Centre de Recherche en Informatique, Signal et Automatique de Lille ( CRISTAL )",Cesson-Sevigne;Villeneuve-d'Ascq,France;France,,,,,2018-06-08,8 June 2018,"IEEE Wireless Communications and Networking Conference, WCNC",15253511,145653,,Conference Proceeding,2018-April,,,1-6,,,2,0,repositoryam,Green,,,
783,2-s2.0-85049392562,10.1109/FG.2018.00071,,,Barycentric representation and metric learning for facial expression recognition,cp,Conference Paper,Kacem A.,,Université de Lille,Lille,France,,,,,2018-06-05,5 June 2018,"Proceedings - 13th IEEE International Conference on Automatic Face and Gesture Recognition, FG 2018",,21100866710,,Conference Proceeding,,,,443-447,,,4,0,repositoryam,Green,,,
784,2-s2.0-85049391259,10.1109/FG.2018.00116,,,Detecting depression severity by interpretable representations of motion dynamics,cp,Conference Paper,Anis K.,,Université de Lille,Lille,France,,,,,2018-06-05,5 June 2018,"Proceedings - 13th IEEE International Conference on Automatic Face and Gesture Recognition, FG 2018",,21100866710,,Conference Proceeding,,,,739-745,,,22,0,repositoryam,Green,,,
785,2-s2.0-85049386015,10.1109/FG.2018.00082,,,A new computational approach to identify human social intention in action,cp,Conference Paper,Daoudi M.,,Université de Lille,Lille,France,,,,,2018-06-05,5 June 2018,"Proceedings - 13th IEEE International Conference on Automatic Face and Gesture Recognition, FG 2018",,21100866710,,Conference Proceeding,,,,512-516,,,3,0,repositoryam,Green,,,
786,2-s2.0-85048498252,10.1109/ICTAI.2017.00117,,,Distributed algorithm for egalitarian matching between individuals and activities with additively separable preferences,cp,Conference Paper,Morge M.,,Université de Lille,Lille,France,,,,,2018-06-04,4 June 2018,"Proceedings - International Conference on Tools with Artificial Intelligence, ICTAI",10823409,145117,,Conference Proceeding,2017-November,,,739-746,,,0,0,repositoryam,Green,,,
787,2-s2.0-85050528746,10.2478/amcs-2018-0023,,,Control strategies for the grid side converter in a wind generation system based on a fuzzy approach,ar,Article,Harrabi N.,,Ecole Nationale d'Ingénieurs de Sfax,Sfax,Tunisia,,,,,2018-06-01,1 June 2018,International Journal of Applied Mathematics and Computer Science,1641876X,4500151509,20838492,Journal,28,2,,323-333,,,8,1,publisherfullgold,Gold,,,
788,2-s2.0-85050521434,10.2478/amcs-2018-0019,,,On-the-fly diagnosability analysis of bounded and unbounded labeled petri nets using verifier nets,ar,Article,Li B.,,Cent d'Automatique de Lille,Villeneuve-d'Ascq,France,,,,,2018-06-01,1 June 2018,International Journal of Applied Mathematics and Computer Science,1641876X,4500151509,20838492,Journal,28,2,,269-281,,,10,1,repositoryvor,Green,,,
789,2-s2.0-85048777075,10.1109/AMC.2019.8371098,,,Kane's method-based dynamic modeling and triple-trajectory tracking of a hyper redundant non-holonomic MDAMS,cp,Conference Paper,Wei Y.,,"Centre de Recherche en Informatique, Signal et Automatique de Lille ( CRISTAL )",Villeneuve-d'Ascq,France,,,,,2018-06-01,1 June 2018,"Proceedings - 2018 IEEE 15th International Workshop on Advanced Motion Control, AMC 2018",,21100865110,,Conference Proceeding,,,,255-262,,,1,0,,,,,
790,2-s2.0-85048374316,10.1089/soro.2017.0079,,29658827,"Finite element method-based kinematics and closed-loop control of soft, continuum manipulators",ar,Article,Bieze T.M.,,Université de Lille,Lille,France,,,,,2018-06-01,June 2018,Soft Robotics,21695172,21100779064,21695180,Journal,5,3,,348-364,,,44,0,repositoryam,Green,,,
791,2-s2.0-85046478472,10.1007/s00371-018-1522-x,,,Multiple importance sampling characterization by weighted mean invariance,ar,Article,Sbert M.,,Tianjin University;Universitat de Girona,Tianjin;Girona,China;Spain,,,,,2018-06-01,1 June 2018,Visual Computer,01782789,26146,,Journal,34,6-8,,843-852,,,8,0,,,,,
792,2-s2.0-85042116930,10.1016/j.swevo.2018.02.002,S2210650217304868,,A generic fuzzy approach for multi-objective optimization under uncertainty,ar,Article,Bahri O.,,"Centre de Recherche en Informatique, Signal et Automatique de Lille ( CRISTAL );ISGT",Villeneuve-d'Ascq;Tunis,France;Tunisia,,,,,2018-06-01,June 2018,Swarm and Evolutionary Computation,22106502,19900192513,,Journal,40,,,166-183,,,20,0,,,,,
793,2-s2.0-85028921383,10.1109/TFUZZ.2017.2728522,,,H<inf>∞</inf> LMI-Based Observer Design for Nonlinear Systems via Takagi-Sugeno Models With Unmeasured Premise Variables,ar,Article,Guerra T.M.,,Université Polytechnique Hauts-de-France,Valenciennes,France,,,,,2018-06-01,June 2018,IEEE Transactions on Fuzzy Systems,10636706,24242,,Journal,26,3,,1498-1509,,,40,0,,,,,
794,2-s2.0-85025816845,10.1177/1077546316688991,,,"A novel gearbox fault feature extraction and classification using Hilbert empirical wavelet transform, singular value decomposition, and SOM neural network",ar,Article,Merainani B.,,"Centre de Recherche en Informatique, Signal et Automatique de Lille ( CRISTAL );Université de Boumerdes",Villeneuve-d'Ascq;Boumerdes,France;Algeria,,,,,2018-06-01,1 June 2018,JVC/Journal of Vibration and Control,10775463,13034,17412986,Journal,24,12,,2512-2531,,,41,0,,,,,
795,2-s2.0-85048809471,10.1109/ICOA.2018.8370541,,,Towards controlling climatic parameters under greenhouse,cp,Conference Paper,Youssef E.A.,,Université de Lille;Université Moulay Ismail,Lille;Meknes,France;Morocco,,,,,2018-05-31,31 May 2018,"Proceedings of the 2018 International Conference on Optimization and Applications, ICOA 2018",,21100865109,,Conference Proceeding,,,,1-5,,,0,0,,,,,
796,2-s2.0-85047662692,10.3389/fpsyg.2018.00820,,,Affordance realization in climbing: Learning and transfer,ar,Article,Seifert L.,,CETAPS - Centre d'Etudes des Transformations des Activités Physiques et Sportives,Mont-Saint-Aignan,France,,,,,2018-05-28,28 May 2018,Frontiers in Psychology,,21100216571,16641078,Journal,9,MAY,820,,,,17,1,repositoryvor,Green,,,
797,2-s2.0-85048497227,10.1109/ATSIP.2018.8364485,,,A Bayesian approach for parameter estimation in railway systems,cp,Conference Paper,Jaoua N.,,IRT Railenium,Valenciennes,France,,,,,2018-05-23,23 May 2018,"2018 4th International Conference on Advanced Technologies for Signal and Image Processing, ATSIP 2018",,21100864354,,Conference Proceeding,,,,1-6,,,0,0,,,,,
798,2-s2.0-85048310407,10.1109/IC2E.2018.00041,,,A precise model for Google cloud platform,cp,Conference Paper,Challita S.,,Université de Lille,Lille,France,,,,,2018-05-16,16 May 2018,"Proceedings - 2018 IEEE International Conference on Cloud Engineering, IC2E 2018",,21100863699,,Conference Proceeding,,,,177-183,,,14,0,repositoryam,Green,,,
799,2-s2.0-85047075769,10.1186/s12885-018-4492-5,,29769060,BioPro-RCMI-1505 trial: Multicenter study evaluating the use of a biodegradable balloon for the treatment of intermediate risk prostate cancer by intensity modulated radiotherapy; study protocol,ar,Article,Pasquier D.,,Université de Lille;Centre Oscar Lambret,Lille;Lille,France;France,,,,,2018-05-16,16 May 2018,BMC Cancer,,28747,14712407,Journal,18,1,566,,,,4,1,repositoryvor,Green,,,
800,2-s2.0-85045697565,10.1113/JP275733,,29573276,Sinusoidal voltage protocols for rapid characterisation of ion channel kinetics,ar,Article,Beattie K.A.,,University of Oxford;Food and Drug Administration,Oxford;Rockville,United Kingdom;United States,,,,,2018-05-15,15 May 2018,Journal of Physiology,00223751,23478,14697793,Journal,596,10,,1813-1828,,,25,1,repositoryam,Green,,,
801,2-s2.0-85035213438,10.1002/cpe.4374,,,GPU-accelerated backtracking using CUDA Dynamic Parallelism,cp,Conference Paper,Carneiro Pessoa T.,,Universidade Federal do Ceará,Fortaleza,Brazil,,,,,2018-05-10,10 May 2018,Concurrency and Computation: Practice and Experience,15320626,27871,15320634,Journal,30,9,e4374,,,,9,0,,,,,
802,2-s2.0-85048307065,10.4230/LIPIcs.CPM.2018.18,,,Dualities in tree representations,cp,Conference Paper,Chikhi R.,,Université de Lille,Lille,France,,,,,2018-05-01,1 May 2018,"Leibniz International Proceedings in Informatics, LIPIcs",18688969,21100244929,,Conference Proceeding,105,,,181-1812,,,0,0,,,,,
803,2-s2.0-85046906307,10.1089/cmb.2017.0258,,29620920,AllSome Sequence Bloom Trees,ar,Article,Sun C.,,Pennsylvania State University,University Park,United States,,,,,2018-05-01,May 2018,Journal of Computational Biology,10665277,29581,,Journal,25,5,,467-479,,,10,0,repositoryam,Green,,,
804,2-s2.0-85044613362,10.1016/j.ijrobp.2018.01.037,S0360301618301007,29619972,In Reply to El Majjaoui et al,le,Letter,Pasquier D.,,Université de Lille,Lille,France,,,,,2018-05-01,1 May 2018,International Journal of Radiation Oncology Biology Physics,03603016,17191,1879355X,Journal,101,1,,237-238,,,0,0,,,,,
805,2-s2.0-85043458923,10.1016/j.ejcon.2018.01.006,S0947358017301085,,Unknown input observer with stability: A structural analysis approach in bond graph,ar,Article,Gonzalez J.,,"Centre de Recherche en Informatique, Signal et Automatique de Lille ( CRISTAL )",Villeneuve-d'Ascq,France,,,,,2018-05-01,May 2018,European Journal of Control,09473580,25406,,Journal,41,,,25-43,,,8,0,,,,,
806,2-s2.0-85041501105,10.1109/TSP.2018.2802452,,,Spatial Field Reconstruction and Sensor Selection in Heterogeneous Sensor Networks with Stochastic Energy Harvesting,ar,Article,Zhang P.,,University of Oxford,Oxford,United Kingdom,,,,,2018-05-01,1 May 2018,IEEE Transactions on Signal Processing,1053587X,17391,,Journal,66,9,,2245-2257,,,18,0,repositoryam,Green,,,
807,2-s2.0-85009445514,10.1016/j.future.2016.12.039,S0167739X16308706,,Multi-core versus many-core computing for many-task Branch-and-Bound applied to big optimization problems,ar,Article,Melab N.,,INRIA Institut National de Recherche en Informatique et en Automatique,Le Chesnay,France,,,,,2018-05-01,May 2018,Future Generation Computer Systems,0167739X,12264,,Journal,82,,,472-481,,,9,0,repositoryam,Green,,,
808,2-s2.0-85046976990,10.1109/ICIT.2018.8352195,,,Synthesis of model-free control for system with time-varying communication delay,cp,Conference Paper,Yaseen A.A.,,Middle Technical University;Université de Lille,Baghdad;Lille,Iraq;France,,,,,2018-04-27,27 April 2018,Proceedings of the IEEE International Conference on Industrial Technology,,84128,,Conference Proceeding,2018-February,,,310-315,,,3,0,,,,,
809,2-s2.0-85049388638,10.1145/3195258.3195262,,,"Challenges for the design of a privacy-preserving, multi-domain telemetry system for widely-spread network security appliances",cp,Conference Paper,Bacara C.,,Université de Lille,Lille,France,,,,,2018-04-23,23 April 2018,"Proceedings of the Workshop on Privacy by Design in Distributed Systems, P2DS 2018, co-located with European Conference on Computer Systems, EuroSys 2018",,21100866764,,Conference Proceeding,,,,,,,0,0,,,,,
810,2-s2.0-85048983427,10.23919/DATE.2018.8342008,,,Design and analysis of semaphore precedence constraints: A model-based approach for deterministic communications,cp,Conference Paper,Nguyen T.D.,,CNRS - University of Poitiers - ENSMA,Futuroscope,France,,,,,2018-04-19,19 April 2018,"Proceedings of the 2018 Design, Automation and Test in Europe Conference and Exhibition, DATE 2018",,21100865553,,Conference Proceeding,2018-January,,,231-236,,,0,0,,,,,
811,2-s2.0-85053662134,10.1145/3191697.3214335,,,Collectors,cp,Conference Paper,Costiou S.,,Université de Brest (UBO),Brest,France,,,,,2018-04-09,9 April 2018,ACM International Conference Proceeding Series,,11600154611,,Conference Proceeding,Part F137691,,,144-152,,,1,0,repositoryam,Green,,,
812,2-s2.0-85050513142,10.1145/3167132.3167244,,,Implementing modular class-based reuse mechanisms on top of a single inheritance VM,cp,Conference Paper,Tesone P.,,Université de Lille,Lille,France,,,,,2018-04-09,9 April 2018,Proceedings of the ACM Symposium on Applied Computing,,89358,,Conference Proceeding,,,,1030-1037,,,1,0,repositoryvor,Green,,,
813,2-s2.0-85048864524,10.1109/SITIS.2017.35,,,Automatic extraction of breast region in raw mammograms using a combined strategy,cp,Conference Paper,Feudjio C.,,University of Buea,Buea,Cameroon,,,,,2018-04-09,9 April 2018,"Proceedings - 13th International Conference on Signal-Image Technology and Internet-Based Systems, SITIS 2017",,21100865369,,Conference Proceeding,2018-January,,,158-162,,,1,0,,,,,
814,2-s2.0-85042230574,10.1080/00207721.2018.1435837,,,Leaderless consensus for the fractional-order nonlinear multi-agent systems under directed interaction topology,ar,Article,Bai J.,,University of Science and Technology Beijing,Beijing,China,,,,,2018-04-04,4 April 2018,International Journal of Systems Science,00207721,12419,14645319,Journal,49,5,,954-963,,,19,0,,,,,
815,2-s2.0-85048796704,10.1109/VPPC.2017.8331025,,,Fuel Cells Remaining Useful Life Real-Time Estimation Using an Extended Kalman Filter in a Hardware in the Loop Platform,cp,Conference Paper,Cherragui H.,,Université de Technologie de Belfort-Montbéliard,Belfort,France,,,,,2018-04-03,3 April 2018,"2017 IEEE Vehicle Power and Propulsion Conference, VPPC 2017 - Proceedings",,21100865121,,Conference Proceeding,2018-January,,,1-6,,,3,0,,,,,
816,2-s2.0-85048770571,10.1109/VPPC.2017.8331039,,,Campus of University with Mobility Based on Innovation and Carbon Neutral,cp,Conference Paper,Bouscayrol A.,,Université de Lille,Lille,France,,,,,2018-04-03,3 April 2018,"2017 IEEE Vehicle Power and Propulsion Conference, VPPC 2017 - Proceedings",,21100865121,,Conference Proceeding,2018-January,,,1-5,,,11,0,,,,,
817,2-s2.0-85045830143,10.1093/bioinformatics/btx771,,29194476,RecoverY: K-mer-based read classification for Y-chromosome-specific sequencing and assembly,ar,Article,Rangavittal S.,,Pennsylvania State University,University Park,United States,,,,,2018-04-01,1 April 2018,Bioinformatics,13674803,17945,14602059,Journal,34,7,,1125-1131,,,10,1,repositoryam,Green,,,
818,2-s2.0-85045185735,10.1109/TAFFC.2016.2623718,,,Spontaneous expression detection from 3d dynamic sequences by analyzing trajectories on grassmann manifolds,ar,Article,Alashkar T.,,IMT Nord Europe,Villeneuve-d'Ascq,France,,,,,2018-04-01,April-June 2018,IEEE Transactions on Affective Computing,19493045,19700177034,,Journal,9,2,,271-284,,,4,0,repositoryam,Green,,,
819,2-s2.0-85045026073,10.1016/j.imavis.2018.03.007,S0262885618300416,,Corrigendum to “Distances evolution analysis for online and off-line human object interaction recognition” [Image Vis. Comput. 70(2018) 32–45] (S0262885617301890) (10.1016/j.imavis.2017.12.003)),er,Erratum,Meng M.,,North Carolina Central University,Durham,United States,,,,,2018-04-01,April 2018,Image and Vision Computing,02628856,25549,,Journal,72,,,39,,,0,1,publisherfree2read,Bronze,,,
820,2-s2.0-85042779114,10.1016/j.simpat.2017.12.015,S1569190X17301946,,Multi-level agent-based simulations: Four design patterns,ar,Article,Mathieu P.,,Université de Lille,Lille,France,,,,,2018-04-01,April 2018,Simulation Modelling Practice and Theory,1569190X,12189,,Journal,83,,,51-64,,,12,0,repositoryvor,Green,,,
821,2-s2.0-85041416826,10.1016/j.asoc.2017.12.036,S1568494617307615,,Evolutionary optimization of convolutional neural networks for cancer miRNA biomarkers classification,ar,Article,Lopez-Rincon A.,,Laboratoire d'Informatique de Paris 6;Universite Paris-Saclay;Université de Lille,Paris;Saint-Aubin;Lille,France;France;France,,,,,2018-04-01,April 2018,Applied Soft Computing Journal,15684946,18136,,Journal,65,,,91-100,,,34,0,,,,,
822,2-s2.0-85039172471,10.1002/spe.2557,,,Improving responsiveness of time-sensitive applications by exploiting dynamic task dependencies,ar,Article,Cucinotta T.,,Sant'Anna Scuola Universitaria Superiore Pisa,Pisa,Italy,,,,,2018-04-01,April 2018,Software - Practice and Experience,00380644,20007,1097024X,Journal,48,4,,820-841,,,0,0,repositoryvor,Green,,,
823,2-s2.0-85051030523,10.1109/VST.2018.8327152,,,Evaluating the efficiency of continuous testing during test-driven development,cp,Conference Paper,Demeyer S.,,INRIA Institut National de Recherche en Informatique et en Automatique;Universiteit Antwerpen,Le Chesnay;Antwerpen,France;Belgium,,,,,2018-03-27,27 March 2018,"2018 IEEE 2nd International Workshop on Validation, Analysis and Evolution of Software Tests, VST 2018 - Proceedings",,21100871685,,Conference Proceeding,2018-March,,8327152,21-25,,,2,0,repositoryam,Green,,,
824,2-s2.0-85042917298,10.1049/iet-cta.2017.0523,,,Consensus for the fractional-order double-integrator multi-agent systems based on the sliding mode estimator,ar,Article,Bai J.,,University of Science and Technology Beijing,Beijing,China,,,,,2018-03-27,27 March 2018,IET Control Theory and Applications,17518644,5100155079,17518652,Journal,12,5,,621-628,,,20,0,,,,,
825,2-s2.0-85045076280,10.7717/peerj-cs.148,,,Indexing labeled sequences,ar,Article,Rocher T.,,Université de Lille,Lille,France,,,,,2018-03-26,26 March 2018,PeerJ Computer Science,,21100830173,23765992,Journal,2018,3,e148,,,,0,1,repositoryam,Green,,,
826,2-s2.0-85050035251,10.1109/ROBIO.2017.8324742,,,Optimal motion planning for minimizing energy consumption of wheeled mobile robots,cp,Conference Paper,Datouo R.,,Université de Yaoundé I,Yaounde,Cameroon,,,,,2018-03-23,23 March 2018,"2017 IEEE International Conference on Robotics and Biomimetics, ROBIO 2017",,21100868544,,Conference Proceeding,2018-January,,,2179-2184,,,10,0,,,,,
827,2-s2.0-85050006637,10.1109/ROBIO.2017.8324400,,,Towards adaptive power consumption estimation for over-actuated unmanned vehicles,cp,Conference Paper,Bensekrane I.,,"Centre de Recherche en Informatique, Signal et Automatique de Lille ( CRISTAL )",Villeneuve-d'Ascq,France,,,,,2018-03-23,23 March 2018,"2017 IEEE International Conference on Robotics and Biomimetics, ROBIO 2017",,21100868258,,Conference Proceeding,2018-January,,,92-97,,,7,0,,,,,
828,2-s2.0-85049924648,10.1109/ROBIO.2017.8324427,,,Optimal work space of parallel continuum manipulator consisting of compact bionic handling arms,cp,Conference Paper,Singh I.,,"Centre de Recherche en Informatique, Signal et Automatique de Lille ( CRISTAL )",Villeneuve-d'Ascq,France,,,,,2018-03-23,23 March 2018,"2017 IEEE International Conference on Robotics and Biomimetics, ROBIO 2017",,21100868201,,Conference Proceeding,2018-January,,,258-263,,,6,0,repositoryvor,Green,,,
829,2-s2.0-85049889451,10.1109/ROBIO.2017.8324428,,,Performances evaluation of inverse kinematic models of a compact bionic handling assistant,cp,Conference Paper,Singh I.,,"Centre de Recherche en Informatique, Signal et Automatique de Lille ( CRISTAL )",Villeneuve-d'Ascq,France,,,,,2018-03-23,23 March 2018,"2017 IEEE International Conference on Robotics and Biomimetics, ROBIO 2017",,21100868201,,Conference Proceeding,2018-January,,,264-269,,,10,0,repositoryvor,Green,,,
830,2-s2.0-85046249717,10.1109/ITSC.2017.8317687,,,Counting public transport passenger using WiFi signatures of mobile devices,cp,Conference Paper,Myrvoll T.A.,,SINTEF Digital,Trondheim,Norway,,,,,2018-03-14,14 March 2018,"IEEE Conference on Intelligent Transportation Systems, Proceedings, ITSC",,21100858477,,Conference Proceeding,2018-March,,,1-6,,,20,0,,,,,
831,2-s2.0-85048570095,10.1109/STA.2017.8314951,,,Model-free control of LTI systems: An algebraic state estimation approach,cp,Conference Paper,Maalej S.,,Université de Lille,Lille,France,,,,,2018-03-12,12 March 2018,"2017 18th International Conference on Sciences and Techniques of Automatic Control and Computer Engineering, STA 2017 - Proceedings",,21100864435,,Conference Proceeding,2018-January,,,30-35,,,0,0,,,,,
832,2-s2.0-85048395707,10.1109/STA.2017.8314961,,,Comparative study of fuzzy logic peak power trackers for a photovoltaic system,cp,Conference Paper,Harrabi N.,,Ecole Nationale d'Ingénieurs de Sfax,Sfax,Tunisia,,,,,2018-03-12,12 March 2018,"2017 18th International Conference on Sciences and Techniques of Automatic Control and Computer Engineering, STA 2017 - Proceedings",,21100864033,,Conference Proceeding,2018-January,,,539-545,,,0,0,,,,,
833,2-s2.0-85051142965,10.1109/CAMSAP.2017.8313090,,,Population Monte Carlo schemes with reduced path degeneracy,cp,Conference Paper,Elvira V.,,"Centre de Recherche en Informatique, Signal et Automatique de Lille ( CRISTAL )",Villeneuve-d'Ascq,France,,,,,2018-03-09,9 March 2018,"2017 IEEE 7th International Workshop on Computational Advances in Multi-Sensor Adaptive Processing, CAMSAP 2017",,21100871842,,Conference Proceeding,2017-December,,8313090,1-5,,,9,0,,,,,
834,2-s2.0-85050682225,10.1109/WISNET.2018.8311570,,,Six-port reflectometer in WR15 metallic waveguide for free-space sensing applications,cp,Conference Paper,Haddadi K.,,Université de Lille,Lille,France,,,,,2018-03-09,9 March 2018,WiSNet 2018 - Proceedings 2018 IEEE Topical Conference on Wireless Sensors and Sensor Networks,,21100870399,,Conference Proceeding,2018-January,,,80-83,,,10,0,repositoryam,Green,,,
835,2-s2.0-85050701967,10.1109/IPTA.2017.8310135,,,Illumination-robust multispectral demosaicing,cp,Conference Paper,Mihoubi S.,,Université de Lille,Lille,France,,,,,2018-03-08,8 March 2018,"Proceedings of the 7th International Conference on Image Processing Theory, Tools and Applications, IPTA 2017",,21100870342,,Conference Proceeding,2018-January,,,1-6,,,5,0,repositoryam,Green,,,
836,2-s2.0-85050688163,10.1109/CADS.2017.8310732,,,Impact of increasing number of neurons on performance of neuromorphic architecture,cp,Conference Paper,Shahsavari M.,,Université de Lille,Lille,France,,,,,2018-03-08,8 March 2018,"2017 19th International Symposium on Computer Architecture and Digital Systems, CADS 2017",,21100870398,,Conference Proceeding,2018-January,,,1-6,,,2,0,repositoryam,Green,,,
837,2-s2.0-85046101818,10.1109/AICCSA.2017.167,,,Fusing multi-techniques based on LDA-CCA and their application in palmprint identification system,cp,Conference Paper,Mokni R.,,FSEG Sfax - Faculté des Sciences Économiques et de Gestion de Sfax,Sfax,Tunisia,,,,,2018-03-07,7 March 2018,"Proceedings of IEEE/ACS International Conference on Computer Systems and Applications, AICCSA",21615322,21100198533,21615330,Conference Proceeding,2017-October,,,350-357,,,5,0,,,,,
838,2-s2.0-85046075500,10.1109/AICCSA.2017.47,,,Intelligent indoor evacuation guidance system based on ant colony algorithm,cp,Conference Paper,Hajjem M.,,"Laboratoire de Recherche Opérationnelle, de Décision et de Contrôle de processus",Le Bardo,Tunisia,,,,,2018-03-07,7 March 2018,"Proceedings of IEEE/ACS International Conference on Computer Systems and Applications, AICCSA",21615322,21100198533,21615330,Conference Proceeding,2017-October,,,1035-1042,,,7,0,,,,,
839,2-s2.0-85046074941,10.1109/AICCSA.2017.185,,,Orchestration and adaptation of learning scenarios - Application to the case of programming learning / teaching,cp,Conference Paper,Souleiman A.H.,,Université de Lille,Lille,France,,,,,2018-03-07,7 March 2018,"Proceedings of IEEE/ACS International Conference on Computer Systems and Applications, AICCSA",21615322,21100198533,21615330,Conference Proceeding,2017-October,,,7-11,,,1,0,,,,,
840,2-s2.0-85048973010,10.2478/amcs-2018-0005,,,Active fault tolerance control of a wind turbine system using an unknown input observer with an actuator fault,ar,Article,Li S.,,Nanjing University of Science and Technology,Nanjing,China,,,,,2018-03-01,March 2018,International Journal of Applied Mathematics and Computer Science,1641876X,4500151509,20838492,Journal,28,1,,69-81,,,10,1,publisherfullgold,Gold,,,
841,2-s2.0-85044647704,10.4230/LIPIcs.ICDT.2018.5,,,Enumeration on trees under relabelings,cp,Conference Paper,Amarilli A.,,Universite Paris-Saclay,Saint-Aubin,France,,,,,2018-03-01,1 March 2018,"Leibniz International Proceedings in Informatics, LIPIcs",18688969,21100244929,,Conference Proceeding,98,,5,,,,3,0,,,,,
842,2-s2.0-85044228097,10.1371/journal.pone.0193721,,29554126,Spatio-spectral classification of hyperspectral images for brain cancer detection during surgical operations,ar,Article,Fabelo H.,,Universidad de Las Palmas de Gran Canaria,Las Palmas de Gran Canaria,Spain,,,,,2018-03-01,March 2018,PLoS ONE,,10600153309,19326203,Journal,13,3,e0193721,,,,65,1,repositoryam,Green,,,
