,eid,doi,pii,pubmed_id,title,subtype,subtypeDescription,creator,afid,affilname,affiliation_city,affiliation_country,author_count,author_names,author_ids,author_afids,coverDate,coverDisplayDate,publicationName,issn,source_id,eIssn,aggregationType,volume,issueIdentifier,article_number,pageRange,description,authkeywords,citedby_count,openaccess,freetoread,freetoreadLabel,fund_acr,fund_no,fund_sponsor
1168,2-s2.0-85006983459,10.1007/s12555-015-0132-x,,,Distributed formation control of fractional-order multi-agent systems with relative damping and communication delay,ar,Article,Bai J.,,University of Science and Technology Beijing,Beijing,China,,,,,2017-02-01,1 February 2017,"International Journal of Control, Automation and Systems",15986446,25479,20054092,Journal,15,1,,85-94,,,16,0,,,,,
1169,2-s2.0-85002994009,10.1016/j.automatica.2016.10.023,S0005109816304277,,Recent developments on the stability of systems with aperiodic sampling: An overview,ar,Article,Hetel L.,,Ecole Centrale de Lille,Villeneuve-d'Ascq,France,,,,,2017-02-01,1 February 2017,Automatica,00051098,24909,,Journal,76,,,309-335,,,220,0,repositoryam,Green,,,
1170,2-s2.0-85002262379,10.1016/j.leukres.2016.11.009,S0145212616302491,27930944,High-throughput sequencing in acute lymphoblastic leukemia: Follow-up of minimal residual disease and emergence of new clones,ar,Article,Salson M.,,Université de Lille,Lille,France,,,,,2017-02-01,1 February 2017,Leukemia Research,01452126,26017,18735835,Journal,53,,,1-7,,,10,0,repositoryam,Green,,,
1171,2-s2.0-84999780416,10.1016/j.conengprac.2016.11.014,S0967066116302623,,An agent-based Decision Support System for resources' scheduling in Emergency Supply Chains,ar,Article,Ben Othman S.,,"Centre de Recherche en Informatique, Signal et Automatique de Lille ( CRISTAL )",Villeneuve-d'Ascq,France,,,,,2017-02-01,1 February 2017,Control Engineering Practice,09670661,18174,,Journal,59,,,27-43,,,31,0,repositoryam,Green,,,
1172,2-s2.0-84992364602,10.1016/j.epsr.2016.10.015,S0378779616304126,,Embedding OLTC nonlinearities in predictive Volt Var Control for active distribution networks,ar,Article,Morin J.,,Arts et Metiers Institute of Technology,Paris,France,,,,,2017-02-01,1 February 2017,Electric Power Systems Research,03787796,16044,,Journal,143,,,225-234,,,11,0,repositoryam,Green,,,
1173,2-s2.0-84988423506,10.1016/j.ipl.2016.09.007,S002001901630134X,,The emptiness problem for tree automata with at least one global disequality constraint is NP-hard,ar,Article,Héam P.C.,,Université Bourgogne Franche-Comté,Besancon,France,,,,,2017-02-01,1 February 2017,Information Processing Letters,00200190,14388,,Journal,118,,,6-9,,,1,0,,,,,
1174,2-s2.0-84979230958,10.1007/s11760-016-0938-x,,,Improving retrieval framework using information gain models,ar,Article,Le H.T.,,University of Science and Technology of Hanoi,Hanoi,Viet Nam,,,,,2017-02-01,1 February 2017,"Signal, Image and Video Processing",18631703,6200180165,18631711,Journal,11,2,,309-316,,,6,0,repositoryam,Green,,,
1175,2-s2.0-84942065789,10.1007/s10463-015-0540-y,,,Faster exact distributions of pattern statistics through sequential elimination of states,ar,Article,Martin D.E.K.,,NC State University,Raleigh,United States,,,,,2017-02-01,1 February 2017,Annals of the Institute of Statistical Mathematics,00203157,23213,15729052,Journal,69,1,,231-248,,,5,0,,,,,
1176,2-s2.0-85013025420,10.1088/1742-6596/783/1/012011,,,Fault tolerant multi-sensor fusion based on the information gain,cp,Conference Paper,Al Hage J.,,Université de Lille,Lille,France,,,,,2017-01-19,19 January 2017,Journal of Physics: Conference Series,17426588,130053,17426596,Conference Proceeding,783,1,012011,,,,4,1,publisherfree2read,Bronze,,,
1177,2-s2.0-85013020903,10.1088/1742-6596/783/1/012035,,,Robust Power Management Control for Stand-Alone Hybrid Power Generation System,cp,Conference Paper,Kamal E.,,CNRS Centre National de la Recherche Scientifique;Minufiya University Faculty of Electronic Engineering,Paris;Shibin El Kom,France;Egypt,,,,,2017-01-19,19 January 2017,Journal of Physics: Conference Series,17426588,130053,17426596,Conference Proceeding,783,1,012035,,,,3,1,publisherfree2read,Bronze,,,
1178,2-s2.0-85013020581,10.1088/1742-6596/783/1/012001,,,Robust unknown input observer design for state estimation and fault detection using linear parameter varying model,cp,Conference Paper,Li S.,,"Centre de Recherche en Informatique, Signal et Automatique de Lille ( CRISTAL );Nanjing University of Science and Technology",Villeneuve-d'Ascq;Nanjing,France;China,,,,,2017-01-19,19 January 2017,Journal of Physics: Conference Series,17426588,130053,17426596,Conference Proceeding,783,1,012001,,,,13,1,publisherfree2read,Bronze,,,
1179,2-s2.0-85013005020,10.1088/1742-6596/783/1/012022,,,Attack-tolerant networked control system: An approach for detection the controller stealthy hijacking attack,cp,Conference Paper,Yaseen A.A.,,Université de Lille,Lille,France,,,,,2017-01-19,19 January 2017,Journal of Physics: Conference Series,17426588,130053,17426596,Conference Proceeding,783,1,012022,,,,2,1,publisherfree2read,Bronze,,,
1180,2-s2.0-85013001242,10.1088/1742-6596/783/1/012056,,,Towards Extending Forward Kinematic Models on Hyper-Redundant Manipulator to Cooperative Bionic Arms,cp,Conference Paper,Singh I.,,"Centre de Recherche en Informatique, Signal et Automatique de Lille ( CRISTAL )",Villeneuve-d'Ascq,France,,,,,2017-01-19,19 January 2017,Journal of Physics: Conference Series,17426588,130053,17426596,Conference Proceeding,783,1,012056,,,,5,1,repositoryam,Green,,,
1181,2-s2.0-85012952349,10.1088/1742-6596/783/1/012021,,,An adaptive actuator failure compensation scheme for two linked 2WD mobile robots,cp,Conference Paper,Ma Y.,,Université de Lille,Lille,France,,,,,2017-01-19,19 January 2017,Journal of Physics: Conference Series,17426588,130053,17426596,Conference Proceeding,783,1,012021,,,,2,1,publisherfullgold,Gold,,,
1182,2-s2.0-85014168484,10.1109/CLOUD.2016.49,,,Automated setup of multi-cloud environments for microservices applications,cp,Conference Paper,Sousa G.,,Université de Lille,Lille,France,,,,,2017-01-17,17 January 2017,"IEEE International Conference on Cloud Computing, CLOUD",21596182,21100291859,21596190,Conference Proceeding,,,7820288,327-334,,,12,0,,,,,
1183,2-s2.0-84989312971,10.1109/CLOUD.2016.98,,,Model-driven management of docker containers,cp,Conference Paper,Paraiso F.,,Université de Lille,Lille,France,,,,,2017-01-17,17 January 2017,"IEEE International Conference on Cloud Computing, CLOUD",21596182,21100291859,21596190,Conference Proceeding,,,7820337,718-725,,,40,0,,,,,
1184,2-s2.0-85013236827,10.1109/JSEN.2016.2625099,,,Elder Tracking and Fall Detection System Using Smart Tiles,ar,Article,Daher M.,,"Centre de Recherche en Informatique, Signal et Automatique de Lille ( CRISTAL )",Villeneuve-d'Ascq,France,,,,,2017-01-15,15 January 2017,IEEE Sensors Journal,1530437X,15047,,Journal,17,2,7733127,469-479,,,52,0,,,,,
1185,2-s2.0-85013092921,10.1109/ICSME.2016.43,,,How can we help software rearchitecting efforts? Study of an industrial case,cp,Conference Paper,Govin B.,,Thales Group;INRIA Institut National de Recherche en Informatique et en Automatique,Puteaux;Le Chesnay,France;France,,,,,2017-01-12,12 January 2017,"Proceedings - 2016 IEEE International Conference on Software Maintenance and Evolution, ICSME 2016",,21100795272,,Conference Proceeding,,,7816503,509-518,,,1,0,repositoryam,Green,,,
1186,2-s2.0-85013642671,10.1109/ICTAI.2016.17,,,Preference-like score to cope with cold-start user in recommender systems,cp,Conference Paper,Felício C.Z.,,Universidade Federal de Uberlândia;IFTM,Uberlandia;Uberlandia,Brazil;Brazil,,,,,2017-01-11,11 January 2017,"Proceedings - 2016 IEEE 28th International Conference on Tools with Artificial Intelligence, ICTAI 2016",,21100797222,,Conference Proceeding,,,7814580,62-69,,,4,0,,,,,
1187,2-s2.0-85015072490,10.1109/ECC.2016.7810532,,,A bilinear input-output model with state-dependent delay for separated flow control,cp,Conference Paper,Feingesicht M.,,"Centre de Recherche en Informatique, Signal et Automatique de Lille ( CRISTAL );Ecole Centrale de Lille;Non-A team @ Inria",Villeneuve-d'Ascq;Villeneuve-d'Ascq;Villeneuve-d'Ascq,France;France;France,,,,,2017-01-06,6 January 2017,"2016 European Control Conference, ECC 2016",,21100800603,,Conference Proceeding,,,7810532,1679-1684,,,9,0,repositoryam,Green,,,
1188,2-s2.0-85015063599,10.1109/ECC.2016.7810534,,,On design of sampled-data interval observers,cp,Conference Paper,Efimov D.,,"Saint Petersburg National Research University of Information Technologies, Mechanics and Optics University ITMO;Non-A team @ Inria",Saint Petersburg;Villeneuve-d'Ascq,Russian Federation;France,,,,,2017-01-06,6 January 2017,"2016 European Control Conference, ECC 2016",,21100800603,,Conference Proceeding,,,7810534,1691-1696,,,0,0,repositoryam,Green,,,
1189,2-s2.0-85015060803,10.1109/ECC.2016.7810332,,,Robust and adaptive control using measurements of higher order derivatives,cp,Conference Paper,Shao Z.,,Ecole Centrale de Lille;INRIA Institut National de Recherche en Informatique et en Automatique,Villeneuve-d'Ascq;Le Chesnay,France;France,,,,,2017-01-06,6 January 2017,"2016 European Control Conference, ECC 2016",,21100800603,,Conference Proceeding,,,7810332,489-494,,,0,0,,,,,
1190,2-s2.0-85015059815,10.1109/ECC.2016.7810559,,,Robust synchronization of genetic oscillators subjected to cell division and common entrainment,cp,Conference Paper,Ahmed H.,,Ecole Centrale de Lille;INRIA Institut National de Recherche en Informatique et en Automatique,Villeneuve-d'Ascq;Le Chesnay,France;France,,,,,2017-01-06,6 January 2017,"2016 European Control Conference, ECC 2016",,21100800603,,Conference Proceeding,,,7810559,1844-1849,,,1,0,repositoryam,Green,,,
1191,2-s2.0-85015052826,10.1109/ECC.2016.7810433,,,A forecasting algorithm for latency compensation in indirect human-computer interactions,cp,Conference Paper,Ushirobira R.,,INRIA Institut National de Recherche en Informatique et en Automatique,Le Chesnay,France,,,,,2017-01-06,6 January 2017,"2016 European Control Conference, ECC 2016",,21100800603,,Conference Proceeding,,,7810433,1081-1086,,,4,0,repositoryam,Green,,,
1192,2-s2.0-85015049211,10.1109/ECC.2016.7810476,,,Interval differentiators: On-line estimation of differentiation accuracy,cp,Conference Paper,Guerra M.,,Ecole Centrale de Lille;INRIA Institut National de Recherche en Informatique et en Automatique,Villeneuve-d'Ascq;Le Chesnay,France;France,,,,,2017-01-06,6 January 2017,"2016 European Control Conference, ECC 2016",,21100800603,,Conference Proceeding,,,7810476,1347-1352,,,2,0,repositoryam,Green,,,
1193,2-s2.0-85015010217,10.1109/ECC.2016.7810530,,,Observer-based relay feedback controller design for LTI systems,cp,Conference Paper,Kader Z.,,"Centre de Recherche en Informatique, Signal et Automatique de Lille ( CRISTAL );INRIA Institut National de Recherche en Informatique et en Automatique",Villeneuve-d'Ascq;Le Chesnay,France;France,,,,,2017-01-06,6 January 2017,"2016 European Control Conference, ECC 2016",,21100800603,,Conference Proceeding,,,7810530,1667-1672,,,2,0,repositoryam,Green,,,
1194,2-s2.0-85015005781,10.1109/ECC.2016.7810642,,,Event driven hybrid bond graph for diagnosis,cp,Conference Paper,Abdallah I.,,Université de Lille,Lille,France,,,,,2017-01-06,6 January 2017,"2016 European Control Conference, ECC 2016",,21100800603,,Conference Proceeding,,,7810642,2353-2358,,,3,0,,,,,
1195,2-s2.0-85015004166,10.1109/ECC.2016.7810348,,,Frequency domain analysis of control system based on implicit Lyapunov function,cp,Conference Paper,Zimenko K.,,"Saint Petersburg National Research University of Information Technologies, Mechanics and Optics University ITMO",Saint Petersburg,Russian Federation,,,,,2017-01-06,6 January 2017,"2016 European Control Conference, ECC 2016",,21100800603,,Conference Proceeding,,,7810348,587-593,,,0,0,repositoryam,Green,,,
1196,2-s2.0-85009190767,10.1109/ECC.2016.7810443,,,Interval estimation of sequestered infected erythrocytes in malaria patients,cp,Conference Paper,Degue K.H.,,Polytechnique Montréal;Groupe d'études et de Recherche en Analyse des Décisions,Montreal;Montreal,Canada;Canada,,,,,2017-01-06,6 January 2017,"2016 European Control Conference, ECC 2016",,21100800603,,Conference Proceeding,,,7810443,1141-1145,,,12,0,repositoryam,Green,,,
1197,2-s2.0-85007315156,10.1049/iet-cta.2016.0200,,,Robust fault estimation observer design with finite-time convergence specification,ar,Article,Zhang K.,,Nanjing University of Aeronautics and Astronautics,Nanjing,China,,,,,2017-01-06,6 January 2017,IET Control Theory and Applications,17518644,5100155079,17518652,Journal,11,1,,1-9,,,13,0,,,,,
1198,2-s2.0-85011263094,10.1109/ICMIC.2016.7804169,,,Rolling bearing fault diagnosis based empirical wavelet transform using vibration signal,cp,Conference Paper,Merainani B.,,Université de Boumerdes,Boumerdes,Algeria,,,,,2017-01-03,3 January 2017,"Proceedings of 2016 8th International Conference on Modelling, Identification and Control, ICMIC 2016",,21100793802,,Conference Proceeding,,,7804169,526-531,,,16,0,,,,,
1199,2-s2.0-85119341929,,,,LIG-CRIStAL system for the WMT17 automatic post-editing task,cp,Conference Paper,Bérard A.,,Université de Lille,Lille,France,,,,,2017-01-01,2017,"WMT 2017 - 2nd Conference on Machine Translation, Proceedings",,21101066010,,Conference Proceeding,,,,623-629,,,8,0,,,,,
1200,2-s2.0-85113794680,,,,Unknown input observer for mimo systems with stability,cp,Conference Paper,Gonzalez J.A.,,Ecole Centrale de Lille,Villeneuve-d'Ascq,France,,,,,2017-01-01,2017,International Conference on Integrated Modeling and Analysis in Applied Control and Automation,23052139,21100298658,,Conference Proceeding,,,,1-8,,,1,0,,,,,
1201,2-s2.0-85113763884,,,,Well-formed petri net based patterns for modeling logic controllers for autonomous trains,cp,Conference Paper,Xie Y.,,"Centre de Recherche en Informatique, Signal et Automatique de Lille ( CRISTAL );Université de Lille",Villeneuve-d'Ascq;Lille,France;France,,,,,2017-01-01,2017,International Conference on Integrated Modeling and Analysis in Applied Control and Automation,23052139,21100298658,,Conference Proceeding,,,,25-34,,,1,0,,,,,
1202,2-s2.0-85083937842,,,,On the troll-trust model for edge sign prediction in social networks,cp,Conference Paper,Le Falher G.,,Université de Lille,Lille,France,,,,,2017-01-01,2017,"Proceedings of the 20th International Conference on Artificial Intelligence and Statistics, AISTATS 2017",,21100913124,,Conference Proceeding,,,,,,,1,0,,,,,
1203,2-s2.0-85083937621,,,,Learning Nash equilibrium for general-sum Markov games from batch data,cp,Conference Paper,Pérolat J.,,Université de Lille,Lille,France,,,,,2017-01-01,2017,"Proceedings of the 20th International Conference on Artificial Intelligence and Statistics, AISTATS 2017",,21100913124,,Conference Proceeding,,,,,,,7,0,,,,,
1204,2-s2.0-85069824769,,,,Sketching sonata form structure in selected classical string quartets,cp,Conference Paper,Bigo L.,,Université de Lille,Lille,France,,,,,2017-01-01,2017,"Proceedings of the 18th International Society for Music Information Retrieval Conference, ISMIR 2017",,21100921031,,Conference Proceeding,,,,752-759,,,4,0,,,,,
1205,2-s2.0-85063031321,10.2312/3dor.20171061,,,Semantic correspondence across 3D models for example-based modeling,cp,Conference Paper,Léon V.,,Uraniom,Laval,France,,,,,2017-01-01,2017,"Eurographics Workshop on 3D Object Retrieval, EG 3DOR",19970463,21100255386,19970471,Conference Proceeding,2017-April,,,121-127,,,1,0,,,,,
1206,2-s2.0-85060308196,10.2312/3dor.20171049,,,SHREC'17 track: 3D hand gesture recognition using a depth and skeletal dataset,cp,Conference Paper,De Smedt Q.,,Université de Lille,Lille,France,,,,,2017-01-01,2017,"Eurographics Workshop on 3D Object Retrieval, EG 3DOR",19970463,21100255386,19970471,Conference Proceeding,2017-April,,,33-38,,,48,0,,,,,
1207,2-s2.0-85055284277,10.5220/0006504203130320,,,Analysis of a batch strategy for a master-worker adaptive selection algorithm framework,cp,Conference Paper,Jankee C.,,Université du Littoral Côte d‘Opale,Dunkerque,France,,,,,2017-01-01,2017,IJCCI 2017 - Proceedings of the 9th International Joint Conference on Computational Intelligence,,21100882451,,Conference Proceeding,,,,313-320,,,0,1,repositoryam,Green,,,
1208,2-s2.0-85048412367,,,,Zonotope hit-and-run for efficient sampling from projection DPPs,cp,Conference Paper,Gautier G.,,Université de Lille;INRIA Institut National de Recherche en Informatique et en Automatique,Lille;Le Chesnay,France;France,,,,,2017-01-01,2017,"34th International Conference on Machine Learning, ICML 2017",,21100864010,,Conference Proceeding,3,,,1978-1989,,,6,0,,,,,
1209,2-s2.0-85047863880,10.5220/0006127402350242,,,Consistent optical flow maps for full and micro facial expression recognition,cp,Conference Paper,Allaert B.,,Université de Lille,Lille,France,,,,,2017-01-01,2017,"VISIGRAPP 2017 - Proceedings of the 12th International Joint Conference on Computer Vision, Imaging and Computer Graphics Theory and Applications",,21100862623,,Conference Proceeding,5,,,235-242,,,12,1,repositoryam,Green,,,
1210,2-s2.0-85047017339,,,,Monte-Carlo tree search by best arm identification,cp,Conference Paper,Kaufmann E.,,Université de Lille,Lille,France,,,,,2017-01-01,2017,Advances in Neural Information Processing Systems,10495258,23669,,Conference Proceeding,2017-December,,,4898-4907,,,14,0,,,,,
1211,2-s2.0-85046992502,,,,Is the Bellman residual a bad proxy?,cp,Conference Paper,Geist M.,,Université de Lorraine,Nancy,France,,,,,2017-01-01,2017,Advances in Neural Information Processing Systems,10495258,23669,,Conference Proceeding,2017-December,,,3206-3215,,,5,0,,,,,
1212,2-s2.0-85043992858,,,,Modulating early visual processing by language,cp,Conference Paper,De Vries H.,,University of Montreal,Montreal,Canada,,,,,2017-01-01,2017,Advances in Neural Information Processing Systems,10495258,23669,,Conference Proceeding,2017-December,,,6595-6605,,,163,0,,,,,
1213,2-s2.0-85042316286,10.3166/RIA.31.401-426,,,Fair task allocation for large data sets analysis,ar,Article,Baert Q.,,Université de Lille,Lille,France,,,,,2017-01-01,2017,Revue d'Intelligence Artificielle,0992499X,24847,,Journal,31,4,,401-426,,,6,0,repositoryam,Green,,,
1214,2-s2.0-85042273952,10.3166/RIA.31.709-739,,,Multi-level social welfare modelling in MAS : Application to assignment and matching problems,ar,Article,Nongaillard A.,,Université de Lille,Lille,France,,,,,2017-01-01,2017,Revue d'Intelligence Artificielle,0992499X,24847,,Journal,31,6,,709-734,,,1,0,,,,,
1215,2-s2.0-85042268128,,,,Introduction,ed,Editorial,Bouveret S.,,Laboratoire d'Informatique de Grenoble,Saint Martin d'Heres,France,,,,,2017-01-01,2017,Revue d'Intelligence Artificielle,0992499X,24847,,Journal,31,1-2,,7-9,,,0,0,,,,,
1216,2-s2.0-85041432242,,,,Visual variables in UML: A first empirical assessment,cp,Conference Paper,Ahmar Y.E.,,Université de Lille;Commissariat a L'Energie Atomique CEA,Lille;Gif-sur-Yvette,France;France,,,,,2017-01-01,2017,CEUR Workshop Proceedings,16130073,21100218356,,Conference Proceeding,2019,,,376-384,,,0,0,,,,,
1217,2-s2.0-85041223005,,,,Trajectories comparing based on matching and distance evaluation within stiefel and grassmann manifolds,cp,Conference Paper,Elaoud A.,,"Université de Tunis El Manar, Institut Supérieur d'Informatique de Tunis",Ariana,Tunisia,,,,,2017-01-01,2017,Proceedings of the International Conference on WWW/Internet 2017 and Applied Computing 2017,,21100849113,,Conference Proceeding,,,,171-178,,,0,0,,,,,
1218,2-s2.0-85040534061,10.3233/978-1-61499-830-3-989,,29295249,An innovative approach to jointly scheduling and assigning a consultation time to patients arriving in the emergency department,cp,Conference Paper,Ajmi F.,,Ecole Centrale de Lille,Villeneuve-d'Ascq,France,,,,,2017-01-01,2017,Studies in Health Technology and Informatics,09269630,19582,18798365,Book Series,245,,,989-993,,,1,0,,,,,
1219,2-s2.0-85037164462,10.1504/IJEP.2017.088191,,,Identification of a dynamical model for phytoplankton bloom based on high frequency measurements,ar,Article,Ahmed H.,,Coventry University,Coventry,United Kingdom,,,,,2017-01-01,2017,International Journal of Environment and Pollution,09574352,23996,17415101,Journal,62,1,,74-86,,,0,0,repositoryam,Green,,,
1220,2-s2.0-85036620866,10.1109/TCI.2017.2691553,,,Multispectral Demosaicing Using Pseudo-Panchromatic Image,ar,Article,Mihoubi S.,,Université de Lille,Lille,France,,,,,2017-01-01,2017,IEEE Transactions on Computational Imaging,25730436,21100854164,23339403,Journal,3,4,7893771,982-995,,,39,0,repositoryam,Green,,,
1221,2-s2.0-85036610227,10.1007/978-3-319-70353-4_12,,,Analysis of skeletal shape trajectories for person re-identification,cp,Conference Paper,Elaoud A.,,"Université de Tunis El Manar, Institut Supérieur d'Informatique de Tunis",Ariana,Tunisia,,,,,2017-01-01,2017,Lecture Notes in Computer Science (including subseries Lecture Notes in Artificial Intelligence and Lecture Notes in Bioinformatics),03029743,25674,16113349,Book Series,10617 LNCS,,,138-149,,,5,0,repositoryam,Green,,,
1222,2-s2.0-85035345305,,,,Unknown input observer for MIMO systems with stability,cp,Conference Paper,Gonzalez J.A.,,Ecole Centrale de Lille,Villeneuve-d'Ascq,France,,,,,2017-01-01,2017,"10th International Conference on Integrated Modeling and Analysis in Applied Control and Automation, IMAACA 2017, Held at the International Multidisciplinary Modeling and Simulation Multiconference, I3M 2017",,21100840495,,Conference Proceeding,,,,1-8,,,1,0,,,,,
1223,2-s2.0-85035327372,,,,Well-formed Petri Net based patterns for modeling logic controllers for autonomous trains,cp,Conference Paper,Xie Y.,,Université de Lille,Lille,France,,,,,2017-01-01,2017,"10th International Conference on Integrated Modeling and Analysis in Applied Control and Automation, IMAACA 2017, Held at the International Multidisciplinary Modeling and Simulation Multiconference, I3M 2017",,21100840495,,Conference Proceeding,,,,25-34,,,1,0,,,,,
1224,2-s2.0-85034237858,10.1007/978-3-319-69404-7_14,,,A new constructive heuristic for the no-wait flowshop scheduling problem,cp,Conference Paper,Mousin L.,,Université de Lille,Lille,France,,,,,2017-01-01,2017,Lecture Notes in Computer Science (including subseries Lecture Notes in Artificial Intelligence and Lecture Notes in Bioinformatics),03029743,25674,16113349,Book Series,10556 LNCS,,,196-209,,,0,0,repositoryam,Green,,,
1225,2-s2.0-85034216513,10.1007/978-3-319-68759-9_6,,,Using parallel strategies to speed up pareto local search,cp,Conference Paper,Shi J.,,City University of Hong Kong,Kowloon,Hong Kong,,,,,2017-01-01,2017,Lecture Notes in Computer Science (including subseries Lecture Notes in Artificial Intelligence and Lecture Notes in Bioinformatics),03029743,25674,16113349,Book Series,10593 LNCS,,,62-74,,,4,0,repositoryam,Green,,,
1226,2-s2.0-85033698402,,,,Passivity based control of continuous bioreactors,ar,Article,Makkar M.,,LMNIIT,Jaipur,India,,,,,2017-01-01,2017,Nonlinear Dynamics and Systems Theory,15628353,11500153304,18137385,Journal,17,4,,357-368,,,1,0,,,,,
1227,2-s2.0-85032501674,10.1007/978-3-319-68560-1_49,,,Emotion recognition by body movement representation on the manifold of symmetric positive definite matrices,cp,Conference Paper,Daoudi M.,,Université de Lille,Lille,France,,,,,2017-01-01,2017,Lecture Notes in Computer Science (including subseries Lecture Notes in Artificial Intelligence and Lecture Notes in Bioinformatics),03029743,25674,16113349,Book Series,10484 LNCS,,,550-560,,,12,0,repositoryam,Green,,,
1228,2-s2.0-85032193308,10.1007/978-3-319-68288-4_7,,,Semantics and validation of shapes schemas for RDF,cp,Conference Paper,Boneva I.,,Université de Lille,Lille,France,,,,,2017-01-01,2017,Lecture Notes in Computer Science (including subseries Lecture Notes in Artificial Intelligence and Lecture Notes in Bioinformatics),03029743,25674,16113349,Book Series,10587 LNCS,,,104-120,,,20,0,repositoryam,Green,,,
1229,2-s2.0-85031931811,10.24963/ijcai.2017/53,,,Enhancing sustainability of complex epidemiological models through a generic multilevel agent-based approach,cp,Conference Paper,Picault S.,,"Ecole Nationale Vétérinaire, Agroalimentaire et de l'Alimentation (ONIRIS) - Nantes Atlantique;Université de Lille",Nantes;Lille,France;France,,,,,2017-01-01,2017,IJCAI International Joint Conference on Artificial Intelligence,10450823,19400157504,,Conference Proceeding,0,,,374-380,,,5,1,repositoryam,Green,,,
1230,2-s2.0-85031920986,10.24963/ijcai.2017/122,,,Making Cross products and guarded ontology languages compatible,cp,Conference Paper,Bourhis P.,,CNRS Centre National de la Recherche Scientifique,Paris,France,,,,,2017-01-01,2017,IJCAI International Joint Conference on Artificial Intelligence,10450823,19400157504,,Conference Proceeding,0,,,880-886,,,8,1,repositoryam,Green,,,
1231,2-s2.0-85031897383,10.24963/ijcai.2017/385,,,End-to-end optimization of goal-driven and visually grounded dialogue systems,cp,Conference Paper,Strub F.,,Université de Lille,Lille,France,,,,,2017-01-01,2017,IJCAI International Joint Conference on Artificial Intelligence,10450823,19400157504,,Conference Proceeding,0,,,2765-2771,,,45,1,repositoryam,Green,,,
1232,2-s2.0-85030758265,,,,The case for non-cohesive packages,cp,Conference Paper,Anquetil N.,,Université de Lille,Lille,France,,,,,2017-01-01,2017,CEUR Workshop Proceedings,16130073,21100218356,,Conference Proceeding,1938,,19,,,,0,0,,,,,
1233,2-s2.0-85030655934,,,,State feedback trajectory tracking control of nonlinear affine in control system with unknown internal dynamics and disturbances,ar,Article,Wang H.P.,,Nanjing University of Science and Technology,Nanjing,China,,,,,2017-01-01,2017,Control Engineering and Applied Informatics,14548658,19900191768,,Journal,19,3,,22-30,,,1,0,,,,,
