,eid,doi,pii,pubmed_id,title,subtype,subtypeDescription,creator,afid,affilname,affiliation_city,affiliation_country,author_count,author_names,author_ids,author_afids,coverDate,coverDisplayDate,publicationName,issn,source_id,eIssn,aggregationType,volume,issueIdentifier,article_number,pageRange,description,authkeywords,citedby_count,openaccess,freetoread,freetoreadLabel,fund_acr,fund_no,fund_sponsor
394,2-s2.0-85075613978,10.1145/3344514,,,"Monadic datalog, tree validity, and limited access containment",ar,Article,Benedikt M.,,University of Oxford,Oxford,United Kingdom,,,,,2019-10-01,October 2019,ACM Transactions on Computational Logic,15293785,23051,1557945X,Journal,21,1,6,,,,1,0,repositoryam,Green,,,
395,2-s2.0-85073642183,10.1016/j.conengprac.2019.07.011,S0967066119301108,,An adaptive FIR filter for trajectory prediction and latency reduction in direct Human–Computer interactions,ar,Article,Aranovskiy S.,,"Institut d’Électronique et des Technologies du numéRique;Saint Petersburg National Research University of Information Technologies, Mechanics and Optics University ITMO",Rennes;Saint Petersburg,France;Russian Federation,,,,,2019-10-01,October 2019,Control Engineering Practice,09670661,18174,,Journal,91,,104093,,,,0,0,repositoryam,Green,,,
396,2-s2.0-85073149715,10.1145/3358183,,,Is your bus arbiter really fair? Restoring fairness in axi interconnects for FPGA SOCs,cp,Conference Paper,Restuccia F.,,Consiglio Nazionale delle Ricerche,Rome,Italy,,,,,2019-10-01,October 2019,ACM Transactions on Embedded Computing Systems,15399087,10300153313,15583465,Journal,18,5s,a51,,,,14,0,,,,,
397,2-s2.0-85072704079,10.3390/ijms20194788,,31561566,"Complete sequence, multichromosomal architecture and transcriptome analysis of the Solanum tuberosum mitochondrial genome",ar,Article,Varré J.S.,,Université de Lille,Lille,France,,,,,2019-10-01,1 October 2019,International Journal of Molecular Sciences,16616596,25879,14220067,Journal,20,19,4788,,,,19,1,repositoryvor,Green,,,
398,2-s2.0-85071470839,10.1109/LRA.2019.2932604,,,Modeling Novel Soft Mechanosensors Based on Air-Flow Measurements,ar,Article,Navarro S.E.,,"Centre de Recherche en Informatique, Signal et Automatique de Lille ( CRISTAL )",Villeneuve-d'Ascq,France,,,,,2019-10-01,October 2019,IEEE Robotics and Automation Letters,,21100900379,23773766,Journal,4,4,8784163,4338-4345,,,10,0,repositoryam,Green,,,
399,2-s2.0-85071126978,10.1016/j.canrad.2019.07.149,S1278321819303257,31451356,Prophylactic nodal radiotherapy in prostate cancer,sh,Short Survey,Bourdais R.,,Institut de Cancerologie Gustave Roussy,Villejuif,France,,,,,2019-10-01,October 2019,Cancer/Radiotherapie,12783218,29181,17696658,Journal,23,6-7,,688-695,,,0,0,,,,,
400,2-s2.0-85071052861,10.1109/TAC.2019.2892395,,,On boundedness of solutions of state periodic systems: A multivariable cell structure approach,ar,Article,Efimov D.,,"Université de Lille;Saint Petersburg National Research University of Information Technologies, Mechanics and Optics University ITMO",Lille;Saint Petersburg,France;Russian Federation,,,,,2019-10-01,October 2019,IEEE Transactions on Automatic Control,00189286,17339,15582523,Journal,64,10,8610007,4094-4104,,,1,0,repositoryam,Green,,,
401,2-s2.0-85070873497,10.1016/j.canrad.2019.07.148,S1278321819303245,31447344,"The radiation oncologist, one of the actors in the patient's path after cancer. Follow up after prostate cancer",sh,Short Survey,Brassart C.,,Centre O. Lambret,Lille,France,,,,,2019-10-01,October 2019,Cancer/Radiotherapie,12783218,29181,17696658,Journal,23,6-7,,565-571,,,0,1,publisherfree2read,Bronze,,,
402,2-s2.0-85070862400,10.1016/j.canrad.2019.07.153,S1278321819303294,31447339,Stereotactic body radiotherapy. How to better protect normal tissues?,sh,Short Survey,Pasquier D.,,Université de Lille,Lille,France,,,,,2019-10-01,October 2019,Cancer/Radiotherapie,12783218,29181,17696658,Journal,23,6-7,,630-635,,,2,1,publisherfree2read,Bronze,,,
403,2-s2.0-85065531174,10.1016/j.sigpro.2019.05.007,S0165168419301653,,Multidimensional harmonic retrieval based on Vandermonde tensor train,ar,Article,Zniyed Y.,,Laboratoire des Signaux et Systèmes,Gif-sur-Yvette,France,,,,,2019-10-01,October 2019,Signal Processing,01651684,25548,,Journal,163,,,75-86,,,4,1,repositoryam,Green,,,
404,2-s2.0-85086686943,10.1007/978-3-030-22587-2_24,,,Control and automation for miniaturized microwave GSG nanoprobing,ch,Book Chapter,Taleb A.,,Université de Lille,Lille,France,,,,,2019-09-30,30 September 2019,Machine Vision and Navigation,,21101000692,,Book,,,,751-768,,,0,0,repositoryam,Green,,,
405,2-s2.0-85052135351,10.1016/j.dam.2018.06.038,S0166218X18304001,,Incremental delay enumeration: Space and time,ar,Article,Capelli F.,,Université de Lille,Lille,France,,,,,2019-09-15,15 September 2019,Discrete Applied Mathematics,0166218X,25890,,Journal,268,,,179-190,,,6,1,repositoryvor,Green,,,
406,2-s2.0-85072213640,10.4204/EPTCS.303.3,,,(Co)inductive Proof Systems for compositional proofs in reachability logic,cp,Conference Paper,Rusu V.,,INRIA Institut National de Recherche en Informatique et en Automatique,Le Chesnay,France,,,,,2019-09-02,2 September 2019,"Electronic Proceedings in Theoretical Computer Science, EPTCS",20752180,21100244944,,Conference Proceeding,303,,,32-47,,,1,1,repositoryam,Green,,,
407,2-s2.0-85077809950,10.1109/ACIIW.2019.8925009,,,Gram Matrices Formulation of Body Shape Motion: An Application for Depression Severity Assessment,cp,Conference Paper,Daoudi M.,,Université de Lille,Lille,France,,,,,2019-09-01,September 2019,"2019 8th International Conference on Affective Computing and Intelligent Interaction Workshops and Demos, ACIIW 2019",,21100941911,,Conference Proceeding,,,8925009,258-263,,,2,0,repositoryam,Green,,,
408,2-s2.0-85077636130,10.1109/SYSTOL.2019.8864751,,,Application of Parametric Sensitivity Method to Analysis of Automatic Mooring Winch with Electric Drive System,cp,Conference Paper,Kostiuchko S.,,Lutsk National Technical University,Lutsk,Ukraine,,,,,2019-09-01,September 2019,"Conference on Control and Fault-Tolerant Systems, SysTol",21621195,21100291862,21621209,Conference Proceeding,,,8864751,294-299,,,1,0,,,,,
409,2-s2.0-85077590546,10.1109/SYSTOL.2019.8864762,,,Functionability Analysis of Redundant Systems having Multiple Configurations,cp,Conference Paper,Kumar P.,,Graphic Era Deemed to be University,Dehradun,India,,,,,2019-09-01,September 2019,"Conference on Control and Fault-Tolerant Systems, SysTol",21621195,21100291862,21621209,Conference Proceeding,,,8864762,282-287,,,0,0,,,,,
410,2-s2.0-85077546410,10.1109/SYSTOL.2019.8864734,,,Sensor and Actuator Fault Diagnosis for a Multi-Robot System Based on the Kullback-Leibler Divergence,cp,Conference Paper,Abci B.,,Université de Lille,Lille,France,,,,,2019-09-01,September 2019,"Conference on Control and Fault-Tolerant Systems, SysTol",21621195,21100291862,21621209,Conference Proceeding,,,8864734,68-73,,,0,0,,,,,
411,2-s2.0-85077529777,10.1109/WHISPERS.2019.8920859,,,A Fully Bayesian Approach for Inferring Physical Properties with Credibility Intervals from Noisy Astronomical Data,cp,Conference Paper,Vono M.,,,,,,,,,2019-09-01,September 2019,"Workshop on Hyperspectral Image and Signal Processing, Evolution in Remote Sensing",21586276,21000195601,,Conference Proceeding,2019-September,,8920859,,,,0,0,,,,,
412,2-s2.0-85077522780,10.1109/SYSTOL.2019.8864768,,,An adaptive threshold for change detection methods using a windowed entropy-based criterion-Application to fault-tolerant fusion in collaborative mobile robotics,cp,Conference Paper,Daass B.,,Université de Lille,Lille,France,,,,,2019-09-01,September 2019,"Conference on Control and Fault-Tolerant Systems, SysTol",21621195,21100291862,21621209,Conference Proceeding,,,8864768,56-61,,,1,0,,,,,
413,2-s2.0-85077463436,10.1016/j.ifacol.2019.11.784,S2405896319317872,,Differential neural network identification for homogeneous dynamical systems,cp,Conference Paper,Ballesteros M.,,Université de Lille;Centro de Investigacion y de Estudios Avanzados,Lille;Mexico City,France;Mexico,,,,,2019-09-01,September 2019,IFAC-PapersOnLine,,21100456158,24058963,Conference Proceeding,52,16,,233-238,,,3,1,repositoryam,Green,,,
414,2-s2.0-85077461214,10.1016/j.ifacol.2019.11.749,S2405896319317446,,Homogeneous discrete-time approximation,cp,Conference Paper,Sanchez T.,,Université de Lille,Lille,France,,,,,2019-09-01,September 2019,IFAC-PapersOnLine,,21100456158,24058963,Conference Proceeding,52,16,,19-24,,,2,1,repositoryam,Green,,,
415,2-s2.0-85077460260,10.1016/j.ifacol.2019.11.033,S2405896319309681,,Real curve analysis and stability of time-delay systems,cp,Conference Paper,Bouzidi Y.,,INRIA Institut National de Recherche en Informatique et en Automatique,Le Chesnay,France,,,,,2019-09-01,September 2019,IFAC-PapersOnLine,,21100456158,24058963,Conference Proceeding,52,17,,94-98,,,0,1,publisherfree2read,Bronze,,,
416,2-s2.0-85077441826,10.1016/j.ifacol.2019.11.789,S2405896319317926,,On adaptive estimation of bacterial growth in the competitive chemostat,cp,Conference Paper,dos Reis de Souza A.,,Université de Lille,Lille,France,,,,,2019-09-01,September 2019,IFAC-PapersOnLine,,21100456158,24058963,Conference Proceeding,52,16,,262-267,,,1,1,repositoryam,Green,,,
417,2-s2.0-85077431641,10.1016/j.ifacol.2019.11.748,S2405896319317434,,A note on converse Lyapunov-Krasovskii theorems for nonlinear neutral systems in Sobolev spaces,cp,Conference Paper,Efimov D.,,"Université de Lille;Saint Petersburg National Research University of Information Technologies, Mechanics and Optics University ITMO",Lille;Saint Petersburg,France;Russian Federation,,,,,2019-09-01,September 2019,IFAC-PapersOnLine,,21100456158,24058963,Conference Proceeding,52,16,,13-18,,,3,1,repositoryam,Green,,,
418,2-s2.0-85077189645,10.1109/ICSME.2019.00027,,,Decomposing God Classes at Siemens,cp,Conference Paper,Anquetil N.,,Université de Lille;INRIA Institut National de Recherche en Informatique et en Automatique,Lille;Le Chesnay,France;France,,,,,2019-09-01,September 2019,"Proceedings - 2019 IEEE International Conference on Software Maintenance and Evolution, ICSME 2019",,21100962484,,Conference Proceeding,,,8919246,169-180,,,1,0,repositoryam,Green,,,
419,2-s2.0-85075929152,10.1109/MODELS-C.2019.00062,,,Preface to the fourth international workshop on human factors in modeling (HuFaMo'19),ed,Editorial,Jolak R.,,Chalmers University of Technology,Gothenburg,Sweden,,,,,2019-09-01,September 2019,"Proceedings - 2019 ACM/IEEE 22nd International Conference on Model Driven Engineering Languages and Systems Companion, MODELS-C 2019",,21100959263,,Conference Proceeding,,,8904814,403-404,,,0,1,publisherfree2read,Bronze,,,
420,2-s2.0-85075864848,10.1109/ISGTEurope.2019.8905461,,,Stochastic estimation of PQ powers at the interface between distribution and transport grids,cp,Conference Paper,Buire J.,,Université de Lille,Lille,France,,,,,2019-09-01,September 2019,"Proceedings of 2019 IEEE PES Innovative Smart Grid Technologies Europe, ISGT-Europe 2019",,21100963065,,Conference Proceeding,,,8905461,,,,0,0,,,,,
421,2-s2.0-85075856211,10.1109/ISGTEurope.2019.8905538,,,Energy Management for Microgrids: A Reinforcement Learning Approach,cp,Conference Paper,Levent T.,,Laboratoire de Physique des Interfaces et des Couches Minces,Palaiseau,France,,,,,2019-09-01,September 2019,"Proceedings of 2019 IEEE PES Innovative Smart Grid Technologies Europe, ISGT-Europe 2019",,21100958334,,Conference Proceeding,,,8905538,,,,9,0,repositoryam,Green,,,
422,2-s2.0-85075616359,10.23919/EUSIPCO.2019.8902662,,,Gauss-Hermite quadrature for non-Gaussian inference via an importance sampling interpretation,cp,Conference Paper,Elvira V.,,IMT Nord Europe,Villeneuve-d'Ascq,France,,,,,2019-09-01,September 2019,European Signal Processing Conference,22195491,21100204301,,Conference Proceeding,2019-September,,,,,,1,0,repositoryam,Green,,,
423,2-s2.0-85075609075,10.23919/EUSIPCO.2019.8902642,,,Efficient adaptive multiple importance sampling,cp,Conference Paper,El-Laham Y.,,Stony Brook University,Stony Brook,United States,,,,,2019-09-01,September 2019,European Signal Processing Conference,22195491,21100204301,,Conference Proceeding,2019-September,,,,,,1,0,repositoryam,Green,,,
424,2-s2.0-85075600990,10.23919/EUSIPCO.2019.8902770,,,Tensor-train modeling for MIMO-OFDM tensor coding-and-forwarding relay systems,cp,Conference Paper,Boyer Y.Z.R.,,Université de Lille;Laboratoire des Signaux et Systèmes,Lille;Gif-sur-Yvette,France;France,,,,,2019-09-01,September 2019,European Signal Processing Conference,22195491,21100204301,,Conference Proceeding,2019-September,,,,,,3,0,repositoryam,Green,,,
425,2-s2.0-85074339329,10.1109/EMCEurope.2019.8872055,,,Autonomous electromagnetic mapping system in augmented reality,cp,Conference Paper,Rioult J.,,"IFSTTAR - French institute of science and technology for transport, development and networks",Marne-la-Vallee,France,,,,,2019-09-01,September 2019,EMC Europe 2019 - 2019 International Symposium on Electromagnetic Compatibility,,21100934550,,Conference Proceeding,,,8872055,138-143,,,2,0,,,,,
426,2-s2.0-85074191491,10.1109/ETFA.2019.8869155,,,Using code generated by MATLAB for the Mold Level Control System of a Continuous Slab Caster in ArcelorMittal Gent,cp,Conference Paper,Philippe S.,,KU Leuven,3000 Leuven,Belgium,,,,,2019-09-01,September 2019,"IEEE International Conference on Emerging Technologies and Factory Automation, ETFA",19460740,21100275520,19460759,Conference Proceeding,2019-September,,8869155,1497-1500,,,0,0,,,,,
427,2-s2.0-85072281313,10.1016/j.rehab.2019.07.005,S1877065719301150,31415824,Toward a hybrid brain-machine interface for palliating motor handicap with Duchenne muscular dystrophy: A case report,le,Letter,Duprès A.,,Université de Lille,Lille,France,,,,,2019-09-01,September 2019,Annals of Physical and Rehabilitation Medicine,18770657,16500154708,18770665,Journal,62,5,,379-381,,,0,1,repositoryam,Green,,,
428,2-s2.0-85068862681,10.1007/s12555-018-0754-x,,,Robust H<inf>∞</inf> Observer-based Stabilization of Linear Discrete-time Systems with Parameter Uncertainties,ar,Article,Bennani C.,,Université Mouloud Mammeri de Tizi Ouzou,Tizi Ouzou,Algeria,,,,,2019-09-01,1 September 2019,"International Journal of Control, Automation and Systems",15986446,25479,20054092,Journal,17,9,,2261-2273,,,2,0,,,,,
429,2-s2.0-85067898183,10.1038/s41375-019-0496-7,,31243313,Standardized next-generation sequencing of immunoglobulin and T-cell receptor gene recombinations for MRD marker identification in acute lymphoblastic leukaemia; a EuroClonality-NGS validation study,ar,Article,Brüggemann M.,,Universitätsklinikum Schleswig-Holstein Campus Kiel,Kiel,Germany,,,,,2019-09-01,1 September 2019,Leukemia,08876924,26015,14765551,Journal,33,9,,2241-2253,,,80,1,repositoryvor,Green,,,
430,2-s2.0-85066472759,10.1016/j.dsp.2019.05.011,S1051200419300612,,PARATUCK semi-blind receivers for relaying multi-hop MIMO systems,ar,Article,Marinho R. de Oliveira P.,,Université Côte d'Azur,Nice,France,,,,,2019-09-01,September 2019,Digital Signal Processing: A Review Journal,10512004,24306,,Journal,92,,,127-138,,,2,1,repositoryam,Green,,,
431,2-s2.0-85065241035,10.1016/j.patcog.2019.04.016,S0031320319301621,,Unsupervised visual feature learning with spike-timing-dependent plasticity: How far are we from traditional feature learning approaches?,ar,Article,Falez P.,,Université de Lille,Lille,France,,,,,2019-09-01,September 2019,Pattern Recognition,00313203,24823,,Journal,93,,,418-429,,,13,1,repositoryam,Green,,,
432,2-s2.0-85064686733,10.1177/1094342019840806,,,Dual tree traversal on integrated GPUs for astrophysical N-body simulations,ar,Article,Fortin P.,,Université de Lille;Sorbonne Universite,Lille;Paris,France;France,,,,,2019-09-01,1 September 2019,International Journal of High Performance Computing Applications,10943420,19268,17412846,Journal,33,5,,960-972,,,4,0,repositoryam,Green,,,
433,2-s2.0-85060960775,10.1016/j.jcss.2018.11.004,S0022000019300017,,Logics for unordered trees with data constraints,ar,Article,Boiret A.,,Université de Mons,Mons,Belgium,,,,,2019-09-01,September 2019,Journal of Computer and System Sciences,00220000,12370,10902724,Journal,104,,,149-164,,,1,0,repositoryam,Green,,,
434,2-s2.0-85058875403,10.1109/TAC.2018.2887409,,,Fully distributed formation-containment control of heterogeneous linear multiagent systems,ar,Article,Jiang W.,,"Centre de Recherche en Informatique, Signal et Automatique de Lille ( CRISTAL )",Villeneuve-d'Ascq,France,,,,,2019-09-01,September 2019,IEEE Transactions on Automatic Control,00189286,17339,15582523,Journal,64,9,8579593,3889-3896,,,49,0,,,,,
435,2-s2.0-85007454148,10.1016/j.jocs.2016.11.011,S1877750316303878,,"Towards understanding uncertainty in cloud computing with risks of confidentiality, integrity, and availability",ar,Article,Tchernykh A.,,Centro de Investigacion Cientifica y de Educacion Superior de Ensenada,Ensenada,Mexico,,,,,2019-09-01,September 2019,Journal of Computational Science,18777503,19700174607,,Journal,36,,100581,,,,63,0,,,,,
436,2-s2.0-85076400609,10.1145/3299904.3340308,,,New features for continuous exploratory landscape analysis based on the SOO tree,cp,Conference Paper,Derbel B.,,Université de Lille,Lille,France,,,,,2019-08-27,27 August 2019,FOGA 2019 - Proceedings of the 15th ACM/SIGEVO Conference on Foundations of Genetic Algorithms,,21100955829,,Conference Proceeding,,,,72-86,,,13,0,repositoryam,Green,,,
437,2-s2.0-85068529695,10.1080/20445911.2019.1637879,,,The face of memory: experiential avoidance and facial expressions during the retrieval of autobiographical memories,ar,Article,Nandrino J.L.,,Université de Lille,Lille,France,,,,,2019-08-18,18 August 2019,Journal of Cognitive Psychology,20445911,19900192026,2044592X,Journal,31,5-6,,533-542,,,2,0,repositoryam,Green,,,
438,2-s2.0-85074212843,10.1109/RTCSA.2019.8864558,,,Code generation for multi-phase tasks on a multi-core distributed memory platform,cp,Conference Paper,Fort F.,,Université de Lille,Lille,France,,,,,2019-08-01,August 2019,"Proceedings - 2019 IEEE 25th International Conference on Embedded and Real-Time Computing Systems and Applications, RTCSA 2019",,21100948451,,Conference Proceeding,,,8864558,,,,1,0,repositoryam,Green,,,
439,2-s2.0-85070461816,10.1136/bmjopen-2018-026666,,31377694,GETUG-AFU 31: A phase I/II multicentre study evaluating the safety and efficacy of salvage stereotactic radiation in patients with intraprostatic tumour recurrence after external radiation therapy-study protocol,ar,Article,Pasquier D.,,Université de Lille;Centre Oscar Lambret,Lille;Lille,France;France,,,,,2019-08-01,1 August 2019,BMJ Open,,19800188003,20446055,Journal,9,8,e026666,,,,10,1,repositoryvor,Green,,,
440,2-s2.0-85069528761,10.1109/TPDS.2019.2898436,,,Task-Based Augmented Contour Trees with Fibonacci Heaps,ar,Article,Gueunet C.,,Kitware SAS;Sorbonne Universite,Villeurbanne;Paris,France;France,,,,,2019-08-01,1 August 2019,IEEE Transactions on Parallel and Distributed Systems,10459219,26098,15582183,Journal,30,8,8637719,1889-1905,,,15,0,repositoryam,Green,,,
441,2-s2.0-85067186517,10.1016/j.imavis.2019.04.010,S0262885619300605,,Lip reading with Hahn Convolutional Neural Networks,ar,Article,Mesbah A.,,Université Sidi Mohamed Ben Abdellah,Fez,Morocco,,,,,2019-08-01,August 2019,Image and Vision Computing,02628856,25549,,Journal,88,,,76-83,,,21,0,,,,,
442,2-s2.0-85064845215,10.1016/j.automatica.2019.04.003,S0005109819301633,,Observer analysis and synthesis for perturbed Lipschitz systems under noisy time-varying measurements,ar,Article,Etienne L.,,DIA,Douai,France,,,,,2019-08-01,August 2019,Automatica,00051098,24909,,Journal,106,,,406-410,,,3,0,repositoryam,Green,,,
443,2-s2.0-85063928796,10.1115/1.4042947,,,Derivative-Based Sampled Data Control for Continuous Linear Parameter Varying System with Unknown Parameters,ar,Article,Maalej S.,,"Centre de Recherche en Informatique, Signal et Automatique de Lille ( CRISTAL );INRIA Nancy",Villeneuve-d'Ascq;Villers-les-Nancy,France;France,,,,,2019-08-01,1 August 2019,"Journal of Dynamic Systems, Measurement and Control, Transactions of the ASME",00220434,21141,15289028,Journal,141,8,081013,,,,1,0,repositoryam,Green,,,
444,2-s2.0-85054519961,10.1109/TIM.2018.2871228,,,Informational Framework for Minimalistic Visual Odometry on Outdoor Robot,ar,Article,Al Hage J.,,Université de Lille;Université de Technologie de Compiègne,Lille;Compiegne,France;France,,,,,2019-08-01,August 2019,IEEE Transactions on Instrumentation and Measurement,00189456,15361,,Journal,68,8,8482334,2988-2995,,,7,0,repositoryam,Green,,,
445,2-s2.0-85067699879,10.1007/s11071-019-05034-1,,,Differential evolution-based parameter estimation and synchronization of heterogeneous uncertain nonlinear delayed fractional-order multi-agent systems with unknown leader,ar,Article,Hu W.,,"Centre de Recherche en Informatique, Signal et Automatique de Lille ( CRISTAL )",Villeneuve-d'Ascq,France,,,,,2019-07-31,31 July 2019,Nonlinear Dynamics,0924090X,21576,1573269X,Journal,97,2,,1087-1105,,,9,0,,,,,
446,2-s2.0-85072345246,10.1145/3321707.3321836,,,Surrogate-assisted multiobjective optimization based on decomposition: A comprehensive comparative analysis,cp,Conference Paper,Berveglieri N.,,Université de Lille,Lille,France,,,,,2019-07-13,13 July 2019,GECCO 2019 - Proceedings of the 2019 Genetic and Evolutionary Computation Conference,,21100946488,,Conference Proceeding,,,,507-515,,,5,0,repositoryvor,Green,,,
447,2-s2.0-85072311421,10.1145/3321707.3321769,,,A hybrid metaheuristic approach to a real world employee scheduling problem,cp,Conference Paper,Reid K.N.,,University of Stirling,Stirling,United Kingdom,,,,,2019-07-13,13 July 2019,GECCO 2019 - Proceedings of the 2019 Genetic and Evolutionary Computation Conference,,21100929357,,Conference Proceeding,,,,1311-1318,,,2,0,repositoryam,Green,,,
448,2-s2.0-85070631240,10.1145/3319619.3321985,,,Studying compartmental models interpolation to estimate MOEAS population size,cp,Conference Paper,Monzón H.,,Shinshu University,Matsumoto,Japan,,,,,2019-07-13,13 July 2019,GECCO 2019 Companion - Proceedings of the 2019 Genetic and Evolutionary Computation Conference Companion,,21100954363,,Conference Proceeding,,,,227-228,,,0,0,,,,,
449,2-s2.0-85070579563,10.1145/3319619.3326912,,,Dynamic compartmental models for algorithm analysis and population size estimation,cp,Conference Paper,Monzón H.,,Shinshu University,Matsumoto,Japan,,,,,2019-07-13,13 July 2019,GECCO 2019 Companion - Proceedings of the 2019 Genetic and Evolutionary Computation Conference Companion,,21100954363,,Conference Proceeding,,,,2044-2047,,,1,0,,,,,
450,2-s2.0-85069975293,10.1145/3335203.3335715,,,Computing dependencies between DCT coefficients for natural steganography in JPEG domain,cp,Conference Paper,Taburet T.,,Université de Lille,Lille,France,,,,,2019-07-02,2 July 2019,IH and MMSec 2019 - Proceedings of the ACM Workshop on Information Hiding and Multimedia Security,,21100957532,,Conference Proceeding,,,,57-62,,,8,0,repositoryvor,Green,,,
451,2-s2.0-85069973841,10.1145/3335203.3335726,,,"The Alaska steganalysis challenge: A first step towards steganalysis ""into the wild""",cp,Conference Paper,Cogranne R.,,Université de Technologie de Troyes,Troyes,France,,,,,2019-07-02,2 July 2019,IH and MMSec 2019 - Proceedings of the ACM Workshop on Information Hiding and Multimedia Security,,21100921163,,Conference Proceeding,,,,125-137,,,43,0,repositoryvor,Green,,,
452,2-s2.0-85069953340,10.1145/3335203.3335737,,,Exploiting adversarial embeddings for better steganography,cp,Conference Paper,Bernard S.,,Université de Lille,Lille,France,,,,,2019-07-02,2 July 2019,IH and MMSec 2019 - Proceedings of the ACM Workshop on Information Hiding and Multimedia Security,,21100921163,,Conference Proceeding,,,,216-221,,,17,0,repositoryvor,Green,,,
453,2-s2.0-85092052845,10.1109/HPCS48598.2019.9188065,,,Surrogate-Assisted Optimization for Multi-stage Optimal Scheduling of Virtual Power Plants,cp,Conference Paper,Gobert M.,,Université de Mons,Mons,Belgium,,,,,2019-07-01,July 2019,"2019 International Conference on High Performance Computing and Simulation, HPCS 2019",,21101022902,,Conference Proceeding,,,9188065,113-120,,,0,0,repositoryam,Green,,,
454,2-s2.0-85086593939,10.1109/HPCS48598.2019.9188106,,,An Incremental Parallel PGAS-based Tree Search Algorithm,cp,Conference Paper,Carneiro T.,,INRIA Institut National de Recherche en Informatique et en Automatique,Le Chesnay,France,,,,,2019-07-01,July 2019,"2019 International Conference on High Performance Computing and Simulation, HPCS 2019",,21101022902,,Conference Proceeding,,,9188106,19-26,,,1,0,repositoryam,Green,,,
455,2-s2.0-85082856817,10.1109/SampTA45681.2019.9030925,,,A correspondence between zeros of time-frequency transforms and Gaussian analytic functions,cp,Conference Paper,Bardenet R.,,Université de Lille,Lille,France,,,,,2019-07-01,July 2019,"2019 13th International Conference on Sampling Theory and Applications, SampTA 2019",,21100976864,,Conference Proceeding,,,9030925,,,,0,0,repositoryam,Green,,,
456,2-s2.0-85075776719,10.1109/ICCA.2019.8899961,,,A Distributed Consensus Protocol for Attitude Synchronization and Tracking of Multiple Spacecraft on Directed Graphs,cp,Conference Paper,Yu Y.,,University of Science and Technology Beijing,Beijing,China,,,,,2019-07-01,July 2019,"IEEE International Conference on Control and Automation, ICCA",19483449,21100199742,19483457,Conference Proceeding,2019-July,,8899961,881-886,,,2,0,,,,,
457,2-s2.0-85073220522,10.1109/IJCNN.2019.8852346,,,Multi-layered Spiking Neural Network with Target Timestamp Threshold Adaptation and STDP,cp,Conference Paper,Falez P.,,Université de Lille,Lille,France,,,,,2019-07-01,July 2019,Proceedings of the International Joint Conference on Neural Networks,,96537,,Conference Proceeding,2019-July,,8852346,,,,13,0,repositoryam,Green,,,
