,eid,doi,pii,pubmed_id,title,subtype,subtypeDescription,creator,afid,affilname,affiliation_city,affiliation_country,author_count,author_names,author_ids,author_afids,coverDate,coverDisplayDate,publicationName,issn,source_id,eIssn,aggregationType,volume,issueIdentifier,article_number,pageRange,description,authkeywords,citedby_count,openaccess,freetoread,freetoreadLabel,fund_acr,fund_no,fund_sponsor
201,2-s2.0-85050401685,10.1109/TCOMM.2018.2858765,,,Code constructions for distributed storage with low repair bandwidth and low repair complexity,ar,Article,Kumar S.,,Chalmers University of Technology;Simula@UiB,Gothenburg;Bergen,Sweden;Norway,,,,,2018-12-01,December 2018,IEEE Transactions on Communications,00906778,18931,15580857,Journal,66,12,8418386,5847-5860,,,2,0,repositoryam,Green,,,
202,2-s2.0-85046400077,10.1109/TIFS.2018.2833799,,,Rate adaptation for secure HARQ protocols,ar,Article,Le Treust M.,,Equipes Traitement de l'Information et Systèmes,Cergy-Pontoise,France,,,,,2018-12-01,December 2018,IEEE Transactions on Information Forensics and Security,15566013,4000149002,,Journal,13,12,,2981-2994,,,8,0,repositoryam,Green,,,
203,2-s2.0-85058347177,10.1109/HealthCom.2018.8531181,,,Toward an embedded OFDM-based system for living cells study by electrochemical impedance spectroscopy,cp,Conference Paper,De Roux E.,,Equipes Traitement de l'Information et Systèmes;Universidad Tecnolgica de Panam,Cergy-Pontoise;,France;France,,,,,2018-11-09,9 November 2018,"2018 IEEE 20th International Conference on e-Health Networking, Applications and Services, Healthcom 2018",,21100890556,,Conference Proceeding,,,8531181,,,,2,0,,,,,
204,2-s2.0-85057732659,10.1109/COMET.2017.8521463,,,Embeddable real time tool for automatic skin lesions characterization,cp,Conference Paper,Angermann Q.,,"Animal, Santé, Territoires, Risques et Ecosystèmes (ASTRE)",Montferrier-sur-Lez,France,,,,,2018-11-02,2 November 2018,"2017 Cosmetic Measurements and Testing, COSMETIC 2017",,21100889416,,Conference Proceeding,,,8521463,,,,0,0,,,,,
205,2-s2.0-85073114116,10.1109/NSSMIC.2018.8824374,,,An interior Compton Scatter Tomography,cp,Conference Paper,Cebeiro J.,,Universidad Nacional de San Martín,San Martin,Argentina,,,,,2018-11-01,November 2018,"2018 IEEE Nuclear Science Symposium and Medical Imaging Conference, NSS/MIC 2018 - Proceedings",,21100931449,,Conference Proceeding,,,8824374,,,,3,0,,,,,
206,2-s2.0-85050205303,10.1109/TIT.2018.2857487,,,Almost Universal Codes for MIMO Wiretap Channels,cp,Conference Paper,Luzzi L.,,CY Cergy Paris Université,Cergy-Pontoise,France,,,,,2018-11-01,November 2018,IEEE Transactions on Information Theory,00189448,15107,,Journal,64,11,8413127,7218-7241,,,5,0,repositoryam,Green,,,
207,2-s2.0-85045294757,10.1109/TIT.2018.2825994,,,Capacity Results on Multiple-Input Single-Output Wireless Optical Channels,cp,Conference Paper,Moser S.M.,,ETH Zürich;National Chiao Tung University,"Zurich ZH,;Hsinchu",Switzerland;Taiwan,,,,,2018-11-01,November 2018,IEEE Transactions on Information Theory,00189448,15107,,Journal,64,11,8336902,6954-6966,,,16,1,repositoryam,Green,,,
208,2-s2.0-85056703526,10.1109/ISWCS.2018.8491081,,,DoF in sectored cellular systems with BS cooperation under a complexity constraint,cp,Conference Paper,Gelincik S.,,Universite Paris-Saclay,Saint-Aubin,France,,,,,2018-10-12,12 October 2018,Proceedings of the International Symposium on Wireless Communication Systems,21540217,21100198411,21540225,Conference Proceeding,2018-August,,8491081,,,,5,0,repositoryam,Green,,,
209,2-s2.0-85056483638,10.1109/DSD.2018.00085,,,Towards spectral pulse oximetry independent of motion artifacts,cp,Conference Paper,Von Chong A.,,Equipes Traitement de l'Information et Systèmes,Cergy-Pontoise,France,,,,,2018-10-12,12 October 2018,"Proceedings - 21st Euromicro Conference on Digital System Design, DSD 2018",,21100885601,,Conference Proceeding,,,8491856,479-483,,,0,0,,,,,
210,2-s2.0-85056447073,10.1109/DSD.2018.00086,,,Toward an OFDM-Based technique for electrochemical impedance spectroscopy,cp,Conference Paper,De Roux E.,,Universidad Tecnologica de Panama;ENSEA Ecole Nationale Supérieure de l'Electronique et de ses Applications,Panama;Cergy,Panama;France,,,,,2018-10-12,12 October 2018,"Proceedings - 21st Euromicro Conference on Digital System Design, DSD 2018",,21100885601,,Conference Proceeding,,,8491857,484-487,,,0,0,,,,,
211,2-s2.0-85072374740,10.1109/DigitalHeritage.2018.8810098,,,CRM<inf>CR</inf>-A CIDOC-CRM extension for supporting semantic interoperability in the conservation and restoration domain,cp,Conference Paper,Bannour I.,,Equipes Traitement de l'Information et Systèmes,Cergy-Pontoise,France,,,,,2018-10-01,October 2018,"Proceedings of the 2018 3rd Digital Heritage International Congress, Digital Heritage 2018 - Held jointly with the 2018 24th International Conference on Virtual Systems and Multimedia, VSMM 2018",,21100929542,,Conference Proceeding,,,8810098,,,,5,0,,,,,
212,2-s2.0-85054472450,10.1109/ICT.2018.8464944,,,Lasting Successive-Cancellation based Decoders for Multilevel Polar Coded Modulation,cp,Conference Paper,Chandesris L.,,Equipes Traitement de l'Information et Systèmes;CEA LETI ,Cergy-Pontoise;Grenoble,France;France,,,,,2018-09-13,13 September 2018,"2018 25th International Conference on Telecommunications, ICT 2018",,21100880166,,Conference Proceeding,,,8464944,264-266,,,2,0,,,,,
213,2-s2.0-85054246052,10.1109/ICASSP.2018.8461642,,,Reduced Dimension Minimum BER PSK Precoding for Constrained Transmit Signals in Massive MIMO,cp,Conference Paper,Lee Swindlehurst A.,,"University of California, Irvine",Irvine,United States,,,,,2018-09-10,10 September 2018,"ICASSP, IEEE International Conference on Acoustics, Speech and Signal Processing - Proceedings",15206149,110544,,Conference Proceeding,2018-April,,8461642,3584-3588,,,5,0,,,,,
214,2-s2.0-85065592409,10.1109/DEVLRN.2018.8761041,,,Visual learning for reaching and body-schema with gain-field networks,cp,Conference Paper,Abrossimoff J.,,Equipes Traitement de l'Information et Systèmes,Cergy-Pontoise,France,,,,,2018-09-01,September 2018,"2018 Joint IEEE 8th International Conference on Development and Learning and Epigenetic Robotics, ICDL-EpiRob 2018",,21100946631,,Conference Proceeding,,,8761041,197-203,,,6,0,repositoryam,Green,,,
215,2-s2.0-85051226489,10.1109/TCSI.2018.2815008,,,Hardware Implementation and Performance Analysis of Resource Efficient Probabilistic Hard Decision LDPC Decoders,ar,Article,Unal B.,,The University of Arizona,Tucson,United States,,,,,2018-09-01,September 2018,IEEE Transactions on Circuits and Systems I: Regular Papers,15498328,11000153733,15580806,Journal,65,9,8329987,3074-3084,,,11,1,publisherfree2read,Bronze,,,
216,2-s2.0-85047075002,10.1016/j.jpdc.2018.02.011,S0743731518300881,,FPGA-based simultaneous multichannel audio processor for musical genre indexing applications in broadcast band,ar,Article,Wassi G.,,CY Cergy Paris Université,Cergy-Pontoise,France,,,,,2018-09-01,September 2018,Journal of Parallel and Distributed Computing,07437315,25621,,Journal,119,,,146-161,,,3,0,,,,,
217,2-s2.0-85044328419,10.1109/TIFS.2018.2818650,,,Covert Communication with Channel-State Information at the Transmitter,ar,Article,Lee S.H.,,Pohang University of Science and Technology,Pohang,South Korea,,,,,2018-09-01,September 2018,IEEE Transactions on Information Forensics and Security,15566013,4000149002,,Journal,13,9,,2310-2319,,,23,0,repositoryam,Green,,,
218,2-s2.0-85062922611,10.1109/ICIP.2018.8451817,,,Leveraging implicit spatial information in global features for image retrieval,cp,Conference Paper,Jacob P.,,Equipes Traitement de l'Information et Systèmes,Cergy-Pontoise,France,,,,,2018-08-29,29 August 2018,"Proceedings - International Conference on Image Processing, ICIP",15224880,144684,,Conference Proceeding,,,8451817,2002-2006,,,1,0,repositoryam,Green,,,
219,2-s2.0-85062921984,10.1109/ICIP.2018.8451094,,,Jigsaw Puzzle Solving Using Local Feature Co-Occurrences in Deep Neural Networks,cp,Conference Paper,Paumard M.M.,,Equipes Traitement de l'Information et Systèmes,Cergy-Pontoise,France,,,,,2018-08-29,29 August 2018,"Proceedings - International Conference on Image Processing, ICIP",15224880,144684,,Conference Proceeding,,,8451094,1018-1022,,,8,0,repositoryam,Green,,,
220,2-s2.0-85053871453,10.1109/IWCMC.2018.8450500,,,Cycle-Based Routing Protocol for Device-to-Device Group Communications,cp,Conference Paper,Dammak M.,,Equipes Traitement de l'Information et Systèmes;Ecole Nationale d'Ingénieurs de Sfax,Cergy-Pontoise;Sfax,France;Tunisia,,,,,2018-08-28,28 August 2018,"2018 14th International Wireless Communications and Mobile Computing Conference, IWCMC 2018",,21100878012,,Conference Proceeding,,,8450500,1053-1058,,,1,0,,,,,
221,2-s2.0-85052473364,10.1109/SPAWC.2018.8445976,,,On Covert Communication over Infinite-Bandwidth Gaussian Channels,cp,Conference Paper,Wang L.,,Equipes Traitement de l'Information et Systèmes,Cergy-Pontoise,France,,,,,2018-08-24,24 August 2018,"IEEE Workshop on Signal Processing Advances in Wireless Communications, SPAWC",,21100877185,,Conference Proceeding,2018-June,,8445976,,,,4,0,repositoryam,Green,,,
222,2-s2.0-85052470950,10.1109/ISIT.2018.8437350,,,The Continuous-Time Poisson Channel Has Infinite Covert Communication Capacity,cp,Conference Paper,Wang L.,,CY Cergy Paris Université,Cergy-Pontoise,France,,,,,2018-08-15,15 August 2018,IEEE International Symposium on Information Theory - Proceedings,21578095,110567,,Conference Proceeding,2018-June,,8437350,756-760,,,6,0,repositoryam,Green,,,
223,2-s2.0-85052467691,10.1109/ISIT.2018.8437505,,,Covert Communication over a Physically Degraded Relay Channel with Non-Colluding Wardens,cp,Conference Paper,Kumar Arumugam K.S.,,School of Electrical and Computer Engineering,Atlanta,United States,,,,,2018-08-15,15 August 2018,IEEE International Symposium on Information Theory - Proceedings,21578095,110567,,Conference Proceeding,2018-June,,8437505,766-770,,,9,0,repositoryam,Green,,,
224,2-s2.0-85052465344,10.1109/ISIT.2018.8437727,,,EBP-GEXIT Charts over the Binary-Input AWGN Channel for Generalized and Doubly-Generalized LDPC Codes,cp,Conference Paper,Yardi A.D.,,Université Fédérale Toulouse Midi-Pyrénées,Toulouse,France,,,,,2018-08-15,15 August 2018,IEEE International Symposium on Information Theory - Proceedings,21578095,110567,,Conference Proceeding,2018-June,,8437727,496-500,,,4,0,repositoryam,Green,,,
225,2-s2.0-85052432003,10.1109/ISIT.2018.8437826,,,The DMT Classification of Real and Quaternionic Lattice Codes,cp,Conference Paper,Luzzi L.,,CY Cergy Paris Université,Cergy-Pontoise,France,,,,,2018-08-15,15 August 2018,IEEE International Symposium on Information Theory - Proceedings,21578095,110567,,Conference Proceeding,2018-June,,8437826,1026-1030,,,0,0,repositoryam,Green,,,
226,2-s2.0-85048835520,10.1080/01691864.2018.1483209,,,Synergistic control of a multi-segments vertebral column robot based on tensegrity for postural balance,ar,Article,Melnyk A.,,Université Côte d'Azur,Nice,France,,,,,2018-08-03,3 August 2018,Advanced Robotics,01691864,18003,15685535,Journal,32,15,,850-864,,,5,0,repositoryvor,Green,,,
227,2-s2.0-85052239174,10.1111/cgf.13501,,,Statistical Modeling of the 3D Geometry and Topology of Botanical Trees,ar,Article,Wang G.,,Tongji University;Murdoch University,Shanghai;Perth,China;Australia,,,,,2018-08-01,August 2018,Computer Graphics Forum,01677055,25023,14678659,Journal,37,5,,185-198,,,6,0,,,,,
228,2-s2.0-85050214216,10.1049/iet-cvi.2017.0282,,,Action recognition based on motion of oriented magnitude patterns and feature selection,ar,Article,Phan H.H.,,CY Cergy Paris Université;Le Qui Don University,Cergy-Pontoise;Hanoi,France;Viet Nam,,,,,2018-08-01,1 August 2018,IET Computer Vision,17519632,7000153231,17519640,Journal,12,5,,735-743,,,13,0,,,,,
229,2-s2.0-85047100601,10.1016/j.jneumeth.2018.04.013,S016502701830116X,29738806,An embedded implementation based on adaptive filter bank for brain–computer interface systems,ar,Article,Belwafi K.,,King Saud University,Riyadh,Saudi Arabia,,,,,2018-07-15,15 July 2018,Journal of Neuroscience Methods,01650270,16765,1872678X,Journal,305,,,1-16,,,39,0,,,,,
230,2-s2.0-85050633008,10.1109/ICDEW.2018.00035,,,Images &amp; recipes: Retrieval in the cooking context,cp,Conference Paper,Carvalho M.,,Sorbonne Universite,Paris,France,,,,,2018-07-02,2 July 2018,"Proceedings - IEEE 34th International Conference on Data Engineering Workshops, ICDEW 2018",,21100870209,,Conference Proceeding,,,,169-174,,,0,0,repositoryam,Green,,,
231,2-s2.0-85040071535,10.1109/TCSI.2017.2777802,,,Variable-Node-Shift Based Architecture for Probabilistic Gradient Descent Bit Flipping on QC-LDPC Codes,ar,Article,Le K.,,Equipes Traitement de l'Information et Systèmes,Cergy-Pontoise,France,,,,,2018-07-01,July 2018,IEEE Transactions on Circuits and Systems I: Regular Papers,15498328,11000153733,15580806,Journal,65,7,,2183-2195,,,9,0,,,,,
232,2-s2.0-85048636194,10.1109/LCOMM.2018.2822730,,,Routing and Network Coding over a Cyclic Network for Online Video Gaming,ar,Article,Dammak M.,,Equipes Traitement de l'Information et Systèmes;Ecole Nationale d'Ingénieurs de Sfax;CY Cergy Paris Université,Cergy-Pontoise;Sfax;Cergy-Pontoise,France;Tunisia;France,,,,,2018-06-01,June 2018,IEEE Communications Letters,10897798,18896,,Journal,22,6,,1188-1191,,,1,0,repositoryam,Green,,,
233,2-s2.0-85041676705,10.1109/TCOMM.2018.2793887,,,Dynamic-SCFlip Decoding of Polar Codes,ar,Article,Chandesris L.,,Equipes Traitement de l'Information et Systèmes;CEA LETI ,Cergy-Pontoise;Grenoble,France;France,,,,,2018-06-01,June 2018,IEEE Transactions on Communications,00906778,18931,,Journal,66,6,,2333-2345,,,67,0,repositoryam,Green,,,
234,2-s2.0-85048568457,10.1109/CISS.2018.8362301,,,The MISO free-space optical channel at low and moderate SNR,cp,Conference Paper,Li L.,,Universite Paris-Saclay,Saint-Aubin,France,,,,,2018-05-21,21 May 2018,"2018 52nd Annual Conference on Information Sciences and Systems, CISS 2018",,21100864427,,Conference Proceeding,,,,1-6,,,2,0,repositoryam,Green,,,
235,2-s2.0-85047019374,10.1121/1.5034799,,29857752,Kriging-based spatial interpolation from measurements for sound level mapping in urban areas,ar,Article,Aumond P.,,"IFSTTAR - French institute of science and technology for transport, development and networks",Marne-la-Vallee,France,,,,,2018-05-01,1 May 2018,Journal of the Acoustical Society of America,00014966,12936,,Journal,143,5,,2847-2857,,,26,0,repositoryam,Green,,,
236,2-s2.0-84988697979,10.1007/s10044-016-0582-7,,,A sequential pattern mining approach to design taxonomies for hierarchical music genre recognition,ar,Article,Iloga S.,,Université de Maroua;Institut de Recherche pour le Developpement Cameroon;CY Cergy Paris Université,Maroua;Yaounde;Cergy-Pontoise,Cameroon;Cameroon;France,,,,,2018-05-01,1 May 2018,Pattern Analysis and Applications,14337541,24822,,Journal,21,2,,363-380,,,9,0,,,,,
237,2-s2.0-85057121896,10.1109/ISCAS.2018.8351713,,,Probabilistic Gradient Descent Bit-Flipping Decoders for Flash Memory Channels,cp,Conference Paper,Ghaffari F.,,Equipes Traitement de l'Information et Systèmes,Cergy-Pontoise,France,,,,,2018-04-26,26 April 2018,Proceedings - IEEE International Symposium on Circuits and Systems,02714310,56190,,Conference Proceeding,2018-May,,8351713,,,,3,0,,,,,
238,2-s2.0-85057106610,10.1109/ISCAS.2018.8351055,,,Lightweight Hardware Architecture for Probabilistic Gradient Descent Bit Flipping on QC-LDPC Codes,cp,Conference Paper,Le K.,,Equipes Traitement de l'Information et Systèmes,Cergy-Pontoise,France,,,,,2018-04-26,26 April 2018,Proceedings - IEEE International Symposium on Circuits and Systems,02714310,56190,,Conference Proceeding,2018-May,,8351055,,,,1,0,,,,,
239,2-s2.0-85045253440,10.3389/fnins.2018.00135,,,Event-based color segmentation with a high dynamic range sensor,ar,Article,Marcireau A.,,Inserm,Paris,France,,,,,2018-04-11,11 April 2018,Frontiers in Neuroscience,16624548,21100199812,1662453X,Journal,12,APR,135,,,,4,1,repositoryvor,Green,,,
240,2-s2.0-85051003220,10.1109/ACSSC.2017.8335130,,,Predistortion techniques for vector perturbation precoding of one-bit massive-MIMO,cp,Conference Paper,Fijalkow I.,,Equipes Traitement de l'Information et Systèmes,Cergy-Pontoise,France,,,,,2018-04-10,10 April 2018,"Conference Record of 51st Asilomar Conference on Signals, Systems and Computers, ACSSC 2017",,21100871603,,Conference Proceeding,2017-October,,8335130,32-36,,,1,0,repositoryam,Green,,,
241,2-s2.0-85050357281,10.1109/DEVLRN.2017.8329834,,,Synchronisation and desynchronisation as important elements for the development of interaction capabilities,cp,Conference Paper,Ansermin E.,,CY Cergy Paris Université,Cergy-Pontoise,France,,,,,2018-04-02,2 April 2018,"7th Joint IEEE International Conference on Development and Learning and on Epigenetic Robotics, ICDL-EpiRob 2017",,21100869442,,Conference Proceeding,2018-January,,,384-390,,,0,0,repositoryam,Green,,,
242,2-s2.0-85038819735,10.1016/j.apacoust.2017.12.016,S0003682X1730912X,,"A cross-national comparison in assessment of urban park soundscapes in France, Korea, and Sweden through laboratory experiments",ar,Article,Jeon J.Y.,,Hanyang University,Seoul,South Korea,,,,,2018-04-01,April 2018,Applied Acoustics,0003682X,12946,1872910X,Journal,133,,,107-117,,,62,0,repositoryam,Green,,,
243,2-s2.0-85018758200,10.1007/s11042-017-4749-z,,,Local derivative pattern for action recognition in depth images,ar,Article,Nguyen X.S.,,Université de Caen Normandie,Caen,France,,,,,2018-04-01,1 April 2018,Multimedia Tools and Applications,13807501,25627,15737721,Journal,77,7,,8531-8549,,,9,0,repositoryam,Green,,,
244,2-s2.0-85050722516,10.1109/PAWR.2018.8310069,,,Design of high-performances CMOS power-stage for handset applications based on MASMOS cells,cp,Conference Paper,Loraine J.,,Equipes Traitement de l'Information et Systèmes;ACCO Semiconductor,Cergy-Pontoise;Louveciennes,France;France,,,,,2018-03-08,8 March 2018,PAWR 2018 - Proceedings 2018 IEEE Topical Conference on Power Amplifiers for Wireless and Radio Applications,,21100870598,,Conference Proceeding,2018-January,,,66-68,,,1,0,,,,,
245,2-s2.0-85046069147,10.1109/AICCSA.2017.203,,,The generalized multi scaled radon transform and application on objects classification,cp,Conference Paper,Hamdi D.E.,,"Université de Tunis El Manar, Faculté des Sciences de Tunis;CNRS Centre National de la Recherche Scientifique",Tunis;Paris,Tunisia;France,,,,,2018-03-07,7 March 2018,"Proceedings of IEEE/ACS International Conference on Computer Systems and Applications, AICCSA",21615322,21100198533,21615330,Conference Proceeding,2017-October,,,829-834,,,0,0,,,,,
246,2-s2.0-85043790856,10.1109/TCDS.2016.2647439,,,"A Modular Dynamic Sensorimotor Model for Affordances Learning, Sequences Planning, and Tool-Use",ar,Article,Braud R.,,CY Cergy Paris Université,Cergy-Pontoise,France,,,,,2018-03-01,March 2018,IEEE Transactions on Cognitive and Developmental Systems,23798920,21100784665,23798939,Journal,10,1,,72-87,,,4,0,repositoryam,Green,,,
247,2-s2.0-85045248569,10.1109/PIMRC.2017.8292326,,,Density evolution thresholds for noise-against-noise min-sum decoders,cp,Conference Paper,Cochachin F.,,Universite de Bretagne-Sud;CY Cergy Paris Université,Lorient;Cergy-Pontoise,France;France,,,,,2018-02-14,14 February 2018,"IEEE International Symposium on Personal, Indoor and Mobile Radio Communications, PIMRC",,21100857161,,Conference Proceeding,2017-October,,,1-7,,,6,0,,,,,
248,2-s2.0-85059521169,10.1515/pjbr-2018-0025,,,Is it useful for a robot to visit a museum?: The impact of cumulative learning on a robot population,ar,Article,Moualla A.,,CY Cergy Paris Université,Cergy-Pontoise,France,,,,,2018-02-01,February 2018,Paladyn,,21100810658,20814836,Journal,9,1,,374-390,,,1,1,publisherfullgold,Gold,,,
249,2-s2.0-85046353305,10.1109/ITW.2017.8277933,,,Asymptotic high-SNR capacity of MISO optical intensity channels,cp,Conference Paper,Moser S.M.,,ETH Zürich;National Chiao Tung University,"Zurich ZH,;Hsinchu",Switzerland;Taiwan,,,,,2018-01-31,31 January 2018,IEEE International Symposium on Information Theory - Proceedings,21578095,110567,,Conference Proceeding,2018-January,,,86-90,,,5,0,repositoryam,Green,,,
250,2-s2.0-85067562224,,,,"A novel modality of Compton Scattering Tomography, image formation and Reconstruction",cp,Conference Paper,Tarpau C.,,CY Cergy Paris Université,Cergy-Pontoise,France,,,,,2018-01-01,2018,"Proceedings of the 2018 International Conference on Image Processing, Computer Vision, and Pattern Recognition, IPCV 2018",,21100931096,,Conference Proceeding,,,,60-65,,,2,0,,,,,
251,2-s2.0-85064647810,10.1109/MWSCAS.2018.8623923,,,The Probabilistic Finite Alphabet Iterative Decoder for Low-Density Parity-Check Codes,cp,Conference Paper,Le K.,,Equipes Traitement de l'Information et Systèmes,Cergy-Pontoise,France,,,,,2018-01-01,2018,Midwest Symposium on Circuits and Systems,15483746,26047,,Conference Proceeding,2019-January,,8623923,755-758,,,0,0,,,,,
252,2-s2.0-85063468339,10.1109/GLOCOM.2018.8648121,,,Early Video Content Popularity Detection with Change Point Analysis,cp,Conference Paper,Skaperas S.,,Panepistimion Makedonias,Thessaloniki,Greece,,,,,2018-01-01,2018,"2018 IEEE Global Communications Conference, GLOBECOM 2018 - Proceedings",,21100910974,,Conference Proceeding,,,8648121,,,,5,0,repositoryam,Green,,,
253,2-s2.0-85055103389,10.1007/978-3-030-01231-1_10,,,Image reassembly combining deep learning and shortest path problem,cp,Conference Paper,Paumard M.M.,,Equipes Traitement de l'Information et Systèmes,Cergy-Pontoise,France,,,,,2018-01-01,2018,Lecture Notes in Computer Science (including subseries Lecture Notes in Artificial Intelligence and Lecture Notes in Bioinformatics),03029743,25674,16113349,Book Series,11210 LNCS,,,155-169,,,2,0,repositoryam,Green,,,
254,2-s2.0-85054818755,10.1007/978-3-030-01449-0_34,,,Fingerprint Classification Using Conic Radon Transform and Convolutional Neural Networks,cp,Conference Paper,El Hamdi D.,,Université de Tunis El Manar;CY Cergy Paris Université,Tunis;Cergy-Pontoise,Tunisia;France,,,,,2018-01-01,2018,Lecture Notes in Computer Science (including subseries Lecture Notes in Artificial Intelligence and Lecture Notes in Bioinformatics),03029743,25674,16113349,Book Series,11182 LNCS,,,402-413,,,2,0,,,,,
255,2-s2.0-85050477882,10.1007/978-3-319-95972-6_6,,,"The neck of Pinobo, a low-cost compliant robot",cp,Conference Paper,Blanchard A.,,Equipes Traitement de l'Information et Systèmes,Cergy-Pontoise,France,,,,,2018-01-01,2018,Lecture Notes in Computer Science (including subseries Lecture Notes in Artificial Intelligence and Lecture Notes in Bioinformatics),03029743,25674,16113349,Book Series,10928 LNAI,,,40-51,,,0,0,repositoryam,Green,,,
256,2-s2.0-85049363285,10.1007/978-3-319-93037-4_6,,,Adding missing words to regular expressions,cp,Conference Paper,Rebele T.,,Télécom Paris,Palaiseau,France,,,,,2018-01-01,2018,Lecture Notes in Computer Science (including subseries Lecture Notes in Artificial Intelligence and Lecture Notes in Bioinformatics),03029743,25674,16113349,Book Series,10938 LNAI,,,67-79,,,4,0,,,,,
257,2-s2.0-85047844431,10.5220/0006613403560362,,,Image analysis based on radon-type integral transforms over conic sections,cp,Conference Paper,El Hamdi D.,,"Université de Tunis El Manar, Faculté des Sciences de Tunis;CY Cergy Paris Université",Tunis;Cergy-Pontoise,Tunisia;France,,,,,2018-01-01,2018,"VISIGRAPP 2018 - Proceedings of the 13th International Joint Conference on Computer Vision, Imaging and Computer Graphics Theory and Applications",,21100862530,,Conference Proceeding,4,,,356-362,,,2,1,repositoryam,Green,,,
258,2-s2.0-85044935548,10.32523/2306-6172-2018-6-1-32-51,,,The development of Radon transforms associated to compton scatter imaging concepts,ar,Article,Nguyen M.K.,,CY Cergy Paris Université,Cergy-Pontoise,France,,,,,2018-01-01,2018,Eurasian Journal of Mathematical and Computer Applications,23066172,21100809811,23089822,Journal,6,1,,32-51,,,4,0,repositoryam,Green,,,
259,2-s2.0-85042295507,10.3813/AAA.919149,,,Probabilistic modelling of the temporal variability of urban sound levels,ar,Article,Can A.,,Université Nantes Angers Le Mans,Nantes,France,,,,,2018-01-01,January-February 2018,Acta Acustica united with Acustica,16101928,12941,18619959,Journal,104,1,,94-105,,,4,0,repositoryvor,Green,,,
260,2-s2.0-85041323618,10.1145/3144456,,,The shape space of 3D botanical tree models,ar,Article,Wang G.,,Tongji University,Shanghai,China,,,,,2018-01-01,January 2018,ACM Transactions on Graphics,07300301,24972,15577368,Journal,37,1,7,,,,15,0,,,,,
261,2-s2.0-85023767041,10.1109/LCOMM.2017.2718523,,,An Imprecise Stopping Criterion Based on In-Between Layers Partial Syndromes,ar,Article,Declercq D.,,CY Cergy Paris Université,Cergy-Pontoise,France,,,,,2018-01-01,January 2018,IEEE Communications Letters,10897798,18896,,Journal,22,1,7954939,13-16,,,5,0,,,,,
262,2-s2.0-85046637334,10.1109/IECON.2017.8216602,,,FPGA static timing analysis enhancement based on real operating conditions,cp,Conference Paper,Kacou M.A.,,Valeo,Paris,France,,,,,2017-12-15,15 December 2017,Proceedings IECON 2017 - 43rd Annual Conference of the IEEE Industrial Electronics Society,,21100859900,,Conference Proceeding,2017-January,,,3556-3561,,,2,0,,,,,
263,2-s2.0-85046473995,10.23919/RPIC.2017.8214370,,,The Radon transform on V-lines: Artifact analysis and image enhancement,cp,Conference Paper,Cebeiro J.,,Universidad Nacional de San Martín,San Martin,Argentina,,,,,2017-12-14,14 December 2017,"2017 17th Workshop on Information Processing and Control, RPIC 2017",,21100858675,,Conference Proceeding,2017-January,,,1-6,,,0,0,,,,,
