,eid,doi,pii,pubmed_id,title,subtype,subtypeDescription,creator,afid,affilname,affiliation_city,affiliation_country,author_count,author_names,author_ids,author_afids,coverDate,coverDisplayDate,publicationName,issn,source_id,eIssn,aggregationType,volume,issueIdentifier,article_number,pageRange,description,authkeywords,citedby_count,openaccess,freetoread,freetoreadLabel,fund_acr,fund_no,fund_sponsor
264,2-s2.0-85038806464,10.1109/TVLSI.2017.2776561,,,"Analysis and Design of Cost-Effective, High-Throughput LDPC Decoders",ar,Article,Nguyen-Ly T.T.,,Equipes Traitement de l'Information et Systèmes;CEA LETI ,Cergy-Pontoise;Grenoble,France;France,,,,,2017-12-14,14 December 2017,IEEE Transactions on Very Large Scale Integration (VLSI) Systems,10638210,12300,,Journal,26,3,,508-521,,,28,0,repositoryam,Green,,,
265,2-s2.0-85045837933,10.1109/ROMAN.2017.8172381,,,Readability of the gaze and expressions of a robot museum visitor: Impact of the low level sensory-motor control,cp,Conference Paper,Moualla A.,,CY Cergy Paris Université,Cergy-Pontoise,France,,,,,2017-12-08,8 December 2017,RO-MAN 2017 - 26th IEEE International Symposium on Robot and Human Interactive Communication,,21100857942,,Conference Proceeding,2017-January,,,712-719,,,2,0,repositoryam,Green,,,
266,2-s2.0-85045833847,10.1109/ROMAN.2017.8172442,,,Unintentional entrainment effect in a context of Human Robot Interaction: An experimental study,cp,Conference Paper,Ansermin E.,,CY Cergy Paris Université,Cergy-Pontoise,France,,,,,2017-12-08,8 December 2017,RO-MAN 2017 - 26th IEEE International Symposium on Robot and Human Interactive Communication,,21100857942,,Conference Proceeding,2017-January,,,1108-1114,,,5,0,repositoryam,Green,,,
267,2-s2.0-85045727941,10.1109/ROMAN.2017.8172311,,,The influence of individual social traits on robot learning in a human-robot interaction,cp,Conference Paper,Guedjou H.,,Sorbonne Universite,Paris,France,,,,,2017-12-08,8 December 2017,RO-MAN 2017 - 26th IEEE International Symposium on Robot and Human Interactive Communication,,21100857853,,Conference Proceeding,2017-January,,,256-262,,,3,0,repositoryam,Green,,,
268,2-s2.0-85041964222,10.1109/ATC.2017.8167601,,,"A novel high-throughput, low-complexity bit-flipping decoder for LDPC codes",cp,Conference Paper,Le K.,,Equipes Traitement de l'Information et Systèmes,Cergy-Pontoise,France,,,,,2017-12-05,5 December 2017,International Conference on Advanced Technologies for Communications,21621039,20600195633,21621020,Conference Proceeding,2017-October,,8167601,126-131,,,9,0,,,,,
269,2-s2.0-85048477297,10.3390/s17122758,,29186021,An efficient audio coding scheme for quantitative and qualitative large scale acoustic monitoring using the sensor grid approach,ar,Article,Gontier F.,,Laboratoire des Sciences du Numérique de Nantes,Nantes,France,,,,,2017-12-01,December 2017,Sensors (Switzerland),14248220,130124,,Journal,17,12,2758,,,,9,1,repositoryam,Green,,,
270,2-s2.0-85020228354,10.1016/j.apacoust.2017.05.028,S0003682X17305169,,Influence of the search radius in a noise prediction software on population exposure and human health impact assessments,ar,Article,Meyer R.,,Equipes Traitement de l'Information et Systèmes;Luxembourg Institute of Science and Technology,Cergy-Pontoise;Esch-sur-Alzette,France;Luxembourg,,,,,2017-12-01,1 December 2017,Applied Acoustics,0003682X,12946,1872910X,Journal,127,,,63-73,,,6,0,,,,,
271,2-s2.0-85043481235,10.1109/SENSET.2017.8125052,,,Power estimation on FPGAS based on signal information propagation through digital operators,cp,Conference Paper,Nasser Y.,,INSA Rennes,Rennes,France,,,,,2017-11-29,29 November 2017,"2017 Sensors Networks Smart and Emerging Technologies, SENSET 2017",,21100854718,,Conference Proceeding,2017-January,,,1-4,,,0,0,repositoryam,Green,,,
272,2-s2.0-85041376562,10.1109/WiMOB.2017.8115855,,,Impact of imperfect CSI on resource allocation in cognitive radio channels,cp,Conference Paper,Masmoudi R.,,Equipes Traitement de l'Information et Systèmes;Laboratoire d'Informatique Gaspard Monge,Cergy-Pontoise;Marne-la-Vallee,France;France,,,,,2017-11-20,20 November 2017,"International Conference on Wireless and Mobile Computing, Networking and Communications",21619646,21000195607,21619654,Conference Proceeding,2017-October,,8115855,293-299,,,6,0,repositoryam,Green,,,
273,2-s2.0-85040524884,10.1109/EWDTS.2017.8110059,,,Error rate estimation of a design implemented in an FPGA based on the operating conditions,cp,Conference Paper,Kacou M.A.,,Equipes Traitement de l'Information et Systèmes;Valeo,Cergy-Pontoise;Paris,France;France,,,,,2017-11-14,14 November 2017,"Proceedings of 2017 IEEE East-West Design and Test Symposium, EWDTS 2017",,21100846325,,Conference Proceeding,,,8110059,,,,4,0,,,,,
274,2-s2.0-85040969474,10.1109/DASC.2017.8102086,,,Reduction of frames storage size in AFDX reception end-system using a lossless compression algorithm,cp,Conference Paper,Baga Y.,,Zodiac Aerospace;CY Cergy Paris Université,Plaisir;Cergy-Pontoise,France;France,,,,,2017-11-08,8 November 2017,AIAA/IEEE Digital Avionics Systems Conference - Proceedings,21557195,110368,21557209,Conference Proceeding,2017-September,,8102086,,,,2,0,,,,,
275,2-s2.0-85012045756,10.1080/17415977.2017.1281920,,,New “improved” Compton scatter tomography modality for investigative imaging of one-sided large objects,ar,Article,Cebeiro J.,,Universidad Nacional de San Martín;CY Cergy Paris Université,San Martin;Cergy-Pontoise,Argentina;France,,,,,2017-11-02,2 November 2017,Inverse Problems in Science and Engineering,17415977,12424,17415985,Journal,25,11,,1676-1696,,,7,0,repositoryvor,Green,,,
276,2-s2.0-85029315300,10.1109/TIFS.2017.2713342,,,Protecting Secret Key Generation Systems Against Jamming: Energy Harvesting and Channel Hopping Approaches,cp,Conference Paper,Veronica Belmega E.,,Equipes Traitement de l'Information et Systèmes;INRIA Institut National de Recherche en Informatique et en Automatique,Cergy-Pontoise;Le Chesnay,France;France,,,,,2017-11-01,November 2017,IEEE Transactions on Information Forensics and Security,15566013,4000149002,,Journal,12,11,7942022,2611-2626,,,18,0,repositoryam,Green,,,
277,2-s2.0-85019712597,10.1007/s11042-017-4824-5,,,LBP-and-ScatNet-based combined features for efficient texture classification,ar,Article,Nguyen V.L.,,CY Cergy Paris Université,Cergy-Pontoise,France,,,,,2017-11-01,1 November 2017,Multimedia Tools and Applications,13807501,25627,15737721,Journal,76,21,,22425-22444,,,1,0,repositoryam,Green,,,
278,2-s2.0-85012875719,10.1016/j.patrec.2017.02.001,S0167865517300326,,Learning features combination for human action recognition from skeleton sequences,ar,Article,Carbonera Luvizon D.,,CY Cergy Paris Université,Cergy-Pontoise,France,,,,,2017-11-01,1 November 2017,Pattern Recognition Letters,01678655,24825,,Journal,99,,,13-20,,,76,0,repositoryam,Green,,,
279,2-s2.0-84992709461,10.1007/s11265-016-1192-8,,,A Hardware/Software Prototype of EEG-based BCI System for Home Device Control,ar,Article,Belwafi K.,,Université de Sousse;CY Cergy Paris Université,Sousse;Cergy-Pontoise,Tunisia;France,,,,,2017-11-01,1 November 2017,Journal of Signal Processing Systems,19398018,11400153333,19398115,Journal,89,2,,263-279,,,19,0,,,,,
280,2-s2.0-85034428026,10.23919/FPL.2017.8056783,,,Dynamic power estimation based on switching activity propagation,cp,Conference Paper,Nasser Y.,,INSA Rennes,Rennes,France,,,,,2017-10-02,2 October 2017,"2017 27th International Conference on Field Programmable Logic and Applications, FPL 2017",,21100838542,,Conference Proceeding,,,8056783,,,,7,0,repositoryam,Green,,,
281,2-s2.0-85032468621,10.1145/3125719.3132108,,,"NDN synchronization: IRoundSync, an improved roundsync",cp,Conference Paper,Hindi A.Z.,,Universite Paris-Saclay,Saint-Aubin,France,,,,,2017-09-26,26 September 2017,ICN 2017 - Proceedings of the 4th ACM Conference on Information Centric Networking,,21100835820,,Conference Proceeding,,,,194-195,,,2,0,repositoryvor,Green,,,
282,2-s2.0-85034443501,10.1109/DSD.2017.47,,,Wireless and Portable System for the Study of in-vitro Cell Culture Impedance Spectrum by Electrical Impedance Spectroscopy,cp,Conference Paper,De Roux E.,,CY Cergy Paris Université,Cergy-Pontoise,France,,,,,2017-09-25,25 September 2017,"Proceedings - 20th Euromicro Conference on Digital System Design, DSD 2017",,21100838547,,Conference Proceeding,,,8049825,456-461,,,1,0,,,,,
283,2-s2.0-85034421041,10.1109/DSD.2017.65,,,Hardware Platforms Benchmark For Real-Time Polyp Detection,cp,Conference Paper,Angermann Q.,,Equipes Traitement de l'Information et Systèmes,Cergy-Pontoise,France,,,,,2017-09-25,25 September 2017,"Proceedings - 20th Euromicro Conference on Digital System Design, DSD 2017",,21100838547,,Conference Proceeding,,,8049824,451-455,,,0,0,,,,,
284,2-s2.0-85032676162,10.1109/ISCAS.2017.8050695,,,Hardware optimization of the perturbation for probabilistic gradient descent bit flipping decoders,cp,Conference Paper,Le K.,,ENSEA Ecole Nationale Supérieure de l'Electronique et de ses Applications,Cergy,France,,,,,2017-09-25,25 September 2017,Proceedings - IEEE International Symposium on Circuits and Systems,02714310,56190,,Conference Proceeding,,,8050695,,,,1,0,,,,,
285,2-s2.0-85032261593,10.1109/ICCCN.2017.8038467,,,Multi-mode low-latency software-defined error correction for data centers,cp,Conference Paper,Ghaffari F.,,Equipes Traitement de l'Information et Systèmes,Cergy-Pontoise,France,,,,,2017-09-14,14 September 2017,"2017 26th International Conference on Computer Communications and Networks, ICCCN 2017",,21100835670,,Conference Proceeding,,,8038467,,,,1,0,,,,,
286,2-s2.0-85032209364,10.1109/EMBC.2017.8036804,,29059852,Unidirectional ephaptic stimulation between two myelinated axons,cp,Conference Paper,Capllonch-Juan M.,,University of Essex,Colchester,United Kingdom,,,,,2017-09-13,13 September 2017,"Proceedings of the Annual International Conference of the IEEE Engineering in Medicine and Biology Society, EMBS",1557170X,34202,,Conference Proceeding,,,8036804,230-233,,,3,0,,,,,
287,2-s2.0-85032189636,10.1109/EMBC.2017.8037236,,29060280,An IC-based controllable stimulator for respiratory muscle stimulation investigations,cp,Conference Paper,Castelli J.,,Université de Bordeaux,Bordeaux,France,,,,,2017-09-13,13 September 2017,"Proceedings of the Annual International Conference of the IEEE Engineering in Medicine and Biology Society, EMBS",1557170X,34202,,Conference Proceeding,,,8037236,1970-1973,,,5,0,,,,,
288,2-s2.0-85080090074,,,,Towards a better understanding of museum visitors’ behavior through indoor trajectory analysis,cp,Conference Paper,Kontarinis A.,,Equipes Traitement de l'Information et Systèmes;Universite Paris-Saclay,Cergy-Pontoise;Saint-Aubin,France;France,,,,,2017-09-10,10 September 2017,Digital Presentation and Preservation of Cultural and Scientific Heritage,13144006,21100901947,25350366,Conference Proceeding,7,,,19-30,,,4,0,,,,,
289,2-s2.0-85029683429,10.1371/journal.pone.0184960,,28934291,Emotional metacontrol of attention: Top-down modulation of sensorimotor processes in a robotic visual search task,ar,Article,Belkaid M.,,Equipes Traitement de l'Information et Systèmes,Cergy-Pontoise,France,,,,,2017-09-01,September 2017,PLoS ONE,,10600153309,19326203,Journal,12,9,e0184960,,,,4,1,repositoryam,Green,,,
290,2-s2.0-85021815577,10.1109/TSP.2017.2715006,,,Analysis of One-Bit Quantized Precoding for the Multiuser Massive MIMO Downlink,ar,Article,Saxena A.K.,,"University of California, Irvine",Irvine,United States,,,,,2017-09-01,1 September 2017,IEEE Transactions on Signal Processing,1053587X,17391,,Journal,65,17,7946265,4624-4634,,,85,1,repositoryam,Green,,,
291,2-s2.0-85020879446,10.1016/j.engappai.2017.05.009,S0952197617301033,,3D facial expression recognition using kernel methods on Riemannian manifold,ar,Article,Hariri W.,,Equipes Traitement de l'Information et Systèmes;Université Badji Mokhtar - Annaba,Cergy-Pontoise;Annaba,France;Algeria,,,,,2017-09-01,September 2017,Engineering Applications of Artificial Intelligence,09521976,24182,,Journal,64,,,25-32,,,33,0,,,,,
292,2-s2.0-85015305322,10.1016/j.neucom.2017.01.101,S0925231217304617,,Learning shape retrieval from different modalities,ar,Article,Tabia H.,,CY Cergy Paris Université,Cergy-Pontoise,France,,,,,2017-08-30,30 August 2017,Neurocomputing,09252312,24807,18728286,Journal,253,,,24-33,,,9,0,repositoryvor,Green,,,
293,2-s2.0-85034446173,10.1109/NEWCAS.2017.8010183,,,Prototype of a multispectral and multiwavelength pulse oximeter based on a BQJ sensor,cp,Conference Paper,Von Chong A.,,Equipes Traitement de l'Information et Systèmes,Cergy-Pontoise,France,,,,,2017-08-11,11 August 2017,"Proceedings - 2017 IEEE 15th International New Circuits and Systems Conference, NEWCAS 2017",,21100838543,,Conference Proceeding,,,8010183,373-376,,,1,0,,,,,
294,2-s2.0-85034442284,10.1109/NEWCAS.2017.8010185,,,Implantable Systems - Perspective review,cp,Conference Paper,Sobot R.,,Equipes Traitement de l'Information et Systèmes,Cergy-Pontoise,France,,,,,2017-08-11,11 August 2017,"Proceedings - 2017 IEEE 15th International New Circuits and Systems Conference, NEWCAS 2017",,21100838543,,Conference Proceeding,,,8010185,381-384,,,0,0,,,,,
295,2-s2.0-85034423703,10.1109/NEWCAS.2017.8010173,,,Analysis and implementation of resource efficient probabilistic Gallager B LDPC decoder,cp,Conference Paper,Unal B.,,The University of Arizona,Tucson,United States,,,,,2017-08-11,11 August 2017,"Proceedings - 2017 IEEE 15th International New Circuits and Systems Conference, NEWCAS 2017",,21100838543,,Conference Proceeding,,,8010173,333-336,,,4,0,repositoryvor,Green,,,
296,2-s2.0-85034085514,10.1109/ISIT.2017.8007116,,,A strong data processing inequality for thinning poisson processes and some applications,cp,Conference Paper,Wang L.,,CNRS Centre National de la Recherche Scientifique,Paris,France,,,,,2017-08-09,9 August 2017,IEEE International Symposium on Information Theory - Proceedings,21578095,110567,,Conference Proceeding,,,8007116,3180-3184,,,2,0,repositoryam,Green,,,
297,2-s2.0-85034069034,10.1109/ISIT.2017.8006585,,,Asymptotic capacity results for MIMO wireless optical communication,cp,Conference Paper,Moser S.M.,,ETH Zürich;National Chiao Tung University,"Zurich ZH,;Hsinchu",Switzerland;Taiwan,,,,,2017-08-09,9 August 2017,IEEE International Symposium on Information Theory - Proceedings,21578095,110567,,Conference Proceeding,,,8006585,536-540,,,20,0,repositoryam,Green,,,
298,2-s2.0-85034068122,10.1109/ISIT.2017.8007047,,,Strong coordination of signals and actions over noisy channels,cp,Conference Paper,Cervia G.,,Equipes Traitement de l'Information et Systèmes,Cergy-Pontoise,France,,,,,2017-08-09,9 August 2017,IEEE International Symposium on Information Theory - Proceedings,21578095,110567,,Conference Proceeding,,,8007047,2835-2839,,,9,0,repositoryam,Green,,,
299,2-s2.0-85034062532,10.1109/ISIT.2017.8007046,,,Covert communication with noncausal channel-state information at the transmitter,cp,Conference Paper,Lee S.H.,,Pohang University of Science and Technology,Pohang,South Korea,,,,,2017-08-09,9 August 2017,IEEE International Symposium on Information Theory - Proceedings,21578095,110567,,Conference Proceeding,,,8007046,2830-2834,,,5,0,repositoryam,Green,,,
300,2-s2.0-85028016099,10.1111/cgf.13241,,,Modeling and Exploring Co-variations in the Geometry and Configuration of Man-made 3D Shape Families,ar,Article,Laga H.,,Murdoch University,Perth,Australia,,,,,2017-08-01,August 2017,Computer Graphics Forum,01677055,25023,14678659,Journal,36,5,,13-25,,,3,0,,,,,
301,2-s2.0-85021832097,10.1109/TIT.2017.2714682,,,Joint Empirical Coordination of Source and Channel,ar,Article,Le Treust M.,,Equipes Traitement de l'Information et Systèmes,Cergy-Pontoise,France,,,,,2017-08-01,August 2017,IEEE Transactions on Information Theory,00189448,15107,,Journal,63,8,7946090,5087-5114,,,9,0,repositoryvor,Green,,,
302,2-s2.0-85020875714,10.1016/j.patrec.2017.06.007,S0167865517302131,,Multiple vocabulary coding for 3D shape retrieval using Bag of Covariances,ar,Article,Tabia H.,,Equipes Traitement de l'Information et Systèmes,Cergy-Pontoise,France,,,,,2017-08-01,1 August 2017,Pattern Recognition Letters,01678655,24825,,Journal,95,,,78-84,,,4,0,repositoryvor,Green,,,
303,2-s2.0-85028362981,10.1109/ICC.2017.7996559,,,Energy harvesting in secret key generation systems under jamming attacks,cp,Conference Paper,Belmega E.V.,,INRIA Institut National de Recherche en Informatique et en Automatique,Le Chesnay,France,,,,,2017-07-28,28 July 2017,IEEE International Conference on Communications,15503607,33201,,Conference Proceeding,,,7996559,,,,4,0,repositoryam,Green,,,
304,2-s2.0-85028322553,10.1109/ICC.2017.7996660,,,Secret key generation in Rayleigh block fading AWGN channels under jamming attacks,cp,Conference Paper,Chorti A.,,University of Essex,Colchester,United Kingdom,,,,,2017-07-28,28 July 2017,IEEE International Conference on Communications,15503607,33201,,Conference Proceeding,,,7996660,,,,1,0,repositoryam,Green,,,
305,2-s2.0-85028317733,10.1109/ICC.2017.7996548,,,Performance of taylor-kuznetsov memories under timing errors,cp,Conference Paper,Dupraz E.,,Université de Brest (UBO),Brest,France,,,,,2017-07-28,28 July 2017,IEEE International Conference on Communications,15503607,33201,,Conference Proceeding,,,7996548,,,,1,0,,,,,
306,2-s2.0-85028575073,10.1109/SIES.2017.7993400,,,Probabilistic model of AFDX frames reception for end system backlog assessment,cp,Conference Paper,Baga Y.,,Zodiac Aerospace;CY Cergy Paris Université,Plaisir;Cergy-Pontoise,France;France,,,,,2017-07-26,26 July 2017,"2017 12th IEEE International Symposium on Industrial Embedded Systems, SIES 2017 - Proceedings",,21100828726,,Conference Proceeding,,,7993400,,,,4,0,,,,,
307,2-s2.0-85028909861,10.1109/ACCESS.2017.2731902,,,Fast and Parallel AAC Decoder Architecture for a Digital Radio Mondiale 30 Receiver,ar,Article,Ibraheem M.S.,,Laboratoire d'Informatique de Paris 6,Paris,France,,,,,2017-07-25,25 July 2017,IEEE Access,,21100374601,21693536,Journal,5,,7990477,14638-14646,,,3,1,repositoryam,Green,,,
308,2-s2.0-85027235887,,,,Academic track of Foss4G Europe 2017 - Open innovation for Europe,ed,Editorial,Brovelli M.A.,,Politecnico di Milano,Milan,Italy,,,,,2017-07-05,5 July 2017,"International Archives of the Photogrammetry, Remote Sensing and Spatial Information Sciences - ISPRS Archives",16821750,21100248929,,Conference Proceeding,42,4W2,,1-2,,,0,0,,,,,
309,2-s2.0-85046294936,10.1109/ICCVW.2017.149,,,A Handcrafted Normalized-Convolution Network for Texture Classification,cp,Conference Paper,Vu N.S.,,CY Cergy Paris Université,Cergy-Pontoise,France,,,,,2017-07-01,1 July 2017,"Proceedings - 2017 IEEE International Conference on Computer Vision Workshops, ICCVW 2017",,21100953746,,Conference Proceeding,2018-January,,,1238-1245,,,4,0,repositoryam,Green,,,
310,2-s2.0-85018712355,10.1007/s10470-017-0975-6,,,RF transceiver and transmission line behavioral modeling in VHDL-AMS for wired RFNoC,ar,Article,Zerioul L.,,Equipes Traitement de l'Information et Systèmes,Cergy-Pontoise,France,,,,,2017-07-01,1 July 2017,Analog Integrated Circuits and Signal Processing,09251030,25569,15731979,Journal,92,1,,103-114,,,5,0,,,,,
311,2-s2.0-85026227986,10.1109/ICCW.2017.7962751,,,On puncturing strategies for polar codes,cp,Conference Paper,Chandesris L.,,Equipes Traitement de l'Information et Systèmes;CEA LETI ,Cergy-Pontoise;Grenoble,France;France,,,,,2017-06-29,29 June 2017,"2017 IEEE International Conference on Communications Workshops, ICC Workshops 2017",,21100824904,,Conference Proceeding,,,7962751,766-771,,,11,0,repositoryam,Green,,,
312,2-s2.0-85026205077,10.1109/ICCW.2017.7962783,,,High Throughput FPGA Implementation for regular Non-Surjective Finite Alphabet Iterative Decoders,cp,Conference Paper,Nguyen-Ly T.T.,,CEA LETI ;CY Cergy Paris Université,Grenoble;Cergy-Pontoise,France;France,,,,,2017-06-29,29 June 2017,"2017 IEEE International Conference on Communications Workshops, ICC Workshops 2017",,21100824904,,Conference Proceeding,,,7962783,961-966,,,7,0,repositoryam,Green,,,
313,2-s2.0-85023768102,10.1109/ICASSP.2017.7953405,,,Minimum probability-of-error perturbation precoding for the one-bit massive MIMO downlink,cp,Conference Paper,Swindlehurst A.,,"University of California, Irvine",Irvine,United States,,,,,2017-06-16,16 June 2017,"ICASSP, IEEE International Conference on Acoustics, Speech and Signal Processing - Proceedings",15206149,110544,,Conference Proceeding,,,7953405,6483-6487,,,43,0,repositoryam,Green,,,
314,2-s2.0-85021449496,10.1109/TMI.2017.2664042,,28182555,Comparative Validation of Polyp Detection Methods in Video Colonoscopy: Results from the MICCAI 2015 Endoscopic Vision Challenge,ar,Article,Bernal J.,,Universitat Autònoma de Barcelona,Cerdanyola del Valles,Spain,,,,,2017-06-01,June 2017,IEEE Transactions on Medical Imaging,02780062,16733,1558254X,Journal,36,6,7840040,1231-1249,,,198,0,repositoryam,Green,,,
315,2-s2.0-85017375126,10.1016/j.amp.2017.03.013,S0003448717301178,,"Autism, serious games and robotics: Tangible reality or abuse of language?",ar,Article,Cohen D.,,Institut des Systèmes Intelligents et de Robotique;Hôpital Universitaire Pitié Salpêtrière,Paris;Paris,France;France,,,,,2017-06-01,June 2017,Annales Medico-Psychologiques,00034487,29521,17696631,Journal,175,5,,438-445,,,1,0,,,,,
316,2-s2.0-85025628682,10.1109/TCOMM.2017.2661758,,,Adaptive Cross-Packet HARQ,cp,Conference Paper,Jabi M.,,Centre Énergie Matériaux Télécommunications,Varennes,Canada,,,,,2017-05-01,May 2017,IEEE Transactions on Communications,00906778,18931,,Journal,65,5,7837710,2022-2035,,,11,0,repositoryam,Green,,,
317,2-s2.0-85020721086,10.3813/AAA.919073,,,Modeling soundscape pleasantness using perceptual assessments and acoustic measurements along paths in urban context,ar,Article,Aumond P.,,"IFSTTAR - French institute of science and technology for transport, development and networks",Marne-la-Vallee,France,,,,,2017-05-01,May-June 2017,Acta Acustica united with Acustica,16101928,12941,18619959,Journal,103,3,,430-443,,,39,0,repositoryam,Green,,,
318,2-s2.0-85018725484,10.1109/TIT.2017.2683494,,,Almost universal codes achieving ergodic MIMO capacity within a constant gap,cp,Conference Paper,Luzzi L.,,CY Cergy Paris Université,Cergy-Pontoise,France,,,,,2017-05-01,May 2017,IEEE Transactions on Information Theory,00189448,15107,,Journal,63,5,7879826,3224-3241,,,6,0,repositoryam,Green,,,
319,2-s2.0-85015191832,10.1109/TSP.2017.2656847,,,Distributed stochastic optimization via matrix exponential learning,ar,Article,Mertikopoulos P.,,Laboratoire d'Informatique de Grenoble,Saint Martin d'Heres,France,,,,,2017-05-01,1 May 2017,IEEE Transactions on Signal Processing,1053587X,17391,,Journal,65,9,7829402,2277-2290,,,19,0,repositoryam,Green,,,
320,2-s2.0-85019145091,10.1109/ICMCS.2016.7905529,,,Aid to the medical diagnosis by retinal analysis,cp,Conference Paper,Boucherk K.,,Université Mouloud Mammeri de Tizi Ouzou,Tizi Ouzou,Algeria,,,,,2017-04-19,19 April 2017,International Conference on Multimedia Computing and Systems -Proceedings,,21100962458,,Conference Proceeding,0,,7905529,82-86,,,1,0,,,,,
321,2-s2.0-85015250123,10.1109/GlobalSIP.2016.7905899,,,Distributed learning for resource allocation under uncertainty,cp,Conference Paper,Mertikopoulos P.,,Laboratoire d'Informatique de Grenoble;INRIA Institut National de Recherche en Informatique et en Automatique,Saint Martin d'Heres;Le Chesnay,France;France,,,,,2017-04-19,19 April 2017,"2016 IEEE Global Conference on Signal and Information Processing, GlobalSIP 2016 - Proceedings",,21100812602,,Conference Proceeding,,,7905899,535-539,,,1,0,repositoryam,Green,,,
322,2-s2.0-84981303538,10.1109/BlackSeaCom.2016.7901540,,,Code-aware quantizer design for finite-precision min-sum decoders,cp,Conference Paper,Mheich Z.,,CEA LETI ,Grenoble,France,,,,,2017-04-14,14 April 2017,"2016 IEEE International Black Sea Conference on Communications and Networking, BlackSeaCom 2016",,21100812534,,Conference Proceeding,,,7901540,,,,5,0,repositoryam,Green,,,
323,2-s2.0-85018167482,10.1109/LCOMM.2017.2647804,,,Asymptotic error probability of the Gallager B decoder under timing errors,ar,Article,Dupraz E.,,"Laboratoire des Sciences et Techniques de l'Information, de la Communication et de la Connaissance (Lab-Sticc)",Brest,France,,,,,2017-04-01,April 2017,IEEE Communications Letters,10897798,18896,,Journal,21,4,7805222,698-701,,,2,1,repositoryvor,Green,,,
324,2-s2.0-85007412167,10.1109/TCSI.2016.2633581,,,Efficient Hardware Implementation of Probabilistic Gradient Descent Bit-Flipping,ar,Article,Le K.,,CY Cergy Paris Université,Cergy-Pontoise,France,,,,,2017-04-01,April 2017,IEEE Transactions on Circuits and Systems I: Regular Papers,15498328,11000153733,15580806,Journal,64,4,7786873,906-917,,,22,1,publisherfree2read,Bronze,,,
325,2-s2.0-85018297220,10.1109/ITA.2016.7888184,,,Message-aggregation enhanced iterative hard-decision decoders,cp,Conference Paper,Brkic S.,,University of Belgrade,Belgrade,Serbia,,,,,2017-03-27,27 March 2017,"2016 Information Theory and Applications Workshop, ITA 2016",,21100810416,,Conference Proceeding,,,7888184,,,,0,0,,,,,
326,2-s2.0-85016870681,10.1109/ITA.2016.7888185,,,Approaching maximum likelihood performance of LDPC codes by stochastic resonance in noisy iterative decoders,cp,Conference Paper,Vasić B.,,The University of Arizona,Tucson,United States,,,,,2017-03-27,27 March 2017,"2016 Information Theory and Applications Workshop, ITA 2016",,21100810416,,Conference Proceeding,,,7888185,,,,11,0,,,,,
327,2-s2.0-85016275777,10.1109/ACSSC.2016.7869012,,,Wove paper analysis through texture similarities,cp,Conference Paper,Abry P.,,École Normale Supérieure de Lyon,Lyon,France,,,,,2017-03-01,1 March 2017,"Conference Record - Asilomar Conference on Signals, Systems and Computers",10586393,12222,,Conference Proceeding,,,7869012,144-148,,,2,0,repositoryam,Green,,,
