,eid,doi,pii,pubmed_id,title,subtype,subtypeDescription,creator,afid,affilname,affiliation_city,affiliation_country,author_count,author_names,author_ids,author_afids,coverDate,coverDisplayDate,publicationName,issn,source_id,eIssn,aggregationType,volume,issueIdentifier,article_number,pageRange,description,authkeywords,citedby_count,openaccess,freetoread,freetoreadLabel,fund_acr,fund_no,fund_sponsor
678,2-s2.0-85030764550,,,,Frame instance extraction and clustering for default knowledge building,cp,Conference Paper,Shah A.,,National Institute of Technology Karnataka,Mangalore,India,,,,,2017-01-01,2017,CEUR Workshop Proceedings,16130073,21100218356,,Conference Proceeding,1935,,,1-10,,,1,0,,,,,
679,2-s2.0-85030752830,,,,Making sense of indoor spaces using semantic web mining and situated robot perception,cp,Conference Paper,Young J.,,University of Birmingham,Birmingham,United Kingdom,,,,,2017-01-01,2017,CEUR Workshop Proceedings,16130073,21100218356,,Conference Proceeding,1935,,,31-40,,,0,0,,,,,
680,2-s2.0-85030684104,10.1007/978-3-319-67471-1_12,,,Detecting toxicity pathways with a formal framework based on equilibrium changes,cp,Conference Paper,Miraglio B.,,Université Côte d'Azur,Nice,France,,,,,2017-01-01,2017,Lecture Notes in Computer Science (including subseries Lecture Notes in Artificial Intelligence and Lecture Notes in Bioinformatics),03029743,25674,16113349,Book Series,10545 LNBI,,,196-213,,,0,0,,,,,
681,2-s2.0-85030456598,,,,Soft and cost MDD propagators,cp,Conference Paper,Perez G.,,Université Côte d'Azur,Nice,France,,,,,2017-01-01,2017,"31st AAAI Conference on Artificial Intelligence, AAAI 2017",,21100832747,,Conference Proceeding,,,,3922-3928,,,5,0,,,,,
682,2-s2.0-85030166092,10.1007/978-3-319-66845-1_13,,,Analysis of synchronisations in stateful active objects,cp,Conference Paper,Henrio L.,,Université Côte d'Azur,Nice,France,,,,,2017-01-01,2017,Lecture Notes in Computer Science (including subseries Lecture Notes in Artificial Intelligence and Lecture Notes in Bioinformatics),03029743,25674,16113349,Book Series,10510 LNCS,,,195-210,,,7,0,repositoryam,Green,,,
683,2-s2.0-85029719246,,,,Colourings with bounded monochromatic components in graphs of given circumference,ar,Article,Mohar B.,,"Simon Fraser University;Institute of Mathematics, Physics and Mechanics Ljubljana",Burnaby;Ljubljana,Canada;Slovenia,,,,,2017-01-01,2017,Australasian Journal of Combinatorics,10344942,17700155817,22023518,Journal,69,2,,236-242,,,4,0,,,,,
684,2-s2.0-85029489408,,,,Learning slowly to learn better: Curriculum learning for legal ontology population,cp,Conference Paper,Cardellino C.,,Universidad Nacional de Córdoba,Cordoba,Argentina,,,,,2017-01-01,2017,FLAIRS 2017 - Proceedings of the 30th International Florida Artificial Intelligence Research Society Conference,,21100830700,,Conference Proceeding,,,,252-257,,,1,0,,,,,
685,2-s2.0-85029405422,10.1007/978-3-319-66583-2_18,,,Stochastic models for solar power,cp,Conference Paper,Politaki D.,,Université Côte d'Azur,Nice,France,,,,,2017-01-01,2017,Lecture Notes in Computer Science (including subseries Lecture Notes in Artificial Intelligence and Lecture Notes in Bioinformatics),03029743,25674,16113349,Book Series,10497 LNCS,,,282-297,,,3,0,repositoryam,Green,,,
686,2-s2.0-85029159309,,,,A pragma semantic analysis of the emotion/sentiment relation in debates,cp,Conference Paper,Basile V.,,Université Côte d'Azur,Nice,France,,,,,2017-01-01,2017,CEUR Workshop Proceedings,16130073,21100218356,,Conference Proceeding,1895,,,117-123,,,0,0,,,,,
687,2-s2.0-85028728357,10.1007/978-3-319-66158-2_45,,,Search strategies for floating point constraint systems,cp,Conference Paper,Zitoun H.,,Université Côte d'Azur,Nice,France,,,,,2017-01-01,2017,Lecture Notes in Computer Science (including subseries Lecture Notes in Artificial Intelligence and Lecture Notes in Bioinformatics),03029743,25674,16113349,Book Series,10416 LNCS,,,707-722,,,8,0,,,,,
688,2-s2.0-85028723891,10.1007/978-3-319-64203-1_2,,,Scaling energy adaptive applications for sustainable profitability,cp,Conference Paper,Hermenier F.,,"Nutanix, Inc.;Université Côte d'Azur",San Jose;Nice,United States;France,,,,,2017-01-01,2017,Lecture Notes in Computer Science (including subseries Lecture Notes in Artificial Intelligence and Lecture Notes in Bioinformatics),03029743,25674,16113349,Book Series,10417 LNCS,,,23-35,,,1,0,,,,,
689,2-s2.0-85028692351,10.1007/978-3-319-66158-2_15,,,MDDs: Sampling and probability constraints,cp,Conference Paper,Perez G.,,Université Côte d'Azur,Nice,France,,,,,2017-01-01,2017,Lecture Notes in Computer Science (including subseries Lecture Notes in Artificial Intelligence and Lecture Notes in Bioinformatics),03029743,25674,16113349,Book Series,10416 LNCS,,,226-242,,,5,0,,,,,
690,2-s2.0-85028325793,10.1109/MAES.2017.160047,,,Security of SCADA systems against cyber-physical attacks,ar,Article,Do V.L.,,Viettel Research and Development Institute,Hanoi,Viet Nam,,,,,2017-01-01,2017,IEEE Aerospace and Electronic Systems Magazine,08858985,25993,,Journal,32,5,7954148,28-45,,,39,0,,,,,
691,2-s2.0-85026778057,10.1007/978-3-319-62401-3_29,,,Multiple Bayesian models for the sustainable city: The case of urban sprawl,cp,Conference Paper,Fusco G.,,Université Côte d'Azur,Nice,France,,,,,2017-01-01,2017,Lecture Notes in Computer Science (including subseries Lecture Notes in Artificial Intelligence and Lecture Notes in Bioinformatics),03029743,25674,16113349,Book Series,10407 LNCS,,,392-407,,,1,0,repositoryam,Green,,,
692,2-s2.0-85026406861,,,,Stratégies de recherche pour les systèmes de contraintes sur les flottants,cp,Conference Paper,Zitoun H.,,Université Côte d'Azur,Nice,France,,,,,2017-01-01,2017,"Treiziemes Journees Francophones de Programmation par Contraintes, JFPC 2017",,21100825265,,Conference Proceeding,,,,149-158,,,0,0,,,,,
693,2-s2.0-85022326190,10.5220/0006358504950500,,,Improving confidence in experimental systems through automated construction of argumentation diagrams,cp,Conference Paper,Duffau C.,,Université Côte d'Azur;Axonic,Nice;Sophia Antipolis,France;France,,,,,2017-01-01,2017,ICEIS 2017 - Proceedings of the 19th International Conference on Enterprise Information Systems,,21100469407,,Conference Proceeding,2,,,495-500,,,5,1,repositoryam,Green,,,
694,2-s2.0-85021900097,,,,Multi-view design for cyber-physical systems,cp,Conference Paper,Zhao H.,,Université Côte d'Azur,Nice,France,,,,,2017-01-01,2017,CEUR Workshop Proceedings,16130073,21100218356,,Conference Proceeding,1851,,,22-28,,,3,0,,,,,
695,2-s2.0-85021839196,10.1137/16M1062089,,,Low-rank tensor recovery using sequentially optimal modal projections in iterative hard thresholding (sempiht),ar,Article,De Morais Goulart J.H.,,Universite Grenoble Alpes,Saint Martin d'Heres,France,,,,,2017-01-01,2017,SIAM Journal on Scientific Computing,10648275,26425,10957197,Journal,39,3,,A860-A889,,,3,0,repositoryam,Green,,,
696,2-s2.0-85021690484,10.1007/978-3-319-58071-5_50,,,Persuasive argumentation and emotions: An empirical evaluation with users,ch,Book Chapter,Benlamine M.S.,,University of Montreal,Montreal,Canada,,,,,2017-01-01,2017,Lecture Notes in Computer Science (including subseries Lecture Notes in Artificial Intelligence and Lecture Notes in Bioinformatics),03029743,25674,16113349,Book Series,10271,,,659-671,,,4,0,,,,,
697,2-s2.0-85021628402,10.18653/v1/e17-2041,,,"Legal NERC with ontologies, Wikipedia and curriculum learning",cp,Conference Paper,Cardellino C.,,Universidad Nacional de Córdoba,Cordoba,Argentina,,,,,2017-01-01,2017,"15th Conference of the European Chapter of the Association for Computational Linguistics, EACL 2017 - Proceedings of Conference",,21100821101,,Conference Proceeding,2,,,254-259,,,5,1,repositoryam,Green,,,
698,2-s2.0-85020777057,10.1007/978-3-319-59776-8_3,,,MDDS are efficient modeling tools: An application to some statistical constraints,cp,Conference Paper,Perez G.,,"Laboratoire d'Informatique, Signaux et Systèmes de Sophia-Antipolis",Sophia Antipolis,France,,,,,2017-01-01,2017,Lecture Notes in Computer Science (including subseries Lecture Notes in Artificial Intelligence and Lecture Notes in Bioinformatics),03029743,25674,16113349,Book Series,10335 LNCS,,,30-40,,,3,0,,,,,
699,2-s2.0-85020626245,,,,An abstract discrete-event simulator considering input with uncertainty,cp,Conference Paper,Vicino D.,,Carleton University,Ottawa,Canada,,,,,2017-01-01,2017,Simulation Series,07359276,12193,,Conference Proceeding,49,4,,192-203,,,0,0,,,,,
700,2-s2.0-85020452342,10.4149/cai_2017_1_223,,,Personalizing and improving resource recommendation by analyzing users preferences in social tagging activities,ar,Article,Beldjoudi S.,,Université Badji Mokhtar - Annaba;Higher School of Industrial Technologies,Annaba;Algiers,Algeria;Algeria,,,,,2017-01-01,2017,Computing and Informatics,13359150,24162,,Journal,36,1,,223-256,,,7,0,,,,,
701,2-s2.0-85020448153,10.1007/978-3-319-59448-4_20,,,3D coronary vessel tracking in X-ray projections,cp,Conference Paper,Poulain E.,,"Université Côte d'Azur;GE Healthcare, France",Nice;Aulnay-sous-Bois,France;France,,,,,2017-01-01,2017,Lecture Notes in Computer Science (including subseries Lecture Notes in Artificial Intelligence and Lecture Notes in Bioinformatics),03029743,25674,16113349,Book Series,10263 LNCS,,,204-215,,,1,0,repositoryam,Green,,,
702,2-s2.0-85020428617,10.1007/978-3-319-55372-6_1,,,Observers for position estimation using bearing and biased velocity information,cp,Conference Paper,Le Bras F.,,French Direction Générale de l’Armement (Technical Directorate),Paris,France,,,,,2017-01-01,2017,Lecture Notes in Control and Information Sciences,01708643,13412,,Book Series,474,,,3-23,,,10,0,,,,,
703,2-s2.0-85020381791,10.1007/978-3-319-58631-1_12,,,Enumerating orthogonal Latin squares generated by bipermutive cellular automata,cp,Conference Paper,Mariot L.,,Université Côte d'Azur;Università degli Studi di Milano-Bicocca,Nice;Milan,France;Italy,,,,,2017-01-01,2017,Lecture Notes in Computer Science (including subseries Lecture Notes in Artificial Intelligence and Lecture Notes in Bioinformatics),03029743,25674,16113349,Book Series,10248 LNCS,,,151-164,,,4,0,repositoryam,Green,,,
704,2-s2.0-85020377808,,,,Preface,ed,Editorial,Dennunzio A.,,Università degli Studi di Milano-Bicocca,Milan,Italy,,,,,2017-01-01,2017,Lecture Notes in Computer Science (including subseries Lecture Notes in Artificial Intelligence and Lecture Notes in Bioinformatics),03029743,25674,16113349,Book Series,10248 LNCS,,,,,,0,0,,,,,
705,2-s2.0-85020080719,10.1137/16M1060868,,,Number of fixed points and disjoint cycles in monotone boolean networks,ar,Article,Aracena J.,,Universidad de Concepcion,Biobio,Chile,,,,,2017-01-01,2017,SIAM Journal on Discrete Mathematics,08954801,26406,,Journal,31,3,,1702-1725,,,21,0,repositoryam,Green,,,
706,2-s2.0-85019746156,10.1007/978-3-319-58694-6_7,,,A formalization of the French elementary school curricula,cp,Conference Paper,Rocha O.R.,,Centre Inria Sophia Antipolis - Méditerranée,Sophia Antipolis,France,,,,,2017-01-01,2017,Lecture Notes in Computer Science (including subseries Lecture Notes in Artificial Intelligence and Lecture Notes in Bioinformatics),03029743,25674,16113349,Book Series,10180 LNAI,,,82-94,,,4,0,repositoryam,Green,,,
707,2-s2.0-85019270801,10.1007/978-3-319-56856-0_8,,,Tracing imperfectly modular variability in software product line implementation,cp,Conference Paper,Tërnava X.,,Université Côte d'Azur,Nice,France,,,,,2017-01-01,2017,Lecture Notes in Computer Science (including subseries Lecture Notes in Artificial Intelligence and Lecture Notes in Bioinformatics),03029743,25674,16113349,Book Series,10221 LNCS,,,112-120,,,3,0,repositoryam,Green,,,
708,2-s2.0-85018700062,10.3233/JIFS-169295,,,Bayesian localization of anomaly in distributed networks with quadratic criterion,ar,Article,Zhang J.,,Wuhan University of Technology,Wuhan,China,,,,,2017-01-01,2017,Journal of Intelligent and Fuzzy Systems,10641246,23917,18758967,Journal,32,5,,3595-3608,,,1,0,,,,,
709,2-s2.0-85018669689,10.1007/978-3-319-57708-1_3,,,Instant-based and state-based analysis of infinite logical clock,cp,Conference Paper,Xu Q.,,Shanghai University;Shanghai Key Laboratory of Computer Software Evaluating and Testing,Shanghai;Shanghai,China;China,,,,,2017-01-01,2017,Lecture Notes in Computer Science (including subseries Lecture Notes in Artificial Intelligence and Lecture Notes in Bioinformatics),03029743,25674,16113349,Book Series,10189 LNCS,,,32-51,,,0,0,,,,,
710,2-s2.0-85018290827,10.1007/978-3-319-57666-4_8,,,MARTE/pCCSL: Modeling and refining stochastic behaviors of CPSs with probabilistic logical clocks,cp,Conference Paper,Du D.,,East China Normal University,Shanghai,China,,,,,2017-01-01,2017,Lecture Notes in Computer Science (including subseries Lecture Notes in Artificial Intelligence and Lecture Notes in Bioinformatics),03029743,25674,16113349,Book Series,10231 LNCS,,,111-133,,,6,0,repositoryam,Green,,,
711,2-s2.0-85017398774,10.1016/j.dam.2017.03.009,S0166218X17301427,,Steinberg-like theorems for backbone colouring,ar,Article,Araujo J.,,Universidade Federal do Ceará,Fortaleza,Brazil,,,,,2017-01-01,20 August 2018,Discrete Applied Mathematics,0166218X,25890,,Journal,245,,,155-167,,,0,0,repositoryam,Green,,,
712,2-s2.0-85015693223,,,,"""Humanitarian"" drone: State of the art and reflections",ar,Article,Apvrille L.,,Laboratoire Traitement et Communication de l'Information,Palaiseau,France,,,,,2017-01-01,January-April 2017,Revue Francaise de Photogrammetrie et de Teledetection,17689791,144988,,Journal,2017-January,213-214,,63-71,,,5,0,,,,,
713,2-s2.0-85013016930,10.1007/978-3-319-53354-4_6,,,An agent-based architecture for personalized recommendations,cp,Conference Paper,Othmane A.B.,,"Laboratoire d'Informatique, Signaux et Systèmes de Sophia-Antipolis",Sophia Antipolis,France,,,,,2017-01-01,2017,Lecture Notes in Computer Science (including subseries Lecture Notes in Artificial Intelligence and Lecture Notes in Bioinformatics),03029743,25674,16113349,Book Series,10162 LNAI,,,96-113,,,2,0,repositoryam,Green,,,
714,2-s2.0-85012986161,10.1007/978-3-319-53354-4_8,,,Natural language argumentation for text exploration,cp,Conference Paper,Cabrio E.,,Université Côte d'Azur,Nice,France,,,,,2017-01-01,2017,Lecture Notes in Computer Science (including subseries Lecture Notes in Artificial Intelligence and Lecture Notes in Bioinformatics),03029743,25674,16113349,Book Series,10162 LNAI,,,133-150,,,2,0,,,,,
715,2-s2.0-85010703034,10.1007/978-3-319-52228-9_5,,,A denotational semantics for parameterised networks of synchronised automata,cp,Conference Paper,Li S.,,East China Normal University,Shanghai,China,,,,,2017-01-01,2017,Lecture Notes in Computer Science (including subseries Lecture Notes in Artificial Intelligence and Lecture Notes in Bioinformatics),03029743,25674,16113349,Book Series,10134 LNCS,,,93-113,,,0,0,repositoryam,Green,,,
716,2-s2.0-85010695116,10.1007/978-3-319-51741-4_4,,,Bin packing with colocations,cp,Conference Paper,Bermond J.C.,,Université Côte d'Azur,Nice,France,,,,,2017-01-01,2017,Lecture Notes in Computer Science (including subseries Lecture Notes in Artificial Intelligence and Lecture Notes in Bioinformatics),03029743,25674,16113349,Book Series,10138 LNCS,,,40-51,,,3,0,repositoryam,Green,,,
717,2-s2.0-85010788251,10.1109/CDC.2016.7798991,,,Output regulation on the Special Euclidean Group SE(3),cp,Conference Paper,De Marco S.,,Alma Mater Studiorum Università di Bologna,Bologna,Italy,,,,,2016-12-27,27 December 2016,"2016 IEEE 55th Conference on Decision and Control, CDC 2016",,21100793187,,Conference Proceeding,,,7798991,4734-4739,,,3,0,,,,,
718,2-s2.0-85010780487,10.1109/CDC.2016.7798565,,,Riccati observers for position and velocity bias estimation from direction measurements,cp,Conference Paper,Hamel T.,,"Laboratoire d'Informatique, Signaux et Systèmes de Sophia-Antipolis",Sophia Antipolis,France,,,,,2016-12-27,27 December 2016,"2016 IEEE 55th Conference on Decision and Control, CDC 2016",,21100793187,,Conference Proceeding,,,7798565,2047-2053,,,6,0,repositoryam,Green,,,
719,2-s2.0-85009371839,10.1109/FOCS.2016.79,,,How to Determine if a Random Graph with a Fixed Degree Sequence Has a Giant Component,cp,Conference Paper,Joos F.,,University of Birmingham,Birmingham,United Kingdom,,,,,2016-12-14,14 December 2016,"Proceedings - Annual IEEE Symposium on Foundations of Computer Science, FOCS",02725428,21100474207,,Conference Proceeding,2016-December,,7782984,695-703,,,4,0,repositoryam,Green,,,
720,2-s2.0-85010282299,10.1109/CCI.2016.7778890,,,HTTP adaptive streaming and access router management: The users' and network's perspectives,cp,Conference Paper,Livi S.,,Université Côte d'Azur,Nice,France,,,,,2016-12-08,8 December 2016,"2016 1st IEEE International Conference on Computer Communication and the Internet, ICCCI 2016",,21100792709,,Conference Proceeding,,,7778890,118-123,,,0,0,,,,,
721,2-s2.0-85010703389,10.1109/CloudNet.2016.51,,,Container-Based Service Chaining: A Performance Perspective,cp,Conference Paper,Livi S.,,Université Côte d'Azur,Nice,France,,,,,2016-12-06,6 December 2016,"Proceedings - 2016 5th IEEE International Conference on Cloud Networking, CloudNet 2016",,21100793174,,Conference Proceeding,,,7776597,176-181,,,8,0,,,,,
722,2-s2.0-84997120374,10.1016/j.tcs.2016.11.001,S0304397516305813,,Forewords: Special issue on Theory and Applications of Graph Searching Problems,ed,Editorial,Fomin F.V.,,Universitetet i Bergen,Bergen,Norway,,,,,2016-12-06,6 December 2016,Theoretical Computer Science,03043975,20571,,Journal,655,,,1,,,0,1,publisherfree2read,Bronze,,,
723,2-s2.0-85010295312,10.1109/MCSoC.2016.14,,,Going beyond Mean and Median Programs Performances,cp,Conference Paper,Worms J.,,Laboratoire de Mathématiques de Versailles,Versailles,France,,,,,2016-12-05,5 December 2016,"Proceedings - IEEE 10th International Symposium on Embedded Multicore/Many-Core Systems-on-Chip, MCSoC 2016",,21100792732,,Conference Proceeding,,,7774425,93-100,,,0,0,repositoryam,Green,,,
724,2-s2.0-85020667655,10.3390/systems4040034,,,Emergence at the fundamental systems level: Existence conditions for iterative specifications,ar,Article,Zeigler B.P.,,The University of Arizona,Tucson,United States,,,,,2016-12-01,December 2016,Systems,,21101020135,20798954,Journal,4,4,34,,,,2,1,repositoryam,Green,,,
725,2-s2.0-85013324772,10.1142/S021819401640009X,,,Using Closed Patterns to Solve the Consensus Clustering Problem,cp,Conference Paper,Al-Najdi A.,,"Laboratoire d'Informatique, Signaux et Systèmes de Sophia-Antipolis",Sophia Antipolis,France,,,,,2016-12-01,1 December 2016,International Journal of Software Engineering and Knowledge Engineering,02181940,19270,,Journal,26,9-10,,1379-1397,,,3,0,,,,,
726,2-s2.0-84996931974,10.1016/j.acvd.2016.03.002,S1875213616301097,27402153,Non-invasive prediction of catheter ablation outcome in persistent atrial fibrillation by fibrillatory wave amplitude computation in multiple electrocardiogram leads,ar,Article,Zarzoso V.,,"Laboratoire d'Informatique, Signaux et Systèmes de Sophia-Antipolis",Sophia Antipolis,France,,,,,2016-12-01,1 December 2016,Archives of Cardiovascular Diseases,18752136,11300153709,18752128,Journal,109,12,,679-688,,,7,1,publisherfree2read,Bronze,,,
727,2-s2.0-84990829764,10.1109/TRO.2016.2604495,,,Landing of a quadrotor on a moving target using dynamic image-based visual servo control,ar,Article,Serra P.,,GMV S.A.;University of Macau,Tres Cantos;Taipa,Spain;Macao,,,,,2016-12-01,December 2016,IEEE Transactions on Robotics,15523098,95101,,Journal,32,6,7580657,1524-1535,,,111,0,,,,,
728,2-s2.0-84964316632,10.1007/s00362-016-0767-6,,,Extremal measures maximizing functionals based on simplicial volumes,ar,Article,Pronzato L.,,CNRS Centre National de la Recherche Scientifique,Paris,France,,,,,2016-12-01,1 December 2016,Statistical Papers,09325026,14233,,Journal,57,4,,1059-1075,,,3,0,repositoryam,Green,,,
729,2-s2.0-84958033616,10.1186/s13634-016-0308-4,,,Rate-distortion-optimized multi-view streaming in wireless environment using network coding,ar,Article,Greco C.,,DxO,Paris,France,,,,,2016-12-01,1 December 2016,Eurasip Journal on Advances in Signal Processing,16876172,15300154801,16876180,Journal,2016,1,17,1-20,,,3,1,publisherfullgold,Gold,,,
730,2-s2.0-85007575554,10.1145/2994374.2994398,,,On the behavioral drift estimation of ubiquitous computing systems in partially known environments,cp,Conference Paper,Rocher G.,,Université Côte d'Azur;Groupe Innovation,Nice;Saint-Ouen,France;France,,,,,2016-11-28,28 November 2016,ACM International Conference Proceeding Series,,11600154611,,Conference Proceeding,28-November-2016,,,264-273,,,1,0,repositoryam,Green,,,
731,2-s2.0-85007565440,10.1145/2994374.3004075,,,Opportunistic human activity recognition: A study on opportunity dataset,cp,Conference Paper,Gioanni L.,,Université Côte d'Azur,Nice,France,,,,,2016-11-28,28 November 2016,ACM International Conference Proceeding Series,,11600154611,,Conference Proceeding,28-November-2016,,,290-291,,,1,0,,,,,
732,2-s2.0-85005966670,10.1109/EUSIPCO.2016.7760578,,,An efficient image retrieval method under dithered-based quantization scheme,cp,Conference Paper,Chaker A.,,"University of Carthage, Ecole Supérieure des Communications de Tunis",Ariana,Tunisia,,,,,2016-11-28,28 November 2016,European Signal Processing Conference,22195491,21100204301,,Conference Proceeding,2016-November,,7760578,1896-1900,,,0,0,,,,,
733,2-s2.0-84997541871,10.37236/6152,,,Equitable orientations of sparse uniform hypergraphs,ar,Article,Cohen N.,,Universite Paris-Saclay,Saint-Aubin,France,,,,,2016-11-25,25 November 2016,Electronic Journal of Combinatorics,,26389,10778926,Journal,23,4,#P4.31,,,,0,1,repositoryam,Green,,,
734,2-s2.0-85001976223,10.1613/jair.5247,,,Embarrassingly parallel search in constraint programming,ar,Article,Malapert A.,,Université Côte d'Azur,Nice,France,,,,,2016-11-01,November 2016,Journal of Artificial Intelligence Research,10769757,24330,,Journal,57,,,421-464,,,17,1,repositoryvor,Green,,,
735,2-s2.0-84981723077,10.1109/TGRS.2016.2585201,,,Nonconvex Regularization in Remote Sensing,ar,Article,Tuia D.,,Universität Zürich,Zurich,Switzerland,,,,,2016-11-01,November 2016,IEEE Transactions on Geoscience and Remote Sensing,01962892,17360,,Journal,54,11,7529046,6470-6480,,,23,0,repositoryam,Green,,,
736,2-s2.0-84966774712,10.1016/j.sigpro.2016.04.009,S0165168416300482,,Nested Tucker tensor decomposition with application to MIMO relay systems using tensor space-time coding (TSTC),ar,Article,Favier G.,,"Laboratoire d'Informatique, Signaux et Systèmes de Sophia-Antipolis",Sophia Antipolis,France,,,,,2016-11-01,1 November 2016,Signal Processing,01651684,25548,,Journal,128,,,318-331,,,34,0,,,,,
737,2-s2.0-84998546926,10.1109/DSD.2016.86,,,Using SystemC Cyber Models in an FMI Co-Simulation Environment: Results and Proposed FMI Enhancements,cp,Conference Paper,Centomo S.,,Università degli Studi di Verona,Verona,Italy,,,,,2016-10-26,26 October 2016,"Proceedings - 19th Euromicro Conference on Digital System Design, DSD 2016",,21100787306,,Conference Proceeding,,,7723569,318-325,,,13,0,repositoryam,Green,,,
738,2-s2.0-85084182274,10.1145/2993236.2993246,,,Delaying decisions in variable concern hierarchies,ar,Article,Kienzle J.,,Université McGill,Montreal,Canada,,,,,2016-10-20,20 October 2016,ACM SIGPLAN Notices,15232867,19700185000,,Journal,52,3,,93-103,,,3,0,repositoryam,Green,,,
739,2-s2.0-85006825778,10.1145/2993236.2993246,,,Delaying decisions in variable concern hierarchies,cp,Conference Paper,Kienzle J.,,Université McGill,Montreal,Canada,,,,,2016-10-20,20 October 2016,"GPCE 2016 - Proceedings of the 2016 ACM SIGPLAN International Conference on Generative Programming: Concepts and Experiences, co-located with SPLASH 2016",,21100789907,,Conference Proceeding,,,,93-103,,,9,0,repositoryam,Green,,,
740,2-s2.0-85006753302,10.1145/2997364.2997384,,,Execution framework of the GEMOC studio (Tool Demo),cp,Conference Paper,Bousse E.,,Technische Universität Wien,Vienna,Austria,,,,,2016-10-20,20 October 2016,"SLE 2016 - Proceedings of the 2016 ACM SIGPLAN International Conference on Software Language Engineering, co-located with SPLASH 2016",,21100789897,,Conference Proceeding,,,,84-89,,,56,0,repositoryvor,Green,,,
741,2-s2.0-84995474885,10.1063/1.4965407,,,TV-regularized phase reconstruction in differential-interference-contrast (DIC) microscopy,cp,Conference Paper,Rebegoldi S.,,Università degli Studi di Modena e Reggio Emilia,Modena,Italy,,,,,2016-10-20,20 October 2016,AIP Conference Proceedings,0094243X,26916,15517616,Conference Proceeding,1776,,090043,,,,0,0,,,,,
742,2-s2.0-84990848146,10.1109/SAM.2016.7569709,,,Enhanced block term decomposition for atrial activity extraction in atrial fibrillation ECG,cp,Conference Paper,Ribeiro L.N.,,Universidade Federal do Ceará,Fortaleza,Brazil,,,,,2016-09-15,15 September 2016,Proceedings of the IEEE Sensor Array and Multichannel Signal Processing Workshop,,21100217219,2151870X,Conference Proceeding,2016-September,,7569709,,,,7,0,,,,,
743,2-s2.0-84991721140,10.1109/HPCSim.2016.7568433,,,Parallel and pseudorandom discrete event system specification vs. networks of spiking neurons: Formalization and preliminary implementation results,cp,Conference Paper,Muzy A.,,"Laboratoire d'Informatique, Signaux et Systèmes de Sophia-Antipolis",Sophia Antipolis,France,,,,,2016-09-13,13 September 2016,"2016 International Conference on High Performance Computing and Simulation, HPCS 2016",,21100782374,,Conference Proceeding,,,7568433,925-934,,,1,0,repositoryam,Green,,,
