,eid,doi,pii,pubmed_id,title,subtype,subtypeDescription,creator,afid,affilname,affiliation_city,affiliation_country,author_count,author_names,author_ids,author_afids,coverDate,coverDisplayDate,publicationName,issn,source_id,eIssn,aggregationType,volume,issueIdentifier,article_number,pageRange,description,authkeywords,citedby_count,openaccess,freetoread,freetoreadLabel,fund_acr,fund_no,fund_sponsor
315,2-s2.0-85070958384,10.1007/s11548-019-02048-3,,31420832,Force classification during robotic interventions through simulation-trained neural networks,ar,Article,Mendizabal A.,,"Laboratoire des Sciences de l'Ingénieur, de l'Informatique et de l'Imagerie;INRIA Institut National de Recherche en Informatique et en Automatique",Illkirch-Graffenstaden;Le Chesnay,France;France,,,,,2019-09-01,1 September 2019,International Journal of Computer Assisted Radiology and Surgery,18616410,4700152490,18616429,Journal,14,9,,1601-1610,,,10,0,repositoryam,Green,,,
316,2-s2.0-85069818478,10.1016/j.imavis.2019.06.005,S0262885619300885,,Reinforcement learning for neural architecture search: A review,ar,Article,Jaafra Y.,,"Université de Strasbourg;Université de Tunis El Manar, Ecole Nationale d'Ingénieurs de Tunis;Segula Technologies",Strasbourg;Tunis;Trappes,France;Tunisia;France,,,,,2019-09-01,September 2019,Image and Vision Computing,02628856,25549,,Journal,89,,,57-66,,,41,1,repositoryvor,Green,,,
317,2-s2.0-85068463693,10.1016/j.jviscsurg.2019.06.005,S1878788619300840,31296453,Should we ban Live Surgery?,ed,Editorial,Liverneaux P.,,Les Hôpitaux Universitaires de Strasbourg,Strasbourg,France,,,,,2019-09-01,September 2019,Journal of Visceral Surgery,18787886,19700181201,18787878,Journal,156,4,,279-280,,,3,0,,,,,
318,2-s2.0-85068186037,10.1016/j.hansur.2019.06.003,S2468122919300799,31254656,Comparison of tactile sensitivity measured with a new digital esthesiometer (Beam Test) relative to Semmes–Weinstein monofilament analog esthesiometer,ar,Article,Sapa M.C.,,Les Hôpitaux Universitaires de Strasbourg,Strasbourg,France,,,,,2019-09-01,September 2019,Hand Surgery and Rehabilitation,24681229,21100456711,24681210,Journal,38,4,,242-245,,,2,1,publisherfree2read,Bronze,,,
319,2-s2.0-85067802176,10.1016/j.asoc.2019.105594,S1568494619303746,,SCHEDA: Lightweight euclidean-like heuristics for anomaly detection in periodic time series,ar,Article,Guigou F.,,Université de Strasbourg;IPLine,Strasbourg;,France;France,,,,,2019-09-01,September 2019,Applied Soft Computing Journal,15684946,18136,,Journal,82,,105594,,,,4,0,repositoryvor,Green,,,
320,2-s2.0-85072219874,10.5194/isprs-archives-XLII-2-W15-829-2019,,,MULTI-SENSOR 3D RECORDING PIPELINE for the DOCUMENTATION of JAVANESE TEMPLES,cp,Conference Paper,Murtiyos A.,,"Laboratoire des Sciences de l'Ingénieur, de l'Informatique et de l'Imagerie",Illkirch-Graffenstaden,France,,,,,2019-08-19,19 August 2019,"International Archives of the Photogrammetry, Remote Sensing and Spatial Information Sciences - ISPRS Archives",16821750,21100248929,,Conference Proceeding,42,2/W15,,829-834,,,3,1,publisherfullgold,Gold,,,
321,2-s2.0-85072219299,10.5194/isprs-archives-XLII-2-W15-527-2019,,,3D INDOOR DOCUMENTATION of the WINTER GARDEN in the EARTHENWARE MUSEUM at SARREGUEMINES (France),cp,Conference Paper,Girardet V.,,"Laboratoire des Sciences de l'Ingénieur, de l'Informatique et de l'Imagerie",Illkirch-Graffenstaden,France,,,,,2019-08-19,19 August 2019,"International Archives of the Photogrammetry, Remote Sensing and Spatial Information Sciences - ISPRS Archives",16821750,21100248929,,Conference Proceeding,42,2/W15,,527-532,,,2,1,publisherfullgold,Gold,,,
322,2-s2.0-85072201244,10.5194/isprs-archives-XLII-2-W15-719-2019,,,COMBINATION of THERMAL and GEOMETRIC INFORMATION for BIM ENRICHMENT,cp,Conference Paper,Macher H.,,"Laboratoire des Sciences de l'Ingénieur, de l'Informatique et de l'Imagerie",Illkirch-Graffenstaden,France,,,,,2019-08-19,19 August 2019,"International Archives of the Photogrammetry, Remote Sensing and Spatial Information Sciences - ISPRS Archives",16821750,21100248929,,Conference Proceeding,42,2/W15,,719-725,,,4,1,repositoryam,Green,,,
323,2-s2.0-85072200018,10.5194/isprs-archives-XLII-2-W15-821-2019,,,AUTOMATIC HERITAGE BUILDING POINT CLOUD SEGMENTATION and CLASSIFICATION USING GEOMETRICAL RULES,cp,Conference Paper,Murtiyoso A.,,"Laboratoire des Sciences de l'Ingénieur, de l'Informatique et de l'Imagerie",Illkirch-Graffenstaden,France,,,,,2019-08-19,19 August 2019,"International Archives of the Photogrammetry, Remote Sensing and Spatial Information Sciences - ISPRS Archives",16821750,21100248929,,Conference Proceeding,42,2/W15,,821-827,,,7,1,publisherfullgold,Gold,,,
324,2-s2.0-85072184373,10.5194/isprs-archives-XLII-2-W15-55-2019,,,"2D &amp; 3D RECONSTRUCTION WORKFLOWS from ARCHIVE IMAGES, CASE STUDY of DAMAGED MONUMENTS in BOSRA AL-SHAM CITY (Syria)",cp,Conference Paper,Al Khalil O.,,Tishreen University,Latakia,Syrian Arab Republic,,,,,2019-08-19,19 August 2019,"International Archives of the Photogrammetry, Remote Sensing and Spatial Information Sciences - ISPRS Archives",16821750,21100248929,,Conference Proceeding,42,2/W15,,55-62,,,3,1,publisherfullgold,Gold,,,
325,2-s2.0-85072179885,10.5194/isprs-archives-XLII-2-W15-1083-2019,,,REGISTRATION of 2D DRAWINGS on A 3D POINT CLOUD AS A SUPPORT for the MODELING of COMPLEX ARCHITECTURES,cp,Conference Paper,Semler Q.,,"Laboratoire des Sciences de l'Ingénieur, de l'Informatique et de l'Imagerie",Illkirch-Graffenstaden,France,,,,,2019-08-19,19 August 2019,"International Archives of the Photogrammetry, Remote Sensing and Spatial Information Sciences - ISPRS Archives",16821750,21100248929,,Conference Proceeding,42,2/W15,,1083-1087,,,1,1,publisherfullgold,Gold,,,
326,2-s2.0-85072166705,10.5194/isprs-archives-XLII-2-W15-41-2019,,,"IMPLEMENTATION of SURVEY and THREE-DIMENSIONAL MONITORING of ARCHAEOLOGICAL EXCAVATIONS of the KHIRBAT AL-DUSAQ SITE, Jordan",cp,Conference Paper,Alby E.,,"Laboratoire des Sciences de l'Ingénieur, de l'Informatique et de l'Imagerie",Illkirch-Graffenstaden,France,,,,,2019-08-19,19 August 2019,"International Archives of the Photogrammetry, Remote Sensing and Spatial Information Sciences - ISPRS Archives",16821750,21100248929,,Conference Proceeding,42,2/W15,,41-47,,,4,1,publisherfullgold,Gold,,,
327,2-s2.0-85072156348,10.5194/isprs-archives-XLII-2-W15-625-2019,,,3D MODELLING of ARCHITECTURAL BLOCKS and ANTIQUE SCULPTURES for the CONSERVATION and the PROMOTION of ARCHAEOLOGICAL HERITAGE &amp;ndash; EXPERIMENTS in ALSACE,cp,Conference Paper,Koehl M.,,"Laboratoire des Sciences de l'Ingénieur, de l'Informatique et de l'Imagerie",Illkirch-Graffenstaden,France,,,,,2019-08-19,19 August 2019,"International Archives of the Photogrammetry, Remote Sensing and Spatial Information Sciences - ISPRS Archives",16821750,21100248929,,Conference Proceeding,42,2/W15,,625-632,,,3,1,publisherfullgold,Gold,,,
328,2-s2.0-85072155072,10.5194/isprs-archives-XLII-2-W15-133-2019,,,ASSESSMENT of A KEYPOINTS DETECTOR for the REGISTRATION of INDOOR and OUTDOOR HERITAGE POINT CLOUDS,cp,Conference Paper,Assi R.,,INSA Strasbourg,Strasbourg,France,,,,,2019-08-19,19 August 2019,"International Archives of the Photogrammetry, Remote Sensing and Spatial Information Sciences - ISPRS Archives",16821750,21100248929,,Conference Proceeding,42,2/W15,,133-138,,,2,1,publisherfullgold,Gold,,,
329,2-s2.0-85061628858,10.1007/s10237-019-01124-6,,30762151,Homogenization of heterogeneous brain tissue under quasi-static loading: a visco-hyperelastic model of a 3D RVE,ar,Article,Kazempour M.,,University of Tehran,Tehran,Iran,,,,,2019-08-15,15 August 2019,Biomechanics and Modeling in Mechanobiology,16177959,16294,16177940,Journal,18,4,,969-981,,,11,0,,,,,
330,2-s2.0-85075373278,10.1093/rheumatology/kez040,,,Muscle fluorodeoxyglucose uptake assessed by positron emission tomography-computed tomography as a biomarker of inflammatory myopathies disease activity,ar,Article,Matuszak J.,,Les Hôpitaux Universitaires de Strasbourg,Strasbourg,France,,,,,2019-08-01,1 August 2019,Rheumatology (United Kingdom),14620324,19771,14620332,Journal,58,8,,1459-1464,,,9,0,,,,,
331,2-s2.0-85070839552,10.1364/BOE.10.003916,,,Real-time optical properties and oxygenation imaging using custom parallel processing in the spatial frequency domain,ar,Article,Aguénounon E.,,Université de Strasbourg,Strasbourg,France,,,,,2019-08-01,1 August 2019,Biomedical Optics Express,,21100205908,21567085,Journal,10,8,366437,3916-3928,,,5,1,repositoryvor,Green,,,
332,2-s2.0-85070710971,10.3390/app9153065,,,Occam's razor for big data? On detecting quality in large unstructured datasets,re,Review,Dresp-Langley B.,,Université de Strasbourg,Strasbourg,France,,,,,2019-08-01,1 August 2019,Applied Sciences (Switzerland),,21100829268,20763417,Journal,9,15,3065,,,,4,1,repositoryam,Green,,,
333,2-s2.0-85070405045,10.3390/ma12152419,,,Constitutive modeling of the tensile behavior of recycled polypropylene-based composites,ar,Article,Wang K.,,Central South University,Changsha,China,,,,,2019-08-01,1 August 2019,Materials,,76627,19961944,Journal,12,15,2419,,,,2,1,repositoryam,Green,,,
334,2-s2.0-85067387691,10.1109/TIP.2019.2901706,,30835221,nD Variational Restoration of Curvilinear Structures With Prior-Based Directional Regularization,ar,Article,Merveille O.,,Université de Strasbourg,Strasbourg,France,,,,,2019-08-01,August 2019,IEEE Transactions on Image Processing,10577149,25534,19410042,Journal,28,8,8653478,3848-3859,,,5,0,repositoryam,Green,,,
335,2-s2.0-85065725204,10.1007/s12149-019-01363-8,,31087250,Evaluation of the effects of chemotherapy on brain glucose metabolism in children with Hodgkin’s lymphoma,ar,Article,Tauty A.,,Hopital de Hautepierre,Strasbourg,France,,,,,2019-08-01,1 August 2019,Annals of Nuclear Medicine,09147187,16558,18646433,Journal,33,8,,564-569,,,1,0,,,,,
336,2-s2.0-85065670253,10.1016/j.anplas.2019.04.007,S0294126019300603,31113648,Surgical treatment of phlegmons of the digital flexor tendon sheaths at the early stage: Lavage by conventional open technique versus ultrasound-guided percutaneous technique,ar,Article,Boyer E.,,Les Hôpitaux Universitaires de Strasbourg,Strasbourg,France,,,,,2019-08-01,August 2019,Annales de Chirurgie Plastique Esthetique,02941260,20470,1768319X,Journal,64,4,,344-350,,,1,1,publisherfree2read,Bronze,,,
337,2-s2.0-85065258304,10.1007/s11548-019-01989-z,,31041697,Liver tissue segmentation in multiphase CT scans using cascaded convolutional neural networks,ar,Article,Ouhmich F.,,Hopital Civil,Strasbourg,France,,,,,2019-08-01,1 August 2019,International Journal of Computer Assisted Radiology and Surgery,18616410,4700152490,18616429,Journal,14,8,,1275-1284,,,14,0,repositoryam,Green,,,
338,2-s2.0-85064184657,10.1016/j.cortex.2019.02.017,S0010945219300693,30991308,Emotional disturbances in multiple sclerosis: A neuropsychological and fMRI study,ar,Article,Pfaff L.,,Université de Strasbourg,Strasbourg,France,,,,,2019-08-01,August 2019,Cortex,00109452,14945,19738102,Journal,117,,,205-216,,,6,1,repositoryvor,Green,,,
339,2-s2.0-85063751086,10.1016/j.geoderma.2019.03.042,S0016706118312230,,"Determining the influence of catchment area on intensity of gully erosion using high-resolution aerial imagery: A 40-year case study from the Loess Plateau, northern China",ar,Article,Yang S.,,Beijing Normal University;Guizhou Normal University,Beijing;Guiyang,China;China,,,,,2019-08-01,1 August 2019,Geoderma,00167061,39112,,Journal,347,,,90-102,,,15,1,repositoryvor,Green,,,
340,2-s2.0-85060343336,10.1016/j.websem.2019.01.002,S1570826819300022,,BNO—An ontology for understanding the transittability of complex biomolecular networks,ar,Article,Ayadi A.,,"Laboratoire des Sciences de l'Ingénieur, de l'Informatique et de l'Imagerie;Institut Supérieur de Gestion de Tunis",Illkirch-Graffenstaden;Le Bardo,France;Tunisia,,,,,2019-08-01,August 2019,Journal of Web Semantics,15708268,14879,,Journal,57,,100495,,,,1,0,repositoryvor,Green,,,
341,2-s2.0-85071656695,10.1088/1361-665X/ab2e87,,,Continuous nonlinear eigenvalue solver with applications to the design of electro/magnetorheological sandwich structures,ar,Article,Ammovilli V.,,Université de Strasbourg,Strasbourg,France,,,,,2019-07-23,23 July 2019,Smart Materials and Structures,09641726,29859,1361665X,Journal,28,8,085038,,,,3,0,repositoryam,Green,,,
342,2-s2.0-85070557515,10.1021/acsaem.9b00771,,,Cu(InGa)Se<inf>2</inf> Solar Cell Efficiency Enhancement Using a Yb-Doped SnO<inf>x</inf> Photon Converting Layer,ar,Article,Bouras K.,,Université de Strasbourg,Strasbourg,France,,,,,2019-07-22,22 July 2019,ACS Applied Energy Materials,,21100904205,25740962,Journal,2,7,,5094-5102,,,8,0,repositoryam,Green,,,
343,2-s2.0-85069581674,10.3390/ijgi8070301,,,HBIM modeling from the surface mesh and its extended capability of knowledge representation,ar,Article,Yang X.,,"Laboratoire des Sciences de l'Ingénieur, de l'Informatique et de l'Imagerie",Illkirch-Graffenstaden,France,,,,,2019-07-15,15 July 2019,ISPRS International Journal of Geo-Information,,21100427639,22209964,Journal,8,7,301,,,,35,1,publisherfullgold,Gold,,,
344,2-s2.0-85061585564,10.1007/s10994-019-05790-6,,,"Preface to special issue on Inductive Logic Programming, ILP 2017 and 2018",ed,Editorial,Lachiche N.,,Université de Strasbourg,Strasbourg,France,,,,,2019-07-15,15 July 2019,Machine Learning,08856125,24775,15730565,Journal,108,7,,1057-1059,,,0,1,repositoryam,Green,,,
345,2-s2.0-85046686827,10.1007/s11265-018-1372-9,,,"Embedded Fluorescence Lifetime Determination for High-Throughput, Low-Photon-Number Applications",ar,Article,Lieske T.,,Friedrich-Alexander-Universität Erlangen-Nürnberg,Erlangen,Germany,,,,,2019-07-15,15 July 2019,Journal of Signal Processing Systems,19398018,11400153333,19398115,Journal,91,7,,819-831,,,2,0,repositoryam,Green,,,
346,2-s2.0-85068778633,10.1002/pssa.201800761,,,High Resolution Surface Metrology Using Microsphere-Assisted Interference Microscopy,ar,Article,Montgomery P.C.,,Université de Strasbourg,Strasbourg,France,,,,,2019-07-10,10 July 2019,Physica Status Solidi (A) Applications and Materials Science,18626300,5800179580,18626319,Journal,216,13,1800761,,,,6,0,,,,,
347,2-s2.0-85061998442,10.1002/app.47664,,,Multiscale simulation of the interlaminar failure of graphene nanoplatelets reinforced fibers laminate composite materials,ar,Article,Basso M.,,Stellantis N.V.,Lijnden,Netherlands,,,,,2019-07-05,5 July 2019,Journal of Applied Polymer Science,00218995,13554,10974628,Journal,136,25,47664,,,,4,0,repositoryam,Green,,,
348,2-s2.0-85077711920,10.1109/IGARSS.2019.8899144,,,Estimation of Net Surface Shortwave Radiation from Simulated Chinese Gaofen-5 Satellite Data,cp,Conference Paper,Si M.,,University of Chinese Academy of Sciences;Chinese Academy of Sciences;CNRS Centre National de la Recherche Scientifique,Beijing;Beijing;Paris,China;China;France,,,,,2019-07-01,July 2019,International Geoscience and Remote Sensing Symposium (IGARSS),,82000,,Conference Proceeding,,,8899144,1978-1981,,,1,0,,,,,
349,2-s2.0-85077705441,10.1109/IGARSS.2019.8899324,,,Exploitation of Sentinel-1 Data for Flood Mapping and Monitoring within the Framework of the Copernicus Emergency Core and Downstream Services,cp,Conference Paper,Nadine T.,,Université de Strasbourg,Strasbourg,France,,,,,2019-07-01,July 2019,International Geoscience and Remote Sensing Symposium (IGARSS),,82000,,Conference Proceeding,,,8899324,5393-5396,,,2,0,,,,,
350,2-s2.0-85077684806,10.1109/IGARSS.2019.8899823,,,A Method for Angular Normalization of Land Surface Temperature Products Based on Component Temperatures and Fractional Vegetation Cover,cp,Conference Paper,Liu X.,,University of Chinese Academy of Sciences;Chinese Academy of Sciences;CNRS Centre National de la Recherche Scientifique,Beijing;Beijing;Paris,China;China;France,,,,,2019-07-01,July 2019,International Geoscience and Remote Sensing Symposium (IGARSS),,82000,,Conference Proceeding,,,8899823,1849-1852,,,3,0,,,,,
351,2-s2.0-85077684051,10.1109/IGARSS.2019.8898184,,,Reconstruction of Daily Evapotranspiration on Cloudy Sky Conditions from Field and Modis Data,cp,Conference Paper,Jiang Y.,,University of Chinese Academy of Sciences;CNRS Centre National de la Recherche Scientifique,Beijing;Paris,China;France,,,,,2019-07-01,July 2019,International Geoscience and Remote Sensing Symposium (IGARSS),,82000,,Conference Proceeding,,,8898184,1887-1890,,,0,0,,,,,
352,2-s2.0-85072395775,10.1117/1.JBO.24.7.071601,,31325251,Special Section Guest Editorial: Special Section on Spatial Frequency Domain Imaging,ed,Editorial,Gioux S.,,Université de Strasbourg,Strasbourg,France,,,,,2019-07-01,1 July 2019,Journal of Biomedical Optics,10833668,12156,15602281,Journal,24,7,071601,,,,0,1,repositoryam,Green,,,
353,2-s2.0-85071674973,10.1109/EMBC.2019.8856795,,31947343,Evaluation of cortical segmentation pipelines on clinical neonatal MRI data,cp,Conference Paper,Tor-DIez C.,,IMT Atlantique,Nantes,France,,,,,2019-07-01,July 2019,"Proceedings of the Annual International Conference of the IEEE Engineering in Medicine and Biology Society, EMBS",1557170X,34202,,Conference Proceeding,,,8856795,6553-6556,,,1,0,repositoryam,Green,,,
354,2-s2.0-85070530204,10.1109/JSTARS.2019.2906053,,,An Improved Computational Geometry Method for Obtaining Accurate Remotely Sensed Products via Convex Hulls with Dynamic Weights: A Case Study with Leaf Area Index,ar,Article,Chen H.,,China Aero Geophysical Survey and Remote Sensing Center for Land and Resources,Beijing,China,,,,,2019-07-01,July 2019,IEEE Journal of Selected Topics in Applied Earth Observations and Remote Sensing,19391404,17700155033,21511535,Journal,12,7,8688645,2308-2319,,,0,0,repositoryam,Green,,,
355,2-s2.0-85069432049,10.3390/su11143897,,,Constructal macroscale thermodynamic model of spherical urban greenhouse form with double thermal envelope within heat currents,ar,Article,Mavromatidis L.,,Université de Strasbourg,Strasbourg,France,,,,,2019-07-01,July 2019,Sustainability (Switzerland),,21100240100,20711050,Journal,11,14,3897,,,,8,1,repositoryam,Green,,,
356,2-s2.0-85068562883,10.1016/j.crhy.2019.07.001,S163107051930101X,,Synchrosqueezing transforms: From low- to high-frequency modulations and perspectives,sh,Short Survey,Meignen S.,,Laboratoire Jean Kuntzmann (LJK),Saint Martin d'Heres,France,,,,,2019-07-01,July - August 2019,Comptes Rendus Physique,16310705,26531,,Journal,20,5,,449-460,,,17,1,repositoryam,Green,,,
357,2-s2.0-85068513039,10.1109/JSTARS.2019.2896923,,,Evaluation of machine learning algorithms in spatial downscaling of modis land surface temperature,ar,Article,Li W.,,University of Chinese Academy of Sciences;Chinese Academy of Sciences,Beijing;Beijing,China;China,,,,,2019-07-01,July 2019,IEEE Journal of Selected Topics in Applied Earth Observations and Remote Sensing,19391404,17700155033,21511535,Journal,12,7,8656568,2299-2307,,,31,0,repositoryam,Green,,,
358,2-s2.0-85068492844,10.1117/1.JBO.24.7.071613,,31222987,"Spatial frequency domain imaging in 2019: Principles, applications, and perspectives",ar,Article,Gioux S.,,Université de Strasbourg,Strasbourg,France,,,,,2019-07-01,1 July 2019,Journal of Biomedical Optics,10833668,12156,15602281,Journal,24,7,071613,,,,52,1,repositoryam,Green,,,
359,2-s2.0-85066135890,10.1002/mats.201900011,,,A Multiscale Approach for the Nonlinear Mechanical Response of 3-Phases Fiber Reinforced Graphene Nanoplatelets Polymer Composite Materials,ar,Article,Azoti W.,,Université de Strasbourg;School of Engineering,Strasbourg;Schiltigheim,France;France,,,,,2019-07-01,July 2019,Macromolecular Theory and Simulations,10221344,25944,15213919,Journal,28,4,1900011,,,,1,0,repositoryam,Green,,,
360,2-s2.0-85065469856,10.1117/1.JBO.24.7.071612,,31037929,Single snapshot imaging of optical properties using a single-pixel camera: A simulation study,ar,Article,Aguénounon E.,,Université de Strasbourg,Strasbourg,France,,,,,2019-07-01,1 July 2019,Journal of Biomedical Optics,10833668,12156,15602281,Journal,24,7,071612,,,,11,1,repositoryam,Green,,,
361,2-s2.0-85064935734,10.1016/j.jfluidstructs.2019.04.012,S0889974619300350,,Experimental investigation of the dynamic behaviour of a fully passive flapping foil hydrokinetic turbine,ar,Article,Duarte L.,,Université de Strasbourg,Strasbourg,France,,,,,2019-07-01,July 2019,Journal of Fluids and Structures,08899746,12490,10958622,Journal,88,,,1-12,,,19,1,repositoryam,Green,,,
362,2-s2.0-85063933734,10.1117/1.JBO.24.7.071611,,30927346,Single snapshot of optical properties image quality improvement using anisotropic two-dimensional windows filtering,ar,Article,Aguénounon E.,,Université de Strasbourg,Strasbourg,France,,,,,2019-07-01,1 July 2019,Journal of Biomedical Optics,10833668,12156,15602281,Journal,24,7,071611,,,,12,1,repositoryam,Green,,,
363,2-s2.0-85063133149,10.1016/j.jvir.2018.11.034,S105104431831738X,30922795,Accuracy of a CT-Ultrasound Fusion Imaging Guidance System Used for Hepatic Percutaneous Procedures,ar,Article,Bing F.,,Université de Strasbourg;Hôpital d'Annecy,Strasbourg;Metz,France;France,,,,,2019-07-01,July 2019,Journal of Vascular and Interventional Radiology,10510443,17243,15357732,Journal,30,7,,1013-1020,,,3,0,repositoryvor,Green,,,
364,2-s2.0-85062892599,10.1117/1.JBO.24.7.071610,,30868804,"Real-time, wide-field, and quantitative oxygenation imaging using spatiotemporal modulation of light",ar,Article,Schmidt M.,,Université de Strasbourg,Strasbourg,France,,,,,2019-07-01,1 July 2019,Journal of Biomedical Optics,10833668,12156,15602281,Journal,24,7,071610,,,,9,1,repositoryam,Green,,,
365,2-s2.0-85059580694,10.1007/s00590-018-02361-8,,30610369,"Correction to: Distal radius fluoroscopic skyline view: extension–supination versus flexion–supination (European Journal of Orthopaedic Surgery &amp; Traumatology, (2019), 29, 3, (583-590), 10.1007/s00590-018-2335-3)",er,Erratum,El Amiri L.,,Les Hôpitaux Universitaires de Strasbourg,Strasbourg,France,,,,,2019-07-01,1 July 2019,European Journal of Orthopaedic Surgery and Traumatology,16338065,29696,14321068,Journal,29,5,,1161,,,0,1,publisherfree2read,Bronze,,,
366,2-s2.0-85058612139,10.1117/1.JBO.24.7.071606,,30550050,Machine learning approach for rapid and accurate estimation of optical properties using spatial frequency domain imaging,ar,Article,Panigrahi S.,,Université de Strasbourg,Strasbourg,France,,,,,2019-07-01,1 July 2019,Journal of Biomedical Optics,10833668,12156,15602281,Journal,24,7,071606,,,,24,1,repositoryam,Green,,,
367,2-s2.0-85054015822,10.1002/jbm.b.34242,,30267639,Bone cement modeling for percutaneous vertebroplasty,ar,Article,Lepoutre N.,,"Laboratoire des Sciences de l'Ingénieur, de l'Informatique et de l'Imagerie",Illkirch-Graffenstaden,France,,,,,2019-07-01,July 2019,Journal of Biomedical Materials Research - Part B Applied Biomaterials,15524973,16074,15524981,Journal,107,5,,1504-1515,,,3,0,repositoryam,Green,,,
368,2-s2.0-85053559048,10.1117/1.JBO.24.7.071602,,30218503,Review of structured light in diffuse optical imaging,re,Review,Angelo J.P.,,National Institute of Standards and Technology,Gaithersburg,United States,,,,,2019-07-01,1 July 2019,Journal of Biomedical Optics,10833668,12156,15602281,Journal,24,7,071602,,,,57,1,repositoryam,Green,,,
369,2-s2.0-85069735755,10.1051/e3sconf/20199210004,,,Study of the mechanical behaviour of reclaimed asphalt aggregates without binder addition,cp,Conference Paper,Gaillard L.,,Université de Strasbourg,Strasbourg,France,,,,,2019-06-25,25 June 2019,E3S Web of Conferences,25550403,21100795900,22671242,Conference Proceeding,92,,10004,,,,1,1,repositoryam,Green,,,
370,2-s2.0-85068756395,10.1002/chem.201900689,,30964574,Hydrogen Bonding as a Supramolecular Tool for Robust OFET Devices,ar,Article,Mula S.,,"Homi Bhabha National Institute;Institut de Chimie et Procédés pour l'Energie, l'Environnement et la Santé (ICPEES);Bhabha Atomic Research Centre",Mumbai;Strasbourg;Mumbai,India;France;India,,,,,2019-06-21,21 June 2019,Chemistry - A European Journal,09476539,23392,15213765,Journal,25,35,,8304-8312,,,10,0,,,,,
371,2-s2.0-85063289186,10.1016/j.scitotenv.2019.03.161,S004896971931143X,30921717,Predicting cyanobacteria bloom occurrence in lakes and reservoirs before blooms occur,ar,Article,Zhao C.S.,,Beijing Normal University;CNRS Centre National de la Recherche Scientifique,Beijing;Paris,China;France,,,,,2019-06-20,20 June 2019,Science of the Total Environment,00489697,25349,18791026,Journal,670,,,837-848,,,35,0,,,,,
372,2-s2.0-85067874776,10.3389/fsurg.2019.00031,,,Quantitative wide-field imaging techniques for fluorescence guided neurosurgery,re,Review,Valdes P.A.,,Brigham and Women's Hospital,Boston,United States,,,,,2019-06-06,6 June 2019,Frontiers in Surgery,,21100913558,2296875X,Journal,6,,31,,,,9,1,repositoryvor,Green,,,
373,2-s2.0-85067510470,10.5194/isprs-archives-XLII-2-W13-747-2019,,,Energy function algorithm for detection of openings in indoor point clouds,cp,Conference Paper,Assi R.,,INSA Strasbourg,Strasbourg,France,,,,,2019-06-04,4 June 2019,"International Archives of the Photogrammetry, Remote Sensing and Spatial Information Sciences - ISPRS Archives",16821750,21100248929,,Conference Proceeding,42,2/W13,,747-752,,,2,1,repositoryam,Green,,,
374,2-s2.0-85082016731,10.1109/PIERS-Spring46901.2019.9017315,,,Assessment of the Urban Three-dimensional Structural Influence on the Satellite Thermal Infrared Measurement,cp,Conference Paper,Zheng X.,,CNRS Centre National de la Recherche Scientifique,Paris,France,,,,,2019-06-01,June 2019,Progress in Electromagnetics Research Symposium,15599450,21000195302,19317360,Conference Proceeding,2019-June,,9017315,377-386,,,2,0,,,,,
