,eid,doi,pii,pubmed_id,title,subtype,subtypeDescription,creator,afid,affilname,affiliation_city,affiliation_country,author_count,author_names,author_ids,author_afids,coverDate,coverDisplayDate,publicationName,issn,source_id,eIssn,aggregationType,volume,issueIdentifier,article_number,pageRange,description,authkeywords,citedby_count,openaccess,freetoread,freetoreadLabel,fund_acr,fund_no,fund_sponsor
628,2-s2.0-85048980515,10.1016/j.compind.2018.06.001,S0166361518301210,,Experience capitalization to support decision making in inventive problem solving,ar,Article,Zhang P.,,CNRS Centre National de la Recherche Scientifique,Paris,France,,,,,2018-10-01,October 2018,Computers in Industry,01663615,19080,,Journal,101,,,25-40,,,10,0,,,,,
629,2-s2.0-85048791157,10.1007/s00432-018-2690-9,,29926160,The clinical usefulness of optical coherence tomography during cancer interventions,re,Review,van Manen L.,,Leids Universitair Medisch Centrum,Leiden,Netherlands,,,,,2018-10-01,1 October 2018,Journal of Cancer Research and Clinical Oncology,01715216,29930,14321335,Journal,144,10,,1967-1990,,,29,1,repositoryvor,Green,,,
630,2-s2.0-85048296616,10.1016/j.jlumin.2018.06.001,S0022231318303326,,"Photon conversion in Tb,Yb:Ca<inf>x</inf>Sr<inf>1-x</inf>Al<inf>2</inf>O<inf>4</inf> nanocrystals",ar,Article,Fix T.,,Université de Strasbourg,Strasbourg,France,,,,,2018-10-01,October 2018,Journal of Luminescence,00222313,12179,,Journal,202,,,377-380,,,1,0,,,,,
631,2-s2.0-85045738459,10.1007/s00231-018-2355-x,,,Thermal stress during RTP processes and its possible effect on the light induced degradation in Cz-Si wafers,ar,Article,Kouhlane Y.,,Université Badji Mokhtar - Annaba,Annaba,Algeria,,,,,2018-10-01,1 October 2018,Heat and Mass Transfer/Waerme- und Stoffuebertragung,09477411,13749,14321181,Journal,54,10,,3081-3087,,,1,0,,,,,
632,2-s2.0-85042121540,10.1007/s10489-018-1139-9,,,An effective method for classification with missing values,ar,Article,Zahin S.A.,,University of Dhaka,Dhaka,Bangladesh,,,,,2018-10-01,1 October 2018,Applied Intelligence,0924669X,23674,15737497,Journal,48,10,,3209-3230,,,14,0,,,,,
633,2-s2.0-85041592678,10.1002/mrm.27114,,29405357,Flow MRI simulation in complex 3D geometries: Application to the cerebral venous network,ar,Article,Fortin A.,,Université de Reims Champagne-Ardenne,Reims,France,,,,,2018-10-01,October 2018,Magnetic Resonance in Medicine,07403194,17267,15222594,Journal,80,4,,1655-1665,,,10,0,,,,,
634,2-s2.0-85055886150,10.1109/IRSEC.2017.8477292,,,Thermomechanical Investigation of PV Panels Behaviour under NOCT Conditions,cp,Conference Paper,Sahli M.,,Université de Strasbourg,Strasbourg,France,,,,,2018-09-28,28 September 2018,"Proceedings of 2017 International Renewable and Sustainable Energy Conference, IRSEC 2017",,21100884090,,Conference Proceeding,,,8477292,,,,0,0,,,,,
635,2-s2.0-85055863448,10.1109/IRSEC.2017.8477575,,,Time-of-day and Exposure Influences on PV Soiling,cp,Conference Paper,Figgis B.,,Qatar Environment and Energy Research Institute;Texas A&amp;M University at Qatar,Doha;Doha,Qatar;Qatar,,,,,2018-09-28,28 September 2018,"Proceedings of 2017 International Renewable and Sustainable Energy Conference, IRSEC 2017",,21100884090,,Conference Proceeding,,,8477575,,,,6,0,,,,,
636,2-s2.0-85054160638,10.1063/1.5049670,,30278667,Experimental and theoretical investigations on the optical and electrochemical properties of π-conjugated donor-acceptor-donor (DAD) compounds toward a universal model,ar,Article,Chochos C.L.,,Advent Technologies SA;University of Ioannina,Patra;Ioannina,Greece;Greece,,,,,2018-09-28,28 September 2018,Journal of Chemical Physics,00219606,28134,,Journal,149,12,124902,,,,6,0,repositoryam,Green,,,
637,2-s2.0-85047652223,10.1109/IRSEC.2017.8477249,,,"Modeling of the Influence of Dust Soiling on Photovoltaic Panels for Desert Applications the Example of the Solar Test Facility at Doha, Qatar",cp,Conference Paper,Barth N.,,Qatar Environment and Energy Research Institute,Doha,Qatar,,,,,2018-09-28,28 September 2018,"Proceedings of 2017 International Renewable and Sustainable Energy Conference, IRSEC 2017",,21100884090,,Conference Proceeding,,,8477249,,,,4,0,,,,,
638,2-s2.0-85090781758,10.1364/OSAC.1.000026,,,Faceted structure: a design for desired illumination and manufacture using 3D printing,ar,Article,Liu L.,,Université de Strasbourg;Qilu University of Technology;INSA Strasbourg,Strasbourg;Jinan;Strasbourg,France;China;France,,,,,2018-09-15,15 September 2018,OSA Continuum,,21100918256,25787519,Journal,1,1,,26-39,,,4,1,repositoryvor,Green,,,
639,2-s2.0-85053599872,10.3390/molecules23092324,,30213056,Theoretical calculations for highly selective direct heteroarylation polymerization: New nitrile-substituted dithienyl-diketopyrrolopyrrole-based polymers,ar,Article,Bura T.,,Université Laval,Quebec,Canada,,,,,2018-09-12,12 September 2018,Molecules,,26370,14203049,Journal,23,9,2324,,,,7,1,repositoryvor,Green,,,
640,2-s2.0-85053239165,10.1186/s13195-018-0417-4,,30208961,Sex ratio in dementia with Lewy bodies balanced between Alzheimer's disease and Parkinson's disease dementia: A cross-sectional study,ar,Article,Mouton A.,,Cognition Behavior Technology;Centre Hospitalier Universitaire de Nice,Nice;Nice,France;France,,,,,2018-09-12,12 September 2018,Alzheimer's Research and Therapy,,19700174935,17589193,Journal,10,1,92,,,,14,1,repositoryvor,Green,,,
641,2-s2.0-85053802397,10.1051/e3sconf/20184006010,,,1D/2D porosity model for urban flood modeling: Case of a dense street networks,cp,Conference Paper,Finaud-Guyot P.,,National School for Water and Environmental Engineering,Strasbourg,France,,,,,2018-09-05,5 September 2018,E3S Web of Conferences,,21100795900,22671242,Conference Proceeding,40,,06010,,,,0,1,repositoryvor,Green,,,
642,2-s2.0-85023197704,10.1080/13588265.2017.1345590,,,Comparison of two child seats subjected to a regulatory side impact regarding biomechanical criteria associated to the newborn,ar,Article,Le Tellier B.,,Université de Strasbourg,Strasbourg,France,,,,,2018-09-03,3 September 2018,International Journal of Crashworthiness,13588265,55762,17542111,Journal,23,5,,475-485,,,0,0,,,,,
643,2-s2.0-85073904592,10.1109/WHISPERS.2018.8747032,,,Spectroscopic Decomposition of Astronomical Multispectral Images Using B-Splines,cp,Conference Paper,Mortada H.,,Université de Strasbourg,Strasbourg,France,,,,,2018-09-01,September 2018,"Workshop on Hyperspectral Image and Signal Processing, Evolution in Remote Sensing",21586276,21000195601,,Conference Proceeding,2018-September,,8747032,,,,0,0,repositoryam,Green,,,
644,2-s2.0-85057519385,10.1684/met.2018.0729,,,Withdrawal dyskinesia induced by quetiapine : Case report,ar,Article,Javelot H.,,Établissement Public de Santé Alsace Nord,Strasbourg,France,,,,,2018-09-01,September-October 2018,Medecine Therapeutique,12646520,17761,19524099,Journal,24,5,,375-376,,,0,0,,,,,
645,2-s2.0-85056653636,10.1016/j.jsse.2018.01.006,S2468896717300976,,Extrapolation of population grids for risk analysis,ar,Article,Bellucci A.,,CNES Centre National d'Etudes Spatiales,Paris,France,,,,,2018-09-01,September - December 2018,Journal of Space Safety Engineering,,21100871641,24688967,Journal,5,3-4,,192-196,,,1,0,,,,,
646,2-s2.0-85055855804,10.24200/sci.2018.20449,,,"Analytical solution to governing equations of triple coupled physics of structural mechanics, diffusion, and heat transfer",ar,Article,Mahdavi E.,,University of Tehran,Tehran,Iran,,,,,2018-09-01,September-October 2018,Scientia Iranica,10263098,24196,23453605,Journal,25,5B,,2738-2757,,,2,1,publisherfree2read,Bronze,,,
647,2-s2.0-85054381602,10.1242/dmm.035634,,30115750,Correction of cognitive deficits in mouse models of Down syndrome by a pharmacological inhibitor of DYRK1A,ar,Article,Nguyen T.L.,,Université de Strasbourg;IGBMC Institut de Genetique et de Biologie Moleculaire et Cellulaire;CNRS Centre National de la Recherche Scientifique;Inserm;Perharidy Research Center,Strasbourg;Illkirch-Graffenstaden;Paris;Paris;Roscoff,France;France;France;France;France,,,,,2018-09-01,September 2018,DMM Disease Models and Mechanisms,17548403,19400157151,17548411,Journal,11,9,dmm035634,,,,30,1,repositoryam,Green,,,
648,2-s2.0-85053640245,10.3390/rs10091395,,,Evaluating a static multibeam sonar scanner for 3D surveys in confined underwater environments,ar,Article,Moisan E.,,"Laboratoire des Sciences de l'Ingénieur, de l'Informatique et de l'Imagerie;Centre d'Etudes et d'Expertise sur les Risques, l'Environnement, la Mobilité et l'Aménagement",Illkirch-Graffenstaden;Bron,France;France,,,,,2018-09-01,1 September 2018,Remote Sensing,,86430,20724292,Journal,10,9,1395,,,,5,1,repositoryam,Green,,,
649,2-s2.0-85053636456,10.1684/pnv.2018.0750,,30168437,Diagnostic value of cerebrospinal fluid alpha-synuclein in dementia with Lewy body,ar,Article,Bousiges O.,,Laboratoire de Neurosciences Cognitives et Adaptatives;Les Hôpitaux Universitaires de Strasbourg,Strasbourg;Strasbourg,France;France,,,,,2018-09-01,September 2018,Geriatrie et Psychologie Neuropsychiatrie du Vieillissement,21158789,19800188011,21157863,Journal,16,3,,305-310,,,1,0,,,,,
650,2-s2.0-85053261725,10.1371/journal.pone.0204145,,30212567,320-row CT transcatheter aortic valve replacement planning with a single reduced contrast media bolus injection,ar,Article,Mata-Mbemba D.,,Hospital for Sick Children University of Toronto,Toronto,Canada,,,,,2018-09-01,September 2018,PLoS ONE,,10600153309,19326203,Journal,13,9,e0204145,,,,9,1,repositoryam,Green,,,
651,2-s2.0-85052662075,10.1111/ctr.13357,,30044000,Interleukin 6 at reperfusion: A potent predictor of hepatic and extrahepatic early complications after liver transplantation,ar,Article,Faitot F.,,Université de Strasbourg;Les Hôpitaux Universitaires de Strasbourg,Strasbourg;Strasbourg,France;France,,,,,2018-09-01,September 2018,Clinical Transplantation,09020063,21038,13990012,Journal,32,9,e13357,,,,2,0,,,,,
652,2-s2.0-85049113750,10.1016/j.image.2018.06.012,S0923596518306416,,Distribution strategies for very large 3D image deconvolution algorithms,ar,Article,Meillier C.,,Université de Strasbourg;Laboratoire Traitement et Communication de l'Information,Strasbourg;Palaiseau,France;France,,,,,2018-09-01,September 2018,Signal Processing: Image Communication,09235965,13803,,Journal,67,,,149-160,,,3,0,repositoryam,Green,,,
653,2-s2.0-85046645939,10.1016/j.jcct.2018.04.013,S1934592518300893,29752224,Prevalence and impact of scan-related anxiety during coronary CT angiography: A prospective cohort study of 366 patients,ar,Article,Ohana M.,,"Laboratoire des Sciences de l'Ingénieur, de l'Informatique et de l'Imagerie;Hopital Civil;St. Paul's Hospital, Vancouver",Illkirch-Graffenstaden;Strasbourg;Vancouver,France;France;Canada,,,,,2018-09-01,September - October 2018,Journal of Cardiovascular Computed Tomography,19345925,7700153237,1876861X,Journal,12,5,,364-371,,,7,0,,,,,
654,2-s2.0-85045639903,10.1007/s11548-018-1754-2,,29671199,Automatic planning of needle placement for robot-assisted percutaneous procedures,ar,Article,Belbachir E.,,Université de Strasbourg;Université de Technologie de Belfort-Montbéliard,Strasbourg;Belfort,France;France,,,,,2018-09-01,1 September 2018,International Journal of Computer Assisted Radiology and Surgery,18616410,4700152490,18616429,Journal,13,9,,1429-1438,,,6,0,repositoryam,Green,,,
655,2-s2.0-85044331183,10.1016/j.pnpbp.2018.03.008,S0278584617309831,29559372,A double dissociation between two psychotic phenotypes: Periodic catatonia and cataphasia,ar,Article,Foucher J.R.,,Université de Strasbourg;University Hospital Strasbourg,Strasbourg;Illkirch-Graffenstaden,France;France,,,,,2018-08-30,30 August 2018,Progress in Neuro-Psychopharmacology and Biological Psychiatry,02785846,21767,18784216,Journal,86,,,363-369,,,16,0,,,,,
656,2-s2.0-85062906503,10.1109/ICIP.2018.8451792,,,Radial function based ab-initio tomographic reconstruction for cryo electron microscopy,cp,Conference Paper,Michels Y.,,Université de Strasbourg,Strasbourg,France,,,,,2018-08-29,29 August 2018,"Proceedings - International Conference on Image Processing, ICIP",15224880,144684,,Conference Proceeding,,,8451792,1178-1182,,,2,0,repositoryam,Green,,,
657,2-s2.0-85053816358,10.1109/SSP.2018.8450841,,,Triplet Markov Trees for Image Segmentation,cp,Conference Paper,Courbot J.B.,,"Services répartis, architecture modélisation validation administration de réseaux;Université de Strasbourg",Evry;Strasbourg,France;France,,,,,2018-08-29,29 August 2018,"2018 IEEE Statistical Signal Processing Workshop, SSP 2018",,21100878004,,Conference Proceeding,,,8450841,628-632,,,2,0,repositoryam,Green,,,
658,2-s2.0-85053910562,10.1109/IWCMC.2018.8450358,,,Performance Modeling of IEEE 802.15.4-TSCH with Shared Access and ON-OFF traffic,cp,Conference Paper,Yaala S.B.,,Université de Tunis El Manar,Tunis,Tunisia,,,,,2018-08-28,28 August 2018,"2018 14th International Wireless Communications and Mobile Computing Conference, IWCMC 2018",,21100878012,,Conference Proceeding,,,8450358,352-357,,,5,0,repositoryam,Green,,,
659,2-s2.0-85053835610,10.1109/VR.2018.8446217,,,Effects of Image Size and Structural Complexity on Time and Precision of Hand Movements in Head Mounted Virtual Reality,cp,Conference Paper,Batmaz A.U.,,Université de Strasbourg,Strasbourg,France,,,,,2018-08-24,24 August 2018,"25th IEEE Conference on Virtual Reality and 3D User Interfaces, VR 2018 - Proceedings",,21100878001,,Conference Proceeding,,,8446217,167-174,,,4,0,,,,,
660,2-s2.0-85048478828,10.1016/j.enbuild.2018.05.033,S0378778817339907,,Description and assessment of the building surface temperature modeling in LASER/F,ar,Article,Roupioz L.,,"Laboratoire des Sciences de l'Ingénieur, de l'Informatique et de l'Imagerie",Illkirch-Graffenstaden,France,,,,,2018-08-15,15 August 2018,Energy and Buildings,03787788,29359,,Journal,173,,,91-102,,,5,0,,,,,
661,2-s2.0-85052580000,10.23919/MIXDES.2018.8436730,,,Analog RF and mm-Wave design Tradeoff in UTBB FDSOI: Application to a 35 GHz LNA,cp,Conference Paper,Ghouli S.E.,,"STMicroelectronics SA, France",Paris,France,,,,,2018-08-14,14 August 2018,"Proceedings of 25th International Conference Mixed Design of Integrated Circuits and Systems, MIXDES 2018",,21100875615,,Conference Proceeding,,,8436730,57-62,,,1,0,repositoryam,Green,,,
662,2-s2.0-85052289526,10.1109/AINA.2018.00015,,,Experimental analysis of the efficiency of shared access in IEEE802.15.4-TSCH networks with sporadic traffic,cp,Conference Paper,Ben Yaala S.,,"University of Carthage, Ecole Supérieure des Communications de Tunis;Université de Tunis El Manar, Ecole Nationale d'Ingénieurs de Tunis",Ariana;Tunis,Tunisia;Tunisia,,,,,2018-08-09,9 August 2018,"Proceedings - International Conference on Advanced Information Networking and Applications, AINA",1550445X,4600151509,,Conference Proceeding,2018-May,,8432217,9-16,,,2,0,repositoryam,Green,,,
663,2-s2.0-85053058987,10.1016/j.spmi.2018.05.018,S0749603618304129,,Sodium doping mechanism on sol-gel processed kesterite Cu<inf>2</inf>ZnSnS<inf>4</inf> thin films,ar,Article,Laghfour Z.,,Faculté des Sciences Rabat;Optics and Photonics Center,Rabat;Agdal Rabat,Morocco;Morocco,,,,,2018-08-01,August 2018,Superlattices and Microstructures,07496036,21959,10963677,Journal,120,,,747-752,,,10,0,,,,,
664,2-s2.0-85051428289,10.1089/cmb.2018.0012,,29741924,Efficient modeling and simulation of space-dependent biological systems,cp,Conference Paper,Rosati E.,,Université de Strasbourg,Strasbourg,France,,,,,2018-08-01,August 2018,Journal of Computational Biology,10665277,29581,,Journal,25,8,,917-933,,,4,0,,,,,
665,2-s2.0-85049677048,10.1109/TED.2018.2849867,,,"Analysis, design, and optimization of the CHOPFET magnetic field transducer",ar,Article,Osberger L.,,Université de Strasbourg,Strasbourg,France,,,,,2018-08-01,August 2018,IEEE Transactions on Electron Devices,00189383,26052,,Journal,65,8,8408479,3454-3459,,,2,0,,,,,
666,2-s2.0-85049588172,10.1007/s12652-017-0498-0,,,A model-driven framework for data quality management in the Internet of Things,ar,Article,Karkouch A.,,Université de Strasbourg;Université Cadi Ayyad,Strasbourg;Marakech,France;Morocco,,,,,2018-08-01,1 August 2018,Journal of Ambient Intelligence and Humanized Computing,18685137,19400158593,18685145,Journal,9,4,,977-998,,,8,0,,,,,
667,2-s2.0-85048868346,10.1109/TED.2018.2843806,,,Low-Frequency Noise Correlation in Current-Mode Magnetic Transducers: The CHOPFET Case,ar,Article,Frick V.,,Université de Strasbourg,Strasbourg,France,,,,,2018-08-01,August 2018,IEEE Transactions on Electron Devices,00189383,26052,,Journal,65,8,8387905,3401-3407,,,2,0,,,,,
668,2-s2.0-85028712657,10.1016/j.jcss.2017.08.001,S0022000017301113,,Object digitization up to a translation,ar,Article,Mazo L.,,"Laboratoire des Sciences de l'Ingénieur, de l'Informatique et de l'Imagerie",Illkirch-Graffenstaden,France,,,,,2018-08-01,August 2018,Journal of Computer and System Sciences,00220000,12370,10902724,Journal,95,,,193-203,,,4,0,repositoryam,Green,,,
669,2-s2.0-85050264031,10.1039/c8nr03137a,,29993081,Tuning photovoltaic response in Bi<inf>2</inf>FeCrO<inf>6</inf> films by ferroelectric poling,ar,Article,Quattropani A.,,Université de Strasbourg,Strasbourg,France,,,,,2018-07-28,28 July 2018,Nanoscale,20403364,19700173215,20403372,Journal,10,28,,13761-13766,,,20,0,repositoryam,Green,,,
670,2-s2.0-85057754528,10.1051/epjconf/201818604002,,,Shared nomenclature and identifiers for telescopes and instruments,cp,Conference Paper,Perret E.,,Université de Strasbourg,Strasbourg,France,,,,,2018-07-27,27 July 2018,EPJ Web of Conferences,21016275,21100227410,2100014X,Conference Proceeding,186,,04002,,,,1,1,repositoryam,Green,,,
671,2-s2.0-85052193874,10.1080/14656566.2018.1496237,,30009650,Pharmacotherapeutic strategies for treating epilepsy in patients with Alzheimer’s disease,re,Review,Cretin B.,,Université de Strasbourg;Les Hôpitaux Universitaires de Strasbourg;Centre Mémoire de Ressources et de Recherche d'Alsace (Strasbourg-Colmar),Strasbourg;Strasbourg;Strasbourg,France;France;France,,,,,2018-07-24,24 July 2018,Expert Opinion on Pharmacotherapy,14656566,21352,17447666,Journal,19,11,,1201-1209,,,14,0,,,,,
672,2-s2.0-85050965525,10.1109/CCGRID.2018.00064,,,An overview of cloud simulation enhancement using the monte-carlo method,cp,Conference Paper,Bertot L.,,CNRS Centre National de la Recherche Scientifique,Paris,France,,,,,2018-07-13,13 July 2018,"Proceedings - 18th IEEE/ACM International Symposium on Cluster, Cloud and Grid Computing, CCGRID 2018",,21100871263,,Conference Proceeding,,,,386-387,,,1,0,repositoryam,Green,,,
673,2-s2.0-85048255278,10.1080/02786826.2018.1462473,,,Dominant environmental parameters for dust deposition and resuspension in desert climates,ar,Article,Figgis B.,,Qatar Environment and Energy Research Institute;Université de Strasbourg,Doha;Strasbourg,Qatar;France,,,,,2018-07-03,3 July 2018,Aerosol Science and Technology,02786826,22670,15217388,Journal,52,7,,788-798,,,31,1,publisherfree2read,Bronze,,,
674,2-s2.0-85065673801,10.1109/IRSEC.2018.8703001,,,Air-conditioner on-off optimization control XNder variant ambient condition,cp,Conference Paper,Al-Azba M.,,Qatar Environment and Energy Research Institute;CNRS Centre National de la Recherche Scientifique,Doha;Paris,Qatar;France,,,,,2018-07-02,2 July 2018,"Proceedings of 2018 6th International Renewable and Sustainable Energy Conference, IRSEC 2018",,21100925143,,Conference Proceeding,,,8703001,,,,4,0,,,,,
675,2-s2.0-85050399258,10.1016/j.jocs.2018.06.004,S1877750317313856,,Efficient data layouts for a three-dimensional electrostatic Particle-in-Cell code,ar,Article,Barsamian Y.,,Université de Strasbourg;INRIA Nancy,Strasbourg;Villers-les-Nancy,France;France,,,,,2018-07-01,July 2018,Journal of Computational Science,18777503,19700174607,,Journal,27,,,345-356,,,2,0,repositoryam,Green,,,
676,2-s2.0-85049221938,10.1364/AO.57.005281,,30117815,Chromatic analysis of harmonic Fresnel lenses by FDTD and angular spectrum methods,ar,Article,Yang J.,,Université de Strasbourg;Changchun Institute of Optics Fine Mechanics and Physics Chinese Academy of Sciences,Strasbourg;Changchun,France;China,,,,,2018-07-01,1 July 2018,Applied Optics,1559128X,29593,21553165,Journal,57,19,,5281-5287,,,5,0,repositoryvor,Green,,,
677,2-s2.0-85047207484,10.1016/j.hansur.2018.03.002,S2468122918300616,,Ultrasound for the diagnosis of pyogenic flexor tenosynovitis,ar,Article,Prunières G.,,Les Hôpitaux Universitaires de Strasbourg,Strasbourg,France,,,,,2018-07-01,July 2018,Hand Surgery and Rehabilitation,24681229,21100456711,24681210,Journal,37,4,,243-246,,,6,0,,,,,
678,2-s2.0-85046008849,10.1007/s11548-018-1724-8,,29557997,Automatic preoperative planning of DBS electrode placement using anatomo-clinical atlases and volume of tissue activated,ar,Article,Dergachyova O.,,Laboratoire Traitement du Signal et de l'Image;Université de Strasbourg,Rennes;Strasbourg,France;France,,,,,2018-07-01,1 July 2018,International Journal of Computer Assisted Radiology and Surgery,18616410,4700152490,18616429,Journal,13,7,,1117-1128,,,8,0,repositoryam,Green,,,
679,2-s2.0-85045764885,10.1016/j.cose.2018.03.001,S0167404818302141,,A systematic survey on multi-step attack detection,re,Review,Navarro J.,,Université de Strasbourg,Strasbourg,France,,,,,2018-07-01,July 2018,Computers and Security,01674048,28898,,Journal,76,,,214-249,,,51,0,,,,,
680,2-s2.0-85044793451,10.1109/TNANO.2018.2822599,,,Design of Broadband CNFET LNA Based on Extracted I-V Closed-Form Equation,ar,Article,Saberkari A.,,University of Guilan,Rasht,Iran,,,,,2018-07-01,July 2018,IEEE Transactions on Nanotechnology,1536125X,15464,,Journal,17,4,,731-742,,,3,0,repositoryvor,Green,,,
681,2-s2.0-85044748403,10.1109/COMST.2018.2820810,,,A tutorial on performance evaluation and validation methodology for low-power and lossy networks,ar,Article,Kritsis K.,,"Institute for Language and Speech Processing, Athens",Athens,Greece,,,,,2018-07-01,Third Quarter 2018,IEEE Communications Surveys and Tutorials,,17900156715,1553877X,Journal,20,3,8327804,1799-1825,,,19,0,repositoryam,Green,,,
682,2-s2.0-85043766138,10.1016/j.dyepig.2018.03.017,S0143720817325123,,"Phthalocyanine-based dumbbell-shaped molecule: Synthesis, structure and charge transport studies",re,Review,Marzouk S.,,Université de Strasbourg;Université de Tunis El Manar,Strasbourg;Tunis,France;Tunisia,,,,,2018-07-01,July 2018,Dyes and Pigments,01437208,23502,18733743,Journal,154,,,282-289,,,2,0,repositoryam,Green,,,
683,2-s2.0-85043538148,10.1016/j.jalz.2018.01.004,S1552526018300219,29458036,Plasma amyloid levels within the Alzheimer's process and correlations with central biomarkers,ar,Article,Hanon O.,,Université Paris Cité;Hôpital Broca,Paris;Paris,France;France,,,,,2018-07-01,July 2018,Alzheimer's and Dementia,15525260,3600148102,15525279,Journal,14,7,,858-868,,,64,1,publisherhybridgold,Hybrid Gold,,,
684,2-s2.0-85041895304,10.1080/00268976.2018.1433882,,,Development of an electron paramagnetic resonance methodology for studying the photo-generation of reactive species in semiconductor nano-particle assembled films,ar,Article,Twardoch M.,,Université de Strasbourg,Strasbourg,France,,,,,2018-06-18,18 June 2018,Molecular Physics,00268976,26990,13623028,Journal,116,12,,1558-1564,,,4,0,repositoryam,Green,,,
685,2-s2.0-85026464324,10.1016/j.solmat.2017.07.039,S0927024817304257,,Multi-physics modeling and simulation of heat and electrical yield generation in photovoltaics,ar,Article,Sahli M.,,Université de Strasbourg,Strasbourg,France,,,,,2018-06-15,15 June 2018,Solar Energy Materials and Solar Cells,09270248,13332,,Journal,180,,,358-372,,,13,0,,,,,
686,2-s2.0-85046826798,10.1021/acs.jmedchem.8b00337,,29733645,Aromatic-Based Design of Highly Active and Noncalcemic Vitamin D Receptor Agonists,ar,Article,Gogoi P.,,Universidad de Santiago de Compostela;CSIR-NEIST,Santiago de Compostela;Jorbat,Spain;India,,,,,2018-06-14,14 June 2018,Journal of Medicinal Chemistry,00222623,23041,15204804,Journal,61,11,,4928-4937,,,10,0,repositoryam,Green,,,
687,2-s2.0-85050004181,10.1109/GOL.2018.8378084,,,A risk assessment model for supply chain design. Implementation at Kuehne + Nagel Luxembourg,cp,Conference Paper,Winter A.,,Université de Strasbourg,Strasbourg,France,,,,,2018-06-08,8 June 2018,Proceedings - GOL 2018: 4th IEEE International Conference on Logistics Operations Management,,21100868279,,Conference Proceeding,,,,1-8,,,0,0,,,,,
688,2-s2.0-85056935196,10.1371/journal.pone.0196297,,29906284,Multi-parametric quantitative MRI reveals three different white matter subtypes,ar,Article,Foucher J.R.,,Université de Strasbourg;Les Hôpitaux Universitaires de Strasbourg,Strasbourg;Strasbourg,France;France,,,,,2018-06-01,June 2018,PLoS ONE,,10600153309,19326203,Journal,13,6,e0196297,,,,3,1,repositoryam,Green,,,
689,2-s2.0-85050430410,10.1148/radiol.2018160233,,29782242,Case 254: Posttraumatic migrating fat embolus causing fat emboli syndrome,ar,Article,Molière S.,,Les Hôpitaux Universitaires de Strasbourg,Strasbourg,France,,,,,2018-06-01,June 2018,Radiology,00338419,17864,15271315,Journal,287,3,,1073-1080,,,4,1,publisherfree2read,Bronze,,,
690,2-s2.0-85049119031,10.1684/pnv.2018.0731,,29877185,Diagnostic value of Alzheimer’s biomarkers in cerebrospinal fluid in dementia with Lewy body,ar,Article,Bousiges O.,,Les Hôpitaux Universitaires de Strasbourg,Strasbourg,France,,,,,2018-06-01,June 2018,Geriatrie et Psychologie Neuropsychiatrie du Vieillissement,21158789,19800188011,21157863,Journal,16,2,,174-180,,,1,0,,,,,
691,2-s2.0-85047554368,10.1016/j.jeurea.2018.05.002,S221142381830004X,,Reprint of: How to manage vertigo in adult?,sh,Short Survey,Vuong Chaney H.,,Hopital de Hautepierre,Strasbourg,France,,,,,2018-06-01,June 2018,Journal Europeen des Urgences et de Reanimation,22114238,21100228103,,Journal,30,1-2,,11-19,,,0,0,,,,,
