,eid,doi,pii,pubmed_id,title,subtype,subtypeDescription,creator,afid,affilname,affiliation_city,affiliation_country,author_count,author_names,author_ids,author_afids,coverDate,coverDisplayDate,publicationName,issn,source_id,eIssn,aggregationType,volume,issueIdentifier,article_number,pageRange,description,authkeywords,citedby_count,openaccess,freetoread,freetoreadLabel,fund_acr,fund_no,fund_sponsor
1007,2-s2.0-85009179801,10.1002/hyp.11033,,,Hydraulic visibility: Using satellite altimetry to parameterize a hydraulic model of an ungauged reach of a braided river,ar,Article,Garambois P.A.,,INSA Strasbourg,Strasbourg,France,,,,,2017-02-15,15 February 2017,Hydrological Processes,08856087,29467,10991085,Journal,31,4,,756-767,,,33,0,repositoryam,Green,,,
1008,2-s2.0-85016001769,10.1109/SSCI.2016.7849902,,,Morwilog: An ACO-based system for outlining multi-step attacks,cp,Conference Paper,Navarro-Lara J.,,Université de Strasbourg,Strasbourg,France,,,,,2017-02-09,9 February 2017,"2016 IEEE Symposium Series on Computational Intelligence, SSCI 2016",,21100803187,,Conference Proceeding,,,7849902,,,,7,0,,,,,
1009,2-s2.0-85015996382,10.1109/SSCI.2016.7850132,,,The Graph Matching Optimization methodology for thin object recognition in pick and place tasks,cp,Conference Paper,Willaume P.,,Université de Strasbourg;Hager Group;ECAM Strasbourg-Europe,Strasbourg;;Schiltigheim,France;France;France,,,,,2017-02-09,9 February 2017,"2016 IEEE Symposium Series on Computational Intelligence, SSCI 2016",,21100803187,,Conference Proceeding,,,7850132,,,,4,0,,,,,
1010,2-s2.0-85013765900,10.1109/CloudTech.2016.7847707,,,A model-driven architecture-based data quality management framework for the internet of Things,cp,Conference Paper,Karkouch A.,,Université Cadi Ayyad,Marakech,Morocco,,,,,2017-02-08,8 February 2017,"Proceedings of 2016 International Conference on Cloud Computing Technologies and Applications, CloudTech 2016",,21100797715,,Conference Proceeding,,,7847707,252-259,,,10,0,,,,,
1011,2-s2.0-85014097200,10.1088/1742-6596/780/1/012003,,,Optical nanoscopy characterization of nanofilms,cp,Conference Paper,Montgomery P.C.,,Université de Strasbourg,Strasbourg,France,,,,,2017-02-06,6 February 2017,Journal of Physics: Conference Series,17426588,130053,17426596,Conference Proceeding,780,1,012003,,,,1,1,publisherfree2read,Bronze,,,
1012,2-s2.0-85015701783,10.1051/lhb/2017005,,,Implicit immersed boundary method for fluid-structure interaction,ar,Article,Cai S.G.,,Sorbonne Universite,Paris,France,,,,,2017-02-01,1 February 2017,Houille Blanche,00186368,16967,,Journal,,1,,33-36,,,1,0,,,,,
1013,2-s2.0-85014107394,10.1051/medsci/20173302011,,28240207,Application of microelectronics CAD tools to synthetic biology,ar,Article,Madec M.,,"Laboratoire des Sciences de l'Ingénieur, de l'Informatique et de l'Imagerie",Illkirch-Graffenstaden,France,,,,,2017-02-01,1 February 2017,Medecine/Sciences,07670974,17758,19585381,Journal,33,2,,159-168,,,1,1,repositoryam,Green,,,
1014,2-s2.0-85013455923,10.3174/ajnr.A5013,,27932509,Use of phase-contrast MRA to assess intracranial venous sinus resistance to drainage in healthy individuals,ar,Article,Fall S.,,Université de Strasbourg;Université de Picardie Jules Verne,Strasbourg;Amiens,France;France,,,,,2017-02-01,February 2017,American Journal of Neuroradiology,01956108,20028,1936959X,Journal,38,2,,281-287,,,5,1,repositoryvor,Green,,,
1015,2-s2.0-85011409956,10.1016/j.purol.2016.12.008,S1166708716307801,28169121,Percutaneous nephrolithotomy for kidney stones in elderly patients: Meta-analysis of results and complications,sh,Short Survey,Haider R.,,Université Côte d'Azur,Nice,France,,,,,2017-02-01,1 February 2017,Progres en Urologie,11667087,20472,,Journal,27,2,,58-67,,,6,0,,,,,
1016,2-s2.0-85010727448,10.1016/j.hansur.2016.09.015,S2468122916303747,28137442,Results of conservative treatment of volar plate sprains of the proximal interphalangeal joint with and without avulsion fracture,ar,Article,Adi M.,,Les Hôpitaux Universitaires de Strasbourg,Strasbourg,France,,,,,2017-02-01,1 February 2017,Hand Surgery and Rehabilitation,24681229,21100456711,24681210,Journal,36,1,,44-47,,,2,0,,,,,
1017,2-s2.0-85009829454,10.1016/j.rcot.2016.12.002,S1877051716307201,,Minimally invasive hardware removal after minimally invasive distal radius plate osteosynthesis (MIPO): Feasibility study in a 388 case series,ar,Article,Luigi Medda P.,,Les Hôpitaux Universitaires de Strasbourg,Strasbourg,France,,,,,2017-02-01,1 February 2017,Revue de Chirurgie Orthopedique et Traumatologique,18770517,16400154783,,Journal,103,1,,73-75,,,0,0,,,,,
1018,2-s2.0-85009211698,10.1016/j.otsr.2016.10.014,S1877056816302262,27923762,Treatment of acute perilunate dislocations: ORIF versus proximal row carpectomy,ar,Article,Muller T.,,Les Hôpitaux Universitaires de Strasbourg,Strasbourg,France,,,,,2017-02-01,1 February 2017,Orthopaedics and Traumatology: Surgery and Research,,17500155019,18770568,Journal,103,1,,95-99,,,10,1,publisherfree2read,Bronze,,,
1019,2-s2.0-85009209263,10.1016/j.rcot.2016.12.003,S1877051716307213,,Treatment of acute perilunate dislocations: ORIF versus proximal row carpectomy,ar,Article,Muller T.,,Les Hôpitaux Universitaires de Strasbourg,Strasbourg,France,,,,,2017-02-01,1 February 2017,Revue de Chirurgie Orthopedique et Traumatologique,18770517,16400154783,,Journal,103,1,,77-81,,,0,0,,,,,
1020,2-s2.0-85008452763,10.1016/j.otsr.2016.10.015,S1877056816302274,27923763,Minimally invasive hardware removal after minimally invasive distal radius plate osteosynthesis (MIPO): Feasibility study in a 388 case series,ar,Article,Luigi Medda P.,,Les Hôpitaux Universitaires de Strasbourg,Strasbourg,France,,,,,2017-02-01,1 February 2017,Orthopaedics and Traumatology: Surgery and Research,,17500155019,18770568,Journal,103,1,,85-87,,,8,1,publisherfree2read,Bronze,,,
1021,2-s2.0-85008235138,10.1016/j.pneumo.2016.09.007,S0761841716301183,27956084,What future for chest x-ray against ultra-low-dose computed tomography?,re,Review,Ohana M.,,Université de Strasbourg;Hopital Civil,Strasbourg;Strasbourg,France;France,,,,,2017-02-01,1 February 2017,Revue de Pneumologie Clinique,07618417,19070,17762561,Journal,73,1,,3-12,,,6,0,,,,,
1022,2-s2.0-85008220998,10.1016/j.rcot.2016.11.001,S1877051716306827,,The role of e-learning in the teaching of microsurgery,ar,Article,Vernet P.,,Les Hôpitaux Universitaires de Strasbourg,Strasbourg,France,,,,,2017-02-01,1 February 2017,Revue de Chirurgie Orthopedique et Traumatologique,18770517,16400154783,,Journal,103,1,,97-101,,,0,0,,,,,
1023,2-s2.0-85003906135,10.1007/s00590-016-1888-2,,27942915,Treatment of hand enchondroma with injectable calcium phosphate cement: a series of eight cases,ar,Article,Rajeh M.A.,,Les Hôpitaux Universitaires de Strasbourg,Strasbourg,France,,,,,2017-02-01,1 February 2017,European Journal of Orthopaedic Surgery and Traumatology,16338065,29696,14321068,Journal,27,2,,251-254,,,8,0,,,,,
1024,2-s2.0-85002994009,10.1016/j.automatica.2016.10.023,S0005109816304277,,Recent developments on the stability of systems with aperiodic sampling: An overview,ar,Article,Hetel L.,,Ecole Centrale de Lille,Villeneuve-d'Ascq,France,,,,,2017-02-01,1 February 2017,Automatica,00051098,24909,,Journal,76,,,309-335,,,220,0,repositoryam,Green,,,
1025,2-s2.0-84994626514,10.1136/jnnp-2016-314005,,27951522,Brain lesion distribution criteria distinguish MS from AQP4-antibody NMOSD and MOG-antibody disease,ar,Article,Juryńczyk M.,,University of Oxford Medical Sciences Division,Oxford,United Kingdom,,,,,2017-02-01,1 February 2017,"Journal of Neurology, Neurosurgery and Psychiatry",00223050,16757,1468330X,Journal,88,2,,132-136,,,96,0,repositoryam,Green,,,
1026,2-s2.0-84992029004,10.1007/s11548-016-1493-1,,27771843,Scale-adaptive supervoxel-based random forests for liver tumor segmentation in dynamic contrast-enhanced CT scans,ar,Article,Conze P.H.,,Université de Strasbourg,Strasbourg,France,,,,,2017-02-01,1 February 2017,International Journal of Computer Assisted Radiology and Surgery,18616410,4700152490,18616429,Journal,12,2,,223-233,,,40,0,,,,,
1027,2-s2.0-84978091946,10.1007/s10851-016-0673-5,,,Moment-Based Angular Difference Estimation Between Two Tomographic Projections in 2D and 3D,ar,Article,Phan M.S.,,Université de Strasbourg,Strasbourg,France,,,,,2017-02-01,1 February 2017,Journal of Mathematical Imaging and Vision,09249907,28501,15737683,Journal,57,2,,164-182,,,0,1,repositoryvor,Green,,,
1028,2-s2.0-85012054104,10.3389/fpsyg.2017.00067,,,Editorial: Perceptual grouping-the state of the art,ed,Editorial,Dresp-Langley B.,,Université de Strasbourg,Strasbourg,France,,,,,2017-01-30,30 January 2017,Frontiers in Psychology,,21100216571,16641078,Journal,8,JAN,67,,,,4,1,repositoryam,Green,,,
1029,2-s2.0-85027298565,10.1021/acs.jpcb.6b11060,,28045263,Single- and double-strand breaks of dry DNA exposed to protons at bragg-peak energies,ar,Article,Souici M.,,Université Bourgogne Franche-Comté;Université de Jijel,Besancon;Jijel,France;Algeria,,,,,2017-01-26,26 January 2017,Journal of Physical Chemistry B,15206106,26970,15205207,Journal,121,3,,497-507,,,14,0,,,,,
1030,2-s2.0-85006434731,10.1016/j.jclepro.2016.11.008,S095965261631842X,,Reviewing the use of the theory of inventive problem solving (TRIZ) in green supply chain problems,re,Review,Ben Moussa F.Z.,,Ecole Nationale des Sciences Appliquées de Marrakech,Marakech,Morocco,,,,,2017-01-20,20 January 2017,Journal of Cleaner Production,09596526,19167,,Journal,142,,,2677-2692,,,26,0,repositoryam,Green,,,
1031,2-s2.0-85007415390,10.1016/j.patrec.2016.11.023,S0167865516303464,,A tomographical reconstruction method from unknown direction projections for 2D gray-level images,ar,Article,Ben Cheikh B.,,Sorbonne Universite,Paris,France,,,,,2017-01-15,15 January 2017,Pattern Recognition Letters,01678655,24825,,Journal,86,,,49-55,,,4,0,,,,,
1032,2-s2.0-85013642130,10.1109/ICTAI.2016.57,,,Reframing in clustering,cp,Conference Paper,Hoque M.N.,,University of Dhaka,Dhaka,Bangladesh,,,,,2017-01-11,11 January 2017,"Proceedings - 2016 IEEE 28th International Conference on Tools with Artificial Intelligence, ICTAI 2016",,21100797222,,Conference Proceeding,,,7814620,350-354,,,5,0,,,,,
1033,2-s2.0-85013074749,10.1109/ICA.2016.7811476,,,Study of robustness of 2D fringe processing in coherence scanning interferometry for the characterization of a transparent polymer film,cp,Conference Paper,Gianto G.,,Université de Strasbourg,Strasbourg,France,,,,,2017-01-09,9 January 2017,"Proceedings of the 2016 International Conference on Instrumentation, Control, and Automation, ICA 2016",,21100795281,,Conference Proceeding,,,7811476,60-65,,,1,0,repositoryvor,Green,,,
1034,2-s2.0-85015104347,10.1109/ECC.2016.7810606,,,"Robotically assisted injection of orthopedic cement: System design, control and modeling",cp,Conference Paper,Lepoutre N.,,Université de Strasbourg,Strasbourg,France,,,,,2017-01-06,6 January 2017,"2016 European Control Conference, ECC 2016",,21100800603,,Conference Proceeding,,,7810606,2127-2132,,,3,0,,,,,
1035,2-s2.0-85015060118,10.1109/ECC.2016.7810650,,,Phase space identification method for modeling the viscosity of bone cement,cp,Conference Paper,Lepoutre N.,,Université de Strasbourg,Strasbourg,France,,,,,2017-01-06,6 January 2017,"2016 European Control Conference, ECC 2016",,21100800603,,Conference Proceeding,,,7810650,2404-2409,,,1,0,,,,,
1036,2-s2.0-84962092193,10.1080/14680629.2016.1159973,,,Modelling of the fatigue damage of a geogrid-reinforced asphalt concrete,ar,Article,Arsenie I.M.,,CNRS Centre National de la Recherche Scientifique;EIFFAGE Infrastructures,Paris;Vaulx-en-Velin,France;France,,,,,2017-01-02,2 January 2017,Road Materials and Pavement Design,14680629,5100154503,21647402,Journal,18,1,,250-262,,,15,0,repositoryvor,Green,,,
1037,2-s2.0-84962076506,10.1080/17512549.2016.1161545,,,Design and development of a mini scale hot box for thermal efficiency evaluation of an insulation building block prototype used in Bahrain,le,Letter,Modi P.,,Bahrain Polytechnic,Isa,Bahrain,,,,,2017-01-02,2 January 2017,Advances in Building Energy Research,17512549,19400158302,17562201,Journal,11,1,,130-151,,,8,0,repositoryam,Green,,,
1038,2-s2.0-84961390448,10.1080/14680629.2016.1163280,,,Laboratory characterisation of the fatigue behaviour of a glass fibre grid-reinforced asphalt concrete using 4PB tests,ar,Article,Arsenie I.M.,,CNRS Centre National de la Recherche Scientifique,Paris,France,,,,,2017-01-02,2 January 2017,Road Materials and Pavement Design,14680629,5100154503,21647402,Journal,18,1,,168-180,,,20,0,,,,,
1039,2-s2.0-85060493810,10.1007/978-3-319-45901-1_2,,,POEM-COPA collaborative open peer assessment,ch,Book Chapter,Collet P.,,Université de Strasbourg;e-laboratory on Education,Strasbourg;Paris,France;France,,,,,2017-01-01,2017,Springer Proceedings in Complexity,22138684,21100873452,22138692,Conference Proceeding,,,,15-27,,,0,0,,,,,
1040,2-s2.0-85060459694,10.1007/978-3-319-45901-1_5,,,Is the lean organisation a complex system?,ch,Book Chapter,Masai P.,,Université de Strasbourg;TOYOTA MOTOR EUROPE NV,Strasbourg;Brussels,France;Belgium,,,,,2017-01-01,2017,Springer Proceedings in Complexity,22138684,21100873452,22138692,Conference Proceeding,,,,55-69,,,0,0,repositoryam,Green,,,
1041,2-s2.0-85060446921,10.1007/978-3-319-45901-1_6,,,An artificial immune ecosystem model for hybrid cloud supervision,ch,Book Chapter,Guigou F.,,Université de Strasbourg;IPLine,Strasbourg;,France;France,,,,,2017-01-01,2017,Springer Proceedings in Complexity,22138684,21100873452,22138692,Conference Proceeding,,,,71-84,,,1,0,repositoryam,Green,,,
1042,2-s2.0-85058522683,,,,Unsaturated resilient strain behaviours of a granular material,cp,Conference Paper,Jing P.,,CNRS Centre National de la Recherche Scientifique,Paris,France,,,,,2017-01-01,2017,"Bearing Capacity of Roads, Railways and Airfields - Proceedings of the 10th International Conference on the Bearing Capacity of Roads, Railways and Airfields, BCRRA 2017",,21100931088,,Conference Proceeding,,,,93-100,,,0,0,,,,,
1043,2-s2.0-85057585511,,,,Thoracic response of post-mortem swine under blast loadings,cp,Conference Paper,Boutillier J.,,Université de Strasbourg,Strasbourg,France,,,,,2017-01-01,2017,"Conference proceedings International Research Council on the Biomechanics of Injury, IRCOBI",22353151,21100888800,,Conference Proceeding,2017-September,,,717-727,,,0,0,,,,,
1044,2-s2.0-85053888238,,,,Sensitivity analysis of indoor hydroxyl radicals with the INCA-Indoor model,cp,Conference Paper,Guo F.,,Université de Strasbourg,Strasbourg,France,,,,,2017-01-01,2017,Healthy Buildings Europe 2017,,21100878015,,Conference Proceeding,,,,,,,0,0,,,,,
1045,2-s2.0-85051795043,10.1201/9781420007299,,,Bayesian estimation of blur and noise in remote sensing imaging,ch,Book Chapter,Jalobeanu A.,,"Laboratoire des Sciences de l'Ingénieur, de l'Informatique et de l'Imagerie",Illkirch-Graffenstaden,France,,,,,2017-01-01,1 January 2017,Blind Image Deconvolution: Theory and Applications,,21100873614,,Book,,,,239-276,,,7,0,,,,,
1046,2-s2.0-85048599585,,,,A BIM-compatible framework to assess the thermal and optical performance of envelope systems,cp,Conference Paper,Boudhaim M.,,"Laboratoire des Sciences de l'Ingénieur, de l'Informatique et de l'Imagerie",Illkirch-Graffenstaden,France,,,,,2017-01-01,2017,"30th International Conference on Efficiency, Cost, Optimization, Simulation and Environmental Impact of Energy Systems, ECOS 2017",,21100864701,,Conference Proceeding,,,,,,,0,0,,,,,
1047,2-s2.0-85042320899,10.3166/RIA.31.681-707,,,Case-based reasoning for modeling crop location in farm fields,re,Review,Le Ber F.,,Université de Strasbourg,Strasbourg,France,,,,,2017-01-01,2017,Revue d'Intelligence Artificielle,0992499X,24847,,Journal,31,6,,681-707,,,1,0,,,,,
1048,2-s2.0-85042295185,10.3166/RIA.31.133-152,,,Study of segmentation-classification interactions within a multi-paradigm framework for remote sensing image analysis,ar,Article,Troya-Galvis A.,,Université de Strasbourg,Strasbourg,France,,,,,2017-01-01,2017,Revue d'Intelligence Artificielle,0992499X,24847,,Journal,31,1-2,,133-152,,,1,0,,,,,
1049,2-s2.0-85040962246,10.1117/12.2307906,,,FLEX: An imaging spectrometer for measurement of vegetation fluorescence,cp,Conference Paper,Smorenburg K.,,Nederlandse Organisatie voor toegepast natuurwetenschappelijk onderzoek- TNO,The Hague,Netherlands,,,,,2017-01-01,2017,Proceedings of SPIE - The International Society for Optical Engineering,0277786X,40067,1996756X,Conference Proceeding,10569,,105690L,,,,0,1,publisherfree2read,Bronze,,,
1050,2-s2.0-85037689892,10.1039/c7ta09224e,,,The role of chemical structure in indacenodithienothiophene-alt-benzothiadiazole copolymers for high performance organic solar cells with improved photo-stability through minimization of burn-in loss,ar,Article,Chochos C.L.,,Advent Technologies SA;University of Ioannina,Patra;Ioannina,Greece;Greece,,,,,2017-01-01,2017,Journal of Materials Chemistry A,20507488,21100232403,20507496,Journal,5,47,,25064-25076,,,20,0,repositoryam,Green,,,
1051,2-s2.0-85035146792,10.1364/FIO.2017.JTu2A.115,,,New perspectives in color vision using spectroscopy and nanotechnology: Application to media photonics,cp,Conference Paper,Vauderwange O.,,Université de Strasbourg;University of Applied Sciences Offenburg,Strasbourg;Offenburg,France;Germany,,,,,2017-01-01,2017,Optics InfoBase Conference Papers,,21100840334,,Conference Proceeding,Part F66-FiO 2017,,,,,,3,0,,,,,
1052,2-s2.0-85035110251,10.1364/FIO.2017.JTu2A.97,,,Augmented reality based real-time data visualization concept for ultra-efficient car prototype,cp,Conference Paper,Wozniak P.,,Université de Strasbourg;University of Applied Sciences Offenburg,Strasbourg;Offenburg,France;Germany,,,,,2017-01-01,2017,Optics InfoBase Conference Papers,,21100840334,,Conference Proceeding,Part F66-FiO 2017,,,,,,0,0,,,,,
1053,2-s2.0-85033598077,10.1117/12.2285774,,,Towards real-time quantitative optical imaging for surgery,cp,Conference Paper,Gioux S.,,"Laboratoire des Sciences de l'Ingénieur, de l'Informatique et de l'Imagerie;Université de Strasbourg",Illkirch-Graffenstaden;Strasbourg,France;France,,,,,2017-01-01,2017,Progress in Biomedical Optics and Imaging - Proceedings of SPIE,16057422,130022,,Conference Proceeding,10411,,104110K,,,,0,0,,,,,
1054,2-s2.0-85033402968,10.1117/12.2285998,,,Development of a wearable CMOS-based contact imaging system for real-time skin condition diagnosis,cp,Conference Paper,Petitdidier N.,,"Laboratoire des Sciences de l'Ingénieur, de l'Informatique et de l'Imagerie;Universite Grenoble Alpes;Université de Strasbourg;CEA Grenoble",Illkirch-Graffenstaden;Saint Martin d'Heres;Strasbourg;Grenoble,France;France;France;France,,,,,2017-01-01,2017,Progress in Biomedical Optics and Imaging - Proceedings of SPIE,16057422,130022,,Conference Proceeding,10412,,104120F,,,,0,0,,,,,
1055,2-s2.0-85032697873,10.1007/978-3-319-68765-0_5,,,Regression Tree for Bandits Models in A/B Testing,cp,Conference Paper,Claeys E.,,Université de Strasbourg;AB TASTY,Strasbourg;Paris,France;France,,,,,2017-01-01,2017,Lecture Notes in Computer Science (including subseries Lecture Notes in Artificial Intelligence and Lecture Notes in Bioinformatics),03029743,25674,16113349,Book Series,10584 LNCS,,,52-62,,,2,0,repositoryam,Green,,,
1056,2-s2.0-85032590431,10.1039/c7tc03155f,,,Improved structural order by side-chain engineering of organic small molecules for photovoltaic applications,ar,Article,Han T.,,Université de Strasbourg,Strasbourg,France,,,,,2017-01-01,2017,Journal of Materials Chemistry C,20507534,21100229207,20507526,Journal,5,41,,10794-10800,,,9,0,repositoryam,Green,,,
1057,2-s2.0-85032345705,10.1016/j.procs.2017.08.155,S1877050917315120,,A Smart System to Standardize the Specifications of Haptic Quality Control,cp,Conference Paper,Albert B.,,"Laboratoire des Sciences de l'Ingénieur, de l'Informatique et de l'Imagerie;Université Savoie Mont Blanc;INEVA",Illkirch-Graffenstaden;Chambery;Illkirch-Graffenstaden,France;France;France,,,,,2017-01-01,2017,Procedia Computer Science,,19700182801,18770509,Conference Proceeding,112,,,723-730,,,3,1,repositoryam,Green,,,
1058,2-s2.0-85032338890,10.1016/j.procs.2017.08.157,S1877050917315144,,CBNSimulator: A simulator tool for understanding the behaviour of complex biomolecular networks using discrete time simulation,cp,Conference Paper,Ayadi A.,,Institut Supérieur de Gestion de Tunis;CNRS Centre National de la Recherche Scientifique,Le Bardo;Paris,Tunisia;France,,,,,2017-01-01,2017,Procedia Computer Science,,19700182801,18770509,Conference Proceeding,112,,,514-523,,,1,1,repositoryam,Green,,,
1059,2-s2.0-85032338448,10.1016/j.procs.2017.08.004,S1877050917313431,,Case-based Reasoning for Knowledge Capitalization in Inventive Design Using Latent Semantic Analysis,cp,Conference Paper,Zhang P.,,CNRS Centre National de la Recherche Scientifique,Paris,France,,,,,2017-01-01,2017,Procedia Computer Science,,19700182801,18770509,Conference Proceeding,112,,,323-332,,,6,1,repositoryam,Green,,,
1060,2-s2.0-85032329717,10.1016/j.procs.2017.08.159,S1877050917315168,,BNO: An ontology for describing the behaviour of complex biomolecular networks,cp,Conference Paper,Ayadi A.,,Institut Supérieur de Gestion de Tunis;CNRS Centre National de la Recherche Scientifique,Le Bardo;Paris,Tunisia;France,,,,,2017-01-01,2017,Procedia Computer Science,,19700182801,18770509,Conference Proceeding,112,,,524-533,,,2,1,repositoryam,Green,,,
1061,2-s2.0-85032307692,10.1117/12.2285774,,,Towards real-time quantitative optical imaging for surgery,cp,Conference Paper,Gioux S.,,"Laboratoire des Sciences de l'Ingénieur, de l'Informatique et de l'Imagerie;Université de Strasbourg",Illkirch-Graffenstaden;Strasbourg,France;France,,,,,2017-01-01,2017,Optics InfoBase Conference Papers,,21100835669,,Conference Proceeding,Part F61-ECBO 2017,,,,,,0,0,,,,,
1062,2-s2.0-85032264213,10.1117/12.2285998,,,Development of a wearable CMOS-based contact imaging system for real-time skin condition diagnosis,cp,Conference Paper,Petitdidier N.,,"Laboratoire des Sciences de l'Ingénieur, de l'Informatique et de l'Imagerie;Universite Grenoble Alpes;Université de Strasbourg",Illkirch-Graffenstaden;Saint Martin d'Heres;Strasbourg,France;France;France,,,,,2017-01-01,2017,Optics InfoBase Conference Papers,,21100835669,,Conference Proceeding,Part F61-ECBO 2017,,,,,,0,0,,,,,
1063,2-s2.0-85030703749,10.1117/12.2270328,,,Real-time augmented reality overlay for an energy-efficient car study,cp,Conference Paper,Wozniak P.,,University of Applied Sciences Offenburg,Offenburg,Germany,,,,,2017-01-01,2017,Proceedings of SPIE - The International Society for Optical Engineering,0277786X,40067,1996756X,Conference Proceeding,10335,,103350B,,,,0,0,,,,,
1064,2-s2.0-85029479445,10.1007/978-3-319-66272-5_29,,,Study on the digitization dual combinatorics and convex case,cp,Conference Paper,Mazo L.,,"Laboratoire des Sciences de l'Ingénieur, de l'Informatique et de l'Imagerie",Illkirch-Graffenstaden,France,,,,,2017-01-01,2017,Lecture Notes in Computer Science (including subseries Lecture Notes in Artificial Intelligence and Lecture Notes in Bioinformatics),03029743,25674,16113349,Book Series,10502 LNCS,,,363-374,,,1,0,repositoryam,Green,,,
1065,2-s2.0-85029187469,10.1117/12.2270223,,,Sub-diffraction surface topography measurement using a microsphere-assisted Linnik interferometer,cp,Conference Paper,Montgomery P.C.,,Université de Strasbourg,Strasbourg,France,,,,,2017-01-01,2017,Proceedings of SPIE - The International Society for Optical Engineering,0277786X,40067,1996756X,Conference Proceeding,10329,,1032918,,,,6,0,repositoryam,Green,,,
1066,2-s2.0-85028615565,10.1016/j.matpr.2017.05.008,S2214785317307162,,Improvement in measurements of hydroxyapatite layers by hybrid high dynamic range image processing in white-light interferometry,cp,Conference Paper,Leong-Hoi A.,,Université de Strasbourg,Strasbourg,France,,,,,2017-01-01,2017,Materials Today: Proceedings,,21100370037,22147853,Conference Proceeding,4,,,S36-S43,,,1,1,publisherhybridgold,Hybrid Gold,,,
1067,2-s2.0-85028606714,10.1016/j.matpr.2017.05.011,S2214785317307198,,Investigation into Photonic Jet Machining Using Shaped Optical Fibre Tips,cp,Conference Paper,Chabrol G.R.,,"Laboratoire des Sciences de l'Ingénieur, de l'Informatique et de l'Imagerie",Illkirch-Graffenstaden,France,,,,,2017-01-01,2017,Materials Today: Proceedings,,21100370037,22147853,Conference Proceeding,4,,,S62-S67,,,0,1,publisherhybridgold,Hybrid Gold,,,
1068,2-s2.0-85028605274,10.1117/12.2270246,,,Role of coherence in microsphere-assisted nanoscopy,cp,Conference Paper,Perrin S.,,Université de Strasbourg,Strasbourg,France,,,,,2017-01-01,2017,Proceedings of SPIE - The International Society for Optical Engineering,0277786X,40067,1996756X,Conference Proceeding,10330,,103300V,,,,10,0,,,,,
1069,2-s2.0-85028582510,10.1016/j.matpr.2017.05.003,S2214785317307113,,Symposium DD: Light interaction with nanomaterials,cp,Conference Paper,Lecler S.,,Université de Strasbourg,Strasbourg,France,,,,,2017-01-01,2017,Materials Today: Proceedings,,21100370037,22147853,Conference Proceeding,4,,,S1-S2,,,0,1,publisherhybridgold,Hybrid Gold,,,
1070,2-s2.0-85027307410,10.1007/978-3-319-45123-7_3,,,Open source first person view 3D point cloud visualizer for large data sets,cp,Conference Paper,Palha A.,,"Laboratoire des Sciences de l'Ingénieur, de l'Informatique et de l'Imagerie",Illkirch-Graffenstaden,France,,,,,2017-01-01,2017,Lecture Notes in Geoinformation and Cartography,18632246,21100244603,18632351,Book Series,,,,27-39,,,1,0,,,,,
