,eid,doi,pii,pubmed_id,title,subtype,subtypeDescription,creator,afid,affilname,affiliation_city,affiliation_country,author_count,author_names,author_ids,author_afids,coverDate,coverDisplayDate,publicationName,issn,source_id,eIssn,aggregationType,volume,issueIdentifier,article_number,pageRange,description,authkeywords,citedby_count,openaccess,freetoread,freetoreadLabel,fund_acr,fund_no,fund_sponsor
948,2-s2.0-85040586342,,,,A characterization for decidable separability by piecewise testable languages<sup>∗</sup>,ar,Article,Czerwinski W.,,University of Warsaw,Warsaw,Poland,,,,,2017-01-01,2017,Discrete Mathematics and Theoretical Computer Science,14627264,78470,13658050,Journal,19,4,1,,,,7,0,,,,,
949,2-s2.0-85040362782,,,,OAEI 2017 results of KEPLER,cp,Conference Paper,Kachroudi M.,,"Université de Tunis El Manar, Faculté des Sciences de Tunis",Tunis,Tunisia,,,,,2017-01-01,2017,CEUR Workshop Proceedings,16130073,21100218356,,Conference Proceeding,2032,,,138-145,,,10,0,,,,,
950,2-s2.0-85040354407,10.13053/CyS-21-4-2857,,,Proving Distributed Coloring of Forests in Dynamic Networks,ar,Article,Fakhfakh F.,,University of Sfax,Sfax,Tunisia,,,,,2017-01-01,2017,Computacion y Sistemas,14055546,21100223167,20079737,Journal,21,4,,863-881,,,8,0,,,,,
951,2-s2.0-85040178215,,,,MuGDAD: Multilevel graph drawing algorithm in a distributed architecture,cp,Conference Paper,Hinge A.,,Université de Bordeaux,Bordeaux,France,,,,,2017-01-01,2017,"Proceedings of the International Conferences on Computer Graphics, Visualization, Computer Vision and Image Processing 2017 and Big Data Analytics, Data Mining and Computational Intelligence 2017 - Part of the Multi Conference on Computer Science and Information Systems 2017",,21100845613,,Conference Proceeding,,,,189-196,,,2,0,,,,,
952,2-s2.0-85040115899,10.1007/978-3-319-72050-0_19,,,A generic framework for computing parameters of sequence-based dynamic graphs,cp,Conference Paper,Casteigts A.,,Université de Bordeaux,Bordeaux,France,,,,,2017-01-01,2017,Lecture Notes in Computer Science (including subseries Lecture Notes in Artificial Intelligence and Lecture Notes in Bioinformatics),03029743,25674,16113349,Book Series,10641 LNCS,,,321-338,,,2,0,,,,,
953,2-s2.0-85040080336,,,,Extending dataflows with temporal graphs,cp,Conference Paper,Celerier J.M.,,Université de Bordeaux;Blue Yeti,Bordeaux;,France;France,,,,,2017-01-01,2017,2017 ICMC/EMW - 43rd International Computer Music Conference and the 6th International Electronic Music Week,,21100845189,,Conference Proceeding,,,,69-74,,,0,0,,,,,
954,2-s2.0-85039745980,10.1137/16M1108625,,,Interactive video colorization within a variational framework,ar,Article,Pierre F.,,Université de Bordeaux,Bordeaux,France,,,,,2017-01-01,2017,SIAM Journal on Imaging Sciences,,19700186911,19364954,Journal,10,4,,2293-2325,,,6,0,repositoryam,Green,,,
955,2-s2.0-85037369565,10.7155/jgaa.00449,,,Parameterized and approximation complexity of the detection pair problem in graphs,ar,Article,Foucaud F.,,Laboratoire d Informatique de Modelisation et d Optimisation des Systems,Aubiere,France,,,,,2017-01-01,2017,Journal of Graph Algorithms and Applications,15261719,28347,,Journal,21,6,,1039-1056,,,0,1,repositoryam,Green,,,
956,2-s2.0-85037347023,10.7155/jgaa.00444,,,Non-aligned drawings of planar graphs,ar,Article,Biedl T.,,David R. Cheriton School of Computer Science,Waterloo,Canada,,,,,2017-01-01,2017,Journal of Graph Algorithms and Applications,15261719,28347,,Journal,21,5,,915-937,,,1,1,repositoryam,Green,,,
957,2-s2.0-85034230583,10.1007/978-3-319-68792-6_41,,,Rhoban football club: RoboCup humanoid kid-size 2016 champion team paper,cp,Conference Paper,Allali J.,,Université de Bordeaux,Bordeaux,France,,,,,2017-01-01,2017,Lecture Notes in Computer Science (including subseries Lecture Notes in Artificial Intelligence and Lecture Notes in Bioinformatics),03029743,25674,16113349,Book Series,9776 LNAI,,,491-502,,,5,0,,,,,
958,2-s2.0-85034219668,10.1007/978-3-319-68792-6_14,,,"Dynaban, an open-source alternative firmware for Dynamixel servo-motors",cp,Conference Paper,Fabre R.,,Université de Bordeaux,Bordeaux,France,,,,,2017-01-01,2017,Lecture Notes in Computer Science (including subseries Lecture Notes in Artificial Intelligence and Lecture Notes in Bioinformatics),03029743,25674,16113349,Book Series,9776 LNAI,,,169-177,,,0,0,,,,,
959,2-s2.0-85034110527,10.1007/978-3-319-69035-3_32,,,Automated generation of REST API specification from plain HTML documentation,cp,Conference Paper,Cao H.,,Université de Bordeaux,Bordeaux,France,,,,,2017-01-01,2017,Lecture Notes in Computer Science (including subseries Lecture Notes in Artificial Intelligence and Lecture Notes in Bioinformatics),03029743,25674,16113349,Book Series,10601 LNCS,,,453-461,,,11,0,,,,,
960,2-s2.0-85034100844,10.1007/978-3-319-68705-6_10,,,Token sliding on chordal graphs,cp,Conference Paper,Bonamy M.,,Université de Bordeaux,Bordeaux,France,,,,,2017-01-01,2017,Lecture Notes in Computer Science (including subseries Lecture Notes in Artificial Intelligence and Lecture Notes in Bioinformatics),03029743,25674,16113349,Book Series,10520 LNCS,,,127-139,,,18,0,repositoryam,Green,,,
961,2-s2.0-85034083119,10.1007/978-3-319-69035-3_45,,,Empirical study on REST APIs usage in android mobile applications,cp,Conference Paper,Oumaziz M.A.,,Université de Bordeaux,Bordeaux,France,,,,,2017-01-01,2017,Lecture Notes in Computer Science (including subseries Lecture Notes in Artificial Intelligence and Lecture Notes in Bioinformatics),03029743,25674,16113349,Book Series,10601 LNCS,,,614-622,,,6,0,,,,,
962,2-s2.0-85034070472,10.1007/978-3-319-69035-3_30,,,Polly: A language-based approach for custom change detection of web service data,cp,Conference Paper,Ben Hadj Yahia E.,,Université de Bordeaux;CProDirect,Bordeaux;Merignac,France;France,,,,,2017-01-01,2017,Lecture Notes in Computer Science (including subseries Lecture Notes in Artificial Intelligence and Lecture Notes in Bioinformatics),03029743,25674,16113349,Book Series,10601 LNCS,,,430-444,,,1,0,repositoryam,Green,,,
963,2-s2.0-85033602541,10.1007/978-3-319-70284-1_32,,,Semantic social networks: A new approach to scaling digital ethnography,cp,Conference Paper,Cottica A.,,Universitat d'Alacant;EDGERYDERS OU,Alicante;Tallinn,Spain;Estonia,,,,,2017-01-01,2017,Lecture Notes in Computer Science (including subseries Lecture Notes in Artificial Intelligence and Lecture Notes in Bioinformatics),03029743,25674,16113349,Book Series,10673 LNCS,,,412-420,,,1,0,repositoryam,Green,,,
964,2-s2.0-85032695122,10.1007/978-3-319-69084-1_22,,,A fully asynchronous and fault tolerant distributed algorithm to compute a minimum graph orientation,cp,Conference Paper,Gillet N.,,Université de Bordeaux,Bordeaux,France,,,,,2017-01-01,2017,Lecture Notes in Computer Science (including subseries Lecture Notes in Artificial Intelligence and Lecture Notes in Bioinformatics),03029743,25674,16113349,Book Series,10616 LNCS,,,308-322,,,2,0,,,,,
965,2-s2.0-85030872903,,,,On a combination of the 1-2-3 conjecture and the antimagic labelling conjecture,ar,Article,Bensmail J.,,"Laboratoire d'Informatique, Signaux et Systèmes de Sophia-Antipolis",Sophia Antipolis,France,,,,,2017-01-01,2017,Discrete Mathematics and Theoretical Computer Science,14627264,78470,13658050,Journal,19,1,21,,,,11,0,,,,,
966,2-s2.0-85030769103,10.1145/3072959.3073611,,,Example-based expressive animation of 2D rigid bodies,cp,Conference Paper,Dvorožňák M.,,Czech Technical University in Prague,Prague,Czech Republic,,,,,2017-01-01,2017,ACM Transactions on Graphics,07300301,24972,15577368,Journal,36,4,127,,,,8,0,repositoryvor,Green,,,
967,2-s2.0-85030664866,10.1007/978-3-319-67549-7_16,,,GREP: Games for the runtime enforcement of properties,cp,Conference Paper,Renard M.,,Université de Bordeaux,Bordeaux,France,,,,,2017-01-01,2017,Lecture Notes in Computer Science (including subseries Lecture Notes in Artificial Intelligence and Lecture Notes in Bioinformatics),03029743,25674,16113349,Book Series,10533 LNCS,,,259-275,,,2,0,repositoryam,Green,,,
968,2-s2.0-85030566116,,,,An operational method toward efficient walk control policies for humanoid robots,cp,Conference Paper,Hofer L.,,Laboratoire Bordelais de Recherche en Informatique,Talence,France,,,,,2017-01-01,2017,"Proceedings International Conference on Automated Planning and Scheduling, ICAPS",23340835,21100396641,23340843,Conference Proceeding,,,,489-497,,,3,0,,,,,
969,2-s2.0-85030472322,,,,Diagnosability planning for controllable discrete event systems,cp,Conference Paper,Ibrahim H.,,Laboratoire de Recherche en Informatique,Gif-sur-Yvette,France,,,,,2017-01-01,2017,"31st AAAI Conference on Artificial Intelligence, AAAI 2017",,21100832747,,Conference Proceeding,,,,1149-1155,,,1,0,,,,,
970,2-s2.0-85030174052,10.1007/978-3-319-67910-5_23,,,Correlation-free multipath routing for multimedia traffic in wireless sensor networks,cp,Conference Paper,Ghrab D.,,Université de la Manouba,Manouba,Tunisia,,,,,2017-01-01,2017,Lecture Notes in Computer Science (including subseries Lecture Notes in Artificial Intelligence and Lecture Notes in Bioinformatics),03029743,25674,16113349,Book Series,10517 LNCS,,,276-289,,,4,0,,,,,
971,2-s2.0-85029954951,10.1117/12.2268741,,,Speaker gender identification based on majority vote classifiers,cp,Conference Paper,Mezghani E.,,University of Sfax,Sfax,Tunisia,,,,,2017-01-01,2017,Proceedings of SPIE - The International Society for Optical Engineering,0277786X,40067,1996756X,Conference Proceeding,10341,,103410A,,,,0,0,,,,,
972,2-s2.0-85029449990,10.1007/978-3-319-67434-6_9,,,Early prediction of alzheimer’s disease with non-local patch-based longitudinal descriptors,cp,Conference Paper,Sanroma G.,,Universitat Pompeu Fabra Barcelona,Barcelona,Spain,,,,,2017-01-01,2017,Lecture Notes in Computer Science (including subseries Lecture Notes in Artificial Intelligence and Lecture Notes in Bioinformatics),03029743,25674,16113349,Book Series,10530 LNCS,,,74-81,,,4,0,repositoryam,Green,,,
973,2-s2.0-85029447136,10.1109/MMUL.2017.3051510,,,Dynamic Deployment and Optimization of Virtual Content Delivery Networks,ar,Article,Herbaut N.,,Laboratoire Bordelais de Recherche en Informatique,Talence,France,,,,,2017-01-01,2017,IEEE Multimedia,1070986X,25531,,Journal,24,3,7999159,28-37,,,9,0,repositoryam,Green,,,
974,2-s2.0-85029441024,10.1007/978-3-319-67434-6_10,,,Adaptive fusion of texture-based grading: Application to alzheimer’s disease detection,cp,Conference Paper,Hett K.,,Université de Bordeaux;CNRS Centre National de la Recherche Scientifique,Bordeaux;Paris,France;France,,,,,2017-01-01,2017,Lecture Notes in Computer Science (including subseries Lecture Notes in Artificial Intelligence and Lecture Notes in Bioinformatics),03029743,25674,16113349,Book Series,10530 LNCS,,,82-89,,,4,0,repositoryam,Green,,,
975,2-s2.0-85029416846,10.1007/978-3-319-67434-6_4,,,Hippocampus Subfield Segmentation Using a Patch-Based Boosted Ensemble of Autocontext Neural Networks,cp,Conference Paper,Manjón J.V.,,Universitat Politècnica de València,Valencia,Spain,,,,,2017-01-01,2017,Lecture Notes in Computer Science (including subseries Lecture Notes in Artificial Intelligence and Lecture Notes in Bioinformatics),03029743,25674,16113349,Book Series,10530 LNCS,,,29-36,,,3,0,repositoryam,Green,,,
976,2-s2.0-85029409839,,,,Preface,ed,Editorial,Klasing R.,,Université de Bordeaux,Bordeaux,France,,,,,2017-01-01,2017,Lecture Notes in Computer Science (including subseries Lecture Notes in Artificial Intelligence and Lecture Notes in Bioinformatics),03029743,25674,16113349,Book Series,10472 LNCS,,,V,,,0,0,,,,,
977,2-s2.0-85029404240,10.1007/978-3-662-55751-8_3,,,A tour of recent results on word transducers,cp,Conference Paper,Muscholl A.,,Université de Bordeaux,Bordeaux,France,,,,,2017-01-01,2017,Lecture Notes in Computer Science (including subseries Lecture Notes in Artificial Intelligence and Lecture Notes in Bioinformatics),03029743,25674,16113349,Book Series,10472 LNCS,,,29-33,,,1,0,,,,,
978,2-s2.0-85029317780,10.5220/0006418202210229,,,Mobility strategies based on virtual forces for swarms of autonomous UAVs in constrained environments,cp,Conference Paper,Falomir E.,,Université de Bordeaux;Thales Group,Bordeaux;Puteaux,France;France,,,,,2017-01-01,2017,"ICINCO 2017 - Proceedings of the 14th International Conference on Informatics in Control, Automation and Robotics",,21100830144,,Conference Proceeding,1,,,221-229,,,3,1,repositoryam,Green,,,
979,2-s2.0-85028729996,10.1007/978-3-319-66263-3_5,,,On the community structure of bounded model checking SAT problems,cp,Conference Paper,Baud-Berthier G.,,Université de Bordeaux;SafeRiver,Bordeaux;Paris,France;France,,,,,2017-01-01,2017,Lecture Notes in Computer Science (including subseries Lecture Notes in Artificial Intelligence and Lecture Notes in Bioinformatics),03029743,25674,16113349,Book Series,10491 LNCS,,,65-82,,,3,0,,,,,
980,2-s2.0-85028717951,10.1007/978-3-319-66396-8_22,,,A permutation on words in a two letter alphabet,cp,Conference Paper,Castronuovo N.,,University of Ferrara,Ferrara,Italy,,,,,2017-01-01,2017,Lecture Notes in Computer Science (including subseries Lecture Notes in Artificial Intelligence and Lecture Notes in Bioinformatics),03029743,25674,16113349,Book Series,10432 LNCS,,,240-251,,,0,0,,,,,
981,2-s2.0-85028711495,10.1007/978-3-319-64203-1_4,,,Online dynamic monitoring of MPI communications,cp,Conference Paper,Bosilca G.,,"The University of Tennessee, Knoxville",Knoxville,United States,,,,,2017-01-01,2017,Lecture Notes in Computer Science (including subseries Lecture Notes in Artificial Intelligence and Lecture Notes in Bioinformatics),03029743,25674,16113349,Book Series,10417 LNCS,,,49-62,,,9,0,repositoryam,Green,,,
982,2-s2.0-85028711364,10.1007/978-3-319-64419-6_55,,,Further progress on the heredity of the game domination number,cp,Conference Paper,James T.,,Cochin University of Science and Technology;Pavanatma College,Kochi;Idukki,India;India,,,,,2017-01-01,2017,Lecture Notes in Computer Science (including subseries Lecture Notes in Artificial Intelligence and Lecture Notes in Bioinformatics),03029743,25674,16113349,Book Series,10398 LNCS,,,435-444,,,4,0,,,,,
983,2-s2.0-85028692089,10.1007/978-3-319-66396-8_14,,,A set of sequences of complexity 2 n+ 1,cp,Conference Paper,Cassaigne J.,,Institut de Mathématiques de Marseille;CNRS Centre National de la Recherche Scientifique;Université de Liège,Marseille;Paris;Liege,France;France;Belgium,,,,,2017-01-01,2017,Lecture Notes in Computer Science (including subseries Lecture Notes in Artificial Intelligence and Lecture Notes in Bioinformatics),03029743,25674,16113349,Book Series,10432 LNCS,,,144-156,,,7,0,repositoryam,Green,,,
984,2-s2.0-85028691021,10.1007/978-3-319-64203-1_19,,,Rewriting system for profile-guided data layout transformations on binaries,cp,Conference Paper,Haine C.,,Université de Bordeaux,Bordeaux,France,,,,,2017-01-01,2017,Lecture Notes in Computer Science (including subseries Lecture Notes in Artificial Intelligence and Lecture Notes in Bioinformatics),03029743,25674,16113349,Book Series,10417 LNCS,,,260-272,,,0,0,repositoryam,Green,,,
985,2-s2.0-85028457719,10.1007/978-3-319-62389-4_10,,,The approximability of the p-hub center problem with parameterized triangle inequality,cp,Conference Paper,Chen L.H.,,National Cheng Kung University,Tainan,Taiwan,,,,,2017-01-01,2017,Lecture Notes in Computer Science (including subseries Lecture Notes in Artificial Intelligence and Lecture Notes in Bioinformatics),03029743,25674,16113349,Book Series,10392 LNCS,,,112-123,,,8,0,,,,,
986,2-s2.0-85026780611,10.5220/0006134200890097,,,Combining different reconstruction kernel responses as preprocessing step for airway tree extraction in CT scan,cp,Conference Paper,Bouzidi S.,,Université de Bordeaux;University of Sfax,Bordeaux;Sfax,France;Tunisia,,,,,2017-01-01,2017,"VISIGRAPP 2017 - Proceedings of the 12th International Joint Conference on Computer Vision, Imaging and Computer Graphics Theory and Applications",,21100862623,,Conference Proceeding,4,,,89-97,,,1,1,repositoryam,Green,,,
987,2-s2.0-85026772122,10.1007/978-3-319-63390-9_9,,,Model-checking linear-time properties of parametrized asynchronous shared-memory pushdown systems,cp,Conference Paper,Fortin M.,,École Normale Supérieure Paris-Saclay,Cachan,France,,,,,2017-01-01,2017,Lecture Notes in Computer Science (including subseries Lecture Notes in Artificial Intelligence and Lecture Notes in Bioinformatics),03029743,25674,16113349,Book Series,10427 LNCS,,,155-175,,,7,0,repositoryam,Green,,,
988,2-s2.0-85026661325,,,,A Parallel implementation on a multi-core architecture of a dynamic programming algorithm applied in cognitive radio ad hoc networks,ar,Article,Benmammar B.,,Université Abou Bekr Belkaid Tlemcen,Tlemcen,Algeria,,,,,2017-01-01,2017,International Journal of Communication Networks and Information Security,20760930,19900195075,2073607X,Journal,9,2,,196-204,,,5,0,,,,,
989,2-s2.0-85026410879,10.1007/978-3-319-60042-0_27,,,Implicit knowledge extraction and structuration from electrical diagrams,cp,Conference Paper,Kaadoud I.C.,,Institut des Maladies Neurodégénératives;INRIA Institut National de Recherche en Informatique et en Automatique;CNRS Centre National de la Recherche Scientifique;Technopole Izarbel,Bordeaux;Le Chesnay;Paris;Bidart,France;France;France;France,,,,,2017-01-01,2017,Lecture Notes in Computer Science (including subseries Lecture Notes in Artificial Intelligence and Lecture Notes in Bioinformatics),03029743,25674,16113349,Book Series,10350 LNCS,,,235-241,,,1,0,repositoryam,Green,,,
990,2-s2.0-85026394696,10.1007/978-3-319-50422-3_7,,,"Classifiers, Sorts, and Base Types in the Montagovian Generative Lexicon and Related Type Theoretical Frameworks for Lexical Compositional Semantics",ch,Book Chapter,Mery B.,,Université de Bordeaux,Bordeaux,France,,,,,2017-01-01,2017,Studies in Linguistics and Philosophy,09244662,21101039446,2215034X,Book Series,98,,,163-188,,,1,0,,,,,
991,2-s2.0-85026353466,,,,Modernisation de la duplication de clauses,cp,Conference Paper,Baud-Berthier G.,,Laboratoire Bordelais de Recherche en Informatique;SafeRiver,Talence;Paris,France;France,,,,,2017-01-01,2017,"Treiziemes Journees Francophones de Programmation par Contraintes, JFPC 2017",,21100825265,,Conference Proceeding,,,,251-259,,,0,0,,,,,
992,2-s2.0-85026350133,10.1007/978-3-319-61572-1_7,,,Challenges in the computational implementation of montagovian lexical semantics,cp,Conference Paper,Mery B.,,Université de Bordeaux,Bordeaux,France,,,,,2017-01-01,2017,Lecture Notes in Computer Science (including subseries Lecture Notes in Artificial Intelligence and Lecture Notes in Bioinformatics),03029743,25674,16113349,Book Series,10247 LNAI,,,90-107,,,2,0,repositoryam,Green,,,
993,2-s2.0-85022073020,10.1007/978-3-319-60134-2_9,,,Stamina: Stabilisation monoids in automata theory,cp,Conference Paper,Fijalkow N.,,University of Warwick,Coventry,United Kingdom,,,,,2017-01-01,2017,Lecture Notes in Computer Science (including subseries Lecture Notes in Artificial Intelligence and Lecture Notes in Bioinformatics),03029743,25674,16113349,Book Series,10329 LNCS,,,101-112,,,0,0,repositoryam,Green,,,
994,2-s2.0-85022071652,,,,Interaction with the internet of tangible things (IoTT),cp,Conference Paper,Angelini L.,,University of Applied Sciences Western Switzerland,Delemont,Switzerland,,,,,2017-01-01,2017,CEUR Workshop Proceedings,16130073,21100218356,,Conference Proceeding,1861,,,31,,,5,0,,,,,
995,2-s2.0-85022050922,10.1007/978-3-319-60134-2_14,,,From hadamard expressions to weighted rotating automata and back,cp,Conference Paper,Dando L.,,Université de Bordeaux,Bordeaux,France,,,,,2017-01-01,2017,Lecture Notes in Computer Science (including subseries Lecture Notes in Artificial Intelligence and Lecture Notes in Bioinformatics),03029743,25674,16113349,Book Series,10329 LNCS,,,163-174,,,1,0,,,,,
996,2-s2.0-85021986415,,,,Tangible user interfaces characterization (TUIC),cp,Conference Paper,Ticona-Herrera R.,,Laboratoire Bordelais de Recherche en Informatique;Universidad Católica San Pablo,Talence;Arequipa,France;Peru,,,,,2017-01-01,2017,CEUR Workshop Proceedings,16130073,21100218356,,Conference Proceeding,1861,,,34-35,,,0,0,,,,,
997,2-s2.0-85021907687,,,,Museomix: Lessons learned from an open creative hackathon in museums,cp,Conference Paper,Rey S.,,Université de Bordeaux;LRA,Bordeaux;Toulouse,France;France,,,,,2017-01-01,2017,CEUR Workshop Proceedings,16130073,21100218356,,Conference Proceeding,1861,,,24-28,,,1,0,,,,,
998,2-s2.0-85021874509,,,,Designing and evaluating ambient tangible interfaces for shifting energy supply in the workplace,cp,Conference Paper,Daniel M.,,Laboratoire Bordelais de Recherche en Informatique,Talence,France,,,,,2017-01-01,2017,CEUR Workshop Proceedings,16130073,21100218356,,Conference Proceeding,1861,,,5-9,,,0,0,,,,,
999,2-s2.0-85021809218,10.1016/j.procs.2017.05.363,S1877050917310323,,Electing a Leader in Dynamic Networks using Mobile Agents and Local Computations,cp,Conference Paper,Ktari M.,,FSEG Sfax - Faculté des Sciences Économiques et de Gestion de Sfax,Sfax,Tunisia,,,,,2017-01-01,2017,Procedia Computer Science,,19700182801,18770509,Conference Proceeding,109,,,351-358,,,4,1,publisherfullgold,Gold,,,
1000,2-s2.0-85021799447,10.1016/j.procs.2017.05.340,S1877050917310098,,An Efficient Broadcast Authentication Scheme in Wireless Sensor Networks,cp,Conference Paper,Mbarek B.,,"Université de Tunis El Manar, Ecole Nationale d'Ingénieurs de Tunis",Tunis,Tunisia,,,,,2017-01-01,2017,Procedia Computer Science,,19700182801,18770509,Conference Proceeding,109,,,553-559,,,5,1,publisherfullgold,Gold,,,
1001,2-s2.0-85021101504,10.7151/dmgt.1963,,,Packing coloring of some undirected and oriented coronae graphs,ar,Article,Laïche D.,,Université des Sciences et de la Technologie Houari Boumediene,Algiers,Algeria,,,,,2017-01-01,2017,Discussiones Mathematicae - Graph Theory,12343099,19700180503,20835892,Journal,37,3,,665-690,,,7,1,repositoryam,Green,,,
1002,2-s2.0-85020539246,10.1007/978-3-319-59665-5_12,,,Benchmarking cryptographic schemes for securing public cloud storages (practical experience report),cp,Conference Paper,Contiu S.,,Université de Bordeaux;Scille,Bordeaux;Gentilly,France;France,,,,,2017-01-01,2017,Lecture Notes in Computer Science (including subseries Lecture Notes in Artificial Intelligence and Lecture Notes in Bioinformatics),03029743,25674,16113349,Book Series,10320 LNCS,,,163-176,,,0,0,repositoryam,Green,,,
1003,2-s2.0-85020456204,10.1007/978-3-319-58943-5_14,,,Exploiting a parametrized task graph model for the parallelization of a sparse direct multifrontal solver,cp,Conference Paper,Agullo E.,,Laboratoire Bordelais de Recherche en Informatique,Talence,France,,,,,2017-01-01,2017,Lecture Notes in Computer Science (including subseries Lecture Notes in Artificial Intelligence and Lecture Notes in Bioinformatics),03029743,25674,16113349,Book Series,10104 LNCS,,,175-186,,,2,0,repositoryam,Green,,,
1004,2-s2.0-85020398377,10.1007/978-3-319-58943-5_5,,,Resource aggregation for task-based cholesky factorization on top of heterogeneous machines,cp,Conference Paper,Cojean T.,,Université de Bordeaux,Bordeaux,France,,,,,2017-01-01,2017,Lecture Notes in Computer Science (including subseries Lecture Notes in Artificial Intelligence and Lecture Notes in Bioinformatics),03029743,25674,16113349,Book Series,10104 LNCS,,,56-68,,,0,0,repositoryam,Green,,,
1005,2-s2.0-85019935291,10.1137/16M1062454,,,Reordering strategy for blocking optimization in sparse linear solvers,ar,Article,Pichon G.,,Université de Bordeaux,Bordeaux,France,,,,,2017-01-01,2017,SIAM Journal on Matrix Analysis and Applications,08954798,26419,10957162,Journal,38,1,,226-248,,,7,0,repositoryam,Green,,,
1006,2-s2.0-85019252348,10.1007/978-3-319-56856-0_2,,,Documentation reuse: Hot or not? an empirical study,cp,Conference Paper,Oumaziz M.A.,,Université de Bordeaux,Bordeaux,France,,,,,2017-01-01,2017,Lecture Notes in Computer Science (including subseries Lecture Notes in Artificial Intelligence and Lecture Notes in Bioinformatics),03029743,25674,16113349,Book Series,10221 LNCS,,,12-27,,,11,0,repositoryam,Green,,,
1007,2-s2.0-85019194255,10.1007/978-3-319-58747-9_5,,,"Concatenation hierarchies: New bottle, old wine",cp,Conference Paper,Place T.,,Université de Bordeaux,Bordeaux,France,,,,,2017-01-01,2017,Lecture Notes in Computer Science (including subseries Lecture Notes in Artificial Intelligence and Lecture Notes in Bioinformatics),03029743,25674,16113349,Book Series,10304 LNCS,,,25-37,,,9,0,,,,,
1008,2-s2.0-85018639116,10.1007/978-3-319-56414-2_9,,,On the implementation of centerline extraction based on confidence vote in accumulation map,cp,Conference Paper,Kerautret B.,,Université de Lorraine;LORIA Laboratoire Lorrain de Recherche en Informatique et ses Applications,Nancy;Vandoeouvre-les-Nancy,France;France,,,,,2017-01-01,2017,Lecture Notes in Computer Science (including subseries Lecture Notes in Artificial Intelligence and Lecture Notes in Bioinformatics),03029743,25674,16113349,Book Series,10214 LNCS,,,116-130,,,0,0,,,,,
1009,2-s2.0-85018543480,10.1214/16-BJPS315,,,The probability that n random points in a disk are in convex position,ar,Article,Marckert J.F.,,Université de Bordeaux,Bordeaux,France,,,,,2017-01-01,2017,Brazilian Journal of Probability and Statistics,01030752,19900192736,,Journal,31,2,,320-337,,,3,1,repositoryam,Green,,,
1010,2-s2.0-85018428709,10.1007/978-3-319-57586-5_14,,,On the complexity of the star p-hub center problem with parameterized triangle inequality,cp,Conference Paper,Chen L.H.,,National Cheng Kung University,Tainan,Taiwan,,,,,2017-01-01,2017,Lecture Notes in Computer Science (including subseries Lecture Notes in Artificial Intelligence and Lecture Notes in Bioinformatics),03029743,25674,16113349,Book Series,10236 LNCS,,,152-163,,,6,0,,,,,
