,eid,doi,pii,pubmed_id,title,subtype,subtypeDescription,creator,afid,affilname,affiliation_city,affiliation_country,author_count,author_names,author_ids,author_afids,coverDate,coverDisplayDate,publicationName,issn,source_id,eIssn,aggregationType,volume,issueIdentifier,article_number,pageRange,description,authkeywords,citedby_count,openaccess,freetoread,freetoreadLabel,fund_acr,fund_no,fund_sponsor
0,2-s2.0-85096669196,10.7326/M20-5261,,32931326,The COVID-NMA project: Building an evidence ecosystem for the COVID-19 pandemic,re,Review,Boutron I.,,Université Paris Cité;Hôpital Hotel-Dieu AP-HP,Paris;Paris,France;France,,,,,2020-12-15,15 December 2020,Annals of Internal Medicine,00034819,26574,15393704,Journal,173,12,,1015-1017,,,19,0,repositoryvor,Green,,,
1,2-s2.0-85103355265,10.1007/s41781-020-00042-y,,,Optimizing Cherenkov Photons Generation and Propagation in CORSIKA for CTA Monte–Carlo Simulations,ar,Article,Arrabito L.,,Laboratoire Univers et Particules de Montpellier,Montpellier,France,,,,,2020-12-01,December 2020,Computing and Software for Big Science,,21101041418,25102044,Journal,4,1,9,,,,1,0,repositoryam,Green,,,
2,2-s2.0-85102189509,10.1109/ICS51289.2020.00034,,,The Hardness and Approximation of the Densest k-Subgraph Problem in Parameterized Metric Graphs,cp,Conference Paper,Chang S.C.,,National Taipei University of Business,Taipei,Taiwan,,,,,2020-12-01,December 2020,"Proceedings - 2020 International Computer Symposium, ICS 2020",,21101039602,,Conference Proceeding,,,9359054,126-130,,,0,0,repositoryam,Green,,,
3,2-s2.0-85100947975,10.4230/LIPIcs.ISAAC.2020.7,,,Algorithms and complexity for geodetic sets on planar and chordal graphs,cp,Conference Paper,Chakraborty D.,,"Indraprastha Institute of Information Technology, Delhi",New Delhi,India,,,,,2020-12-01,December 2020,"Leibniz International Proceedings in Informatics, LIPIcs",18688969,21100244929,,Conference Proceeding,181,,7,71-715,,,3,0,,,,,
4,2-s2.0-85100923050,10.4230/LIPIcs.ISAAC.2020.37,,,Linear transformations between dominating sets in the TAR-model,cp,Conference Paper,Bousquet N.,,Université Claude Bernard Lyon 1,Villeurbanne,France,,,,,2020-12-01,December 2020,"Leibniz International Proceedings in Informatics, LIPIcs",18688969,21100244929,,Conference Proceeding,181,,37,371-3714,,,2,0,,,,,
5,2-s2.0-85100917595,10.4230/LIPIcs.ISAAC.2020.24,,,Discriminating codes in geometric setups,cp,Conference Paper,Dey S.,,"Indian Statistical Institute, Kolkata",Kolkata,India,,,,,2020-12-01,December 2020,"Leibniz International Proceedings in Informatics, LIPIcs",18688969,21100244929,,Conference Proceeding,181,,24,241-2416,,,0,0,,,,,
6,2-s2.0-85100914789,10.4230/LIPIcs.ISAAC.2020.30,,,Finding temporal paths under waiting time constraints,cp,Conference Paper,Casteigts A.,,Université de Bordeaux,Bordeaux,France,,,,,2020-12-01,December 2020,"Leibniz International Proceedings in Informatics, LIPIcs",18688969,21100244929,,Conference Proceeding,181,,30,301-3018,,,6,0,,,,,
7,2-s2.0-85100420837,10.1109/GLOBECOM42002.2020.9322147,,,Proactive Autoscaling for Cloud-Native Applications using Machine Learning,cp,Conference Paper,Marie-Magdelaine N.,,Université de Bordeaux;Lectra SA,Bordeaux;Cestas,France;France,,,,,2020-12-01,December 2020,"2020 IEEE Global Communications Conference, GLOBECOM 2020 - Proceedings",,21101036128,,Conference Proceeding,,,9322147,,,,1,0,,,,,
8,2-s2.0-85097470965,10.1016/j.heliyon.2020.e05652,S2405844020324956,,Improving Alzheimer's stage categorization with Convolutional Neural Network using transfer learning and different magnetic resonance imaging modalities,ar,Article,Aderghal K.,,Université de Bordeaux;Faculté des Sciences - Agadir,Bordeaux;Agadir,France;Morocco,,,,,2020-12-01,December 2020,Heliyon,24058440,21100411756,,Journal,6,12,e05652,,,,13,1,repositoryvor,Green,,,
9,2-s2.0-85094974458,10.1016/j.visinf.2020.09.005,S2468502X2030036X,,On visualization techniques comparison for large social networks overview: A user experiment,ar,Article,Pinaud B.,,Laboratoire Bordelais de Recherche en Informatique,Talence,France,,,,,2020-12-01,December 2020,Visual Informatics,25432656,21100907392,2468502X,Journal,4,4,,23-34,,,3,1,repositoryam,Green,,,
10,2-s2.0-85091397233,10.1038/s41467-020-18766-1,,32973140,"Publisher Correction: Reconciling qualitative, abstract, and scalable modeling of biological networks (Nature Communications, (2020), 11, 1, (4256), 10.1038/s41467-020-18112-5)",er,Erratum,Paulevé L.,,Laboratoire de Recherche en Informatique;Université de Bordeaux,Gif-sur-Yvette;Bordeaux,France;France,,,,,2020-12-01,1 December 2020,Nature Communications,,19700182758,20411723,Journal,11,1,4900,,,,0,1,publisherfullgold,Gold,,,
11,2-s2.0-85090322702,10.1016/j.adhoc.2020.102292,S157087052030651X,,Cross-layer adaptive multipath routing for multimedia Wireless Sensor Networks under duty cycle mode,ar,Article,Jemili I.,,University of Carthage,Carthage,Tunisia,,,,,2020-12-01,1 December 2020,Ad Hoc Networks,15708705,26799,,Journal,109,,102292,,,,13,0,,,,,
12,2-s2.0-85089874072,10.1038/s41467-020-18112-5,,32848126,"Reconciling qualitative, abstract, and scalable modeling of biological networks",ar,Article,Paulevé L.,,Laboratoire de Recherche en Informatique;Université de Bordeaux,Gif-sur-Yvette;Bordeaux,France;France,,,,,2020-12-01,1 December 2020,Nature Communications,,19700182758,20411723,Journal,11,1,4256,,,,14,1,repositoryam,Green,,,
13,2-s2.0-85089667859,10.1016/j.ic.2020.104604,S0890540120300924,,Perfect failure detection with very few bits,ar,Article,Fraigniaud P.,,Université Paris Cité,Paris,France,,,,,2020-12-01,December 2020,Information and Computation,08905401,25509,10902651,Journal,275,,104604,,,,0,1,repositoryam,Green,,,
14,2-s2.0-85089570189,10.1007/s13218-020-00680-9,,,A Short Survey on Inconsistency Handling in Ontology-Mediated Query Answering,ar,Article,Bienvenu M.,,Université de Bordeaux,Bordeaux,France,,,,,2020-12-01,December 2020,KI - Kunstliche Intelligenz,09331875,21101017166,16101987,Journal,34,4,,443-451,,,5,0,repositoryam,Green,,,
15,2-s2.0-85087317470,10.1016/j.jcss.2020.06.004,S0022000020300635,,"Selected papers of the 21st International Symposium on Fundamentals of Computation Theory, FCT 2017",ed,Editorial,Klasing R.,,Université de Bordeaux,Bordeaux,France,,,,,2020-12-01,December 2020,Journal of Computer and System Sciences,00220000,12370,10902724,Journal,114,,,105-106,,,0,0,,,,,
16,2-s2.0-85087117382,10.1038/s41598-020-67581-7,,32606432,"Author Correction: Multimodal hippocampal subfield grading for Alzheimer’s disease classification (Scientific Reports, (2019), 9, 1, (13845), 10.1038/s41598-019-49970-9)",er,Erratum,Hett K.,,Laboratoire Bordelais de Recherche en Informatique;Université de Bordeaux;CNRS Centre National de la Recherche Scientifique,Talence;Bordeaux;Paris,France;France;France,,,,,2020-12-01,1 December 2020,Scientific Reports,,21100200805,20452322,Journal,10,1,10969,,,,0,1,repositoryvor,Green,,,
17,2-s2.0-85088974058,10.1016/j.tcs.2020.07.003,S0304397520303789,,Exploration of carrier-based time-varying networks: The power of waiting,ar,Article,Ilcinkas D.,,Université de Bordeaux,Bordeaux,France,,,,,2020-11-12,12 November 2020,Theoretical Computer Science,03043975,20571,,Journal,841,,,50-61,,,0,0,repositoryam,Green,,,
18,2-s2.0-85097148796,10.1088/1361-6560/abb6be,,,RegQCNET: Deep quality control for image-to-template brain MRI affine registration,ar,Article,Denis De Senneville B.,,Université de Bordeaux,Bordeaux,France,,,,,2020-11-11,11 November 2020,Physics in Medicine and Biology,00319155,29203,13616560,Journal,65,22,225022,,,,4,0,repositoryam,Green,,,
19,2-s2.0-85099312870,10.1109/IPTA50016.2020.9286657,,,Predicting Brain Degeneration with a Multimodal Siamese Neural Network <sup>*</sup>,cp,Conference Paper,Ostertag C.,,La Rochelle Université,La Rochelle,France,,,,,2020-11-09,9 November 2020,"2020 10th International Conference on Image Processing Theory, Tools and Applications, IPTA 2020",,21101033874,,Conference Proceeding,,,9286657,,,,0,0,repositoryam,Green,,,
20,2-s2.0-85099300586,10.1109/IPTA50016.2020.9286629,,,Features Understanding in 3D CNNs for Actions Recognition in Video,cp,Conference Paper,Ahmed Asif Fuad K.,,Université de Bordeaux,Bordeaux,France,,,,,2020-11-09,9 November 2020,"2020 10th International Conference on Image Processing Theory, Tools and Applications, IPTA 2020",,21101033874,,Conference Proceeding,,,9286629,,,,4,0,,,,,
21,2-s2.0-85099298316,10.1109/IPTA50016.2020.9286693,,,Detection of asian hornet's nest on drone acquired FLIR and color images using deep learning methods,cp,Conference Paper,Shams T.,,Université de Bordeaux,Bordeaux,France,,,,,2020-11-09,9 November 2020,"2020 10th International Conference on Image Processing Theory, Tools and Applications, IPTA 2020",,21101033874,,Conference Proceeding,,,9286693,,,,1,0,,,,,
22,2-s2.0-85115878678,10.4230/OASIcs.ATMOS.2020.11,,,Framing algorithms for approximate multicriteria shortest paths,cp,Conference Paper,Hanusse N.,,Université de Bordeaux,Bordeaux,France,,,,,2020-11-01,November 2020,OpenAccess Series in Informatics,21906807,21100235606,,Conference Proceeding,85,,11,,,,0,0,,,,,
23,2-s2.0-85099601164,10.1109/PDSW51947.2020.00007,,,Towards On-Demand I/O Forwarding in HPC Platforms,cp,Conference Paper,Bez J.L.,,Universidade Federal do Rio Grande do Sul,Porto Alegre,Brazil,,,,,2020-11-01,November 2020,"Proceedings of PDSW 2020: IEEE/ACM 5th International Parallel Data Systems Workshop, Held in conjunction with SC 2020: The International Conference for High Performance Computing, Networking, Storage and Analysis",,21101080529,,Conference Proceeding,,,9307161,7-14,,,1,0,repositoryam,Green,,,
24,2-s2.0-85099367011,10.1109/Correctness51934.2020.00009,,,PARCOACH Extension for Static MPI Nonblocking and Persistent Communication Validation,cp,Conference Paper,Nguyen V.M.,,Université de Bordeaux;INRIA Institut National de Recherche en Informatique et en Automatique;Commissariat a L'Energie Atomique CEA,Bordeaux;Le Chesnay;Gif-sur-Yvette,France;France;France,,,,,2020-11-01,November 2020,"Proceedings of Correctness 2020: 4th International Workshop on Software Correctness for HPC Applications, Held in conjunction with SC 2020: The International Conference for High Performance Computing, Networking, Storage and Analysis",,21101033906,,Conference Proceeding,,,9296940,31-39,,,1,0,repositoryam,Green,,,
25,2-s2.0-85098791267,10.1109/FOCS46700.2020.00060,,,Adjacency labelling for planar graphs (and beyond),cp,Conference Paper,Dujmovic V.,,University of Ottawa,Ottawa,Canada,,,,,2020-11-01,November 2020,"Proceedings - Annual IEEE Symposium on Foundations of Computer Science, FOCS",02725428,21100474207,,Conference Proceeding,2020-November,,9317884,577-588,,,6,0,repositoryam,Green,,,
26,2-s2.0-85097112207,10.1145/3424908,,,Semantic Optimization of Conjunctive Queries,ar,Article,Barceló P.,,Pontificia Universidad Católica de Chile,Santiago,Chile,,,,,2020-11-01,November 2020,Journal of the ACM,00045411,23127,1557735X,Journal,67,6,34,,,,2,0,repositoryam,Green,,,
27,2-s2.0-85095961806,10.3390/v12111256,,33167335,"Art-treated patients exhibit an adaptive immune response against the hfvac peptides, a potential hiv-1 therapeutic vaccine (Provir/latitude45 study)",ar,Article,Fleury H.,,Université de Bordeaux;Centre Hospitalier Universitaire de Bordeaux,Bordeaux;Talence,France;France,,,,,2020-11-01,November 2020,Viruses,,19700188364,19994915,Journal,12,11,1256,,,,0,1,repositoryvor,Green,,,
28,2-s2.0-85094630398,10.1007/s00012-020-00690-6,,,Affine completeness of the algebra of full binary trees,ar,Article,Arnold A.,,Université de Bordeaux,Bordeaux,France,,,,,2020-11-01,1 November 2020,Algebra Universalis,00025240,24618,14208911,Journal,81,4,55,,,,1,0,,,,,
29,2-s2.0-85091971536,10.1016/j.ecoinf.2020.101175,S1574954120301254,,Automated landmarking for insects morphometric analysis using deep neural networks,ar,Article,Le V.L.,,Université de Bordeaux;INRIA Institut National de Recherche en Informatique et en Automatique,Bordeaux;Le Chesnay,France;France,,,,,2020-11-01,November 2020,Ecological Informatics,15749541,3100147401,,Journal,60,,101175,,,,2,0,repositoryam,Green,,,
30,2-s2.0-85088248244,10.1016/j.future.2020.05.005,S0167739X20300856,,Adaptive request scheduling for the I/O forwarding layer using reinforcement learning,ar,Article,Bez J.L.,,Centro Nacional de Supercomputación;Universidade Federal do Rio Grande do Sul,Barcelona;Porto Alegre,Spain;Brazil,,,,,2020-11-01,November 2020,Future Generation Computer Systems,0167739X,12264,,Journal,112,,,1156-1169,,,1,0,repositoryam,Green,,,
31,2-s2.0-85087645822,10.1007/s00493-019-4014-3,,,Degeneracy and Colorings of Squares of Planar Graphs without 4-Cycles,ar,Article,Choi I.,,Hankuk University of Foreign Studies,Seoul,South Korea,,,,,2020-11-01,November 2020,Combinatorica,02099683,25785,14396912,Journal,40,5,,625-653,,,0,0,repositoryam,Green,,,
32,2-s2.0-85068796707,10.7151/dmgt.2223,,,On a total version of 1-2-3 conjecture1,ar,Article,Baudon O.,,Université de Bordeaux,Bordeaux,France,,,,,2020-11-01,1 November 2020,Discussiones Mathematicae - Graph Theory,12343099,19700180503,20835892,Journal,40,4,,1175-1186,,,0,1,repositoryam,Green,,,
33,2-s2.0-85103464250,10.1109/BMSB49480.2020.9379874,,,"Multiple-source streaming over remote radio light head: A pragmatic, efficient and reliable video streaming system for 5G intra-building use cases",cp,Conference Paper,Lacaud M.,,Joada SAS,Bordeaux,France,,,,,2020-10-27,27 October 2020,"IEEE International Symposium on Broadband Multimedia Systems and Broadcasting, BMSB",21555044,21100218013,21555052,Conference Proceeding,2020-October,,9379874,,,,0,0,,,,,
34,2-s2.0-85086135132,10.1016/j.tcs.2020.05.033,S0304397520303169,,Diameter of colorings under Kempe changes,ar,Article,Bonamy M.,,Université de Bordeaux,Bordeaux,France,,,,,2020-10-24,24 October 2020,Theoretical Computer Science,03043975,20571,,Journal,838,,,45-57,,,1,1,publisherfree2read,Bronze,,,
35,2-s2.0-85086381728,10.1016/j.dam.2020.06.007,S0166218X20303024,,Distinguishing numbers and distinguishing indices of oriented graphs,ar,Article,Meslem K.,,Université des Sciences et de la Technologie Houari Boumediene,Algiers,Algeria,,,,,2020-10-15,15 October 2020,Discrete Applied Mathematics,0166218X,25890,,Journal,285,,,330-342,,,2,1,repositoryam,Green,,,
36,2-s2.0-85098112630,10.1109/IPTComm50535.2020.9261558,,,VaVite: Verifiable Information Exchange for Virtual Asset Service Providers,cp,Conference Paper,Tumas V.,,University of Luxembourg,Esch-sur-Alzette,Luxembourg,,,,,2020-10-13,13 October 2020,"2020 Principles, Systems and Applications of IP Telecommunications, IPTComm 2020",,21101080996,,Conference Proceeding,,,9261558,,,,0,0,repositoryam,Green,,,
37,2-s2.0-85098864990,10.1109/SMC42975.2020.9283108,,,Towards measuring states of epistemic curiosity through electroencephalographic signals,cp,Conference Paper,Appriou A.,,Université de Bordeaux,Bordeaux,France,,,,,2020-10-11,11 October 2020,"Conference Proceedings - IEEE International Conference on Systems, Man and Cybernetics",1062922X,145097,,Conference Proceeding,2020-October,,9283108,4006-4011,,,0,0,repositoryam,Green,,,
38,2-s2.0-85098846334,10.1109/SMC42975.2020.9283307,,,Assessing the Relevance of Neurophysiological Patterns to Predict Motor Imagery-based BCI Users' Performance,cp,Conference Paper,Tzdaka E.,,INRIA Institut National de Recherche en Informatique et en Automatique,Le Chesnay,France,,,,,2020-10-11,11 October 2020,"Conference Proceedings - IEEE International Conference on Systems, Man and Cybernetics",1062922X,145097,,Conference Proceeding,2020-October,,9283307,2490-2495,,,1,0,repositoryam,Green,,,
39,2-s2.0-85097981993,10.1109/DASC50938.2020.9256773,,,Resilience by design is mandatory to support the certification of the embedded/artificial intelligence of an autonomous swarm of drones,cp,Conference Paper,Chaumette S.,,Université de Bordeaux,Bordeaux,France,,,,,2020-10-11,11 October 2020,AIAA/IEEE Digital Avionics Systems Conference - Proceedings,21557195,110368,21557209,Conference Proceeding,2020-October,,9256773,,,,0,0,,,,,
40,2-s2.0-85104408565,10.2991/IJNDC.K.200829.001,,,"Vehicle platooning systems: Review, classification and validation strategies",ar,Article,Fakhfakh F.,,FSEG Sfax - Faculté des Sciences Économiques et de Gestion de Sfax,Sfax,Tunisia,,,,,2020-10-01,October 2020,International Journal of Networked and Distributed Computing,22117938,21100812152,22117946,Journal,8,4,,203-213,,,2,1,publisherfullgold,Gold,,,
41,2-s2.0-85091592915,10.1109/ICST46399.2020.00026,,,Fostering the Diversity of Exploratory Testing in Web Applications,cp,Conference Paper,Leveau J.,,Université de Bordeaux,Bordeaux,France,,,,,2020-10-01,October 2020,"Proceedings - 2020 IEEE 13th International Conference on Software Testing, Verification and Validation, ICST 2020",,21101022125,,Conference Proceeding,,,9159101,164-174,,,0,0,repositoryam,Green,,,
42,2-s2.0-85088213461,10.1016/j.aam.2020.102080,S019688582030083X,,"New invariants for permutations, orders and graphs",ar,Article,Aval J.C.,,Université de Bordeaux,Bordeaux,France,,,,,2020-10-01,October 2020,Advances in Applied Mathematics,01968858,24556,10902074,Journal,121,,102080,,,,2,0,repositoryam,Green,,,
43,2-s2.0-85086132276,10.1016/j.neuroimage.2020.117026,S1053811920305127,32522665,AssemblyNet: A large ensemble of CNNs for 3D whole brain MRI segmentation,ar,Article,Coupé P.,,Université de Bordeaux,Bordeaux,France,,,,,2020-10-01,1 October 2020,NeuroImage,10538119,17495,10959572,Journal,219,,117026,,,,23,1,repositoryam,Green,,,
44,2-s2.0-85082831519,10.1016/j.dam.2020.03.029,S0166218X20301281,,Complexity of planar signed graph homomorphisms to cycles,ar,Article,Dross F.,,"University of Warsaw, Institute of Informatics;Laboratoire d'Informatique, Signaux et Systèmes de Sophia-Antipolis",Warsaw;Sophia Antipolis,Poland;France,,,,,2020-09-30,30 September 2020,Discrete Applied Mathematics,0166218X,25890,,Journal,284,,,166-178,,,4,1,repositoryam,Green,,,
45,2-s2.0-85082409500,10.1016/j.dam.2020.03.025,S0166218X20301189,,Domination and location in twin-free digraphs,ar,Article,Foucaud F.,,Université de Bordeaux;Universite d'Orleans,Bordeaux;Orleans,France;France,,,,,2020-09-30,30 September 2020,Discrete Applied Mathematics,0166218X,25890,,Journal,284,,,42-52,,,1,1,repositoryam,Green,,,
46,2-s2.0-85093940549,10.1145/3416315.3416319,,,Collectives and Communicators: A Case for Orthogonality: (Or: How to get rid of MPI neighbor and enhance Cartesian collectives),cp,Conference Paper,Träff J.L.,,Technische Universität Wien,Vienna,Austria,,,,,2020-09-21,21 September 2020,ACM International Conference Proceeding Series,,11600154611,,Conference Proceeding,,,,31-38,,,0,0,,,,,
47,2-s2.0-85096534399,10.23919/SoftCOM50211.2020.9238196,,,Comparative Case Study of Plan-Driven and Agile Approaches in Student Computing Projects,cp,Conference Paper,Wlodarski R.,,Lodz University of Technology,Lodz,Poland,,,,,2020-09-17,17 September 2020,"2020 28th International Conference on Software, Telecommunications and Computer Networks, SoftCOM 2020",,21101028317,,Conference Proceeding,,,9238196,,,,2,0,,,,,
48,2-s2.0-85081914049,10.1016/j.dam.2020.03.012,S0166218X20301049,,A connected version of the graph coloring game,ar,Article,Charpentier C.,,,,,,,,,2020-09-15,15 September 2020,Discrete Applied Mathematics,0166218X,25890,,Journal,283,,,744-750,,,1,1,repositoryam,Green,,,
49,2-s2.0-85079270123,10.1016/j.dam.2020.01.030,S0166218X20300470,,Broadcasts on paths and cycles,ar,Article,Bouchouika S.,,Université des Sciences et de la Technologie Houari Boumediene,Algiers,Algeria,,,,,2020-09-15,15 September 2020,Discrete Applied Mathematics,0166218X,25890,,Journal,283,,,375-395,,,1,1,repositoryam,Green,,,
50,2-s2.0-85100925276,10.22489/CinC.2020.126,,,Feasibility of Whole-Heart Electrophysiological Models with Near-Cellular Resolution,cp,Conference Paper,Potse M.,,Université de Bordeaux;INRIA Institut National de Recherche en Informatique et en Automatique;IHU Liryc,Bordeaux;Le Chesnay;Pessac,France;France;France,,,,,2020-09-13,13 September 2020,Computing in Cardiology,23258861,21100236007,2325887X,Conference Proceeding,2020-September,,9344453,,,,1,1,repositoryam,Green,,,
51,2-s2.0-85096378672,10.1142/S0129054120410026,,,Weak Cost Register Automata are Still Powerful,cp,Conference Paper,Almagor S.,,Technion - Israel Institute of Technology,Haifa,Israel,,,,,2020-09-01,1 September 2020,International Journal of Foundations of Computer Science,01290541,4700152641,,Journal,31,6,,689-709,,,0,0,repositoryam,Green,,,
52,2-s2.0-85092243945,10.1142/S0219649220500215,,,Using Semantic Web Technologies and Multi-agent System for Multi-dimensional Analysis of Open Health Data,ar,Article,El Hajjami S.,,Université Sidi Mohamed Ben Abdellah,Fez,Morocco,,,,,2020-09-01,1 September 2020,Journal of Information and Knowledge Management,02196492,21100237436,,Journal,19,3,2050021,,,,3,0,,,,,
53,2-s2.0-85089527989,10.1016/j.isci.2020.101389,S2589004220305770,,HASLR: Fast Hybrid Assembly of Long Reads,ar,Article,Haghshenas E.,,Vancouver Prostate Centre;Simon Fraser University,Vancouver;Burnaby,Canada;Canada,,,,,2020-08-21,21 August 2020,iScience,,21100907125,25890042,Journal,23,8,101389,,,,8,1,repositoryam,Green,,,
54,2-s2.0-85085001075,10.1016/j.jns.2020.116929,S0022510X20302665,32460145,Effect of cognitive rehabilitation on neuropsychological and semiecological testing and on daily cognitive functioning in multiple sclerosis: The REACTIV randomized controlled study,ar,Article,Lamargue D.,,Neurocentre Magendie;Université de Bordeaux,Bordeaux;Bordeaux,France;France,,,,,2020-08-15,15 August 2020,Journal of the Neurological Sciences,0022510X,16820,18785883,Journal,415,,116929,,,,3,0,,,,,
55,2-s2.0-85052808595,10.1002/cpe.4907,,,Efficient monitoring for intrusion detection in wireless sensor networks,cp,Conference Paper,Abdellatif T.,,Polytechnic School of Tunisia,La Marsa,Tunisia,,,,,2020-08-10,10 August 2020,Concurrency and Computation: Practice and Experience,15320626,27871,15320634,Journal,32,15,e4907,,,,7,0,,,,,
56,2-s2.0-85089170655,10.1172/jci.insight.137869,,32759499,Inhibition of DDR1 enhances in vivo chemosensitivity in KRAS-mutant lung adenocarcinoma,ar,Article,Nokin M.J.,,Université de Bordeaux,Bordeaux,France,,,,,2020-08-06,6 August 2020,JCI Insight,,21100894518,23793708,Journal,5,15,e137869,,,,4,1,repositoryvor,Green,,,
57,2-s2.0-85093852110,10.1109/ICCCN49398.2020.9209661,,,A Scalable Blockchain-based Approach for Authentication and Access Control in Software Defined Vehicular Networks,cp,Conference Paper,Mendiboure L.,,Université de Bordeaux,Bordeaux,France,,,,,2020-08-01,August 2020,"Proceedings - International Conference on Computer Communications and Networks, ICCCN",10952055,145205,,Conference Proceeding,2020-August,,9209661,,,,4,0,,,,,
58,2-s2.0-85092759863,10.4230/LIPIcs.WABI.2020.11,,,A graph-theoretic barcode ordering model for linked-reads,cp,Conference Paper,Dufresne Y.,,"Institut Pasteur, Paris",Paris,France,,,,,2020-08-01,1 August 2020,"Leibniz International Proceedings in Informatics, LIPIcs",18688969,21100244929,,Conference Proceeding,172,,11,,,,0,0,,,,,
59,2-s2.0-85092474207,10.4230/LIPIcs.ESA.2020.24,,,Reconfiguration of spanning trees with many or few leaves,cp,Conference Paper,Bousquet N.,,Université Claude Bernard Lyon 1,Villeurbanne,France,,,,,2020-08-01,1 August 2020,"Leibniz International Proceedings in Informatics, LIPIcs",18688969,21100244929,,Conference Proceeding,173,,24,,,,1,0,,,,,
60,2-s2.0-85091599672,10.4230/LIPIcs.CONCUR.2020.37,,,Reachability in two-dimensional vector addition systems with states: One test is for free,cp,Conference Paper,Leroux J.,,Université de Bordeaux,Bordeaux,France,,,,,2020-08-01,1 August 2020,"Leibniz International Proceedings in Informatics, LIPIcs",18688969,21100244929,,Conference Proceeding,171,,37,371-3717,,,1,0,,,,,
61,2-s2.0-85091576800,10.4230/LIPIcs.CONCUR.2020.9,,,Characterizing consensus in the heard-of model,cp,Conference Paper,Balasubramanian A.R.,,Technical University of Munich,Munich,Germany,,,,,2020-08-01,1 August 2020,"Leibniz International Proceedings in Informatics, LIPIcs",18688969,21100244929,,Conference Proceeding,171,,9,91-918,,,0,0,,,,,
62,2-s2.0-85091574784,10.4230/LIPIcs.CONCUR.2020.19,,,Wreath/cascade products and related decomposition results for the concurrent setting of Mazurkiewicz traces,cp,Conference Paper,Adsul B.,,Indian Institute of Technology Bombay,Mumbai,India,,,,,2020-08-01,1 August 2020,"Leibniz International Proceedings in Informatics, LIPIcs",18688969,21100244929,,Conference Proceeding,171,,19,191-1917,,,1,0,,,,,
63,2-s2.0-85091572267,10.4230/LIPIcs.CONCUR.2020.36,,,Universality problem for unambiguous VASS,cp,Conference Paper,Czerwiński W.,,University of Warsaw,Warsaw,Poland,,,,,2020-08-01,1 August 2020,"Leibniz International Proceedings in Informatics, LIPIcs",18688969,21100244929,,Conference Proceeding,171,,36,361-3615,,,2,0,,,,,
64,2-s2.0-85090510129,10.4230/LIPIcs.MFCS.2020.34,,,Value iteration using universal graphs and the complexity of mean payoff games,cp,Conference Paper,Fijalkow N.,,Alan Turing Institute;CNRS Centre National de la Recherche Scientifique,London;Paris,United Kingdom;France,,,,,2020-08-01,1 August 2020,"Leibniz International Proceedings in Informatics, LIPIcs",18688969,21100244929,,Conference Proceeding,170,,MFCS-2020-34,,,,1,0,,,,,
65,2-s2.0-85083639112,10.1016/j.jnca.2020.102651,S1084804520301259,,Performance analyses of the IEEE 802.15.6 Wireless Body Area Network with heterogeneous traffic,ar,Article,Benmansour T.,,Université de Bordeaux;Université des Sciences et de la Technologie Houari Boumediene,Bordeaux;Algiers,France;Algeria,,,,,2020-08-01,1 August 2020,Journal of Network and Computer Applications,10848045,27277,10958592,Journal,163,,102651,,,,8,1,publisherfree2read,Bronze,,,
