,eid,doi,pii,pubmed_id,title,subtype,subtypeDescription,creator,afid,affilname,affiliation_city,affiliation_country,author_count,author_names,author_ids,author_afids,coverDate,coverDisplayDate,publicationName,issn,source_id,eIssn,aggregationType,volume,issueIdentifier,article_number,pageRange,description,authkeywords,citedby_count,openaccess,freetoread,freetoreadLabel,fund_acr,fund_no,fund_sponsor
275,2-s2.0-85072910031,10.1038/s41467-019-12528-4,,31586061,Engineering selective competitors for the discrimination of highly conserved protein-protein interaction modules,ar,Article,Rimbault C.,,Université de Bordeaux;CNRS Centre National de la Recherche Scientifique,Bordeaux;Paris,France;France,,,,,2019-12-01,1 December 2019,Nature Communications,,19700182758,20411723,Journal,10,1,4521,,,,8,1,repositoryvor,Green,,,
276,2-s2.0-85072677808,10.1038/s41598-019-49970-9,,31554909,Multimodal Hippocampal Subfield Grading For Alzheimer’s Disease Classification,ar,Article,Hett K.,,Laboratoire Bordelais de Recherche en Informatique;Université de Bordeaux;CNRS Centre National de la Recherche Scientifique,Talence;Bordeaux;Paris,France;France;France,,,,,2019-12-01,1 December 2019,Scientific Reports,,21100200805,20452322,Journal,9,1,13845,,,,15,1,repositoryam,Green,,,
277,2-s2.0-85071523221,10.1016/j.dam.2019.08.011,S0166218X19303841,,Coloring squares of graphs with mad constraints,ar,Article,Hocquard H.,,Université de Bordeaux,Bordeaux,France,,,,,2019-12-01,1 December 2019,Discrete Applied Mathematics,0166218X,25890,,Journal,271,,,64-73,,,0,1,repositoryam,Green,,,
278,2-s2.0-85068939319,10.1007/s11005-019-01194-8,,,Diagrammatic proof of the large N melonic dominance in the SYK model,ar,Article,Bonzom V.,,Institut Galilée,Villetaneuse,France,,,,,2019-12-01,1 December 2019,Letters in Mathematical Physics,03779017,28663,15730530,Journal,109,12,,2611-2624,,,6,0,repositoryam,Green,,,
279,2-s2.0-85066146568,10.1007/s10664-019-09719-4,,,Fostering good coding practices through individual feedback and gamification: an industrial case study,ar,Article,Foucault M.,,University of Victoria,Victoria,Canada,,,,,2019-12-01,1 December 2019,Empirical Software Engineering,13823256,18650,15737616,Journal,24,6,,3731-3754,,,6,0,,,,,
280,2-s2.0-85065019897,10.1057/s41599-019-0241-x,,,Interaction effects between consumer information and firms' decision rules in a duopoly: how cognitive features can impact market dynamics,ar,Article,Nioche A.,,Aalto University;Université de Bordeaux;CNRS Centre National de la Recherche Scientifique;École Normale Supérieure,Espoo;Bordeaux;Paris;Paris,Finland;France;France;France,,,,,2019-12-01,1 December 2019,Palgrave Communications,,21100873453,20551045,Journal,5,1,33,,,,0,1,repositoryvor,Green,,,
281,2-s2.0-85062609219,10.1038/s41598-019-39809-8,,30850617,Lifespan Changes of the Human Brain In Alzheimer’s Disease,ar,Article,Coupé P.,,Université de Bordeaux;CNRS Centre National de la Recherche Scientifique,Bordeaux;Paris,France;France,,,,,2019-12-01,1 December 2019,Scientific Reports,,21100200805,20452322,Journal,9,1,3998,,,,41,1,repositoryam,Green,,,
282,2-s2.0-85076682655,10.3389/fmicb.2019.02701,,,Multiple Origins and Specific Evolution of CRISPR/Cas9 Systems in Minimal Bacteria (Mollicutes),ar,Article,Ipoutcha T.,,Biologie du Fruit et Pathologie;Université de Bordeaux,Villenave-d'Ornon;Bordeaux,France;France,,,,,2019-11-21,21 November 2019,Frontiers in Microbiology,,21100226442,1664302X,Journal,10,,2701,,,,11,1,repositoryam,Green,,,
283,2-s2.0-85082690173,10.1109/AICCSA47632.2019.9035321,,,Arabic text-based video indexing and retrieval system enhanced by semantic content and relevance feedback,cp,Conference Paper,Lajmi S.,,Al Baha University;University of Sfax,Al-Baha;Sfax,Saudi Arabia;Tunisia,,,,,2019-11-01,November 2019,"Proceedings of IEEE/ACS International Conference on Computer Systems and Applications, AICCSA",21615322,21100198533,21615330,Conference Proceeding,2019-November,,9035321,,,,1,0,,,,,
284,2-s2.0-85081081259,10.1109/ICTAI.2019.00014,,,Synthesis of boolean networks from biological dynamical constraints using answer-set programming,cp,Conference Paper,Chevalier S.,,CNRS Centre National de la Recherche Scientifique,Paris,France,,,,,2019-11-01,November 2019,"Proceedings - International Conference on Tools with Artificial Intelligence, ICTAI",10823409,145117,,Conference Proceeding,2019-November,,8995442,34-41,,,5,0,repositoryam,Green,,,
285,2-s2.0-85078706233,10.1109/ScalA49573.2019.00013,,,Making Speculative Scheduling Robust to Incomplete Data,cp,Conference Paper,Gainaru A.,,Vanderbilt University,Nashville,United States,,,,,2019-11-01,November 2019,"Proceedings of ScalA 2019: 10th Workshop on Latest Advances in Scalable Algorithms for Large-Scale Systems - Held in conjunction with SC 2019: The International Conference for High Performance Computing, Networking, Storage and Analysis",,21100946847,,Conference Proceeding,,,8948696,62-71,,,2,0,repositoryam,Green,,,
286,2-s2.0-85077966322,10.1109/IPTA.2019.8936099,,,A Deep Learning based Framework for UAV Trajectory Pattern Recognition,cp,Conference Paper,Pan X.,,Université de Bordeaux,Bordeaux,France,,,,,2019-11-01,November 2019,"2019 9th International Conference on Image Processing Theory, Tools and Applications, IPTA 2019",,21100942238,,Conference Proceeding,,,8936099,,,,1,0,repositoryvor,Green,,,
287,2-s2.0-85077953240,10.1109/IPTA.2019.8936125,,,Forward-backward visual saliency propagation in Deep NNs vs internal attentional mechanisms,cp,Conference Paper,Obeso A.M.,,Université de Bordeaux;Instituto Politécnico Nacional,Bordeaux;Mexico City,France;Mexico,,,,,2019-11-01,November 2019,"2019 9th International Conference on Image Processing Theory, Tools and Applications, IPTA 2019",,21100942238,,Conference Proceeding,,,8936125,,,,4,0,,,,,
288,2-s2.0-85075592381,10.1145/3356339,,,Adding successor: A transfer theorem for separation and covering,ar,Article,Place T.,,Université de Bordeaux,Bordeaux,France,,,,,2019-11-01,November 2019,ACM Transactions on Computational Logic,15293785,23051,1557945X,Journal,21,2,9,,,,2,0,,,,,
289,2-s2.0-85074060185,10.1111/acps.13087,,31418816,Cerebellar parcellation in schizophrenia and bipolar disorder,ar,Article,Laidi C.,,FondaMental Foundation;Institut Mondor de Recherche Biomédicale;Universite Paris-Saclay;AP-HP Assistance Publique - Hopitaux de Paris,Creteil;Creteil;Saint-Aubin;Paris,France;France;France;France,,,,,2019-11-01,1 November 2019,Acta Psychiatrica Scandinavica,0001690X,17574,16000447,Journal,140,5,,468-476,,,7,0,repositoryam,Green,,,
290,2-s2.0-85073766243,10.1016/j.dam.2019.07.019,S0166218X1930335X,,Edge weights and vertex colours: Minimizing sum count,ar,Article,Baudon O.,,Université de Bordeaux,Bordeaux,France,,,,,2019-11-01,1 November 2019,Discrete Applied Mathematics,0166218X,25890,,Journal,270,,,13-24,,,8,1,repositoryam,Green,,,
291,2-s2.0-85068615631,10.1177/1094342019860184,,,Study on progress threads placement and dedicated cores for overlapping MPI nonblocking collectives on manycore processor,ar,Article,Denis A.,,INRIA Institut National de Recherche en Informatique et en Automatique,Le Chesnay,France,,,,,2019-11-01,1 November 2019,International Journal of High Performance Computing Applications,10943420,19268,17412846,Journal,33,6,,1240-1254,,,2,0,repositoryam,Green,,,
292,2-s2.0-85066855626,10.1177/1094342019847263,,,Modeling high-throughput applications for in situ analytics,ar,Article,Aupy G.,,Université de Bordeaux,Bordeaux,France,,,,,2019-11-01,1 November 2019,International Journal of High Performance Computing Applications,10943420,19268,17412846,Journal,33,6,,1185-1200,,,3,0,repositoryam,Green,,,
293,2-s2.0-85064550603,10.1177/1094342019841681,,,On-the-fly scheduling versus reservation-based scheduling for unpredictable workflows,ar,Article,Gainaru A.,,Vanderbilt University,Nashville,United States,,,,,2019-11-01,1 November 2019,International Journal of High Performance Computing Applications,10943420,19268,17412846,Journal,33,6,,1140-1158,,,5,0,repositoryam,Green,,,
294,2-s2.0-85070271655,10.1007/s00454-019-00113-x,,,On the Density of Sets Avoiding Parallelohedron Distance 1,ar,Article,Bachoc C.,,Université de Bordeaux,Bordeaux,France,,,,,2019-10-15,15 October 2019,Discrete and Computational Geometry,01795376,25887,14320444,Journal,62,3,,497-524,,,0,0,repositoryam,Green,,,
295,2-s2.0-85078604372,10.1080/2326263X.2019.1697143,,,Turning negative into positives! Exploiting ‘negative’ results in Brain–Machine Interface (BMI) research,ar,Article,Lotte F.,,Université de Bordeaux,Bordeaux,France,,,,,2019-10-02,2 October 2019,Brain-Computer Interfaces,2326263X,21100886426,23262621,Journal,6,4,,178-189,,,2,0,repositoryam,Green,,,
296,2-s2.0-85084151849,10.1109/SRDS47363.2019.00030,,,Emergent overlays for adaptive MANET broadcast,cp,Conference Paper,Carvajal-Gomez R.,,Université Catholique de Louvain,Louvain-la-Neuve,Belgium,,,,,2019-10-01,October 2019,Proceedings of the IEEE Symposium on Reliable Distributed Systems,10609857,12906,,Conference Proceeding,,,9049546,193-202,,,3,0,repositoryam,Green,,,
297,2-s2.0-85082494618,10.1109/ICCVW.2019.00342,,,CorNet: Generic 3D corners for 6d pose estimation of new objects without retraining,cp,Conference Paper,Pitteri G.,,Université de Bordeaux,Bordeaux,France,,,,,2019-10-01,October 2019,"Proceedings - 2019 International Conference on Computer Vision Workshop, ICCVW 2019",,21100975801,,Conference Proceeding,,,9021977,2807-2815,,,6,0,repositoryam,Green,,,
298,2-s2.0-85082473283,10.1109/ICCVW.2019.00123,,,LU-net: An efficient network for 3D LiDAR point cloud semantic segmentation based on end-to-end-learned 3D features and U-net,cp,Conference Paper,Biasutti P.,,Université de Bordeaux;Université Paris-Est;GEOSAT,Bordeaux;Marne-la-Vallee;Pessac,France;France;France,,,,,2019-10-01,October 2019,"Proceedings - 2019 International Conference on Computer Vision Workshop, ICCVW 2019",,21100975801,,Conference Proceeding,,,9022291,942-950,,,11,0,repositoryam,Green,,,
299,2-s2.0-85080368849,10.1109/ICCV.2019.00231,,,GP2C: Geometric projection parameter consensus for joint 3D pose and focal length estimation in the wild,cp,Conference Paper,Grabner A.,,Technische Universitat Graz,Graz,Austria,,,,,2019-10-01,October 2019,Proceedings of the IEEE International Conference on Computer Vision,15505499,110561,,Conference Proceeding,2019-October,,9010630,2222-2231,,,6,0,repositoryam,Green,,,
300,2-s2.0-85078889649,10.23638/LMCS-15(4:15)2019,,,On functions weakly computable by pushdown petri nets and related systems,ar,Article,Leroux J.,,Université de Bordeaux,Bordeaux,France,,,,,2019-10-01,October 2019,Logical Methods in Computer Science,,19700175752,18605974,Journal,15,4,,15:1-15:26,,,1,0,,,,,
301,2-s2.0-85078708301,10.23638/LMCS-15(4:14)2019,,,Definable isomorphism problem,ar,Article,Keshvardoost K.,,Velayat University,Iranshahr,Iran,,,,,2019-10-01,October 2019,Logical Methods in Computer Science,,19700175752,18605974,Journal,15,4,,14:1-14:19,,,0,0,,,,,
302,2-s2.0-85078696481,10.23638/LMCS-15(4:16)2019,,,Logical and algebraic characterizations of rational transductions,ar,Article,Filiot E.,,Université Libre de Bruxelles,Brussels,Belgium,,,,,2019-10-01,October 2019,Logical Methods in Computer Science,,19700175752,18605974,Journal,15,4,,16:1-16:42,,,2,0,,,,,
303,2-s2.0-85075956160,10.1109/SPED.2019.8906577,,,Sleepiness detection on read speech using simple features,cp,Conference Paper,Martin V.P.,,Université de Bordeaux,Bordeaux,France,,,,,2019-10-01,October 2019,"2019 10th International Conference on Speech Technology and Human-Computer Dialogue, SpeD 2019",,21100960003,,Conference Proceeding,,,8906577,,,,6,0,repositoryam,Green,,,
304,2-s2.0-85075450282,10.1613/jair.1.11741,,,Community structure in industrial SAT instances,ar,Article,Ansótegui C.,,DIEI,Lleida,Spain,,,,,2019-10-01,1 October 2019,Journal of Artificial Intelligence Research,10769757,24330,,Journal,66,,,443-472,,,7,1,repositoryam,Green,,,
305,2-s2.0-85074606900,10.4230/LIPIcs.DISC.2019.3,,,Long-lived counters with polylogarithmic amortized step complexity,cp,Conference Paper,Baig M.A.,,"ReLaX, Research Lab in Computer Science;Laboratoire Bordelais de Recherche en Informatique;Chennai Mathematical Institute",Siruseri;Talence;Kelambakkam,India;France;India,,,,,2019-10-01,October 2019,"Leibniz International Proceedings in Informatics, LIPIcs",18688969,21100244929,,Conference Proceeding,146,,3,,,,2,0,,,,,
306,2-s2.0-85066304924,10.1016/j.jpdc.2019.05.006,S0743731519303934,,Disconnected components detection and rooted shortest-path tree maintenance in networks,ar,Article,Glacet C.,,Université de Bordeaux,Bordeaux,France,,,,,2019-10-01,October 2019,Journal of Parallel and Distributed Computing,07437315,25621,,Journal,132,,,299-309,,,1,1,repositoryam,Green,,,
307,2-s2.0-85053932631,10.1016/j.tcs.2018.09.017,S0304397518305887,,From Hadamard expressions to weighted rotating automata and back,ar,Article,Dando L.M.,,Université de Bordeaux,Bordeaux,France,,,,,2019-10-01,1 October 2019,Theoretical Computer Science,03043975,20571,,Journal,787,,,28-44,,,0,1,publisherfree2read,Bronze,,,
308,2-s2.0-85075898314,10.1145/3357526.3357546,,,M&amp;MMs: Navigating complex memory spaces with hwloc,cp,Conference Paper,León E.A.,,Lawrence Livermore National Laboratory,Livermore,United States,,,,,2019-09-30,30 September 2019,ACM International Conference Proceeding Series,,11600154611,,Conference Proceeding,,,,149-155,,,1,1,repositoryam,Green,,,
309,2-s2.0-85074791391,10.1145/3352631.3352646,,,Papy-s-Net: A Siamese Network to match papyrus fragments,cp,Conference Paper,Pirrone A.,,Université de Bordeaux,Bordeaux,France,,,,,2019-09-20,20 September 2019,ACM International Conference Proceeding Series,,11600154611,,Conference Proceeding,,,,78-83,,,5,0,repositoryvor,Green,,,
310,2-s2.0-85075890172,10.1145/3343211.3343213,,,"Exposition, Clarification, and Expansion of MPI Semantic Terms and Conventions Is a nonblocking MPI function permitted to block?",cp,Conference Paper,Bangalore P.V.,,The University of Alabama at Birmingham,Birmingham,United States,,,,,2019-09-11,11 September 2019,ACM International Conference Proceeding Series,,11600154611,,Conference Proceeding,,,a2,,,,3,1,publisherfree2read,Bronze,,,
311,2-s2.0-85074043960,,,,A brooks-like result for graph powers,ar,Article,Pierron T.,,Université de Bordeaux,Bordeaux,France,,,,,2019-09-02,2 September 2019,Acta Mathematica Universitatis Comenianae,08629544,76019,13360310,Journal,88,3,,1003-1007,,,0,0,,,,,
312,2-s2.0-85084744604,10.1109/DASC43569.2019.9081771,,,Detection of Clone Attacks in Swarms of Autonomous Aircraft Systems - Position Paper - Position P,cp,Conference Paper,Bounab B.,,Université de Bordeaux,Bordeaux,France,,,,,2019-09-01,September 2019,AIAA/IEEE Digital Avionics Systems Conference - Proceedings,21557195,110368,21557209,Conference Proceeding,2019-September,,9081771,,,,0,0,,,,,
313,2-s2.0-85077191072,10.1109/ICSME.2019.00086,,,Handling Duplicates in Dockerfiles Families: Learning from Experts,cp,Conference Paper,Oumaziz M.A.,,Université de Bordeaux,Bordeaux,France,,,,,2019-09-01,September 2019,"Proceedings - 2019 IEEE International Conference on Software Maintenance and Evolution, ICSME 2019",,21100954470,,Conference Proceeding,,,8919205,524-535,,,4,0,repositoryam,Green,,,
314,2-s2.0-85076815793,10.1109/ICIP.2019.8803780,,,Optimal Choice of Motion Estimation Methods for Fine-Grained Action Classification with 3D Convolutional Networks,cp,Conference Paper,Martin P.E.,,Université de Bordeaux,Bordeaux,France,,,,,2019-09-01,September 2019,"Proceedings - International Conference on Image Processing, ICIP",15224880,144684,,Conference Proceeding,2019-September,,8803780,554-558,,,13,0,repositoryam,Green,,,
315,2-s2.0-85076814296,10.1109/ICIP.2019.8803382,,,Fine-Grained Action Detection and Classification in Table Tennis with Siamese Spatio-Temporal Convolutional Neural Network,cp,Conference Paper,Martin P.E.,,Université de Bordeaux,Bordeaux,France,,,,,2019-09-01,September 2019,"Proceedings - International Conference on Image Processing, ICIP",15224880,144684,,Conference Proceeding,2019-September,,8803382,3027-3028,,,4,0,repositoryam,Green,,,
316,2-s2.0-85075620044,10.1109/ICIP.2019.8803085,,,Texture-Aware Superpixel Segmentation,cp,Conference Paper,Giraud R.,,Université de Bordeaux,Bordeaux,France,,,,,2019-09-01,September 2019,"Proceedings - International Conference on Image Processing, ICIP",15224880,144684,,Conference Proceeding,2019-September,,8803085,1465-1469,,,3,0,repositoryam,Green,,,
317,2-s2.0-85075260994,10.1109/VTCFall.2019.8891151,,,A SDN-Based Pub/Sub middleware for geographic content dissemination in internet of vehicles,cp,Conference Paper,Mendiboure L.,,Université de Bordeaux,Bordeaux,France,,,,,2019-09-01,September 2019,IEEE Vehicular Technology Conference,15502252,23922,,Conference Proceeding,2019-September,,8891151,,,,4,0,,,,,
318,2-s2.0-85074980198,10.1109/3DV.2019.00073,,,On Object Symmetries and 6D Pose Estimation from Images,cp,Conference Paper,Pitteri G.,,Université de Bordeaux,Bordeaux,France,,,,,2019-09-01,September 2019,"Proceedings - 2019 International Conference on 3D Vision, 3DV 2019",,21100953697,,Conference Proceeding,,,8885689,614-622,,,11,0,repositoryam,Green,,,
319,2-s2.0-85074971728,10.1109/3DV.2019.00070,,,Location Field Descriptors: Single Image 3D Model Retrieval in the Wild,cp,Conference Paper,Grabner A.,,Technische Universitat Graz,Graz,Austria,,,,,2019-09-01,September 2019,"Proceedings - 2019 International Conference on 3D Vision, 3DV 2019",,21100953697,,Conference Proceeding,,,8885861,583-593,,,10,0,repositoryam,Green,,,
320,2-s2.0-85074967261,10.1109/3DV.2019.00063,,,Sparse-to-Dense Hypercolumn Matching for Long-Term Visual Localization,cp,Conference Paper,Germain H.,,Laboratoire Bordelais de Recherche en Informatique,Talence,France,,,,,2019-09-01,September 2019,"Proceedings - 2019 International Conference on 3D Vision, 3DV 2019",,21100953697,,Conference Proceeding,,,8885963,513-523,,,21,0,repositoryam,Green,,,
321,2-s2.0-85074368770,10.1109/CBMI.2019.8877477,,,Recognition of Alzheimer's Disease on sMRI based on 3D Multi-Scale CNN Features and a Gated Recurrent Fusion Unit,cp,Conference Paper,Bakkouri I.,,Faculté des Sciences - Agadir,Agadir,Morocco,,,,,2019-09-01,September 2019,Proceedings - International Workshop on Content-Based Multimedia Indexing,19493991,19700180519,,Conference Proceeding,2019-September,,8877477,,,,7,0,,,,,
322,2-s2.0-85074347919,10.1109/CBMI.2019.8877380,,,Dropping Activations in Convolutional Neural Networks with Visual Attention Maps,cp,Conference Paper,Obeso A.,,Instituto Politécnico Nacional,Mexico City,Mexico,,,,,2019-09-01,September 2019,Proceedings - International Workshop on Content-Based Multimedia Indexing,19493991,19700180519,,Conference Proceeding,2019-September,,8877380,,,,2,0,,,,,
323,2-s2.0-85074342484,10.1109/CBMI.2019.8877476,,,"Multi-sensing of fragile persons for risk situation detection: Devices, methods, challenges",cp,Conference Paper,Yebda T.,,Université de Bordeaux,Bordeaux,France,,,,,2019-09-01,September 2019,Proceedings - International Workshop on Content-Based Multimedia Indexing,19493991,19700180519,,Conference Proceeding,2019-September,,8877476,,,,5,0,,,,,
324,2-s2.0-85073183892,10.1109/TCBB.2019.2914383,,31056515,Algorithms for the sequential reprogramming of boolean networks,ar,Article,Mandon H.,,Universite Paris-Saclay,Saint-Aubin,France,,,,,2019-09-01,September 2019,IEEE/ACM Transactions on Computational Biology and Bioinformatics,15455963,17971,15579964,Journal,16,5,3370701,1610-1619,,,7,0,repositoryam,Green,,,
325,2-s2.0-85072388186,10.1145/3344255,,,Adaptive biometric systems: Review and perspectives,ar,Article,Pisani P.H.,,Universidade Federal do ABC,Santo Andre,Brazil,,,,,2019-09-01,September 2019,ACM Computing Surveys,03600300,23038,15577341,Journal,52,5,102,,,,12,0,,,,,
326,2-s2.0-85071724671,10.1016/j.ejmp.2019.08.022,S1120179719302029,31494371,A Geant4 simulation for three-dimensional proton imaging of microscopic samples,ar,Article,Michelet C.,,Université de Bordeaux,Bordeaux,France,,,,,2019-09-01,September 2019,Physica Medica,11201797,17037,1724191X,Journal,65,,,172-180,,,4,0,repositoryam,Green,,,
327,2-s2.0-85069715306,10.1016/j.bdr.2019.07.001,S2214579618302442,,HiePaCo: Scalable Hierarchical Exploration in Abstract Parallel Coordinates Under Budget Constraints,ar,Article,Richer G.,,Université de Bordeaux,Bordeaux,France,,,,,2019-09-01,September 2019,Big Data Research,,21100356018,22145796,Journal,17,,,1-17,,,2,0,repositoryam,Green,,,
328,2-s2.0-85063638574,10.1111/cgf.13610,,,The State of the Art in Multilayer Network Visualization,ar,Article,McGee F.,,Luxembourg Institute of Science and Technology,Esch-sur-Alzette,Luxembourg,,,,,2019-09-01,1 September 2019,Computer Graphics Forum,01677055,25023,14678659,Journal,38,6,,125-149,,,29,1,repositoryam,Green,,,
329,2-s2.0-85063536476,10.1016/j.amc.2019.03.027,S0096300319302280,,Acyclic improper choosability of subcubic graphs,ar,Article,Chen M.,,Zhejiang Normal University,Jinhua,China,,,,,2019-09-01,1 September 2019,Applied Mathematics and Computation,00963003,25170,,Journal,356,,,92-98,,,1,0,,,,,
330,2-s2.0-85057614130,10.1097/RTI.0000000000000377,,30489434,3-Dimensional Quantification of Composite Pleural Plaque Volume in Patients Exposed to Asbestos Using High-resolution Computed Tomography: A Validation Study,ar,Article,Dournes G.,,Centre d’Investigation Clinique Plurithématique de Bordeaux;Centre de Recherche Cardio-Thoracique de Bordeaux;Centre Hospitalier Universitaire de Bordeaux,Bordeaux;Pessac;Talence,France;France;France,,,,,2019-09-01,1 September 2019,Journal of Thoracic Imaging,08835993,17239,15360237,Journal,34,5,,320-325,,,3,0,,,,,
331,2-s2.0-85071651979,10.1186/s12864-019-5959-8,,31462217,Natural allelic variations of Saccharomyces cerevisiae impact stuck fermentation due to the combined effect of ethanol and temperature; A QTL-mapping study,ar,Article,Marullo P.,,Université de Bordeaux;Biolaffort,Bordeaux;Bordeaux,France;France,,,,,2019-08-28,28 August 2019,BMC Genomics,,21727,14712164,Journal,20,1,680,,,,8,1,repositoryam,Green,,,
332,2-s2.0-85072339175,10.1145/3331543.3342585,,,Screaming in the IO monad: A realtime audio processing and control experiment in Haskell,cp,Conference Paper,Janin D.,,Université de Bordeaux,Bordeaux,France,,,,,2019-08-23,23 August 2019,"FARM 2019 - Proceedings of the 7th ACM SIGPLAN International Workshop on Functional Art, Music, Modeling, and Design, co-located with ICFP 2019",,21100957784,,Conference Proceeding,,,,71-82,,,2,0,repositoryam,Green,,,
333,2-s2.0-85071431986,10.3233/SHTI190225,,31437927,No structural differences are revealed by VBM in 'de Novo' Parkinsonian patients,cp,Conference Paper,Ramírez V.M.,,Grenoble Institut des Neurosciences;Universite Grenoble Alpes,La Tronche;Saint Martin d'Heres,France;France,,,,,2019-08-21,21 August 2019,Studies in Health Technology and Informatics,09269630,19582,18798365,Book Series,264,,,268-272,,,0,0,,,,,
334,2-s2.0-85060228603,10.1007/s11265-018-1430-3,,,Fast and Flexible Software Polar List Decoders,ar,Article,Léonardon M.,,Université de Bordeaux;Polytechnique Montréal,Bordeaux;Montreal,France;Canada,,,,,2019-08-15,15 August 2019,Journal of Signal Processing Systems,19398018,11400153333,19398115,Journal,91,8,,937-952,,,9,0,repositoryam,Green,,,
335,2-s2.0-85056642184,10.1016/j.dam.2018.10.021,S0166218X18305687,,On the distinguishing number of cyclic tournaments: Towards the Albertson–Collins Conjecture,ar,Article,Meslem K.,,Université des Sciences et de la Technologie Houari Boumediene,Algiers,Algeria,,,,,2019-08-15,15 August 2019,Discrete Applied Mathematics,0166218X,25890,,Journal,266,,,219-236,,,2,0,repositoryam,Green,,,
336,2-s2.0-85061805665,10.1016/j.tcs.2019.02.009,S030439751930115X,,Counting in one-hop beeping networks,ar,Article,Casteigts A.,,Université de Bordeaux,Bordeaux,France,,,,,2019-08-09,9 August 2019,Theoretical Computer Science,03043975,20571,,Journal,780,,,20-28,,,3,1,repositoryam,Green,,,
337,2-s2.0-85071122399,10.1145/3337821.3337893,,,Data and thread placement in NUMA architectures: A statistical learning approach,cp,Conference Paper,Denoyelle N.,,Université de Bordeaux,Bordeaux,France,,,,,2019-08-05,5 August 2019,ACM International Conference Proceeding Series,,11600154611,,Conference Proceeding,,,a39,,,,4,0,repositoryvor,Green,,,
338,2-s2.0-85086998003,10.1109/TVT.2019.2924906,,,Improving driver identification for the next-generation of in-vehicle software systems,ar,Article,Mekki A.E.,,"Mohammed VI Polytechnic University;Laboratoire Informatique, Modélisation et Systèmes, Université Sidi Mohamed Ben Abdellah",Ben Guerir;Fez,Morocco;Morocco,,,,,2019-08-01,August 2019,IEEE Transactions on Vehicular Technology,00189545,17393,19399359,Journal,68,8,2924906,7406-7415,,,18,0,,,,,
339,2-s2.0-85073684917,10.1109/DEVLRN.2019.8850718,,,Learning to Parse Grounded Language using Reservoir Computing,cp,Conference Paper,Hinaut X.,,Université de Bordeaux,Bordeaux,France,,,,,2019-08-01,August 2019,"2019 Joint IEEE 9th International Conference on Development and Learning and Epigenetic Robotics, ICDL-EpiRob 2019",,21100933229,,Conference Proceeding,,,8850718,266-271,,,5,0,repositoryam,Green,,,
340,2-s2.0-85073345851,,,,Spying on instant messaging servers: Potential privacy leaks through metadata,ar,Article,Pujol A.,,Université de Bordeaux;Technological University Dublin;University College Dublin,Bordeaux;Dublin;Dublin,France;Ireland;Ireland,,,,,2019-08-01,August 2019,Transactions on Data Privacy,18885063,19700186871,20131631,Journal,12,2,,175-206,,,1,0,,,,,
