,eid,doi,pii,pubmed_id,title,subtype,subtypeDescription,creator,afid,affilname,affiliation_city,affiliation_country,author_count,author_names,author_ids,author_afids,coverDate,coverDisplayDate,publicationName,issn,source_id,eIssn,aggregationType,volume,issueIdentifier,article_number,pageRange,description,authkeywords,citedby_count,openaccess,freetoread,freetoreadLabel,fund_acr,fund_no,fund_sponsor
616,2-s2.0-85045558574,10.1016/j.disc.2018.03.012,S0012365X18300839,,List star chromatic index of sparse graphs,ar,Article,Kerdjoudj S.,,Université Blida;Université des Sciences et de la Technologie Houari Boumediene,Blida;Algiers,Algeria;Algeria,,,,,2018-07-01,July 2018,Discrete Mathematics,0012365X,25892,,Journal,341,7,,1835-1849,,,6,0,,,,,
617,2-s2.0-85045154191,10.1007/s00429-018-1659-4,,29637298,Pattern separation in the hippocampus: distinct circuits under different conditions,ar,Article,Kassab R.,,Université de Bordeaux;INRIA Institut National de Recherche en Informatique et en Automatique,Bordeaux;Le Chesnay,France;France,,,,,2018-07-01,1 July 2018,Brain Structure and Function,18632653,6600153204,18632661,Journal,223,6,,2785-2808,,,15,0,repositoryam,Green,,,
618,2-s2.0-85043538319,10.1016/j.jmaa.2018.03.016,S0022247X18302221,,A note on matrices mapping a positive vector onto its element-wise inverse,ar,Article,Labbé S.,,CNRS Centre National de la Recherche Scientifique,Paris,France,,,,,2018-07-01,1 July 2018,Journal of Mathematical Analysis and Applications,0022247X,23935,10960813,Journal,463,1,,235-241,,,0,0,repositoryam,Green,,,
619,2-s2.0-85042064178,10.1016/j.ergon.2018.02.002,S0169814117300082,,A survey on health monitoring systems for health smart homes,re,Review,Mshali H.,,Université de Bordeaux,Bordeaux,France,,,,,2018-07-01,July 2018,International Journal of Industrial Ergonomics,01698141,12385,18728219,Journal,66,,,26-56,,,110,0,repositoryam,Green,,,
620,2-s2.0-85041649785,10.1109/MMUL.2018.112142627,,,Adding a New Dimension to HTTP Adaptive Streaming Through Multiple-Source Capabilities,ar,Article,Bruneau-Queyreix J.,,Université de Bordeaux,Bordeaux,France,,,,,2018-07-01,July-September 2018,IEEE Multimedia,1070986X,25531,19410166,Journal,25,3,8259361,65-78,,,9,0,repositoryam,Green,,,
621,2-s2.0-85023750654,10.1007/s00224-017-9796-3,,,Exploration of the T-Interval-Connected Dynamic Graphs: the Case of the Ring,ar,Article,Ilcinkas D.,,Université de Bordeaux,Bordeaux,France,,,,,2018-07-01,1 July 2018,Theory of Computing Systems,14324350,20573,14330490,Journal,62,5,,1144-1160,,,14,0,repositoryam,Green,,,
622,2-s2.0-85050275693,10.1109/DAS.2018.59,,,Vocabulometer: A web platform for document and reader mutual analysis,cp,Conference Paper,Augereau O.,,Osaka Prefecture University,Sakai,Japan,,,,,2018-06-22,22 June 2018,"Proceedings - 13th IAPR International Workshop on Document Analysis Systems, DAS 2018",,21100869192,,Conference Proceeding,,,,109-114,,,5,0,repositoryam,Green,,,
623,2-s2.0-85049853910,10.1088/1741-2552/aac577,,29769435,Defining and quantifying users' mental imagery-based BCI skills: A first step,ar,Article,Lotte F.,,Université de Bordeaux;INRIA Institut National de Recherche en Informatique et en Automatique,Bordeaux;Le Chesnay,France;France,,,,,2018-06-19,19 June 2018,Journal of Neural Engineering,17412560,130164,17412552,Journal,15,4,046030,,,,22,0,repositoryam,Green,,,
624,2-s2.0-85050658155,10.1145/3204949.3208108,,,MUSLIN demo: High QoE fair multi-source live streaming,cp,Conference Paper,Da Silva S.,,Université de Bordeaux,Bordeaux,France,,,,,2018-06-12,12 June 2018,"Proceedings of the 9th ACM Multimedia Systems Conference, MMSys 2018",,21100870335,,Conference Proceeding,,,,529-532,,,2,0,,,,,
625,2-s2.0-85050600913,10.1145/3210424.3210432,,,"MUSLIN: Achieving high, fairly shared QoE through multi-Source live streaming",cp,Conference Paper,Da Silva S.,,Université de Bordeaux,Bordeaux,France,,,,,2018-06-12,12 June 2018,"Proceedings of the 23th ACM Workshop on Packet Video, PV 2018",,21100870244,,Conference Proceeding,,,,54-59,,,5,0,,,,,
626,2-s2.0-85050086358,10.1145/3205873.3205877,,,FlyMap: Interacting with maps projected from a drone,cp,Conference Paper,Brock A.M.,,Université de Bordeaux;Université Fédérale Toulouse Midi-Pyrénées,Bordeaux;Toulouse,France;France,,,,,2018-06-06,6 June 2018,PerDis 2018 - Proceedings of the 7th ACM International Symposium on Pervasive Displays,,21100868842,,Conference Proceeding,,,13,,,,28,0,repositoryvor,Green,,,
627,2-s2.0-85053877844,10.1145/3206025.3206073,,,Perceptually-guided understanding of egocentric video content: Recognition of objects to grasp,cp,Conference Paper,González-Díaz I.,,Universidad Carlos III de Madrid,Madrid,Spain,,,,,2018-06-05,5 June 2018,ICMR 2018 - Proceedings of the 2018 ACM International Conference on Multimedia Retrieval,,21100878025,,Conference Proceeding,,,,434-441,,,4,0,,,,,
628,2-s2.0-85048505766,10.1109/ICTAI.2017.00136,,,On selecting constraints for replication in model checking,cp,Conference Paper,Baud-Berthier G.,,SafeRiver,Montrouge,France,,,,,2018-06-04,4 June 2018,"Proceedings - International Conference on Tools with Artificial Intelligence, ICTAI",10823409,145117,,Conference Proceeding,2017-November,,,876-883,,,0,0,,,,,
629,2-s2.0-85049918501,10.14358/PERS.84.6.367,,,Range-image: Incorporating sensor topology for lidar point cloud processing,ar,Article,Biasutti P.,,Université de Bordeaux;IGN Institut Geographique National,Bordeaux;Paris,France;France,,,,,2018-06-01,June 2018,Photogrammetric Engineering and Remote Sensing,00991112,12366,,Journal,84,6,,367-375,,,6,0,repositoryam,Green,,,
630,2-s2.0-85049119193,10.4230/LIPIcs.AofA.2018.11,,,Periodic Pólya urns and an application to young tableaux,cp,Conference Paper,Banderier C.,,University Sorbonne Paris Nord,Villetaneuse,France,,,,,2018-06-01,1 June 2018,"Leibniz International Proceedings in Informatics, LIPIcs",18688969,21100244929,,Conference Proceeding,110,,11,,,,2,0,,,,,
631,2-s2.0-85046662927,10.1016/j.ic.2018.03.003,S0890540118300580,,On mobile agent verifiable problems,ar,Article,Bampas E.,,Laboratoire d’Informatique et Systèmes,Marseille,France,,,,,2018-06-01,June 2018,Information and Computation,08905401,25509,10902651,Journal,260,,,51-71,,,0,0,repositoryam,Green,,,
632,2-s2.0-85042922615,10.1007/s10753-018-0748-0,,29516383,A Peptide Targeting Inflammatory CNS Lesions in the EAE Rat Model of Multiple Sclerosis,ar,Article,Boiziau C.,,"Neuroinflammation, Imagerie et Thérapie de la Sclérose en Plaques;Bioingénierie Tissulaire;Université de Bordeaux",Bordeaux;Bordeaux;Bordeaux,France;France;France,,,,,2018-06-01,1 June 2018,Inflammation,03603997,14688,15732576,Journal,41,3,,932-947,,,5,0,,,,,
633,2-s2.0-85044732499,10.1016/j.neuroscience.2018.03.013,S0306452218302045,29572165,Using Recent BCI Literature to Deepen our Understanding of Clinical Neurofeedback: A Short Review,re,Review,Jeunet C.,,Ecole Polytechnique Fédérale de Lausanne;CNRS Centre National de la Recherche Scientifique,Lausanne;Paris,Switzerland;France,,,,,2018-05-15,15 May 2018,Neuroscience,03064522,18042,18737544,Journal,378,,,225-233,,,28,0,repositoryam,Green,,,
634,2-s2.0-85044622424,10.1016/j.neuroimage.2017.11.067,S1053811917310133,29229276,Corrigendum to “HIPS: A new hippocampus subfield segmentation method” [NeuroImage 163 (2017) 286–295](S1053811917307978)(10.1016/j.neuroimage.2017.09.049),er,Erratum,Romero J.E.,,Universitat Politècnica de València,Valencia,Spain,,,,,2018-05-15,15 May 2018,NeuroImage,10538119,17495,10959572,Journal,172,,,914,,,1,0,,,,,
635,2-s2.0-85048295201,10.4230/LIPIcs.CPM.2018.6,,,Nearest constrained circular words,cp,Conference Paper,Blin G.,,Université de Bordeaux,Bordeaux,France,,,,,2018-05-01,1 May 2018,"Leibniz International Proceedings in Informatics, LIPIcs",18688969,21100244929,,Conference Proceeding,105,,,61-614,,,0,0,,,,,
636,2-s2.0-85041587657,10.1016/j.cviu.2018.01.006,S1077314218300067,,Robust superpixels using color and contour features along linear path,ar,Article,Giraud R.,,Université de Bordeaux;CNRS Centre National de la Recherche Scientifique,Bordeaux;Paris,France;France,,,,,2018-05-01,May 2018,Computer Vision and Image Understanding,10773142,24161,1090235X,Journal,170,,,1-13,,,29,0,repositoryam,Green,,,
637,2-s2.0-85038837407,10.1007/s00182-017-0607-5,,,Ice sliding games,ar,Article,Dorbec P.,,Université de Bordeaux,Bordeaux,France,,,,,2018-05-01,1 May 2018,International Journal of Game Theory,00207276,23241,,Journal,47,2,,487-508,,,0,0,repositoryam,Green,,,
638,2-s2.0-85028887416,10.1142/S1793042118500562,,,Davenport-Zannier polynomials over,ar,Article,Pakovich F.,,Ben-Gurion University of the Negev,Beer Sheba,Israel,,,,,2018-05-01,1 May 2018,International Journal of Number Theory,17930421,11700154720,,Journal,14,4,,925-974,,,0,0,repositoryam,Green,,,
639,2-s2.0-85052023457,10.1145/3170427.3188617,,,Towards robust neuroadaptive HCI: Exploring modern machine learning methods to estimate mental workload from EEG signals,cp,Conference Paper,Appriou A.,,Université de Bordeaux,Bordeaux,France,,,,,2018-04-20,20 April 2018,Conference on Human Factors in Computing Systems - Proceedings,,31473,,Conference Proceeding,2018-April,,LBW615,,,,13,0,repositoryam,Green,,,
640,2-s2.0-85052021905,10.1145/3170427.3170634,,,Internet of tangible things: Workshop on tangible interaction with the internet of things,cp,Conference Paper,Angelini L.,,University of Applied Sciences Western Switzerland,Delemont,Switzerland,,,,,2018-04-20,20 April 2018,Conference on Human Factors in Computing Systems - Proceedings,,31473,,Conference Proceeding,2018-April,,W14,,,,1,0,repositoryvor,Green,,,
641,2-s2.0-85040605067,10.1088/1741-2552/aab2f2,,29488902,A review of classification algorithms for EEG-based brain-computer interfaces: A 10 year update,re,Review,Lotte F.,,Université de Bordeaux;RIKEN Center for Brain Science,Bordeaux;Wako,France;Japan,,,,,2018-04-16,16 April 2018,Journal of Neural Engineering,17412560,130164,17412552,Journal,15,3,031005,,,,734,0,repositoryam,Green,,,
642,2-s2.0-85049752976,10.1109/MAPR.2018.8337517,,,Heritage image classification by convolution neural networks,cp,Conference Paper,Vu M.T.,,Laboratoire Bordelais de Recherche en Informatique,Talence,France,,,,,2018-04-12,12 April 2018,"2018 1st International Conference on Multimedia Analysis and Pattern Recognition, MAPR 2018 - Proceedings",,21100867699,,Conference Proceeding,2018-January,,,1-6,,,3,0,,,,,
643,2-s2.0-85049744454,10.1109/MAPR.2018.8337519,,,Landmarks detection by applying deep networks,cp,Conference Paper,Le V.L.,,Laboratoire Bordelais de Recherche en Informatique;ITDLU - Dalat University,Talence;,France;Viet Nam,,,,,2018-04-12,12 April 2018,"2018 1st International Conference on Multimedia Analysis and Pattern Recognition, MAPR 2018 - Proceedings",,21100867699,,Conference Proceeding,2018-January,,,1-6,,,1,0,,,,,
644,2-s2.0-85050344277,10.1109/DEVLRN.2017.8329810,,,Syntactic reanalysis in language models for speech recognition,cp,Conference Paper,Twiefel J.,,Universität Hamburg,Hamburg,Germany,,,,,2018-04-02,2 April 2018,"7th Joint IEEE International Conference on Development and Learning and on Epigenetic Robotics, ICDL-EpiRob 2017",,21100869442,,Conference Proceeding,2018-January,,,215-220,,,2,0,repositoryam,Green,,,
645,2-s2.0-85050879839,10.1016/j.jlamp.2017.12.005,S2352220816301729,,Labelled Graph Strategic Rewriting for Social Networks,ar,Article,Fernández M.,,King's College London,London,United Kingdom,,,,,2018-04-01,April 2018,Journal of Logical and Algebraic Methods in Programming,,21100403130,23522216,Journal,96,,,12-40,,,9,1,repositoryam,Green,,,
646,2-s2.0-85044666592,10.1016/j.comcom.2018.01.010,S0140366416307381,,Whac-A-Mole: Smart node positioning in clone attack in wireless sensor networks,ar,Article,Ben Jaballah W.,,Thales Group,Puteaux,France,,,,,2018-04-01,April 2018,Computer Communications,01403664,13681,,Journal,119,,,66-82,,,11,0,repositoryam,Green,,,
647,2-s2.0-85043460105,10.1002/hbm.23970,,29331060,Regional hippocampal vulnerability in early multiple sclerosis: Dynamic pathological spreading from dentate gyrus to CA1,ar,Article,Planche V.,,Neurocentre Magendie;Université de Bordeaux;Centre Hospitalier Universitaire de Bordeaux,Bordeaux;Bordeaux;Talence,France;France;France,,,,,2018-04-01,April 2018,Human Brain Mapping,10659471,16101,10970193,Journal,39,4,,1814-1824,,,31,1,repositoryam,Green,,,
648,2-s2.0-85039726219,10.1016/j.aam.2017.12.001,S0196885817301525,,Hopf algebras and Tutte polynomials,ar,Article,Krajewski T.,,Centre de Physique Theorique,Marseille,France,,,,,2018-04-01,April 2018,Advances in Applied Mathematics,01968858,24556,10902074,Journal,95,,,271-330,,,9,1,repositoryam,Green,,,
649,2-s2.0-85032949798,10.1016/j.aam.2017.10.001,S0196885817301422,,"A trinity of duality: Non-separable planar maps, β(1,0)-trees and synchronized intervals",ar,Article,Fang W.,,Institut de Recherche en Informatique Fondamentale (IRIF);Université de Bordeaux;Technische Universitat Graz,Paris;Bordeaux;Graz,France;France;Austria,,,,,2018-04-01,April 2018,Advances in Applied Mathematics,01968858,24556,10902074,Journal,95,,,1-30,,,6,1,repositoryam,Green,,,
650,2-s2.0-85042127468,10.1016/j.dam.2017.12.010,S0166218X17305905,,List star edge coloring of sparse graphs,ar,Article,Kerdjoudj S.,,Université Blida;Université des Sciences et de la Technologie Houari Boumediene,Blida;Algiers,Algeria;Algeria,,,,,2018-03-31,31 March 2018,Discrete Applied Mathematics,0166218X,25890,,Journal,238,,,115-125,,,10,1,publisherfree2read,Bronze,,,
651,2-s2.0-85040014502,10.1016/j.dam.2017.12.017,S0166218X17305978,,Strong rainbow connection in digraphs,ar,Article,Sidorowicz E.,,Uniwersytet Zielonogórski,Zielona Gora,Poland,,,,,2018-03-31,31 March 2018,Discrete Applied Mathematics,0166218X,25890,,Journal,238,,,133-143,,,2,1,publisherfree2read,Bronze,,,
652,2-s2.0-85018770627,10.1016/j.tcs.2017.03.044,S0304397517302839,,Separating codes and traffic monitoring,ar,Article,Bellitto T.,,Université de Bordeaux,Bordeaux,France,,,,,2018-03-22,22 March 2018,Theoretical Computer Science,03043975,20571,,Journal,717,,,73-85,,,4,1,repositoryam,Green,,,
653,2-s2.0-85049082623,10.3389/fninf.2018.00012,,,A density-driven method for the placement of biological cells over two-dimensional manifolds,ar,Article,Rougier N.P.,,Laboratoire Bordelais de Recherche en Informatique;Institut des Maladies Neurodégénératives;INRIA Institut National de Recherche en Informatique et en Automatique,Talence;Bordeaux;Le Chesnay,France;France;France,,,,,2018-03-20,20 March 2018,Frontiers in Neuroinformatics,,19700175167,16625196,Journal,12,,12,,,,0,1,repositoryam,Green,,,
654,2-s2.0-85046671457,10.1145/3173225.3173294,,,Designing an expandable illuminated ring to build an actuated ring chart,cp,Conference Paper,Daniel M.,,Université de Bordeaux;ESTIA,Bordeaux;Bidart,France;France,,,,,2018-03-18,18 March 2018,"TEI 2018 - Proceedings of the 12th International Conference on Tangible, Embedded, and Embodied Interaction",,21100859923,,Conference Proceeding,2018-January,,,140-147,,,5,0,repositoryam,Green,,,
655,2-s2.0-85046658657,10.1145/3173225.3173334,,,Internet of tangibles: Exploring the interaction-attention continuum,cp,Conference Paper,Angelini L.,,University of Applied Sciences Western Switzerland,Delemont,Switzerland,,,,,2018-03-18,18 March 2018,"TEI 2018 - Proceedings of the 12th International Conference on Tangible, Embedded, and Embodied Interaction",,21100859923,,Conference Proceeding,2018-January,,,740-743,,,2,0,repositoryam,Green,,,
656,2-s2.0-85046622940,10.1145/3173225.3173288,,,Designing the interaction with the internet of tangible things: A card set,cp,Conference Paper,Angelini L.,,University of Applied Sciences Western Switzerland,Delemont,Switzerland,,,,,2018-03-18,18 March 2018,"TEI 2018 - Proceedings of the 12th International Conference on Tangible, Embedded, and Embodied Interaction",,21100859923,,Conference Proceeding,2018-January,,,299-306,,,9,0,,,,,
657,2-s2.0-85044729476,,,,A construction of certain weak colimits and an exactness property of the 2-category of categories,ar,Article,Descotte M.,,Université de Bordeaux;Universidad de Buenos Aires,Bordeaux;Buenos Aires,France;Argentina,,,,,2018-03-12,12 March 2018,Theory and Applications of Categories,1201561X,145268,,Journal,33,,,193-215,,,1,0,,,,,
658,2-s2.0-85050653363,10.1109/IPTA.2017.8310116,,,"Extraction of saliency in images and video: Problems, methods and applications. A survey",cp,Conference Paper,Benois-Pineau J.,,Télécom SudParis;Université de Bordeaux,Evry;Bordeaux,France;France,,,,,2018-03-08,8 March 2018,"Proceedings of the 7th International Conference on Image Processing Theory, Tools and Applications, IPTA 2017",,21100870342,,Conference Proceeding,2018-January,,,1-6,,,1,0,,,,,
659,2-s2.0-85043572425,10.1098/rsos.171661,,,A mathematical model of marine bacteriophage evolution,ar,Article,Pagliarini S.,,Centre de Recerca Matemàtica;Université de Bordeaux;Università degli Studi di Verona;INRIA Institut National de Recherche en Informatique et en Automatique,Cerdanyola del Valles;Bordeaux;Verona;Le Chesnay,Spain;France;Italy;France,,,,,2018-03-07,7 March 2018,Royal Society Open Science,,21100446014,20545703,Journal,5,3,171661,,,,5,1,repositoryvor,Green,,,
660,2-s2.0-85040619807,10.1016/j.tcs.2017.12.039,S0304397518300057,,On the complexity of basic abstractions to implement consensus,ar,Article,Capdevielle C.,,Université de Bordeaux,Bordeaux,France,,,,,2018-03-01,1 March 2018,Theoretical Computer Science,03043975,20571,,Journal,715,,,86-96,,,0,1,publisherfree2read,Bronze,,,
661,2-s2.0-85035357406,10.1016/j.ejc.2017.10.010,S0195669817301828,,Recoloring graphs via tree decompositions,ar,Article,Bonamy M.,,Université de Bordeaux,Bordeaux,France,,,,,2018-03-01,March 2018,European Journal of Combinatorics,01956698,26445,,Journal,69,,,200-213,,,22,1,repositoryam,Green,,,
662,2-s2.0-85034739251,10.1016/j.ipl.2017.11.004,S0020019017301989,,Independent feedback vertex sets for graphs of bounded diameter,ar,Article,Bonamy M.,,Laboratoire Bordelais de Recherche en Informatique,Talence,France,,,,,2018-03-01,March 2018,Information Processing Letters,00200190,14388,,Journal,131,,,26-32,,,10,1,repositoryam,Green,,,
663,2-s2.0-85033492275,10.1016/j.jcss.2017.09.012,S0022000017301605,,Approximability and inapproximability of the star p-hub center problem with parameterized triangle inequality,ar,Article,Chen L.H.,,National Cheng Kung University,Tainan,Taiwan,,,,,2018-03-01,March 2018,Journal of Computer and System Sciences,00220000,12370,10902724,Journal,92,,,92-112,,,8,1,repositoryam,Green,,,
664,2-s2.0-85048454500,10.4204/EPTCS.266.16,,,Toward quantum combinatorial games,cp,Conference Paper,Dorbec P.,,Université de Bordeaux;CNRS Centre National de la Recherche Scientifique,Bordeaux;Paris,France;France,,,,,2018-02-27,27 February 2018,"Electronic Proceedings in Theoretical Computer Science, EPTCS",20752180,21100244944,,Conference Proceeding,266,,,237-248,,,0,1,repositoryam,Green,,,
665,2-s2.0-85052023978,10.1145/3178433.3178435,,,MIPP: A portable C++ SIMD wrapper and its use for error correction coding in 5G standard,cp,Conference Paper,Cassagne A.,,Laboratoire de l’Intégration du Matériau au Système;INRIA Institut National de Recherche en Informatique et en Automatique,Talence;Le Chesnay,France;France,,,,,2018-02-24,24 February 2018,"WPMVP 2018 - Proceedings of the 2018 4th Workshop on Programming Models for SIMD/Vector Processing, Co-located with PPoPP 2018",,21100874124,,Conference Proceeding,2018-March,,,,,,6,0,repositoryam,Green,,,
666,2-s2.0-85045342100,10.1109/ICIP.2017.8296371,,,Superpixel-based color transfer,cp,Conference Paper,Giraud R.,,Université de Bordeaux,Bordeaux,France,,,,,2018-02-20,20 February 2018,"Proceedings - International Conference on Image Processing, ICIP",15224880,144684,,Conference Proceeding,2017-September,,,700-704,,,3,0,repositoryam,Green,,,
667,2-s2.0-85045322974,10.1109/ICIP.2017.8296924,,,Robust shape regularity criteria for superpixel evaluation,cp,Conference Paper,Giraud R.,,Université de Bordeaux,Bordeaux,France,,,,,2018-02-20,20 February 2018,"Proceedings - International Conference on Image Processing, ICIP",15224880,144684,,Conference Proceeding,2017-September,,,3455-3459,,,4,0,repositoryam,Green,,,
668,2-s2.0-85048382724,10.4204/EPTCS.265.2,,,Attributed hierarchical port graphs and applications,cp,Conference Paper,Ene N.,,King's College London,London,United Kingdom,,,,,2018-02-16,16 February 2018,"Electronic Proceedings in Theoretical Computer Science, EPTCS",20752180,21100244944,,Conference Proceeding,265,,,2-19,,,2,1,repositoryam,Green,,,
669,2-s2.0-85050857694,10.1109/SII.2017.8279363,,,Design of an industrial human-robot system through participative simulations - Tank cleaning case study,cp,Conference Paper,Bitonneau D.,,Université de Bordeaux;Safran SA,Bordeaux;Issy-les-Moulineaux,France;France,,,,,2018-02-01,1 February 2018,SII 2017 - 2017 IEEE/SICE International Symposium on System Integration,,21100870887,,Conference Proceeding,2018-January,,,1059-1066,,,0,0,repositoryam,Green,,,
670,2-s2.0-85041558317,10.1142/S0218213018400018,,,On the Glucose SAT Solver,ar,Article,Audemard G.,,Universite d'Artois,Arras,France,,,,,2018-02-01,1 February 2018,International Journal on Artificial Intelligence Tools,02182130,4700152645,17936349,Journal,27,1,1840001,,,,39,0,,,,,
671,2-s2.0-85041472105,10.1016/j.jvcir.2018.01.009,S1047320318300154,,"Multi-modal activity recognition from egocentric vision, semantic enrichment and lifelogging applications for the care of dementia",ar,Article,Meditskos G.,,Centre for Research and Technologies - Hellas,,Greece,,,,,2018-02-01,February 2018,Journal of Visual Communication and Image Representation,10473203,25592,10959076,Journal,51,,,169-190,,,21,0,,,,,
672,2-s2.0-85044362508,10.1145/3149457.3149459,,,Maximizing communication overlap with dynamic program analysis,cp,Conference Paper,Saillard E.,,Université de Bordeaux,Bordeaux,France,,,,,2018-01-28,28 January 2018,ACM International Conference Proceeding Series,,11600154611,,Conference Proceeding,,,,1-11,,,1,0,repositoryvor,Green,,,
673,2-s2.0-85056456078,10.3390/informatics5010007,,,Internet of tangible things (IOTT): Challenges and opportunities for tangible interaction with IoT,ar,Article,Angelini L.,,University of Applied Sciences Western Switzerland,Delemont,Switzerland,,,,,2018-01-25,25 January 2018,Informatics,,21100897717,22279709,Journal,5,1,7,,,,24,1,repositoryam,Green,,,
674,2-s2.0-85042610118,10.1088/1741-2552/aa9817,,29099388,A review of rapid serial visual presentation-based brain-computer interfaces,re,Review,Lees S.,,Ulster University,Coleraine,United Kingdom,,,,,2018-01-24,24 January 2018,Journal of Neural Engineering,17412560,130164,17412552,Journal,15,2,021001,,,,43,1,repositoryam,Green,,,
675,2-s2.0-85055824243,10.23638/LMCS-14(1:4)2018,,,Soundness in negotiations,ar,Article,Esparza J.,,Technical University of Munich,Munich,Germany,,,,,2018-01-16,16 January 2018,Logical Methods in Computer Science,,19700175752,18605974,Journal,14,1,4,,,,1,0,,,,,
676,2-s2.0-85043753368,10.3389/fninf.2017.00069,,,"Re-run, repeat, reproduce, reuse, replicate: Transforming code into scientific contributions",ar,Article,Benureau F.C.Y.,,Université de Bordeaux;INRIA Institut National de Recherche en Informatique et en Automatique,Bordeaux;Le Chesnay,France;France,,,,,2018-01-04,4 January 2018,Frontiers in Neuroinformatics,,19700175167,16625196,Journal,11,,69,,,,18,1,repositoryam,Green,,,
677,2-s2.0-85117995376,10.1049/PBCE114E_ch8,,,A BCI challenge for the signal-processing community: Considering the user in the loop,ch,Book Chapter,Lotte F.,,Université de Bordeaux,Bordeaux,France,,,,,2018-01-01,1 January 2018,Signal Processing and Machine Learning for Brain-Machine Interfaces,,21101063186,,Book,,,,143-172,,,7,0,repositoryam,Green,,,
678,2-s2.0-85103905637,10.1007/978-3-319-97175-9_13,,,Non-perturbative Renormalization Group of a U(1) Tensor Model,ch,Book Chapter,Lahoche V.,,Université de Bordeaux,Bordeaux,France,,,,,2018-01-01,2018,"STEAM-H: Science, Technology, Engineering, Agriculture, Mathematics and Health",2520193X,21101041995,25201948,Book Series,,,,293-310,,,0,0,,,,,
679,2-s2.0-85093854998,,,,Spatio-temporal domains: An overview,cp,Conference Paper,Janin D.,,Université de Bordeaux,Bordeaux,France,,,,,2018-01-01,2018,JFLA 2018 - Journees Francophones des Langages Applicatifs,,21101023688,,Conference Proceeding,,,,61-75,,,0,0,,,,,
680,2-s2.0-85093821296,,,,Hydra Ludica: A simple proof of impossibility to prove,cp,Conference Paper,Castéran P.,,Université de Bordeaux,Bordeaux,France,,,,,2018-01-01,2018,JFLA 2018 - Journees Francophones des Langages Applicatifs,,21101023688,,Conference Proceeding,,,,91-104,,,0,0,,,,,
681,2-s2.0-85092135452,10.2312/eged.20181004,,,Teaching spatial augmented reality: A practical assignment for large audiences,cp,Conference Paper,Ridel B.,,INRIA Institut National de Recherche en Informatique et en Automatique,Le Chesnay,France,,,,,2018-01-01,2018,"European Association for Computer Graphics - 39th Annual Conference, EUROGRAPHICS 2018 - Education Papers",,21101023022,,Conference Proceeding,,,,33-38,,,0,0,,,,,
682,2-s2.0-85081411884,10.1016/B978-0-12-811926-6.00072-5,B9780128119266000725,,Recent advances in EEG-based neuroergonomics for human-computer interaction,ch,Book Chapter,Frey J.,,Université de Bordeaux;INRIA Institut National de Recherche en Informatique et en Automatique,Bordeaux;Le Chesnay,France;France,,,,,2018-01-01,1 January 2018,Neuroergonomics: The Brain at Work and in Everyday Life,,21100967525,,Book,,,,275,,,1,0,repositoryam,Green,,,
