,eid,doi,pii,pubmed_id,title,subtype,subtypeDescription,creator,afid,affilname,affiliation_city,affiliation_country,author_count,author_names,author_ids,author_afids,coverDate,coverDisplayDate,publicationName,issn,source_id,eIssn,aggregationType,volume,issueIdentifier,article_number,pageRange,description,authkeywords,citedby_count,openaccess,freetoread,freetoreadLabel,fund_acr,fund_no,fund_sponsor
262,2-s2.0-85068776164,10.1002/rnc.4600,,,Enhancing the settling time estimation of a class of fixed-time stable systems,ar,Article,Aldana-López R.,,Intel Guadalajara Design Center,Guadalajara,Mexico,,,,,2019-08-01,1 August 2019,International Journal of Robust and Nonlinear Control,10498923,17987,10991239,Journal,29,12,,4135-4148,,,59,1,repositoryam,Green,,,
263,2-s2.0-85064625762,10.1016/j.ijimpeng.2019.04.017,S0734743X18311552,,Experimental characterization of the mechanical behaviour and the failure of multi-sheet and multi-material spot welded assembly,ar,Article,Tounsi R.,,Université Polytechnique Hauts-de-France,Valenciennes,France,,,,,2019-08-01,August 2019,International Journal of Impact Engineering,0734743X,12383,,Journal,130,,,226-238,,,1,1,repositoryvor,Green,,,
264,2-s2.0-85056328771,10.1016/j.sysarc.2018.10.004,S1383762118300705,,ENOrMOUS: ENergy Optimization for MObile plateform using User needS,ar,Article,Draa I.C.,,Université Polytechnique Hauts-de-France,Valenciennes,France,,,,,2019-08-01,August 2019,Journal of Systems Architecture,13837621,12398,,Journal,97,,,320-334,,,4,1,repositoryam,Green,,,
265,2-s2.0-85063863807,10.1002/fld.4727,,,Theoretical and numerical study of Couette-Taylor flow with an axial flow using lattice Boltzmann method,ar,Article,Mehrez I.,,Ecole National d'Ingenieurs de Monastir,Monastir,Tunisia,,,,,2019-07-30,30 July 2019,International Journal for Numerical Methods in Fluids,02712091,18534,10970363,Journal,90,9,,427-441,,,0,0,,,,,
266,2-s2.0-85062351219,10.1080/1463922X.2019.1574932,,,Using fuzzy coding with qualitative data: example with subjective data in human-computer interaction,ar,Article,Loslever P.,,Université Polytechnique Hauts-de-France,Valenciennes,France,,,,,2019-07-04,4 July 2019,Theoretical Issues in Ergonomics Science,1463922X,19900191825,1464536X,Journal,20,4,,459-488,,,4,0,,,,,
267,2-s2.0-85064179005,10.1080/0951192X.2019.1599442,,,Reconstruction of a CAD model from the deformed mesh using B-spline surfaces,ar,Article,Ben Makhlouf A.,,Université de Sousse,Sousse,Tunisia,,,,,2019-07-03,3 July 2019,International Journal of Computer Integrated Manufacturing,0951192X,18198,13623052,Journal,32,7,,669-681,,,11,0,,,,,
268,2-s2.0-85068856134,10.1063/1.5112625,,,Micromachining simulation using a crystal plasticity model: ALE and CEL approaches,cp,Conference Paper,Boubakri C.,,Université de Lorraine;Université Polytechnique Hauts-de-France,Nancy;Valenciennes,France;France,,,,,2019-07-02,2 July 2019,AIP Conference Proceedings,0094243X,26916,15517616,Conference Proceeding,2113,,080017,,,,1,0,,,,,
269,2-s2.0-85083091313,10.1109/ICCAD46983.2019.9037877,,,Root causes analysis and fault prediction in intelligent transportation systems: Coupling unsupervised and supervised learning techniques,cp,Conference Paper,Mbuli J.,,LAMIH,Valenciennes,France,,,,,2019-07-01,July 2019,"2019 International Conference on Control, Automation and Diagnosis, ICCAD 2019 - Proceedings",,21100977512,,Conference Proceeding,,,9037877,,,,2,0,,,,,
270,2-s2.0-85078007799,10.1109/ICECCE47252.2019.8940707,,,An Iris based Smart System for Stress Identification,cp,Conference Paper,Haider A.,,Riphah International University;UCERD,Islamabad;Islamabad,Pakistan;Pakistan,,,,,2019-07-01,July 2019,"1st International Conference on Electrical, Communication and Computer Engineering, ICECCE 2019",,21100958087,,Conference Proceeding,,,8940707,,,,1,0,,,,,
271,2-s2.0-85072302905,10.23919/acc.2019.8814323,,,A lane keeping assist design: Adaptation to driving style based on aggressiveness,cp,Conference Paper,Rath J.J.,,"Fakultät für Informatik, Technische Universität München",Garching bei Munchen,Germany,,,,,2019-07-01,July 2019,Proceedings of the American Control Conference,07431619,18692,,Conference Proceeding,2019-July,,8814323,5316-5321,,,3,0,,,,,
272,2-s2.0-85072298270,10.1109/IV.2019.00077,,,Reconstruction of a CAD Model using TPS Surface,cp,Conference Paper,Makhlouf A.,,Université de Sousse,Sousse,Tunisia,,,,,2019-07-01,July 2019,Proceedings of the International Conference on Information Visualisation,10939547,25533,,Conference Proceeding,2019-July,,8811996,417-424,,,3,0,,,,,
273,2-s2.0-85071655221,10.1109/MED.2019.8798494,,,A class of predefined-time stabilizing controllers for nonholonomic systems,cp,Conference Paper,Jimenez-Rodriguez E.,,Centro de Investigacion y de Estudios Avanzados,Mexico City,Mexico,,,,,2019-07-01,July 2019,"27th Mediterranean Conference on Control and Automation, MED 2019 - Proceedings",,21100927188,,Conference Proceeding,,,8798494,464-471,,,0,0,,,,,
274,2-s2.0-85066248206,10.1016/j.clinbiomech.2019.05.012,S0268003318309446,31158728,Frequency coherence analysis of postural balance in able-bodied and in non-treated adolescent idiopathic scoliotic girls,ar,Article,Leteneur S.,,Université Polytechnique Hauts-de-France;CNRS Centre National de la Recherche Scientifique,Valenciennes;Paris,France;France,,,,,2019-07-01,July 2019,Clinical Biomechanics,02680033,21170,18791271,Journal,67,,,180-186,,,2,0,repositoryvor,Green,,,
275,2-s2.0-85062439338,10.1016/j.eiar.2019.02.007,S0195925517304882,,A framework to help decision makers to be environmentally aware during the maintenance of cyber physical systems,ar,Article,Sénéchal O.,,Université Polytechnique Hauts-de-France,Valenciennes,France,,,,,2019-07-01,July 2019,Environmental Impact Assessment Review,01959255,21004,,Journal,77,,,11-22,,,19,0,,,,,
276,2-s2.0-85062416117,10.1016/j.euromechflu.2019.01.006,S0997754618300426,,Investigation of the dynamics in separated turbulent flow,ar,Article,Fadla F.,,LAMIH,Valenciennes,France,,,,,2019-07-01,July - August 2019,"European Journal of Mechanics, B/Fluids",09977546,13878,,Journal,76,,,190-204,,,6,0,repositoryam,Green,,,
277,2-s2.0-85062367593,10.1016/j.apmr.2018.12.023,S0003999319300048,30639274,Does Unilateral Lower Limb Amputation Influence Ankle Joint Torque in the Intact Leg?,ar,Article,Simoneau-Buessinger É.,,Université Polytechnique Hauts-de-France,Valenciennes,France,,,,,2019-07-01,July 2019,Archives of Physical Medicine and Rehabilitation,00039993,16270,1532821X,Journal,100,7,,1259-1266,,,0,0,,,,,
278,2-s2.0-85055699233,10.1002/pc.25108,,,Performance over a wide range of strain rate of polypropylene reinforced by short alfa fibers,ar,Article,Nciri M.,,Ecole Nationale d'Ingénieurs de Sfax;Université Polytechnique Hauts-de-France,Sfax;Valenciennes,Tunisia;France,,,,,2019-07-01,July 2019,Polymer Composites,02728397,14433,15480569,Journal,40,7,,2850-2862,,,3,0,,,,,
279,2-s2.0-85063733729,10.1016/j.jallcom.2019.03.113,S092583881930920X,,Physically-based constitutive description of a commercial Al-Mg-Si alloy deformed under cold-warm working conditions,ar,Article,Le Mercier K.,,Université Polytechnique Hauts-de-France,Valenciennes,France,,,,,2019-06-25,25 June 2019,Journal of Alloys and Compounds,09258388,12325,,Journal,790,,,1177-1191,,,0,0,,,,,
280,2-s2.0-85072376708,10.1145/3319499.3328239,,,A framework to support the engineering of internet of things software systems,cp,Conference Paper,Motta R.C.,,LAMIH;Universidade Federal do Rio de Janeiro,Valenciennes;Rio de Janeiro,France;Brazil,,,,,2019-06-18,18 June 2019,"Proceedings of the ACM SIGCHI Symposium on Engineering Interactive Computing Systems, EICS 2019",,21100929552,,Conference Proceeding,,,3328239,,,,3,0,,,,,
281,2-s2.0-85070593210,10.1145/3322276.3322284,,,E-Pad: Large display pointing in a continuous interaction space around a mobile device,cp,Conference Paper,Arslan C.,,Université de Lille,Lille,France,,,,,2019-06-18,18 June 2019,DIS 2019 - Proceedings of the 2019 ACM Designing Interactive Systems Conference,,21100946724,,Conference Proceeding,,,,1101-1108,,,1,0,repositoryam,Green,,,
282,2-s2.0-85063082495,10.1016/j.cma.2019.03.013,S0045782519301422,,A novel DEM approach for modeling brittle elastic media based on distinct lattice spring model,ar,Article,André D.,,Universite de Limoges,Limoges,France,,,,,2019-06-15,15 June 2019,Computer Methods in Applied Mechanics and Engineering,00457825,18158,,Journal,350,,,100-122,,,13,0,repositoryam,Green,,,
283,2-s2.0-85052989001,10.1016/j.ymssp.2018.09.011,S0888327018306216,,Lane keeping of autonomous vehicles based on differential steering with adaptive multivariable super-twisting control,ar,Article,Hu C.,,University of Waterloo,Waterloo,Canada,,,,,2019-06-15,15 June 2019,Mechanical Systems and Signal Processing,08883270,21080,10961216,Journal,125,,,330-346,,,49,0,,,,,
284,2-s2.0-85035807684,10.1007/s10845-017-1376-5,,,Ontology for cloud manufacturing based Product Lifecycle Management,ar,Article,Talhi A.,,Arts et Metiers Institute of Technology,Paris,France,,,,,2019-06-15,15 June 2019,Journal of Intelligent Manufacturing,09565515,24363,15728145,Journal,30,5,,2171-2192,,,19,0,,,,,
285,2-s2.0-85065904938,10.1007/s40815-019-00613-1,,,Nonlinear Tracking Control with Reduced Complexity of Serial Robots: A Robust Fuzzy Descriptor Approach,ar,Article,Nguyen V.A.,,Université Polytechnique Hauts-de-France,Valenciennes,France,,,,,2019-06-12,12 June 2019,International Journal of Fuzzy Systems,15622479,12358,21993211,Journal,21,4,,1038-1050,,,10,0,,,,,
286,2-s2.0-85038113894,10.1080/02670844.2017.1414766,,,Assessment of the mechanical and tribological performance of a ZrN PVD coating,ar,Article,Staia M.H.,,"MSMP Mechanics, Surfaces and Materials Processing;Universidad Central de Venezuela",Aix-en-Provence;Caracas,France;Venezuela,,,,,2019-06-03,3 June 2019,Surface Engineering,02670844,28462,17432944,Journal,35,6,,491-500,,,11,0,repositoryam,Green,,,
287,2-s2.0-85071585637,10.23919/ECC.2019.8796191,,,Comparison of two robust static output feedback H<inf>2</inf> design approaches for car lateral control,cp,Conference Paper,Mustaki S.,,Laboratoire des Sciences du Numérique de Nantes;Renault,Nantes;Boulogne-Billancourt,France;France,,,,,2019-06-01,June 2019,"2019 18th European Control Conference, ECC 2019",,21100926603,,Conference Proceeding,,,8796191,716-723,,,1,0,,,,,
288,2-s2.0-85067972250,10.1049/iet-cps.2018.5038,,,Assessing cyber-physical systems to balance maintenance replacement policies and optimise long-run average costs for aircraft assets,ar,Article,Andreacchio M.,,EAM RFID Solutions (Subdivision of EAM Worldwide),Miami,United States,,,,,2019-06-01,1 June 2019,IET Cyber-Physical Systems: Theory and Applications,,21100912216,23983396,Journal,4,2,,148-155,,,1,1,publisherfullgold,Gold,,,
289,2-s2.0-85067297597,10.3390/su11113127,,,Multi-objective sustainable truck scheduling in a rail-road physical internet cross-docking hub considering energy consumption,ar,Article,Chargui T.,,Université Polytechnique Hauts-de-France;Université Abdelmalek Essaadi,Valenciennes;Tetouan,France;Morocco,,,,,2019-06-01,1 June 2019,Sustainability (Switzerland),,21100240100,20711050,Journal,11,11,3127,,,,19,1,publisherfullgold,Gold,,,
290,2-s2.0-85065176131,10.1007/s11071-019-04953-3,,,Control strategy for fixed-time leader–follower consensus for multi-agent systems with chained-form dynamics,ar,Article,Anggraeni P.,,Université Polytechnique Hauts-de-France,Valenciennes,France,,,,,2019-06-01,1 June 2019,Nonlinear Dynamics,0924090X,21576,1573269X,Journal,96,4,,2693-2705,,,17,0,,,,,
291,2-s2.0-85064415217,10.1016/j.scispo.2019.01.004,S0765159719300346,,Influence of three different types of physical training programs on bone mineral density in a group of elderly subjects,ar,Article,Nasr R.,,University of Balamand;Université Polytechnique Hauts-de-France,Al Koura;Valenciennes,Lebanon;France,,,,,2019-06-01,June 2019,Science and Sports,07651597,20349,17784131,Journal,34,3,,186-189,,,1,0,,,,,
292,2-s2.0-85063660717,10.1016/j.enconman.2019.03.063,S0196890419303668,,"Effect of hydroxyl (OH) group position in alcohol on performance, emission and combustion characteristics of SI engine",ar,Article,Jesu Godwin D.,,SRM Institute of Science and Technology,Chennai,India,,,,,2019-06-01,1 June 2019,Energy Conversion and Management,01968904,29372,,Journal,189,,,195-201,,,23,0,,,,,
293,2-s2.0-85063603864,10.1016/j.sna.2019.03.034,S0924424718319435,,High frequency characterization of a sweeping jet actuator,ar,Article,Ott C.,,LAMIH;Université de Lille,Valenciennes;Lille,France;France,,,,,2019-06-01,1 June 2019,"Sensors and Actuators, A: Physical",09244247,13660,,Journal,291,,,39-47,,,5,0,repositoryam,Green,,,
294,2-s2.0-85062964121,10.1016/j.compind.2019.01.006,S0166361519300107,,Digital transformation of manufacturing through cloud services and resource virtualization,ed,Editorial,Borangiu T.,,University Politehnica of Bucharest,Bucuresti,Romania,,,,,2019-06-01,June 2019,Computers in Industry,01663615,19080,,Journal,108,,,150-162,,,72,0,,,,,
295,2-s2.0-85062711614,10.1016/j.ijheatmasstransfer.2019.03.016,S0017931018328394,,Effect of self-rewetting fluids on the liquid/vapor phase change in a porous media of two-phase heat transfer devices,ar,Article,Boubaker R.,,Université Polytechnique Hauts-de-France,Valenciennes,France,,,,,2019-06-01,June 2019,International Journal of Heat and Mass Transfer,00179310,20448,,Journal,136,,,655-663,,,11,0,,,,,
296,2-s2.0-85059662096,10.1016/j.neucli.2018.12.006,S0987705318302077,30639034,How can the stimulation of plantar cutaneous receptors improve postural control? Review and clinical commentary,re,Review,Viseux F.,,Université Polytechnique Hauts-de-France;Centre Hospitalier de Valenciennes;Posture Lab,Valenciennes;Valenciennes;Paris,France;France;France,,,,,2019-06-01,June 2019,Neurophysiologie Clinique,09877053,17997,17697131,Journal,49,3,,263-268,,,20,0,,,,,
297,2-s2.0-85067104352,10.1109/ROBOSOFT.2019.8722804,,,Dynamically closed-loop controlled soft robotic arm using a reduced order finite element model with state observer,cp,Conference Paper,Katzschmann R.K.,,MIT Computer Science &amp; Artificial Intelligence Laboratory,Cambridge,United States,,,,,2019-05-24,24 May 2019,RoboSoft 2019 - 2019 IEEE International Conference on Soft Robotics,,21100911306,,Conference Proceeding,,,8722804,717-724,,,30,0,repositoryam,Green,,,
298,2-s2.0-85066608467,10.23919/DATE.2019.8714818,,,Adaptive Vehicle Detection for Real-time Autonomous Driving System,cp,Conference Paper,Hemmati M.,,The University of Auckland,Auckland,New Zealand,,,,,2019-05-14,14 May 2019,"Proceedings of the 2019 Design, Automation and Test in Europe Conference and Exhibition, DATE 2019",,21100909438,,Conference Proceeding,,,8714818,1034-1039,,,6,0,,,,,
299,2-s2.0-85069505351,10.1117/1.JEI.28.3.033010,,,"Case study of an HEVC decoder application using high-level synthesis: Intraprediction, dequantization, and inverse transform blocks",ar,Article,Kammoun M.,,University of Sfax,Sfax,Tunisia,,,,,2019-05-01,1 May 2019,Journal of Electronic Imaging,10179909,25978,1560229X,Journal,28,3,033010,,,,6,0,,,,,
300,2-s2.0-85067389185,10.1002/cav.1891,,,Yet another low-level agent handler,cp,Conference Paper,Nunnari F.,,German Research Center for Artificial Intelligence (DFKI),Kaiserslautern,Germany,,,,,2019-05-01,May/August 2019,Computer Animation and Virtual Worlds,15464261,145508,1546427X,Journal,30,3-4,e1891,,,,3,0,,,,,
301,2-s2.0-85065840071,,,,Numerical and experimental study of convective heat exchanges on a rotating disk with an eccentric impinging jet,ar,Article,Haidar C.,,Université Hassan 1er,Settat,Morocco,,,,,2019-05-01,1 May 2019,Journal of Advanced Research in Fluid Mechanics and Thermal Sciences,22897879,21100853837,,Journal,57,2,,208-215,,,1,0,,,,,
302,2-s2.0-85060996143,10.1016/j.autcon.2019.01.019,S0926580518301079,,Building Information Maturity Model specific to the renovation sector,ar,Article,Joblot L.,,Arts et Metiers Institute of Technology;Université Polytechnique Hauts-de-France,Paris;Valenciennes,France;France,,,,,2019-05-01,May 2019,Automation in Construction,09265805,24931,,Journal,101,,,140-159,,,10,1,repositoryvor,Green,,,
303,2-s2.0-85056895217,10.1016/j.nahs.2018.10.009,S1751570X18300906,,Sufficient conditions for uniform exponential stability and h-stability of some classes of dynamic equations on arbitrary time scales,ar,Article,Ben Nasser B.,,King Abdullah University of Science and Technology;Université de Kairouan,Thuwal;Kairouan,Saudi Arabia;Tunisia,,,,,2019-05-01,May 2019,Nonlinear Analysis: Hybrid Systems,1751570X,9000153105,,Journal,32,,,54-64,,,15,0,,,,,
304,2-s2.0-85063103439,10.1080/00207721.2019.1588409,,,A geometric approach to nonlinear fault detection and isolation in a hybrid three-cell converter,ar,Article,Khelouat S.,,Ecole Nationale Polytechnique Alger,Algiers,Algeria,,,,,2019-04-04,4 April 2019,International Journal of Systems Science,00207721,12419,14645319,Journal,50,5,,1069-1088,,,1,0,,,,,
305,2-s2.0-85076956764,10.1109/DTSS.2019.8914906,,,Study of a dual longitudinal and shear acoustic wave ZnO transducer in the gigahertz frequency range: Application to viscosity measurement and first step for device integration,cp,Conference Paper,Dahmani H.,,Université Polytechnique Hauts-de-France,Valenciennes,France,,,,,2019-04-01,April 2019,"IEEE International Conference on Design and Test of Integrated Micro and Nano-Systems, DTS 2019",,21100962527,,Conference Proceeding,,,8914906,,,,1,0,,,,,
306,2-s2.0-85072837868,10.1109/CoDIT.2019.8820462,,,Proposition of a holonic approach to model the information chain from product to stakeholder,cp,Conference Paper,Basselot V.,,Université Polytechnique Hauts-de-France;CNRS Centre National de la Recherche Scientifique,Valenciennes;Paris,France;France,,,,,2019-04-01,April 2019,"2019 6th International Conference on Control, Decision and Information Technologies, CoDIT 2019",,21100931006,,Conference Proceeding,,,8820462,109-114,,,0,0,,,,,
307,2-s2.0-85072829699,10.1109/CoDIT.2019.8820707,,,A special case of variable-sized bin packing problem with color constraints,cp,Conference Paper,Crevits I.,,Université Polytechnique Hauts-de-France,Valenciennes,France,,,,,2019-04-01,April 2019,"2019 6th International Conference on Control, Decision and Information Technologies, CoDIT 2019",,21100931006,,Conference Proceeding,,,8820707,1150-1154,,,2,0,,,,,
308,2-s2.0-85066735813,10.1016/j.mfglet.2019.05.004,S2213846319300124,,Effective dynamic selection of smart products scheduling rules in FMS,ar,Article,Bouazza W.,,Université Oran,Oran,Algeria,,,,,2019-04-01,April 2019,Manufacturing Letters,22138463,21100283796,,Journal,20,,,45-48,,,4,0,,,,,
309,2-s2.0-85063905559,10.1007/s00340-019-7179-y,,,Optical measurements of temperature fields in sooting flames: influence of soot self-absorption,ar,Article,Wang Q.,,Tianjin University,Tianjin,China,,,,,2019-04-01,1 April 2019,Applied Physics B: Lasers and Optics,09462171,27029,,Journal,125,4,63,,,,6,0,,,,,
310,2-s2.0-85063500586,10.1016/j.mfglet.2019.03.001,S2213846318301998,,Information chain modeling from product to stakeholder in the use phase – Application to diagnoses in railway transportation,ar,Article,Basselot V.,,Université Polytechnique Hauts-de-France,Valenciennes,France,,,,,2019-04-01,April 2019,Manufacturing Letters,22138463,21100283796,,Journal,20,,,22-26,,,3,0,repositoryvor,Green,,,
311,2-s2.0-85063266914,10.1016/j.scispo.2018.10.009,S0765159718303241,,Adapted physical activity and cerebral palsy: A case study in educational boxing,le,Letter,Maïga D.,,Athlétic club de Boulogne-Billancourt (ACBB),Boulogne-Billancourt,France,,,,,2019-04-01,April 2019,Science and Sports,07651597,20349,17784131,Journal,34,2,,107-108,,,0,0,,,,,
312,2-s2.0-85062944721,10.1016/j.engappai.2018.04.016,S0952197618300952,,Introduction to the Special Issue on Intelligent Control in Systems Engineering and Automation Sciences,ed,Editorial,Guelton K.,,Centre de Recherche en Science et Technologie de l'Information et de la Communication (CRESTIC),Reims,France,,,,,2019-04-01,April 2019,Engineering Applications of Artificial Intelligence,09521976,24182,,Journal,80,,,97-98,,,0,0,,,,,
313,2-s2.0-85061819688,10.1016/j.forsciint.2019.02.007,S037907381930043X,30802646,Rib fractures prediction method for kinetic energy projectile impact: from blunt ballistic experiments on SEBS gel to impact modeling on a human torso FE model,ar,Article,Bracq A.,,Université Polytechnique Hauts-de-France,Valenciennes,France,,,,,2019-04-01,April 2019,Forensic Science International,03790738,27743,18726283,Journal,297,,,177-183,,,8,0,,,,,
314,2-s2.0-85064124003,10.1109/ICOMET.2019.8673495,,,An iris based lungs pre-diagnostic system,cp,Conference Paper,Hussain T.,,Riphah International University;UCERD,Islamabad;Islamabad,Pakistan;Pakistan,,,,,2019-03-22,22 March 2019,"2019 2nd International Conference on Computing, Mathematics and Engineering Technologies, iCoMET 2019",,21100903175,,Conference Proceeding,,,8673495,,,,5,0,repositoryam,Green,,,
315,2-s2.0-85057259214,10.1016/j.euromechsol.2018.11.008,S0997753817308951,,Propagation of singularities in shells of non-uniform geometrical nature. A numerical investigation,ar,Article,Béchet F.,,Université Polytechnique Hauts-de-France,Valenciennes,France,,,,,2019-03-01,March - April 2019,"European Journal of Mechanics, A/Solids",09977538,13877,,Journal,74,,,188-201,,,0,0,,,,,
316,2-s2.0-85063731161,10.1007/s40815-018-0548-6,,,On Stabilization Conditions for T–S Systems with Nonlinear Consequent Parts,ar,Article,Moodi H.,,Quchan University of Technology,Quchan,Iran,,,,,2019-02-06,6 February 2019,International Journal of Fuzzy Systems,15622479,12358,21993211,Journal,21,1,,84-94,,,8,0,,,,,
317,2-s2.0-85069037769,10.1109/ICIT.2019.8755164,,,3-d multi-nodal thermal modelling for fault-tolerant machine,cp,Conference Paper,Ouenzerfi S.,,Université Polytechnique Hauts-de-France,Valenciennes,France,,,,,2019-02-01,February 2019,Proceedings of the IEEE International Conference on Industrial Technology,,84128,,Conference Proceeding,2019-February,,8755164,1551-1556,,,2,0,repositoryam,Green,,,
318,2-s2.0-85060127641,10.1016/j.scispo.2018.10.007,S0765159718303228,,Muscular maximal strength indices and bone variables in a group of elderly men,le,Letter,Nasr R.,,University of Balamand;Université Polytechnique Hauts-de-France,Al Koura;Valenciennes,Lebanon;France,,,,,2019-02-01,February 2019,Science and Sports,07651597,20349,17784131,Journal,34,1,,56-58,,,3,0,,,,,
319,2-s2.0-85060022523,10.1109/MCI.2018.2881644,,,"Fuzzy control systems: Past, present and future",ar,Article,Nguyen A.T.,,Université Polytechnique Hauts-de-France,Valenciennes,France,,,,,2019-02-01,February 2019,IEEE Computational Intelligence Magazine,1556603X,4000148905,15566048,Journal,14,1,8610273,56-68,,,93,0,,,,,
320,2-s2.0-85053215069,10.1016/j.jfoodeng.2018.08.024,S0260877418303613,,Effect of swirl flow on whey protein fouling and cleaning in a straight duct,ar,Article,Bouvier L.,,Université de Lille,Lille,France,,,,,2019-02-01,February 2019,Journal of Food Engineering,02608774,20586,,Journal,242,,,115-123,,,3,0,,,,,
321,2-s2.0-85047652564,10.1109/TAC.2018.2841806,,,On the Local Stabilization of Hybrid Limit Cycles in Switched Affine Systems,ar,Article,Benmiloud M.,,Laboratoire des Sciences du Numérique de Nantes,Nantes,France,,,,,2019-02-01,February 2019,IEEE Transactions on Automatic Control,00189286,17339,15582523,Journal,64,2,8368141,841-846,,,11,0,,,,,
322,2-s2.0-85041561131,10.1016/j.trf.2017.12.005,S1369847817305314,,Predictive shared steering control for driver override in automated driving: A simulator study,ar,Article,Guo C.,,Université Polytechnique Hauts-de-France;Renault,Valenciennes;Boulogne-Billancourt,France;France,,,,,2019-02-01,February 2019,Transportation Research Part F: Traffic Psychology and Behaviour,13698478,20897,,Journal,61,,,326-336,,,22,0,,,,,
323,2-s2.0-85029169715,10.1016/j.trf.2017.08.013,S1369847816306647,,Online adaptation of the Level of Haptic Authority in a lane keeping system considering the driver's state,ar,Article,Benloucif M.A.,,Université Polytechnique Hauts-de-France,Valenciennes,France,,,,,2019-02-01,February 2019,Transportation Research Part F: Traffic Psychology and Behaviour,13698478,20897,,Journal,61,,,107-119,,,16,0,,,,,
324,2-s2.0-85018241488,10.1016/j.trf.2017.04.006,S1369847816306623,,Cooperation between driver and automated driving system: Implementation and evaluation,ar,Article,Guo C.,,Université Polytechnique Hauts-de-France;Renault;LRA,Valenciennes;Boulogne-Billancourt;Palaiseau,France;France;France,,,,,2019-02-01,February 2019,Transportation Research Part F: Traffic Psychology and Behaviour,13698478,20897,,Journal,61,,,314-325,,,18,0,,,,,
325,2-s2.0-85062733822,10.1109/RSP.2018.8631986,,,A Comprehensive Fault Injection Strategy for Embedded Systems Reliability Assessment,cp,Conference Paper,Chabot A.,,Commissariat a L'Energie Atomique CEA,Gif-sur-Yvette,France,,,,,2019-01-31,31 January 2019,"Proceedings - IEEE International Symposium on Rapid System Prototyping, RSP",21505500,21100228514,21505519,Conference Proceeding,2018-October,,8631986,22-28,,,1,0,,,,,
326,2-s2.0-85056453476,10.1002/rnc.4406,,,Distributed leader-follower consensus for a class of semilinear second-order multiagent systems using time scale theory,ar,Article,Babenko S.,,The Bohdan Khmelnytsky National University of Cherkasy,Cherkasy,Ukraine,,,,,2019-01-25,25 January 2019,International Journal of Robust and Nonlinear Control,10498923,17987,10991239,Journal,29,2,,433-450,,,12,0,,,,,
