,eid,doi,pii,pubmed_id,title,subtype,subtypeDescription,creator,afid,affilname,affiliation_city,affiliation_country,author_count,author_names,author_ids,author_afids,coverDate,coverDisplayDate,publicationName,issn,source_id,eIssn,aggregationType,volume,issueIdentifier,article_number,pageRange,description,authkeywords,citedby_count,openaccess,freetoread,freetoreadLabel,fund_acr,fund_no,fund_sponsor
862,2-s2.0-85014951053,10.1007/978-3-319-51100-9_28,,,Caregivers routing problem in home health care: Literature review,re,Review,Marcon E.,,Décision et Information pour les Sytèmes de Production,Villeurbanne,France,,,,,2017-01-01,2017,Studies in Computational Intelligence,1860949X,4900152708,,Book Series,694,,,319-326,,,3,0,,,,,
863,2-s2.0-85014933905,10.1007/978-3-319-51100-9_20,,,Analysing the impact of rescheduling time in hybrid manufacturing control,ch,Book Chapter,Jimenez J.F.,,LAMIH;Pontificia Universidad Javeriana,Valenciennes;Bogota,France;Colombia,,,,,2017-01-01,2017,Studies in Computational Intelligence,1860949X,4900152708,,Book Series,694,,,225-236,,,1,0,repositoryam,Green,,,
864,2-s2.0-85014931566,10.1007/978-3-319-51100-9_9,,,"Specifying self-organising logistics system: Openness, intelligence, and decentralised control",ch,Book Chapter,Pan S.,,Centre de Gestion Scientifique,Paris,France,,,,,2017-01-01,2017,Studies in Computational Intelligence,1860949X,4900152708,,Book Series,694,,,93-102,,,7,0,repositoryam,Green,,,
865,2-s2.0-85014920277,10.1007/978-3-319-51100-9_30,,,Active monitoring of a product: A way to solve the “lack of information” issue in the use phase,ch,Book Chapter,Basselot V.,,LAMIH;Université de Lille,Valenciennes;Lille,France;France,,,,,2017-01-01,2017,Studies in Computational Intelligence,1860949X,4900152708,,Book Series,694,,,337-346,,,4,0,,,,,
866,2-s2.0-85014883518,10.1007/978-3-319-51100-9_1,,,Digital transformation in service and computing oriented manufacturing,no,Note,Borangiu T.,,University Politehnica of Bucharest,Bucuresti,Romania,,,,,2017-01-01,2017,Studies in Computational Intelligence,1860949X,4900152708,,Book Series,694,,,1-7,,,2,0,repositoryam,Green,,,
867,2-s2.0-85013372015,10.3390/su9020255,,,Evaluating resiliency of supply chain network: A data envelopment analysis approach,ar,Article,Pourhejazy P.,,LAMIH;Inha University,Valenciennes;Incheon,France;South Korea,,,,,2017-01-01,2017,Sustainability (Switzerland),,21100240100,20711050,Journal,9,2,255,,,,25,1,publisherfullgold,Gold,,,
868,2-s2.0-85011559275,10.1007/s13198-015-0341-y,,,Novel semi-blind estimation for turbo decoding in impulsive noise channel,ar,Article,Chemsa A.,,University of El Oued;Université Mohamed Khider Biskra,El Oued Province;Biskra,Algeria;Algeria,,,,,2017-01-01,1 January 2017,International Journal of System Assurance Engineering and Management,09756809,21101083191,09764348,Journal,8,,,188-197,,,0,0,,,,,
869,2-s2.0-85011547196,10.1177/0037549716680025,,,An evolutionary approach to solve the dynamic multihop ridematching problem,ar,Article,Ben Cheikh S.,,Ecole Centrale de Lille,Villeneuve-d'Ascq,France,,,,,2017-01-01,January 2017,Simulation,00375497,14452,17413133,Journal,93,1,,3-19,,,8,1,publisherfree2read,Bronze,,,
870,2-s2.0-85011031976,,,,An efficient hybrid approach to the remote sensing land cover classification,ar,Article,Zigh E.,,Institut National des Télécommunications et des Technologies de L'Information et de la Communication,Oran,Algeria,,,,,2017-01-01,2017,International Journal of Imaging and Robotics,2231525X,20500195139,,Journal,17,1,,27-42,,,1,0,,,,,
871,2-s2.0-85011015659,10.1049/iet-cds.2015.0318,,,AS8-static random access memory (SRAM): Asymmetric SRAM architecture for soft error hardening enhancement,ar,Article,Alouani I.,,LAMIH;IRT Railenium,Valenciennes;Valenciennes,France;France,,,,,2017-01-01,1 January 2017,"IET Circuits, Devices and Systems",1751858X,5400152712,,Journal,11,1,,89-94,,,25,0,,,,,
872,2-s2.0-85010804129,10.1108/EC-03-2016-0081,,,Macro-modeling of spot weld strength and failure: Formulation and identification procedure based on pure and mixed modes of loading,ar,Article,Chtourou R.,,Ecole Nationale d'Ingénieurs de Sfax;Université Polytechnique Hauts-de-France,Sfax;Valenciennes,Tunisia;France,,,,,2017-01-01,2017,"Engineering Computations (Swansea, Wales)",02644401,18184,,Journal,34,3,,941-959,,,3,0,,,,,
873,2-s2.0-85007324956,10.1002/cta.2308,,,Design exploration of efficient implementation on SoC heterogeneous platform: HEVC intra prediction application,ar,Article,Kammoun M.,,Ecole Nationale d'Ingénieurs de Sfax,Sfax,Tunisia,,,,,2017-01-01,1 January 2017,International Journal of Circuit Theory and Applications,00989886,17963,1097007X,Journal,45,12,,2243-2259,,,15,0,,,,,
874,2-s2.0-84992409648,10.1016/j.proci.2016.07.063,S1540748916303212,,Experimental characterization of the different nitrogen dilution effects on soot formation in ethylene diffusion flames,ar,Article,Wang Q.,,Shanghai Jiao Tong University,Shanghai,China,,,,,2017-01-01,2017,Proceedings of the Combustion Institute,15407489,26880,,Journal,36,2,,3227-3235,,,19,0,repositoryam,Green,,,
875,2-s2.0-84989842116,10.1007/978-3-319-45991-2_13,,,An ontology-based approach for user interface adaptation,cp,Conference Paper,Soui M.,,Université de Gabès,,Tunisia,,,,,2017-01-01,2017,Advances in Intelligent Systems and Computing,21945357,5100152904,,Book Series,512,,,199-215,,,5,0,,,,,
876,2-s2.0-84985032100,10.1016/j.jmatprotec.2016.08.036,S0924013616303120,,Dynamic recrystallization behaviour of spheroidal graphite iron. Application to cutting operations,ar,Article,Le Mercier K.,,LAMIH;Arts et Metiers Institute of Technology,Valenciennes;Paris,France;France,,,,,2017-01-01,1 January 2017,Journal of Materials Processing Technology,09240136,20972,,Journal,239,,,315-325,,,2,0,repositoryvor,Green,,,
877,2-s2.0-84952058904,10.1016/j.fss.2015.12.012,S0165011415005928,,Asymptotically necessary and sufficient conditions for Takagi–Sugeno models using generalized non-quadratic parameter-dependent controller design,ar,Article,Márquez R.,,Université Polytechnique Hauts-de-France;Sonora Institute of Technology,Valenciennes;Ciudad Obregon,France;Mexico,,,,,2017-01-01,1 January 2017,Fuzzy Sets and Systems,01650114,26529,,Journal,306,,,48-62,,,28,0,,,,,
878,2-s2.0-85010065288,10.1109/IECON.2016.7793301,,,Towards a new standard in medical video compression,cp,Conference Paper,Habchi Y.,,Université Tahri Mohammed Béchar,Béchar,Algeria,,,,,2016-12-21,21 December 2016,IECON Proceedings (Industrial Electronics Conference),,56670,,Conference Proceeding,,,7793301,1061-1066,,,1,0,,,,,
879,2-s2.0-85010039102,10.1109/IECON.2016.7793619,,,New and robust method for trabecular bone texture based on fractal dimension,cp,Conference Paper,Zehani S.,,Université Kasdi Merbah - Ouargla,Ouargla,Algeria,,,,,2016-12-21,21 December 2016,IECON Proceedings (Industrial Electronics Conference),,56670,,Conference Proceeding,,,7793619,992-997,,,5,0,,,,,
880,2-s2.0-85010038861,10.1109/IECON.2016.7793180,,,Human-machine cooperation to design Intelligent Manufacturing Systems,cp,Conference Paper,Pacaux-Lemoine M.P.,,Université Polytechnique Hauts-de-France,Valenciennes,France,,,,,2016-12-21,21 December 2016,IECON Proceedings (Industrial Electronics Conference),,56670,,Conference Proceeding,,,7793180,5904-5909,,,7,0,,,,,
881,2-s2.0-84991236488,10.1016/j.neuroscience.2016.09.033,S0306452216304808,27693473,I can't reach it! Focus on theta sensorimotor rhythm toward a better understanding of impaired action–perception coupling,ar,Article,Daviaux Y.,,Université de Nantes,Nantes,France,,,,,2016-12-17,17 December 2016,Neuroscience,03064522,18042,18737544,Journal,339,,,32-46,,,5,0,,,,,
882,2-s2.0-84985911837,10.1016/j.eswa.2016.08.071,S095741741630478X,,A rule-based support system for dissonance discovery and control applied to car driving,ar,Article,Vanderhaegen F.,,LAMIH;CNRS Centre National de la Recherche Scientifique,Valenciennes;Paris,France;France,,,,,2016-12-15,15 December 2016,Expert Systems with Applications,09574174,24201,,Journal,65,,,361-371,,,35,0,,,,,
883,2-s2.0-85006736354,10.1049/iet-cta.2016.0094,,,Fixed-time stabilisation and consensus of non-holonomic systems,ar,Article,Defoort M.,,Université Polytechnique Hauts-de-France,Valenciennes,France,,,,,2016-12-12,12 December 2016,IET Control Theory and Applications,17518644,5100155079,17518652,Journal,10,18,,2497-2505,,,50,0,repositoryam,Green,,,
884,2-s2.0-85010285093,10.1109/MCSoC.2016.38,,,AFFORDe: Automatic Allocation and Floorplanning for SPMD Architecture,cp,Conference Paper,Chouchene W.,,Université de Lille,Lille,France,,,,,2016-12-05,5 December 2016,"Proceedings - IEEE 10th International Symposium on Embedded Multicore/Many-Core Systems-on-Chip, MCSoC 2016",,21100792732,,Conference Proceeding,,,7774413,1-7,,,0,0,,,,,
885,2-s2.0-85010901052,10.1016/j.egypro.2016.11.288,S1876610216314989,,A Smart Pool Search Matheuristic for Solving a Multi-objective Microgrid Storage Planning Problem,cp,Conference Paper,Coelho V.N.,,Universidade Federal de Minas Gerais;Instituto de Pesquisa e Desenvolvimento de Tecnologias,Belo Horizonte;Ouro Preto,Brazil;Brazil,,,,,2016-12-01,1 December 2016,Energy Procedia,18766102,17700156736,,Conference Proceeding,103,,,292-297,,,4,1,publisherfree2read,Bronze,,,
886,2-s2.0-85001955841,10.1162/EVCO_a_00187,,27258842,Hybrid self-adaptive evolution strategies guided by neighborhood structures for combinatorial optimization problems,ar,Article,Coelho V.N.,,Universidade Federal de Minas Gerais;Universidade Federal de Ouro Preto,Belo Horizonte;Ouro Preto,Brazil;Brazil,,,,,2016-12-01,1 December 2016,Evolutionary Computation,10636560,24966,15309304,Journal,24,4,,637-666,,,10,0,,,,,
887,2-s2.0-84997848615,10.1016/j.scispo.2016.08.002,S0765159716300831,,Perceived exertion responses and performance of two mode of propulsion in the multistage field test with wheelchair basketball players,ar,Article,Astier M.,,Université Côte d'Azur;Universite du Sud Toulon - Var;Comité Régional Handisport de Provence-Alpes Côte d'Azur,Nice;La Garde;Marseille,France;France;France,,,,,2016-12-01,1 December 2016,Science and Sports,07651597,20349,17784131,Journal,31,6,,e181-e188,,,1,0,,,,,
888,2-s2.0-84997207383,10.1016/j.hansur.2016.07.009,S2468122916301268,27890208,"Descriptive, radiographic, topographic and functional anatomy applied to distal radius fractures",sh,Short Survey,Fontaine C.,,Université de Lille;Université Polytechnique Hauts-de-France;CHU Lille,Lille;Valenciennes;Lille,France;France;France,,,,,2016-12-01,1 December 2016,Hand Surgery and Rehabilitation,24681229,21100456711,24681210,Journal,35,,,S3-S14,,,2,0,,,,,
889,2-s2.0-84996836001,10.1109/TIE.2016.2590993,,,A Robust Observer-Based Sensor Fault-Tolerant Control for PMSM in Electric Vehicles,ar,Article,Kommuri S.K.,,Kyungpook National University,Daegu,South Korea,,,,,2016-12-01,December 2016,IEEE Transactions on Industrial Electronics,02780046,26053,,Journal,63,12,7511702,7671-7681,,,265,0,,,,,
890,2-s2.0-84992525087,10.1016/j.jprocont.2016.10.001,S0959152416301366,,New MPPT algorithm for PV applications based on hybrid dynamical approach,ar,Article,Elmetennani S.,,King Abdullah University of Science and Technology,Thuwal,Saudi Arabia,,,,,2016-12-01,1 December 2016,Journal of Process Control,09591524,14414,,Journal,48,,,14-24,,,17,0,,,,,
891,2-s2.0-84989948354,10.1080/10447318.2016.1220068,,,Integration of Subjective and Objective Usability Evaluation Based on IEC/IEC 15939: A Case Study for Traffic Supervision Systems,ar,Article,Assila A.,,University of Sfax;Université Polytechnique Hauts-de-France,Sfax;Valenciennes,Tunisia;France,,,,,2016-12-01,1 December 2016,International Journal of Human-Computer Interaction,10447318,19420,15327590,Journal,32,12,,931-955,,,10,0,,,,,
892,2-s2.0-84987630009,10.1115/1.4034198,,,Electrochemical Measurements for Real-Time Stochastic Reconstruction of Large-Scale Dynamics of a Separated Flow,ar,Article,Fadla F.,,Université Polytechnique Hauts-de-France,Valenciennes,France,,,,,2016-12-01,1 December 2016,"Journal of Fluids Engineering, Transactions of the ASME",00982202,18538,1528901X,Journal,138,12,121204,,,,4,0,,,,,
893,2-s2.0-84978878090,10.1016/j.jmatprotec.2016.07.022,S0924013616302394,,A methodology for the viscoplastic behaviour characterisation of spot-weld heat affected materials,ar,Article,Markiewicz É.,,Université Polytechnique Hauts-de-France,Valenciennes,France,,,,,2016-12-01,1 December 2016,Journal of Materials Processing Technology,09240136,20972,,Journal,238,,,169-180,,,7,0,,,,,
894,2-s2.0-84965002365,10.1080/00207543.2016.1177237,,,A switching mechanism framework for optimal coupling of predictive scheduling and reactive control in manufacturing hybrid control architectures,ar,Article,Jimenez J.F.,,Pontificia Universidad Javeriana;Université Polytechnique Hauts-de-France,Bogota;Valenciennes,Colombia;France,,,,,2016-12-01,1 December 2016,International Journal of Production Research,00207543,27656,1366588X,Journal,54,23,,7027-7042,,,8,0,repositoryvor,Green,,,
895,2-s2.0-84964247498,10.1007/s10288-016-0315-1,,,GRASP-based heuristic algorithm for the multi-product multi-vehicle inventory routing problem,ar,Article,Guemri O.,,Université Oran,Oran,Algeria,,,,,2016-12-01,1 December 2016,4OR,16194500,145295,16142411,Journal,14,4,,377-404,,,9,0,,,,,
896,2-s2.0-85006466680,10.1109/EFEA.2016.7748778,,,Fault detection and diagnosis from a hybrid system point of view,cp,Conference Paper,Feng G.,,Université Polytechnique Hauts-de-France,Valenciennes,France,,,,,2016-11-18,18 November 2016,"4th International Symposium on Environment Friendly Energies and Applications, EFEA 2016",,21100788914,,Conference Proceeding,,,7748778,,,,0,0,,,,,
897,2-s2.0-84983033974,10.1080/17461391.2016.1185163,,27210455,The influence of shoe drop on the kinematics and kinetics of children tennis players,ar,Article,Herbaut A.,,Decathlon S.A.;Université Polytechnique Hauts-de-France,Villeneuve-d'Ascq;Valenciennes,France;France,,,,,2016-11-16,16 November 2016,European Journal of Sport Science,17461391,5800207375,15367290,Journal,16,8,,1121-1129,,,4,0,,,,,
898,2-s2.0-84994112566,10.1016/j.knosys.2016.09.009,S0950705116303252,,Enhanced visual data mining process for dynamic decision-making,ar,Article,Ltifi H.,,Université de Kairouan;Ecole Nationale d'Ingénieurs de Sfax,Kairouan;Sfax,Tunisia;Tunisia,,,,,2016-11-15,15 November 2016,Knowledge-Based Systems,09507051,24772,,Journal,112,,,166-181,,,24,0,,,,,
899,2-s2.0-85006826687,10.1109/FUZZ-IEEE.2016.7737712,,,Direct adaptive fuzzy control for a class of nonlinear systems with unknown control gain sign,cp,Conference Paper,Labiod S.,,Université de Jijel,Jijel,Algeria,,,,,2016-11-07,7 November 2016,"2016 IEEE International Conference on Fuzzy Systems, FUZZ-IEEE 2016",,21100789851,,Conference Proceeding,,,7737712,380-385,,,2,0,,,,,
900,2-s2.0-85006818097,10.1109/FUZZ-IEEE.2016.7737987,,,How a person with spinal cord injury controls a sitting situation: Unknown input observer and delayed feedback control with time-varying input delay,cp,Conference Paper,Blandeau M.,,Université Polytechnique Hauts-de-France,Valenciennes,France,,,,,2016-11-07,7 November 2016,"2016 IEEE International Conference on Fuzzy Systems, FUZZ-IEEE 2016",,21100789851,,Conference Proceeding,,,7737987,2349-2356,,,6,0,,,,,
901,2-s2.0-85006750540,10.1109/FUZZ-IEEE.2016.7737988,,,Dual clutch torque estimation: Based on an angular discrete domain takagi-sugeno switched observer,cp,Conference Paper,Losero R.,,LAMIH,Valenciennes,France,,,,,2016-11-07,7 November 2016,"2016 IEEE International Conference on Fuzzy Systems, FUZZ-IEEE 2016",,21100789851,,Conference Proceeding,,,7737988,2357-2363,,,5,0,,,,,
902,2-s2.0-85006744022,10.1109/FUZZ-IEEE.2016.7737967,,,Replica of an Advanced Takagi-Sugeno discrete observer without matrix inversion,cp,Conference Paper,Laurain T.,,CNRS Centre National de la Recherche Scientifique,Paris,France,,,,,2016-11-07,7 November 2016,"2016 IEEE International Conference on Fuzzy Systems, FUZZ-IEEE 2016",,21100789851,,Conference Proceeding,,,7737967,2206-2211,,,2,0,,,,,
903,2-s2.0-85006700564,10.1109/FUZZ-IEEE.2016.7737963,,,Local quadratic and nonquadratic stabilization of discrete-Time TS fuzzy systems,cp,Conference Paper,Lendek Z.,,Technical University of Cluj-Napoca,Cluj-Napoca,Romania,,,,,2016-11-07,7 November 2016,"2016 IEEE International Conference on Fuzzy Systems, FUZZ-IEEE 2016",,21100789851,,Conference Proceeding,,,7737963,2182-2187,,,3,0,,,,,
904,2-s2.0-84998829047,10.1016/j.micpro.2016.07.020,S0141933116301156,,EQUITAS: A tool-chain for functional safety and reliability improvement in automotive systems,ar,Article,Nouacer R.,,Commissariat a L'Energie Atomique CEA,Gif-sur-Yvette,France,,,,,2016-11-01,1 November 2016,Microprocessors and Microsystems,01419331,15552,,Journal,47,,,252-261,,,5,0,,,,,
905,2-s2.0-84997497748,10.1016/j.microrel.2016.10.002,S0026271416303882,,Solder fatigue failures in a new designed power module under Power Cycling,ar,Article,Durand C.,,Université Polytechnique Hauts-de-France;Robert Bosch GmbH,Valenciennes;Gerlingen,France;Germany,,,,,2016-11-01,1 November 2016,Microelectronics Reliability,00262714,26717,,Journal,66,,,122-133,,,25,0,,,,,
906,2-s2.0-84988672799,10.1016/j.sysconle.2016.08.005,S0167691116301116,,State feedback stabilization of a class of uncertain nonlinear systems on non-uniform time domains,ar,Article,Ben Nasser B.,,University of Sfax,Sfax,Tunisia,,,,,2016-11-01,1 November 2016,Systems and Control Letters,01676911,25563,,Journal,97,,,18-26,,,24,0,,,,,
907,2-s2.0-84982136554,10.1016/j.molliq.2016.08.038,S0167732216319833,,Symmetry analysis for film boiling of nanofluids on a vertical plate using a nonlinear approach,ar,Article,Avramenko A.A.,,National Academy of Sciences in Ukraine,Kiev,Ukraine,,,,,2016-11-01,1 November 2016,Journal of Molecular Liquids,01677322,26965,,Journal,223,,,156-164,,,13,0,,,,,
908,2-s2.0-84977275714,10.1016/j.ijimpeng.2016.05.018,S0734743X16303074,,"Design of a pre-stretched tension Hopkinson bar device: Configuration, tail corrections, and numerical validation",ar,Article,Haugou G.,,Université Polytechnique Hauts-de-France,Valenciennes,France,,,,,2016-11-01,1 November 2016,International Journal of Impact Engineering,0734743X,12383,,Journal,97,,,89-101,,,11,0,,,,,
909,2-s2.0-84973454852,10.1016/j.ijthermalsci.2016.05.018,S1290072916306135,,Liquid film evaporation inside an inclined channel: Effect of the presence of a porous layer,ar,Article,Terzi A.,,"Université de Tunis El Manar, Faculté des Sciences de Tunis;University of Carthage",Tunis;Carthage,Tunisia;Tunisia,,,,,2016-11-01,1 November 2016,International Journal of Thermal Sciences,12900729,13761,,Journal,109,,,136-147,,,13,0,,,,,
910,2-s2.0-84969802519,10.1016/j.cor.2016.04.018,S0305054816300880,,An adaptive perturbation-based heuristic: An application to the continuous p-centre problem,ar,Article,Elshaikh A.,,Kent Business School;University of Misurata,Canterbury;,United Kingdom;Libyan Arab Jamahiriya,,,,,2016-11-01,1 November 2016,Computers and Operations Research,03050548,24355,,Journal,75,,,1-11,,,11,0,repositoryam,Green,,,
911,2-s2.0-84969533177,10.1016/j.edurev.2016.04.002,S1747938X16300161,,"Forty years later, a systematic literature review on inclusion in physical education (1975-2015): A teacher perspective",re,Review,Tant M.,,Universite d'Artois,Arras,France,,,,,2016-11-01,1 November 2016,Educational Research Review,1747938X,4700152248,,Journal,19,,,1-17,,,49,0,,,,,
912,2-s2.0-84929687623,10.1007/s10209-015-0409-0,,,Toward an intuitive sign language animation authoring system for the deaf,ar,Article,Heloir A.,,LAMIH;German Research Center for Artificial Intelligence (DFKI),Valenciennes;Kaiserslautern,France;Germany,,,,,2016-11-01,1 November 2016,Universal Access in the Information Society,16155289,2600147401,16155297,Journal,15,4,,513-523,,,7,0,,,,,
913,2-s2.0-84998772000,10.1109/DSD.2016.12,,,NS-SRAM: Neighborhood Solidarity SRAM for Reliability Enhancement of SRAM Memories,cp,Conference Paper,Alouani I.,,LAMIH,Valenciennes,France,,,,,2016-10-26,26 October 2016,"Proceedings - 19th Euromicro Conference on Digital System Design, DSD 2016",,21100787306,,Conference Proceeding,,,7723548,154-159,,,0,0,repositoryvor,Green,,,
914,2-s2.0-85000376725,10.1145/3004107.3004124,,,Verification and validation of interactive systems in the CMMI-DEV capability maturity model,cp,Conference Paper,Gonçalves T.G.,,LAMIH,Valenciennes,France,,,,,2016-10-25,25 October 2016,IHM 2016 - Actes de la 28ieme Conference Francophone sur l'Interaction Homme-Machine,,21100787774,,Conference Proceeding,,,,48-58,,,0,0,repositoryam,Green,,,
915,2-s2.0-84995380317,10.1088/1742-6596/745/3/032032,,,A thermal study of power cables cooling in tunnels,cp,Conference Paper,Boukrouche F.,,Electricité de France,Paris,France,,,,,2016-10-21,21 October 2016,Journal of Physics: Conference Series,17426588,130053,17426596,Conference Proceeding,745,3,032032,,,,3,1,repositoryam,Green,,,
916,2-s2.0-84995502135,10.1109/CoDIT.2016.7593629,,,An ant colony algorithm based on opportunities for scheduling the preventive railway maintenance,cp,Conference Paper,Khalouli S.,,Institut de Recherche Technologique Railenium,Valenciennes,France,,,,,2016-10-18,18 October 2016,"International Conference on Control, Decision and Information Technologies, CoDIT 2016",,21100785493,,Conference Proceeding,,,7593629,594-599,,,7,0,,,,,
917,2-s2.0-84982830495,10.1016/j.enconman.2016.07.085,S019689041630663X,,Experimental investigation on the evaporation of a wet porous layer inside a vertical channel with resolution of the heat equation by inverse method,ar,Article,Terzi A.,,"Université de Tunis El Manar, Faculté des Sciences de Tunis;University of Carthage",Tunis;Carthage,Tunisia;Tunisia,,,,,2016-10-15,15 October 2016,Energy Conversion and Management,01968904,29372,,Journal,126,,,158-167,,,9,0,,,,,
918,2-s2.0-84995480687,10.1109/ICIRT.2016.7588733,,,Train timetabling during infrastructure maintenance activities,cp,Conference Paper,Arenas D.,,"IFSTTAR - French institute of science and technology for transport, development and networks;Université de Lille;Université Polytechnique Hauts-de-France;FCS Railenium",Marne-la-Vallee;Lille;Valenciennes;Valenciennes,France;France;France;France,,,,,2016-10-11,11 October 2016,"2016 IEEE International Conference on Intelligent Rail Transportation, ICIRT 2016",,21100785498,,Conference Proceeding,,,7588733,204-209,,,1,0,,,,,
919,2-s2.0-84994817327,10.1145/2994258.2994278,,,Introducing postural variability improves the distribution of muscular loads during mid-air gestural interaction,cp,Conference Paper,Nunnari F.,,German Research Center for Artificial Intelligence (DFKI),Kaiserslautern,Germany,,,,,2016-10-10,10 October 2016,"Proceedings - Motion in Games 2016: 9th International Conference on Motion in Games, MIG 2016",,21100784999,,Conference Proceeding,,,2994278,155-160,,,2,0,,,,,
920,2-s2.0-84958544432,10.1080/00140139.2016.1142122,,26772648,A reliable measure of footwear upper comfort enabled by an innovative sock equipped with textile pressure sensors,ar,Article,Herbaut A.,,Decathlon S.A.;Université Polytechnique Hauts-de-France,Villeneuve-d'Ascq;Valenciennes,France;France,,,,,2016-10-02,2 October 2016,Ergonomics,00140139,29178,13665847,Journal,59,10,,1327-1334,,,11,0,,,,,
921,2-s2.0-84984599950,10.1016/j.sna.2016.08.016,S0924424716303910,,Dynamic characterization of piezoelectric micro-blowers for separation flow control,ar,Article,Chovet C.,,LAMIH,Valenciennes,France,,,,,2016-10-01,1 October 2016,"Sensors and Actuators, A: Physical",09244247,13660,,Journal,249,,,122-130,,,11,0,,,,,
922,2-s2.0-84982682917,10.1016/j.ijadhadh.2016.07.015,S0143749616301506,,A viscoelastic‐viscoplastic model with non associative plasticity for the modelling of bonded joints at high strain rates,ar,Article,Dufour L.,,Université Polytechnique Hauts-de-France,Valenciennes,France,,,,,2016-10-01,1 October 2016,International Journal of Adhesion and Adhesives,01437496,13639,,Journal,70,,,304-314,,,13,0,,,,,
923,2-s2.0-84975522184,10.1016/j.jmbbm.2016.06.008,S1751616116301746,27341290,On the mechanical characterization and modeling of polymer gel brain substitute under dynamic rotational loading,ar,Article,Fontenier B.,,Université Polytechnique Hauts-de-France,Valenciennes,France,,,,,2016-10-01,1 October 2016,Journal of the Mechanical Behavior of Biomedical Materials,17516161,8000153139,18780180,Journal,63,,,44-55,,,8,0,,,,,
924,2-s2.0-84973457907,10.1016/j.engappai.2016.05.006,S0952197616300963,,A hybrid quantum particle swarm optimization for the Multidimensional Knapsack Problem,ar,Article,Haddar B.,,University of Sfax,Sfax,Tunisia,,,,,2016-10-01,1 October 2016,Engineering Applications of Artificial Intelligence,09521976,24182,,Journal,55,,,1-13,,,63,0,,,,,
925,2-s2.0-84962625294,10.1109/TITS.2016.2536683,,,"Rollover Index Estimation in the Presence of Sensor Faults, Unknown Inputs, and Uncertainties",ar,Article,Rath J.J.,,Kyungpook National University,Daegu,South Korea,,,,,2016-10-01,October 2016,IEEE Transactions on Intelligent Transportation Systems,15249050,18378,,Journal,17,10,7442173,2949-2959,,,28,0,,,,,
926,2-s2.0-84989191877,10.1021/acs.langmuir.6b02564,,,Evaporation of binary sessile drops: Infrared and acoustic methods to track alcohol concentration at the interface and on the surface,ar,Article,Chen P.,,Université Polytechnique Hauts-de-France,Valenciennes,France,,,,,2016-09-27,27 September 2016,Langmuir,07437463,26987,15205827,Journal,32,38,,9836-9845,,,21,0,,,,,
