,eid,doi,pii,pubmed_id,title,subtype,subtypeDescription,creator,afid,affilname,affiliation_city,affiliation_country,author_count,author_names,author_ids,author_afids,coverDate,coverDisplayDate,publicationName,issn,source_id,eIssn,aggregationType,volume,issueIdentifier,article_number,pageRange,description,authkeywords,citedby_count,openaccess,freetoread,freetoreadLabel,fund_acr,fund_no,fund_sponsor
644,2-s2.0-85055828069,10.1007/978-3-030-00856-7_21,,,Formalizing railway signaling system ERTMS/ETCS using UML/Event-B,cp,Conference Paper,Ait Wakrime A.,,Institut de Recherche Technologique Railenium,Famars,France,,,,,2018-01-01,2018,Lecture Notes in Computer Science (including subseries Lecture Notes in Artificial Intelligence and Lecture Notes in Bioinformatics),03029743,25674,16113349,Book Series,11163 LNCS,,,321-330,,,5,0,,,,,
645,2-s2.0-85055715148,10.24963/ijcai.2018/646,,,Scheduling under uncertainty: A Query-based Approach,cp,Conference Paper,Arantes L.,,Sorbonne Universite,Paris,France,,,,,2018-01-01,2018,IJCAI International Joint Conference on Artificial Intelligence,10450823,19400157504,,Conference Proceeding,2018-July,,,4646-4652,,,6,1,repositoryam,Green,,,
646,2-s2.0-85055706996,10.1109/ACCESS.2018.2878311,,,Applied graph transformation and verification with use cases in malaria surveillance,ar,Article,Brenas J.H.,,University of Tennessee Health Science Center,Memphis,United States,,,,,2018-01-01,2018,IEEE Access,,21100374601,21693536,Journal,6,,8513828,64728-64741,,,4,1,publisherfullgold,Gold,,,
647,2-s2.0-85055688300,,,,Prime Implicate Generation in Equational Logic,cp,Conference Paper,Echenim M.,,Laboratoire d'Informatique de Grenoble,Saint Martin d'Heres,France,,,,,2018-01-01,2018,IJCAI International Joint Conference on Artificial Intelligence,10450823,19400157504,,Conference Proceeding,2018-July,,,5588-5592,,,0,0,,,,,
648,2-s2.0-85055684432,10.1007/978-3-030-01768-2_11,,,Multiview learning of weighted majority vote by bregman divergence minimization,cp,Conference Paper,Goyal A.,,Universite Grenoble Alpes;Laboratoire Hubert Curien UMR CNRS 5516,Saint Martin d'Heres;Saint-Etienne,France;France,,,,,2018-01-01,2018,Lecture Notes in Computer Science (including subseries Lecture Notes in Artificial Intelligence and Lecture Notes in Bioinformatics),03029743,25674,16113349,Book Series,11191 LNCS,,,124-136,,,1,0,repositoryam,Green,,,
649,2-s2.0-85055683095,10.1007/978-3-319-77116-8_42,,,Efficient association rules selecting for automatic query expansion,cp,Conference Paper,Bouziri A.,,"Université de Tunis El Manar, Faculté des Sciences de Tunis;Université de la Manouba",Tunis;Manouba,Tunisia;Tunisia,,,,,2018-01-01,2018,Lecture Notes in Computer Science (including subseries Lecture Notes in Artificial Intelligence and Lecture Notes in Bioinformatics),03029743,25674,16113349,Book Series,10762 LNCS,,,563-574,,,5,0,,,,,
650,2-s2.0-85055441113,10.1007/978-3-319-77113-7_6,,,Several ways to use the lingwarium.org online MT collaborative platform to develop rich morphological analyzers,cp,Conference Paper,Berment V.,,Institut national des langues et civilisations orientales,Paris,France,,,,,2018-01-01,2018,Lecture Notes in Computer Science (including subseries Lecture Notes in Artificial Intelligence and Lecture Notes in Bioinformatics),03029743,25674,16113349,Book Series,10761 LNCS,,,81-86,,,0,0,,,,,
651,2-s2.0-85055265720,10.1504/IJWGS.2018.095660,,,πSOD-M: Building SOC applications in the presence of non-functional requirements,ar,Article,Belhajjame K.,,Université Paris-Dauphine,Paris,France,,,,,2018-01-01,2018,International Journal of Web and Grid Services,17411106,6700153282,17411114,Journal,14,4,,400-431,,,0,0,repositoryvor,Green,,,
652,2-s2.0-85054965945,10.21437/Interspeech.2018-1308,,,Unsupervised word segmentation from speech with attention,cp,Conference Paper,Godard P.,,Universite Paris-Saclay,Saint-Aubin,France,,,,,2018-01-01,2018,"Proceedings of the Annual Conference of the International Speech Communication Association, INTERSPEECH",2308457X,21100212301,19909772,Conference Proceeding,2018-September,,,2678-2682,,,8,0,repositoryam,Green,,,
653,2-s2.0-85054964725,10.21437/Interspeech.2018-996,,,Bags in Bag: Generating context-aware bags for tracking emotions from speech,cp,Conference Paper,Han J.,,Universität Augsburg,Augsburg,Germany,,,,,2018-01-01,2018,"Proceedings of the Annual Conference of the International Speech Communication Association, INTERSPEECH",2308457X,21100212301,19909772,Conference Proceeding,2018-September,,,3082-3086,,,10,0,repositoryam,Green,,,
654,2-s2.0-85054962129,10.21437/Interspeech.2018-61,,,Voice comparison and rhythm: Behavioral Differences between Target and Non-target Comparisons,cp,Conference Paper,Ajili M.,,Université d'Avignon et des Pays du Vaucluse,Avignon,France,,,,,2018-01-01,2018,"Proceedings of the Annual Conference of the International Speech Communication Association, INTERSPEECH",2308457X,21100212301,19909772,Conference Proceeding,2018-September,,,1061-1065,,,1,0,repositoryam,Green,,,
655,2-s2.0-85054826274,10.1007/978-3-030-00847-5_16,,,Towards quality analysis for document oriented bases,cp,Conference Paper,Gómez P.,,Laboratoire d'Informatique de Grenoble,Saint Martin d'Heres,France,,,,,2018-01-01,2018,Lecture Notes in Computer Science (including subseries Lecture Notes in Artificial Intelligence and Lecture Notes in Bioinformatics),03029743,25674,16113349,Book Series,11157 LNCS,,,200-216,,,7,0,repositoryam,Green,,,
656,2-s2.0-85054760023,,,,A simple and efficient algorithm to compute epsilon-equilibria of discrete colonel blotto games,cp,Conference Paper,Vu D.Q.,,Nokia Bell Labs,Murray,United States,,,,,2018-01-01,2018,"Proceedings of the International Joint Conference on Autonomous Agents and Multiagent Systems, AAMAS",15488403,21100310020,15582914,Conference Proceeding,3,,,2115-2117,,,1,0,,,,,
657,2-s2.0-85054719213,10.24963/ijcai.2018/72,,,Efficient computation of approximate equilibria in discrete Colonel blotto games,cp,Conference Paper,Vu D.Q.,,Nokia Bell Labs,Murray,United States,,,,,2018-01-01,2018,IJCAI International Joint Conference on Artificial Intelligence,10450823,19400157504,,Conference Proceeding,2018-July,,,519-526,,,5,1,repositoryam,Green,,,
658,2-s2.0-85053937313,10.1007/978-3-319-99840-4_5,,,Symbolic specification and verification of data-aware BPMN processes using rewriting modulo SMT,cp,Conference Paper,Durán F.,,Universidad de Málaga,Malaga,Spain,,,,,2018-01-01,2018,Lecture Notes in Computer Science (including subseries Lecture Notes in Artificial Intelligence and Lecture Notes in Bioinformatics),03029743,25674,16113349,Book Series,11152 LNCS,,,76-97,,,3,0,repositoryam,Green,,,
659,2-s2.0-85053874681,10.1007/978-3-030-00794-2_55,,,Towards a french smart-home voice command corpus: Design and NLU experiments,cp,Conference Paper,Desot T.,,Laboratoire d'Informatique de Grenoble,Saint Martin d'Heres,France,,,,,2018-01-01,2018,Lecture Notes in Computer Science (including subseries Lecture Notes in Artificial Intelligence and Lecture Notes in Bioinformatics),03029743,25674,16113349,Book Series,11107 LNAI,,,509-517,,,10,0,repositoryam,Green,,,
660,2-s2.0-85053860945,10.1007/978-3-319-99840-4_1,,,"Benchmarking implementations of term rewriting and pattern matching in algebraic, functional, and object-oriented languages: The 4th rewrite engines competition",cp,Conference Paper,Garavel H.,,Laboratoire d'Informatique de Grenoble,Saint Martin d'Heres,France,,,,,2018-01-01,2018,Lecture Notes in Computer Science (including subseries Lecture Notes in Artificial Intelligence and Lecture Notes in Bioinformatics),03029743,25674,16113349,Book Series,11152 LNCS,,,1-25,,,9,0,,,,,
661,2-s2.0-85053667535,10.3233/SW-180321,,,Semantic technologies and interoperability in the built environment,re,Review,Pauwels P.,,Universiteit Gent,Ghent,Belgium,,,,,2018-01-01,2018,Semantic Web,15700844,21100269620,22104968,Journal,9,6,,731-734,,,4,1,repositoryvor,Green,,,
662,2-s2.0-85053610943,10.1007/978-3-030-00244-2_2,,,Building Correct Cyber-Physical Systems: Why We Need a Multiview Contract Theory,cp,Conference Paper,Graf S.,,Verimag,Saint Martin d'Heres,France,,,,,2018-01-01,2018,Lecture Notes in Computer Science (including subseries Lecture Notes in Artificial Intelligence and Lecture Notes in Bioinformatics),03029743,25674,16113349,Book Series,11119 LNCS,,,19-31,,,4,0,repositoryam,Green,,,
663,2-s2.0-85053608545,10.1007/978-3-030-00244-2_13,,,Compositional Verification in Action,cp,Conference Paper,Garavel H.,,Laboratoire d'Informatique de Grenoble,Saint Martin d'Heres,France,,,,,2018-01-01,2018,Lecture Notes in Computer Science (including subseries Lecture Notes in Artificial Intelligence and Lecture Notes in Bioinformatics),03029743,25674,16113349,Book Series,11119 LNCS,,,189-210,,,7,0,repositoryam,Green,,,
664,2-s2.0-85053592968,10.1007/978-3-030-00244-2_19,,,Evaluation and Comparison of Real-Time Systems Analysis Methods and Tools,cp,Conference Paper,Quinton S.,,Laboratoire d'Informatique de Grenoble,Saint Martin d'Heres,France,,,,,2018-01-01,2018,Lecture Notes in Computer Science (including subseries Lecture Notes in Artificial Intelligence and Lecture Notes in Bioinformatics),03029743,25674,16113349,Book Series,11119 LNCS,,,284-290,,,4,0,repositoryam,Green,,,
665,2-s2.0-85053551589,10.1007/978-3-319-99498-7_20,,,Checkpoint/rollback vs causally-consistent reversibility,cp,Conference Paper,Vassor M.,,Laboratoire d'Informatique de Grenoble,Saint Martin d'Heres,France,,,,,2018-01-01,2018,Lecture Notes in Computer Science (including subseries Lecture Notes in Artificial Intelligence and Lecture Notes in Bioinformatics),03029743,25674,16113349,Book Series,11106 LNCS,,,286-303,,,6,0,repositoryam,Green,,,
666,2-s2.0-85053145044,10.1007/978-3-319-98938-9_15,,,Facilitating the implementation of distributed systems with heterogeneous interactions,cp,Conference Paper,Kobeissi S.,,Université de Strasbourg,Strasbourg,France,,,,,2018-01-01,2018,Lecture Notes in Computer Science (including subseries Lecture Notes in Artificial Intelligence and Lecture Notes in Bioinformatics),03029743,25674,16113349,Book Series,11023 LNCS,,,255-274,,,2,0,repositoryam,Green,,,
667,2-s2.0-85052945057,10.1007/978-3-319-96983-1_15,,,Interference-Aware Scheduling Using Geometric Constraints,cp,Conference Paper,Bleuse R.,,Laboratoire d'Informatique de Grenoble;University of Luxembourg,Saint Martin d'Heres;Esch-sur-Alzette,France;Luxembourg,,,,,2018-01-01,2018,Lecture Notes in Computer Science (including subseries Lecture Notes in Artificial Intelligence and Lecture Notes in Bioinformatics),03029743,25674,16113349,Book Series,11014 LNCS,,,205-217,,,3,0,repositoryam,Green,,,
668,2-s2.0-85052785001,10.1007/978-3-319-98812-2_47,,,Combining bilingual lexicons extracted from comparable corpora: The complementary approach between word embedding and text mining,cp,Conference Paper,Belhaj Rhouma S.,,"Université de Tunis El Manar, Faculté des Sciences de Tunis",Tunis,Tunisia,,,,,2018-01-01,2018,Lecture Notes in Computer Science (including subseries Lecture Notes in Artificial Intelligence and Lecture Notes in Bioinformatics),03029743,25674,16113349,Book Series,11030 LNCS,,,510-518,,,0,0,,,,,
669,2-s2.0-85052707697,10.1007/978-3-319-95246-8_15,,,Lossy Channels in a Dataflow Model of Computation,ch,Book Chapter,Fradet P.,,Laboratoire d'Informatique de Grenoble,Saint Martin d'Heres,France,,,,,2018-01-01,2018,Lecture Notes in Computer Science (including subseries Lecture Notes in Artificial Intelligence and Lecture Notes in Bioinformatics),03029743,25674,16113349,Book Series,10760 LNCS,,,254-266,,,1,0,,,,,
670,2-s2.0-85051715208,10.5220/0006557900830093,,,Towards an agent-based model to monitor epidemics and chronic diseases in DR congo,cp,Conference Paper,Mfumu J.C.T.,,Laboratoire d'Informatique de Grenoble,Saint Martin d'Heres,France,,,,,2018-01-01,2018,"HEALTHINF 2018 - 11th International Conference on Health Informatics, Proceedings; Part of 11th International Joint Conference on Biomedical Engineering Systems and Technologies, BIOSTEC 2018",,21100873444,,Conference Proceeding,5,,,83-93,,,3,1,repositoryam,Green,,,
671,2-s2.0-85051278814,10.1016/j.procs.2018.04.055,S1877050918304083,,IoV distributed architecture for real-time traffic data analytics,cp,Conference Paper,Nahri M.,,Faculté des Sciences et Techniques de Mohammedia,Mohammedia,Morocco,,,,,2018-01-01,2018,Procedia Computer Science,,19700182801,18770509,Conference Proceeding,130,,,480-487,,,13,1,publisherfullgold,Gold,,,
672,2-s2.0-85051141395,10.1007/978-3-319-96562-8_7,,,Inferring FSM models of systems without reset,cp,Conference Paper,Groz R.,,Laboratoire d'Informatique de Grenoble,Saint Martin d'Heres,France,,,,,2018-01-01,2018,Lecture Notes in Computer Science (including subseries Lecture Notes in Artificial Intelligence and Lecture Notes in Bioinformatics),03029743,25674,16113349,Book Series,11026 LNCS,,,178-201,,,4,0,,,,,
673,2-s2.0-85051140870,10.1007/978-3-319-94640-5_6,,,"Preliminary evaluations of AMBRE-KB, an authoring tool to elicit knowledge to be taught without programming",cp,Conference Paper,Diattara A.,,Laboratoire d'Informatique de Grenoble;Université Claude Bernard Lyon 1,Saint Martin d'Heres;Villeurbanne,France;France,,,,,2018-01-01,2018,Communications in Computer and Information Science,18650929,17700155007,,Book Series,865,,,116-137,,,0,0,,,,,
674,2-s2.0-85051062027,10.1007/978-3-319-98932-7_26,,,Overview of the CLEF ehealth evaluation lab 2018,cp,Conference Paper,Suominen H.,,The Australian National University;Turun yliopisto,Canberra;Turku,Australia;Finland,,,,,2018-01-01,2018,Lecture Notes in Computer Science (including subseries Lecture Notes in Artificial Intelligence and Lecture Notes in Bioinformatics),03029743,25674,16113349,Book Series,11018 LNCS,,,286-301,,,54,0,repositoryam,Green,,,
675,2-s2.0-85050137695,10.1016/j.ifacol.2018.06.288,S2405896318306189,,Symbolic Limited Lookahead Control for Best-effort Dynamic Computing Resource Management<sup>⁎</sup>,cp,Conference Paper,Berthier N.,,University of Liverpool,Liverpool,United Kingdom,,,,,2018-01-01,1 January 2018,,,,24058963,Conference Proceeding,51,7,,112-119,,,0,1,repositoryam,Green,,,
676,2-s2.0-85049993287,10.1007/978-3-319-94205-6_25,,,Superposition with Datatypes and Codatatypes,cp,Conference Paper,Blanchette J.C.,,Vrije Universiteit Amsterdam;Max Planck Institute for Informatics,Amsterdam;Saarbrucken,Netherlands;Germany,,,,,2018-01-01,2018,Lecture Notes in Computer Science (including subseries Lecture Notes in Artificial Intelligence and Lecture Notes in Bioinformatics),03029743,25674,16113349,Book Series,10900 LNAI,,,370-387,,,7,0,repositoryam,Green,,,
677,2-s2.0-85049963958,10.1007/978-3-319-94205-6_5,,,A Tableaux Calculus for Reducing Proof Size,cp,Conference Paper,Lettmann M.P.,,Technische Universität Wien,Vienna,Austria,,,,,2018-01-01,2018,Lecture Notes in Computer Science (including subseries Lecture Notes in Artificial Intelligence and Lecture Notes in Bioinformatics),03029743,25674,16113349,Book Series,10900 LNAI,,,64-80,,,1,0,repositoryam,Green,,,
678,2-s2.0-85049960194,,,,A multi-agent based approach for simulating the impact of human behaviours on air pollution,ar,Article,Ghazi S.,,Université Badji Mokhtar - Annaba,Annaba,Algeria,,,,,2018-01-01,2018,Informatica (Slovenia),03505596,25507,18543871,Journal,42,2,,199-209,,,2,0,,,,,
679,2-s2.0-85049944876,10.1007/978-3-319-94205-6_19,,,A Generic Framework for Implicate Generation Modulo Theories,cp,Conference Paper,Echenim M.,,Laboratoire d'Informatique de Grenoble,Saint Martin d'Heres,France,,,,,2018-01-01,2018,Lecture Notes in Computer Science (including subseries Lecture Notes in Artificial Intelligence and Lecture Notes in Bioinformatics),03029743,25674,16113349,Book Series,10900 LNAI,,,279-294,,,4,0,repositoryam,Green,,,
680,2-s2.0-85049874776,10.1007/978-3-319-95153-9_12,,,A corpus for amharic-english speech translation: The case of tourism domain,cp,Conference Paper,Woldeyohannis M.M.,,Addis Ababa University,Addis Ababa,Ethiopia,,,,,2018-01-01,2018,"Lecture Notes of the Institute for Computer Sciences, Social-Informatics and Telecommunications Engineering, LNICST",18678211,21100220348,,Book Series,244,,,129-139,,,5,0,,,,,
681,2-s2.0-85049775659,10.1007/978-3-319-94277-3_41,,,The gazeplay project: Open and free eye-trackers games and a community for people with multiple disabilities,cp,Conference Paper,Schwab D.,,Laboratoire d'Informatique de Grenoble,Saint Martin d'Heres,France,,,,,2018-01-01,2018,Lecture Notes in Computer Science (including subseries Lecture Notes in Artificial Intelligence and Lecture Notes in Bioinformatics),03029743,25674,16113349,Book Series,10896 LNCS,,,254-261,,,5,0,repositoryam,Green,,,
682,2-s2.0-85049369350,10.1007/978-3-319-94580-4_27,,,Masap: Multi-agent simulation of air pollution,cp,Conference Paper,Ghazi S.,,Université Badji Mokhtar - Annaba,Annaba,Algeria,,,,,2018-01-01,2018,Lecture Notes in Computer Science (including subseries Lecture Notes in Artificial Intelligence and Lecture Notes in Bioinformatics),03029743,25674,16113349,Book Series,10978 LNAI,,,309-313,,,0,0,,,,,
683,2-s2.0-85049359432,10.1007/978-3-319-94580-4_16,,,Environment for identification of significant subjects on information portals,cp,Conference Paper,Koźlak J.,,AGH University of Science and Technology,Krakow MP,Poland,,,,,2018-01-01,2018,Lecture Notes in Computer Science (including subseries Lecture Notes in Artificial Intelligence and Lecture Notes in Bioinformatics),03029743,25674,16113349,Book Series,10978 LNAI,,,200-211,,,0,0,,,,,
684,2-s2.0-85049108814,10.1007/978-3-319-92991-0_10,,,Verifying graph transformation systems with description logics,cp,Conference Paper,Brenas J.H.,,University of Tennessee Health Science Center,Memphis,United States,,,,,2018-01-01,2018,Lecture Notes in Computer Science (including subseries Lecture Notes in Artificial Intelligence and Lecture Notes in Bioinformatics),03029743,25674,16113349,Book Series,10887 LNCS,,,155-170,,,4,0,,,,,
685,2-s2.0-85049073013,10.1137/16M1105682,,,On the convergence of gradient-like flows with noisy gradient input,ar,Article,Mertikopoulos P.,,Laboratoire d'Informatique de Grenoble,Saint Martin d'Heres,France,,,,,2018-01-01,2018,SIAM Journal on Optimization,10526234,26422,,Journal,28,1,,163-197,,,19,0,repositoryam,Green,,,
686,2-s2.0-85048998443,10.1007/978-3-319-92970-5_11,,,Counterexample simplification for liveness property violation,cp,Conference Paper,Barbon G.,,Laboratoire d'Informatique de Grenoble,Saint Martin d'Heres,France,,,,,2018-01-01,2018,Lecture Notes in Computer Science (including subseries Lecture Notes in Artificial Intelligence and Lecture Notes in Bioinformatics),03029743,25674,16113349,Book Series,10886 LNCS,,,173-188,,,3,0,repositoryam,Green,,,
687,2-s2.0-85048899138,10.1007/978-3-319-92639-1_32,,,EnerVMAS: Virtual agent organizations to optimize energy consumption using intelligent temperature calibration,cp,Conference Paper,González-Briones A.,,Universidad de Salamanca,Salamanca,Spain,,,,,2018-01-01,2018,Lecture Notes in Computer Science (including subseries Lecture Notes in Artificial Intelligence and Lecture Notes in Bioinformatics),03029743,25674,16113349,Book Series,10870 LNAI,,,387-398,,,10,0,,,,,
688,2-s2.0-85048538555,10.1007/978-3-319-91704-7_8,,,Model consolidation: A process modelling method combining process mining and business process modelling,cp,Conference Paper,Çela O.,,Laboratoire d'Informatique de Grenoble,Saint Martin d'Heres,France,,,,,2018-01-01,2018,Lecture Notes in Business Information Processing,18651348,17500155101,,Book Series,318,,,117-130,,,3,0,repositoryam,Green,,,
689,2-s2.0-85048345785,10.1007/978-3-319-91464-0_31,,,A hybrid architecture for non-technical skills diagnosis,cp,Conference Paper,Bourrier Y.,,Laboratoire d'Informatique de Grenoble;Sorbonne Universite,Saint Martin d'Heres;Paris,France;France,,,,,2018-01-01,2018,Lecture Notes in Computer Science (including subseries Lecture Notes in Artificial Intelligence and Lecture Notes in Bioinformatics),03029743,25674,16113349,Book Series,10858 LNCS,,,300-305,,,0,0,,,,,
690,2-s2.0-85048236892,10.1007/978-3-319-91473-2_8,,,Multi-operator decision trees for explainable time-series classification,cp,Conference Paper,Shalaeva V.,,Laboratoire d'Informatique de Grenoble,Saint Martin d'Heres,France,,,,,2018-01-01,2018,Communications in Computer and Information Science,18650929,17700155007,,Book Series,853,,,86-99,,,6,0,,,,,
691,2-s2.0-85048217330,10.1007/978-3-319-92612-4_3,,,Monotonic prefix consistency in distributed systems,cp,Conference Paper,Girault A.,,Laboratoire d'Informatique de Grenoble,Saint Martin d'Heres,France,,,,,2018-01-01,2018,Lecture Notes in Computer Science (including subseries Lecture Notes in Artificial Intelligence and Lecture Notes in Bioinformatics),03029743,25674,16113349,Book Series,10854 LNCS,,,41-57,,,5,0,repositoryam,Green,,,
692,2-s2.0-85048011078,10.1007/978-3-319-91662-0_15,,,Selectivity estimation for SPARQL triple patterns with shape expressions,cp,Conference Paper,Abbas A.,,Laboratoire d'Informatique de Grenoble,Saint Martin d'Heres,France,,,,,2018-01-01,2018,Lecture Notes in Computer Science (including subseries Lecture Notes in Artificial Intelligence and Lecture Notes in Bioinformatics),03029743,25674,16113349,Book Series,10845 LNCS,,,195-209,,,1,0,repositoryam,Green,,,
693,2-s2.0-85047951024,10.5220/0006622600440054,,,PEAR: Prototyping expressive animated robots a framework for social robot prototyping,cp,Conference Paper,Balit E.,,Universite Grenoble Alpes,Saint Martin d'Heres,France,,,,,2018-01-01,2018,"VISIGRAPP 2018 - Proceedings of the 13th International Joint Conference on Computer Vision, Imaging and Computer Graphics Theory and Applications",,21100862530,,Conference Proceeding,2,,,44-54,,,2,1,repositoryam,Green,,,
694,2-s2.0-85047442110,10.1007/978-3-319-90053-7_15,,,A web of data platform for mineral intelligence capacity analysis (MICA),cp,Conference Paper,Ziébelin D.,,Laboratoire d'Informatique de Grenoble,Saint Martin d'Heres,France,,,,,2018-01-01,2018,Lecture Notes in Computer Science (including subseries Lecture Notes in Artificial Intelligence and Lecture Notes in Bioinformatics),03029743,25674,16113349,Book Series,10819 LNCS,,,155-171,,,0,0,,,,,
695,2-s2.0-85045836436,10.1007/978-3-319-89963-3_13,,,TESTOR: A modular tool for on-the-fly conformance test case generation,cp,Conference Paper,Marsso L.,,Laboratoire d'Informatique de Grenoble,Saint Martin d'Heres,France,,,,,2018-01-01,2018,Lecture Notes in Computer Science (including subseries Lecture Notes in Artificial Intelligence and Lecture Notes in Bioinformatics),03029743,25674,16113349,Book Series,10806 LNCS,,,211-228,,,8,1,repositoryvor,Green,,,
696,2-s2.0-85045584443,10.1137/1.9781611975031.172,,,Cycles in adversarial regularized learning,cp,Conference Paper,Mertikopoulos P.,,Laboratoire d'Informatique de Grenoble,Saint Martin d'Heres,France,,,,,2018-01-01,2018,Proceedings of the Annual ACM-SIAM Symposium on Discrete Algorithms,,110527,,Conference Proceeding,,,,2703-2717,,,59,1,repositoryam,Green,,,
697,2-s2.0-85045377690,,,,Trends in gaming indicators: On failed attempts at deception and their computerised detection,cp,Conference Paper,Labbé C.,,Laboratoire d'Informatique de Grenoble,Saint Martin d'Heres,France,,,,,2018-01-01,2018,CEUR Workshop Proceedings,16130073,21100218356,,Conference Proceeding,2080,,,6-15,,,1,0,,,,,
698,2-s2.0-85045297245,10.1007/978-981-10-7814-9_10,,,Enhancing comfort of occupants in energy buildings,cp,Conference Paper,Pal M.,,"Indian Statistical Institute, Kolkata",Kolkata,India,,,,,2018-01-01,2018,Springer Proceedings in Mathematics and Statistics,21941009,21100255398,21941017,Conference Proceeding,225,,,133-144,,,2,0,repositoryam,Green,,,
699,2-s2.0-85044469772,10.1007/978-3-319-69953-0_10,,,TINS: A task-based dynamic helper core strategy for in situ analytics,cp,Conference Paper,Dirand E.,,Commissariat a L'Energie Atomique CEA,Gif-sur-Yvette,France,,,,,2018-01-01,2018,Lecture Notes in Computer Science (including subseries Lecture Notes in Artificial Intelligence and Lecture Notes in Bioinformatics),03029743,25674,16113349,Book Series,10776 LNCS,,,159-178,,,7,1,repositoryam,Green,,,
700,2-s2.0-85044461797,10.1007/978-3-319-77398-8_3,,,Tuning EASY-Backfilling Queues,cp,Conference Paper,Lelong J.,,Laboratoire d'Informatique de Grenoble,Saint Martin d'Heres,France,,,,,2018-01-01,2018,Lecture Notes in Computer Science (including subseries Lecture Notes in Artificial Intelligence and Lecture Notes in Bioinformatics),03029743,25674,16113349,Book Series,10773 LNCS,,,43-61,,,5,0,repositoryam,Green,,,
701,2-s2.0-85044458058,10.1007/978-3-319-76941-7_30,,,Cross-lingual document retrieval using regularized wasserstein distance,cp,Conference Paper,Balikas G.,,Laboratoire d'Informatique de Grenoble,Saint Martin d'Heres,France,,,,,2018-01-01,2018,Lecture Notes in Computer Science (including subseries Lecture Notes in Artificial Intelligence and Lecture Notes in Bioinformatics),03029743,25674,16113349,Book Series,10772 LNCS,,,398-410,,,3,0,repositoryam,Green,,,
702,2-s2.0-85044451299,,,,Tutorial on semantic search on text,cp,Conference Paper,Tamine L.,,Université Fédérale Toulouse Midi-Pyrénées,Toulouse,France,,,,,2018-01-01,2018,Lecture Notes in Computer Science (including subseries Lecture Notes in Artificial Intelligence and Lecture Notes in Bioinformatics),03029743,25674,16113349,Book Series,10772 LNCS,,,838,,,0,0,,,,,
703,2-s2.0-85043987757,10.2478/cait-2018-0011,,,2L-APD: A two-level plagiarism detection system for Arabic documents,ar,Article,Nagoudi E.M.B.,,Université Amar Telidji Laghouat,Laghouat,Algeria,,,,,2018-01-01,2018,Cybernetics and Information Technologies,13119702,21100199814,13144081,Journal,18,1,,124-138,,,16,1,publisherfullgold,Gold,,,
