,eid,doi,pii,pubmed_id,title,subtype,subtypeDescription,creator,afid,affilname,affiliation_city,affiliation_country,author_count,author_names,author_ids,author_afids,coverDate,coverDisplayDate,publicationName,issn,source_id,eIssn,aggregationType,volume,issueIdentifier,article_number,pageRange,description,authkeywords,citedby_count,openaccess,freetoread,freetoreadLabel,fund_acr,fund_no,fund_sponsor
323,2-s2.0-85044258795,10.1007/s10115-018-1184-z,,,A large margin time series nearest neighbour classification under locally weighted time warps,ar,Article,Yuan J.,,Laboratoire d'Informatique de Grenoble;Beijing Jiaotong University,Saint Martin d'Heres;Beijing,France;China,,,,,2019-04-04,4 April 2019,Knowledge and Information Systems,02191377,15703,02193116,Journal,59,1,,117-135,,,11,0,,,,,
324,2-s2.0-85068852572,10.1109/RTAS.2019.00023,,,CertiCAN: A tool for the coq certification of CAN analysis results,cp,Conference Paper,Fradet P.,,Laboratoire d'Informatique de Grenoble,Saint Martin d'Heres,France,,,,,2019-04-01,April 2019,"Proceedings of the IEEE Real-Time and Embedded Technology and Applications Symposium, RTAS",15453421,145656,,Conference Proceeding,2019-April,,8743259,182-191,,,1,0,repositoryam,Green,,,
325,2-s2.0-85068365460,10.1109/ICSTW.2019.00030,,,Case studies in learning models and testing without reset,cp,Conference Paper,Bremond N.,,Laboratoire d'Informatique de Grenoble,Saint Martin d'Heres,France,,,,,2019-04-01,April 2019,"Proceedings - 2019 IEEE 12th International Conference on Software Testing, Verification and Validation Workshops, ICSTW 2019",,21100914874,,Conference Proceeding,,,8728898,40-45,,,2,0,,,,,
326,2-s2.0-85068209301,10.1109/INFOCOM.2019.8737548,,,Memory flipping: A threat to NUMA virtual machines in the Cloud.,cp,Conference Paper,Mvondo D.,,Laboratoire d'Informatique de Grenoble,Saint Martin d'Heres,France,,,,,2019-04-01,April 2019,Proceedings - IEEE INFOCOM,0743166X,18204,,Conference Proceeding,2019-April,,8737548,325-333,,,1,0,repositoryam,Green,,,
327,2-s2.0-85065048285,10.1016/j.cola.2018.12.006,S1045926X17301209,,GraphTQL: A visual query system for graph databases,ar,Article,Pabón M.C.,,"Pontificia Universidad Javeriana, Cali",Cali,Colombia,,,,,2019-04-01,April 2019,Journal of Computer Languages,,21100904890,25901184,Journal,51,,,97-111,,,1,0,,,,,
328,2-s2.0-85064897569,10.1016/j.jlamp.2018.11.005,S2352220817302018,,Nested-unit Petri nets,ar,Article,Garavel H.,,Laboratoire d'Informatique de Grenoble;Universität des Saarlandes,Saint Martin d'Heres;Saarbrucken,France;Germany,,,,,2019-04-01,April 2019,Journal of Logical and Algebraic Methods in Programming,,21100403130,23522216,Journal,104,,,60-85,,,9,1,repositoryam,Green,,,
329,2-s2.0-85062638245,10.1109/LRA.2019.2899429,,,Using Human Attention to Address Human-Robot Motion,ar,Article,Paulin R.,,Laboratoire d'Informatique de Grenoble,Saint Martin d'Heres,France,,,,,2019-04-01,April 2019,IEEE Robotics and Automation Letters,,21100900379,23773766,Journal,4,2,8642355,2038-2045,,,2,0,repositoryam,Green,,,
330,2-s2.0-85021174284,10.1007/s10009-017-0462-5,,,From high-level modeling toward efficient and trustworthy circuits,ar,Article,Zaraket F.A.,,American University of Beirut,Beirut,Lebanon,,,,,2019-04-01,1 April 2019,International Journal on Software Tools for Technology Transfer,14332779,19271,14332787,Journal,21,2,,143-163,,,0,0,,,,,
331,2-s2.0-85063904139,10.1145/3294109.3295654,,,Co-creation of a transitional smart sculpture for voice changes,cp,Conference Paper,Davat A.,,Laboratoire d'Informatique de Grenoble;Universite Grenoble Alpes;APORIA project,Saint Martin d'Heres;Saint Martin d'Heres;,France;France;France,,,,,2019-03-17,17 March 2019,"TEI 2019 - Proceedings of the 13th International Conference on Tangible, Embedded, and Embodied Interaction",,21100902836,,Conference Proceeding,,,,97-104,,,0,0,,,,,
332,2-s2.0-85060685379,10.1016/j.apenergy.2019.01.118,S0306261919301047,,Unmasking the causal relationships latent in the interplay between occupant's actions and indoor ambience: A building energy management outlook,ar,Article,Pal M.,,"Indian Statistical Institute, Kolkata",Kolkata,India,,,,,2019-03-15,15 March 2019,Applied Energy,03062619,28801,,Journal,238,,,1452-1470,,,10,0,,,,,
333,2-s2.0-85064121240,10.1109/SC.2018.00049,,,Associative instruction reordering to alleviate register pressure,cp,Conference Paper,Rawat P.S.,,The Ohio State University,Columbus,United States,,,,,2019-03-11,11 March 2019,"Proceedings - International Conference for High Performance Computing, Networking, Storage, and Analysis, SC 2018",,21100903180,,Conference Proceeding,,,8665800,590-602,,,8,0,repositoryam,Green,,,
334,2-s2.0-85075632764,10.1109/SSD.2019.8894872,,,Authors' Writing Styles Based Authorship Identification System Using the Text Representation Vector,cp,Conference Paper,Benzebouchi N.E.,,Université Badji Mokhtar - Annaba,Annaba,Algeria,,,,,2019-03-01,March 2019,"16th International Multi-Conference on Systems, Signals and Devices, SSD 2019",,21100936627,,Conference Proceeding,,,8894872,371-376,,,2,0,,,,,
335,2-s2.0-85068014382,10.1371/journal.pone.0213266,,30822319,Semi-automated fact-checking of nucleotide sequence reagents in biomedical research publications: The Seek &amp; Blastn tool,ar,Article,Labbé C.,,Laboratoire d'Informatique de Grenoble,Saint Martin d'Heres,France,,,,,2019-03-01,March 2019,PLoS ONE,,10600153309,19326203,Journal,14,3,e0213266,,,,7,1,repositoryam,Green,,,
336,2-s2.0-85067985370,10.1109/PERCOMW.2019.8730721,,,Learning Natural Language Understanding Systems from Unaligned Labels for Voice Command in Smart Homes,cp,Conference Paper,Mishakova A.,,Laboratoire d'Informatique de Grenoble,Saint Martin d'Heres,France,,,,,2019-03-01,March 2019,"2019 IEEE International Conference on Pervasive Computing and Communications Workshops, PerCom Workshops 2019",,21100946525,,Conference Proceeding,,,8730721,832-837,,,6,0,repositoryam,Green,,,
337,2-s2.0-85063190550,10.1145/3301501,,,Lock-unlock: Is that all? A pragmatic analysis of locking in software systems,ar,Article,Guerraoui R.,,Ecole Polytechnique Fédérale de Lausanne,Lausanne,Switzerland,,,,,2019-03-01,March 2019,ACM Transactions on Computer Systems,07342071,12213,15577333,Journal,36,1,1,,,,12,0,repositoryam,Green,,,
338,2-s2.0-85056235600,10.1016/j.ijhcs.2018.11.004,S1071581918306499,,Framing design for appropriation with Zones of Proximal Evolution: Email for PIM,ar,Article,Tchounikine P.,,Laboratoire d'Informatique de Grenoble,Saint Martin d'Heres,France,,,,,2019-03-01,March 2019,International Journal of Human Computer Studies,10715819,12960,10959300,Journal,123,,,18-28,,,3,0,,,,,
339,2-s2.0-85063531713,10.1109/CCNC.2019.8651852,,,Demo: Fog Based Framework for IoT Service Orchestration,cp,Conference Paper,Donassolo B.,,Laboratoire d'Informatique de Grenoble;Orange Labs,Saint Martin d'Heres;Issy-les-Moulineaux,France;France,,,,,2019-02-25,25 February 2019,"2019 16th IEEE Annual Consumer Communications and Networking Conference, CCNC 2019",,21100902104,,Conference Proceeding,,,8651852,,,,4,0,,,,,
340,2-s2.0-85062420927,10.1109/CCNC.2019.8651835,,,Fog Based Framework for IoT Service Provisioning,cp,Conference Paper,Donassolo B.,,Laboratoire d'Informatique de Grenoble;Orange Labs,Saint Martin d'Heres;Issy-les-Moulineaux,France;France,,,,,2019-02-25,25 February 2019,"2019 16th IEEE Annual Consumer Communications and Networking Conference, CCNC 2019",,21100902104,,Conference Proceeding,,,8651835,,,,34,0,repositoryam,Green,,,
341,2-s2.0-85063126503,10.1109/CAHPC.2018.8645901,,,Network-Aware Energy-Efficient Virtual Machine Management in Distributed Cloud Infrastructures with On-Site Photovoltaic Production,cp,Conference Paper,Camus B.,,CNRS Centre National de la Recherche Scientifique,Paris,France,,,,,2019-02-20,20 February 2019,"Proceedings - 2018 30th International Symposium on Computer Architecture and High Performance Computing, SBAC-PAD 2018",,21100901754,,Conference Proceeding,,,8645901,86-92,,,1,0,repositoryam,Green,,,
342,2-s2.0-85064222491,10.1145/3293883.3295737,,,Data-flow/dependence profiling for structured transformations,cp,Conference Paper,Gruber F.,,Laboratoire d'Informatique de Grenoble,Saint Martin d'Heres,France,,,,,2019-02-16,16 February 2019,"Proceedings of the ACM SIGPLAN Symposium on Principles and Practice of Parallel Programming, PPOPP",,57354,,Conference Proceeding,,,,173-185,,,4,0,repositoryam,Green,,,
343,2-s2.0-85063028277,10.1109/EduHPC.2018.00006,,,SMPI Courseware: Teaching Distributed-Memory Computing with MPI in Simulation,cp,Conference Paper,Casanova H.,,University of Hawaiʻi at Mānoa,Honolulu,United States,,,,,2019-02-08,8 February 2019,"Proceedings of EduHPC 2018: Workshop on Education for High-Performance Computing, Held in conjunction with SC 2018: The International Conference for High Performance Computing, Networking, Storage and Analysis",,21100901610,,Conference Proceeding,,,8638406,21-30,,,3,0,repositoryam,Green,,,
344,2-s2.0-85017167481,10.1007/s10009-017-0454-5,,,"First international Competition on Runtime Verification: rules, benchmarks, tools, and final results of CRV 2014",ar,Article,Bartocci E.,,Technische Universität Wien,Vienna,Austria,,,,,2019-02-06,6 February 2019,International Journal on Software Tools for Technology Transfer,14332779,19271,14332787,Journal,21,1,,31-70,,,42,1,repositoryvor,Green,,,
345,2-s2.0-85070415792,10.1177/1177271919829162,,,"The Possibility of Systematic Research Fraud Targeting Under-Studied Human Genes: Causes, Consequences, and Potential Solutions",re,Review,Byrne J.A.,,The Children's Hospital at Westmead;The University of Sydney,Sydney;Sydney,Australia;Australia,,,,,2019-02-01,1 February 2019,Biomarker Insights,,10900153302,11772719,Journal,14,,,,,,13,1,repositoryvor,Green,,,
346,2-s2.0-85068472341,10.1016/j.jlamp.2018.12.003,S2352220818300038,,The PBPO graph transformation approach,ar,Article,Corradini A.,,Università di Pisa,Pisa,Italy,,,,,2019-02-01,February 2019,Journal of Logical and Algebraic Methods in Programming,,21100403130,23522216,Journal,103,,,213-231,,,7,0,,,,,
347,2-s2.0-85062409493,10.1145/3291043,,,Modeling information retrieval by formal logic: A survey,re,Review,Abdulahhad K.,,Leibniz Institute for the Social Sciences GESIS,Mannheim,Germany,,,,,2019-02-01,February 2019,ACM Computing Surveys,03600300,23038,15577341,Journal,52,1,15,,,,2,1,publisherfree2read,Bronze,,,
348,2-s2.0-85061289660,10.1007/s11042-018-5798-7,,,Object instance identification with fully convolutional networks,ar,Article,Portaz M.,,Laboratoire d'Informatique de Grenoble,Saint Martin d'Heres,France,,,,,2019-02-01,1 February 2019,Multimedia Tools and Applications,13807501,25627,15737721,Journal,78,3,,2747-2764,,,3,0,,,,,
349,2-s2.0-85057330129,10.1007/s10649-018-9862-z,,,The instrumental deconstruction as a link between drawing and geometrical figure,ar,Article,Mithalal J.,,Université Claude Bernard Lyon 1,Villeurbanne,France,,,,,2019-02-01,1 February 2019,Educational Studies in Mathematics,00131954,25961,15730816,Journal,100,2,,161-176,,,2,0,repositoryam,Green,,,
350,2-s2.0-85057240697,10.1016/j.peva.2018.09.007,S0166531618302670,,Distributed best response dynamics with high playing rates in potential games,ar,Article,Durand S.,,Laboratoire d'Informatique de Grenoble;Universite Grenoble Alpes,Saint Martin d'Heres;Saint Martin d'Heres,France;France,,,,,2019-02-01,February 2019,Performance Evaluation,01665316,22313,,Journal,129,,,40-59,,,4,1,repositoryam,Green,,,
351,2-s2.0-85050671806,10.1007/s00778-018-0516-7,,,Optimized group formation for solving collaborative tasks,ar,Article,Rahman H.,,The University of Texas at Arlington,Arlington,United States,,,,,2019-02-01,1 February 2019,VLDB Journal,10668888,13646,0949877X,Journal,28,1,,1-23,,,19,0,repositoryam,Green,,,
352,2-s2.0-85062878805,10.1109/DSAA.2018.00045,,,Scalable and interpretable predictive models for electronic health records,cp,Conference Paper,Fejza A.,,Laboratoire d'Informatique de Grenoble,Saint Martin d'Heres,France,,,,,2019-01-31,31 January 2019,"Proceedings - 2018 IEEE 5th International Conference on Data Science and Advanced Analytics, DSAA 2018",,21100901427,,Conference Proceeding,,,8631441,341-350,,,4,0,repositoryam,Green,,,
353,2-s2.0-85061826247,10.1145/3287560.3287570,,,Equality of voice: Towards fair representation in crowdsourced top-k recommendations,cp,Conference Paper,Chakraborty A.,,Indian Institute of Technology Kharagpur,Kharagpur,India,,,,,2019-01-29,29 January 2019,"FAT* 2019 - Proceedings of the 2019 Conference on Fairness, Accountability, and Transparency",,21100898959,,Conference Proceeding,,,,129-138,,,14,0,repositoryam,Green,,,
354,2-s2.0-85061767406,10.1145/3287560.3287580,,,On microtargeting socially divisive ads: A case study of Russia-linked Ad campaigns on Facebook,cp,Conference Paper,Ribeiro F.N.,,UFOP/UFMG,,Brazil,,,,,2019-01-29,29 January 2019,"FAT* 2019 - Proceedings of the 2019 Conference on Fairness, Accountability, and Transparency",,21100898959,,Conference Proceeding,,,,140-149,,,28,0,repositoryam,Green,,,
355,2-s2.0-85062697634,10.1109/BGDDS.2018.8626832,,,"Spatio-Temporal Evolution of a Socio-Environmental System: The Alps, A Case Study",cp,Conference Paper,Ziebelin D.,,Laboratoire d'Informatique de Grenoble,Saint Martin d'Heres,France,,,,,2019-01-25,25 January 2019,BGDDS 2018 - 2018 International Workshop on Big Geospatial Data and Data Science,,21100901160,,Conference Proceeding,,,8626832,,,,0,0,,,,,
356,2-s2.0-85061550091,10.1145/3308897.3308938,,,Congestion avoidance in low-voltage networks by using the advanced metering infrastructure,cp,Conference Paper,Vinot B.,,Schneider Electric,Rueil-Malmaison,France,,,,,2019-01-25,25 January 2019,Performance Evaluation Review,01635999,26742,,Conference Proceeding,46,3,,89-91,,,0,0,repositoryam,Green,,,
357,2-s2.0-85061546916,10.1145/3308897.3308917,,,Efficiency of best response dynamics with high playing rates in potential games,cp,Conference Paper,Durand S.,,Universite Grenoble Alpes,Saint Martin d'Heres,France,,,,,2019-01-25,25 January 2019,Performance Evaluation Review,01635999,26742,,Conference Proceeding,46,3,,41-42,,,0,0,repositoryam,Green,,,
358,2-s2.0-85061539033,10.1145/3308897.3308909,,,Size expansions of mean field approximation: Transient and steady-state analysis,cp,Conference Paper,Gast N.,,Laboratoire d'Informatique de Grenoble,Saint Martin d'Heres,France,,,,,2019-01-25,25 January 2019,Performance Evaluation Review,01635999,26742,,Conference Proceeding,46,3,,25-26,,,0,0,,,,,
359,2-s2.0-85043484765,10.1007/s10107-018-1254-8,,,Learning in games with continuous action sets and unknown payoff functions,ar,Article,Mertikopoulos P.,,Laboratoire d'Informatique de Grenoble,Saint Martin d'Heres,France,,,,,2019-01-23,23 January 2019,Mathematical Programming,00255610,28512,14364646,Journal,173,1-2,,465-507,,,47,0,repositoryam,Green,,,
360,2-s2.0-85062609801,10.1109/BigData.2018.8621985,,,A Multi-Criteria Experimental Ranking of Distributed SPARQL Evaluators,cp,Conference Paper,Graux D.,,Laboratoire d'Informatique de Grenoble;Fraunhofer Institute for Intelligent Analysis and Information Systems IAIS,Saint Martin d'Heres;Sankt Augustin,France;Germany,,,,,2019-01-22,22 January 2019,"Proceedings - 2018 IEEE International Conference on Big Data, Big Data 2018",,21100901000,,Conference Proceeding,,,8621985,693-702,,,7,0,repositoryam,Green,,,
361,2-s2.0-85062070162,10.1109/SRDS.2018.00030,,,Héron: Taming tail latencies in key-value stores under heterogeneous workloads,cp,Conference Paper,Jaiman V.,,Universite Grenoble Alpes;Université Catholique de Louvain,Saint Martin d'Heres;Louvain-la-Neuve,France;Belgium,,,,,2019-01-15,15 January 2019,Proceedings of the IEEE Symposium on Reliable Distributed Systems,10609857,12906,,Conference Proceeding,2019-October,,8613967,191-200,,,6,0,repositoryam,Green,,,
362,2-s2.0-85056452628,10.1016/j.scico.2018.09.007,S0167642318304052,,Checking business process evolution,ar,Article,Krishna A.,,Laboratoire d'Informatique de Grenoble,Saint Martin d'Heres,France,,,,,2019-01-15,15 January 2019,Science of Computer Programming,01676423,28416,,Journal,170,,,1-26,,,16,0,repositoryam,Green,,,
363,2-s2.0-85061541421,10.1109/RTSS.2018.00039,,,A Generic Coq Proof of Typical Worst-Case Analysis,cp,Conference Paper,Fradet P.,,Laboratoire d'Informatique de Grenoble,Saint Martin d'Heres,France,,,,,2019-01-04,4 January 2019,Proceedings - Real-Time Systems Symposium,10528725,85329,,Conference Proceeding,2018-December,,8603215,218-229,,,0,0,repositoryam,Green,,,
364,2-s2.0-85108301112,,,,Devir: Data collection and analysis for the recommendation of events and itineraries,cp,Conference Paper,Nurbakova D.,,Institut National des Sciences Appliquées de Lyon,Villeurbanne,France,,,,,2019-01-01,2019,Proceedings of the Annual Hawaii International Conference on System Sciences,15301605,145755,,Conference Proceeding,2019-January,,,2294-2303,,,0,0,,,,,
365,2-s2.0-85108249762,,,,ICT and artificial intelligence for crisis and emergency management,ed,Editorial,Dugdale J.,,Universite Grenoble Alpes,Saint Martin d'Heres,France,,,,,2019-01-01,2019,Proceedings of the Annual Hawaii International Conference on System Sciences,15301605,145755,,Conference Proceeding,2019-January,,,626-628,,,0,0,,,,,
366,2-s2.0-85105738543,10.3166/dn.22.75-96,,,Quels corpus d'entraînement pour l'expansion de requêtes par plongement de mots: Application à la recherche de microblogs culturels,ar,Article,Mulhem P.,,Universite Grenoble Alpes,Saint Martin d'Heres,France,,,,,2019-01-01,2019,Document Numerique,12795127,17600155217,,Journal,22,3,,75-96,,,0,0,,,,,
367,2-s2.0-85094662358,,,,Modeling of the variability of indicators within the framework of public service administrations,cp,Conference Paper,Diaz D.,,Laboratoire d'Informatique de Grenoble,Saint Martin d'Heres,France,,,,,2019-01-01,2019,37th INFORSID 2019 - INFormatique des ORganisations et Systemes d'Information et de Decision,,21101024047,,Conference Proceeding,,,,163-168,,,0,0,,,,,
368,2-s2.0-85094637852,,,,Automatic generation of data structuring alternatives for document-oriented systems,cp,Conference Paper,Gómez P.,,Laboratoire d'Informatique de Grenoble,Saint Martin d'Heres,France,,,,,2019-01-01,2019,37th INFORSID 2019 - INFormatique des ORganisations et Systemes d'Information et de Decision,,21101024047,,Conference Proceeding,,,,271-286,,,0,0,,,,,
369,2-s2.0-85094089318,10.1137/18M1215682,,,Hessian barrier algorithms for linearly constrained optimization problems,ar,Article,Bomze I.M.,,Universität Wien,Vienna,Austria,,,,,2019-01-01,2019,SIAM Journal on Optimization,10526234,26422,,Journal,29,3,,2100-2127,,,2,0,repositoryam,Green,,,
370,2-s2.0-85093991044,,,,Implicit discourse relation classification with syntax-aware contextualizedword representations,cp,Conference Paper,Popa D.N.,,Naver Labs Corporation;Laboratoire d'Informatique de Grenoble,Seongnam;Saint Martin d'Heres,South Korea;France,,,,,2019-01-01,2019,"Proceedings of the 32nd International Florida Artificial Intelligence Research Society Conference, FLAIRS 2019",,21101039780,,Conference Proceeding,,,,203-208,,,3,0,,,,,
371,2-s2.0-85092641700,,,,Fine-grained control of sentence segmentation and entity positioning in neural NLG,cp,Conference Paper,Mehta K.,,Laboratoire d'Informatique de Grenoble,Saint Martin d'Heres,France,,,,,2019-01-01,2019,"DSNNLG 2019 - 1st Workshop on Discourse Structure in Neural NLG, Proceedings of the Workshop",,21101023283,,Conference Proceeding,,,,18-23,,,1,0,,,,,
372,2-s2.0-85091134141,10.4000/RDST.2786,,,"Analysis of students misconceptions on the living, in an experimental design situation that includes a computer environment",ar,Article,Bonnat C.,,Laboratoire d'Informatique de Grenoble,Saint Martin d'Heres,France,,,,,2019-01-01,2019,Recherches en Didactiques des Sciences et des Technologies,21106460,21100281307,,Journal,,20,,149-173,,,0,0,,,,,
373,2-s2.0-85090803619,,,,Transductive bounds for the multi-class majority vote classifier,cp,Conference Paper,Feofanov V.,,Laboratoire d'Informatique de Grenoble,Saint Martin d'Heres,France,,,,,2019-01-01,2019,"33rd AAAI Conference on Artificial Intelligence, AAAI 2019, 31st Innovative Applications of Artificial Intelligence Conference, IAAI 2019 and the 9th AAAI Symposium on Educational Advances in Artificial Intelligence, EAAI 2019",,21101021490,,Conference Proceeding,,,,3566-3573,,,2,0,,,,,
374,2-s2.0-85090176435,,,,Nonzero-sum adversarial hypothesis testing games,cp,Conference Paper,Yasodharan S.,,Indian Institute of Science,Bengaluru,India,,,,,2019-01-01,2019,Advances in Neural Information Processing Systems,10495258,23669,,Conference Proceeding,32,,,,,,3,0,,,,,
375,2-s2.0-85090175703,,,,An adaptive mirror-prox algorithm for variational inequalities with singular operators,cp,Conference Paper,Antonakopoulos K.,,Laboratoire d'Informatique de Grenoble,Saint Martin d'Heres,France,,,,,2019-01-01,2019,Advances in Neural Information Processing Systems,10495258,23669,,Conference Proceeding,32,,,,,,3,0,,,,,
376,2-s2.0-85087167612,,,,Semi-supervised neural text generation by joint learning of natural language generation and natural language understanding models,cp,Conference Paper,Qader R.,,Laboratoire d'Informatique de Grenoble,Saint Martin d'Heres,France,,,,,2019-01-01,2019,"INLG 2019 - 12th International Conference on Natural Language Generation, Proceedings of the Conference",,21101007459,,Conference Proceeding,,,,552-562,,,10,0,,,,,
377,2-s2.0-85086606356,,,,Beatbox sounds recognition using a speech-dedicated HMM-GMM based system,cp,Conference Paper,Evain S.,,Laboratoire d'Informatique de Grenoble,Saint Martin d'Heres,France,,,,,2019-01-01,2019,"Models and Analysis of Vocal Emissions for Biomedical Applications - 11th International Workshop, MAVEBA 2019",,21101004834,,Conference Proceeding,,,,219-222,,,0,0,,,,,
378,2-s2.0-85085243349,,,,On the convergence of single-call stochastic extra-gradient methods,cp,Conference Paper,Hsieh Y.G.,,Laboratoire Jean Kuntzmann (LJK);École Normale Supérieure,Saint Martin d'Heres;Paris,France;France,,,,,2019-01-01,2019,Advances in Neural Information Processing Systems,10495258,23669,,Conference Proceeding,32,,,,,,12,0,,,,,
379,2-s2.0-85084339284,,,,"Word recognition, competition, and activation in a model of visually grounded speech",cp,Conference Paper,Havard W.N.,,Laboratoire d'Informatique de Grenoble;Universite Grenoble Alpes,Saint Martin d'Heres;Saint Martin d'Heres,France;France,,,,,2019-01-01,2019,"CoNLL 2019 - 23rd Conference on Computational Natural Language Learning, Proceedings of the Conference",,21100985332,,Conference Proceeding,,,,339-348,,,6,0,,,,,
380,2-s2.0-85083952306,,,,Optimistic mirror descent in saddle-point problems: Going the extra (gradient) mile,cp,Conference Paper,Mertikopoulos P.,,Laboratoire d'Informatique de Grenoble,Saint Martin d'Heres,France,,,,,2019-01-01,2019,"7th International Conference on Learning Representations, ICLR 2019",,21100925600,,Conference Proceeding,,,,,,,30,0,,,,,
381,2-s2.0-85083483736,10.1007/978-3-030-30135-4_29,,,The difficult identification of multiworld expressions: From decision criteria to annotated corpora,cp,Conference Paper,Tutin A.,,Universite Grenoble Alpes,Saint Martin d'Heres,France,,,,,2019-01-01,2019,Lecture Notes in Computer Science (including subseries Lecture Notes in Artificial Intelligence and Lecture Notes in Bioinformatics),03029743,25674,16113349,Book Series,11755 LNAI,,,404-416,,,1,0,,,,,
382,2-s2.0-85082441718,,,,A guided walk into link key candidate extraction with relational concept analysis,cp,Conference Paper,Atencia M.,,Laboratoire d'Informatique de Grenoble,Saint Martin d'Heres,France,,,,,2019-01-01,2019,CEUR Workshop Proceedings,16130073,21100218356,,Conference Proceeding,2576,,,,,,0,0,,,,,
383,2-s2.0-85081165982,10.1007/978-3-319-89327-3_16,,,Object Segmentation in Depth Maps with One User Click and a Synthetically Trained Fully Convolutional Network,ch,Book Chapter,Grard M.,,École Centrale de Lyon;Siléane,Ecully;Saint-Etienne,France;France,,,,,2019-01-01,2019,Springer Proceedings in Advanced Robotics,25111256,21101047137,25111264,Conference Proceeding,7,,,207-221,,,3,0,repositoryam,Green,,,
384,2-s2.0-85079751304,,,,Applying formal reasoning to model transformation: The Meeduse solution,cp,Conference Paper,Idani A.,,Laboratoire d'Informatique de Grenoble,Saint Martin d'Heres,France,,,,,2019-01-01,2019,CEUR Workshop Proceedings,16130073,21100218356,,Conference Proceeding,2550,,,33-44,,,1,0,,,,,
385,2-s2.0-85078853432,10.1155/2019/1574749,,,Smart Detection: An Online Approach for DoS/DDoS Attack Detection Using Machine Learning,ar,Article,Lima Filho F.S.D.,,Universidade Federal do Rio Grande do Norte,Natal,Brazil,,,,,2019-01-01,2019,Security and Communication Networks,19390114,18000156707,19390122,Journal,2019,,1574749,,,,66,1,publisherfullgold,Gold,,,
386,2-s2.0-85078329719,,,,Cautious regret minimization: Online optimization with long-term budget constraints,cp,Conference Paper,Liakopoulos N.,,EURECOM Ecole d'Ingénieur et Centre de Recherche en Sciences du Numérique;Huawei Technologies,Sophia Antipolis;Paris,France;France,,,,,2019-01-01,2019,"36th International Conference on Machine Learning, ICML 2019",,21100958059,,Conference Proceeding,2019-June,,,6958-6973,,,12,0,,,,,
387,2-s2.0-85078027043,,,,Discovering expressive rules for complex ontology matching and data interlinking,cp,Conference Paper,Atencia M.,,Laboratoire d'Informatique de Grenoble,Saint Martin d'Heres,France,,,,,2019-01-01,2019,CEUR Workshop Proceedings,16130073,21100218356,,Conference Proceeding,2536,,,199-200,,,0,0,,,,,
388,2-s2.0-85077955061,10.1109/ACCESS.2019.2950437,,,Multi-Layer Coupled Hidden Markov Model for Cross-Market Behavior Analysis and Trend Forecasting,ar,Article,Cao W.,,Hefei University of Technology,Hefei,China,,,,,2019-01-01,2019,IEEE Access,,21100374601,21693536,Journal,7,,8887150,158563-158574,,,4,1,repositoryam,Green,,,
