,eid,doi,pii,pubmed_id,title,subtype,subtypeDescription,creator,afid,affilname,affiliation_city,affiliation_country,author_count,author_names,author_ids,author_afids,coverDate,coverDisplayDate,publicationName,issn,source_id,eIssn,aggregationType,volume,issueIdentifier,article_number,pageRange,description,authkeywords,citedby_count,openaccess,freetoread,freetoreadLabel,fund_acr,fund_no,fund_sponsor
899,2-s2.0-85040001933,10.1016/j.trpro.2017.12.019,S235214651730916X,,Combinatorial connectivity and spectral graph analytics for urban public transportation system,cp,Conference Paper,Boulmakoul B.,,Faculté des Sciences et Techniques de Mohammedia,Mohammedia,Morocco,,,,,2017-01-01,2017,Transportation Research Procedia,23521457,21100448300,23521465,Conference Proceeding,27,,,1154-1162,,,3,1,publisherfullgold,Gold,,,
900,2-s2.0-85039172738,10.21437/Interspeech.2017-268,,,Machine assisted analysis of vowel length contrasts in Wolof,cp,Conference Paper,Gauthier E.,,Universite Grenoble Alpes,Saint Martin d'Heres,France,,,,,2017-01-01,2017,"Proceedings of the Annual Conference of the International Speech Communication Association, INTERSPEECH",2308457X,21100212301,19909772,Conference Proceeding,2017-August,,,2138-2142,,,0,0,repositoryam,Green,,,
901,2-s2.0-85039149656,10.21437/Interspeech.2017-152,,,Homogeneity measure impact on target and non-target trials in forensic voice comparison,cp,Conference Paper,Ajili M.,,Université d'Avignon et des Pays du Vaucluse,Avignon,France,,,,,2017-01-01,2017,"Proceedings of the Annual Conference of the International Speech Communication Association, INTERSPEECH",2308457X,21100212301,19909772,Conference Proceeding,2017-August,,,2844-2848,,,3,0,,,,,
902,2-s2.0-85038207536,10.1007/978-3-319-72044-9_9,,,On the most suitable axiomatization of signed integers,cp,Conference Paper,Garavel H.,,Laboratoire d'Informatique de Grenoble;Universität des Saarlandes;INRIA Institut National de Recherche en Informatique et en Automatique,Saint Martin d'Heres;Saarbrucken;Le Chesnay,France;Germany;France,,,,,2017-01-01,2017,Lecture Notes in Computer Science (including subseries Lecture Notes in Artificial Intelligence and Lecture Notes in Bioinformatics),03029743,25674,16113349,Book Series,10644 LNCS,,,120-134,,,1,0,repositoryam,Green,,,
903,2-s2.0-85037031151,10.1007/978-3-319-71924-5_10,,,The asymptotic behavior of the price of anarchy,cp,Conference Paper,Colini-Baldeschi R.,,Luiss University,Rome,Italy,,,,,2017-01-01,2017,Lecture Notes in Computer Science (including subseries Lecture Notes in Artificial Intelligence and Lecture Notes in Bioinformatics),03029743,25674,16113349,Book Series,10660 LNCS,,,133-145,,,7,0,,,,,
904,2-s2.0-85035097108,10.1007/978-3-319-70139-4_54,,,Position-based content attention for time series forecasting with sequence-to-sequence RNNs,cp,Conference Paper,Cinar Y.G.,,Laboratoire d'Informatique de Grenoble,Saint Martin d'Heres,France,,,,,2017-01-01,2017,Lecture Notes in Computer Science (including subseries Lecture Notes in Artificial Intelligence and Lecture Notes in Bioinformatics),03029743,25674,16113349,Book Series,10638 LNCS,,,533-544,,,35,0,repositoryam,Green,,,
905,2-s2.0-85034812146,,,,Comparing agent architectures in social simulation: BDI agents versus finite-state machines,cp,Conference Paper,Adam C.,,Laboratoire d'Informatique de Grenoble;Universite Grenoble Alpes,Saint Martin d'Heres;Saint Martin d'Heres,France;France,,,,,2017-01-01,2017,Proceedings of the Annual Hawaii International Conference on System Sciences,15301605,145755,,Conference Proceeding,2017-January,,,267-273,,,7,0,,,,,
906,2-s2.0-85034770952,,,,CLEF 2017 Task overview: The IR Task at the eHealth Evaluation Lab evaluating retrieval methods for consumer Health search,cp,Conference Paper,Palotti J.,,Technische Universität Wien,Vienna,Austria,,,,,2017-01-01,2017,CEUR Workshop Proceedings,16130073,21100218356,,Conference Proceeding,1866,,,,,,0,0,,,,,
907,2-s2.0-85034735753,,,,CLEF 2017 MC2 search and timeline tasks overview,cp,Conference Paper,Goeuriot L.,,Laboratoire d'Informatique de Grenoble,Saint Martin d'Heres,France,,,,,2017-01-01,2017,CEUR Workshop Proceedings,16130073,21100218356,,Conference Proceeding,1866,,,,,,0,0,,,,,
908,2-s2.0-85034600394,10.1007/978-3-319-68179-5_51,,,Adaptive mapping for multiple applications on parallel architectures,cp,Conference Paper,Assayad I.,,Hassan II University of Casablanca,Casablanca,Morocco,,,,,2017-01-01,2017,Lecture Notes in Computer Science (including subseries Lecture Notes in Artificial Intelligence and Lecture Notes in Bioinformatics),03029743,25674,16113349,Book Series,10542 LNCS,,,584-595,,,2,0,repositoryam,Green,,,
909,2-s2.0-85034237118,10.1007/978-3-319-69131-2_33,,,A Theory to Devise Dependable Cooperative Encounters,cp,Conference Paper,Fiorino H.,,Laboratoire d'Informatique de Grenoble,Saint Martin d'Heres,France,,,,,2017-01-01,2017,Lecture Notes in Computer Science (including subseries Lecture Notes in Artificial Intelligence and Lecture Notes in Bioinformatics),03029743,25674,16113349,Book Series,10621 LNAI,,,504-513,,,0,0,repositoryam,Green,,,
910,2-s2.0-85034226072,10.1007/978-3-319-69131-2_15,,,Crafting Ontology Alignments from Scratch Through Agent Communication,cp,Conference Paper,Euzenat J.,,Laboratoire d'Informatique de Grenoble,Saint Martin d'Heres,France,,,,,2017-01-01,2017,Lecture Notes in Computer Science (including subseries Lecture Notes in Artificial Intelligence and Lecture Notes in Bioinformatics),03029743,25674,16113349,Book Series,10621 LNAI,,,245-262,,,3,0,repositoryam,Green,,,
911,2-s2.0-85032876442,10.1007/978-3-319-68972-2_2,,,Debugging of Concurrent Systems Using Counterexample Analysis,cp,Conference Paper,Barbon G.,,Laboratoire d'Informatique de Grenoble,Saint Martin d'Heres,France,,,,,2017-01-01,2017,Lecture Notes in Computer Science (including subseries Lecture Notes in Artificial Intelligence and Lecture Notes in Bioinformatics),03029743,25674,16113349,Book Series,10522 LNCS,,,20-34,,,6,0,repositoryam,Green,,,
912,2-s2.0-85032810778,,,,"Evaluating lstm networks, hmm and wfst in Malay part-of-speech tagging",ar,Article,Tan T.P.,,Universiti Sains Malaysia,Minden,Malaysia,,,,,2017-01-01,2017,"Journal of Telecommunication, Electronic and Computer Engineering",21801843,21100332206,22898131,Journal,9,2-9,,79-83,,,5,0,,,,,
913,2-s2.0-85032709511,10.1007/978-3-319-68270-9_1,,,From LOTOS to LNT,cp,Conference Paper,Garavel H.,,Laboratoire d'Informatique de Grenoble;INRIA Institut National de Recherche en Informatique et en Automatique,Saint Martin d'Heres;Le Chesnay,France;France,,,,,2017-01-01,2017,Lecture Notes in Computer Science (including subseries Lecture Notes in Artificial Intelligence and Lecture Notes in Bioinformatics),03029743,25674,16113349,Book Series,10500 LNCS,,,3-26,,,30,0,repositoryam,Green,,,
914,2-s2.0-85031916526,10.24963/ijcai.2017/19,,,Voting by sequential elimination with few voters,cp,Conference Paper,Bouveret S.,,Laboratoire d'Informatique de Grenoble,Saint Martin d'Heres,France,,,,,2017-01-01,2017,IJCAI International Joint Conference on Artificial Intelligence,10450823,19400157504,,Conference Proceeding,0,,,128-134,,,2,1,repositoryam,Green,,,
915,2-s2.0-85031397570,10.1007/978-3-319-67477-3_1,,,A BDI agent architecture for the GAMA modeling and simulation platform,cp,Conference Paper,Taillandier P.,,Université Fédérale Toulouse Midi-Pyrénées,Toulouse,France,,,,,2017-01-01,2017,Lecture Notes in Computer Science (including subseries Lecture Notes in Artificial Intelligence and Lecture Notes in Bioinformatics),03029743,25674,16113349,Book Series,10399 LNAI,,,3-23,,,11,0,repositoryam,Green,,,
916,2-s2.0-85031396214,10.1007/978-3-319-67585-5_43,,,A dataset of routine daily activities in an instrumented home,cp,Conference Paper,Cumin J.,,Laboratoire d'Informatique de Grenoble;Orange Labs,Saint Martin d'Heres;Issy-les-Moulineaux,France;France,,,,,2017-01-01,2017,Lecture Notes in Computer Science (including subseries Lecture Notes in Artificial Intelligence and Lecture Notes in Bioinformatics),03029743,25674,16113349,Book Series,10586 LNCS,,,413-425,,,19,0,repositoryam,Green,,,
917,2-s2.0-85030863095,10.1007/978-3-319-67190-1_22,,,Action Model Acquisition Using Sequential Pattern Mining,cp,Conference Paper,Arora A.,,Laboratoire d'Informatique de Grenoble,Saint Martin d'Heres,France,,,,,2017-01-01,2017,Lecture Notes in Computer Science (including subseries Lecture Notes in Artificial Intelligence and Lecture Notes in Bioinformatics),03029743,25674,16113349,Book Series,10505 LNAI,,,286-292,,,0,0,repositoryam,Green,,,
918,2-s2.0-85030847447,10.1007/978-3-319-67687-6_8,,,Bringing worth maps a step further: A dedicated online-resource,cp,Conference Paper,Camara F.G.,,Laboratoire d'Informatique de Grenoble,Saint Martin d'Heres,France,,,,,2017-01-01,2017,Lecture Notes in Computer Science (including subseries Lecture Notes in Artificial Intelligence and Lecture Notes in Bioinformatics),03029743,25674,16113349,Book Series,10515 LNCS,,,95-113,,,0,0,repositoryam,Green,,,
919,2-s2.0-85030714845,,,,A review on the influence of social attachment on human mobility during crises,cp,Conference Paper,Bañgate J.,,Laboratoire d'Informatique de Grenoble,Saint Martin d'Heres,France,,,,,2017-01-01,2017,Proceedings of the International ISCRAM Conference,,21100802691,24113387,Conference Proceeding,2017-May,,,110-126,,,11,0,,,,,
920,2-s2.0-85030714006,10.1007/978-3-319-67549-7_8,,,From passive to active FSM inference via checking sequence construction,cp,Conference Paper,Petrenko A.,,Cent de Recherche Informatique de Montreal,Montreal,Canada,,,,,2017-01-01,2017,Lecture Notes in Computer Science (including subseries Lecture Notes in Artificial Intelligence and Lecture Notes in Bioinformatics),03029743,25674,16113349,Book Series,10533 LNCS,,,126-141,,,12,0,repositoryam,Green,,,
921,2-s2.0-85030700072,,,,Discrete stochastic graph dynamics for the nuclear architecture of mouse meiotic prophase spermatocytes,cp,Conference Paper,Fenner J.L.,,Universidad de la Frontera,Temuco,Chile,,,,,2017-01-01,2017,Lecture Notes in Computer Science (including subseries Lecture Notes in Artificial Intelligence and Lecture Notes in Bioinformatics),03029743,25674,16113349,Book Series,10545 LNBI,,,321-323,,,0,0,,,,,
922,2-s2.0-85030700053,,,,The role of cognitive biases in reactions to bushfires,cp,Conference Paper,Arnaud M.,,Laboratoire d'Informatique de Grenoble,Saint Martin d'Heres,France,,,,,2017-01-01,2017,Proceedings of the International ISCRAM Conference,,21100802691,24113387,Conference Proceeding,2017-May,,,85-96,,,4,0,,,,,
923,2-s2.0-85030688420,,,,Thumbs up? Attitudes of emergency managers to proposed masters programs in em with an IS focus,cp,Conference Paper,Plotnick L.,,Plotnick Consulting LLC,Jacksonville,United States,,,,,2017-01-01,2017,Proceedings of the International ISCRAM Conference,,21100802691,24113387,Conference Proceeding,2017-May,,,1030-1042,,,0,0,,,,,
924,2-s2.0-85030682468,,,,An interactive simulation for testing communication strategies in bushfires,cp,Conference Paper,Bailly C.,,Laboratoire d'Informatique de Grenoble,Saint Martin d'Heres,France,,,,,2017-01-01,2017,Proceedings of the International ISCRAM Conference,,21100802691,24113387,Conference Proceeding,2017-May,,,72-84,,,3,0,,,,,
925,2-s2.0-85030672629,10.1007/978-3-319-67549-7_21,,,Adaptive localizer based on splitting trees,cp,Conference Paper,Groz R.,,Laboratoire d'Informatique de Grenoble,Saint Martin d'Heres,France,,,,,2017-01-01,2017,Lecture Notes in Computer Science (including subseries Lecture Notes in Artificial Intelligence and Lecture Notes in Bioinformatics),03029743,25674,16113349,Book Series,10533 LNCS,,,326-332,,,1,0,repositoryam,Green,,,
926,2-s2.0-85030664866,10.1007/978-3-319-67549-7_16,,,GREP: Games for the runtime enforcement of properties,cp,Conference Paper,Renard M.,,Université de Bordeaux,Bordeaux,France,,,,,2017-01-01,2017,Lecture Notes in Computer Science (including subseries Lecture Notes in Artificial Intelligence and Lecture Notes in Bioinformatics),03029743,25674,16113349,Book Series,10533 LNCS,,,259-275,,,2,0,repositoryam,Green,,,
927,2-s2.0-85030570261,10.5441/002/edbt.2017.23,,,Motivation-Aware task assignment in crowdsourcing,cp,Conference Paper,Pilourdault J.,,Laboratoire d'Informatique de Grenoble,Saint Martin d'Heres,France,,,,,2017-01-01,2017,Advances in Database Technology - EDBT,,21100858680,23672005,Conference Proceeding,2017-March,,,246-257,,,16,0,,,,,
928,2-s2.0-85030452634,,,,Complexity of manipulating sequential allocation,cp,Conference Paper,Aziz H.,,Commonwealth Scientific and Industrial Research Organization,Melbourne,Australia,,,,,2017-01-01,2017,"31st AAAI Conference on Artificial Intelligence, AAAI 2017",,21100832747,,Conference Proceeding,,,,328-334,,,10,0,,,,,
929,2-s2.0-85030177768,10.1007/978-3-319-66845-1_21,,,VBPMN: Automated verification of BPMN processes (tool paper),cp,Conference Paper,Krishna A.,,Laboratoire d'Informatique de Grenoble,Saint Martin d'Heres,France,,,,,2017-01-01,2017,Lecture Notes in Computer Science (including subseries Lecture Notes in Artificial Intelligence and Lecture Notes in Bioinformatics),03029743,25674,16113349,Book Series,10510 LNCS,,,323-331,,,14,0,,,,,
930,2-s2.0-85030165942,10.1007/978-3-319-66917-5_23,,,SPARQL query containment with ShEx constraints,cp,Conference Paper,Abbas A.,,Laboratoire d'Informatique de Grenoble,Saint Martin d'Heres,France,,,,,2017-01-01,2017,Lecture Notes in Computer Science (including subseries Lecture Notes in Artificial Intelligence and Lecture Notes in Bioinformatics),03029743,25674,16113349,Book Series,10509 LNCS,,,343-356,,,2,0,repositoryam,Green,,,
931,2-s2.0-85029603987,10.1007/978-3-319-67008-9_59,,,"Top-down and bottom-up approaches to identify the users, the services and the interface of a 2.0 digital library",cp,Conference Paper,Leblanc E.,,Universite Grenoble Alpes,Saint Martin d'Heres,France,,,,,2017-01-01,2017,Lecture Notes in Computer Science (including subseries Lecture Notes in Artificial Intelligence and Lecture Notes in Bioinformatics),03029743,25674,16113349,Book Series,10450 LNCS,,,632-639,,,1,0,,,,,
932,2-s2.0-85029601984,10.1007/978-3-319-67531-2_15,,,Verifying policy enforcers,cp,Conference Paper,Riganelli O.,,Università degli Studi di Milano-Bicocca,Milan,Italy,,,,,2017-01-01,2017,Lecture Notes in Computer Science (including subseries Lecture Notes in Artificial Intelligence and Lecture Notes in Bioinformatics),03029743,25674,16113349,Book Series,10548 LNCS,,,241-258,,,10,0,repositoryam,Green,,,
933,2-s2.0-85029576700,10.1007/978-3-319-66610-5_29,,,An approach for the analysis of perceptual and gestural performance during critical situations,cp,Conference Paper,Bourrier Y.,,Laboratoire d'Informatique de Grenoble;Sorbonne Universite,Saint Martin d'Heres;Paris,France;France,,,,,2017-01-01,2017,Lecture Notes in Computer Science (including subseries Lecture Notes in Artificial Intelligence and Lecture Notes in Bioinformatics),03029743,25674,16113349,Book Series,10474 LNCS,,,373-378,,,1,0,,,,,
934,2-s2.0-85029498008,,,,Reasoning with temporal preferences over data streams,cp,Conference Paper,Ribeiro M.R.,,Instituto Federal de Minas Gerais;Universidade Federal de Uberlândia,Belo Horizonte;Uberlandia,Brazil;Brazil,,,,,2017-01-01,2017,FLAIRS 2017 - Proceedings of the 30th International Florida Artificial Intelligence Research Society Conference,,21100830700,,Conference Proceeding,,,,700-705,,,2,0,,,,,
935,2-s2.0-85029437028,10.1007/978-3-319-61756-5_10,,,Batsim: A realistic language-independent resources and jobs management systems simulator,cp,Conference Paper,Dutot P.F.,,Laboratoire d'Informatique de Grenoble,Saint Martin d'Heres,France,,,,,2017-01-01,2017,Lecture Notes in Computer Science (including subseries Lecture Notes in Artificial Intelligence and Lecture Notes in Bioinformatics),03029743,25674,16113349,Book Series,10353 LNCS,,,178-197,,,15,0,repositoryam,Green,,,
936,2-s2.0-85029435961,10.1007/978-3-319-65813-1_27,,,CLEF 2017 Microblog Cultural Contextualization Lab Overview,cp,Conference Paper,Ermakova L.,,Université de Lorraine,Nancy,France,,,,,2017-01-01,2017,Lecture Notes in Computer Science (including subseries Lecture Notes in Artificial Intelligence and Lecture Notes in Bioinformatics),03029743,25674,16113349,Book Series,10456 LNCS,,,304-314,,,10,0,repositoryam,Green,,,
937,2-s2.0-85029435267,10.1007/978-3-662-55751-8_5,,,Contextuality in multipartite pseudo-telepathy graph games,cp,Conference Paper,Anshu A.,,Centre for Quantum Technologies,Singapore City,Singapore,,,,,2017-01-01,2017,Lecture Notes in Computer Science (including subseries Lecture Notes in Artificial Intelligence and Lecture Notes in Bioinformatics),03029743,25674,16113349,Book Series,10472 LNCS,,,41-55,,,0,0,repositoryam,Green,,,
938,2-s2.0-85029423658,10.1007/978-3-319-65813-1_26,,,CLEF 2017 eHealth evaluation lab overview,cp,Conference Paper,Goeuriot L.,,Laboratoire d'Informatique de Grenoble,Saint Martin d'Heres,France,,,,,2017-01-01,2017,Lecture Notes in Computer Science (including subseries Lecture Notes in Artificial Intelligence and Lecture Notes in Bioinformatics),03029743,25674,16113349,Book Series,10456 LNCS,,,291-303,,,64,0,repositoryvor,Green,,,
939,2-s2.0-85029411601,10.1007/978-3-319-65813-1_22,,,TimeLine illustration based on microblogs: When diversification meets metadata re-ranking,cp,Conference Paper,Mulhem P.,,Laboratoire d'Informatique de Grenoble,Saint Martin d'Heres,France,,,,,2017-01-01,2017,Lecture Notes in Computer Science (including subseries Lecture Notes in Artificial Intelligence and Lecture Notes in Bioinformatics),03029743,25674,16113349,Book Series,10456 LNCS,,,224-235,,,2,0,,,,,
940,2-s2.0-85029368356,10.24963/ijcai.2017/20,,,Fair division of a graph,cp,Conference Paper,Bouveret S.,,Laboratoire d'Informatique de Grenoble,Saint Martin d'Heres,France,,,,,2017-01-01,2017,IJCAI International Joint Conference on Artificial Intelligence,10450823,19400157504,,Conference Proceeding,0,,,135-141,,,48,1,publisherfree2read,Bronze,,,
941,2-s2.0-85029349185,10.1007/978-3-319-66700-3_20,,,Hedging under uncertainty: Regret minimization meets exponentially fast convergence,cp,Conference Paper,Cohen J.,,Laboratoire de Recherche en Informatique,Gif-sur-Yvette,France,,,,,2017-01-01,2017,Lecture Notes in Computer Science (including subseries Lecture Notes in Artificial Intelligence and Lecture Notes in Bioinformatics),03029743,25674,16113349,Book Series,10504 LNCS,,,252-263,,,2,0,,,,,
942,2-s2.0-85029231447,,,,Itinerary recommendation for cruises: User study,cp,Conference Paper,Nurbakova D.,,Laboratoire d'Informatique en Image et Systèmes d'Information,Villeurbanne,France,,,,,2017-01-01,2017,CEUR Workshop Proceedings,16130073,21100218356,,Conference Proceeding,1906,,,31-34,,,2,0,,,,,
943,2-s2.0-85028717455,10.1007/978-3-319-64203-1_14,,,Using simulation to evaluate and tune the performance of dynamic load balancing of an over-decomposed geophysics application,cp,Conference Paper,Keller Tesser R.,,Universidade Federal do Rio Grande do Sul,Porto Alegre,Brazil,,,,,2017-01-01,2017,Lecture Notes in Computer Science (including subseries Lecture Notes in Artificial Intelligence and Lecture Notes in Bioinformatics),03029743,25674,16113349,Book Series,10417 LNCS,,,192-205,,,2,0,repositoryam,Green,,,
944,2-s2.0-85028691325,10.1007/978-3-319-64203-1_16,,,Generic algorithms for scheduling applications on hybrid multi-core machines,cp,Conference Paper,Amaris M.,,Laboratoire d'Informatique de Grenoble;Universidade de São Paulo,Saint Martin d'Heres;Sao Paulo,France;Brazil,,,,,2017-01-01,2017,Lecture Notes in Computer Science (including subseries Lecture Notes in Artificial Intelligence and Lecture Notes in Bioinformatics),03029743,25674,16113349,Book Series,10417 LNCS,,,220-231,,,10,0,repositoryam,Green,,,
945,2-s2.0-85028686588,10.1016/j.procs.2017.06.072,S1877050917312486,,C2IoT: A framework for Cloud-based Context-aware Internet of Things services for smart cities,cp,Conference Paper,Faieq S.,,Laboratoire d'Informatique de Grenoble;Faculté des Sciences Rabat,Saint Martin d'Heres;Rabat,France;Morocco,,,,,2017-01-01,2017,Procedia Computer Science,,19700182801,18770509,Conference Proceeding,110,,,151-158,,,9,1,repositoryvor,Green,,,
946,2-s2.0-85028461321,10.1007/978-3-319-64468-4_11,,,Temporal conditional preference queries on streams,cp,Conference Paper,Ribeiro M.R.,,Instituto Federal de Minas Gerais;Universidade Federal de Uberlândia,Belo Horizonte;Uberlandia,Brazil;Brazil,,,,,2017-01-01,2017,Lecture Notes in Computer Science (including subseries Lecture Notes in Artificial Intelligence and Lecture Notes in Bioinformatics),03029743,25674,16113349,Book Series,10438 LNCS,,,143-158,,,0,0,repositoryam,Green,,,
947,2-s2.0-85028452937,10.1007/978-3-319-64468-4_23,,,Representing and learning human behavior patterns with contextual variability,cp,Conference Paper,Lago P.,,"Universidad de Los Andes, Colombia",Bogota,Colombia,,,,,2017-01-01,2017,Lecture Notes in Computer Science (including subseries Lecture Notes in Artificial Intelligence and Lecture Notes in Bioinformatics),03029743,25674,16113349,Book Series,10438 LNCS,,,305-313,,,2,0,repositoryam,Green,,,
948,2-s2.0-85028344181,10.1109/ACCESS.2017.2688279,,,Comparison of the Device Lifetime in Wireless Networks for the Internet of Things,ar,Article,Morin É.,,"Universite Grenoble Alpes;STMicroelectronics SA, France;CEA LETI ",Saint Martin d'Heres;Paris;Grenoble,France;France;France,,,,,2017-01-01,2017,IEEE Access,,21100374601,21693536,Journal,5,,7894201,7097-7117,,,102,1,repositoryam,Green,,,
949,2-s2.0-85027373151,10.1016/j.procs.2017.05.154,S1877050917307299,,Recommendation of Short-Term Activity Sequences during Distributed Events,cp,Conference Paper,Nurbakova D.,,Laboratoire d'Informatique en Image et Systèmes d'Information,Villeurbanne,France,,,,,2017-01-01,2017,Procedia Computer Science,,19700182801,18770509,Conference Proceeding,108,,,2069-2078,,,5,1,repositoryam,Green,,,
950,2-s2.0-85026830639,10.5441/002/edbt.2017.42,,,Crowdsourcing strategies for text creation tasks,cp,Conference Paper,Borromeo R.M.,,Keio University,Tokyo,Japan,,,,,2017-01-01,2017,Advances in Database Technology - EDBT,,21100858680,23672005,Conference Proceeding,2017-March,,,450-453,,,4,0,,,,,
951,2-s2.0-85026730079,10.1007/978-3-319-63046-5_33,,,The binomial pricing model in finance: A formalization in isabelle,cp,Conference Paper,Echenim M.,,Laboratoire d'Informatique de Grenoble,Saint Martin d'Heres,France,,,,,2017-01-01,2017,Lecture Notes in Computer Science (including subseries Lecture Notes in Artificial Intelligence and Lecture Notes in Bioinformatics),03029743,25674,16113349,Book Series,10395 LNAI,,,546-562,,,3,0,,,,,
952,2-s2.0-85024387471,10.5220/0006290103920396,,,User-based load balancer in HBase,cp,Conference Paper,Ghandour A.,,American University of Beirut,Beirut,Lebanon,,,,,2017-01-01,2017,CLOSER 2017 - Proceedings of the 7th International Conference on Cloud Computing and Services Science,,21100823381,,Conference Proceeding,,,,364-368,,,0,1,publisherhybridgold,Hybrid Gold,,,
953,2-s2.0-85023763986,10.5220/0006315100820091,,,An authoring tool to elicit knowledge to be taught without programming,cp,Conference Paper,Diattara A.,,Laboratoire d'Informatique de Grenoble;Université Claude Bernard Lyon 1,Saint Martin d'Heres;Villeurbanne,France;France,,,,,2017-01-01,2017,CSEDU 2017 - Proceedings of the 9th International Conference on Computer Supported Education,,21100469401,,Conference Proceeding,1,,,82-91,,,1,1,repositoryam,Green,,,
954,2-s2.0-85022334952,10.1007/978-3-319-61033-7_5,,,Datalog revisited for reasoning in linked data,cp,Conference Paper,Rousset M.C.,,Laboratoire d'Informatique de Grenoble;Institut Universitaire de France,Saint Martin d'Heres;Paris,France;France,,,,,2017-01-01,2017,Lecture Notes in Computer Science (including subseries Lecture Notes in Artificial Intelligence and Lecture Notes in Bioinformatics),03029743,25674,16113349,Book Series,10370 LNCS,,,121-166,,,0,0,,,,,
955,2-s2.0-85022217703,10.1007/978-3-319-61425-0_41,,,A multi-layered architecture for analysis of non-technical-skills in critical situations,cp,Conference Paper,Bourrier Y.,,Laboratoire d'Informatique de Paris 6;Laboratoire d'Informatique de Grenoble,Paris;Saint Martin d'Heres,France;France,,,,,2017-01-01,2017,Lecture Notes in Computer Science (including subseries Lecture Notes in Artificial Intelligence and Lecture Notes in Bioinformatics),03029743,25674,16113349,Book Series,10331 LNAI,,,463-466,,,0,0,,,,,
956,2-s2.0-85021818725,10.1016/j.procs.2017.05.311,S1877050917309717,,Safest and shortest itineraries for transporting hazardous materials using split points of Voronoï spatial diagrams based on spatial modeling of vulnerable zones,cp,Conference Paper,Mabrouk A.,,Laboratoire d'Informatique de Grenoble;Université Abdelmalek Essaadi;Faculté des Sciences et Techniques de Mohammedia,Saint Martin d'Heres;Tetouan;Mohammedia,France;Morocco;Morocco,,,,,2017-01-01,2017,Procedia Computer Science,,19700182801,18770509,Conference Proceeding,109,,,156-163,,,5,1,publisherfullgold,Gold,,,
957,2-s2.0-85021801314,10.1016/j.procs.2017.05.314,S1877050917309742,,Galois's algebraic structure and bipartite graph spatio-structural analytics for urban public transportation system assessment,cp,Conference Paper,Boulmakoul B.,,Faculté des Sciences et Techniques de Mohammedia,Mohammedia,Morocco,,,,,2017-01-01,2017,Procedia Computer Science,,19700182801,18770509,Conference Proceeding,109,,,172-179,,,0,1,publisherfullgold,Gold,,,
