,eid,doi,pii,pubmed_id,title,subtype,subtypeDescription,creator,afid,affilname,affiliation_city,affiliation_country,author_count,author_names,author_ids,author_afids,coverDate,coverDisplayDate,publicationName,issn,source_id,eIssn,aggregationType,volume,issueIdentifier,article_number,pageRange,description,authkeywords,citedby_count,openaccess,freetoread,freetoreadLabel,fund_acr,fund_no,fund_sponsor
0,2-s2.0-85091253549,10.1016/j.tcs.2020.09.025,S0304397520305247,,Parallel rewriting of attributed graphs,ar,Article,Boy de la Tour T.,,Laboratoire d'Informatique de Grenoble,Saint Martin d'Heres,France,,,,,2020-12-24,24 December 2020,Theoretical Computer Science,03043975,20571,,Journal,848,,,106-132,,,2,1,repositoryam,Green,,,
1,2-s2.0-85100691232,10.1145/3443279.3443280,,,Ranking Hotel Reviews Based on User's Aspects Importance and Opinions,cp,Conference Paper,Bonesso D.,,Universidade Federal do Rio Grande do Sul,Porto Alegre,Brazil,,,,,2020-12-18,18 December 2020,ACM International Conference Proceeding Series,,11600154611,,Conference Proceeding,,,,157-162,,,0,0,,,,,
2,2-s2.0-85096669196,10.7326/M20-5261,,32931326,The COVID-NMA project: Building an evidence ecosystem for the COVID-19 pandemic,re,Review,Boutron I.,,Université Paris Cité;Hôpital Hotel-Dieu AP-HP,Paris;Paris,France;France,,,,,2020-12-15,15 December 2020,Annals of Internal Medicine,00034819,26574,15393704,Journal,173,12,,1015-1017,,,19,0,repositoryvor,Green,,,
3,2-s2.0-85102385526,10.1109/APSEC51365.2020.00017,,,Clusters of faulty states for debugging behavioural models,cp,Conference Paper,Faqrizal I.,,Laboratoire d'Informatique de Grenoble,Saint Martin d'Heres,France,,,,,2020-12-01,December 2020,"Proceedings - Asia-Pacific Software Engineering Conference, APSEC",15301362,145296,,Conference Proceeding,2020-December,,9359298,91-99,,,0,0,repositoryam,Green,,,
4,2-s2.0-85102379473,10.1109/ICPADS51040.2020.00017,,,Communication-aware load balancing of the lu factorization over heterogeneous clusters,cp,Conference Paper,Nesi L.L.,,Universidade Federal do Rio Grande do Sul,Porto Alegre,Brazil,,,,,2020-12-01,December 2020,Proceedings of the International Conference on Parallel and Distributed Systems - ICPADS,15219097,69957,,Conference Proceeding,2020-December,,9359162,54-63,,,1,0,repositoryam,Green,,,
5,2-s2.0-85100678261,10.1007/s10590-020-09254-w,,,Investigating alignment interpretability for low-resource NMT,ar,Article,Boito M.Z.,,Universite Grenoble Alpes,Saint Martin d'Heres,France,,,,,2020-12-01,December 2020,Machine Translation,09226567,27190,15730573,Journal,34,4,,305-323,,,1,0,repositoryam,Green,,,
6,2-s2.0-85100414992,10.1109/GLOBECOM42002.2020.9322637,,,Spreading Factor Allocation for LoRa Nodes Progressively Joining a Multi-Gateway Adaptive Network,cp,Conference Paper,Ochoa M.N.,,Laboratoire d'Informatique de Grenoble;CEA Grenoble,Saint Martin d'Heres;Grenoble,France;France,,,,,2020-12-01,December 2020,"2020 IEEE Global Communications Conference, GLOBECOM 2020 - Proceedings",,21101036128,,Conference Proceeding,,,9322637,,,,0,0,,,,,
7,2-s2.0-85097096994,10.3390/info11120561,,,Syragri: A recommender system for agriculture in mali,ar,Article,Konaté J.,,Université des Sciences des Techniques et des Technologies de Bamako,Bamako,Mali,,,,,2020-12-01,December 2020,Information (Switzerland),,21100223111,20782489,Journal,11,12,561,1-24,,,1,1,publisherfullgold,Gold,,,
8,2-s2.0-85090878368,10.1016/j.artint.2020.103385,S0004370220301351,,"So, what exactly is a qualitative calculus?",ar,Article,Inants A.,,Laboratoire d'Informatique de Grenoble,Saint Martin d'Heres,France,,,,,2020-12-01,December 2020,Artificial Intelligence,00043702,23675,,Journal,289,,103385,,,,0,1,repositoryam,Green,,,
9,2-s2.0-85089394982,10.1038/s41598-020-69920-0,,32792540,Variability and reproducibility in deep learning for medical image segmentation,ar,Article,Renard F.,,Laboratoire d'Informatique de Grenoble;Universite Grenoble Alpes,Saint Martin d'Heres;Saint Martin d'Heres,France;France,,,,,2020-12-01,1 December 2020,Scientific Reports,,21100200805,20452322,Journal,10,1,13724,,,,33,1,repositoryvor,Green,,,
10,2-s2.0-85087677857,10.1016/j.diii.2020.05.009,S2211568420301558,32651155,Artificial intelligence to predict clinical disability in patients with multiple sclerosis using FLAIR MRI,ar,Article,Roca P.,,Pixyl,Grenoble,France,,,,,2020-12-01,December 2020,Diagnostic and Interventional Imaging,,21100205116,22115684,Journal,101,12,,795-802,,,14,1,publisherfree2read,Bronze,,,
11,2-s2.0-85085970765,10.1007/s11334-020-00366-3,,,Alliance of model-driven engineering with a proof-based formal approach,ar,Article,Idani A.,,Laboratoire d'Informatique de Grenoble,Saint Martin d'Heres,France,,,,,2020-12-01,1 December 2020,Innovations in Systems and Software Engineering,16145046,300147006,16145054,Journal,16,3-4,,289-307,,,6,0,,,,,
12,2-s2.0-85099496809,10.4000/educationdidactique.7793,,,Model proposal for understanding teacher's didactic decisions,ar,Article,Bonnat C.,,University of Fribourg,Fribourg,Switzerland,,,,,2020-11-27,27 November 2020,Education et Didactique,19563485,21100896480,21114838,Journal,14,3,,69-90,,,0,0,repositoryam,Green,,,
13,2-s2.0-85116107866,10.3389/fdata.2020.577974,,,Interdisciplinary Research in Artificial Intelligence: Challenges and Opportunities,ar,Article,Kusters R.,,Université Paris Cité,Paris,France,,,,,2020-11-23,23 November 2020,Frontiers in Big Data,,21101052354,2624909X,Journal,3,,577974,,,,1,1,repositoryvor,Green,,,
14,2-s2.0-85098163902,10.1145/3426462.3426468,,,The Challenges of in Situ Analysis for Multiple Simulations,cp,Conference Paper,Ribés A.,,Electricité de France,Paris,France,,,,,2020-11-12,12 November 2020,ACM International Conference Proceeding Series,,11600154611,,Conference Proceeding,,,3426468,32-37,,,1,0,repositoryvor,Green,,,
15,2-s2.0-85095828216,10.1145/3427316,,,Impact of Hand Used on One-Handed Back-of-Device Performance,ar,Article,Fan Z.,,Laboratoire d'Informatique de Grenoble,Saint Martin d'Heres,France,,,,,2020-11-04,4 November 2020,Proceedings of the ACM on Human-Computer Interaction,,21100908414,25730142,Journal,4,ISS,188,,,,1,0,repositoryvor,Green,,,
16,2-s2.0-85102341955,10.1109/SC41405.2020.00091,,,Efficient tiled sparse matrix multiplication through matrix signatures,cp,Conference Paper,Kurt S.E.,,The University of Utah,Salt Lake City,United States,,,,,2020-11-01,November 2020,"International Conference for High Performance Computing, Networking, Storage and Analysis, SC",21674329,21100239652,21674337,Conference Proceeding,2020-November,,9355290,,,,1,0,repositoryam,Green,,,
17,2-s2.0-85098779704,10.1109/ICTAI50040.2020.00195,,,A new tool to initialize global localization for a mobile robot,cp,Conference Paper,Aycard O.,,Universite Grenoble Alpes,Saint Martin d'Heres,France,,,,,2020-11-01,November 2020,"Proceedings - International Conference on Tools with Artificial Intelligence, ICTAI",10823409,145117,,Conference Proceeding,2020-November,,9288264,1296-1303,,,0,0,repositoryam,Green,,,
18,2-s2.0-85098747064,10.1109/ICTAI50040.2020.00180,,,Retro-engineering state machines into PDDL domains,cp,Conference Paper,Grand M.,,Laboratoire d'Informatique de Grenoble,Saint Martin d'Heres,France,,,,,2020-11-01,November 2020,"Proceedings - International Conference on Tools with Artificial Intelligence, ICTAI",10823409,145117,,Conference Proceeding,2020-November,,9288353,1186-1193,,,1,0,repositoryam,Green,,,
19,2-s2.0-85087887723,10.1007/s11192-020-03583-6,,,Using neural-network based paragraph embeddings for the calculation of within and between document similarities,ar,Article,Thijs B.,,Laboratoire d'Informatique de Grenoble;KU Leuven,Saint Martin d'Heres;3000 Leuven,France;Belgium,,,,,2020-11-01,November 2020,Scientometrics,01389130,24222,15882861,Journal,125,2,,835-849,,,7,0,,,,,
20,2-s2.0-85097301557,10.1145/3419394.3423632,,,Are You Human?: Resilience of Phishing Detection to Evasion Techniques Based on Human Verification,cp,Conference Paper,Maroofi S.,,Laboratoire d'Informatique de Grenoble,Saint Martin d'Heres,France,,,,,2020-10-27,27 October 2020,"Proceedings of the ACM SIGCOMM Internet Measurement Conference, IMC",,21101030004,,Conference Proceeding,,,,78-86,,,2,0,,,,,
21,2-s2.0-85096952892,10.1145/3373625.3418010,,,Towards Automatic Captioning of University Lectures for French students who are Deaf,cp,Conference Paper,Evain S.,,Laboratoire d'Informatique de Grenoble,Saint Martin d'Heres,France,,,,,2020-10-26,26 October 2020,ASSETS 2020 - 22nd International ACM SIGACCESS Conference on Computers and Accessibility,,21101029459,,Conference Proceeding,,,3418010,,,,0,0,repositoryvor,Green,,,
22,2-s2.0-85096958759,10.1145/3379337.3415893,,,GyroSuite: General-purpose interactions for handheld perspective corrected displays,cp,Conference Paper,Louis T.,,Grenoble Images Parole Signal Automatique,Saint Martin d'Heres,France,,,,,2020-10-20,20 October 2020,UIST 2020 - Proceedings of the 33rd Annual ACM Symposium on User Interface Software and Technology,,21101029460,,Conference Proceeding,,,3415893,1248-1260,,,1,0,repositoryvor,Green,,,
23,2-s2.0-85097747380,10.1109/IECON43393.2020.9255314,,,Comparing High Accurate Regression Models for Short-term Load Forecasting in Smart Buildings,cp,Conference Paper,Nguyen T.T.Q.,,Laboratoire d'Informatique de Grenoble,Saint Martin d'Heres,France,,,,,2020-10-18,18 October 2020,IECON Proceedings (Industrial Electronics Conference),,56670,,Conference Proceeding,2020-October,,9255314,1962-1967,,,3,0,repositoryam,Green,,,
24,2-s2.0-85096774342,10.1145/3417990.3420046,,,"Towards a model driven formal approach for merging data, access control and business processes",cp,Conference Paper,Idani A.,,Laboratoire d'Informatique de Grenoble,Saint Martin d'Heres,France,,,,,2020-10-16,16 October 2020,"Proceedings - 23rd ACM/IEEE International Conference on Model Driven Engineering Languages and Systems, MODELS-C 2020 - Companion Proceedings",,21101028544,,Conference Proceeding,,,,380-384,,,0,0,,,,,
25,2-s2.0-85097284407,10.1109/WiMob50308.2020.9253425,,,Adaptive data rate for multiple gateways LoRaWAN networks,cp,Conference Paper,Coutaud U.,,Universite Grenoble Alpes,Saint Martin d'Heres,France,,,,,2020-10-12,12 October 2020,"International Conference on Wireless and Mobile Computing, Networking and Communications",21619646,21000195607,21619654,Conference Proceeding,2020-October,,9253425,,,,1,0,,,,,
26,2-s2.0-85087117184,10.1016/j.tcs.2020.06.010,S0304397520303510,,Causality analysis and fault ascription in component-based systems,ar,Article,Gössler G.,,Laboratoire d'Informatique de Grenoble,Saint Martin d'Heres,France,,,,,2020-10-12,12 October 2020,Theoretical Computer Science,03043975,20571,,Journal,837,,,158-180,,,4,1,repositoryam,Green,,,
27,2-s2.0-85123040100,10.1145/3423423.3423438,,,Disaster Mitigation Using Interface Adaptation to Emotions: A Targeted Literature Review,cp,Conference Paper,Alipour M.,,Laboratoire d'Informatique de Grenoble,Saint Martin d'Heres,France,,,,,2020-10-06,6 October 2020,ACM International Conference Proceeding Series,,11600154611,,Conference Proceeding,,,,,,,2,0,,,,,
28,2-s2.0-85094947044,10.1145/3379503.3403533,,,"Exploring 3D objects with non-linear perspectives in real-time, a first user study",cp,Conference Paper,Ortega M.,,Laboratoire d'Informatique de Grenoble,Saint Martin d'Heres,France,,,,,2020-10-05,5 October 2020,"Conference Proceedings - 22nd International Conference on Human-Computer Interaction with Mobile Devices and Services: Expanding the Horizon of Mobile Interaction, MobileHCI 2020",,21101024219,,Conference Proceeding,,,3403533,,,,0,0,repositoryvor,Green,,,
29,2-s2.0-85099132873,,,,Human Behaviour Centered Design: Developing a Software System for Cultural Heritage,cp,Conference Paper,Dugdale J.,,Universite Grenoble Alpes,Saint Martin d'Heres,France,,,,,2020-10-01,October 2020,"Proceedings - 2020 ACM/IEEE 42nd International Conference on Software Engineering: Software Engineering in Society, ICSE-SEIS 2020",,21101033508,,Conference Proceeding,,,9276515,85-94,,,1,0,,,,,
30,2-s2.0-85096132697,10.1109/EDOCW49879.2020.00023,,,Integrating PPI Variability in the Context of Customizable Processes by Extending the Business Process Feature Model,cp,Conference Paper,Diego D.,,Laboratoire d'Informatique de Grenoble,Saint Martin d'Heres,France,,,,,2020-10-01,October 2020,"Proceedings - IEEE International Enterprise Distributed Object Computing Workshop, EDOCW",15417719,21100384313,,Conference Proceeding,2020-October,,9233123,80-85,,,2,0,repositoryam,Green,,,
31,2-s2.0-85094854685,10.1016/j.jlamp.2020.100577,S2352220820300626,,From global choreographies to verifiable efficient distributed implementations,ar,Article,Jaber M.,,American University of Beirut,Beirut,Lebanon,,,,,2020-10-01,October 2020,Journal of Logical and Algebraic Methods in Programming,23522208,21100403130,23522216,Journal,115,,100577,,,,1,0,repositoryam,Green,,,
32,2-s2.0-85090291512,10.1109/RIVF48685.2020.9140789,,,Agent-based Modeling of Climate and Electricity Market Impact on Commercial Greenhouse Growers' Demand Response Adoption,cp,Conference Paper,Christensen K.,,Syddansk Universitet,Odense,Denmark,,,,,2020-10-01,October 2020,"Proceedings - 2020 RIVF International Conference on Computing and Communication Technologies, RIVF 2020",,21101021190,,Conference Proceeding,,,9140789,,,,3,0,repositoryam,Green,,,
33,2-s2.0-85089296310,10.1002/spe.2878,,,R2D2: A scalable deep learning toolkit for medical imaging segmentation,ar,Article,Guedria S.,,Laboratoire d'Informatique de Grenoble;Universite Grenoble Alpes,Saint Martin d'Heres;Saint Martin d'Heres,France;France,,,,,2020-10-01,1 October 2020,Software - Practice and Experience,00380644,20007,1097024X,Journal,50,10,,1966-1985,,,2,0,,,,,
34,2-s2.0-85088645289,10.1016/j.patrec.2020.07.028,S0167865520302749,,Deep k-Means: Jointly clustering with k-Means and learning representations,ar,Article,Moradi Fard M.,,Laboratoire d'Informatique de Grenoble,Saint Martin d'Heres,France,,,,,2020-10-01,October 2020,Pattern Recognition Letters,01678655,24825,,Journal,138,,,185-192,,,44,1,repositoryam,Green,,,
35,2-s2.0-85087400034,10.1007/s10951-020-00660-9,,,Dynamic speed scaling minimizing expected energy consumption for real-time tasks,ar,Article,Gaujal B.,,Laboratoire d'Informatique de Grenoble,Saint Martin d'Heres,France,,,,,2020-10-01,1 October 2020,Journal of Scheduling,10946136,19294,10991425,Journal,23,5,,555-574,,,4,0,repositoryam,Green,,,
36,2-s2.0-85082852234,10.1007/s10844-020-00596-8,,,LTR-expand: query expansion model based on learning to rank association rules,ar,Article,Bouziri A.,,Université de la Manouba,Manouba,Tunisia,,,,,2020-10-01,1 October 2020,Journal of Intelligent Information Systems,09259902,24361,15737675,Journal,55,2,,261-286,,,5,0,,,,,
37,2-s2.0-85076612990,10.1007/s12652-019-01625-3,,,Towards a reactive system for managing big trajectory data,ar,Article,Maguerra S.,,Faculté des Sciences et Techniques de Mohammedia,Mohammedia,Morocco,,,,,2020-10-01,1 October 2020,Journal of Ambient Intelligence and Humanized Computing,18685137,19400158593,18685145,Journal,11,10,,3895-3906,,,4,0,,,,,
38,2-s2.0-85123041864,10.1145/3399715.3399836,,,"3D Tabletop AR: A Comparison of Mid-Air, Touch and Touch+Mid-Air Interaction",cp,Conference Paper,Plasson C.,,CNRS Centre National de la Recherche Scientifique,Paris,France,,,,,2020-09-28,28 September 2020,ACM International Conference Proceeding Series,,11600154611,,Conference Proceeding,,,,,,,1,0,repositoryvor,Green,,,
39,2-s2.0-85123040965,10.1145/3399715.3399851,,,Target Expansion in Context: The Case of Menu in Handheld Augmented Reality,cp,Conference Paper,Perea P.,,CNRS Centre National de la Recherche Scientifique,Paris,France,,,,,2020-09-28,28 September 2020,ACM International Conference Proceeding Series,,11600154611,,Conference Proceeding,,,,,,,0,0,repositoryvor,Green,,,
40,2-s2.0-85094124193,10.1103/PhysRevB.102.104205,,,Glass-forming ability of elemental zirconium,ar,Article,Becker S.,,"Sciences et Ingénierie, Matériaux, Procédés (SIMaP);Laboratoire d'Informatique de Grenoble",Saint Martin d'Heres;Saint Martin d'Heres,France;France,,,,,2020-09-25,September 2020,Physical Review B,24699950,21100874236,24699969,Journal,102,10,104205,,,,6,0,repositoryam,Green,,,
41,2-s2.0-85099183936,10.1109/EBCCSP51266.2020.9291353,,,Discrete and continuous optimal control for energy minimization in real-time systems,cp,Conference Paper,Gaujal B.,,Laboratoire d'Informatique de Grenoble,Saint Martin d'Heres,France,,,,,2020-09-23,23 September 2020,"Proceedings - 6th International Conference on Event-Based Control, Communication and Signal Processing, EBCCSP 2020",,21101033826,,Conference Proceeding,,,9291353,,,,0,0,repositoryvor,Green,,,
42,2-s2.0-85092693499,10.1145/3383313.3412229,,,Adaptive Pointwise-Pairwise Learning-to-Rank for Content-based Personalized Recommendation,cp,Conference Paper,Cinar Y.G.,,Laboratoire d'Informatique de Grenoble,Saint Martin d'Heres,France,,,,,2020-09-22,22 September 2020,RecSys 2020 - 14th ACM Conference on Recommender Systems,,21101023297,,Conference Proceeding,,,,414-419,,,0,0,,,,,
43,2-s2.0-85085745129,10.1016/j.scico.2020.102493,S0167642318300789,,Compositional model checking with divergence preserving branching bisimilarity is lively,ar,Article,de Putter S.,,Technische Universiteit Eindhoven,Eindhoven,Netherlands,,,,,2020-09-15,15 September 2020,Science of Computer Programming,01676423,28416,,Journal,196,,102493,,,,0,0,repositoryam,Green,,,
44,2-s2.0-85097078370,10.1109/EuroSPW51379.2020.00078,,,Feasibility of Large-Scale Vulnerability Notifications after GDPR,cp,Conference Paper,Soussi W.,,Laboratoire d'Informatique de Grenoble,Saint Martin d'Heres,France,,,,,2020-09-01,September 2020,"Proceedings - 5th IEEE European Symposium on Security and Privacy Workshops, Euro S and PW 2020",,21101029601,,Conference Proceeding,,,9229722,532-537,,,1,0,,,,,
45,2-s2.0-85095866482,10.1109/SBAC-PAD49847.2020.00020,,,Evaluating computation and data placements in edge infrastructures through a common simulator,cp,Conference Paper,Da Silva A.A.,,Laboratoire d'Informatique de Grenoble;Universidade de São Paulo,Saint Martin d'Heres;Sao Paulo,France;Brazil,,,,,2020-09-01,September 2020,Proceedings - Symposium on Computer Architecture and High Performance Computing,15506533,145120,,Conference Proceeding,2020-September,,9235035,67-74,,,0,0,repositoryam,Green,,,
46,2-s2.0-85086450548,10.1016/j.artint.2020.103342,S0004370220300989,,Interpretable time series kernel analytics by pre-image estimation,ar,Article,Tran T.P.T.,,Laboratoire d'Informatique de Grenoble,Saint Martin d'Heres,France,,,,,2020-09-01,September 2020,Artificial Intelligence,00043702,23675,,Journal,286,,103342,,,,1,1,repositoryam,Green,,,
47,2-s2.0-85095452413,10.1109/COLCOM50121.2020.9219768,,,Impact of Functional Package Manager over a Non-Traditional High Performance Computing System,cp,Conference Paper,Gomez C.E.,,Universidad Industrial de Santander,Bucaramanga,Colombia,,,,,2020-08-01,August 2020,"2020 IEEE Colombian Conference on Communications and Computing, COLCOM 2020 - Proceedings",,21101024407,,Conference Proceeding,,,9219768,,,,0,0,,,,,
48,2-s2.0-85094175738,10.1109/PIMRC48278.2020.9217162,,,Single reception estimation of wireless link quality,cp,Conference Paper,Audeoud H.J.,,Laboratoire d'Informatique de Grenoble,Saint Martin d'Heres,France,,,,,2020-08-01,August 2020,"IEEE International Symposium on Personal, Indoor and Mobile Radio Communications, PIMRC",,21101023800,,Conference Proceeding,2020-August,,9217162,,,,0,0,repositoryam,Green,,,
49,2-s2.0-85094127156,10.1109/PIMRC48278.2020.9217220,,,High reliability in LoRaWAN,cp,Conference Paper,Coutaud U.,,Semtech Corporation,Camarillo,United States,,,,,2020-08-01,August 2020,"IEEE International Symposium on Personal, Indoor and Mobile Radio Communications, PIMRC",,21101023800,,Conference Proceeding,2020-August,,9217220,,,,2,0,repositoryvor,Green,,,
50,2-s2.0-85091269047,10.4230/LIPIcs.APPROX/RANDOM.2020.44,,,A tight (3/2 + ε) approximation for skewed strip packing,cp,Conference Paper,Gálvez W.,,Technical University of Munich,Munich,Germany,,,,,2020-08-01,1 August 2020,"Leibniz International Proceedings in Informatics, LIPIcs",18688969,21100244929,,Conference Proceeding,176,,APPROX44,,,,2,0,,,,,
51,2-s2.0-85090505183,10.4230/LIPIcs.MFCS.2020.11,,,Solving packing problems with few small items using rainbow matchings,cp,Conference Paper,Bannach M.,,Universität zu Lübeck,Lübeck,Germany,,,,,2020-08-01,1 August 2020,"Leibniz International Proceedings in Informatics, LIPIcs",18688969,21100244929,,Conference Proceeding,170,,MFCS-2020-11,,,,1,0,,,,,
52,2-s2.0-85086139714,10.1287/moor.2019.1014,,,Power-of-d-Choices with Memory: Fluid Limit and Optimality,ar,Article,Anselmi J.,,Laboratoire d'Informatique de Grenoble;INRIA Institut National de Recherche en Informatique et en Automatique,Saint Martin d'Heres;Le Chesnay,France;France,,,,,2020-08-01,August 2020,Mathematics of Operations Research,0364765X,22140,15265471,Journal,45,3,,862-888,,,5,0,repositoryam,Green,,,
53,2-s2.0-85085284333,10.1007/s11192-020-03463-z,,,Flagging incorrect nucleotide sequence reagents in biomedical papers: To what extent does the leading publication format impede automatic error detection?,ar,Article,Labbé C.,,Laboratoire d'Informatique de Grenoble,Saint Martin d'Heres,France,,,,,2020-08-01,1 August 2020,Scientometrics,01389130,24222,15882861,Journal,124,2,,1139-1156,,,2,1,repositoryvor,Green,,,
54,2-s2.0-85090151000,10.1145/3397271.3401211,,,Learning Term Discrimination,cp,Conference Paper,Frej J.,,Laboratoire d'Informatique de Grenoble,Saint Martin d'Heres,France,,,,,2020-07-25,25 July 2020,SIGIR 2020 - Proceedings of the 43rd International ACM SIGIR Conference on Research and Development in Information Retrieval,,21101021126,,Conference Proceeding,,,,1993-1996,,,1,0,repositoryam,Green,,,
55,2-s2.0-85089103849,10.3389/fpsyg.2020.01745,,,Coarticulatory Aspects of the Fluent Speech of French and Italian People Who Stutter Under Altered Auditory Feedback,ar,Article,Verdurand M.,,Laboratoire d'Informatique de Grenoble;Speech Therapy Study,Saint Martin d'Heres;,France;France,,,,,2020-07-23,23 July 2020,Frontiers in Psychology,,21100216571,16641078,Journal,11,,1745,,,,0,1,repositoryvor,Green,,,
56,2-s2.0-85089283271,10.1145/3391403.3399482,,,On Fair Selection in the Presence of Implicit Variance,cp,Conference Paper,Emelianov V.,,Laboratoire d'Informatique de Grenoble,Saint Martin d'Heres,France,,,,,2020-07-13,13 July 2020,EC 2020 - Proceedings of the 21st ACM Conference on Economics and Computation,,21101019386,,Conference Proceeding,,,3399482,649-675,,,4,0,repositoryam,Green,,,
57,2-s2.0-85065399312,10.1016/j.neucom.2018.10.092,S0925231219304370,,Coupled ensembles of neural networks,ar,Article,Dutt A.,,Laboratoire d'Informatique de Grenoble;Universite Grenoble Alpes,Saint Martin d'Heres;Saint Martin d'Heres,France;France,,,,,2020-07-05,5 July 2020,Neurocomputing,09252312,24807,18728286,Journal,396,,,346-357,,,7,0,repositoryam,Green,,,
58,2-s2.0-85082793634,10.1016/j.tcs.2020.03.020,S0304397520301791,,Backward type inference for XML queries,ar,Article,Im H.,,Kangwon National University,Chuncheon,South Korea,,,,,2020-07-02,2 July 2020,Theoretical Computer Science,03043975,20571,,Journal,823,,,69-99,,,0,0,repositoryam,Green,,,
59,2-s2.0-85094166058,10.1109/ISCC50000.2020.9219602,,,A Parallel Graph Partitioning Approach to Enhance Community Detection in Social Networks,cp,Conference Paper,Lopes T.,,Universidade Federal de Juiz de Fora,Juiz de Fora,Brazil,,,,,2020-07-01,July 2020,Proceedings - IEEE Symposium on Computers and Communications,15301346,18707,,Conference Proceeding,2020-July,,9219602,,,,3,0,,,,,
60,2-s2.0-85094105420,10.1109/ISCC50000.2020.9219576,,,Increasing the efficiency of Fog Nodes through of Priority-based Load Balancing,cp,Conference Paper,Pereira E.P.,,Universidade Federal de Santa Maria,Santa Maria,Brazil,,,,,2020-07-01,July 2020,Proceedings - IEEE Symposium on Computers and Communications,15301346,18707,,Conference Proceeding,2020-July,,9219576,,,,0,0,,,,,
61,2-s2.0-85094099249,10.1109/ISCC50000.2020.9219611,,,Bringing Fairness in LoRaWAN through SF Allocation Optimization,cp,Conference Paper,Caillouet C.,,Laboratoire d'Informatique de Grenoble,Saint Martin d'Heres,France,,,,,2020-07-01,July 2020,Proceedings - IEEE Symposium on Computers and Communications,15301346,18707,,Conference Proceeding,2020-July,,9219611,,,,1,0,repositoryam,Green,,,
62,2-s2.0-85088694698,10.1007/s00165-020-00515-2,,,Runtime enforcement of timed properties using games,ar,Article,Renard M.,,Université de Bordeaux,Bordeaux,France,,,,,2020-07-01,1 July 2020,Formal Aspects of Computing,09345043,24980,1433299X,Journal,32,2-3,,315-360,,,1,0,repositoryam,Green,,,
63,2-s2.0-85084201736,10.1007/s11241-020-09347-y,,,Feasibility of on-line speed policies in real-time systems,ar,Article,Gaujal B.,,Laboratoire d'Informatique de Grenoble,Saint Martin d'Heres,France,,,,,2020-07-01,1 July 2020,Real-Time Systems,09226443,12443,15731383,Journal,56,3,,254-292,,,0,0,repositoryam,Green,,,
64,2-s2.0-85091526874,10.1145/3377815.3381375,,,Human behaviour centered design: Developing a software system for cultural heritage,cp,Conference Paper,Dugdale J.,,Universite Grenoble Alpes,Saint Martin d'Heres,France,,,,,2020-06-27,27 June 2020,Proceedings - International Conference on Software Engineering,02705257,19242,,Conference Proceeding,,,,85-94,,,4,0,,,,,
65,2-s2.0-85086221848,10.1145/3318464.3380567,,,On the Optimization of Recursive Relational Queries: Application to Graph Queries,cp,Conference Paper,Jachiet L.,,Laboratoire Traitement et Communication de l'Information,Palaiseau,France,,,,,2020-06-14,14 June 2020,Proceedings of the ACM SIGMOD International Conference on Management of Data,07308078,30611,,Conference Proceeding,,,,681-697,,,4,0,repositoryam,Green,,,
