,eid,doi,pii,pubmed_id,title,subtype,subtypeDescription,creator,afid,affilname,affiliation_city,affiliation_country,author_count,author_names,author_ids,author_afids,coverDate,coverDisplayDate,publicationName,issn,source_id,eIssn,aggregationType,volume,issueIdentifier,article_number,pageRange,description,authkeywords,citedby_count,openaccess,freetoread,freetoreadLabel,fund_acr,fund_no,fund_sponsor
478,2-s2.0-85078946897,10.1109/NEWCAS44328.2019.8961269,,,All-Digital Phase-Locked Loop Arrays: Investigation of Synchronisation and Jitter Performance through FPGA Prototyping,cp,Conference Paper,Koskin E.,,University College Dublin,Dublin,Ireland,,,,,2019-06-01,June 2019,"17th IEEE International New Circuits and Systems Conference, NEWCAS 2019",,21100944106,,Conference Proceeding,,,8961269,,,,2,0,,,,,
479,2-s2.0-85078937132,10.1109/ISCC47284.2019.8969743,,,Analytical Evaluation and Potentials of Frame Based Equipment for LTE-LAA/Wi-Fi Coexistence,cp,Conference Paper,Abdelfattah A.,,Sorbonne Universite,Paris,France,,,,,2019-06-01,June 2019,Proceedings - IEEE Symposium on Computers and Communications,15301346,18707,,Conference Proceeding,2019-June,,8969743,,,,2,0,,,,,
480,2-s2.0-85075077764,10.1145/3371991.3371998,,,Multivariate ore polynomials in Sagemath,ar,Article,Kauers M.,,Johannes Kepler University Linz;Sorbonne Universite,Linz;Paris,Austria;France,,,,,2019-06-01,June 2019,ACM Communications in Computer Algebra,19322232,21100198457,19322240,Journal,53,2,,57-60,,,0,0,repositoryam,Green,,,
481,2-s2.0-85074954965,10.1109/CVPR.2019.00209,,,Murel: Multimodal relational reasoning for visual question answering,cp,Conference Paper,Cadene R.,,Sorbonne Universite,Paris,France,,,,,2019-06-01,June 2019,Proceedings of the IEEE Computer Society Conference on Computer Vision and Pattern Recognition,10636919,24212,,Conference Proceeding,2019-June,,8953864,1989-1998,,,121,0,repositoryam,Green,,,
482,2-s2.0-85074853410,10.1109/ARITH.2019.00040,,,Optimal Word-Length Allocation for the Fixed-Point Implementation of Linear Filters and Controllers,cp,Conference Paper,Thibault H.,,Universite Paris-Saclay;Sorbonne Universite,Saint-Aubin;Paris,France;France,,,,,2019-06-01,June 2019,Proceedings - Symposium on Computer Arithmetic,,74910,,Conference Proceeding,2019-June,,8877472,175-182,,,1,0,repositoryam,Green,,,
483,2-s2.0-85074835017,10.1109/ARITH.2019.00048,,,Randomization of Arithmetic over Polynomial Modular Number System,cp,Conference Paper,Didier L.S.,,Universite du Sud Toulon - Var,La Garde,France,,,,,2019-06-01,June 2019,Proceedings - Symposium on Computer Arithmetic,,74910,,Conference Proceeding,2019-June,,8877389,199-206,,,4,0,repositoryam,Green,,,
484,2-s2.0-85074814891,10.1109/ARITH.2019.00049,,,HyPoRes: An Hybrid Representation System for ECC,cp,Conference Paper,Martins P.,,Instituto Superior Técnico,Lisbon,Portugal,,,,,2019-06-01,June 2019,Proceedings - Symposium on Computer Arithmetic,,74910,,Conference Proceeding,2019-June,,8877428,207-214,,,1,0,repositoryam,Green,,,
485,2-s2.0-85073788760,10.1109/FUZZ-IEEE.2019.8858793,,,Fuzzy similarity measures and measurement theory,cp,Conference Paper,Coletti G.,,Università degli Studi di Perugia,Perugia,Italy,,,,,2019-06-01,June 2019,IEEE International Conference on Fuzzy Systems,10987584,110565,,Conference Proceeding,2019-June,,8858793,,,,7,0,,,,,
486,2-s2.0-85071663194,10.1109/FMEC.2019.8795318,,,Network-protocol-based IoT device identification,cp,Conference Paper,Ammar N.,,Nokia Bell Labs,Murray,United States,,,,,2019-06-01,June 2019,"2019 4th International Conference on Fog and Mobile Edge Computing, FMEC 2019",,21100927192,,Conference Proceeding,,,8795318,204-209,,,8,0,,,,,
487,2-s2.0-85071449070,10.1109/WoWMoM.2019.8792976,,,Computing realistic and adaptive capacity of D2D contacts,cp,Conference Paper,Bertier C.,,Sorbonne Universite;THALES SIX GTS FRANCE SAS,Paris;Gennevilliers,France;France,,,,,2019-06-01,June 2019,"20th IEEE International Symposium on A World of Wireless, Mobile and Multimedia Networks, WoWMoM 2019",,21100926515,,Conference Proceeding,,,8792976,,,,0,0,,,,,
488,2-s2.0-85071176978,10.23919/TMA.2019.8784517,,,Autonomous IoT device identification prototype,cp,Conference Paper,Ammar N.,,Nokia Bell Labs,Murray,United States,,,,,2019-06-01,June 2019,TMA 2019 - Proceedings of the 3rd Network Traffic Measurement and Analysis Conference,,21100925605,,Conference Proceeding,,,8784517,195-196,,,3,0,,,,,
489,2-s2.0-85070749398,10.1109/LICS.2019.8785677,,,A comonadic view of simulation and quantum resources,cp,Conference Paper,Abramsky S.,,University of Oxford,Oxford,United Kingdom,,,,,2019-06-01,June 2019,Proceedings - Symposium on Logic in Computer Science,10436871,25562,,Conference Proceeding,2019-June,,8785677,,,,6,0,repositoryam,Green,,,
490,2-s2.0-85069909613,10.23919/IRS.2019.8768161,,,Complex-valued neural networks for fullyoral micro-Doppler classification,cp,Conference Paper,Brooks D.A.,,Thales Group;Sorbonne Universite,Puteaux;Paris,France;France,,,,,2019-06-01,June 2019,Proceedings International Radar Symposium,21555753,21100215175,,Conference Proceeding,2019-June,,8768161,,,,11,0,repositoryam,Green,,,
491,2-s2.0-85069725899,10.1017/S0007680519000709,,,Confronting the Japanese challenge: The revival of manufacturing at Intel,re,Review,Lécuyer C.,,Sorbonne Universite,Paris,France,,,,,2019-06-01,1 June 2019,Business History Review,00076805,20208,2044768X,Journal,93,2,,349-373,,,1,0,repositoryam,Green,,,
492,2-s2.0-85068337934,10.1051/0004-6361/201935335,,,ROHSA: Regularized Optimization for Hyper-Spectral Analysis,ar,Article,Marchal A.,,"Astrophysique, Instrumentation et Modélisation de Paris-Saclay;Institut d'Astrophysique Spatiale",Gif-sur-Yvette;Orsay,France;France,,,,,2019-06-01,1 June 2019,Astronomy and Astrophysics,00046361,26750,14320746,Journal,626,,A101,,,,19,1,repositoryam,Green,,,
493,2-s2.0-85068049944,10.4230/LIPIcs.SoCG.2019.27,,,Almost tight lower bounds for hard cutting problems in embedded graphs,cp,Conference Paper,Cohen-Addad V.,,Sorbonne Universite,Paris,France,,,,,2019-06-01,1 June 2019,"Leibniz International Proceedings in Informatics, LIPIcs",18688969,21100244929,,Conference Proceeding,129,,27,,,,0,0,,,,,
494,2-s2.0-85067862141,10.1002/smr.2206,,,Innovative process paradigms and data driven analytics: A new horizon for software and systems process,ed,Editorial,Raffo D.,,Portland State University,Portland,United States,,,,,2019-06-01,June 2019,Journal of Software: Evolution and Process,,21100205112,20477481,Journal,31,6,e2206,,,,0,1,publisherfree2read,Bronze,,,
495,2-s2.0-85067557744,10.1109/TNET.2019.2912717,,,Routing via Functions in Virtual Networks: The Curse of Choices,ar,Article,Nguyen T.M.,,Sorbonne Universite,Paris,France,,,,,2019-06-01,June 2019,IEEE/ACM Transactions on Networking,10636692,27237,15582566,Journal,27,3,8705279,1192-1205,,,7,0,,,,,
496,2-s2.0-85067399658,10.1371/journal.pone.0217972,,31181112,"Spreading dynamics in a cattle trade network: Size, speed, typical profile and consequences on epidemic control strategies",ar,Article,Payen A.,,AgroParisTech;Sorbonne Universite,Paris;Paris,France;France,,,,,2019-06-01,June 2019,PLoS ONE,,10600153309,19326203,Journal,14,6,e0217972,,,,6,1,repositoryam,Green,,,
497,2-s2.0-85063696104,10.1016/j.micpro.2019.03.006,S0141933118302862,,High-level modeling of communication-centric applications: Extensions to a system-level design and virtual prototyping tool,ar,Article,Genius D.,,Sorbonne Universite,Paris,France,,,,,2019-06-01,June 2019,Microprocessors and Microsystems,01419331,15552,,Journal,67,,,117-130,,,1,0,repositoryam,Green,,,
498,2-s2.0-85045944257,10.1016/j.mejo.2018.01.026,S0026269217305888,,Toward the monitoring of the spinal cord: A feasibility study,ar,Article,Tsiakaka O.,,Sorbonne Universite,Paris,France,,,,,2019-06-01,June 2019,Microelectronics Journal,00262692,9500153939,,Journal,88,,,145-153,,,3,0,repositoryam,Green,,,
499,2-s2.0-85043982040,10.1016/j.cor.2018.02.022,S0305054818300595,,Optimized assignment patterns in Mobile Edge Cloud networks,ar,Article,Ceselli A.,,Università degli Studi di Milano,Milan,Italy,,,,,2019-06-01,June 2019,Computers and Operations Research,03050548,24355,,Journal,106,,,246-259,,,6,0,repositoryam,Green,,,
500,2-s2.0-85066853099,10.1103/PhysRevA.99.052330,,,Near-term quantum-repeater experiments with nitrogen-vacancy centers: Overcoming the limitations of direct transmission,ar,Article,Rozpȩdek F.,,Kavli Institute of Nanoscience Delft;Delft University of Technology,Delft;Delft,Netherlands;Netherlands,,,,,2019-05-22,22 May 2019,Physical Review A,24699926,21100874237,24699934,Journal,99,5,052330,,,,51,0,repositoryam,Green,,,
501,2-s2.0-85067035886,,,,Split-and-merge: Detecting unknown botnets,cp,Conference Paper,Blaise A.,,Thales Group;Sorbonne Universite,Puteaux;Paris,France;France,,,,,2019-05-16,16 May 2019,"2019 IFIP/IEEE Symposium on Integrated Network and Service Management, IM 2019",,21100910979,,Conference Proceeding,,,8717930,153-161,,,3,0,,,,,
502,2-s2.0-85067012434,,,,Q-learning algorithm for joint computation offloading and resource allocation in edge cloud,cp,Conference Paper,Dab B.,,Sorbonne Universite,Paris,France,,,,,2019-05-16,16 May 2019,"2019 IFIP/IEEE Symposium on Integrated Network and Service Management, IM 2019",,21100910979,,Conference Proceeding,,,8717836,45-52,,,18,0,,,,,
503,2-s2.0-85066999664,,,,Collaborative computation offloading for multi-access edge computing,cp,Conference Paper,Yu S.,,Sorbonne Universite,Paris,France,,,,,2019-05-16,16 May 2019,"2019 IFIP/IEEE Symposium on Integrated Network and Service Management, IM 2019",,21100910979,,Conference Proceeding,,,8717863,689-694,,,3,0,,,,,
504,2-s2.0-85061976501,10.1016/j.dam.2019.01.039,S0166218X19300861,,The expanding search ratio of a graph,ar,Article,Angelopoulos S.,,Sorbonne Universite,Paris,France,,,,,2019-05-15,15 May 2019,Discrete Applied Mathematics,0166218X,25890,,Journal,260,,,51-65,,,11,1,repositoryam,Green,,,
505,2-s2.0-85061303712,10.1016/j.dam.2019.01.007,S0166218X19300241,,The query complexity of a permutation-based variant of Mastermind,ar,Article,Afshani P.,,Aarhus Universitet,Aarhus,Denmark,,,,,2019-05-15,15 May 2019,Discrete Applied Mathematics,0166218X,25890,,Journal,260,,,28-50,,,10,1,repositoryam,Green,,,
506,2-s2.0-85049591212,10.1007/s00224-018-9872-3,,,Verification of Quantum Computation: An Overview of Existing Approaches,ar,Article,Gheorghiu A.,,The University of Edinburgh,Edinburgh,United Kingdom,,,,,2019-05-15,15 May 2019,Theory of Computing Systems,14324350,20573,14330490,Journal,63,4,,715-808,,,46,1,repositoryam,Green,,,
507,2-s2.0-85066629788,10.23919/DATE.2019.8715043,,,MixLock: Securing Mixed-Signal Circuits via Logic Locking,cp,Conference Paper,Leonhard J.,,Sorbonne Universite,Paris,France,,,,,2019-05-14,14 May 2019,"Proceedings of the 2019 Design, Automation and Test in Europe Conference and Exhibition, DATE 2019",,21100909438,,Conference Proceeding,,,8715043,84-89,,,20,0,repositoryam,Green,,,
508,2-s2.0-85071839421,10.1109/ICSE-Companion.2019.00044,,,PatchNet: A tool for deep patch classification,cp,Conference Paper,Hoang T.,,Singapore Management University,Singapore City,Singapore,,,,,2019-05-01,May 2019,"Proceedings - 2019 IEEE/ACM 41st International Conference on Software Engineering: Companion, ICSE-Companion 2019",,21100927893,,Conference Proceeding,,,8802642,83-86,,,1,0,repositoryam,Green,,,
509,2-s2.0-85070453041,10.1109/FG.2019.8756538,,,Tree-gated deep regressor ensemble for face alignment in the wild,cp,Conference Paper,Arnaud E.,,Sorbonne Universite,Paris,France,,,,,2019-05-01,May 2019,"Proceedings - 14th IEEE International Conference on Automatic Face and Gesture Recognition, FG 2019",,21100923450,,Conference Proceeding,,,8756538,,,,0,0,repositoryam,Green,,,
510,2-s2.0-85069481928,10.1109/DTIP.2019.8752679,,,Design of a MEMS Electrostatic Kinetic Energy Harvester and its Bennet Conditioning Circuit in Integrated Technologies,cp,Conference Paper,Ben Hassana M.A.,,"University of Carthage, Ecole Polytechnique de Tunisie",La Marsa,Tunisia,,,,,2019-05-01,May 2019,"2019 Symposium on Design, Test, Integration and Packaging of MEMS and MOEMS, DTIP 2019",,21100920017,,Conference Proceeding,,,8752679,,,,5,0,,,,,
511,2-s2.0-85069183490,10.23919/CLEO.2019.8749954,,,Violating Bell inequalities with entangled optical frequency combs and multi-pixel homodyne detection,cp,Conference Paper,Plick W.N.,,University of Dayton,Dayton,United States,,,,,2019-05-01,May 2019,"2019 Conference on Lasers and Electro-Optics, CLEO 2019 - Proceedings",,21100918247,,Conference Proceeding,,,8749954,,,,0,0,,,,,
512,2-s2.0-85069004245,10.1109/ICASSP.2019.8683056,,,Exploring Complex Time-series Representations for Riemannian Machine Learning of Radar Data,cp,Conference Paper,Brooks D.A.,,Thales Group,Puteaux,France,,,,,2019-05-01,May 2019,"ICASSP, IEEE International Conference on Acoustics, Speech and Signal Processing - Proceedings",15206149,110544,,Conference Proceeding,2019-May,,8683056,3672-3676,,,6,0,repositoryam,Green,,,
513,2-s2.0-85061138752,10.1016/j.jalgebra.2019.01.019,S0021869319300535,,Asymptotic combinatorics of Artin–Tits monoids and of some other monoids,ar,Article,Abbes S.,,Institut de Recherche en Informatique Fondamentale (IRIF),Paris,France,,,,,2019-05-01,1 May 2019,Journal of Algebra,00218693,23814,1090266X,Journal,525,,,497-561,,,0,1,repositoryam,Green,,,
514,2-s2.0-85055348423,10.1007/s10878-018-0352-0,,,Speed scaling on parallel processors with migration,ar,Article,Angel E.,,Universite d' Evry Val d'Essonne,Evry,France,,,,,2019-05-01,1 May 2019,Journal of Combinatorial Optimization,13826905,28499,15732886,Journal,37,4,,1266-1282,,,6,1,repositoryam,Green,,,
515,2-s2.0-85040132899,10.1016/j.jsc.2017.12.001,S0747717117301256,,Univariate real root isolation in an extension field and applications,ar,Article,Strzebonski A.,,"Wolfram Research, Inc.",Urbana-Champaign,United States,,,,,2019-05-01,May - June 2019,Journal of Symbolic Computation,07477171,28503,,Journal,92,,,31-51,,,4,0,repositoryam,Green,,,
516,2-s2.0-85073326909,10.18608/jla.2019.61.4,,,From student questions to student profiles in a blended learning environment,ar,Article,Harrak F.,,Sorbonne Universite,Paris,France,,,,,2019-04-15,15 April 2019,Journal of Learning Analytics,,21100932472,19297750,Journal,6,1,,54-84,,,3,1,repositoryam,Green,,,
517,2-s2.0-85063680526,10.1016/j.comcom.2019.03.012,S0140366419302701,,Special Section on Challenged Networks,ed,Editorial,Boldrini C.,,IIT-CNR,,Italy,,,,,2019-04-15,15 April 2019,Computer Communications,01403664,13681,1873703X,Journal,138,,,115,,,0,0,,,,,
518,2-s2.0-85084795857,10.1007/978-3-030-04660-6_10,,,Mitigation transient faults by backward error recovery in SRAM-FPGA,ch,Book Chapter,Ghaffari F.,,Equipes Traitement de l'Information et Systèmes,Cergy-Pontoise,France,,,,,2019-04-10,10 April 2019,Radiation Effects on Integrated Circuits and Systems for Space Applications,,21100982459,,Book,,,,249-276,,,1,0,,,,,
519,2-s2.0-85064973714,10.1109/ICIN.2019.8685915,,,Topology Discovery Performance Evaluation of OpenDaylight and ONOS Controllers,cp,Conference Paper,Tbah M.,,Sorbonne Universite,Paris,France,,,,,2019-04-09,9 April 2019,"Proceedings of the 2019 22nd Conference on Innovation in Clouds, Internet and Networks and Workshops, ICIN 2019",,21100904765,,Conference Proceeding,,,8685915,285-291,,,4,0,,,,,
520,2-s2.0-85064635060,10.1145/3297858.3304065,,,DCNS: Automated Detection of Conservative Non-Sleep Defects in the Linux Kernel,cp,Conference Paper,Bai J.J.,,Sorbonne Universite,Paris,France,,,,,2019-04-04,4 April 2019,International Conference on Architectural Support for Programming Languages and Operating Systems - ASPLOS,,100459,,Conference Proceeding,,,,287-299,,,4,0,repositoryvor,Green,,,
521,2-s2.0-85074762109,10.1109/WCNC.2019.8885537,,,Joint Optimization of Offloading and Resource Allocation Scheme for Mobile Edge Computing,cp,Conference Paper,Dab B.,,Sorbonne Universite,Paris,France,,,,,2019-04-01,April 2019,"IEEE Wireless Communications and Networking Conference, WCNC",15253511,145653,,Conference Proceeding,2019-April,,8885537,,,,5,0,,,,,
522,2-s2.0-85073245171,10.1109/INFCOMW.2019.8845170,,,Poster Abstract: C-Continuum: Edge-to-Cloud computing for distributed AI,cp,Conference Paper,Aguiari D.,,Università degli Studi di Cagliari,Cagliari,Italy,,,,,2019-04-01,April 2019,"INFOCOM 2019 - IEEE Conference on Computer Communications Workshops, INFOCOM WKSHPS 2019",,21100932401,,Conference Proceeding,,,8845170,1053-1054,,,1,0,,,,,
523,2-s2.0-85073216934,10.1109/INFCOMW.2019.8845168,,,Impact of network delays on Hyperledger Fabric,cp,Conference Paper,Nguyen T.S.L.,,Sorbonne Universite,Paris,France,,,,,2019-04-01,April 2019,"INFOCOM 2019 - IEEE Conference on Computer Communications Workshops, INFOCOM WKSHPS 2019",,21100946351,,Conference Proceeding,,,8845168,222-227,,,15,0,repositoryam,Green,,,
524,2-s2.0-85073193826,10.1109/INFCOMW.2019.8845163,,,G-IOTA: Fair and confidence aware tangle,cp,Conference Paper,Bu G.,,Sorbonne Universite,Paris,France,,,,,2019-04-01,April 2019,"INFOCOM 2019 - IEEE Conference on Computer Communications Workshops, INFOCOM WKSHPS 2019",,21100946351,,Conference Proceeding,,,8845163,644-649,,,11,0,repositoryam,Green,,,
525,2-s2.0-85072843021,10.1109/CoDIT.2019.8820394,,,Selection and scheduling of actions for innovation capabilities improvement,cp,Conference Paper,Quezada F.,,Sorbonne Universite,Paris,France,,,,,2019-04-01,April 2019,"2019 6th International Conference on Control, Decision and Information Technologies, CoDIT 2019",,21100931006,,Conference Proceeding,,,8820394,25-29,,,0,0,,,,,
526,2-s2.0-85072831749,10.1109/CoDIT.2019.8820709,,,Stochastic dual dynamic integer programming for a multi-echelon lot-sizing problem with remanufacturing and lost sales,cp,Conference Paper,Quezada F.,,Conservatoire National des Arts et Metiers;Sorbonne Universite,Paris;Paris,France;France,,,,,2019-04-01,April 2019,"2019 6th International Conference on Control, Decision and Information Technologies, CoDIT 2019",,21100931006,,Conference Proceeding,,,8820709,1254-1259,,,1,0,,,,,
527,2-s2.0-85069189332,10.1109/VTS.2019.8758634,,,IP Session on Machine Learning Applications in IC Test-Related Tasks,cp,Conference Paper,Sokar G.,,Cairo University,Giza,Egypt,,,,,2019-04-01,April 2019,Proceedings of the IEEE VLSI Test Symposium,,14939,,Conference Proceeding,2019-April,,8758634,,,,0,0,,,,,
528,2-s2.0-85068213850,10.1109/INFOCOM.2019.8737539,,,Performance Analysis of Online Social Platforms,cp,Conference Paper,Giovanidis A.,,Sorbonne Universite,Paris,France,,,,,2019-04-01,April 2019,Proceedings - IEEE INFOCOM,0743166X,18204,,Conference Proceeding,2019-April,,8737539,2413-2421,,,5,0,repositoryam,Green,,,
529,2-s2.0-85064397650,10.1364/OE.27.009803,,31045129,Active engineering of four-wave mixing spectral correlations in multiband hollow-core fibers,ar,Article,Cordier M.,,Universite Paris-Saclay,Saint-Aubin,France,,,,,2019-04-01,1 April 2019,Optics Express,,12862,10944087,Journal,27,7,,9803-9814,,,20,1,repositoryam,Green,,,
530,2-s2.0-85058168917,10.1016/j.patcog.2018.12.005,S0031320318304266,,Deep representation design from deep kernel networks,ar,Article,Jiu M.,,Zhengzhou University,Zhengzhou,China,,,,,2019-04-01,April 2019,Pattern Recognition,00313203,24823,,Journal,88,,,447-457,,,10,0,repositoryam,Green,,,
531,2-s2.0-85056335108,10.1007/s10817-018-9492-2,,,Refinement to Certify Abstract Interpretations: Illustrated on Linearization for Polyhedra,ar,Article,Boulmé S.,,Verimag,Saint Martin d'Heres,France,,,,,2019-04-01,1 April 2019,Journal of Automated Reasoning,01687433,24354,15730670,Journal,62,4,,505-530,,,0,0,repositoryam,Green,,,
532,2-s2.0-85053375010,10.1007/s12243-018-0663-2,,,A fast unsupervised preprocessing method for network monitoring,ar,Article,Andreoni Lopez M.,,Sorbonne Universite;Universidade Federal do Rio de Janeiro,Paris;Rio de Janeiro,France;Brazil,,,,,2019-04-01,1 April 2019,Annales des Telecommunications/Annals of Telecommunications,00034347,17722,19589395,Journal,74,3-4,,139-155,,,12,0,repositoryam,Green,,,
533,2-s2.0-85083945126,10.1145/3301419.3323970,,,Invariant safety for distributed applications,cp,Conference Paper,Nair S.S.,,Sorbonne Universite,Paris,France,,,,,2019-03-25,25 March 2019,"Proceedings of the 6th Workshop on Principles and Practice of Consistency for Distributed Data, PaPoC 2019",,21100948321,,Conference Proceeding,,,,,,,4,0,repositoryam,Green,,,
534,2-s2.0-85063911118,10.1145/3302424.3303960,,,When eXtended para - Virtualization (XPV) meets NUMA,cp,Conference Paper,Bui B.,,Université Fédérale Toulouse Midi-Pyrénées,Toulouse,France,,,,,2019-03-25,25 March 2019,Proceedings of the 14th EuroSys Conference 2019,,21100902846,,Conference Proceeding,,,3303960,,,,4,0,repositoryvor,Green,,,
535,2-s2.0-85063915008,10.1109/LADC.2018.00026,,,Multi-hop Byzantine Reliable Broadcast Made Practical,cp,Conference Paper,Bonomi S.,,Sapienza Università di Roma,Rome,Italy,,,,,2019-03-19,19 March 2019,"Proceedings - 8th Latin-American Symposium on Dependable Computing, LADC 2018",,21100902854,,Conference Proceeding,,,8671551,155-160,,,1,0,repositoryam,Green,,,
536,2-s2.0-85063859698,10.1109/LADC.2018.00022,,,Bundling Messages to Reduce the Cost of Tree-Based Broadcast Algorithms,cp,Conference Paper,Rodrigues L.A.,,Universidade Estadual do Oeste do Paraná,Cascavel,Brazil,,,,,2019-03-19,19 March 2019,"Proceedings - 8th Latin-American Symposium on Dependable Computing, LADC 2018",,21100902854,,Conference Proceeding,,,8671601,115-124,,,0,0,repositoryam,Green,,,
537,2-s2.0-85064164920,10.1109/SANER.2019.8668017,,,Detecting Data Races Caused by Inconsistent Lock Protection in Device Drivers,cp,Conference Paper,Chen Q.L.,,Tsinghua University,Beijing,China,,,,,2019-03-15,15 March 2019,"SANER 2019 - Proceedings of the 2019 IEEE 26th International Conference on Software Analysis, Evolution, and Reengineering",,21100903220,,Conference Proceeding,,,8668017,366-376,,,5,0,repositoryam,Green,,,
538,2-s2.0-85049086533,10.1007/s00453-018-0461-2,,,On the Separation and Equivalence of Paging Strategies and Other Online Algorithms,ar,Article,Angelopoulos S.,,Sorbonne Universite,Paris,France,,,,,2019-03-15,15 March 2019,Algorithmica,01784617,23087,14320541,Journal,81,3,,1152-1179,,,3,0,repositoryam,Green,,,
539,2-s2.0-85044929511,10.1007/s10479-018-2827-x,,,On the complexity of the Unit Commitment Problem,ar,Article,Bendotti P.,,Electricité de France;Sorbonne Universite,Paris;Paris,France;France,,,,,2019-03-15,15 March 2019,Annals of Operations Research,02545330,23090,15729338,Journal,274,1-2,,119-130,,,11,0,,,,,
540,2-s2.0-85088162748,10.1007/s41060-018-0121-2,,,Easy-Mention: a model-driven mention recommendation heuristic to boost your tweet popularity,ar,Article,Pramanik S.,,Indian Institute of Technology Kharagpur,Kharagpur,India,,,,,2019-03-07,7 March 2019,International Journal of Data Science and Analytics,2364415X,21101017225,23644168,Journal,7,2,,131-147,,,1,0,,,,,
541,2-s2.0-85074919552,10.4230/LIPIcs.STACS.2019.7,,,Best-of-two-worlds analysis of online search,cp,Conference Paper,Angelopoulos S.,,Sorbonne Universite,Paris,France,,,,,2019-03-01,1 March 2019,"Leibniz International Proceedings in Informatics, LIPIcs",18688969,21100244929,,Conference Proceeding,126,,7,,,,2,0,,,,,
542,2-s2.0-85057113212,10.1016/j.jpdc.2018.10.011,S0743731518307822,,VCube-PS: A causal broadcast topic-based publish/subscribe system,ar,Article,de Araujo J.P.,,Sorbonne Universite,Paris,France,,,,,2019-03-01,March 2019,Journal of Parallel and Distributed Computing,07437315,25621,,Journal,125,,,18-30,,,4,0,repositoryam,Green,,,
543,2-s2.0-85062528741,10.1088/1367-2630/ab05fb,,,Super- and subradiance of clock atoms in multimode optical waveguides,ar,Article,Ostermann L.,,Universität Innsbruck,Innsbruck,Austria,,,,,2019-02-28,28 February 2019,New Journal of Physics,13672630,29047,,Journal,21,2,025004,,,,8,1,repositoryam,Green,,,
544,2-s2.0-85062293828,10.1103/PhysRevA.99.022342,,,High-dimensional quantum encoding via photon-subtracted squeezed states,ar,Article,Arzani F.,,Université de Lorraine;Sorbonne Universite,Nancy;Paris,France;France,,,,,2019-02-28,28 February 2019,Physical Review A,24699926,21100874237,24699934,Journal,99,2,022342,,,,5,0,repositoryam,Green,,,
545,2-s2.0-85062290254,10.1103/PhysRevA.99.022336,,,Semi-device-independent quantum money with coherent states,ar,Article,Bozzio M.,,Universite Paris-Saclay;Sorbonne Universite,Saint-Aubin;Paris,France;France,,,,,2019-02-27,27 February 2019,Physical Review A,24699926,21100874237,24699934,Journal,99,2,022336,,,,4,0,repositoryam,Green,,,
546,2-s2.0-85059056450,10.1016/j.comnet.2018.12.010,S1389128618313598,,Link streams: Methods and applications,ed,Editorial,Latapy M.,,Laboratoire d'Informatique de Paris 6,Paris,France,,,,,2019-02-26,26 February 2019,Computer Networks,13891286,26811,,Journal,150,,,263-265,,,2,0,,,,,
547,2-s2.0-85063501334,10.1109/CCNC.2019.8651879,,,A Novel Joint Offloading and Resource Allocation Scheme for Mobile Edge Computing,cp,Conference Paper,Dab B.,,Sorbonne Universite,Paris,France,,,,,2019-02-25,25 February 2019,"2019 16th IEEE Annual Consumer Communications and Networking Conference, CCNC 2019",,21100902104,,Conference Proceeding,,,8651879,,,,11,0,,,,,
548,2-s2.0-85056996569,10.1016/j.neucom.2018.11.002,S0925231218313195,,Distributed optimization for deep learning with gossip exchange,ar,Article,Blot M.,,Sorbonne Universite,Paris,France,,,,,2019-02-22,22 February 2019,Neurocomputing,09252312,24807,18728286,Journal,330,,,287-296,,,17,0,repositoryvor,Green,,,
549,2-s2.0-85062961163,10.1109/ACSSC.2018.8645439,,,Rigorous Polynomial Approximation,cp,Conference Paper,Lauter C.,,Laboratoire d'Informatique de Paris 6,Paris,France,,,,,2019-02-19,19 February 2019,"Conference Record - Asilomar Conference on Signals, Systems and Computers",10586393,12222,,Conference Proceeding,2018-October,,8645439,120-124,,,0,0,,,,,
