,eid,doi,pii,pubmed_id,title,subtype,subtypeDescription,creator,afid,affilname,affiliation_city,affiliation_country,author_count,author_names,author_ids,author_afids,coverDate,coverDisplayDate,publicationName,issn,source_id,eIssn,aggregationType,volume,issueIdentifier,article_number,pageRange,description,authkeywords,citedby_count,openaccess,freetoread,freetoreadLabel,fund_acr,fund_no,fund_sponsor
1439,2-s2.0-85029606618,10.1007/978-3-319-66610-5_11,,,MAGAM: A multi-aspect generic adaptation model for learning environments,cp,Conference Paper,Monterrat B.,,Sorbonne Universite,Paris,France,,,,,2017-01-01,2017,Lecture Notes in Computer Science (including subseries Lecture Notes in Artificial Intelligence and Lecture Notes in Bioinformatics),03029743,25674,16113349,Book Series,10474 LNCS,,,139-152,,,2,0,repositoryam,Green,,,
1440,2-s2.0-85029604617,10.1007/978-3-319-66610-5_35,,,An ontology for describing scenarios of multi-players learning games: Toward an automatic detection of group interactions,cp,Conference Paper,Guinebert M.,,CNRS Centre National de la Recherche Scientifique,Paris,France,,,,,2017-01-01,2017,Lecture Notes in Computer Science (including subseries Lecture Notes in Artificial Intelligence and Lecture Notes in Bioinformatics),03029743,25674,16113349,Book Series,10474 LNCS,,,410-415,,,4,0,,,,,
1441,2-s2.0-85029576700,10.1007/978-3-319-66610-5_29,,,An approach for the analysis of perceptual and gestural performance during critical situations,cp,Conference Paper,Bourrier Y.,,Laboratoire d'Informatique de Grenoble;Sorbonne Universite,Saint Martin d'Heres;Paris,France;France,,,,,2017-01-01,2017,Lecture Notes in Computer Science (including subseries Lecture Notes in Artificial Intelligence and Lecture Notes in Bioinformatics),03029743,25674,16113349,Book Series,10474 LNCS,,,373-378,,,1,0,,,,,
1442,2-s2.0-85029523899,10.18293/SEKE2017-153,,,Practical reasoning in an argumentation-based decision BDI agent: A case study for participatory management of protected areas,cp,Conference Paper,Velmovitsky P.E.,,Pontifícia Universidade Católica do Rio de Janeiro,Rio de Janeiro,Brazil,,,,,2017-01-01,2017,"Proceedings of the International Conference on Software Engineering and Knowledge Engineering, SEKE",23259000,21100400011,23259086,Conference Proceeding,,,,527-530,,,3,1,repositoryam,Green,,,
1443,2-s2.0-85029515153,,,,Learning and selection of dynamic Bayesian networks for non-stationary processes in real time,cp,Conference Paper,Hourbracq M.,,Sorbonne Universite;Akheros S.A.S.,Paris;,France;France,,,,,2017-01-01,2017,FLAIRS 2017 - Proceedings of the 30th International Florida Artificial Intelligence Research Society Conference,,21100830700,,Conference Proceeding,,,,742-747,,,1,0,,,,,
1444,2-s2.0-85029474536,10.1007/978-3-319-67113-0_11,,,Certified Gathering of Oblivious Mobile Robots: Survey of Recent Results and Open Problems,cp,Conference Paper,Balabonski T.,,Universite Paris-Saclay,Saint-Aubin,France,,,,,2017-01-01,2017,Lecture Notes in Computer Science (including subseries Lecture Notes in Artificial Intelligence and Lecture Notes in Bioinformatics),03029743,25674,16113349,Book Series,10471 LNCS,,,165-181,,,2,0,,,,,
1445,2-s2.0-85029412149,10.1007/978-3-319-66583-2_13,,,Analysis of performance and energy consumption in the cloud,cp,Conference Paper,Kandi M.,,Universite Paris-Saclay,Saint-Aubin,France,,,,,2017-01-01,2017,Lecture Notes in Computer Science (including subseries Lecture Notes in Artificial Intelligence and Lecture Notes in Bioinformatics),03029743,25674,16113349,Book Series,10497 LNCS,,,199-213,,,1,0,,,,,
1446,2-s2.0-85029007956,10.1007/978-3-319-66197-1_26,,,Towards automated deployment of self-adaptive applications on hybrid clouds,cp,Conference Paper,Hillah L.M.,,Université Paris Nanterre;Sorbonne Universite,Nanterre;Paris,France;France,,,,,2017-01-01,2017,Lecture Notes in Computer Science (including subseries Lecture Notes in Artificial Intelligence and Lecture Notes in Bioinformatics),03029743,25674,16113349,Book Series,10469 LNCS,,,388-393,,,0,0,,,,,
1447,2-s2.0-85029005972,10.1007/978-3-319-66197-1_1,,,Information flow tracking for linux handling concurrent system calls and shared memory,cp,Conference Paper,Georget L.,,Universite de Rennes 1,Rennes,France,,,,,2017-01-01,2017,Lecture Notes in Computer Science (including subseries Lecture Notes in Artificial Intelligence and Lecture Notes in Bioinformatics),03029743,25674,16113349,Book Series,10469 LNCS,,,1-16,,,5,0,repositoryam,Green,,,
1448,2-s2.0-85028723249,10.1007/978-3-319-66263-3_15,,,PaInleSS: A framework for parallel SAT solving,cp,Conference Paper,Le Frioux L.,,EPITA;Laboratoire d'Informatique de Paris 6;Sorbonne Universite,Le Kremlin-Bicetre;Paris;Paris,France;France;France,,,,,2017-01-01,2017,Lecture Notes in Computer Science (including subseries Lecture Notes in Artificial Intelligence and Lecture Notes in Bioinformatics),03029743,25674,16113349,Book Series,10491 LNCS,,,233-250,,,13,0,,,,,
1449,2-s2.0-85028721134,10.1007/978-3-319-64203-1_15,,,Optimizing egalitarian performance in the side-effects model of colocation for data center resource management,cp,Conference Paper,Pascual F.,,Sorbonne Universite,Paris,France,,,,,2017-01-01,2017,Lecture Notes in Computer Science (including subseries Lecture Notes in Artificial Intelligence and Lecture Notes in Bioinformatics),03029743,25674,16113349,Book Series,10417 LNCS,,,206-219,,,1,0,repositoryam,Green,,,
1450,2-s2.0-85028673899,10.1016/j.procs.2017.06.084,S1877050917312607,,Toward an Efficient Ambient Guidance for Transport Applications,cp,Conference Paper,Ilié J.M.,,Laboratoire d'Informatique de Paris 6,Paris,France,,,,,2017-01-01,2017,Procedia Computer Science,,19700182801,18770509,Conference Proceeding,110,,,190-198,,,1,1,publisherfullgold,Gold,,,
1451,2-s2.0-85028669847,10.1007/978-3-319-66706-5_14,,,Quantitative static analysis of communication protocols using abstract Markov Chains,cp,Conference Paper,Ouadjaout A.,,Sorbonne Universite,Paris,France,,,,,2017-01-01,2017,Lecture Notes in Computer Science (including subseries Lecture Notes in Artificial Intelligence and Lecture Notes in Bioinformatics),03029743,25674,16113349,Book Series,10422 LNCS,,,277-298,,,1,0,repositoryam,Green,,,
1452,2-s2.0-85028469104,10.1007/978-3-319-63697-9_14,,,Private multiplication over finite fields,cp,Conference Paper,Belaïd S.,,Thales Communications &amp; Security,Gennevilliers,France,,,,,2017-01-01,2017,Lecture Notes in Computer Science (including subseries Lecture Notes in Artificial Intelligence and Lecture Notes in Bioinformatics),03029743,25674,16113349,Book Series,10403 LNCS,,,397-426,,,17,0,,,,,
1453,2-s2.0-85028359309,10.1007/978-3-319-56932-1_27,,,Univariate real root isolation over a single logarithmic extension of real algebraic numbers,cp,Conference Paper,Strzeboński A.,,"Wolfram Research, Inc.",Urbana-Champaign,United States,,,,,2017-01-01,2017,Springer Proceedings in Mathematics and Statistics,21941009,21100255398,21941017,Conference Proceeding,198,,,425-445,,,0,0,repositoryam,Green,,,
1454,2-s2.0-85027352171,10.1016/j.procs.2017.05.140,S1877050917307111,,Parallel Learning Portfolio-based solvers,cp,Conference Paper,Menouer T.,,Université Paris Nanterre,Nanterre,France,,,,,2017-01-01,2017,Procedia Computer Science,,19700182801,18770509,Conference Proceeding,108,,,335-344,,,2,1,publisherfullgold,Gold,,,
1455,2-s2.0-85027146808,10.1007/978-3-319-62395-5_7,,,Impact of temporal features of cattle exchanges on the size and speed of epidemic outbreaks,cp,Conference Paper,Payen A.,,AgroParisTech;Sorbonne Universite,Paris;Paris,France;France,,,,,2017-01-01,2017,Lecture Notes in Computer Science (including subseries Lecture Notes in Artificial Intelligence and Lecture Notes in Bioinformatics),03029743,25674,16113349,Book Series,10405,,,84-97,,,2,0,repositoryam,Green,,,
1456,2-s2.0-85027041200,10.25088/ComplexSystems.26.1.1,,,Rigorous measurement of the internet degree distribution,ar,Article,Latapy M.,,Sorbonne Universite,Paris,France,,,,,2017-01-01,2017,Complex Systems,08912513,21100228550,,Journal,26,1,,1-29,,,1,0,repositoryam,Green,,,
1457,2-s2.0-85027021595,,,,Least squares affine transitions for global parameterization,ar,Article,Vintescu A.,,Laboratoire Traitement et Communication de l'Information,Palaiseau,France,,,,,2017-01-01,2017,Journal of WSCG,12136972,19400157203,12136964,Journal,25,1,,21-30,,,2,0,,,,,
1458,2-s2.0-85026848499,10.1039/c7dt01899a,,28683153,Calix[4]arene-fused phospholes,ar,Article,Elaieb F.,,Université de Strasbourg,Strasbourg,France,,,,,2017-01-01,2017,Dalton Transactions,14779226,9500153949,14779234,Journal,46,30,,9833-9845,,,12,0,repositoryam,Green,,,
1459,2-s2.0-85026735452,10.1007/978-3-319-61949-1_37,,,Crowd sensing of weather conditions and traffic congestion based on data mining in social networks,cp,Conference Paper,Tse R.,,Macao Polytechnic Institute,Macau,Macao,,,,,2017-01-01,2017,"Lecture Notes of the Institute for Computer Sciences, Social-Informatics and Telecommunications Engineering, LNICST",18678211,21100220348,,Book Series,195 LNICST,,,353-361,,,2,0,,,,,
1460,2-s2.0-85026392243,10.1007/978-3-319-60042-0_47,,,Introducing causality in business rule-based decisions,cp,Conference Paper,Mernissi K.E.,,Compagnie IBM France;Sorbonne Universite,Bois-Colombes;Paris,France;France,,,,,2017-01-01,2017,Lecture Notes in Computer Science (including subseries Lecture Notes in Artificial Intelligence and Lecture Notes in Bioinformatics),03029743,25674,16113349,Book Series,10350 LNCS,,,433-439,,,0,0,,,,,
1461,2-s2.0-85026391028,,,,Améliorer la propagation: L'Importance d'être Inconsistant,cp,Conference Paper,Ziat G.,,Sorbonne Universite,Paris,France,,,,,2017-01-01,2017,"Treiziemes Journees Francophones de Programmation par Contraintes, JFPC 2017",,21100825265,,Conference Proceeding,,,,213-222,,,0,0,,,,,
1462,2-s2.0-85026289470,10.1007/978-3-319-60045-1_20,,,aGrUM: A graphical universal model framework,cp,Conference Paper,Gonzales C.,,Sorbonne Universite,Paris,France,,,,,2017-01-01,2017,Lecture Notes in Computer Science (including subseries Lecture Notes in Artificial Intelligence and Lecture Notes in Bioinformatics),03029743,25674,16113349,Book Series,10351 LNCS,,,171-177,,,11,0,repositoryam,Green,,,
1463,2-s2.0-85025654345,,,,MPDI: A decimal multiple-precision interval arithmetic library,ar,Article,Graillat S.,,Sorbonne Universite,Paris,France,,,,,2017-01-01,2017,Reliable Computing,13853139,22782,15731340,Journal,25,,,38-52,,,1,0,,,,,
1464,2-s2.0-85025133653,,,,Optimizing quantiles in preference-based markov decision processes,cp,Conference Paper,Gilbert H.,,Sorbonne Universite,Paris,France,,,,,2017-01-01,2017,"31st AAAI Conference on Artificial Intelligence, AAAI 2017",,21100832747,,Conference Proceeding,,,,3569-3575,,,7,0,,,,,
1465,2-s2.0-85024477638,10.5220/0006288202680275,,,Time weight content-based extensions of temporal graphs for personalized recommendation,cp,Conference Paper,Nzeko'o A.J.N.,,Université de Yaoundé I;Sorbonne Universite,Yaounde;Paris,Cameroon;France,,,,,2017-01-01,2017,WEBIST 2017 - Proceedings of the 13th International Conference on Web Information Systems and Technologies,,21100823449,,Conference Proceeding,,,,268-275,,,3,1,repositoryam,Green,,,
1466,2-s2.0-85023763986,10.5220/0006315100820091,,,An authoring tool to elicit knowledge to be taught without programming,cp,Conference Paper,Diattara A.,,Laboratoire d'Informatique de Grenoble;Université Claude Bernard Lyon 1,Saint Martin d'Heres;Villeurbanne,France;France,,,,,2017-01-01,2017,CSEDU 2017 - Proceedings of the 9th International Conference on Computer Supported Education,,21100469401,,Conference Proceeding,1,,,82-91,,,1,1,repositoryam,Green,,,
1467,2-s2.0-85022217703,10.1007/978-3-319-61425-0_41,,,A multi-layered architecture for analysis of non-technical-skills in critical situations,cp,Conference Paper,Bourrier Y.,,Laboratoire d'Informatique de Paris 6;Laboratoire d'Informatique de Grenoble,Paris;Saint Martin d'Heres,France;France,,,,,2017-01-01,2017,Lecture Notes in Computer Science (including subseries Lecture Notes in Artificial Intelligence and Lecture Notes in Bioinformatics),03029743,25674,16113349,Book Series,10331 LNAI,,,463-466,,,0,0,,,,,
1468,2-s2.0-85022178963,10.1007/978-3-319-59294-7_23,,,Coordination of sensors deployed on airborne platform: A scheduling approach,cp,Conference Paper,Grivault L.,,Laboratoire d'Informatique de Paris 6;Thales Group,Paris;Puteaux,France;France,,,,,2017-01-01,2017,Lecture Notes in Computer Science (including subseries Lecture Notes in Artificial Intelligence and Lecture Notes in Bioinformatics),03029743,25674,16113349,Book Series,10207 LNAI,,,285-292,,,0,0,,,,,
1469,2-s2.0-85021765332,10.1007/978-3-319-59605-1_1,,,On the complexity of minimizing the total calibration cost,cp,Conference Paper,Angel E.,,Universite d' Evry Val d'Essonne,Evry,France,,,,,2017-01-01,2017,Lecture Notes in Computer Science (including subseries Lecture Notes in Artificial Intelligence and Lecture Notes in Bioinformatics),03029743,25674,16113349,Book Series,10336 LNCS,,,1-12,,,12,0,,,,,
1470,2-s2.0-85021719617,10.1007/978-3-319-59879-6_6,,,Loop-abort faults on supersingular isogeny cryptosystems,cp,Conference Paper,Gélin A.,,Sorbonne Universite,Paris,France,,,,,2017-01-01,2017,Lecture Notes in Computer Science (including subseries Lecture Notes in Artificial Intelligence and Lecture Notes in Bioinformatics),03029743,25674,16113349,Book Series,10346 LNCS,,,93-106,,,18,0,repositoryam,Green,,,
1471,2-s2.0-85021667958,10.1007/978-3-319-59758-4_17,,,Learning concept-driven document embeddings for medical information search,cp,Conference Paper,Nguyen G.H.,,Université Fédérale Toulouse Midi-Pyrénées,Toulouse,France,,,,,2017-01-01,2017,Lecture Notes in Computer Science (including subseries Lecture Notes in Artificial Intelligence and Lecture Notes in Bioinformatics),03029743,25674,16113349,Book Series,10259 LNAI,,,160-170,,,11,0,repositoryam,Green,,,
1472,2-s2.0-85021216631,10.1007/978-3-319-61428-1_1,,,Stochastic bounds for switched Bernoulli batch arrivals observed through measurements,cp,Conference Paper,Aït-Salaht F.,,ENSAI Ecole Nationale de la Statistique et de lAnalyse de lInformation,Bruz,France,,,,,2017-01-01,2017,Lecture Notes in Computer Science (including subseries Lecture Notes in Artificial Intelligence and Lecture Notes in Bioinformatics),03029743,25674,16113349,Book Series,10378 LNCS,,,1-15,,,0,0,,,,,
1473,2-s2.0-85020900769,10.1007/978-3-319-57837-8_41,,,Improving defect tracking using shared context,cp,Conference Paper,Tahir H.,,Laboratoire d'Informatique de Paris 6,Paris,France,,,,,2017-01-01,2017,Lecture Notes in Computer Science (including subseries Lecture Notes in Artificial Intelligence and Lecture Notes in Bioinformatics),03029743,25674,16113349,Book Series,10257 LNAI,,,498-509,,,0,0,,,,,
1474,2-s2.0-85020846281,10.1007/978-3-319-57837-8_33,,,Context-aware big data analytics and visualization for city-wide traffic accidents,cp,Conference Paper,Fan X.,,Lanzhou University;Xiamen University,Lanzhou;Xiamen,China;China,,,,,2017-01-01,2017,Lecture Notes in Computer Science (including subseries Lecture Notes in Artificial Intelligence and Lecture Notes in Bioinformatics),03029743,25674,16113349,Book Series,10257 LNAI,,,395-405,,,5,0,,,,,
1475,2-s2.0-85020696286,10.3906/elk-1506-51,,,Performance analysis and optimization of cluster-based mesh FPGA architectures: Design methodology and CAD tool support,ar,Article,Chtourou S.,,Ecole Nationale d'Ingénieurs de Sfax,Sfax,Tunisia,,,,,2017-01-01,2017,Turkish Journal of Electrical Engineering and Computer Sciences,13000632,22933,13036203,Journal,25,3,,2044-2054,,,1,0,repositoryam,Green,,,
1476,2-s2.0-85020669033,10.1007/978-3-319-59870-3_7,,,Prover efficient public verification of dense or sparse/structured matrix-vector multiplication,cp,Conference Paper,Dumas J.G.,,Universite Grenoble Alpes,Saint Martin d'Heres,France,,,,,2017-01-01,2017,Lecture Notes in Computer Science (including subseries Lecture Notes in Artificial Intelligence and Lecture Notes in Bioinformatics),03029743,25674,16113349,Book Series,10343 LNCS,,,115-134,,,2,0,repositoryam,Green,,,
1477,2-s2.0-85019761335,10.1007/978-3-319-59044-8_17,,,Who wants to chat on a MOOC? Lessons from a peer recommender system,cp,Conference Paper,Bouchet F.,,Sorbonne Universite,Paris,France,,,,,2017-01-01,2017,Lecture Notes in Computer Science (including subseries Lecture Notes in Artificial Intelligence and Lecture Notes in Bioinformatics),03029743,25674,16113349,Book Series,10254 LNCS,,,150-159,,,4,0,repositoryam,Green,,,
1478,2-s2.0-85019698202,10.1007/978-3-319-59647-1_8,,,A distributed recommender system based on graded multi-label classification,cp,Conference Paper,Laghmari K.,,Faculté des Sciences et Techniques de Mohammedia;Sorbonne Universite,Mohammedia;Paris,Morocco;France,,,,,2017-01-01,2017,Lecture Notes in Computer Science (including subseries Lecture Notes in Artificial Intelligence and Lecture Notes in Bioinformatics),03029743,25674,16113349,Book Series,10299 LNCS,,,101-108,,,0,0,,,,,
1479,2-s2.0-85019243082,10.1007/978-3-319-58747-9_3,,,Verification of quantum computation and the price of trust,cp,Conference Paper,Gheorghiu A.,,The University of Edinburgh,Edinburgh,United Kingdom,,,,,2017-01-01,2017,Lecture Notes in Computer Science (including subseries Lecture Notes in Artificial Intelligence and Lecture Notes in Bioinformatics),03029743,25674,16113349,Book Series,10304 LNCS,,,15-19,,,0,0,repositoryam,Green,,,
1480,2-s2.0-85019221070,10.1007/978-3-319-57861-3_13,,,The complexity of diagnosability and opacity verification for Petri nets,cp,Conference Paper,Bérard B.,,École Normale Supérieure Paris-Saclay;Sorbonne Universite,Cachan;Paris,France;France,,,,,2017-01-01,2017,Lecture Notes in Computer Science (including subseries Lecture Notes in Artificial Intelligence and Lecture Notes in Bioinformatics),03029743,25674,16113349,Book Series,10258 LNCS,,,200-220,,,6,0,repositoryam,Green,,,
1481,2-s2.0-85019210669,10.1007/978-3-319-58747-9_9,,,Entropic uniform sampling of linear extensions in series-parallel posets,cp,Conference Paper,Bodini O.,,University Sorbonne Paris Nord,Villetaneuse,France,,,,,2017-01-01,2017,Lecture Notes in Computer Science (including subseries Lecture Notes in Artificial Intelligence and Lecture Notes in Bioinformatics),03029743,25674,16113349,Book Series,10304 LNCS,,,71-84,,,6,0,,,,,
1482,2-s2.0-85019199272,10.1007/978-3-319-57861-3_9,,,Petri nets repository: A tool to benchmark and debug Petri Net tools,cp,Conference Paper,Hillah L.M.,,Université Paris Nanterre,Nanterre,France,,,,,2017-01-01,2017,Lecture Notes in Computer Science (including subseries Lecture Notes in Artificial Intelligence and Lecture Notes in Bioinformatics),03029743,25674,16113349,Book Series,10258 LNCS,,,125-135,,,8,0,repositoryam,Green,,,
1483,2-s2.0-85018810357,10.3233/978-1-61499-753-5-421,,28423827,Parallel Design of Browsing Scheme and Data Model for Multi-Level Hierarchical Application Devoted to Management of Patient with Infectious Disease in Primary Care,ar,Article,Ugon A.,,Sorbonne Universite,Paris,France,,,,,2017-01-01,2017,Studies in Health Technology and Informatics,09269630,19582,18798365,Book Series,235,,,421-425,,,0,0,,,,,
1484,2-s2.0-85018710660,10.1007/978-3-319-56620-7_3,,,Computing generator in cyclotomic integer rings a subfield algorithm for the principal ideal problem in L<inf>|Δk|</inf>(1/2) and application to the cryptanalysis of a FHE scheme,cp,Conference Paper,Biasse J.F.,,"University of South Florida, Tampa",Tampa,United States,,,,,2017-01-01,2017,Lecture Notes in Computer Science (including subseries Lecture Notes in Artificial Intelligence and Lecture Notes in Bioinformatics),03029743,25674,16113349,Book Series,10210 LNCS,,,60-88,,,12,0,repositoryam,Green,,,
1485,2-s2.0-85018275410,10.1007/978-3-319-57666-4_4,,,Checking business process evolution,cp,Conference Paper,Poizat P.,,Université Paris Nanterre;Sorbonne Universite,Nanterre;Paris,France;France,,,,,2017-01-01,2017,Lecture Notes in Computer Science (including subseries Lecture Notes in Artificial Intelligence and Lecture Notes in Bioinformatics),03029743,25674,16113349,Book Series,10231 LNCS,,,36-53,,,11,0,repositoryam,Green,,,
1486,2-s2.0-85017632921,10.1007/978-3-319-56549-1_22,,,The quantum-safe revolution,cp,Conference Paper,Faugère J.C.,,Sorbonne Universite,Paris,France,,,,,2017-01-01,2017,Lecture Notes in Computer Science (including subseries Lecture Notes in Artificial Intelligence and Lecture Notes in Bioinformatics),03029743,25674,16113349,Book Series,10144 LNCS,,,258-266,,,0,0,,,,,
1487,2-s2.0-85017565510,10.1007/978-3-319-56258-2_12,,,A framework for high level simulation and optimization of coarse-grained reconfigurable architectures,cp,Conference Paper,Pasha M.A.,,Lahore University of Management Sciences,Lahore,Pakistan,,,,,2017-01-01,2017,Lecture Notes in Computer Science (including subseries Lecture Notes in Artificial Intelligence and Lecture Notes in Bioinformatics),03029743,25674,16113349,Book Series,10216 LNCS,,,129-137,,,0,0,,,,,
1488,2-s2.0-85016637764,10.1137/1.9781611974775.2,,,The ordered and colored products in analytic combinatorics: Application to the quantitative study of synchronizations in concurrent processes,cp,Conference Paper,Bodini O.,,Laboratoire d'Informatique de Paris Nord,Paris,France,,,,,2017-01-01,2017,"14th Workshop on Analytic Algorithmics and Combinatorics 2017, ANALCO 2017",,21100804035,,Conference Proceeding,,,,16-30,,,6,1,repositoryam,Green,,,
1489,2-s2.0-85016226536,10.1090/mcom/3135,,,Rigorous uniform approximation of D-finite functions using Chebyshev expansions,ar,Article,Benoit A.,,,,,,,,,2017-01-01,2017,Mathematics of Computation,00255718,25092,,Journal,86,305,,1303-1341,,,8,0,repositoryam,Green,,,
1490,2-s2.0-85016096504,10.1007/978-3-319-47253-9_1,,,From field data to attitude formation,cp,Conference Paper,Brousmiche K.L.,,Laboratoire d'Informatique de Paris 6;Airbus Defence and Space,Paris;Ottobrunn,France;Germany,,,,,2017-01-01,2017,Advances in Intelligent Systems and Computing,21945357,5100152904,,Book Series,528,,,1-14,,,1,0,repositoryam,Green,,,
1491,2-s2.0-85014954867,10.1007/978-3-319-54669-8_1,,,Kernel discriminant analysis for information extraction in the presence of masking,cp,Conference Paper,Cagli E.,,Universite Grenoble Alpes;CEA Grenoble;Sorbonne Universite,Saint Martin d'Heres;Grenoble;Paris,France;France;France,,,,,2017-01-01,2017,Lecture Notes in Computer Science (including subseries Lecture Notes in Artificial Intelligence and Lecture Notes in Bioinformatics),03029743,25674,16113349,Book Series,10146 LNCS,,,1-22,,,9,0,,,,,
1492,2-s2.0-85012095877,10.1007/978-3-319-51052-1_9,,,Information quality and uncertainty,ar,Article,Lesot M.J.,,Sorbonne Universite,Paris,France,,,,,2017-01-01,2017,Studies in Computational Intelligence,1860949X,4900152708,,Book Series,683,,,135-146,,,3,0,repositoryam,Green,,,
1493,2-s2.0-85012041060,10.1007/978-3-319-51052-1_4,,,"Uncertainty management: Probability, possibility, entropy, and other paradigms",ar,Article,Bouchon-Meunier B.,,Laboratoire d'Informatique de Paris 6,Paris,France,,,,,2017-01-01,2017,Studies in Computational Intelligence,1860949X,4900152708,,Book Series,683,,,53-60,,,1,0,,,,,
1494,2-s2.0-85011961690,10.1007/s12369-016-0357-8,,,Towards Engagement Models that Consider Individual Factors in HRI: On the Relation of Extroversion and Negative Attitude Towards Robots to Gaze and Speech During a Human–Robot Assembly Task: Experiments with the iCub humanoid,ar,Article,Ivaldi S.,,Université de Lorraine;INRIA Institut National de Recherche en Informatique et en Automatique;Technische Universität Darmstadt,Nancy;Le Chesnay;Darmstadt,France;France;Germany,,,,,2017-01-01,1 January 2017,International Journal of Social Robotics,18754791,19500157063,18754805,Journal,9,1,,63-86,,,52,0,repositoryam,Green,,,
1495,2-s2.0-85011957195,10.1007/s12369-016-0381-8,,,Interacting with Non-anthropomorphic Robotic Artworks and Interpreting Their Behaviour,ar,Article,Levillain F.,,Universite Paris 8 Vincennes-St Denis;LUTIN Living Lab - FvED 4246,Saint-Denis;Paris,France;France,,,,,2017-01-01,1 January 2017,International Journal of Social Robotics,18754791,19500157063,18754805,Journal,9,1,,141-161,,,5,0,,,,,
1496,2-s2.0-85011320522,10.1145/2996450,,,A nearly optimal algorithm for deciding connectivity queries in smooth and bounded real algebraic sets,ar,Article,Schost É.,,Sorbonne Universite,Paris,France,,,,,2017-01-01,January 2017,Journal of the ACM,00045411,23127,1557735X,Journal,63,6,48,,,,28,0,repositoryam,Green,,,
1497,2-s2.0-85010692163,10.1007/978-3-319-52234-0_5,,,Static analysis of communicating processes using symbolic transducers,cp,Conference Paper,Botbol V.,,Commissariat a L'Energie Atomique CEA;Sorbonne Universite,Gif-sur-Yvette;Paris,France;France,,,,,2017-01-01,2017,Lecture Notes in Computer Science (including subseries Lecture Notes in Artificial Intelligence and Lecture Notes in Bioinformatics),03029743,25674,16113349,Book Series,10145 LNCS,,,73-90,,,5,0,repositoryam,Green,,,
1498,2-s2.0-85010641684,10.1007/978-3-319-52234-0_21,,,Precise thread-modular abstract interpretation of concurrent programs using relational interference abstractions,cp,Conference Paper,Monat R.,,École Normale Supérieure de Lyon;École Normale Supérieure,Lyon;Paris,France;France,,,,,2017-01-01,2017,Lecture Notes in Computer Science (including subseries Lecture Notes in Artificial Intelligence and Lecture Notes in Bioinformatics),03029743,25674,16113349,Book Series,10145 LNCS,,,386-404,,,9,0,repositoryam,Green,,,
1499,2-s2.0-85010070514,10.1007/978-3-319-50340-0_28,,,FORGE enabling FIRE facilities for the elearning community,cp,Conference Paper,Fourmaux O.,,Sorbonne Universite,Paris,France,,,,,2017-01-01,2017,Advances in Intelligent Systems and Computing,21945357,5100152904,,Book Series,545,,,321-327,,,0,0,repositoryam,Green,,,
