,eid,doi,pii,pubmed_id,title,subtype,subtypeDescription,creator,afid,affilname,affiliation_city,affiliation_country,author_count,author_names,author_ids,author_afids,coverDate,coverDisplayDate,publicationName,issn,source_id,eIssn,aggregationType,volume,issueIdentifier,article_number,pageRange,description,authkeywords,citedby_count,openaccess,freetoread,freetoreadLabel,fund_acr,fund_no,fund_sponsor
0,2-s2.0-85102948646,10.1109/IEDM13553.2020.9372026,,,High-voltage micro-plasma switch for efficient power management of triboelectric kinetic energy harvesters,cp,Conference Paper,Basset P.,,Université Gustave Eiffel,Marne-la-Vallee,France,,,,,2020-12-12,12 December 2020,"Technical Digest - International Electron Devices Meeting, IEDM",01631918,26142,,Conference Proceeding,2020-December,,9372026,37.4.1-37.4.4,,,0,0,,,,,
1,2-s2.0-85099564171,10.1109/ASONAM49781.2020.9381334,,,Testing the Impact of Semantics and Structure on Recommendation Accuracy and Diversity,cp,Conference Paper,Morales P.R.,,Médialab Sciences Po,Paris,France,,,,,2020-12-07,7 December 2020,"Proceedings of the 2020 IEEE/ACM International Conference on Advances in Social Networks Analysis and Mining, ASONAM 2020",,21101041880,,Conference Proceeding,,,9381334,250-257,,,1,0,repositoryam,Green,,,
2,2-s2.0-85114403483,10.1109/WIIAT50758.2020.00052,,,Agent-based ordinal classification for group decision making,cp,Conference Paper,Nefla O.,,Université Paris-Dauphine,Paris,France,,,,,2020-12-01,December 2020,"Proceedings - 2020 IEEE/WIC/ACM International Joint Conference on Web Intelligence and Intelligent Agent Technology, WI-IAT 2020",,21101058341,,Conference Proceeding,,,9457691,365-370,,,0,0,repositoryam,Green,,,
3,2-s2.0-85114397602,10.1109/WIIAT50758.2020.00017,,,A game theoretical approach to self-assembly in swarm robotics,cp,Conference Paper,Iwase T.,,Toyota Motor Europe NV/SA,Zaventem,Belgium,,,,,2020-12-01,December 2020,"Proceedings - 2020 IEEE/WIC/ACM International Joint Conference on Web Intelligence and Intelligent Agent Technology, WI-IAT 2020",,21101058341,,Conference Proceeding,,,9457789,90-97,,,0,0,,,,,
4,2-s2.0-85100683705,10.1007/s11134-021-09690-2,,,"Editorial introduction to the special issue on stochastic matching models, matching queues and applications",ed,Editorial,Mairesse J.,,Sorbonne Universite,Paris,France,,,,,2020-12-01,December 2020,Queueing Systems,02570130,19124,15729443,Journal,96,3-4,,357-358,,,0,1,publisherfree2read,Bronze,,,
5,2-s2.0-85099887184,10.1109/PRDC50213.2020.00011,,,Topology Aware Leader Election Algorithm for Dynamic Networks,cp,Conference Paper,Favier A.,,Sorbonne Universite,Paris,France,,,,,2020-12-01,December 2020,"Proceedings of IEEE Pacific Rim International Symposium on Dependable Computing, PRDC",15410110,21100198514,,Conference Proceeding,2020-December,,9320365,1-10,,,2,0,repositoryam,Green,,,
6,2-s2.0-85099702337,10.1109/SSCI47803.2020.9308510,,,Per-Instance Configuration of the Modularized CMA-ES by Means of Classifier Chains and Exploratory Landscape Analysis,cp,Conference Paper,Prager R.P.,,Westfälische Wilhelms-Universität Münster,Munster,Germany,,,,,2020-12-01,1 December 2020,"2020 IEEE Symposium Series on Computational Intelligence, SSCI 2020",,21101034124,,Conference Proceeding,,,9308510,996-1003,,,1,0,,,,,
7,2-s2.0-85099701050,10.1109/SSCI47803.2020.9308180,,,Linear Matrix Factorization Embeddings for Single-objective Optimization Landscapes,cp,Conference Paper,Eftimov T.,,Jozef Stefan Institute,Ljubljana,Slovenia,,,,,2020-12-01,1 December 2020,"2020 IEEE Symposium Series on Computational Intelligence, SSCI 2020",,21101034124,,Conference Proceeding,,,9308180,775-782,,,4,0,repositoryam,Green,,,
8,2-s2.0-85099693739,10.1109/SSCI47803.2020.9308465,,,Exploring Dimensionality Reduction Techniques for Efficient Surrogate-Assisted optimization,cp,Conference Paper,Ullah S.,,Universiteit Leiden,Leiden,Netherlands,,,,,2020-12-01,1 December 2020,"2020 IEEE Symposium Series on Computational Intelligence, SSCI 2020",,21101034124,,Conference Proceeding,,,9308465,2965-2974,,,3,0,repositoryam,Green,,,
9,2-s2.0-85099682532,10.1109/SSCI47803.2020.9308394,,,Neural Network Design: Learning from Neural Architecture Search,cp,Conference Paper,Stein B.V.,,Universiteit Leiden,Leiden,Netherlands,,,,,2020-12-01,1 December 2020,"2020 IEEE Symposium Series on Computational Intelligence, SSCI 2020",,21101034124,,Conference Proceeding,,,9308394,1341-1349,,,0,0,repositoryam,Green,,,
10,2-s2.0-85099210365,10.1109/TBCAS.2020.3033095,,33382646,Erratum: A Low Power and Real-Time Architecture for Hough Transform Processing Integration in a Full HD-Wireless Capsule Endoscopy (IEEE Trans. Biomed. Circuits Syst. (2020) 14:4 (646–657) DOI: 10.1109/TBCAS.2020.3008458),er,Erratum,Chuquimia O.,,Sorbonne Universite,Paris,France,,,,,2020-12-01,December 2020,IEEE Transactions on Biomedical Circuits and Systems,19324545,5700191219,19409990,Journal,14,6,9311880,1442,,,0,1,publisherfree2read,Bronze,,,
11,2-s2.0-85097571505,10.1051/0004-6361/202038649,,,FRIPON: A worldwide network to track incoming meteoroids,ar,Article,Colas F.,,OSU Institut Pythéas;Pontificia Universidad Católica de Chile;Instituto de Estudios Espaciales de Cataluña;Universidad de La Rioja;L'Observatoire de Paris;Club Alpha Centauri;FRIPON;FRIPON (Fireball Recovery and InterPlanetary Observation);PRISMA (Prima Rete per la Sorveglianza sistematica di Meteore e Atmosfera);Planetarium and Astronomical Observatory of the Museum 'Vasile Pârvan' Bârlad,Marseille;Santiago;Barcelona;Logrono;Paris;;;;;,France;Chile;Spain;Spain;France;France;Austria;France;Italy;Romania,,,,,2020-12-01,1 December 2020,Astronomy and Astrophysics,00046361,26750,14320746,Journal,644,,A53,,,,20,1,repositoryam,Green,,,
12,2-s2.0-85092212424,10.1016/j.peva.2020.102134,S0166531620300547,,Optimal control of admission in service in a queue with impatience and setup costs,ar,Article,Hyon E.,,Université Paris Nanterre;Sorbonne Universite,Nanterre;Paris,France;France,,,,,2020-12-01,December 2020,Performance Evaluation,01665316,22313,,Journal,144,,102134,,,,2,1,repositoryam,Green,,,
13,2-s2.0-85089175596,10.1038/s41598-020-70125-8,,32770027,Development and validation of a 1-year survival prognosis estimation model for Amyotrophic Lateral Sclerosis using manifold learning algorithm UMAP,ar,Article,Grollemund V.,,Sorbonne Universite;FRS Consulting,Paris;Paris,France;France,,,,,2020-12-01,1 December 2020,Scientific Reports,,21100200805,20452322,Journal,10,1,13378,,,,16,1,repositoryvor,Green,,,
14,2-s2.0-85088919695,10.1016/j.patcog.2020.107557,S0031320320303605,,SEMEDA: Enhancing segmentation precision with semantic edge aware loss,ar,Article,Chen Y.,,Sorbonne Universite,Paris,France,,,,,2020-12-01,December 2020,Pattern Recognition,00313203,24823,,Journal,108,,107557,,,,9,1,repositoryam,Green,,,
15,2-s2.0-85088380467,10.1016/j.jss.2020.110748,S0164121220301722,,ReSIde: Reusable service identification from software families,ar,Article,Shatnawi A.,,"Laboratoire d'Informatique, de Robotique et de Microélectronique de Montpellie;Sorbonne Universite",Montpellier;Paris,France;France,,,,,2020-12-01,December 2020,Journal of Systems and Software,01641212,19309,,Journal,170,,110748,,,,3,1,repositoryam,Green,,,
16,2-s2.0-85088099001,10.1038/s41534-020-00288-9,,,The Born supremacy: quantum advantage and training of an Ising Born machine,ar,Article,Coyle B.,,The University of Edinburgh,Edinburgh,United Kingdom,,,,,2020-12-01,1 December 2020,npj Quantum Information,,21100827946,20566387,Journal,6,1,60,,,,25,1,repositoryam,Green,,,
17,2-s2.0-85087688099,10.1007/s00453-020-00742-2,,,An Adversarial Model for Scheduling with Testing,ar,Article,Dürr C.,,Sorbonne Universite,Paris,France,,,,,2020-12-01,1 December 2020,Algorithmica,01784617,23087,14320541,Journal,82,12,,3630-3675,,,9,0,repositoryam,Green,,,
18,2-s2.0-85086841851,10.1038/s41467-020-17019-5,,32591516,Employing a MEMS plasma switch for conditioning high-voltage kinetic energy harvesters,ar,Article,Zhang H.,,Université Gustave Eiffel;University of Cambridge,Marne-la-Vallee;Cambridge,France;United Kingdom,,,,,2020-12-01,1 December 2020,Nature Communications,,19700182758,20411723,Journal,11,1,3221,,,,23,1,repositoryam,Green,,,
19,2-s2.0-85086232215,10.1007/s41109-020-00266-2,,,Do you trade with your friends or become friends with your trading partners? A case study in the Ğ1 cryptocurrency,ar,Article,Gensollen N.,,Laboratoire d'Informatique de Paris 6,Paris,France,,,,,2020-12-01,1 December 2020,Applied Network Science,,21100901173,23648228,Journal,5,1,25,,,,1,1,publisherfullgold,Gold,,,
20,2-s2.0-85083347890,10.1007/s10703-019-00335-y,,,Parameterized verification of algorithms for oblivious robots on a ring,ar,Article,Sangnier A.,,Université Paris Cité,Paris,France,,,,,2020-12-01,December 2020,Formal Methods in System Design,09259856,12262,15728102,Journal,56,1-3,,55-89,,,1,0,repositoryam,Green,,,
21,2-s2.0-85078123891,10.1109/TCAD.2020.2966998,,,A g<inf>m</inf>/I<inf>D</inf>Methodology Based Data-Driven Search Algorithm for the Design of Multistage Multipath Feed-Forward-Compensated Amplifiers Targeting High Speed Continuous-Time ΣΔ-Modulators,ar,Article,Gebreyohannes F.T.,,Universite Paris-Saclay,Saint-Aubin,France,,,,,2020-12-01,December 2020,IEEE Transactions on Computer-Aided Design of Integrated Circuits and Systems,02780070,27724,19374151,Journal,39,12,8962331,4311-4324,,,4,0,repositoryam,Green,,,
22,2-s2.0-85067784999,10.1109/TC.2019.2924005,,,Tight Interval Inclusions with Compensated Algorithms,ar,Article,Graillat S.,,Sorbonne Universite,Paris,France,,,,,2020-12-01,1 December 2020,IEEE Transactions on Computers,00189340,25033,15579956,Journal,69,12,8742617,1774-1783,,,1,0,repositoryam,Green,,,
23,2-s2.0-85099496809,10.4000/educationdidactique.7793,,,Model proposal for understanding teacher's didactic decisions,ar,Article,Bonnat C.,,University of Fribourg,Fribourg,Switzerland,,,,,2020-11-27,27 November 2020,Education et Didactique,19563485,21100896480,21114838,Journal,14,3,,69-90,,,0,0,repositoryam,Green,,,
24,2-s2.0-85099727739,10.1109/NCA51143.2020.9306717,,,MemOpLight: Leveraging application feedback to improve container memory consolidation,cp,Conference Paper,Laniel F.,,INRIA Institut National de Recherche en Informatique et en Automatique;Sorbonne Universite,Le Chesnay;Paris,France;France,,,,,2020-11-24,24 November 2020,"2020 IEEE 19th International Symposium on Network Computing and Applications, NCA 2020",,21101080938,,Conference Proceeding,,,9306717,,,,1,0,repositoryam,Green,,,
25,2-s2.0-85099442567,10.1109/ICECS49266.2020.9294822,,,Synchronous conditioning circuits for piezo- And triboelectric harvesters in CMOS technologies,cp,Conference Paper,Lefeuvre E.,,Universite Paris-Saclay,Saint-Aubin,France,,,,,2020-11-23,23 November 2020,"ICECS 2020 - 27th IEEE International Conference on Electronics, Circuits and Systems, Proceedings",,21101033916,,Conference Proceeding,,,9294822,,,,0,0,repositoryam,Green,,,
26,2-s2.0-85098089268,10.1145/3427765.3428495,,,Programming microcontrollers through high-level abstractions,cp,Conference Paper,Varoumas S.,,Sorbonne Universite,Paris,France,,,,,2020-11-17,17 November 2020,"VMIL 2020 - Proceedings of the 12th ACM SIGPLAN International Workshop on Virtual Machines and Intermediate Languages, Co-located with SPLASH 2020",,21101032636,,Conference Proceeding,,,,5-14,,,1,0,,,,,
27,2-s2.0-85078337076,10.1016/j.fss.2020.01.004,S0165011420300154,,Computing real solutions of fuzzy polynomial systems,ar,Article,Aubry P.,,Sorbonne Universite,Paris,France,,,,,2020-11-15,15 November 2020,Fuzzy Sets and Systems,01650114,26529,,Journal,399,,,55-76,,,3,0,repositoryam,Green,,,
28,2-s2.0-85097613781,10.23919/CNSM50824.2020.9269099,,,Heuristic for edge-enabled network slicing optimization using the 'power of two choices',cp,Conference Paper,Alves Esteves J.J.,,Laboratoire d'Informatique de Paris 6;Orange Labs,Paris;Issy-les-Moulineaux,France;France,,,,,2020-11-02,2 November 2020,"16th International Conference on Network and Service Management, CNSM 2020, 2nd International Workshop on Analytics for Service and Application Management, AnServApp 2020 and 1st International Workshop on the Future Evolution of Internet Protocols, IPFuture 2020",,21101033176,,Conference Proceeding,,,9269099,,,,6,0,repositoryam,Green,,,
29,2-s2.0-85115269406,10.4230/LIPIcs.ECOOP.2020.17,,,Static type analysis by abstract interpretation of python programs,cp,Conference Paper,Monat R.,,Sorbonne Universite,Paris,France,,,,,2020-11-01,1 November 2020,"Leibniz International Proceedings in Informatics, LIPIcs",18688969,21100244929,,Conference Proceeding,166,,17,,,,2,0,,,,,
30,2-s2.0-85101541301,10.1109/ICDCS47774.2020.00060,,,Game theoretical analysis of cross-chain swaps,cp,Conference Paper,Belotti M.,,Conservatoire National des Arts et Metiers,Paris,France,,,,,2020-11-01,November 2020,Proceedings - International Conference on Distributed Computing Systems,,26104,,Conference Proceeding,2020-November,,9355687,485-495,,,5,0,repositoryam,Green,,,
31,2-s2.0-85101437088,10.1109/FG47880.2020.00038,,,Deep Entwined Learning Head Pose and Face Alignment Inside an Attentional Cascade with Doubly-Conditional fusion,cp,Conference Paper,Dapogny A.,,Datakalab,Paris,France,,,,,2020-11-01,November 2020,"Proceedings - 2020 15th IEEE International Conference on Automatic Face and Gesture Recognition, FG 2020",,21101038831,,Conference Proceeding,,,9320262,192-198,,,1,0,repositoryam,Green,,,
32,2-s2.0-85100349665,10.1109/FOCS46700.2020.00027,,,Qma-hardness of consistency of local density matrices with applications to quantum zero-knowledge,cp,Conference Paper,Broadbent A.,,University of Ottawa,Ottawa,Canada,,,,,2020-11-01,November 2020,"Proceedings - Annual IEEE Symposium on Foundations of Computer Science, FOCS",02725428,21100474207,,Conference Proceeding,2020-November,,9317977,196-205,,,4,0,repositoryam,Green,,,
33,2-s2.0-85096242228,10.1109/JIOT.2020.3004346,,,Comment on 'Efficient and Secure Outsourcing Scheme for RSA Decryption in Internet of Things',ar,Article,Vergnaud D.,,Institut Universitaire de France;Sorbonne Universite,Paris;Paris,France;France,,,,,2020-11-01,November 2020,IEEE Internet of Things Journal,,21100338350,23274662,Journal,7,11,9123379,11327-11329,,,2,0,repositoryam,Green,,,
34,2-s2.0-85096216133,10.1016/j.artmed.2020.101980,S0933365720312458,33250150,A stochastic multi-agent approach for medical-image segmentation: Application to tumor segmentation in brain MR images,ar,Article,Bennai M.T.,,Université de Boumerdes,Boumerdes,Algeria,,,,,2020-11-01,November 2020,Artificial Intelligence in Medicine,09333657,24140,18732860,Journal,110,,101980,,,,6,0,,,,,
35,2-s2.0-85094664744,10.1109/TIT.2020.3005706,,,Improving the Linear Programming Technique in the Search for Lower Bounds in Secret Sharing,ar,Article,Farràs O.,,Universitat Rovira i Virgili,Tarragona,Spain,,,,,2020-11-01,November 2020,IEEE Transactions on Information Theory,00189448,15107,15579654,Journal,66,11,9127978,7088-7100,,,2,0,repositoryam,Green,,,
36,2-s2.0-85091378349,10.1007/s00285-020-01540-8,,32968839,"Cooperativity, absolute interaction, and algebraic optimization",ar,Article,Kaihnsa N.,,Brown University,Providence,United States,,,,,2020-11-01,1 November 2020,Journal of Mathematical Biology,03036812,29610,14321416,Journal,81,4-5,,1169-1191,,,0,1,repositoryam,Green,,,
37,2-s2.0-85090312254,10.1007/s10878-020-00641-w,,,Online maximum matching with recourse,ar,Article,Angelopoulos S.,,Sorbonne Universite,Paris,France,,,,,2020-11-01,1 November 2020,Journal of Combinatorial Optimization,13826905,28499,15732886,Journal,40,4,,974-1007,,,1,0,repositoryam,Green,,,
38,2-s2.0-85089291802,10.1109/TCAD.2020.3012237,,,Maskara: Compilation of a Masking Countermeasure with Optimized Polynomial Interpolation,ar,Article,Belleville N.,,CEA Grenoble,Grenoble,France,,,,,2020-11-01,November 2020,IEEE Transactions on Computer-Aided Design of Integrated Circuits and Systems,02780070,27724,19374151,Journal,39,11,9153055,3774-3786,,,1,0,repositoryam,Green,,,
39,2-s2.0-85085766710,10.1007/s00453-020-00724-4,,,Deterministic Treasure Hunt in the Plane with Angular Hints,ar,Article,Bouchard S.,,Sorbonne Universite,Paris,France,,,,,2020-11-01,1 November 2020,Algorithmica,01784617,23087,14320541,Journal,82,11,,3250-3281,,,1,0,repositoryam,Green,,,
40,2-s2.0-85085732559,10.1016/j.measurement.2020.108031,S0263224120305698,,On the wavelet-based compressibility of continuous-time sampled ECG signal for e-health applications,ar,Article,Maalej A.,,"University of Carthage, Ecole Supérieure des Communications de Tunis",Ariana,Tunisia,,,,,2020-11-01,November 2020,Measurement: Journal of the International Measurement Confederation,02632241,15424,,Journal,164,,108031,,,,7,1,repositoryvor,Green,,,
41,2-s2.0-85071993975,10.1016/j.jsc.2019.09.001,S0747717119300963,,In-depth comparison of the Berlekamp–Massey–Sakata and the Scalar-FGLM algorithms: The adaptive variants,ar,Article,Berthomieu J.,,Sorbonne Universite,Paris,France,,,,,2020-11-01,November - December 2020,Journal of Symbolic Computation,07477171,28503,,Journal,101,,,270-303,,,2,1,repositoryam,Green,,,
42,2-s2.0-85068251052,10.1016/j.jsc.2019.07.001,S0747717119300641,,Separation bounds for polynomial systems,ar,Article,Emiris I.,,Ethnikó ke Kapodistriakó Panepistímio Athinón;Athena Research and Innovation Center,Athens;Athens,Greece;Greece,,,,,2020-11-01,November - December 2020,Journal of Symbolic Computation,07477171,28503,,Journal,101,,,128-151,,,4,0,repositoryam,Green,,,
43,2-s2.0-85068240332,10.1016/j.jsc.2019.06.004,S0747717119300574,,The complexity of subdivision for diameter-distance tests,ar,Article,Burr M.,,Clemson University,Clemson,United States,,,,,2020-11-01,November - December 2020,Journal of Symbolic Computation,07477171,28503,,Journal,101,,,1-27,,,2,1,repositoryam,Green,,,
44,2-s2.0-85087339211,10.1016/j.comnet.2020.107391,S1389128620300761,,Detection of zero-day attacks: An unsupervised port-based approach,ar,Article,Blaise A.,,Thales Group;Sorbonne Universite,Puteaux;Paris,France;France,,,,,2020-10-24,24 October 2020,Computer Networks,13891286,26811,,Journal,180,,107391,,,,12,1,repositoryam,Green,,,
45,2-s2.0-85097806798,10.1145/3382025.3414947,,,REVE 2020: 8th International Workshop on Reverse Variability Engineering,cp,Conference Paper,Assunção W.K.G.,,Federal University Technology of Paraná,Toledo,Brazil,,,,,2020-10-19,19 October 2020,ACM International Conference Proceeding Series,,11600154611,,Conference Proceeding,Part F164267-A,,,65-76,,,0,0,,,,,
46,2-s2.0-85084072968,10.1016/j.ejor.2020.04.003,S0377221720303210,,Competitive search in a network,ar,Article,Angelopoulos S.,,Sorbonne Universite,Paris,France,,,,,2020-10-16,16 October 2020,European Journal of Operational Research,03772217,22489,,Journal,286,2,,781-790,,,1,1,repositoryam,Green,,,
47,2-s2.0-85097628239,10.1109/NoF50125.2020.9249208,,,Edge-enabled Optimized Network Slicing in Large Scale Networks,cp,Conference Paper,Esteves J.J.A.,,Orange Labs,Issy-les-Moulineaux,France,,,,,2020-10-12,12 October 2020,"Proceedings of the 11th International Conference on Network of the Future, NoF 2020",,21101030396,,Conference Proceeding,,,9249208,129-131,,,4,0,repositoryam,Green,,,
48,2-s2.0-85093360350,10.1103/PhysRevA.102.042401,,,Authenticated teleportation and verification in a noisy network,ar,Article,Unnikrishnan A.,,University of Oxford,Oxford,United Kingdom,,,,,2020-10-07,7 October 2020,Physical Review A,24699926,21100874237,24699934,Journal,102,4,042401,,,,1,0,repositoryam,Green,,,
49,2-s2.0-85093825850,10.3390/s20205899,,33086559,A cmos-mems beol 2-axis lorentz-force magnetometer with device-level offset cancellation,ar,Article,Sánchez-Chiva J.M.,,Universitat Politècnica de Catalunya;Sorbonne Universite,Barcelona;Paris,Spain;France,,,,,2020-10-02,2 October 2020,Sensors (Switzerland),14248220,130124,,Journal,20,20,5899,1-21,,,1,1,repositoryvor,Green,,,
50,2-s2.0-85109516963,10.4230/LIPIcs.DISC.2020.49,,,Brief announcement: Game theoretical framework for analyzing blockchains robustness,cp,Conference Paper,Zappalà P.,,Conservatoire National des Arts et Metiers,Paris,France,,,,,2020-10-01,1 October 2020,"Leibniz International Proceedings in Informatics, LIPIcs",18688969,21100244929,,Conference Proceeding,179,,,,,,0,0,,,,,
51,2-s2.0-85098672934,10.1109/ICIP40778.2020.9191360,,,Coarse-to-Fine Aggregation for Cross-Granularity Action Recognition,cp,Conference Paper,Mazari A.,,Sorbonne Universite,Paris,France,,,,,2020-10-01,October 2020,"Proceedings - International Conference on Image Processing, ICIP",15224880,144684,,Conference Proceeding,2020-October,,9191360,1541-1545,,,0,0,repositoryam,Green,,,
52,2-s2.0-85098648928,10.1109/ICIP40778.2020.9191156,,,End-to-End Deep Kernel Map Design for Image Annotation,cp,Conference Paper,Jiu M.,,Zhengzhou University,Zhengzhou,China,,,,,2020-10-01,October 2020,"Proceedings - International Conference on Image Processing, ICIP",15224880,144684,,Conference Proceeding,2020-October,,9191156,1546-1550,,,1,0,repositoryam,Green,,,
53,2-s2.0-85091435661,10.1088/2058-9565/ab987c,,,Erratum: Randomized benchmarking in the analogue setting (Quantum Sci. Technol. (2020) 5 (034001) (DOI: 10.1088/2058-9565/ab7eec),er,Erratum,Derbyshire E.,,The University of Edinburgh,Edinburgh,United Kingdom,,,,,2020-10-01,October 2020,Quantum Science and Technology,,21100862881,20589565,Journal,5,4,049601,,,,0,1,repositoryam,Green,,,
54,2-s2.0-85086802506,10.1016/j.jpdc.2020.05.019,S0743731520302987,,Compact self-stabilizing leader election for general networks,ar,Article,Blin L.,,Sorbonne Universite,Paris,France,,,,,2020-10-01,October 2020,Journal of Parallel and Distributed Computing,07437315,25621,,Journal,144,,,278-294,,,1,0,,,,,
55,2-s2.0-85086699581,10.1007/s10458-020-09453-y,,,Agent programming in the cognitive era,ar,Article,Bordini R.H.,,Pontifícia Universidade Católica do Rio Grande do Sul,Porto Alegre,Brazil,,,,,2020-10-01,1 October 2020,Autonomous Agents and Multi-Agent Systems,13872532,24157,15737454,Journal,34,2,37,,,,16,1,repositoryvor,Green,,,
56,2-s2.0-85070315294,10.1007/s00446-019-00359-x,,,Self-stabilizing gathering of mobile robots under crash or Byzantine faults,ar,Article,Défago X.,,Tokyo Institute of Technology,Tokyo,Japan,,,,,2020-10-01,1 October 2020,Distributed Computing,01782770,24907,14320452,Journal,33,5,,393-421,,,4,0,,,,,
57,2-s2.0-85098592685,10.1109/RadarConf2043947.2020.9266689,,,Deep Learning and Information Geometry for Drone Micro-Doppler Radar Classification,cp,Conference Paper,Brooks D.,,Sorbonne Universite;Thales Land and Air Systems,Paris;Limours,France;France,,,,,2020-09-21,21 September 2020,IEEE National Radar Conference - Proceedings,10975659,110583,,Conference Proceeding,2020-September,,9266689,,,,1,0,,,,,
58,2-s2.0-85098585352,10.1109/RadarConf2043947.2020.9266371,,,Machine and Deep Learning for Drone Radar Recognition by Micro-Doppler and Kinematic criteria,cp,Conference Paper,Barbaresco F.,,Thales Land and Air Systems,Limours,France,,,,,2020-09-21,21 September 2020,IEEE National Radar Conference - Proceedings,10975659,110583,,Conference Proceeding,2020-September,,9266371,,,,1,0,,,,,
59,2-s2.0-85092660189,10.4204/EPTCS.326.3,,,Synthesis in presence of dynamic links,cp,Conference Paper,Bérard B.,,Sorbonne Universite,Paris,France,,,,,2020-09-20,20 September 2020,"Electronic Proceedings in Theoretical Computer Science, EPTCS",20752180,21100244944,,Conference Proceeding,326,,,33-49,,,1,1,repositoryam,Green,,,
60,2-s2.0-85115903243,10.1103/PhysRevResearch.2.033444,,,Fault-tolerant quantum speedup from constant depth quantum circuits,ar,Article,Mezher R.,,Université Libanaise;The University of Edinburgh;Sorbonne Universite,Beirut;Edinburgh;Paris,Lebanon;United Kingdom;France,,,,,2020-09-18,September 2020,Physical Review Research,26431564,21101060181,,Journal,2,3,033444,,,,0,1,repositoryam,Green,,,
61,2-s2.0-85096149580,10.1109/FDL50818.2020.9232947,,,Virtual Prototyping of Open Source Heterogeneous Systems with an Open Source Framework Featuring SystemC MDVP Extensions,cp,Conference Paper,Pecheux F.,,Sorbonne Universite,Paris,France,,,,,2020-09-15,15 September 2020,Forum on Specification and Design Languages,16369874,20600195637,,Conference Proceeding,2020-September,,9232947,,,,0,0,,,,,
62,2-s2.0-85102897282,10.1145/3457341.3457348,,,Towards fast one-block quantifier elimination through generalised critical values,ar,Article,Berthomieu J.,,Sorbonne Universite,Paris,France,,,,,2020-09-01,September 2020,ACM Communications in Computer Algebra,19322232,21100198457,19322240,Journal,54,3,,109-113,,,0,0,repositoryam,Green,,,
63,2-s2.0-85098174184,10.3390/a13090211,,,Finding top-k nodes for temporal closeness in large temporal graphs,ar,Article,Crescenzi P.,,Université Paris Cité,Paris,France,,,,,2020-09-01,September 2020,Algorithms,,21100199795,19994893,Journal,13,9,211,,,,3,1,publisherfullgold,Gold,,,
64,2-s2.0-85097798654,10.1109/SRDS51746.2020.00019,,,Using Model Checking to Formally Verify Rendezvous Algorithms for Robots with Lights in Euclidean Space,cp,Conference Paper,Defago X.,,Tokyo Institute of Technology,Tokyo,Japan,,,,,2020-09-01,September 2020,Proceedings of the IEEE Symposium on Reliable Distributed Systems,10609857,12906,,Conference Proceeding,2020-September,,9252060,113-122,,,3,0,repositoryam,Green,,,
65,2-s2.0-85096721677,10.1109/ICSME46990.2020.00054,,,Expanding the Number of Reviewers in Open-Source Projects by Recommending Appropriate Developers,cp,Conference Paper,Chueshev A.,,Sorbonne Universite,Paris,France,,,,,2020-09-01,September 2020,"Proceedings - 2020 IEEE International Conference on Software Maintenance and Evolution, ICSME 2020",,21101028405,,Conference Proceeding,,,9240650,499-510,,,2,0,repositoryam,Green,,,
