,eid,doi,pii,pubmed_id,title,subtype,subtypeDescription,creator,afid,affilname,affiliation_city,affiliation_country,author_count,author_names,author_ids,author_afids,coverDate,coverDisplayDate,publicationName,issn,source_id,eIssn,aggregationType,volume,issueIdentifier,article_number,pageRange,description,authkeywords,citedby_count,openaccess,freetoread,freetoreadLabel,fund_acr,fund_no,fund_sponsor
961,2-s2.0-85059830696,10.1145/3178291.3178296,,,All paths lead to Rome: Polymorphic runtime code generation for embedded systems,cp,Conference Paper,Couroussé D.,,CEA Grenoble,Grenoble,France,,,,,2018-01-24,24 January 2018,ACM International Conference Proceeding Series,,11600154611,,Conference Proceeding,,,,17-18,,,1,0,,,,,
962,2-s2.0-85050458577,10.1109/GLOCOMW.2017.8269046,,,Adaptive Energy Threshold for Improved Co-Existence between Licensed Assisted Access and Wi-Fi,cp,Conference Paper,Lopez-Perez D.,,Nokia Bell Labs,Murray,United States,,,,,2018-01-24,24 January 2018,"2017 IEEE Globecom Workshops, GC Wkshps 2017 - Proceedings",,21100869804,,Conference Proceeding,2018-January,,,1-6,,,1,0,,,,,
963,2-s2.0-85029602185,10.1016/j.tcs.2017.08.020,S0304397517306291,,Optimal self-stabilizing synchronous mobile Byzantine-tolerant atomic register,ar,Article,Bonomi S.,,Sapienza Università di Roma,Rome,Italy,,,,,2018-01-24,24 January 2018,Theoretical Computer Science,03043975,20571,,Journal,709,,,64-79,,,2,1,publisherfree2read,Bronze,,,
964,2-s2.0-85032806231,10.1080/00207543.2017.1394597,,,Robust and stochastic multistage optimisation under Markovian uncertainty with applications to production/inventory problems,ar,Article,Minoux M.,,Laboratoire d'Informatique de Paris 6,Paris,France,,,,,2018-01-17,17 January 2018,International Journal of Production Research,00207543,27656,1366588X,Journal,56,1-2,,565-583,,,5,0,,,,,
965,2-s2.0-85021771464,10.1016/j.ejor.2017.06.045,S0377221717305866,,A compact optimization model for the tail assignment problem,ar,Article,Khaled O.,,Compagnie IBM France;Universite Paris-Saclay,Bois-Colombes;Saint-Aubin,France;France,,,,,2018-01-16,16 January 2018,European Journal of Operational Research,03772217,22489,,Journal,264,2,,548-557,,,14,0,,,,,
966,2-s2.0-85127960581,,,,Prescriptive Analytics for MEC Orchestration,cp,Conference Paper,Ceselli A.,,Università degli Studi di Milano,Milan,Italy,,,,,2018-01-01,2018,"17th International IFIP TC6 Networking Conference, Networking 2018",,21101083906,,Conference Proceeding,,,,316-324,,,0,0,,,,,
967,2-s2.0-85093819479,,,,Verification of quantum computation: An overview of existing approaches,cp,Conference Paper,Gheorghiu A.,,The University of Edinburgh,Edinburgh,United Kingdom,,,,,2018-01-01,2018,Proceedings - 23rd Seminaire Poincare: L'Information,,21101023710,,Conference Proceeding,,,,103-191,,,0,0,,,,,
968,2-s2.0-85093259312,,,,A Reinforcement Learning-driven Translation Model for Search-Oriented Conversational Systems,cp,Conference Paper,Aissa W.,,Sorbonne Universite,Paris,France,,,,,2018-01-01,2018,Proceedings of the 2018 EMNLP Workshop SCAI 2018: The 2nd International Workshop on Search-Oriented Conversational AI,,21101071242,,Conference Proceeding,,,,33-39,,,1,0,,,,,
969,2-s2.0-85086388620,10.1137/17M1142570,,,A Lower Bound on the Positive Semidefinite Rank of Convex Bodies,ar,Article,Fawzi H.,,Faculty of Mathematics,Cambridge,United Kingdom,,,,,2018-01-01,2018,SIAM Journal on Applied Algebra and Geometry,,21101018930,24706566,Journal,2,1,,126-139,,,5,1,repositoryam,Green,,,
970,2-s2.0-85086142761,,,,Gradual semantics accounting for similarity between arguments,cp,Conference Paper,Amgoud L.,,CNRS Centre National de la Recherche Scientifique,Paris,France,,,,,2018-01-01,2018,"Principles of Knowledge Representation and Reasoning: Proceedings of the 16th International Conference, KR 2018",,21101017684,,Conference Proceeding,,,,88-97,,,6,0,,,,,
971,2-s2.0-85083954003,,,,Multi-view data generation without view supervision,cp,Conference Paper,Chen M.,,Sorbonne Universite,Paris,France,,,,,2018-01-01,2018,"6th International Conference on Learning Representations, ICLR 2018 - Conference Track Proceedings",,21100925602,,Conference Proceeding,,,,,,,8,0,,,,,
972,2-s2.0-85083953604,,,,Deep learning for physical processes: Incorporating prior scientific knowledge,cp,Conference Paper,De Bézenac E.,,Sorbonne Universite,Paris,France,,,,,2018-01-01,2018,"6th International Conference on Learning Representations, ICLR 2018 - Conference Track Proceedings",,21100925602,,Conference Proceeding,,,,,,,21,0,,,,,
973,2-s2.0-85083951495,,,,Word translation without parallel data,cp,Conference Paper,Lample G.,,Facebook Research,Menlo Park,United States,,,,,2018-01-01,2018,"6th International Conference on Learning Representations, ICLR 2018 - Conference Track Proceedings",,21100925602,,Conference Proceeding,,,,,,,352,0,,,,,
974,2-s2.0-85083950395,,,,Unsupervised machine translation using monolingual corpora only,cp,Conference Paper,Lample G.,,Facebook Research;Sorbonne Universite,Menlo Park;Paris,United States;France,,,,,2018-01-01,2018,"6th International Conference on Learning Representations, ICLR 2018 - Conference Track Proceedings",,21100925602,,Conference Proceeding,,,,,,,281,0,,,,,
975,2-s2.0-85081724184,,,,Phrase-based &amp; neural unsupervised machine translation,cp,Conference Paper,Lample G.,,Sorbonne Universite,Paris,France,,,,,2018-01-01,2018,"Proceedings of the 2018 Conference on Empirical Methods in Natural Language Processing, EMNLP 2018",,21101082402,,Conference Proceeding,,,,5039-5049,,,212,0,,,,,
976,2-s2.0-85072862227,,,,Combining extension-based semantics and ranking-based semantics for abstract argumentation,cp,Conference Paper,Bonzon E.,,Université Paris Cité,Paris,France,,,,,2018-01-01,2018,"Principles of Knowledge Representation and Reasoning: Proceedings of the 16th International Conference, KR 2018",,21101017684,,Conference Proceeding,,,,118-127,,,7,0,,,,,
977,2-s2.0-85069433232,,,,Regularize and explicit collaborative filtering with textual attention,cp,Conference Paper,Dias C.E.,,Sorbonne Universite,Paris,France,,,,,2018-01-01,2018,"ESANN 2018 - Proceedings, European Symposium on Artificial Neural Networks, Computational Intelligence and Machine Learning",,21100920006,,Conference Proceeding,,,,261-266,,,0,0,,,,,
978,2-s2.0-85067417134,10.3917/rfs.593.0507,,,Mining political opinion on Twitter: Challenges and opportunities of multiscale approaches,ar,Article,Severo M.,,Université Paris Nanterre,Nanterre,France,,,,,2018-01-01,2018,Revue Francaise de Sociologie,00352969,17363,,Journal,59,3,,507-532,,,3,0,repositoryam,Green,,,
979,2-s2.0-85065537881,10.3166/DN.21.3.11-31,,,Détection de sources de diffusion par apprentissage de représentations distribuées,re,Review,Bourigault S.,,Sorbonne Universite,Paris,France,,,,,2018-01-01,2018,Document Numerique,12795127,17600155217,,Journal,21,3,,11-31,,,0,0,,,,,
980,2-s2.0-85064838084,,,,Clustering redemption-beyond the impossibility of Kleinberg's axioms,cp,Conference Paper,Cohen-Addad V.,,Sorbonne Universite,Paris,France,,,,,2018-01-01,2018,Advances in Neural Information Processing Systems,10495258,23669,,Conference Proceeding,2018-December,,,8517-8526,,,3,0,,,,,
981,2-s2.0-85064827464,,,,Revisiting multi-task learning with rock: A deep residual auxiliary block for visual detection,cp,Conference Paper,Mordan T.,,Sorbonne Universite;Thales Land and Air Systems,Paris;Elancourt,France;France,,,,,2018-01-01,2018,Advances in Neural Information Processing Systems,10495258,23669,,Conference Proceeding,2018-December,,,1310-1322,,,18,0,,,,,
982,2-s2.0-85064811584,10.7561/SACS.2018.2.161,,,Pattern matching in link streams: Timed-automata with finite memory,ar,Article,Bertrand C.,,"Informatique, BioInformatique, Systèmes Complexes",Evry,France,,,,,2018-01-01,2018,Scientific Annals of Computer Science,18438121,19600157312,22482695,Journal,28,2,,161-198,,,0,1,repositoryam,Green,,,
983,2-s2.0-85063873729,10.1007/978-3-319-91476-3_28,,,Entropy and monotonicity,cp,Conference Paper,Bouchon-Meunier B.,,Sorbonne Universite,Paris,France,,,,,2018-01-01,2018,Communications in Computer and Information Science,18650929,17700155007,,Book Series,854,,,332-343,,,2,0,,,,,
984,2-s2.0-85063096927,,,,Prover: An SMT-based approach for process verification,cp,Conference Paper,Baarir S.,,Laboratoire d'Informatique de Paris 6,Paris,France,,,,,2018-01-01,2018,CEUR Workshop Proceedings,16130073,21100218356,,Conference Proceeding,2245,,,555-562,,,1,0,,,,,
985,2-s2.0-85061312824,10.3166/RIA.32.479-518,,,Declarative modular framework for assessment of actions according to different ethical principles,ar,Article,Berreby F.,,Sorbonne Universite,Paris,France,,,,,2018-01-01,2018,Revue d'Intelligence Artificielle,0992499X,24847,,Journal,32,4,,479-518,,,0,0,repositoryam,Green,,,
986,2-s2.0-85060722146,10.1051/ro/2018031,,,Branch-and-cut-and-price algorithms for the preemptive RCPSP,ar,Article,Fouilhoux P.,,Sorbonne Universite,Paris,France,,,,,2018-01-01,2018,RAIRO - Operations Research,,12991,28047303,Journal,52,2,,513-528,,,1,1,repositoryvor,Green,,,
987,2-s2.0-85060526052,10.1137/18M1170133,,,Fast and rigorous arbitrary-precision computation of gauss-legendre quadrature nodes and weights,ar,Article,Johansson F.,,Université de Bordeaux,Bordeaux,France,,,,,2018-01-01,2018,SIAM Journal on Scientific Computing,10648275,26425,10957197,Journal,40,6,,C726-C747,,,5,0,repositoryam,Green,,,
988,2-s2.0-85060471172,,,,Learning multi-modal word representation grounded in visual context,cp,Conference Paper,Zablocki É.,,Laboratoire d'Informatique de Paris 6,Paris,France,,,,,2018-01-01,2018,"32nd AAAI Conference on Artificial Intelligence, AAAI 2018",,21100896173,,Conference Proceeding,,,,5626-5633,,,10,0,,,,,
989,2-s2.0-85060286225,,,,Proposing and evaluating a model of co-construction of the learning scenario by the learner,cp,Conference Paper,Mbatchou G.M.,,Sorbonne Universite;Université Assane Seck de Ziguinchor,Paris;Senegal,France;Senegal,,,,,2018-01-01,2018,"Proceedings of the 15th International Conference on Cognition and Exploratory Learning in the Digital Age, CELDA 2018",,21100895616,,Conference Proceeding,,,,208-215,,,1,0,,,,,
990,2-s2.0-85059692662,10.1007/978-3-030-05153-2_4,,,Fast computation of isomorphisms between finite fields using elliptic curves,cp,Conference Paper,Narayanan A.K.,,Sorbonne Universite,Paris,France,,,,,2018-01-01,2018,Lecture Notes in Computer Science (including subseries Lecture Notes in Artificial Intelligence and Lecture Notes in Bioinformatics),03029743,25674,16113349,Book Series,11321 LNCS,,,74-91,,,2,0,repositoryam,Green,,,
991,2-s2.0-85058959706,,,,Analysis of peer interaction features in multi-player learning game: Semi-automatic approach and proof of concept,cp,Conference Paper,Guinebert M.,,Sorbonne Universite,Paris,France,,,,,2018-01-01,2018,Proceedings of the European Conference on Games-based Learning,20490992,21100293202,,Conference Proceeding,2018-October,,,162-170,,,0,0,,,,,
992,2-s2.0-85057880270,10.1007/978-3-030-02768-1_6,,,Relational Thread-Modular Abstract Interpretation Under Relaxed Memory Models,cp,Conference Paper,Suzanne T.,,INRIA Institut National de Recherche en Informatique et en Automatique;Sorbonne Universite;École Normale Supérieure,Le Chesnay;Paris;Paris,France;France;France,,,,,2018-01-01,2018,Lecture Notes in Computer Science (including subseries Lecture Notes in Artificial Intelligence and Lecture Notes in Bioinformatics),03029743,25674,16113349,Book Series,11275 LNCS,,,109-128,,,2,0,repositoryam,Green,,,
993,2-s2.0-85057261264,10.1007/978-3-030-00898-7_25,,,The balanced dispatching problem in passengers transport services on demand,cp,Conference Paper,Araya-Córdova P.J.,,Universidad de Chile,Santiago,Chile,,,,,2018-01-01,2018,Lecture Notes in Computer Science (including subseries Lecture Notes in Artificial Intelligence and Lecture Notes in Bioinformatics),03029743,25674,16113349,Book Series,11184 LNCS,,,379-387,,,1,0,,,,,
994,2-s2.0-85057201447,10.1007/978-3-662-58381-4_9,,,MCC’2017 – The Seventh Model Checking Contest,ch,Book Chapter,Kordon F.,,Sorbonne Universite,Paris,France,,,,,2018-01-01,2018,Lecture Notes in Computer Science (including subseries Lecture Notes in Artificial Intelligence and Lecture Notes in Bioinformatics),03029743,25674,16113349,Book Series,11090 LNCS,,,181-209,,,7,0,repositoryam,Green,,,
995,2-s2.0-85057123413,10.1007/978-3-030-03014-8_11,,,Identifying goals of agents by learning from observations,cp,Conference Paper,Lorthioir G.,,Research Organization of Information and Systems National Institute of Informatics;The Graduate University for Advanced Studies,Tokyo;Hayama,Japan;Japan,,,,,2018-01-01,2018,Lecture Notes in Computer Science (including subseries Lecture Notes in Artificial Intelligence and Lecture Notes in Bioinformatics),03029743,25674,16113349,Book Series,11248 LNAI,,,125-138,,,0,0,,,,,
996,2-s2.0-85056874490,10.18293/SEKE2018-110,,,An architecture for the development of ambient intelligence systems managed by embedded agents,cp,Conference Paper,Pantoja C.E.,,Universidade Federal Fluminense,Niteroi,Brazil,,,,,2018-01-01,2018,"Proceedings of the International Conference on Software Engineering and Knowledge Engineering, SEKE",23259000,21100400011,23259086,Conference Proceeding,2018-July,,,215-220,,,7,1,publisherfree2read,Bronze,,,
997,2-s2.0-85056562541,,,,Parameterized power vertex cover,cp,Conference Paper,Angel E.,,"Informatique, BioInformatique, Systèmes Complexes",Evry,France,,,,,2018-01-01,2018,Discrete Mathematics and Theoretical Computer Science,14627264,78470,13658050,Journal,20,2,10,,,,5,0,,,,,
998,2-s2.0-85056485554,10.1007/978-3-030-03232-6_12,,,Reliable broadcast in dynamic networks with locally bounded byzantine failures,cp,Conference Paper,Bonomi S.,,Sapienza Università di Roma,Rome,Italy,,,,,2018-01-01,2018,Lecture Notes in Computer Science (including subseries Lecture Notes in Artificial Intelligence and Lecture Notes in Bioinformatics),03029743,25674,16113349,Book Series,11201 LNCS,,,170-185,,,6,0,repositoryam,Green,,,
999,2-s2.0-85056480558,10.1007/978-3-030-03232-6_28,,,Brief announcement: Optimal self-stabilizing mobile byzantine-tolerant regular register with bounded timestamps,cp,Conference Paper,Bonomi S.,,Sapienza Università di Roma,Rome,Italy,,,,,2018-01-01,2018,Lecture Notes in Computer Science (including subseries Lecture Notes in Artificial Intelligence and Lecture Notes in Bioinformatics),03029743,25674,16113349,Book Series,11201 LNCS,,,398-403,,,1,0,,,,,
1000,2-s2.0-85056477564,10.1007/978-3-030-03232-6_29,,,Brief announcement continuous vs. discrete asynchronous moves: A certified approach for mobile robots,cp,Conference Paper,Balabonski T.,,Laboratoire de Recherche en Informatique,Gif-sur-Yvette,France,,,,,2018-01-01,2018,Lecture Notes in Computer Science (including subseries Lecture Notes in Artificial Intelligence and Lecture Notes in Bioinformatics),03029743,25674,16113349,Book Series,11201 LNCS,,,404-408,,,3,0,,,,,
1001,2-s2.0-85056475697,10.1007/978-3-030-03098-8_55,,,Better collective learning with consistency guarantees,cp,Conference Paper,Veillon L.M.,,Université de Caen Normandie;University Sorbonne Paris Nord,Caen;Villetaneuse,France;France,,,,,2018-01-01,2018,Lecture Notes in Computer Science (including subseries Lecture Notes in Artificial Intelligence and Lecture Notes in Bioinformatics),03029743,25674,16113349,Book Series,11224 LNAI,,,671-679,,,0,0,,,,,
1002,2-s2.0-85056470052,10.1007/978-3-030-03232-6_20,,,Ring exploration with myopic luminous robots,cp,Conference Paper,Ooshita F.,,Nara Institute of Science and Technology,Ikoma,Japan,,,,,2018-01-01,2018,Lecture Notes in Computer Science (including subseries Lecture Notes in Artificial Intelligence and Lecture Notes in Bioinformatics),03029743,25674,16113349,Book Series,11201 LNCS,,,301-316,,,6,0,repositoryam,Green,,,
1003,2-s2.0-85056464414,10.1007/978-3-030-03232-6_22,,,Arbitrary pattern formation with four robots,cp,Conference Paper,Bramas Q.,,Université de Strasbourg,Strasbourg,France,,,,,2018-01-01,2018,Lecture Notes in Computer Science (including subseries Lecture Notes in Artificial Intelligence and Lecture Notes in Bioinformatics),03029743,25674,16113349,Book Series,11201 LNCS,,,333-348,,,8,0,,,,,
1004,2-s2.0-85056462028,10.1007/978-3-030-03098-8_47,,,Decentralized multi-agent patrolling strategies using global idleness estimation,cp,Conference Paper,Othmani-Guibourg M.,,ONERA Centre de Toulouse;Sorbonne Universite,Toulouse;Paris,France;France,,,,,2018-01-01,2018,Lecture Notes in Computer Science (including subseries Lecture Notes in Artificial Intelligence and Lecture Notes in Bioinformatics),03029743,25674,16113349,Book Series,11224 LNAI,,,603-611,,,0,0,repositoryam,Green,,,
1005,2-s2.0-85056459602,10.1007/978-3-030-03232-6_23,,,Gracefully degrading gathering in dynamic rings,cp,Conference Paper,Bournat M.,,Sorbonne Universite,Paris,France,,,,,2018-01-01,2018,Lecture Notes in Computer Science (including subseries Lecture Notes in Artificial Intelligence and Lecture Notes in Bioinformatics),03029743,25674,16113349,Book Series,11201 LNCS,,,349-364,,,3,0,repositoryam,Green,,,
1006,2-s2.0-85056188270,,,,Introduction,ed,Editorial,Delcroix V.,,LAMIH,Valenciennes,France,,,,,2018-01-01,2018,Revue d'Intelligence Artificielle,0992499X,24847,,Journal,32,1,,7-8,,,0,0,,,,,
1007,2-s2.0-85056157208,10.3166/RIA.32.75-109,,,Learning and selection of dynamic Bayesian networks for online non-stationary process,ar,Article,Hourbracq M.,,Sorbonne Universite;Akheros S.A.S.,Paris;,France;France,,,,,2018-01-01,2018,Revue d'Intelligence Artificielle,0992499X,24847,,Journal,32,1,,75-109,,,1,0,repositoryam,Green,,,
1008,2-s2.0-85056148104,10.3166/RIA.32.111-132,,,Incremental inference for probabilistic relational models and application to object-oriented rule-based systems,ar,Article,Agli H.,,Compagnie IBM France,Bois-Colombes,France,,,,,2018-01-01,2018,Revue d'Intelligence Artificielle,0992499X,24847,,Journal,32,1,,111-132,,,2,0,,,,,
1009,2-s2.0-85055797608,10.1007/978-3-030-02610-3_29,,,On Cancellation of Transactions in Bitcoin-Like Blockchains,cp,Conference Paper,Gürcan Ö.,,"CEA, Institut LIST",Palaiseau,France,,,,,2018-01-01,2018,Lecture Notes in Computer Science (including subseries Lecture Notes in Artificial Intelligence and Lecture Notes in Bioinformatics),03029743,25674,16113349,Book Series,11229 LNCS,,,516-533,,,5,0,repositoryam,Green,,,
1010,2-s2.0-85055770901,10.1007/978-3-030-01771-2_27,,,Identifying Control Parameters in Cheese Fabrication Process Using Precedence Constraints,cp,Conference Paper,Munch M.,,Universite Paris-Saclay,Saint-Aubin,France,,,,,2018-01-01,2018,Lecture Notes in Computer Science (including subseries Lecture Notes in Artificial Intelligence and Lecture Notes in Bioinformatics),03029743,25674,16113349,Book Series,11198 LNAI,,,421-434,,,1,0,repositoryam,Green,,,
1011,2-s2.0-85055722838,10.1109/ACCESS.2018.2877890,,,Benchmark analysis of representative deep neural network architectures,ar,Article,Bianco S.,,Università degli Studi di Milano-Bicocca,Milan,Italy,,,,,2018-01-01,2018,IEEE Access,,21100374601,21693536,Journal,6,,8506339,64270-64277,,,300,1,repositoryam,Green,,,
1012,2-s2.0-85055715148,10.24963/ijcai.2018/646,,,Scheduling under uncertainty: A Query-based Approach,cp,Conference Paper,Arantes L.,,Sorbonne Universite,Paris,France,,,,,2018-01-01,2018,IJCAI International Joint Conference on Artificial Intelligence,10450823,19400157504,,Conference Proceeding,2018-July,,,4646-4652,,,6,1,repositoryam,Green,,,
1013,2-s2.0-85055695195,10.24963/ijcai.2018/10,,,Accountable approval sorting,cp,Conference Paper,Belahcene K.,,Universite Paris-Saclay,Saint-Aubin,France,,,,,2018-01-01,2018,IJCAI International Joint Conference on Artificial Intelligence,10450823,19400157504,,Conference Proceeding,2018-July,,,70-76,,,2,1,repositoryam,Green,,,
1014,2-s2.0-85055694885,,,,Learning digital resources in Elementary School: A systematic review,ar,Article,do Nascimento F.S.K.B.,,Universidade Federal do Rio Grande do Norte,Natal,Brazil,,,,,2018-01-01,2018,Espacios,07981015,11200153556,,Journal,39,43,,,,,0,0,,,,,
1015,2-s2.0-85055518303,10.1007/978-3-030-01713-2_2,,,Multiagent resource allocation: The power and limitations of bilateral deals (Extended Abstract),cp,Conference Paper,Maudet N.,,Sorbonne Universite,Paris,France,,,,,2018-01-01,2018,Lecture Notes in Computer Science (including subseries Lecture Notes in Artificial Intelligence and Lecture Notes in Bioinformatics),03029743,25674,16113349,Book Series,10767 LNAI,,,22-25,,,0,0,,,,,
1016,2-s2.0-85055352730,,,,Event-based and scenario-based causality for computational ethics,cp,Conference Paper,Berreby F.,,Sorbonne Universite,Paris,France,,,,,2018-01-01,2018,"Proceedings of the International Joint Conference on Autonomous Agents and Multiagent Systems, AAMAS",15488403,21100310020,15582914,Conference Proceeding,1,,,147-155,,,5,0,,,,,
1017,2-s2.0-85055345194,,,,Local envy-freeness in house allocation problems,cp,Conference Paper,Beynier A.,,Sorbonne Universite,Paris,France,,,,,2018-01-01,2018,"Proceedings of the International Joint Conference on Autonomous Agents and Multiagent Systems, AAMAS",15488403,21100310020,15582914,Conference Proceeding,1,,,292-300,,,8,0,,,,,
1018,2-s2.0-85055103389,10.1007/978-3-030-01231-1_10,,,Image reassembly combining deep learning and shortest path problem,cp,Conference Paper,Paumard M.M.,,Equipes Traitement de l'Information et Systèmes,Cergy-Pontoise,France,,,,,2018-01-01,2018,Lecture Notes in Computer Science (including subseries Lecture Notes in Artificial Intelligence and Lecture Notes in Bioinformatics),03029743,25674,16113349,Book Series,11210 LNCS,,,155-169,,,2,0,repositoryam,Green,,,
1019,2-s2.0-85055087071,10.1007/978-3-030-01234-2_10,,,HybridNet: Classification and reconstruction cooperation for semi-supervised learning,cp,Conference Paper,Robert T.,,Sorbonne Universite,Paris,France,,,,,2018-01-01,2018,Lecture Notes in Computer Science (including subseries Lecture Notes in Artificial Intelligence and Lecture Notes in Bioinformatics),03029743,25674,16113349,Book Series,11211 LNCS,,,158-175,,,2,0,repositoryam,Green,,,
1020,2-s2.0-85054846629,10.1007/978-3-030-00461-3_11,,,"Discovering ordinal attributes through gradual patterns, morphological filters and rank discrimination measures",cp,Conference Paper,Marsala C.,,Sorbonne Universite,Paris,France,,,,,2018-01-01,2018,Lecture Notes in Computer Science (including subseries Lecture Notes in Artificial Intelligence and Lecture Notes in Bioinformatics),03029743,25674,16113349,Book Series,11142 LNAI,,,152-163,,,1,0,repositoryam,Green,,,
1021,2-s2.0-85054840826,10.1007/978-3-030-00461-3_21,,,Positional scoring rules with uncertain weights,cp,Conference Paper,Viappiani P.,,Sorbonne Universite,Paris,France,,,,,2018-01-01,2018,Lecture Notes in Computer Science (including subseries Lecture Notes in Artificial Intelligence and Lecture Notes in Bioinformatics),03029743,25674,16113349,Book Series,11142 LNAI,,,306-320,,,3,0,repositoryam,Green,,,
1022,2-s2.0-85054795917,10.1007/978-3-030-01090-4_22,,,Round-Bounded Control of Parameterized Systems,cp,Conference Paper,Bollig B.,,Universite Paris-Saclay,Saint-Aubin,France,,,,,2018-01-01,2018,Lecture Notes in Computer Science (including subseries Lecture Notes in Artificial Intelligence and Lecture Notes in Bioinformatics),03029743,25674,16113349,Book Series,11138 LNCS,,,370-386,,,0,0,repositoryam,Green,,,
1023,2-s2.0-85054757752,,,,Fairness in multiagent resource allocation with dynamic and partial observations,cp,Conference Paper,Beynier A.,,Sorbonne Universite,Paris,France,,,,,2018-01-01,2018,"Proceedings of the International Joint Conference on Autonomous Agents and Multiagent Systems, AAMAS",15488403,21100310020,15582914,Conference Proceeding,3,,,1868-1870,,,4,0,,,,,
1024,2-s2.0-85054680008,,,,Fair resource allocation over time,cp,Conference Paper,Bampis E.,,Sorbonne Universite,Paris,France,,,,,2018-01-01,2018,"Proceedings of the International Joint Conference on Autonomous Agents and Multiagent Systems, AAMAS",15488403,21100310020,15582914,Conference Proceeding,2,,,766-773,,,6,0,,,,,
1025,2-s2.0-85054342702,10.1007/978-3-319-73198-8_20,,,Discovering patterns of interest in ip traffic using cliques in bipartite link streams,cp,Conference Paper,Viard T.,,CNAM Laboratoire Cédric,Paris,France,,,,,2018-01-01,2018,Springer Proceedings in Complexity,22138684,21100873452,22138692,Conference Proceeding,,219279,,233-241,,,5,0,repositoryam,Green,,,
1026,2-s2.0-85053913213,10.3233/978-1-61499-906-5-249,,,Mediation of debates with dynamic argumentative behaviors,cp,Conference Paper,Hadoux E.,,University College London,London,United Kingdom,,,,,2018-01-01,2018,Frontiers in Artificial Intelligence and Applications,09226389,19500157321,,Book Series,305,,,249-256,,,0,0,,,,,
1027,2-s2.0-85053790079,,,,Improving probabilistic rules compilation using PRM,cp,Conference Paper,Ducamp G.,,Compagnie IBM France;Sorbonne Universite,Bois-Colombes;Paris,France;France,,,,,2018-01-01,2018,CEUR Workshop Proceedings,16130073,21100218356,,Conference Proceeding,2204,,,,,,0,0,,,,,
1028,2-s2.0-85053635493,10.1007/978-3-319-99253-2_5,,,Towards an adaptive CMA-ES configurator,cp,Conference Paper,van Rijn S.,,Universiteit Leiden,Leiden,Netherlands,,,,,2018-01-01,2018,Lecture Notes in Computer Science (including subseries Lecture Notes in Artificial Intelligence and Lecture Notes in Bioinformatics),03029743,25674,16113349,Book Series,11101 LNCS,,,54-65,,,7,0,,,,,
1029,2-s2.0-85053630279,10.1007/978-3-319-99725-4_16,,,Modular Static Analysis of String Manipulations in C Programs,cp,Conference Paper,Journault M.,,Sorbonne Universite,Paris,France,,,,,2018-01-01,2018,Lecture Notes in Computer Science (including subseries Lecture Notes in Artificial Intelligence and Lecture Notes in Bioinformatics),03029743,25674,16113349,Book Series,11002 LNCS,,,243-262,,,7,0,repositoryam,Green,,,
