,eid,doi,pii,pubmed_id,title,subtype,subtypeDescription,creator,afid,affilname,affiliation_city,affiliation_country,author_count,author_names,author_ids,author_afids,coverDate,coverDisplayDate,publicationName,issn,source_id,eIssn,aggregationType,volume,issueIdentifier,article_number,pageRange,description,authkeywords,citedby_count,openaccess,freetoread,freetoreadLabel,fund_acr,fund_no,fund_sponsor
0,2-s2.0-85099878726,10.1109/CDC42340.2020.9304305,,,A Nonsmooth Newton Method for the Design of State Feedback Stabilizers under Structure Constraints,cp,Conference Paper,Yagoubi M.,,Laboratoire des Sciences du Numérique de Nantes,Nantes,France,,,,,2020-12-14,14 December 2020,Proceedings of the IEEE Conference on Decision and Control,07431546,87424,25762370,Conference Proceeding,2020-December,,9304305,5992-5997,,,0,0,,,,,
1,2-s2.0-85099773567,10.1109/IEEM45057.2020.9309742,,,Diagnosis on energy and sustainability of reconfigurable manufacturing system (RMS) design: A bi-level decomposition approach,cp,Conference Paper,Khezri A.,,Arts et Metiers Institute of Technology,Paris,France,,,,,2020-12-14,14 December 2020,IEEE International Conference on Industrial Engineering and Engineering Management,21573611,21100197517,2157362X,Conference Proceeding,2020-December,,9309742,141-145,,,0,0,repositoryam,Green,,,
2,2-s2.0-85098374800,10.1109/CDC42340.2020.9304178,,,Forwarding design for stabilization of a coupled transport equation-ODE with a cone-bounded input nonlinearity,cp,Conference Paper,Marx S.,,Laboratoire des Sciences du Numérique de Nantes,Nantes,France,,,,,2020-12-14,14 December 2020,Proceedings of the IEEE Conference on Decision and Control,07431546,87424,25762370,Conference Proceeding,2020-December,,9304178,640-645,,,3,0,repositoryam,Green,,,
3,2-s2.0-85100111133,10.1109/ICARCV50220.2020.9305426,,,Consensus-based formation control and obstacle avoidance for nonholonomic multi-robot system,cp,Conference Paper,Koung D.,,Ecole Centrale de Nantes,Nantes,France,,,,,2020-12-13,13 December 2020,"16th IEEE International Conference on Control, Automation, Robotics and Vision, ICARCV 2020",,21101034443,,Conference Proceeding,,,9305426,92-97,,,2,0,repositoryam,Green,,,
4,2-s2.0-85100087002,10.1109/ICARCV50220.2020.9305465,,,Multi-Sensor-based Predictive Control for Autonomous Parking in Presence of Pedestrians,cp,Conference Paper,Perez-Morales D.,,Ecole Centrale de Nantes,Nantes,France,,,,,2020-12-13,13 December 2020,"16th IEEE International Conference on Control, Automation, Robotics and Vision, ICARCV 2020",,21101034443,,Conference Proceeding,,,9305465,406-413,,,2,0,repositoryam,Green,,,
5,2-s2.0-85102413389,10.23919/ICITST51030.2020.9351314,,,A Reliable Encryption Oriented Pseudo-chaotic Number Generator Using a Key Space Expandable Strategy,cp,Conference Paper,Qiao Z.,,Ecole Centrale de Nantes,Nantes,France,,,,,2020-12-08,8 December 2020,"2020 15th International Conference for Internet Technology and Secured Transactions, ICITST 2020",,21101039785,,Conference Proceeding,,,9351314,,,,0,0,,,,,
6,2-s2.0-85102412698,10.23919/ICITST51030.2020.9351350,,,A Stream Cipher Based on Fractional Pseudo Chaotic Random Number Generator,cp,Conference Paper,Yang C.,,Ecole Centrale de Nantes,Nantes,France,,,,,2020-12-08,8 December 2020,"2020 15th International Conference for Internet Technology and Secured Transactions, ICITST 2020",,21101039785,,Conference Proceeding,,,9351350,,,,1,0,repositoryam,Green,,,
7,2-s2.0-85097846053,10.3390/app10248905,,,Robust resonant controllers for distributed energy resources in microgrids,ar,Article,Bouzid A.E.M.,,Ecole Centrale de Nantes,Nantes,France,,,,,2020-12-02,2 December 2020,Applied Sciences (Switzerland),,21100829268,20763417,Journal,10,24,8905,1-15,,,0,1,repositoryvor,Green,,,
8,2-s2.0-85103741984,10.1109/MSIEID52046.2020.00060,,,A model of assessment and minimization of CO<inf>2</inf>emissions for green hub location-routing problem,cp,Conference Paper,Yang X.,,Shanghai Customs College,Shanghai,China,,,,,2020-12-01,December 2020,"Proceedings - 2020 Management Science Informatization and Economic Innovation Development Conference, MSIEID 2020",,21101041914,,Conference Proceeding,,,9382572,289-295,,,0,0,,,,,
9,2-s2.0-85095701511,10.1109/TAC.2020.2973609,,,A New Varying-Gain-Exponent-Based Differentiator/Observer: An Efficient Balance between Linear and Sliding-Mode Algorithms,ar,Article,Ghanes M.,,Laboratoire des Sciences du Numérique de Nantes,Nantes,France,,,,,2020-12-01,December 2020,IEEE Transactions on Automatic Control,00189286,17339,15582523,Journal,65,12,8998147,5407-5414,,,11,0,,,,,
10,2-s2.0-85092392531,10.1016/j.mri.2020.08.017,S0730725X20300230,32889090,Towards quantitative evaluation of wall shear stress from 4D flow imaging,ar,Article,Levilly S.,,Laboratoire des Sciences du Numérique de Nantes,Nantes,France,,,,,2020-12-01,December 2020,Magnetic Resonance Imaging,0730725X,17264,18735894,Journal,74,,,232-243,,,0,1,repositoryam,Green,,,
11,2-s2.0-85091105667,10.1007/s12008-020-00712-6,,,"Knowledge management for modeled Heritage objects, requirement specifications towards a tool for heterogeneity embracing",ar,Article,Jeanson L.,,Ecole Centrale de Nantes,Nantes,France,,,,,2020-12-01,December 2020,International Journal on Interactive Design and Manufacturing,19552513,12000154536,19552505,Journal,14,4,,1337-1345,,,1,0,repositoryam,Green,,,
12,2-s2.0-85088930580,10.1007/s11423-020-09814-0,,,Towards fine-grained reading dashboards for online course revision,ar,Article,Sadallah M.,,Centre de Recherche sur l'Information Scientifique et Technique (CERIST);Université Abderrahmane Mira - Béjaïa,Ben Aknoun;Bejaia,Algeria;Algeria,,,,,2020-12-01,December 2020,Educational Technology Research and Development,10421629,20764,15566501,Journal,68,6,,3165-3186,,,0,0,,,,,
13,2-s2.0-85083276358,10.1038/s41598-020-62357-5,,32269239,Probabilistic modeling to estimate jellyfish ecophysiological properties and size distributions,ar,Article,Ramondenc S.,,Sorbonne Universite,Paris,France,,,,,2020-12-01,1 December 2020,Scientific Reports,,21100200805,20452322,Journal,10,1,6074,,,,4,1,repositoryvor,Green,,,
14,2-s2.0-85081686693,10.1007/s10055-020-00430-0,,,Sharing spatial information in a virtual environment: How do visual cues and configuration influence spatial coding and mental workload?,ar,Article,Milleville-Pennel I.,,Université de Nantes,Nantes,France,,,,,2020-12-01,1 December 2020,Virtual Reality,13594338,144702,14349957,Journal,24,4,,695-712,,,0,0,repositoryam,Green,,,
15,2-s2.0-85077253060,10.1109/TIE.2019.2960739,,,Super-Twisting Algorithm-Based Time-Varying Delay Estimation with External Signal,ar,Article,Deng Y.,,CNRS Centre National de la Recherche Scientifique,Paris,France,,,,,2020-12-01,December 2020,IEEE Transactions on Industrial Electronics,02780046,26053,15579948,Journal,67,12,8941257,10663-10671,,,5,0,repositoryam,Green,,,
16,2-s2.0-85084423602,10.1016/j.neucom.2019.11.110,S0925231220305002,,Metric learning with submodular functions,ar,Article,Pan J.,,Université de Nantes,Nantes,France,,,,,2020-11-27,27 November 2020,Neurocomputing,09252312,24807,18728286,Journal,416,,,328-339,,,1,1,repositoryam,Green,,,
17,2-s2.0-85097986807,10.1063/5.0026524,,,Nonlinear optimal control for the industrial crystallization process,cp,Conference Paper,Rigatos G.,,Industrial Systems Institute,Patra,Greece,,,,,2020-11-24,24 November 2020,AIP Conference Proceedings,0094243X,26916,15517616,Conference Proceeding,2293,,310004,,,,0,0,,,,,
18,2-s2.0-85097977200,10.1063/5.0026538,,,A nonlinear optimal control approach for distributed marine-turbine power generation units,cp,Conference Paper,Rigatos G.,,Industrial Systems Institute,Patra,Greece,,,,,2020-11-24,24 November 2020,AIP Conference Proceedings,0094243X,26916,15517616,Conference Proceeding,2293,,310006,,,,0,0,,,,,
19,2-s2.0-85096616959,10.1016/j.celrep.2020.108419,S221112472031408X,33238118,Induction of Human Trophoblast Stem Cells from Somatic Cells and Pluripotent Stem Cells,ar,Article,Castel G.,,Université de Nantes,Nantes,France,,,,,2020-11-24,24 November 2020,Cell Reports,,21100201068,22111247,Journal,33,8,108419,,,,30,1,publisherfullgold,Gold,,,
20,2-s2.0-85100347926,10.1109/ICRAE50850.2020.9310900,,,On the Reconfiguration of Cable-Driven Parallel Robots with Multiple Mobile Cranes,cp,Conference Paper,Tan H.,,Institut Teknologi Sepuluh Nopember,Surabaya,Indonesia,,,,,2020-11-20,20 November 2020,"2020 5th International Conference on Robotics and Automation Engineering, ICRAE 2020",,21101034606,,Conference Proceeding,,,9310900,126-130,,,3,0,repositoryam,Green,,,
21,2-s2.0-85097711159,10.1145/3426425.3426930,,,Annotating executable DSLs with energy estimation formulas,cp,Conference Paper,Béziers La Fosse T.,,Laboratoire des Sciences du Numérique de Nantes;IMT Atlantique;I CAM,Nantes;Nantes;Toulouse,France;France;France,,,,,2020-11-16,16 November 2020,"SLE 2020 - Proceedings of the 13th ACM SIGPLAN International Conference on Software Language Engineering, Co-located with SPLASH 2020",,21101080962,,Conference Proceeding,,,,22-38,,,0,0,repositoryvor,Green,,,
22,2-s2.0-85100869337,10.1109/EPEC48502.2020.9320009,,,Robust constrained controller design for HVDC link embedded in a large-scale AC grid,cp,Conference Paper,Kamal E.,,Laboratoire des Sciences du Numérique de Nantes,Nantes,France,,,,,2020-11-09,9 November 2020,"2020 IEEE Electric Power and Energy Conference, EPEC 2020",,21101037902,,Conference Proceeding,,,9320009,,,,0,0,repositoryam,Green,,,
23,2-s2.0-85100867563,10.1109/EPEC48502.2020.9320020,,,EMT Implementation and Validation of MPC for VSC-HVDC Embedded in AC Meshed Grid,cp,Conference Paper,Thau E.,,Ecole Centrale de Nantes,Nantes,France,,,,,2020-11-09,9 November 2020,"2020 IEEE Electric Power and Energy Conference, EPEC 2020",,21101037902,,Conference Proceeding,,,9320020,,,,0,0,repositoryam,Green,,,
24,2-s2.0-85100859211,10.1109/EPEC48502.2020.9320043,,,Exhaustive modal analysis of interconnected european power system,cp,Conference Paper,Kouki M.,,Ecole Centrale de Nantes,Nantes,France,,,,,2020-11-09,9 November 2020,"2020 IEEE Electric Power and Energy Conference, EPEC 2020",,21101037902,,Conference Proceeding,,,9320043,,,,1,0,repositoryam,Green,,,
25,2-s2.0-85100844121,10.1109/EPEC48502.2020.9319919,,,Robust H∞ decentralized control design for HVDC link embedded in a large-scale AC grid,cp,Conference Paper,Ngo H.T.,,Laboratoire des Sciences du Numérique de Nantes,Nantes,France,,,,,2020-11-09,9 November 2020,"2020 IEEE Electric Power and Energy Conference, EPEC 2020",,21101037902,,Conference Proceeding,,,9319919,,,,0,0,repositoryam,Green,,,
26,2-s2.0-85100839496,10.1109/EPEC48502.2020.9320068,,,Robust H<inf>∞</inf>Dynamic Output-feedback Control of Power Oscillation Damped via VSC-HVDC Transmission Systems,cp,Conference Paper,Xing Y.,,Laboratoire des Sciences du Numérique de Nantes,Nantes,France,,,,,2020-11-09,9 November 2020,"2020 IEEE Electric Power and Energy Conference, EPEC 2020",,21101037902,,Conference Proceeding,,,9320068,,,,0,0,repositoryam,Green,,,
27,2-s2.0-85099290081,10.1109/IPTA50016.2020.9286611,,,Semantic image segmentation based on spatial relationships and inexact graph matching,cp,Conference Paper,Chopin J.,,Universite d'Angers,Angers,France,,,,,2020-11-09,9 November 2020,"2020 10th International Conference on Image Processing Theory, Tools and Applications, IPTA 2020",,21101033874,,Conference Proceeding,,,9286611,,,,1,0,repositoryam,Green,,,
28,2-s2.0-85086452717,10.1016/j.jde.2020.06.007,S0022039620303211,,L<sup>p</sup>-asymptotic stability analysis of a 1D wave equation with a nonlinear damping,ar,Article,Chitour Y.,,Laboratoire des Signaux et Systèmes,Gif-sur-Yvette,France,,,,,2020-11-05,5 November 2020,Journal of Differential Equations,00220396,23874,10902732,Journal,269,10,,8107-8131,,,9,1,repositoryam,Green,,,
29,2-s2.0-85099782007,10.1109/AICCSA50499.2020.9316502,,,Distributed Contextualization of Biomedical Data: A Case Study in Precision Medicine,cp,Conference Paper,Sayadi S.,,Laboratoire des Sciences du Numérique de Nantes;Université de Nantes,Nantes;Nantes,France;France,,,,,2020-11-01,November 2020,"Proceedings of IEEE/ACS International Conference on Computer Systems and Applications, AICCSA",21615322,21100198533,21615330,Conference Proceeding,2020-November,,9316502,,,,2,0,repositoryam,Green,,,
30,2-s2.0-85099776256,10.1109/AICCSA50499.2020.9316536,,,BCTMark: A Framework for Benchmarking Blockchain Technologies,cp,Conference Paper,Saingre D.,,IMT Atlantique,Nantes,France,,,,,2020-11-01,November 2020,"Proceedings of IEEE/ACS International Conference on Computer Systems and Applications, AICCSA",21615322,21100198533,21615330,Conference Proceeding,2020-November,,9316536,,,,3,0,repositoryam,Green,,,
31,2-s2.0-85099453787,10.1109/iThings-GreenCom-CPSCom-SmartData-Cybermatics50389.2020.00065,,,Energy-aware Aperiodic Task Servers for Firm Real-time Energy harvesting Systems,cp,Conference Paper,Audrey Q.,,Université de Nantes,Nantes,France,,,,,2020-11-01,November 2020,"Proceedings - IEEE Congress on Cybermatics: 2020 IEEE International Conferences on Internet of Things, iThings 2020, IEEE Green Computing and Communications, GreenCom 2020, IEEE Cyber, Physical and Social Computing, CPSCom 2020 and IEEE Smart Data, SmartData 2020",,21101033918,,Conference Proceeding,,,9291550,310-317,,,0,0,,,,,
32,2-s2.0-85095759559,10.3390/s20216282,,33158198,Three-dimensional microwave imaging: Fast and accurate computations with block resolution algorithms,ar,Article,Friedrich C.,,Ecole Centrale de Nantes;Polytechnique Montréal,Nantes;Montreal,France;Canada,,,,,2020-11-01,1 November 2020,Sensors (Switzerland),14248220,130124,,Journal,20,21,6282,1-20,,,1,1,repositoryam,Green,,,
33,2-s2.0-85090363086,10.1016/j.cie.2020.106794,S0360835220305015,,A hybrid genetic algorithm for a multilevel assembly replenishment planning problem with stochastic lead times,ar,Article,Ben-Ammar O.,,Université Clermont Auvergne,Clermont-Ferrand,France,,,,,2020-11-01,November 2020,Computers and Industrial Engineering,03608352,18164,,Journal,149,,106794,,,,5,1,repositoryam,Green,,,
34,2-s2.0-85090056424,10.1016/j.robot.2020.103602,S0921889020304425,,"Comparative study of self tuning, adaptive and multiplexing FTC strategies for successive failures in an Octorotor UAV",ar,Article,Hamadi H.,,Université Libanaise;Sorbonne Universite,Beirut;Paris,Lebanon;France,,,,,2020-11-01,November 2020,Robotics and Autonomous Systems,09218890,18079,,Journal,133,,103602,,,,3,0,repositoryam,Green,,,
35,2-s2.0-85089695522,10.1016/j.ijpe.2020.107886,S0925527320302498,,Exploring supply chain structural dynamics: New disruptive technologies and disruption risks,ed,Editorial,Dolgui A.,,Laboratoire des Sciences du Numérique de Nantes,Nantes,France,,,,,2020-11-01,November 2020,International Journal of Production Economics,09255273,19165,,Journal,229,,107886,,,,23,1,repositoryvor,Green,,,
36,2-s2.0-85089255277,10.1002/qre.2705,,,Performance of the MEWMA-CoDa control chart in the presence of measurement errors,ar,Article,Zaidi F.S.,,Université de Nantes,Nantes,France,,,,,2020-11-01,1 November 2020,Quality and Reliability Engineering International,07488017,19123,10991638,Journal,36,7,,2411-2440,,,11,0,,,,,
37,2-s2.0-85087787912,10.1002/oca.2647,,,Stable impulsive zone model predictive control for type 1 diabetic patients based on a long-term model,ar,Article,González A.H.,,Universidad Nacional del Litoral,Santa Fe,Argentina,,,,,2020-11-01,1 November 2020,Optimal Control Applications and Methods,01432087,25529,10991514,Journal,41,6,,2115-2136,,,11,0,repositoryam,Green,,,
38,2-s2.0-85086377097,10.1016/j.sysarc.2020.101800,S138376212030093X,,Efficient mapping of runnables to tasks for embedded AUTOSAR applications,ar,Article,Khenfri F.,,ESTACA Engineering School,Paris,France,,,,,2020-11-01,November 2020,Journal of Systems Architecture,13837621,12398,,Journal,110,,101800,,,,1,0,,,,,
39,2-s2.0-85096445225,10.1088/1757-899X/922/1/012002,,,Invariance and Controlled Invariance in Switching Structured Systems with Application to Disturbance Decoupling,cp,Conference Paper,Conte G.,,Università Politecnica delle Marche,Ancona,Italy,,,,,2020-10-28,28 October 2020,IOP Conference Series: Materials Science and Engineering,17578981,19700200831,1757899X,Conference Proceeding,922,1,012002,,,,0,1,repositoryam,Green,,,
40,2-s2.0-85096673322,10.1145/3395035.3425205,,,Assessment of situation awareness during robotic surgery using multimodal data,cp,Conference Paper,Lechappe A.,,Laboratoire des Sciences du Numérique de Nantes;IMT Atlantique;Université de Brest (UBO),Nantes;Nantes;Brest,France;France;France,,,,,2020-10-25,25 October 2020,ICMI 2020 Companion - Companion Publication of the 2020 International Conference on Multimodal Interaction,,21101033805,,Conference Proceeding,,,,412-416,,,5,0,repositoryvor,Green,,,
41,2-s2.0-85102408039,10.1109/IROS45743.2020.9341680,,,Dense Decentralized Multi-robot SLAM based on locally consistent TSDF submaps,cp,Conference Paper,Dubois R.,,Laboratoire des Sciences du Numérique de Nantes;Universite Paris-Saclay,Nantes;Saint-Aubin,France;France,,,,,2020-10-24,24 October 2020,IEEE International Conference on Intelligent Robots and Systems,21530858,66854,21530866,Conference Proceeding,,,9341680,4862-4869,,,2,0,repositoryam,Green,,,
42,2-s2.0-85100585851,10.1145/3434780.3436688,,,Promoting Open Education through Gamification in Higher Education: The OpenGame project,cp,Conference Paper,García-Holgado A.,,Universidad de Salamanca,Salamanca,Spain,,,,,2020-10-21,21 October 2020,ACM International Conference Proceeding Series,,11600154611,,Conference Proceeding,,,3436687,399-404,,,1,0,,,,,
43,2-s2.0-85096987263,10.1145/3419804.3421447,,,A formalism for specifying model merging conflicts,cp,Conference Paper,Sharbaf M.,,Université de Nantes;University of Isfahan,Nantes;Isfahan,France;Iran,,,,,2020-10-19,19 October 2020,"Proceedings of the 12th System Analysis and Modelling Conference, SAM 2020",,21101029478,,Conference Proceeding,,,,1-11,,,0,0,repositoryvor,Green,,,
44,2-s2.0-85095866439,10.1145/3340531.3412116,,,Rethinking Operators Placement of Stream Data Application in the Edge,cp,Conference Paper,Lambert T.,,IMT Atlantique,Nantes,France,,,,,2020-10-19,19 October 2020,"International Conference on Information and Knowledge Management, Proceedings",,21101027248,,Conference Proceeding,,,,2101-2104,,,2,0,repositoryam,Green,,,
45,2-s2.0-85097783361,10.1109/IECON43393.2020.9255251,,,Cascade GW Controllers for Speed Ripple Minimization at Low Speed Operation of PMSM Drives for EV,cp,Conference Paper,Djeriou A.,,Université Mohamed Boudiaf - M'sila,M'sila,Algeria,,,,,2020-10-18,18 October 2020,IECON Proceedings (Industrial Electronics Conference),,56670,,Conference Proceeding,2020-October,,9255251,4667-4672,,,0,0,,,,,
46,2-s2.0-85096809407,10.1145/3417990.3420204,,,Challenges &amp; opportunities in low-code testing,cp,Conference Paper,Khorram F.,,Laboratoire des Sciences du Numérique de Nantes,Nantes,France,,,,,2020-10-16,16 October 2020,"Proceedings - 23rd ACM/IEEE International Conference on Model Driven Engineering Languages and Systems, MODELS-C 2020 - Companion Proceedings",,21101028544,,Conference Proceeding,,,,490-499,,,7,0,repositoryvor,Green,,,
47,2-s2.0-85096808259,10.1145/3417990.3420206,,,Towards transparent combination of model management execution strategies for low-code development platforms,cp,Conference Paper,Philippe J.,,Laboratoire des Sciences du Numérique de Nantes,Nantes,France,,,,,2020-10-16,16 October 2020,"Proceedings - 23rd ACM/IEEE International Conference on Model Driven Engineering Languages and Systems, MODELS-C 2020 - Companion Proceedings",,21101028544,,Conference Proceeding,,,,507-516,,,4,0,repositoryvor,Green,,,
48,2-s2.0-85096756100,10.1145/3417990.3421438,,,Towards a digital twin for cyber-physical production systems: A multi-paradigm modeling approach in the postal industry,cp,Conference Paper,Niati A.,,École nationale supérieure d'Informatique,Algiers,Algeria,,,,,2020-10-16,16 October 2020,"Proceedings - 23rd ACM/IEEE International Conference on Model Driven Engineering Languages and Systems, MODELS-C 2020 - Companion Proceedings",,21101028544,,Conference Proceeding,,,,651-657,,,1,0,repositoryvor,Green,,,
49,2-s2.0-85096746061,10.1145/3417990.3422005,,,CyprIoT project: An open source toolset to model and generate a network of things,cp,Conference Paper,Berrouyne I.,,Université du Québec à Chicoutimi;CNRS Centre National de la Recherche Scientifique,Chicoutimi-Jonquiere;Paris,Canada;France,,,,,2020-10-16,16 October 2020,"Proceedings - 23rd ACM/IEEE International Conference on Model Driven Engineering Languages and Systems, MODELS-C 2020 - Companion Proceedings",,21101028544,,Conference Proceeding,,,,36-40,,,0,0,,,,,
50,2-s2.0-85096113250,10.1145/3423328.3423496,,,Towards Better Quality Assessment of High-Quality Videos,cp,Conference Paper,Ling S.,,CAPACITES SAS,Nantes,France,,,,,2020-10-16,16 October 2020,QoEVMA 2020 - Proceedings of the 1st Workshop on Quality of Experience (QoE) in Visual Multimedia Applications,,21101027513,,Conference Proceeding,,,,3-9,,,0,0,,,,,
51,2-s2.0-85096112545,10.1145/3423328.3423501,,,A Subjective Study of Multi-Dimensional Aesthetic Assessment for Mobile Game Image,cp,Conference Paper,Ling S.,,CAPACITES SAS,Nantes,France,,,,,2020-10-16,16 October 2020,QoEVMA 2020 - Proceedings of the 1st Workshop on Quality of Experience (QoE) in Visual Multimedia Applications,,21101027513,,Conference Proceeding,,,,47-53,,,2,0,,,,,
52,2-s2.0-85096092286,10.1145/3423328.3423498,,,Perceptual Characterization of 3D Graphical Contents based on Attention Complexity Measures,cp,Conference Paper,Abid M.,,Université de Nantes,Nantes,France,,,,,2020-10-16,16 October 2020,QoEVMA 2020 - Proceedings of the 1st Workshop on Quality of Experience (QoE) in Visual Multimedia Applications,,21101027513,,Conference Proceeding,,,,31-36,,,1,0,repositoryvor,Green,,,
53,2-s2.0-85097832241,10.1109/ICNP49622.2020.9259390,,,A Semi-supervised Stacked Autoencoder Approach for Network Traffic Classification,cp,Conference Paper,Aouedi O.,,Université de Nantes,Nantes,France,,,,,2020-10-13,13 October 2020,"Proceedings - International Conference on Network Protocols, ICNP",10921648,145223,,Conference Proceeding,2020-October,,9259390,,,,4,0,repositoryvor,Green,,,
54,2-s2.0-85106941309,10.1145/3394171.3413619,,,A Probabilistic Graphical Model for Analyzing the Subjective Visual Quality Assessment Data from Crowdsourcing,cp,Conference Paper,Li J.,,Alibaba Group Holding Limited,Yu Hang,China,,,,,2020-10-12,12 October 2020,MM 2020 - Proceedings of the 28th ACM International Conference on Multimedia,,21101047052,,Conference Proceeding,,,,3339-3347,,,2,0,,,,,
55,2-s2.0-85098879556,10.1109/SMC42975.2020.9283101,,,Towards a Driver Model to Clarify Cooperation between Drivers and Haptic Guidance Systems,cp,Conference Paper,Zhao Y.,,IMT Atlantique,Nantes,France,,,,,2020-10-11,11 October 2020,"Conference Proceedings - IEEE International Conference on Systems, Man and Cybernetics",1062922X,145097,,Conference Proceeding,2020-October,,9283101,1731-1737,,,1,0,repositoryam,Green,,,
56,2-s2.0-85098859046,10.1109/SMC42975.2020.9283441,,,"Systematic H<inf>2</inf>/H<inf>∞</inf> haptic shared control synthesis for cars, parameterized by sharing level",cp,Conference Paper,Pano B.,,Laboratoire des Sciences du Numérique de Nantes,Nantes,France,,,,,2020-10-11,11 October 2020,"Conference Proceedings - IEEE International Conference on Systems, Man and Cybernetics",1062922X,145097,,Conference Proceeding,2020-October,,9283441,4416-4423,,,1,0,repositoryam,Green,,,
57,2-s2.0-85098843839,10.1109/SMC42975.2020.9283382,,,Driver Model Validation through Interaction with Varying Levels of Haptic Guidance,cp,Conference Paper,Zhao Y.,,IMT Atlantique,Nantes,France,,,,,2020-10-11,11 October 2020,"Conference Proceedings - IEEE International Conference on Systems, Man and Cybernetics",1062922X,145097,,Conference Proceeding,2020-October,,9283382,2284-2290,,,1,0,repositoryam,Green,,,
58,2-s2.0-85097981289,10.1109/ICSTCC50638.2020.9259692,,,Descriptor Recurrent Neural Network Model and ℒ<inf>2</inf>- Gain Control Design for Systems with Dry Friction,cp,Conference Paper,Yagoubi M.,,Laboratoire des Sciences du Numérique de Nantes,Nantes,France,,,,,2020-10-08,8 October 2020,"2020 24th International Conference on System Theory, Control and Computing, ICSTCC 2020 - Proceedings",,21101032301,,Conference Proceeding,,,9259692,19-24,,,0,0,,,,,
59,2-s2.0-85097977076,10.1109/ICSTCC50638.2020.9259718,,,Analysis of Stability Margins in a Class of Discrete Nonlinear Time - Invariant Systems via Tsypkin Criterion and Describing Function technique,cp,Conference Paper,Das S.S.,,The University of Alabama in Huntsville,Huntsville,United States,,,,,2020-10-08,8 October 2020,"2020 24th International Conference on System Theory, Control and Computing, ICSTCC 2020 - Proceedings",,21101032301,,Conference Proceeding,,,9259718,412-418,,,1,0,,,,,
60,2-s2.0-85097974865,10.1109/ICSTCC50638.2020.9259647,,,Output Feedback H<inf>∞</inf>Control Design for Polynomial T-S Systems: A Novel SOS Approach,cp,Conference Paper,Chaibi R.,,Université Sidi Mohamed Ben Abdellah,Fez,Morocco,,,,,2020-10-08,8 October 2020,"2020 24th International Conference on System Theory, Control and Computing, ICSTCC 2020 - Proceedings",,21101032301,,Conference Proceeding,,,9259647,298-303,,,0,0,repositoryvor,Green,,,
61,2-s2.0-85059525204,10.1080/00207179.2018.1562223,,,ℋ<inf>∞</inf> control under asymptotic tracking constraint and nonproper output weights,ar,Article,Feng Y.,,Zhejiang University of Technology,Hangzhou,China,,,,,2020-10-02,2 October 2020,International Journal of Control,00207179,12342,13665820,Journal,93,10,,2418-2430,,,0,0,repositoryam,Green,,,
