,eid,doi,pii,pubmed_id,title,subtype,subtypeDescription,creator,afid,affilname,affiliation_city,affiliation_country,author_count,author_names,author_ids,author_afids,coverDate,coverDisplayDate,publicationName,issn,source_id,eIssn,aggregationType,volume,issueIdentifier,article_number,pageRange,description,authkeywords,citedby_count,openaccess,freetoread,freetoreadLabel,fund_acr,fund_no,fund_sponsor
922,2-s2.0-85057295443,,,,Unsupervised hyperspectral band selection using clustering and single-layer neural network,ar,Article,Habermann M.,,Sorbonne Universite;Institute for Advanced Studies,Paris;S. J. dos Campos,France;Brazil,,,,,2018-06-01,June-September 2018,Revue Francaise de Photogrammetrie et de Teledetection,17689791,144988,,Journal,2018-September,217-218,,33-42,,,2,0,,,,,
923,2-s2.0-85053866151,10.1115/1.4039400,,,"Kinematics, workspace, and singularity analysis of a parallel robot with five operation modes",ar,Article,Chablat D.,,CNRS Centre National de la Recherche Scientifique,Paris,France,,,,,2018-06-01,June 2018,Journal of Mechanisms and Robotics,19424302,19700186816,19424310,Journal,10,3,035001,,,,19,0,repositoryam,Green,,,
924,2-s2.0-85049206001,10.1109/MENACOMM.2018.8371016,,,"MAC layer-based evaluation of IoT technologies: LoRa, SigFox and NB-IoT",cp,Conference Paper,Mroue H.,,Université de Nantes;SPIE City Networks,Nantes;Saint-Herblain,France;France,,,,,2018-06-01,1 June 2018,"2018 IEEE Middle East and North Africa Communications Conference, MENACOMM 2018",,21100866183,,Conference Proceeding,,,,1-5,,,37,0,,,,,
925,2-s2.0-85047999553,10.1364/JOSAA.35.001028,,29877348,Two-photon speckle illumination for super-resolution microscopy,ar,Article,Negash A.,,Institut Fresnel,Marseille,France,,,,,2018-06-01,June 2018,"Journal of the Optical Society of America A: Optics and Image Science, and Vision",10847529,12320,15208532,Journal,35,6,,1028-1033,,,1,0,,,,,
926,2-s2.0-85047966940,10.1038/s41551-018-0243-9,,,Mechanically induced development and maturation of human intestinal organoids in vivo /692/4020/2741/520/1584,ar,Article,Poling H.,,Cincinnati Children's Hospital Medical Center,Cincinnati,United States,,,,,2018-06-01,1 June 2018,Nature Biomedical Engineering,,21100831443,2157846X,Journal,2,6,,429-442,,,50,0,repositoryam,Green,,,
927,2-s2.0-85046465987,10.1109/TBC.2018.2828607,,,Toward the assessment of quality of experience for asymmetric encoding in immersive media,ar,Article,Battisti F.,,Università degli Studi Roma Tre,Rome,Italy,,,,,2018-06-01,June 2018,IEEE Transactions on Broadcasting,00189316,19901,,Journal,64,2,,392-406,,,18,0,,,,,
928,2-s2.0-85045098320,10.1016/j.trc.2018.03.020,S0968090X18303851,,The fleet size and mix dial-a-ride problem with reconfigurable vehicle capacity,ar,Article,Tellez O.,,Vinci,Rueil-Malmaison,France,,,,,2018-06-01,June 2018,Transportation Research Part C: Emerging Technologies,0968090X,20893,,Journal,91,,,99-123,,,24,0,repositoryam,Green,,,
929,2-s2.0-85045089946,10.1016/j.compbiolchem.2018.03.015,S1476927118301610,29650458,Matching algorithms for assigning orthologs after genome duplication events,ar,Article,Fertin G.,,Université de Nantes,Nantes,France,,,,,2018-06-01,June 2018,Computational Biology and Chemistry,14769271,24599,,Journal,74,,,379-390,,,0,0,,,,,
930,2-s2.0-85044745689,10.1115/1.4039498,,,Design of a compliant gripper with multimode jaws,ar,Article,Hao G.,,University College Cork,Cork,Ireland,,,,,2018-06-01,1 June 2018,Journal of Mechanisms and Robotics,19424302,19700186816,19424310,Journal,10,3,031005,,,,16,0,repositoryam,Green,,,
931,2-s2.0-85044100832,10.1016/j.conengprac.2018.03.004,S0967066118300340,,Visual estimation of deviations for the civil aircraft landing,ar,Article,Gibert V.,,Airbus France,Blagnac,France,,,,,2018-06-01,June 2018,Control Engineering Practice,09670661,18174,,Journal,75,,,17-25,,,13,0,,,,,
932,2-s2.0-85043519835,10.1002/qre.2275,,,The effect of measurement errors on the adaptive EWMA X¯ chart,ar,Article,Tang A.,,Nanjing University of Science and Technology,Nanjing,China,,,,,2018-06-01,June 2018,Quality and Reliability Engineering International,07488017,19123,10991638,Journal,34,4,,609-630,,,29,0,,,,,
933,2-s2.0-85041405356,10.1016/j.ipl.2018.01.009,S0020019018300188,,General parametric scheme for the online uniform machine scheduling problem with two different speeds,ar,Article,Dolgui A.,,Laboratoire des Sciences du Numérique de Nantes,Nantes,France,,,,,2018-06-01,June 2018,Information Processing Letters,00200190,14388,,Journal,134,,,18-23,,,4,0,repositoryam,Green,,,
934,2-s2.0-85041388105,10.1016/j.mri.2017.12.027,S0730725X17303053,29326046,Multi-tissue partial volume quantification in multi-contrast MRI using an optimised spectral unmixing approach,ar,Article,Collewet G.,,INRAE,Paris,France,,,,,2018-06-01,June 2018,Magnetic Resonance Imaging,0730725X,17264,18735894,Journal,49,,,39-46,,,3,0,,,,,
935,2-s2.0-85031503932,10.1016/j.dsp.2017.09.013,S1051200417302166,,Framework for reproducible objective video quality research with case study on PSNR implementations,ar,Article,Aldahdooh A.,,Université de Nantes,Nantes,France,,,,,2018-06-01,June 2018,Digital Signal Processing: A Review Journal,10512004,24306,,Journal,77,,,195-206,,,10,0,,,,,
936,2-s2.0-85021698823,10.1007/s11042-017-4953-x,,,Design and analysis of two stream ciphers based on chaotic coupling and multiplexing techniques,ar,Article,Jallouli O.,,Institut d’Électronique et des Technologies du numéRique,Rennes,France,,,,,2018-06-01,1 June 2018,Multimedia Tools and Applications,13807501,25627,15737721,Journal,77,11,,13391-13417,,,17,0,,,,,
937,2-s2.0-85019577946,10.1017/S0960129517000135,,,Dynamic networks of heterogeneous timed machines,ar,Article,Fiadeiro J.,,"Royal Holloway, University of London",Egham,United Kingdom,,,,,2018-06-01,1 June 2018,Mathematical Structures in Computer Science,09601295,5000157801,,Journal,28,6,,800-855,,,1,0,,,,,
938,2-s2.0-85048376216,10.1109/ICPADS.2017.00051,,,Virtual machine placement for hybrid cloud using constraint programming,cp,Conference Paper,Helene C.,,Laboratoire des Sciences du Numérique de Nantes,Nantes,France,,,,,2018-05-29,29 May 2018,Proceedings of the International Conference on Parallel and Distributed Systems - ICPADS,15219097,69957,,Conference Proceeding,2017-December,,,326-333,,,4,0,,,,,
939,2-s2.0-85048355271,10.1109/ICPADS.2017.00089,,,Green energy aware scheduling problem in virtualized datacenters,cp,Conference Paper,Wamba G.M.,,Laboratoire des Sciences du Numérique de Nantes,Nantes,France,,,,,2018-05-29,29 May 2018,Proceedings of the International Conference on Parallel and Distributed Systems - ICPADS,15219097,69957,,Conference Proceeding,2017-December,,,648-655,,,0,0,repositoryam,Green,,,
940,2-s2.0-85021455452,10.1080/03610918.2017.1311918,,,A side-sensitive modified group runs double sampling (SSMGRDS) control chart for detecting mean shifts,ar,Article,Saha S.,,Universiti Sains Malaysia,Minden,Malaysia,,,,,2018-05-28,28 May 2018,Communications in Statistics: Simulation and Computation,03610918,23526,15324141,Journal,47,5,,1353-1369,,,16,0,,,,,
941,2-s2.0-85041583534,10.1002/rnc.4057,,,Impulsive second-order sliding mode control in reduced information environment,ar,Article,Aldukali F.M.,,The University of Alabama in Huntsville,Huntsville,United States,,,,,2018-05-25,25 May 2018,International Journal of Robust and Nonlinear Control,10498923,17987,10991239,Journal,28,8,,2909-2926,,,3,0,,,,,
942,2-s2.0-85038019269,10.1080/00207543.2017.1412523,,,Exponential cumulative sums chart for detecting shifts in time-between-events,ar,Article,Qu L.,,Tianjin University,Tianjin,China,,,,,2018-05-19,19 May 2018,International Journal of Production Research,00207543,27656,1366588X,Journal,56,10,,3683-3698,,,21,0,,,,,
943,2-s2.0-85040009142,10.1016/j.ejor.2017.12.032,S0377221717311657,,A note on decision making method for product acceptance based on process capability indices C<inf>pk</inf> and C<inf>pmk</inf>,ar,Article,Lepore A.,,Università degli Studi di Napoli Federico II,Naples,Italy,,,,,2018-05-16,16 May 2018,European Journal of Operational Research,03772217,22489,,Journal,267,1,,393-398,,,31,0,,,,,
944,2-s2.0-85048057390,10.23919/ICITST.2017.8356342,,,Reveal false names of accounts as a result of hackers attacks: Security systems with heightened safety of information,cp,Conference Paper,Andreev D.,,Technical University of Sofia,Sofia,Bulgaria,,,,,2018-05-08,8 May 2018,"2017 12th International Conference for Internet Technology and Secured Transactions, ICITST 2017",,21100863043,,Conference Proceeding,,,,39-42,,,0,0,,,,,
945,2-s2.0-85047320012,10.1063/1.5034890,,,Evaluation between residual stresses obtained by neutron diffraction and simulation for dual phase steel welded by laser process,cp,Conference Paper,Kouadri-Henni A.,,Laboratoire des Sciences du Numérique de Nantes;INSA Rennes,Nantes;Rennes,France;France,,,,,2018-05-02,2 May 2018,AIP Conference Proceedings,0094243X,26916,15517616,Conference Proceeding,1960,,060001,,,,0,0,,,,,
946,2-s2.0-85047298480,10.1063/1.5034874,,,Joining of polymer-metal lightweight structures using self-piercing riveting (SPR) technique: Numerical approach and simulation results,cp,Conference Paper,Amro E.,,Laboratoire des Sciences du Numérique de Nantes;National Institute of Applied Sciences (INSA) of Rennes,Nantes;Nantes,France;France,,,,,2018-05-02,2 May 2018,AIP Conference Proceedings,0094243X,26916,15517616,Conference Proceeding,1960,,050001,,,,2,0,,,,,
947,2-s2.0-85048304512,10.4230/LIPIcs.CPM.2018.10,,,A simple linear-time algorithm for computing the centroid and canonical form of a plane graph and its applications,cp,Conference Paper,Akutsu T.,,Kyoto University,Kyoto,Japan,,,,,2018-05-01,1 May 2018,"Leibniz International Proceedings in Informatics, LIPIcs",18688969,21100244929,,Conference Proceeding,105,,,101-1012,,,1,0,,,,,
948,2-s2.0-85048256631,10.4230/LIPIcs.CPM.2018.17,,,On the maximum colorful arborescence problem and color hierarchy graph structure,cp,Conference Paper,Fertin G.,,Université de Nantes,Nantes,France,,,,,2018-05-01,1 May 2018,"Leibniz International Proceedings in Informatics, LIPIcs",18688969,21100244929,,Conference Proceeding,105,,,171-1715,,,2,0,,,,,
949,2-s2.0-85048238333,10.1177/0278364918769992,,,A unified multi-soft-body dynamic model for underwater soft robots,ar,Article,Renda F.,,Khalifa University of Science and Technology,Abu Dhabi,United Arab Emirates,,,,,2018-05-01,1 May 2018,International Journal of Robotics Research,02783649,18050,17413176,Journal,37,6,,648-666,,,22,0,repositoryam,Green,,,
950,2-s2.0-85048201886,10.1371/journal.pcbi.1006146,,29791443,"Traceability, reproducibility and wiki-exploration for “à-la-carte” reconstructions of genome-scale metabolic models",ar,Article,Aite M.,,Institut de Recherche en Informatique et Systèmes Aléatoires,Rennes,France,,,,,2018-05-01,May 2018,PLoS Computational Biology,1553734X,4000151810,15537358,Journal,14,5,e1006146,,,,31,1,repositoryam,Green,,,
951,2-s2.0-85047524662,10.3390/rs10050669,,,Full-waveform LiDAR pixel analysis for low-growing vegetation mapping of coastal foredunes in Western France,ar,Article,Launeau P.,,Université de Nantes,Nantes,France,,,,,2018-05-01,1 May 2018,Remote Sensing,,86430,20724292,Journal,10,5,669,,,,7,1,repositoryam,Green,,,
952,2-s2.0-85046764462,10.3390/a11050057,,,Optimal control algorithms and their analysis for short-term scheduling in manufacturing systems,ar,Article,Sokolov B.,,St. Petersburg Federal Research Center of the Russian Academy of Sciences,Saint Petersburg,Russian Federation,,,,,2018-05-01,1 May 2018,Algorithms,,21100199795,19994893,Journal,11,5,57,,,,17,1,repositoryam,Green,,,
953,2-s2.0-85044628050,10.1016/j.cirpj.2018.01.003,S1755581718300038,,A modular-based approach for Just-In-Time Specification of customer orders in the aircraft manufacturing industry,ar,Article,Buergin J.,,Karlsruher Institut für Technologie,Karlsruhe,Germany,,,,,2018-05-01,May 2018,CIRP Journal of Manufacturing Science and Technology,17555817,12300154704,,Journal,21,,,61-74,,,15,1,repositoryvor,Green,,,
954,2-s2.0-85043487130,10.1016/j.ijpe.2018.02.017,S0925527318301129,,Evaluation of solution approaches for a stochastic lot-sizing and sequencing problem,ar,Article,Schemeleva K.,,Laboratoire Aménagement Economie Transports,Lyon,France,,,,,2018-05-01,May 2018,International Journal of Production Economics,09255273,19165,,Journal,199,,,179-192,,,3,0,repositoryam,Green,,,
955,2-s2.0-85039787959,10.1109/TEM.2017.2773574,,,Hybrid Fuzzy-Probabilistic Approach to Supply Chain Resilience Assessment,ar,Article,Pavlov A.,,"A.F. Mozhaisky Military Space Engineering Academy, Saint Petersburg;St. Petersburg Federal Research Center of the Russian Academy of Sciences",Saint Petersburg;Saint Petersburg,Russian Federation;Russian Federation,,,,,2018-05-01,May 2018,IEEE Transactions on Engineering Management,00189391,17359,,Journal,65,2,,303-315,,,71,0,repositoryam,Green,,,
956,2-s2.0-85037807813,10.1016/j.ymssp.2017.11.003,S0888327017305848,,Modeling and characterization of an electromagnetic system for the estimation of Frequency Response Function of spindle,ar,Article,Tlalolini D.,,Université de Nantes,Nantes,France,,,,,2018-05-01,1 May 2018,Mechanical Systems and Signal Processing,08883270,21080,10961216,Journal,104,,,294-304,,,16,0,repositoryam,Green,,,
957,2-s2.0-85034094899,10.1007/s11044-017-9602-7,,,Walking of biped with passive exoskeleton: evaluation of energy consumption,ar,Article,Aoustin Y.,,Université de Nantes,Nantes,France,,,,,2018-05-01,1 May 2018,Multibody System Dynamics,13845640,14523,1573272X,Journal,43,1,,71-96,,,16,0,repositoryam,Green,,,
958,2-s2.0-85026533923,10.1007/s11280-017-0478-5,,,An adaptive peer-sampling protocol for building networks of browsers,ar,Article,Nédelec B.,,Université de Nantes,Nantes,France,,,,,2018-05-01,1 May 2018,World Wide Web,1386145X,14965,,Journal,21,3,,629-661,,,6,0,repositoryam,Green,,,
959,2-s2.0-85057110841,10.1109/ISCAS.2018.8350911,,,Adaptive Screen Content Image Enhancement Strategy using Layer-based Segmentation,cp,Conference Paper,Che Z.,,Shanghai Jiao Tong University,Shanghai,China,,,,,2018-04-26,26 April 2018,Proceedings - IEEE International Symposium on Circuits and Systems,02714310,56190,,Conference Proceeding,2018-May,,8350911,,,,2,0,,,,,
960,2-s2.0-85046118126,10.3390/app8050666,,,Optimization of two-level disassembly/remanufacturing/assembly system with an integrated maintenance strategy,ar,Article,Guiras Z.,,"Laboratoire de Génie Informatique, de Production et de Maintenance",Metz,France,,,,,2018-04-25,25 April 2018,Applied Sciences (Switzerland),,21100829268,20763417,Journal,8,5,666,,,,17,1,repositoryam,Green,,,
961,2-s2.0-85041535226,10.1016/j.knosys.2018.01.026,S0950705118300418,,Constraint selection in metric learning,ar,Article,Le Capitaine H.,,Université de Nantes,Nantes,France,,,,,2018-04-15,15 April 2018,Knowledge-Based Systems,09507051,24772,,Journal,146,,,91-103,,,4,0,,,,,
962,2-s2.0-85050534557,,,,Special track on knowledge representation and reasoning (KRR),ed,Editorial,Bistarelli S.,,Università degli Studi di Perugia,Perugia,Italy,,,,,2018-04-09,9 April 2018,Proceedings of the ACM Symposium on Applied Computing,,89358,,Conference Proceeding,Part F137816,,,,,,0,0,,,,,
963,2-s2.0-85038033720,10.1108/IR-09-2017-0165,,,An industrial security system for human-robot coexistence,ar,Article,Long P.,,Northeastern University,Boston,United States,,,,,2018-04-09,9 Apr 2018,Industrial Robot,0143991X,18047,,Journal,45,2,,220-226,,,30,0,repositoryam,Green,,,
964,2-s2.0-85042075920,10.1016/j.comnet.2018.01.046,S1389128618300550,,Efficient queuing scheme through cross-layer approach for multimedia transmission over WSNs,ar,Article,Bennis I.,,Université de Reims Champagne-Ardenne,Reims,France,,,,,2018-04-07,7 April 2018,Computer Networks,13891286,26811,,Journal,134,,,272-282,,,9,0,,,,,
965,2-s2.0-85041712156,10.1016/j.matdes.2018.01.045,S0264127518300595,,"Evolutionary design of strong and stable high entropy alloys using multi-objective optimisation based on physical models, statistics and thermodynamics",ar,Article,Menou E.,,Université de Nantes,Nantes,France,,,,,2018-04-05,5 April 2018,Materials and Design,02641275,17797,18734197,Journal,143,,,185-195,,,28,0,,,,,
966,2-s2.0-85030838903,10.1080/00207543.2017.1385869,,,Integrated dynamic single item lot-sizing and quality inspection planning,ar,Article,Bettayeb B.,,Laboratoire des Sciences du Numérique de Nantes,Nantes,France,,,,,2018-04-03,3 April 2018,International Journal of Production Research,00207543,27656,1366588X,Journal,56,7,,2611-2627,,,3,0,,,,,
967,2-s2.0-85019270619,10.1080/08982112.2017.1310230,,,Monitoring the coefficient of variation using a variable parameters chart,ar,Article,Yeong W.,,Universiti Malaya,Kuala Lumpur,Malaysia,,,,,2018-04-03,3 April 2018,Quality Engineering,08982112,13832,15324222,Journal,30,2,,212-235,,,25,0,,,,,
968,2-s2.0-85049626885,10.1109/IRC.2018.00017,,,Efficient decentralized collaborative mapping for outdoor environments,cp,Conference Paper,Contreras L.,,Ecole Centrale de Nantes,Nantes,France,,,,,2018-04-02,2 April 2018,"Proceedings - 2nd IEEE International Conference on Robotic Computing, IRC 2018",,21100867392,,Conference Proceeding,2018-January,,,56-63,,,5,0,repositoryam,Green,,,
969,2-s2.0-85049626167,10.1109/IRC.2018.00018,,,Laser-based control law for autonomous parallel and perpendicular parking,cp,Conference Paper,Pérez-Morales D.,,Ecole Centrale de Nantes,Nantes,France,,,,,2018-04-02,2 April 2018,"Proceedings - 2nd IEEE International Conference on Robotic Computing, IRC 2018",,21100867392,,Conference Proceeding,2018-January,,,64-71,,,7,0,repositoryam,Green,,,
970,2-s2.0-85043372099,10.1002/rnc.4020,,,Delay and state observation for SISO nonlinear systems with input delay,ar,Article,Léchappé V.,,Griffith University,Brisbane,Australia,,,,,2018-04-01,1 April 2018,International Journal of Robust and Nonlinear Control,10498923,17987,10991239,Journal,28,6,,2356-2368,,,11,0,repositoryvor,Green,,,
971,2-s2.0-85042223481,10.1007/s11740-018-0813-4,,,Cutting force model for machining of CFRP laminatewith diamond abrasive cutter,ar,Article,Boudelier A.,,Arts et Metiers Institute of Technology;Université de Nantes,Paris;Nantes,France;France,,,,,2018-04-01,1 April 2018,Production Engineering,09446524,15300154820,18637353,Journal,12,2,,279-287,,,6,0,repositoryam,Green,,,
972,2-s2.0-85042046644,10.1016/j.ijepes.2017.11.005,S0142061517317076,,A flexible design methodology to solve energy management problems,ar,Article,Fauvel C.,,Laboratoire des Sciences du Numérique de Nantes;R&amp;D Department,Nantes;La Garenne-Colombes,France;France,,,,,2018-04-01,April 2018,International Journal of Electrical Power and Energy Systems,01420615,17985,,Journal,97,,,220-232,,,3,0,,,,,
973,2-s2.0-85040865383,10.1002/qre.2260,,,Monitoring compositional data using multivariate exponentially weighted moving average scheme,ar,Article,Tran K.,,Ton-Duc-Thang University,Ho Chi Minh City,Viet Nam,,,,,2018-04-01,April 2018,Quality and Reliability Engineering International,07488017,19123,10991638,Journal,34,3,,391-402,,,17,0,,,,,
974,2-s2.0-85038834743,10.1016/j.ipl.2017.12.005,S0020019017302193,,Sorting signed permutations by reversals using link-cut trees,ar,Article,Rusu I.,,Université de Nantes,Nantes,France,,,,,2018-04-01,April 2018,Information Processing Letters,00200190,14388,,Journal,132,,,44-48,,,0,0,,,,,
975,2-s2.0-85044365764,10.1186/s12859-018-2054-0,,29587628,"A method combining a random forest-based technique with the modeling of linkage disequilibrium through latent variables, to run multilocus genome-wide association studies",ar,Article,Sinoquet C.,,Université de Nantes,Nantes,France,,,,,2018-03-27,27 March 2018,BMC Bioinformatics,,17929,14712105,Journal,19,1,106,,,,5,1,repositoryvor,Green,,,
976,2-s2.0-85050507195,10.1109/ICETSS.2017.8324188,,,Tactile discrimination of fabrics using machine learning techniques,cp,Conference Paper,Khan A.A.,,"Dipartimento di Informatica, Bioingegneria, Robotica e Ingegneria dei Sistemi",Genoa,Italy,,,,,2018-03-23,23 March 2018,"2017 IEEE 3rd International Conference on Engineering Technologies and Social Sciences, ICETSS 2017",,21100869823,,Conference Proceeding,2018-January,,,1-6,,,0,0,,,,,
977,2-s2.0-85044257815,10.1186/s12918-018-0551-4,,29589566,Constraints on signaling network logic reveal functional subgraphs on Multiple Myeloma OMIC data,ar,Article,Miannay B.,,Laboratoire des Sciences du Numérique de Nantes;Universite d'Angers,Nantes;Angers,France;France,,,,,2018-03-21,21 March 2018,BMC Systems Biology,,6700153291,17520509,Journal,12,,32,,,,2,1,repositoryvor,Green,,,
978,2-s2.0-85046248351,10.1109/ITSC.2017.8317683,,,Exciting trajectories for extrinsic calibration of mobile robots with cameras,cp,Conference Paper,Khomutenko B.,,Laboratoire des Sciences du Numérique de Nantes,Nantes,France,,,,,2018-03-14,14 March 2018,"IEEE Conference on Intelligent Transportation Systems, Proceedings, ITSC",,21100858477,,Conference Proceeding,2018-March,,,1-6,,,2,0,repositoryam,Green,,,
979,2-s2.0-85044759799,10.1109/IPTA.2017.8310150,,,Majorization-minimization algorithms for maximum likelihood estimation of magnetic resonance images,cp,Conference Paper,Jiang Q.,,Laboratoire des Sciences du Numérique de Nantes;Beihang University,Nantes;Beijing,France;China,,,,,2018-03-08,8 March 2018,"Proceedings of the 7th International Conference on Image Processing Theory, Tools and Applications, IPTA 2017",,21100870342,,Conference Proceeding,2018-January,,,1-6,,,2,0,repositoryam,Green,,,
980,2-s2.0-85043481702,10.1186/s12859-018-2034-4,,29536824,Discriminate the response of Acute Myeloid Leukemia patients to treatment by using proteomics data and Answer Set Programming,ar,Article,Chebouba L.,,Laboratoire des Sciences du Numérique de Nantes;Université des Sciences et de la Technologie Houari Boumediene,Nantes;Algiers,France;Algeria,,,,,2018-03-08,8 March 2018,BMC Bioinformatics,,17929,14712105,Journal,19,,59,,,,5,1,repositoryvor,Green,,,
981,2-s2.0-85046094937,10.1109/AICCSA.2017.51,,,Customer relationship management and small data - Application of Bayesian network elicitation techniques for building a lead scoring model,cp,Conference Paper,Benhaddou Y.,,Université de Nantes,Nantes,France,,,,,2018-03-07,7 March 2018,"Proceedings of IEEE/ACS International Conference on Computer Systems and Applications, AICCSA",21615322,21100198533,21615330,Conference Proceeding,2017-October,,,251-255,,,2,0,repositoryam,Green,,,
982,2-s2.0-85046093564,10.1109/AICCSA.2017.191,,,Adaptive task mapping and scheduling for reconfigurable distributed embedded energy harvesting systems,cp,Conference Paper,Housseyni W.,,"Laboratoire des Sciences du Numérique de Nantes;University of Carthage, Institut National des Sciences Appliquées et de Technologie",Nantes;Tunis,France;Tunisia,,,,,2018-03-07,7 March 2018,"Proceedings of IEEE/ACS International Conference on Computer Systems and Applications, AICCSA",21615322,21100198533,21615330,Conference Proceeding,2017-October,,,630-636,,,1,0,,,,,
983,2-s2.0-85046089964,10.1109/AICCSA.2017.39,,,Learning probabilistic relational models with (partially structured) graph databases,cp,Conference Paper,El Abri M.,,Institut Supérieur de Gestion de Tunis;Université de Nantes,Le Bardo;Nantes,Tunisia;France,,,,,2018-03-07,7 March 2018,"Proceedings of IEEE/ACS International Conference on Computer Systems and Applications, AICCSA",21615322,21100198533,21615330,Conference Proceeding,2017-October,,,256-263,,,1,0,repositoryam,Green,,,
984,2-s2.0-85049026217,10.1108/COMPEL-05-2017-0201,,,Defect localization and characterization in eddy current nondestructive testing by change detection and global optimization,ar,Article,Kermadi M.,,Université des Sciences et de la Technologie d’Oran Mohamed-Boudiaf,Oran,Algeria,,,,,2018-03-05,5 March 2018,COMPEL - The International Journal for Computation and Mathematics in Electrical and Electronic Engineering,03321649,28454,,Journal,37,2,,948-970,,,3,0,,,,,
985,2-s2.0-85036526449,10.1080/00207543.2017.1394587,,,Optimal due date quoting for a risk-averse decision-maker under CVaR,ar,Article,Tao L.,,Stockholm Business School;Nanjing University of Aeronautics and Astronautics,Stockholm;Nanjing,Sweden;China,,,,,2018-03-04,4 March 2018,International Journal of Production Research,00207543,27656,1366588X,Journal,56,5,,1934-1959,,,5,0,repositoryam,Green,,,
986,2-s2.0-85030658798,10.1080/00423114.2017.1381980,,,Rollover risk prediction of heavy vehicles by reliability index and empirical modelling,ar,Article,Sellami Y.,,Institut Polytechnique des Sciences Avancées,Ivry-sur-Seine,France,,,,,2018-03-04,4 March 2018,Vehicle System Dynamics,00423114,22153,17445159,Journal,56,3,,385-405,,,12,0,,,,,
987,2-s2.0-85046731004,10.1016/j.jda.2018.05.001,S1570866718300844,,Common intervals and permutation reconstruction from MinMax-betweenness constraints,ar,Article,Pelletier L.,,Université de Nantes,Nantes,France,,,,,2018-03-01,March 2018,Journal of Discrete Algorithms,15708667,25607,,Journal,49,,,8-26,,,0,1,publisherfree2read,Bronze,,,
988,2-s2.0-85044856394,10.1016/j.algal.2017.12.011,S2211926417303922,,Identification of transcription factors involved in the phenotype of a domesticated oleaginous microalgae strain of Tisochrysis lutea,ar,Article,Thiriet-Rupert S.,,IFREMER Institut Francais de Recherche pour l'Exploitation de la Mer;Université de Liège,Plouzane;Liege,France;Belgium,,,,,2018-03-01,March 2018,Algal Research,22119264,21100201089,,Journal,30,,,59-72,,,10,1,repositoryvor,Green,,,
989,2-s2.0-85042492431,10.1016/j.tcs.2018.01.012,S030439751830032X,,Sorting permutations and binary strings by length-weighted rearrangements,ar,Article,Lintzmayer C.N.,,Universidade Estadual de Campinas,Campinas,Brazil,,,,,2018-03-01,1 March 2018,Theoretical Computer Science,03043975,20571,,Journal,715,,,35-59,,,1,1,publisherfree2read,Bronze,,,
