,eid,doi,pii,pubmed_id,title,subtype,subtypeDescription,creator,afid,affilname,affiliation_city,affiliation_country,author_count,author_names,author_ids,author_afids,coverDate,coverDisplayDate,publicationName,issn,source_id,eIssn,aggregationType,volume,issueIdentifier,article_number,pageRange,description,authkeywords,citedby_count,openaccess,freetoread,freetoreadLabel,fund_acr,fund_no,fund_sponsor
1459,2-s2.0-85047069588,,,,Préface,ed,Editorial,Minel J.L.,,"Laboratoire Modèles, Dynamiques, Corpus (MoDyCo)",Nanterre,France,,,,,2017-01-01,2017,Revue Traitement Automatique des Langues,12489433,21100202746,19650906,Journal,58,1,,7-11,,,0,0,,,,,
1460,2-s2.0-85045753898,10.26615/978-954-452-049-6-040,,,MappSent: A textual mapping approach for question-to-question similarity,cp,Conference Paper,Hazem A.,,Université de Nantes,Nantes,France,,,,,2017-01-01,2017,"International Conference Recent Advances in Natural Language Processing, RANLP",13138502,21100216911,,Conference Proceeding,2017-September,,,291-300,,,4,0,,,,,
1461,2-s2.0-85042379834,,,,Introduction,ed,Editorial,Richoux F.,,Laboratoire des Sciences du Numérique de Nantes,Nantes,France,,,,,2017-01-01,2017,Revue d'Intelligence Artificielle,0992499X,24847,,Journal,31,3,,247-248,,,0,0,,,,,
1462,2-s2.0-85042087833,10.5220/0006212106450656,,,Combining techniques to verify service-based components,cp,Conference Paper,André P.,,Université de Nantes,Nantes,France,,,,,2017-01-01,2017,MODELSWARD 2017 - Proceedings of the 5th International Conference on Model-Driven Engineering and Software Development,,21100859921,,Conference Proceeding,2017-January,,,645-656,,,4,1,repositoryam,Green,,,
1463,2-s2.0-85041535764,10.2352/ISSN.2470-1173.2017.14.HVEI-124,,,Do gaze disruptions indicate the perceived quality of non-uniformly coded natural scenes?,cp,Conference Paper,Rai Y.,,Université de Nantes,Nantes,France,,,,,2017-01-01,2017,IS and T International Symposium on Electronic Imaging Science and Technology,,21100846961,24701173,Conference Proceeding,,,,104-109,,,4,0,,,,,
1464,2-s2.0-85040917387,,,,VIPE: A new interactive classification framework for large sets of short texts-application to opinion mining,cp,Conference Paper,Siblini W.,,Laboratoire des Sciences du Numérique de Nantes;Orange Labs,Nantes;Issy-les-Moulineaux,France;France,,,,,2017-01-01,2017,"Proceedings of International Conference on Computers and Industrial Engineering, CIE",,21100284931,21648689,Conference Proceeding,,,,,,,0,0,,,,,
1465,2-s2.0-85039460513,10.1007/978-3-319-72905-3_41,,,Modular architectures management with plm for the adaptation of frugal products to regional markets,cp,Conference Paper,Belkadi F.,,Ecole Centrale de Nantes,Nantes,France,,,,,2017-01-01,2017,IFIP Advances in Information and Communication Technology,18684238,19400157163,,Book Series,517,,,462-472,,,5,0,repositoryam,Green,,,
1466,2-s2.0-85038215446,10.1007/978-3-319-71970-2_5,,,Co-clustering for differentially private synthetic data generation,cp,Conference Paper,Benkhelif T.,,Orange Labs;Université de Nantes,Issy-les-Moulineaux;Nantes,France;France,,,,,2017-01-01,2017,Lecture Notes in Computer Science (including subseries Lecture Notes in Artificial Intelligence and Lecture Notes in Bioinformatics),03029743,25674,16113349,Book Series,10708 LNCS,,,36-47,,,1,0,repositoryam,Green,,,
1467,2-s2.0-85038209938,10.1007/978-3-319-71147-8_30,,,On the complexity of robust stable marriage,cp,Conference Paper,Genc B.,,University College Cork,Cork,Ireland,,,,,2017-01-01,2017,Lecture Notes in Computer Science (including subseries Lecture Notes in Artificial Intelligence and Lecture Notes in Bioinformatics),03029743,25674,16113349,Book Series,10628 LNCS,,,441-448,,,3,0,repositoryam,Green,,,
1468,2-s2.0-85035042328,,,,Continuous-grasp revisited,ch,Book Chapter,Martin B.,,Laboratoire des Sciences du Numérique de Nantes,Nantes,France,,,,,2017-01-01,1 January 2017,Mathematical Research Summaries,,21100840001,,Book,2,,,1,,,0,0,,,,,
1469,2-s2.0-85034857252,10.1115/DETC2017-67087,,,Kinematics and workspace analysis of a 3PPPS parallel robot with u-shaped base,cp,Conference Paper,Chablat D.,,Laboratoire des Sciences du Numérique de Nantes,Nantes,France,,,,,2017-01-01,2017,Proceedings of the ASME Design Engineering Technical Conference,,21100839100,,Conference Proceeding,5B-2017,,,,,,8,0,repositoryam,Green,,,
1470,2-s2.0-85034854872,10.1115/DETC2017-67284,,,"Kinematics, workspace and singularity analysis of a multi-mode parallel robot",cp,Conference Paper,Chablat D.,,Laboratoire des Sciences du Numérique de Nantes,Nantes,France,,,,,2017-01-01,2017,Proceedings of the ASME Design Engineering Technical Conference,,21100839100,,Conference Proceeding,5A-2017,,,,,,4,0,repositoryam,Green,,,
1471,2-s2.0-85034817560,10.1115/DETC2017-67441,,,A reconfigurable compliant four-bar mechanism with multiple operation modes,cp,Conference Paper,Nayak A.,,Laboratoire des Sciences du Numérique de Nantes,Nantes,France,,,,,2017-01-01,2017,Proceedings of the ASME Design Engineering Technical Conference,,21100839100,,Conference Proceeding,5A-2017,,,,,,1,0,repositoryam,Green,,,
1472,2-s2.0-85034270686,10.1007/978-3-319-70407-4_33,,,Parallelizing Federated SPARQL Queries in Presence of Replicated Data,cp,Conference Paper,Minier T.,,Université de Nantes,Nantes,France,,,,,2017-01-01,2017,Lecture Notes in Computer Science (including subseries Lecture Notes in Artificial Intelligence and Lecture Notes in Bioinformatics),03029743,25674,16113349,Book Series,10577 LNCS,,,181-196,,,1,0,repositoryam,Green,,,
1473,2-s2.0-85034238959,10.1007/978-3-319-70407-4_35,,,SHARP: Harmonizing and Bridging Cross-Workflow Provenance,cp,Conference Paper,Gaignard A.,,Université de Nantes,Nantes,France,,,,,2017-01-01,2017,Lecture Notes in Computer Science (including subseries Lecture Notes in Artificial Intelligence and Lecture Notes in Bioinformatics),03029743,25674,16113349,Book Series,10577 LNCS,,,219-234,,,4,0,repositoryam,Green,,,
1474,2-s2.0-85034236324,10.1007/978-3-319-70407-4_24,,,Ladda: SPARQL Queries in the Fog of Browsers,cp,Conference Paper,Grall A.,,Université de Nantes,Nantes,France,,,,,2017-01-01,2017,Lecture Notes in Computer Science (including subseries Lecture Notes in Artificial Intelligence and Lecture Notes in Bioinformatics),03029743,25674,16113349,Book Series,10577 LNCS,,,126-131,,,4,0,repositoryam,Green,,,
1475,2-s2.0-85033477472,,,,SWEEP: A streaming web service to deduce basic graph patterns from triple pattern fragments,cp,Conference Paper,Desmontils E.,,Université de Nantes,Nantes,France,,,,,2017-01-01,2017,CEUR Workshop Proceedings,16130073,21100218356,,Conference Proceeding,1963,,,,,,0,0,,,,,
1476,2-s2.0-85033471132,,,,Querying non-RDF datasets using triple patterns,cp,Conference Paper,Moreau B.,,OpenDataSoft,Paris,France,,,,,2017-01-01,2017,CEUR Workshop Proceedings,16130073,21100218356,,Conference Proceeding,1963,,,,,,0,0,,,,,
1477,2-s2.0-85032695594,10.18632/oncotarget.19385,,,"VEGF<inf>121</inf>, is predictor for survival in activated B-cell-like diffuse large B-cell lymphoma and is related to an immune response gene signature conserved in cancers",ar,Article,Broséus J.,,Université de Lorraine;CHU de Nancy,Nancy;Nancy,France;France,,,,,2017-01-01,2017,Oncotarget,,19900191708,19492553,Journal,8,53,,90808-90824,,,3,1,repositoryvor,Green,,,
1478,2-s2.0-85032580181,,,,SHARP: Harmonizing Galaxy and Taverna workflow provenance,cp,Conference Paper,Gaignard A.,,Nantes Academic Hospital,Nantes,France,,,,,2017-01-01,2017,CEUR Workshop Proceedings,16130073,21100218356,,Conference Proceeding,1948,,,80-83,,,1,0,,,,,
1479,2-s2.0-85032568970,,,,SHARP: Harmonizing cross-workflow provenance,cp,Conference Paper,Gaignard A.,,Nantes Academic Hospital,Nantes,France,,,,,2017-01-01,2017,CEUR Workshop Proceedings,16130073,21100218356,,Conference Proceeding,1948,,,50-64,,,1,0,,,,,
1480,2-s2.0-85031902289,10.24963/ijcai.2017/88,,,Finding robust solutions to stable marriage,cp,Conference Paper,Genc B.,,University College Cork,Cork,Ireland,,,,,2017-01-01,2017,IJCAI International Joint Conference on Artificial Intelligence,10450823,19400157504,,Conference Proceeding,0,,,631-637,,,7,1,repositoryam,Green,,,
1481,2-s2.0-85031112460,10.7717/peerj.3860,,,Combining graph and flux-based structures to decipher phenotypic essential metabolites within metabolic networks,ar,Article,Laniau J.,,INRIA Institut National de Recherche en Informatique et en Automatique;CNRS Centre National de la Recherche Scientifique,Le Chesnay;Paris,France;France,,,,,2017-01-01,2017,PeerJ,,21100239256,21678359,Journal,2017,10,e3860,,,,2,1,repositoryam,Green,,,
1482,2-s2.0-85030774921,,,,Semantic web in the fog of browsers,cp,Conference Paper,Molli P.,,Laboratoire des Sciences du Numérique de Nantes,Nantes,France,,,,,2017-01-01,2017,CEUR Workshop Proceedings,16130073,21100218356,,Conference Proceeding,1934,,,,,,0,0,,,,,
1483,2-s2.0-85030694762,10.1007/978-3-319-66854-3_22,,,Mastering heterogeneous behavioural models,cp,Conference Paper,Attiogbé J.C.,,Laboratoire des Sciences du Numérique de Nantes,Nantes,France,,,,,2017-01-01,2017,Lecture Notes in Computer Science (including subseries Lecture Notes in Artificial Intelligence and Lecture Notes in Bioinformatics),03029743,25674,16113349,Book Series,10563 LNCS,,,291-299,,,0,0,repositoryam,Green,,,
1484,2-s2.0-85030530888,10.1016/j.arcontrol.2017.09.011,S1367578817301098,,Modelling human control of steering for the design of advanced driver assistance systems,re,Review,Mars F.,,Ecole Centrale de Nantes,Nantes,France,,,,,2017-01-01,2017,Annual Reviews in Control,13675788,27843,,Journal,44,,,292-302,,,35,0,,,,,
1485,2-s2.0-85030473951,,,,Robust stable marriage,cp,Conference Paper,Genc B.,,University College Cork,Cork,Ireland,,,,,2017-01-01,2017,"31st AAAI Conference on Artificial Intelligence, AAAI 2017",,21100832747,,Conference Proceeding,,,,4925-4926,,,5,0,,,,,
1486,2-s2.0-85030109105,10.1504/IJES.2017.086724,,,A smart mobile cloud environment for modelling and simulation of mobile cloud applications,ar,Article,Gherari M.,,Université Larbi Tébessi - Tébessa,Tebessa,Algeria,,,,,2017-01-01,2017,International Journal of Embedded Systems,17411068,12100157172,17411076,Journal,9,5,,426-443,,,3,0,,,,,
1487,2-s2.0-85030031213,10.1007/978-3-319-66963-2_50,,,A meta-optimization approach for covering problems in facility location,cp,Conference Paper,Crawford B.,,Pontificia Universidad Católica de Valparaíso,Valparaiso,Chile,,,,,2017-01-01,2017,Communications in Computer and Information Science,18650929,17700155007,,Book Series,742,,,565-578,,,25,0,,,,,
1488,2-s2.0-85029773356,10.1016/j.procir.2017.03.243,S2212827117304262,,Investigation of the Evolution of Modal Behavior of HSM Spindle at High Speed,cp,Conference Paper,Rabréau C.,,Université de Nantes,Nantes,France,,,,,2017-01-01,2017,Procedia CIRP,22128271,21100243809,,Conference Proceeding,58,,,405-410,,,4,1,repositoryam,Green,,,
1489,2-s2.0-85029746977,10.1016/j.procir.2017.03.246,S2212827117304298,,Modelling of Robotic Drilling,cp,Conference Paper,Garnier S.,,Laboratoire des Sciences du Numérique de Nantes,Nantes,France,,,,,2017-01-01,2017,Procedia CIRP,22128271,21100243809,,Conference Proceeding,58,,,416-421,,,25,1,publisherfullgold,Gold,,,
1490,2-s2.0-85029664163,,,,A conceptual framework leading to different Dynamic Systems Architectures,cp,Conference Paper,Hartmann C.,,Airbus Helicopters Marignane,Marignane,France,,,,,2017-01-01,2017,Annual Forum Proceedings - AHS International,15522938,4000148004,,Conference Proceeding,,,,2635-2643,,,1,0,,,,,
1491,2-s2.0-85029571950,10.1007/978-3-319-67531-2_23,,,HySIA: Tool for simulating and monitoring hybrid automata based on interval analysis,cp,Conference Paper,Ishii D.,,University of Fukui,Fukui,Japan,,,,,2017-01-01,2017,Lecture Notes in Computer Science (including subseries Lecture Notes in Artificial Intelligence and Lecture Notes in Bioinformatics),03029743,25674,16113349,Book Series,10548 LNCS,,,370-379,,,3,0,repositoryam,Green,,,
1492,2-s2.0-85029539822,10.1007/978-3-319-65765-3_14,,,"Let’s be lazy, we have time: Or, lazy reachability analysis for timed automata",cp,Conference Paper,Jezequel L.,,Université de Nantes,Nantes,France,,,,,2017-01-01,2017,Lecture Notes in Computer Science (including subseries Lecture Notes in Artificial Intelligence and Lecture Notes in Bioinformatics),03029743,25674,16113349,Book Series,10419 LNCS,,,247-263,,,1,0,,,,,
1493,2-s2.0-85029533193,,,,Learning the parameters of possibilistic networks from data: Empirical comparison,cp,Conference Paper,Haddad M.,,Université de Nantes,Nantes,France,,,,,2017-01-01,2017,FLAIRS 2017 - Proceedings of the 30th International Florida Artificial Intelligence Research Society Conference,,21100830700,,Conference Proceeding,,,,736-741,,,2,0,,,,,
1494,2-s2.0-85029498975,10.1007/978-3-319-65765-3_4,,,Optimal reachability in cost time Petri nets,cp,Conference Paper,Boucheneb H.,,Polytechnique Montréal,Montreal,Canada,,,,,2017-01-01,2017,Lecture Notes in Computer Science (including subseries Lecture Notes in Artificial Intelligence and Lecture Notes in Bioinformatics),03029743,25674,16113349,Book Series,10419 LNCS,,,58-73,,,7,0,repositoryam,Green,,,
1495,2-s2.0-85029495525,10.1007/978-3-319-66272-5_14,,,Mojette transform on densest lattices in 2D and 3D,cp,Conference Paper,Ricordel V.,,Université de Nantes,Nantes,France,,,,,2017-01-01,2017,Lecture Notes in Computer Science (including subseries Lecture Notes in Artificial Intelligence and Lecture Notes in Bioinformatics),03029743,25674,16113349,Book Series,10502 LNCS,,,159-170,,,0,0,repositoryam,Green,,,
1496,2-s2.0-85029356697,10.1007/978-3-319-66923-6_56,,,A Dynamic Approach to Multi-stage Job Shop Scheduling in an Industry 4.0-Based Flexible Assembly System,cp,Conference Paper,Ivanov D.,,Hochschule für Wirtschaft und Recht Berlin,Berlin,Germany,,,,,2017-01-01,2017,IFIP Advances in Information and Communication Technology,18684238,19400157163,,Book Series,513,,,475-482,,,12,0,repositoryam,Green,,,
1497,2-s2.0-85028838546,10.1109/ACCESS.2017.2704285,,,Study of Video Quality Assessment for Telesurgery,ar,Article,Leveque L.,,Cardiff University,Cardiff,United Kingdom,,,,,2017-01-01,2017,IEEE Access,,21100374601,21693536,Journal,5,,7927709,9990-9999,,,16,1,repositoryam,Green,,,
1498,2-s2.0-85028731006,10.1007/978-3-319-62932-2_31,,,Probabilistic causal message ordering,cp,Conference Paper,Mostéfaoui A.,,Université de Nantes,Nantes,France,,,,,2017-01-01,2017,Lecture Notes in Computer Science (including subseries Lecture Notes in Artificial Intelligence and Lecture Notes in Bioinformatics),03029743,25674,16113349,Book Series,10421 LNCS,,,315-326,,,3,0,,,,,
1499,2-s2.0-85028726530,10.1007/978-3-319-66158-2_2,,,Generating linear invariants for a conjunction of automata constraints,cp,Conference Paper,Arafailova E.,,Laboratoire des Sciences du Numérique de Nantes,Nantes,France,,,,,2017-01-01,2017,Lecture Notes in Computer Science (including subseries Lecture Notes in Artificial Intelligence and Lecture Notes in Bioinformatics),03029743,25674,16113349,Book Series,10416 LNCS,,,21-37,,,2,0,repositoryam,Green,,,
1500,2-s2.0-85028697736,10.1007/978-3-319-66158-2_3,,,AMONG implied constraints for two families of time-series constraints,cp,Conference Paper,Arafailova E.,,Laboratoire des Sciences du Numérique de Nantes,Nantes,France,,,,,2017-01-01,2017,Lecture Notes in Computer Science (including subseries Lecture Notes in Artificial Intelligence and Lecture Notes in Bioinformatics),03029743,25674,16113349,Book Series,10416 LNCS,,,38-54,,,1,0,repositoryam,Green,,,
1501,2-s2.0-85028670595,10.1007/978-3-319-66335-7_11,,,Reachability in Parametric Interval Markov Chains using constraints,cp,Conference Paper,Bart A.,,IMT Atlantique,Nantes,France,,,,,2017-01-01,2017,Lecture Notes in Computer Science (including subseries Lecture Notes in Artificial Intelligence and Lecture Notes in Bioinformatics),03029743,25674,16113349,Book Series,10503 LNCS,,,173-189,,,4,0,repositoryam,Green,,,
1502,2-s2.0-85028565509,10.1007/978-3-319-66176-6_5,,,WCET analysis by model checking for a processor with dynamic branch prediction,cp,Conference Paper,Mangean A.,,Université de Nantes,Nantes,France,,,,,2017-01-01,2017,Lecture Notes in Computer Science (including subseries Lecture Notes in Artificial Intelligence and Lecture Notes in Bioinformatics),03029743,25674,16113349,Book Series,10466 LNCS,,,64-78,,,0,0,,,,,
1503,2-s2.0-85028460692,10.1007/978-3-319-64468-4_26,,,Co-clustering for microdata anonymization,cp,Conference Paper,Benkhelif T.,,Orange Labs;Université de Nantes,Issy-les-Moulineaux;Nantes,France;France,,,,,2017-01-01,2017,Lecture Notes in Computer Science (including subseries Lecture Notes in Artificial Intelligence and Lecture Notes in Bioinformatics),03029743,25674,16113349,Book Series,10438 LNCS,,,343-351,,,0,0,,,,,
1504,2-s2.0-85027372757,10.1007/978-3-662-55696-2_2,,,Performance analysis of object store systems in a fog and edge computing infrastructure,ch,Book Chapter,Confais B.,,Laboratoire des Sciences du Numérique de Nantes,Nantes,France,,,,,2017-01-01,2017,Lecture Notes in Computer Science (including subseries Lecture Notes in Artificial Intelligence and Lecture Notes in Bioinformatics),03029743,25674,16113349,Book Series,10430,,,40-79,,,17,0,repositoryam,Green,,,
1505,2-s2.0-85026745159,10.1109/TCC.2015.2459710,,,Exploiting renewable sources: When green SLA becomes a possible reality in cloud computing,ar,Article,Hasan M.S.,,INRIA Institut National de Recherche en Informatique et en Automatique,Le Chesnay,France,,,,,2017-01-01,2017,IEEE Transactions on Cloud Computing,,21100338351,21687161,Journal,5,2,,249-262,,,32,0,repositoryam,Green,,,
1506,2-s2.0-85026430080,10.1007/978-3-319-60042-0_21,,,Supervised feature space reduction for multi-label nearest neighbors,cp,Conference Paper,Siblini W.,,Laboratoire des Sciences du Numérique de Nantes;Orange Labs,Nantes;Issy-les-Moulineaux,France;France,,,,,2017-01-01,2017,Lecture Notes in Computer Science (including subseries Lecture Notes in Artificial Intelligence and Lecture Notes in Bioinformatics),03029743,25674,16113349,Book Series,10350 LNCS,,,182-191,,,1,0,repositoryam,Green,,,
1507,2-s2.0-85026401251,,,,Vérification de châýnes de Markov à intervalles paramétrés avec des contraintes,cp,Conference Paper,Bart A.,,Laboratoire des Sciences du Numérique de Nantes,Nantes,France,,,,,2017-01-01,2017,"Treiziemes Journees Francophones de Programmation par Contraintes, JFPC 2017",,21100825265,,Conference Proceeding,,,,137-148,,,0,0,,,,,
1508,2-s2.0-85026320482,10.1007/978-3-319-60045-1_15,,,On the use of WalkSAT based algorithms for MLN inference in some realistic applications,cp,Conference Paper,Rincé R.,,Laboratoire des Sciences du Numérique de Nantes;ONERA Centre de Palaiseau,Nantes;Palaiseau,France;France,,,,,2017-01-01,2017,Lecture Notes in Computer Science (including subseries Lecture Notes in Artificial Intelligence and Lecture Notes in Bioinformatics),03029743,25674,16113349,Book Series,10351 LNCS,,,121-131,,,1,0,repositoryam,Green,,,
1509,2-s2.0-85026305832,10.1007/978-3-319-60045-1_18,,,A probabilistic relational model approach for fault tree modeling,cp,Conference Paper,Kante T.,,Université de Nantes;EDICIA,Nantes;Nantes,France;France,,,,,2017-01-01,2017,Lecture Notes in Computer Science (including subseries Lecture Notes in Artificial Intelligence and Lecture Notes in Bioinformatics),03029743,25674,16113349,Book Series,10351 LNCS,,,154-162,,,1,0,repositoryam,Green,,,
1510,2-s2.0-85025170013,10.1007/978-3-319-58463-8_9,,,Muscle fatigue analysis using opensim,cp,Conference Paper,Chang J.,,Ecole Centrale de Nantes,Nantes,France,,,,,2017-01-01,2017,Lecture Notes in Computer Science (including subseries Lecture Notes in Artificial Intelligence and Lecture Notes in Bioinformatics),03029743,25674,16113349,Book Series,10286 LNCS,,,95-106,,,3,0,repositoryam,Green,,,
1511,2-s2.0-85025169726,,,,Making cloud-based systems elasticity testing reproducible,cp,Conference Paper,Albonico M.,,Laboratoire des Sciences du Numérique de Nantes;Universidade Tecnológica Federal do Paraná,Nantes;Curitiba,France;Brazil,,,,,2017-01-01,2017,CLOSER 2017 - Proceedings of the 7th International Conference on Cloud Computing and Services Science,,21100824413,,Conference Proceeding,,,,495-502,,,3,0,,,,,
1512,2-s2.0-85025155511,10.1007/978-3-319-61482-3_12,,,Model consistency for distributed collaborative modeling,cp,Conference Paper,Sunyé G.,,Université de Nantes,Nantes,France,,,,,2017-01-01,2017,Lecture Notes in Computer Science (including subseries Lecture Notes in Artificial Intelligence and Lecture Notes in Bioinformatics),03029743,25674,16113349,Book Series,10376 LNCS,,,197-212,,,4,0,repositoryam,Green,,,
1513,2-s2.0-85025150220,,,,Peneloop: Parallelizing federated sparql queries in presence of replicated fragments,cp,Conference Paper,Minier T.,,Laboratoire des Sciences du Numérique de Nantes,Nantes,France,,,,,2017-01-01,2017,CEUR Workshop Proceedings,16130073,21100218356,,Conference Proceeding,1870,,,37-50,,,1,0,,,,,
1514,2-s2.0-85025148890,10.1007/978-3-319-61581-3_39,,,Possibilistic MDL: A new possibilistic likelihood based score function for imprecise data,cp,Conference Paper,Haddad M.,,Institut Supérieur de Gestion de Tunis;Université de Nantes,Le Bardo;Nantes,Tunisia;France,,,,,2017-01-01,2017,Lecture Notes in Computer Science (including subseries Lecture Notes in Artificial Intelligence and Lecture Notes in Bioinformatics),03029743,25674,16113349,Book Series,10369 LNAI,,,435-445,,,2,0,,,,,
1515,2-s2.0-85024888037,10.1504/IJITST.2017.087131,,,Design and efficient implementation of a chaos-based stream cipher,ar,Article,Abu Taha M.,,Université de Nantes,Nantes,France,,,,,2017-01-01,2017,International Journal of Internet Technology and Secured Transactions,1748569X,21100242240,17485703,Journal,7,2,,89-114,,,13,0,,,,,
1516,2-s2.0-85024405266,,,,Towards a generic autonomic model to manage cloud services,cp,Conference Paper,Lejeune J.,,Sorbonne Universite,Paris,France,,,,,2017-01-01,2017,CLOSER 2017 - Proceedings of the 7th International Conference on Cloud Computing and Services Science,,21100823381,,Conference Proceeding,,,,147-158,,,7,0,,,,,
1517,2-s2.0-85023773110,10.5220/0006387506610670,,,Towards a self-regulated learning in a lifelong learning perspective,cp,Conference Paper,El Mawas N.,,"Laboratoire des Sciences et Techniques de l'Information, de la Communication et de la Connaissance (Lab-Sticc)",Brest,France,,,,,2017-01-01,2017,CSEDU 2017 - Proceedings of the 9th International Conference on Computer Supported Education,,21100469401,,Conference Proceeding,1,,,661-670,,,3,1,repositoryam,Green,,,
1518,2-s2.0-85021792088,10.1016/j.procir.2017.03.031,S2212827117301750,,Systems Engineering as a Foundation for PSS Development Project: Motivations and Perspectives,cp,Conference Paper,Maleki E.,,Ecole Centrale de Nantes,Nantes,France,,,,,2017-01-01,2017,Procedia CIRP,22128271,21100243809,,Conference Proceeding,64,,,205-210,,,9,1,publisherfullgold,Gold,,,
1519,2-s2.0-85020804195,10.1007/978-3-319-59776-8_2,,,Range-consistent forbidden regions of allen’s relations,cp,Conference Paper,Beldiceanu N.,,Laboratoire des Sciences du Numérique de Nantes,Nantes,France,,,,,2017-01-01,2017,Lecture Notes in Computer Science (including subseries Lecture Notes in Artificial Intelligence and Lecture Notes in Bioinformatics),03029743,25674,16113349,Book Series,10335 LNCS,,,21-29,,,0,0,repositoryam,Green,,,
1520,2-s2.0-85019978565,10.1016/j.procir.2017.01.001,S2212827117300021,,PSS Pattern Concept for Knowledge Representation in Design Process of Industrial Product-service Systems,cp,Conference Paper,Belkadi F.,,Ecole Centrale de Nantes,Nantes,France,,,,,2017-01-01,2017,Procedia CIRP,22128271,21100243809,,Conference Proceeding,60,,,428-433,,,4,1,repositoryvor,Green,,,
1521,2-s2.0-85019568487,10.1007/978-3-319-33581-0_11,,,Comparison study of industrial robots for high-speed machining,ar,Article,Klimchik A.,,Innopolis University,Kazan,Russian Federation,,,,,2017-01-01,2017,Lecture Notes in Mechanical Engineering,21954356,21100431311,21954364,Book Series,,,,135-149,,,8,0,,,,,
1522,2-s2.0-85019560787,10.1007/978-3-319-45781-9_87,,,Applying PLM approach for supporting collaborations in medical sector: Case of prosthesis implantation,ar,Article,Ngo T.,,Ecole Centrale de Nantes,Nantes,France,,,,,2017-01-01,2017,Lecture Notes in Mechanical Engineering,21954356,21100431311,21954364,Book Series,,,,871-878,,,0,0,,,,,
1523,2-s2.0-85019493215,10.1007/978-3-319-45781-9_15,,,Towards a new collaborative framework supporting the design process of industrial product service systems,ar,Article,Maleki E.,,Laboratoire des Sciences du Numérique de Nantes,Nantes,France,,,,,2017-01-01,2017,Lecture Notes in Mechanical Engineering,21954356,21100431311,21954364,Book Series,,,,139-146,,,5,0,,,,,
1524,2-s2.0-85019461054,10.1007/978-3-319-45781-9_33,,,Implementation of a new method for robotic repair operations on composite structures,ar,Article,Paquet E.,,Laboratoire des Sciences du Numérique de Nantes,Nantes,France,,,,,2017-01-01,2017,Lecture Notes in Mechanical Engineering,21954356,21100431311,21954364,Book Series,,,,321-328,,,2,0,repositoryam,Green,,,
1525,2-s2.0-85019369256,10.1016/j.energy.2017.05.087,S0360544217308484,,Experimental assessment of Maximum Power Point Tracking methods for photovoltaic systems,ar,Article,Boukenoui R.,,Université Blida,Blida,Algeria,,,,,2017-01-01,2017,Energy,03605442,29348,,Journal,132,,,324-340,,,33,0,,,,,
1526,2-s2.0-85019145036,10.1016/j.apenergy.2017.05.045,S0306261917305445,,Experimental assessment of new fast MPPT algorithm for PV systems under non-uniform irradiance conditions,ar,Article,Bradai R.,,Université Blida;Polytechnique Montréal,Blida;Montreal,Algeria;Canada,,,,,2017-01-01,2017,Applied Energy,03062619,28801,,Journal,199,,,416-429,,,43,0,,,,,
