,eid,doi,pii,pubmed_id,title,subtype,subtypeDescription,creator,afid,affilname,affiliation_city,affiliation_country,author_count,author_names,author_ids,author_afids,coverDate,coverDisplayDate,publicationName,issn,source_id,eIssn,aggregationType,volume,issueIdentifier,article_number,pageRange,description,authkeywords,citedby_count,openaccess,freetoread,freetoreadLabel,fund_acr,fund_no,fund_sponsor
278,2-s2.0-85041334233,10.1007/978-3-319-71069-3_22,,,Typing quantum superpositions and measurement,cp,Conference Paper,Díaz-Caro A.,,Universidad Nacional de Quilmes,Bernal,Argentina,,,,,2017-01-01,2017,Lecture Notes in Computer Science (including subseries Lecture Notes in Artificial Intelligence and Lecture Notes in Bioinformatics),03029743,25674,16113349,Book Series,10687 LNCS,,,281-293,,,7,0,repositoryam,Green,,,
279,2-s2.0-85040586342,,,,A characterization for decidable separability by piecewise testable languages<sup>∗</sup>,ar,Article,Czerwinski W.,,University of Warsaw,Warsaw,Poland,,,,,2017-01-01,2017,Discrete Mathematics and Theoretical Computer Science,14627264,78470,13658050,Journal,19,4,1,,,,7,0,,,,,
280,2-s2.0-85033445854,10.1007/978-3-319-69904-2_24,,,Alignment-based trace clustering,cp,Conference Paper,Chatain T.,,CNRS Centre National de la Recherche Scientifique,Paris,France,,,,,2017-01-01,2017,Lecture Notes in Computer Science (including subseries Lecture Notes in Artificial Intelligence and Lecture Notes in Bioinformatics),03029743,25674,16113349,Book Series,10650 LNCS,,,295-308,,,16,0,repositoryam,Green,,,
281,2-s2.0-85030675595,10.1007/978-3-319-67471-1_11,,,Temporal reprogramming of boolean networks,cp,Conference Paper,Mandon H.,,CNRS Centre National de la Recherche Scientifique;École Normale Supérieure Paris-Saclay,Paris;Cachan,France;France,,,,,2017-01-01,2017,Lecture Notes in Computer Science (including subseries Lecture Notes in Artificial Intelligence and Lecture Notes in Bioinformatics),03029743,25674,16113349,Book Series,10545 LNBI,,,179-195,,,10,0,repositoryam,Green,,,
282,2-s2.0-85029533157,10.1007/978-3-319-65765-3_1,,,Euler’s method applied to the control of switched systems,cp,Conference Paper,Fribourg L.,,École Normale Supérieure Paris-Saclay,Cachan,France,,,,,2017-01-01,2017,Lecture Notes in Computer Science (including subseries Lecture Notes in Artificial Intelligence and Lecture Notes in Bioinformatics),03029743,25674,16113349,Book Series,10419 LNCS,,,3-21,,,1,0,repositoryam,Green,,,
283,2-s2.0-85029500502,10.1007/978-3-319-65765-3_2,,,On the determinization of timed systems,cp,Conference Paper,Bouyer P.,,École Normale Supérieure Paris-Saclay,Cachan,France,,,,,2017-01-01,2017,Lecture Notes in Computer Science (including subseries Lecture Notes in Artificial Intelligence and Lecture Notes in Bioinformatics),03029743,25674,16113349,Book Series,10419 LNCS,,,25-41,,,5,0,repositoryam,Green,,,
284,2-s2.0-85029427551,10.1007/978-3-319-67089-8_9,,,Distributed control synthesis using Euler’s method,cp,Conference Paper,Le Coënt A.,,Centre Borelli,Gif-sur-Yvette,France,,,,,2017-01-01,2017,Lecture Notes in Computer Science (including subseries Lecture Notes in Artificial Intelligence and Lecture Notes in Bioinformatics),03029743,25674,16113349,Book Series,10506 LNCS,,,118-131,,,4,0,repositoryam,Green,,,
285,2-s2.0-85029409270,10.1007/978-3-319-67089-8_3,,,Space-efficient fragments of higher-order fixpoint logic,cp,Conference Paper,Bruse F.,,Universität Kassel;CNRS Centre National de la Recherche Scientifique,Kassel;Paris,Germany;France,,,,,2017-01-01,2017,Lecture Notes in Computer Science (including subseries Lecture Notes in Artificial Intelligence and Lecture Notes in Bioinformatics),03029743,25674,16113349,Book Series,10506 LNCS,,,26-41,,,3,0,,,,,
286,2-s2.0-85029404956,10.1007/978-3-319-67089-8_1,,,The multiple dimensions of mean-payoff games,cp,Conference Paper,Doyen L.,,École Normale Supérieure Paris-Saclay,Cachan,France,,,,,2017-01-01,2017,Lecture Notes in Computer Science (including subseries Lecture Notes in Artificial Intelligence and Lecture Notes in Bioinformatics),03029743,25674,16113349,Book Series,10506 LNCS,,,1-8,,,0,0,,,,,
287,2-s2.0-85028048926,10.1007/978-3-319-63121-9_11,,,Timed temporal logics,ch,Book Chapter,Bouyer P.,,CNRS Centre National de la Recherche Scientifique,Paris,France,,,,,2017-01-01,2017,Lecture Notes in Computer Science (including subseries Lecture Notes in Artificial Intelligence and Lecture Notes in Bioinformatics),03029743,25674,16113349,Book Series,10460,,,211-230,,,7,0,repositoryam,Green,,,
288,2-s2.0-85028032874,10.1007/978-3-319-63121-9_18,,,The cost of exactness in quantitative reachability,ch,Book Chapter,Chatterjee K.,,Institute of Science and Technology Austria (ISTA),Klosterneuburg,Austria,,,,,2017-01-01,2017,Lecture Notes in Computer Science (including subseries Lecture Notes in Artificial Intelligence and Lecture Notes in Bioinformatics),03029743,25674,16113349,Book Series,10460,,,367-381,,,3,0,,,,,
289,2-s2.0-85026772122,10.1007/978-3-319-63390-9_9,,,Model-checking linear-time properties of parametrized asynchronous shared-memory pushdown systems,cp,Conference Paper,Fortin M.,,École Normale Supérieure Paris-Saclay,Cachan,France,,,,,2017-01-01,2017,Lecture Notes in Computer Science (including subseries Lecture Notes in Artificial Intelligence and Lecture Notes in Bioinformatics),03029743,25674,16113349,Book Series,10427 LNCS,,,155-175,,,7,0,repositoryam,Green,,,
290,2-s2.0-85021221283,10.1007/978-3-319-59536-8_7,,,Aligning modeled and observed behavior: A compromise between computation complexity and quality,cp,Conference Paper,Van Dongen B.,,Technische Universiteit Eindhoven,Eindhoven,Netherlands,,,,,2017-01-01,2017,Lecture Notes in Computer Science (including subseries Lecture Notes in Artificial Intelligence and Lecture Notes in Bioinformatics),03029743,25674,16113349,Book Series,10253 LNCS,,,94-109,,,35,0,repositoryam,Green,,,
291,2-s2.0-85019221070,10.1007/978-3-319-57861-3_13,,,The complexity of diagnosability and opacity verification for Petri nets,cp,Conference Paper,Bérard B.,,École Normale Supérieure Paris-Saclay;Sorbonne Universite,Cachan;Paris,France;France,,,,,2017-01-01,2017,Lecture Notes in Computer Science (including subseries Lecture Notes in Artificial Intelligence and Lecture Notes in Bioinformatics),03029743,25674,16113349,Book Series,10258 LNCS,,,200-220,,,6,0,repositoryam,Green,,,
292,2-s2.0-85015948037,10.1007/978-3-662-54458-7_16,,,Dynamic complexity of the Dyck reachability,cp,Conference Paper,Bouyer P.,,École Normale Supérieure Paris-Saclay,Cachan,France,,,,,2017-01-01,2017,Lecture Notes in Computer Science (including subseries Lecture Notes in Artificial Intelligence and Lecture Notes in Bioinformatics),03029743,25674,16113349,Book Series,10203 LNCS,,,265-280,,,2,0,repositoryam,Green,,,
293,2-s2.0-85015913824,10.1007/978-3-662-54458-7_11,,,Bounding average-energy games,cp,Conference Paper,Bouyer P.,,École Normale Supérieure Paris-Saclay,Cachan,France,,,,,2017-01-01,2017,Lecture Notes in Computer Science (including subseries Lecture Notes in Artificial Intelligence and Lecture Notes in Bioinformatics),03029743,25674,16113349,Book Series,10203 LNCS,,,179-195,,,10,0,repositoryam,Green,,,
294,2-s2.0-85015314014,10.1145/3009837.3009854,,,On the relationship between higher-order recursion schemes and higher-order fixpoint logic,cp,Conference Paper,Kobayashi N.,,The University of Tokyo,Tokyo,Japan,,,,,2017-01-01,1 January 2017,Conference Record of the Annual ACM Symposium on Principles of Programming Languages,07308566,24886,,Conference Proceeding,,,,246-259,,,17,0,repositoryam,Green,,,
295,2-s2.0-85005900972,10.1016/j.jlamp.2016.09.001,S2352220816301080,,"Belief, knowledge, lies and other utterances in an algebra for space and extrusion",ar,Article,Guzman M.,,INRIA Institut National de Recherche en Informatique et en Automatique,Le Chesnay,France,,,,,2017-01-01,1 January 2017,Journal of Logical and Algebraic Methods in Programming,,21100403130,23522216,Journal,86,1,,107-133,,,11,1,repositoryam,Green,,,
296,2-s2.0-84994079366,10.1007/s10817-016-9394-0,,,Preface: Special Issue of Selected Extended Papers of IJCAR 2014,ed,Editorial,Demri S.,,Laboratoire Spécification et Vérification,Gif-sur-Yvette,France,,,,,2017-01-01,1 January 2017,Journal of Automated Reasoning,01687433,24354,15730670,Journal,58,1,,,,,0,1,publisherfree2read,Bronze,,,
297,2-s2.0-84955566741,10.1016/j.tcs.2016.01.015,S0304397516000268,,Preserving differential privacy under finite-precision semantics,ar,Article,Gazeau I.,,Universite Paris-Saclay,Saint-Aubin,France,,,,,2016-12-06,6 December 2016,Theoretical Computer Science,03043975,20571,,Journal,655,,,92-108,,,10,1,repositoryam,Green,,,
298,2-s2.0-85010738765,10.4230/LIPIcs.FSTTCS.2016.20,,,One-counter automata with counter observability,cp,Conference Paper,Bollig B.,,Universite Paris-Saclay,Saint-Aubin,France,,,,,2016-12-01,1 December 2016,"Leibniz International Proceedings in Informatics, LIPIcs",18688969,21100244929,,Conference Proceeding,65,,,20.1-20.14,,,1,0,,,,,
299,2-s2.0-85008978645,10.1145/3013516,,,Nondeterminism and an abstract formulation of Nečiporuk's lower bound method,ar,Article,Beame P.,,University of Washington,Seattle,United States,,,,,2016-12-01,December 2016,ACM Transactions on Computation Theory,19423454,19700166602,19423462,Journal,9,1,5,,,,5,0,repositoryam,Green,,,
300,2-s2.0-85008925699,10.1145/3012283,,,Preserving partial-order runs in parametric time petri nets,ar,Article,André É.,,Institut Galilée,Villetaneuse,France,,,,,2016-12-01,December 2016,ACM Transactions on Embedded Computing Systems,15399087,10300153313,15583465,Journal,16,2,43,,,,1,0,repositoryam,Green,,,
301,2-s2.0-84992709779,10.1007/s00037-014-0089-9,,,The complexity of intersecting finite automata having few final states,ar,Article,Blondin M.,,University of Montreal;École Normale Supérieure Paris-Saclay,Montreal;Cachan,Canada;France,,,,,2016-12-01,1 December 2016,Computational Complexity,10163328,28455,14208954,Journal,25,4,,775-814,,,5,0,,,,,
302,2-s2.0-84991358680,10.1016/j.entcs.2016.09.023,S1571066116300688,,Forecasting Passenger Loads in Transportation Networks,ar,Article,Haar S.,,INRIA Institut National de Recherche en Informatique et en Automatique,Le Chesnay,France,,,,,2016-10-30,30 October 2016,Electronic Notes in Theoretical Computer Science,15710661,20569,,Journal,327,,,49-69,,,6,1,repositoryam,Green,,,
303,2-s2.0-85009895090,10.4204/EPTCS.226.5,,,Stochastic equilibria under imprecise deviations in terminal-reward concurrent games,cp,Conference Paper,Bouyer P.,,Universite Paris-Saclay,Saint-Aubin,France,,,,,2016-09-13,13 September 2016,"Electronic Proceedings in Theoretical Computer Science, EPTCS",20752180,21100244944,,Conference Proceeding,226,,,61-75,,,3,1,repositoryam,Green,,,
304,2-s2.0-85009833713,10.4204/EPTCS.226.15,,,Multi-buffer simulations for trace language inclusion,cp,Conference Paper,Hutagalung M.,,Universität Kassel,Kassel,Germany,,,,,2016-09-13,13 September 2016,"Electronic Proceedings in Theoretical Computer Science, EPTCS",20752180,21100244944,,Conference Proceeding,226,,,213-227,,,4,1,repositoryam,Green,,,
305,2-s2.0-84916899673,10.1017/S0960129514000322,S0960129514000322,,Relating timed and register automata,cp,Conference Paper,Figueira D.,,"University of Warsaw, Institute of Informatics;The University of Edinburgh;École Normale Supérieure Paris-Saclay",Warsaw;Edinburgh;Cachan,Poland;United Kingdom;France,,,,,2016-09-01,1 September 2016,Mathematical Structures in Computer Science,09601295,5000157801,,Journal,26,6,,993-1021,,,8,0,repositoryam,Green,,,
306,2-s2.0-84987615948,10.1109/SP.2016.40,,,A Method for Verifying Privacy-Type Properties: The Unbounded Case,cp,Conference Paper,Hirschi L.,,Universite Paris-Saclay,Saint-Aubin,France,,,,,2016-08-16,16 August 2016,"Proceedings - 2016 IEEE Symposium on Security and Privacy, SP 2016",,21100778649,,Conference Proceeding,,,7546523,564-581,,,20,0,,,,,
307,2-s2.0-85012935591,10.4230/LIPIcs.ICALP.2016.98,,,Computation tree logic for synchronization properties,cp,Conference Paper,Chatterjee K.,,Institute of Science and Technology Austria (ISTA),Klosterneuburg,Austria,,,,,2016-08-01,1 August 2016,"Leibniz International Proceedings in Informatics, LIPIcs",18688969,21100244929,,Conference Proceeding,55,,98,,,,3,0,,,,,
308,2-s2.0-85012930820,10.4230/LIPIcs.ICALP.2016.97,,,Deciding piecewise testable separability for regular tree languages,cp,Conference Paper,Goubault-Larrecq J.,,INRIA Institut National de Recherche en Informatique et en Automatique,Le Chesnay,France,,,,,2016-08-01,1 August 2016,"Leibniz International Proceedings in Informatics, LIPIcs",18688969,21100244929,,Conference Proceeding,55,,97,,,,17,0,,,,,
309,2-s2.0-85012927901,10.4230/LIPIcs.CSL.2016.9,,,The directed homotopy hypothesis,cp,Conference Paper,Dubut J.,,Universite Paris-Saclay;École Normale Supérieure Paris-Saclay,Saint-Aubin;Cachan,France;France,,,,,2016-08-01,1 August 2016,"Leibniz International Proceedings in Informatics, LIPIcs",18688969,21100244929,,Conference Proceeding,62,,,,,,0,0,,,,,
310,2-s2.0-85012925338,10.4230/LIPIcs.CSL.2016.42,,,Infinitary proof theory: The multiplicative additive case,cp,Conference Paper,Baelde D.,,Universite Paris-Saclay,Saint-Aubin,France,,,,,2016-08-01,1 August 2016,"Leibniz International Proceedings in Informatics, LIPIcs",18688969,21100244929,,Conference Proceeding,62,,,,,,21,0,,,,,
311,2-s2.0-85012915932,10.4230/LIPIcs.MFCS.2016.73,,,Undecidability of two-dimensional robot games,cp,Conference Paper,Niskanen R.,,University of Liverpool,Liverpool,United Kingdom,,,,,2016-08-01,1 August 2016,"Leibniz International Proceedings in Informatics, LIPIcs",18688969,21100244929,,Conference Proceeding,58,,73,,,,7,0,,,,,
312,2-s2.0-85012913216,10.4230/LIPIcs.CSL.2016.32,,,A sequent calculus for a modal logic on finite data trees,cp,Conference Paper,Baelde D.,,INRIA Institut National de Recherche en Informatique et en Automatique,Le Chesnay,France,,,,,2016-08-01,1 August 2016,"Leibniz International Proceedings in Informatics, LIPIcs",18688969,21100244929,,Conference Proceeding,62,,,,,,3,0,,,,,
313,2-s2.0-85012905393,10.4230/LIPIcs.ICALP.2016.123,,,The complexity of downward closure comparisons,cp,Conference Paper,Zetzsche G.,,Universite Paris-Saclay,Saint-Aubin,France,,,,,2016-08-01,1 August 2016,"Leibniz International Proceedings in Informatics, LIPIcs",18688969,21100244929,,Conference Proceeding,55,,123,,,,11,0,,,,,
314,2-s2.0-85012901184,10.4230/LIPIcs.CSL.2016.12,,,On the parallel complexity of bisimulation on finite systems,cp,Conference Paper,Ganardi M.,,Universität Siegen,Siegen,Germany,,,,,2016-08-01,1 August 2016,"Leibniz International Proceedings in Informatics, LIPIcs",18688969,21100244929,,Conference Proceeding,62,,,,,,1,0,,,,,
315,2-s2.0-85012896315,10.4230/LIPIcs.CONCUR.2016.27,,,Analyzing timed systems using tree automata,cp,Conference Paper,Akshay S.,,Indian Institute of Technology Bombay,Mumbai,India,,,,,2016-08-01,1 August 2016,"Leibniz International Proceedings in Informatics, LIPIcs",18688969,21100244929,,Conference Proceeding,59,,27,,,,9,0,,,,,
316,2-s2.0-85012895962,10.4230/LIPIcs.CONCUR.2016.37,,,Diagnosis in infinite-state probabilistic systems,cp,Conference Paper,Bertrand N.,,INRIA Institut National de Recherche en Informatique et en Automatique,Le Chesnay,France,,,,,2016-08-01,1 August 2016,"Leibniz International Proceedings in Informatics, LIPIcs",18688969,21100244929,,Conference Proceeding,59,,37,,,,5,0,,,,,
317,2-s2.0-85012893483,10.4230/LIPIcs.MFCS.2016.3,,,Optimal reachability in weighted timed automata and games,cp,Conference Paper,Bouyer-Decitre P.,,Laboratoire Spécification et Vérification,Gif-sur-Yvette,France,,,,,2016-08-01,1 August 2016,"Leibniz International Proceedings in Informatics, LIPIcs",18688969,21100244929,,Conference Proceeding,58,,3,,,,0,0,,,,,
318,2-s2.0-85012892808,10.4230/LIPIcs.ICALP.2016.101,,,Analysing decisive stochastic processes,cp,Conference Paper,Bertrand N.,,INRIA Institut National de Recherche en Informatique et en Automatique,Le Chesnay,France,,,,,2016-08-01,1 August 2016,"Leibniz International Proceedings in Informatics, LIPIcs",18688969,21100244929,,Conference Proceeding,55,,101,,,,3,0,,,,,
319,2-s2.0-85012883056,10.4230/LIPIcs.MFCS.2016.8,,,Stochastic timed games revisited,cp,Conference Paper,Akshay S.,,Indian Institute of Technology Bombay,Mumbai,India,,,,,2016-08-01,1 August 2016,"Leibniz International Proceedings in Informatics, LIPIcs",18688969,21100244929,,Conference Proceeding,58,,8,,,,5,0,,,,,
320,2-s2.0-85012880689,10.4230/LIPIcs.ICALP.2016.106,,,Reachability in networks of register protocols under stochastic schedulers,cp,Conference Paper,Bouyer P.,,Universite Paris-Saclay;Laboratoire Spécification et Vérification,Saint-Aubin;Gif-sur-Yvette,France;France,,,,,2016-08-01,1 August 2016,"Leibniz International Proceedings in Informatics, LIPIcs",18688969,21100244929,,Conference Proceeding,55,,106,,,,8,0,,,,,
321,2-s2.0-85012877040,10.4230/LIPIcs.ICALP.2016.128,,,The taming of the semi-linear set,cp,Conference Paper,Chistikov D.,,University of Oxford;Max Planck Institute for Software Systems,Oxford;Saarbrucken,United Kingdom;Germany,,,,,2016-08-01,1 August 2016,"Leibniz International Proceedings in Informatics, LIPIcs",18688969,21100244929,,Conference Proceeding,55,,128,,,,23,0,,,,,
322,2-s2.0-85012872492,10.4230/LIPIcs.ICALP.2016.105,,,A polynomial-time algorithm for reachability in branching VASS in dimension one,cp,Conference Paper,Göller S.,,Universite Paris-Saclay,Saint-Aubin,France,,,,,2016-08-01,1 August 2016,"Leibniz International Proceedings in Informatics, LIPIcs",18688969,21100244929,,Conference Proceeding,55,,105,,,,8,0,,,,,
323,2-s2.0-85012872324,10.4230/LIPIcs.CSL.2016.37,,,The height of piecewise-testable languages with applications in logical complexity,cp,Conference Paper,Karandikar P.,,Institut de Recherche en Informatique Fondamentale (IRIF),Paris,France,,,,,2016-08-01,1 August 2016,"Leibniz International Proceedings in Informatics, LIPIcs",18688969,21100244929,,Conference Proceeding,62,,,,,,8,0,,,,,
324,2-s2.0-85012872302,10.4230/LIPIcs.CONCUR.2016.28,,,On the expressiveness of QCTL,cp,Conference Paper,David A.,,Universite Paris-Saclay,Saint-Aubin,France,,,,,2016-08-01,1 August 2016,"Leibniz International Proceedings in Informatics, LIPIcs",18688969,21100244929,,Conference Proceeding,59,,28,,,,1,0,,,,,
325,2-s2.0-85012863832,10.4230/LIPIcs.CONCUR.2016.25,,,Bisimulations and unfolding in P-accessible categorical models,cp,Conference Paper,Dubut J.,,Universite Paris-Saclay;École Normale Supérieure Paris-Saclay,Saint-Aubin;Cachan,France;France,,,,,2016-08-01,1 August 2016,"Leibniz International Proceedings in Informatics, LIPIcs",18688969,21100244929,,Conference Proceeding,59,,25,,,,3,0,,,,,
326,2-s2.0-84992065255,10.4204/EPTCS.220.3,,,Two-buffer simulation games,cp,Conference Paper,Hutagalung M.,,Universität Kassel,Kassel,Germany,,,,,2016-07-31,31 July 2016,"Electronic Proceedings in Theoretical Computer Science, EPTCS",20752180,21100244944,,Conference Proceeding,220,,,27-38,,,2,1,repositoryam,Green,,,
327,2-s2.0-84992151455,10.1109/ACC.2016.7525015,,,Predicting traffic load in public transportation networks,cp,Conference Paper,Haar S.,,INRIA Institut National de Recherche en Informatique et en Automatique,Le Chesnay,France,,,,,2016-07-28,28 July 2016,Proceedings of the American Control Conference,07431619,18692,,Conference Proceeding,2016-July,,7525015,821-826,,,0,0,repositoryam,Green,,,
328,2-s2.0-84992302497,10.1016/j.tcs.2016.04.020,S0304397516300597,,Forward analysis and model checking for trace bounded WSTS,ar,Article,Chambart P.,,OCamlPro,Paris,France,,,,,2016-07-18,18 July 2016,Theoretical Computer Science,03043975,20571,,Journal,637,,,1-29,,,3,1,repositoryam,Green,,,
329,2-s2.0-84994663330,10.1145/2933575.2933593,,,The Complexity of Coverability in -Petri Nets,cp,Conference Paper,Lazi R.,,University of Warwick,Coventry,United Kingdom,,,,,2016-07-05,5 July 2016,Proceedings - Symposium on Logic in Computer Science,10436871,25562,,Conference Proceeding,05-08-July-2016,,,467-476,,,10,0,repositoryam,Green,,,
330,2-s2.0-84994643766,10.1145/2933575.2934513,,,Perfect-Information Stochastic Games with Generalized Mean-Payoff Objectives,cp,Conference Paper,Chatterjee K.,,Institute of Science and Technology Austria (ISTA),Klosterneuburg,Austria,,,,,2016-07-05,5 July 2016,Proceedings - Symposium on Logic in Computer Science,10436871,25562,,Conference Proceeding,05-08-July-2016,,,247-256,,,10,0,repositoryam,Green,,,
331,2-s2.0-84994633302,10.1145/2933575.2934552,,,First-order logic with reachability for infinite-state systems,cp,Conference Paper,D'Osualdo E.,,Technische Universität Kaiserslautern,Kaiserslautern,Germany,,,,,2016-07-05,5 July 2016,Proceedings - Symposium on Logic in Computer Science,10436871,25562,,Conference Proceeding,05-08-July-2016,,,457-466,,,6,0,,,,,
332,2-s2.0-84994624545,10.1145/2933575.2933598,,,Towards Completeness via Proof Search in the Linear Time -calculus: The case of Büchi inclusions,cp,Conference Paper,Doumane A.,,CNRS Centre National de la Recherche Scientifique,Paris,France,,,,,2016-07-05,5 July 2016,Proceedings - Symposium on Logic in Computer Science,10436871,25562,,Conference Proceeding,05-08-July-2016,,,377-386,,,5,0,,,,,
333,2-s2.0-84994614060,10.1145/2933575.2934561,,,The complexity of regular abstractions of one-counter languages,cp,Conference Paper,Atig M.F.,,Uppsala Universitet,Uppsala,Sweden,,,,,2016-07-05,5 July 2016,Proceedings - Symposium on Logic in Computer Science,10436871,25562,,Conference Proceeding,05-08-July-2016,,,207-216,,,7,0,repositoryam,Green,,,
334,2-s2.0-84994593427,10.1145/2933575.2934502,,,Games with bound guess actions,cp,Conference Paper,Colcombet T.,,Institut de Recherche en Informatique Fondamentale (IRIF),Paris,France,,,,,2016-07-05,5 July 2016,Proceedings - Symposium on Logic in Computer Science,10436871,25562,,Conference Proceeding,05-08-July-2016,,,257-266,,,3,0,,,,,
335,2-s2.0-84973309288,10.1093/logcom/exv028,,,Temporal logics on strings with prefix relation,ar,Article,Demri S.,,Laboratoire Spécification et Vérification,Gif-sur-Yvette,France,,,,,2016-06-06,6 June 2016,Journal of Logic and Computation,0955792X,25620,1465363X,Journal,26,3,,989-1017,,,2,0,repositoryam,Green,,,
336,2-s2.0-84910068997,10.1007/s10009-014-0353-y,,,Model-based testing for concurrent systems: unfolding-based test selection,ar,Article,Ponce de León H.,,Laboratoire Spécification et Vérification,Gif-sur-Yvette,France,,,,,2016-06-01,1 June 2016,International Journal on Software Tools for Technology Transfer,14332779,19271,14332787,Journal,18,3,,305-318,,,10,0,repositoryam,Green,,,
337,2-s2.0-84966663973,10.1145/2883817.2883822,,,A topological method for finding invariant sets of switched systems,cp,Conference Paper,Fribourg L.,,Universite Paris-Saclay,Saint-Aubin,France,,,,,2016-04-11,11 April 2016,HSCC 2016 - Proceedings of the 19th International Conference on Hybrid Systems: Computation and Control,,21100457361,,Conference Proceeding,,,,61-70,,,2,0,,,,,
338,2-s2.0-85030436340,10.2168/LMCS-12(1:6)2016,,,Simulation problems over one-counter nets,ar,Article,Hofman P.,,Laboratoire Spécification et Vérification,Gif-sur-Yvette,France,,,,,2016-03-14,14 March 2016,Logical Methods in Computer Science,,19700175752,18605974,Journal,12,1,6,,,,6,1,repositoryam,Green,,,
339,2-s2.0-84959924221,10.3233/FI-2016-1313,,,Interrupt Timed Automata with Auxiliary Clocks and Parameters,ar,Article,Bérard B.,,Sorbonne Universite,Paris,France,,,,,2016-03-04,4 March 2016,Fundamenta Informaticae,01692968,28474,,Journal,143,3-4,,235-259,,,3,0,repositoryam,Green,,,
340,2-s2.0-84959921584,10.3233/FI-2016-1316,,,Relating Reachability Problems in Timed and Counter Automata,ar,Article,Haase C.,,Laboratoire Spécification et Vérification,Gif-sur-Yvette,France,,,,,2016-03-04,4 March 2016,Fundamenta Informaticae,01692968,28474,,Journal,143,3-4,,317-338,,,6,0,,,,,
341,2-s2.0-84959868879,10.3233/FI-2016-1320,,,On The Complexity of Counter Reachability Games,ar,Article,Reichert J.,,École Normale Supérieure Paris-Saclay,Cachan,France,,,,,2016-03-04,4 March 2016,Fundamenta Informaticae,01692968,28474,,Journal,143,3-4,,415-436,,,8,0,repositoryam,Green,,,
342,2-s2.0-84991738073,10.4204/EPTCS.204.1,,,Free fall and cellular automata,cp,Conference Paper,Arrighi P.,,Laboratoire d’Informatique et Systèmes,Marseille,France,,,,,2016-03-02,2 March 2016,"Electronic Proceedings in Theoretical Computer Science, EPTCS",20752180,21100244944,,Conference Proceeding,204,,,1-10,,,1,1,repositoryam,Green,,,
343,2-s2.0-84961678089,10.4230/LIPIcs.STACS.2016.1,,,Ideal decompositions for Vector addition systems,cp,Conference Paper,Leroux J.,,Université de Bordeaux,Bordeaux,France,,,,,2016-02-01,1 February 2016,"Leibniz International Proceedings in Informatics, LIPIcs",18688969,21100244929,,Conference Proceeding,47,,1,,,,5,0,,,,,
344,2-s2.0-84961603793,10.4230/LIPIcs.STACS.2016.50,,,"Knapsack in graph groups, HNN-extensions and amalgamated products",cp,Conference Paper,Lohrey M.,,Universität Siegen,Siegen,Germany,,,,,2016-02-01,1 February 2016,"Leibniz International Proceedings in Informatics, LIPIcs",18688969,21100244929,,Conference Proceeding,47,,50,,,,9,0,,,,,
345,2-s2.0-84961575634,10.4230/LIPIcs.STACS.2016.41,,,Tightening the complexity of equivalence problems for commutative grammars,cp,Conference Paper,Haase C.,,Laboratoire Spécification et Vérification,Gif-sur-Yvette,France,,,,,2016-02-01,1 February 2016,"Leibniz International Proceedings in Informatics, LIPIcs",18688969,21100244929,,Conference Proceeding,47,,41,,,,8,0,,,,,
