,eid,doi,pii,pubmed_id,title,subtype,subtypeDescription,creator,afid,affilname,affiliation_city,affiliation_country,author_count,author_names,author_ids,author_afids,coverDate,coverDisplayDate,publicationName,issn,source_id,eIssn,aggregationType,volume,issueIdentifier,article_number,pageRange,description,authkeywords,citedby_count,openaccess,freetoread,freetoreadLabel,fund_acr,fund_no,fund_sponsor
0,2-s2.0-85102389221,10.1109/APSEC51365.2020.00024,,,A coloured petri nets based attack tolerance framework,cp,Conference Paper,Zhou W.,,Universite Paris-Saclay;Jilin University;Ministry of Education China,Saint-Aubin;Changchun;Beijing,France;China;China,,,,,2020-12-01,December 2020,"Proceedings - Asia-Pacific Software Engineering Conference, APSEC",15301362,145296,,Conference Proceeding,2020-December,,9359293,159-168,,,0,0,repositoryam,Green,,,
1,2-s2.0-85101486416,10.4230/LIPIcs.FSTTCS.2020.39,,,Synthesizing safe coalition strategies,cp,Conference Paper,Bertrand N.,,CNRS Centre National de la Recherche Scientifique,Paris,France,,,,,2020-12-01,December 2020,"Leibniz International Proceedings in Informatics, LIPIcs",18688969,21100244929,,Conference Proceeding,182,,39,,,,0,0,,,,,
2,2-s2.0-85093642947,10.1007/s10626-020-00320-2,,,Diagnosis and Degradation Control for Probabilistic Systems,ar,Article,Bertrand N.,,CNRS Centre National de la Recherche Scientifique,Paris,France,,,,,2020-12-01,1 December 2020,Discrete Event Dynamic Systems: Theory and Applications,09246703,28967,15737594,Journal,30,4,,695-723,,,0,0,repositoryam,Green,,,
3,2-s2.0-85091397233,10.1038/s41467-020-18766-1,,32973140,"Publisher Correction: Reconciling qualitative, abstract, and scalable modeling of biological networks (Nature Communications, (2020), 11, 1, (4256), 10.1038/s41467-020-18112-5)",er,Erratum,Paulevé L.,,Laboratoire de Recherche en Informatique;Université de Bordeaux,Gif-sur-Yvette;Bordeaux,France;France,,,,,2020-12-01,1 December 2020,Nature Communications,,19700182758,20411723,Journal,11,1,4900,,,,0,1,publisherfullgold,Gold,,,
4,2-s2.0-85089874072,10.1038/s41467-020-18112-5,,32848126,"Reconciling qualitative, abstract, and scalable modeling of biological networks",ar,Article,Paulevé L.,,Laboratoire de Recherche en Informatique;Université de Bordeaux,Gif-sur-Yvette;Bordeaux,France;France,,,,,2020-12-01,1 December 2020,Nature Communications,,19700182758,20411723,Journal,11,1,4256,,,,14,1,repositoryam,Green,,,
5,2-s2.0-85096162101,10.1145/3372297.3417229,,,Oracle Simulation: A Technique for Protocol Composition with Long Term Shared Secrets,cp,Conference Paper,Comon H.,,INRIA Institut National de Recherche en Informatique et en Automatique,Le Chesnay,France,,,,,2020-10-30,30 October 2020,Proceedings of the ACM Conference on Computer and Communications Security,15437221,110362,,Conference Proceeding,,,,1427-1444,,,1,0,repositoryam,Green,,,
6,2-s2.0-85104140770,10.4230/LIPIcs.DISC.2020.7,,,Distributed computation with continual population growth,cp,Conference Paper,Cho D.J.,,Universität Kassel,Kassel,Germany,,,,,2020-10-01,1 October 2020,"Leibniz International Proceedings in Informatics, LIPIcs",18688969,21100244929,,Conference Proceeding,179,,,,,,0,0,,,,,
7,2-s2.0-85094112225,10.1109/TCAD.2019.2937748,,,A Faithful Binary Circuit Model,ar,Article,Fugger M.,,CNRS Centre National de la Recherche Scientifique,Paris,France,,,,,2020-10-01,October 2020,IEEE Transactions on Computer-Aided Design of Integrated Circuits and Systems,02780070,27724,19374151,Journal,39,10,8818370,2784-2797,,,1,1,repositoryam,Green,,,
8,2-s2.0-85086328767,10.1007/s10485-020-09599-6,,,The Order-Sobrification Monad,ar,Article,Jia X.,,Universite Paris-Saclay,Saint-Aubin,France,,,,,2020-10-01,1 October 2020,Applied Categorical Structures,09272852,28049,15729095,Journal,28,5,,845-852,,,0,0,,,,,
9,2-s2.0-85084214043,10.1109/TCSI.2020.2989552,,,Synchronizer-Free Digital Link Controller,ar,Article,Bund J.,,Max Planck Institute for Informatics;Saarbrücken Graduate School of Computer Science,Saarbrucken;Saarbrucken,Germany;Germany,,,,,2020-10-01,October 2020,IEEE Transactions on Circuits and Systems I: Regular Papers,15498328,11000153733,15580806,Journal,67,10,9085899,3562-3573,,,0,1,repositoryam,Green,,,
10,2-s2.0-85092661368,10.4204/EPTCS.326.10,,,Decisiveness of stochastic systems and its application to hybrid models,cp,Conference Paper,Bouyer P.,,Laboratoire Spécification et Vérification,Gif-sur-Yvette,France,,,,,2020-09-20,20 September 2020,"Electronic Proceedings in Theoretical Computer Science, EPTCS",20752180,21100244944,,Conference Proceeding,326,,,149-165,,,3,1,repositoryam,Green,,,
11,2-s2.0-85092660189,10.4204/EPTCS.326.3,,,Synthesis in presence of dynamic links,cp,Conference Paper,Bérard B.,,Sorbonne Universite,Paris,France,,,,,2020-09-20,20 September 2020,"Electronic Proceedings in Theoretical Computer Science, EPTCS",20752180,21100244944,,Conference Proceeding,326,,,33-49,,,1,1,repositoryam,Green,,,
12,2-s2.0-85082746762,10.1007/s10626-020-00310-4,,,Distributed computation of vector clocks in Petri net unfoldings for test selection,ar,Article,Jezequel L.,,Université de Nantes,Nantes,France,,,,,2020-09-01,1 September 2020,Discrete Event Dynamic Systems: Theory and Applications,09246703,28967,15737594,Journal,30,3,,441-464,,,0,0,,,,,
13,2-s2.0-85091791929,10.3233/FAIA200147,,,Reasoning with a bounded number of resources in atl+,cp,Conference Paper,Belardinelli F.,,Imperial College London,London,United Kingdom,,,,,2020-08-24,24 August 2020,Frontiers in Artificial Intelligence and Applications,09226389,19500157321,,Book Series,325,,,624-631,,,1,0,,,,,
14,2-s2.0-85091769418,10.3233/FAIA200437,,,Reasoning about quality and fuzziness of strategic behaviours,cp,Conference Paper,Bouyer P.,,Universite Paris-Saclay,Saint-Aubin,France,,,,,2020-08-24,24 August 2020,Frontiers in Artificial Intelligence and Applications,09226389,19500157321,,Book Series,325,,,2887-2888,,,0,0,,,,,
15,2-s2.0-85086124685,10.1016/j.topol.2020.107281,S0166864120302248,,Some topological properties of spaces of Lipschitz continuous maps on quasi-metric spaces,ar,Article,Goubault-Larrecq J.,,Universite Paris-Saclay,Saint-Aubin,France,,,,,2020-08-15,15 August 2020,Topology and its Applications,01668641,27416,,Journal,282,,107281,,,,2,1,repositoryam,Green,,,
16,2-s2.0-85080026340,10.1016/j.dam.2020.02.013,S0166218X20300809,,On the radius of nonsplit graphs and information dissemination in dynamic networks,ar,Article,Függer M.,,Universite Paris-Saclay,Saint-Aubin,France,,,,,2020-08-15,15 August 2020,Discrete Applied Mathematics,0166218X,25890,,Journal,282,,,257-264,,,0,1,repositoryam,Green,,,
17,2-s2.0-85091973647,10.4204/EPTCS.320.3,,,From well structured transition systems to program verification,cp,Conference Paper,Finkel A.,,Universite Paris-Saclay,Saint-Aubin,France,,,,,2020-08-07,7 August 2020,"Electronic Proceedings in Theoretical Computer Science, EPTCS",20752180,21100244944,,Conference Proceeding,320,,,44-49,,,0,1,publisherfullgold,Gold,,,
18,2-s2.0-85097326684,10.1017/S0960129520000195,S0960129520000195,,"Forward analysis for WSTS, part I: Completions",ar,Article,Finkel A.,,Universite Paris-Saclay,Saint-Aubin,France,,,,,2020-08-01,August 2020,Mathematical Structures in Computer Science,09601295,5000157801,,Journal,30,7,,752-832,,,0,0,repositoryam,Green,,,
19,2-s2.0-85091601959,10.4230/LIPIcs.CONCUR.2020.24,,,Games where you can play optimally with arena-independent finite memory,cp,Conference Paper,Bouyer P.,,Universite Paris-Saclay,Saint-Aubin,France,,,,,2020-08-01,1 August 2020,"Leibniz International Proceedings in Informatics, LIPIcs",18688969,21100244929,,Conference Proceeding,171,,24,241-2422,,,8,0,,,,,
20,2-s2.0-85091601923,10.4230/LIPIcs.CONCUR.2020.49,,,Bounded reachability problems are decidable in FIFO machines,cp,Conference Paper,Bollig B.,,Universite Paris-Saclay,Saint-Aubin,France,,,,,2020-08-01,1 August 2020,"Leibniz International Proceedings in Informatics, LIPIcs",18688969,21100244929,,Conference Proceeding,171,,49,491-4917,,,3,0,,,,,
21,2-s2.0-85091574784,10.4230/LIPIcs.CONCUR.2020.19,,,Wreath/cascade products and related decomposition results for the concurrent setting of Mazurkiewicz traces,cp,Conference Paper,Adsul B.,,Indian Institute of Technology Bombay,Mumbai,India,,,,,2020-08-01,1 August 2020,"Leibniz International Proceedings in Informatics, LIPIcs",18688969,21100244929,,Conference Proceeding,171,,19,191-1917,,,1,0,,,,,
22,2-s2.0-85091571038,10.4230/LIPIcs.CONCUR.2020.5,,,CONCUR Test-of-time award 2020 announcement,cp,Conference Paper,Aceto L.,,Reykjavik University;Gran,101 Reykjavík;L'Aquila,Iceland;Italy,,,,,2020-08-01,1 August 2020,"Leibniz International Proceedings in Informatics, LIPIcs",18688969,21100244929,,Conference Proceeding,171,,5,51-53,,,1,0,,,,,
23,2-s2.0-85090510762,10.4230/LIPIcs.MFCS.2020.29,,,Register transducers are marble transducers,cp,Conference Paper,Douéneau-Tabot G.,,Université Paris Cité,Paris,France,,,,,2020-08-01,1 August 2020,"Leibniz International Proceedings in Informatics, LIPIcs",18688969,21100244929,,Conference Proceeding,170,,MFCS-2020-29,,,,2,0,,,,,
24,2-s2.0-85073950056,10.1007/s10817-019-09533-z,,,First-Order Automated Reasoning with Theories: When Deduction Modulo Theory Meets Practice,ar,Article,Burel G.,,Universite Paris-Saclay,Saint-Aubin,France,,,,,2020-08-01,1 August 2020,Journal of Automated Reasoning,01687433,24354,15730670,Journal,64,6,,1001-1050,,,4,0,repositoryam,Green,,,
25,2-s2.0-85085953244,10.1145/3373718.3394787,,,Modal Logics with Composition on Finite Forests: Expressivity and Complexity,cp,Conference Paper,Bednarczyk B.,,University of Wroclaw,Wroclaw,Poland,,,,,2020-07-08,8 July 2020,ACM International Conference Proceeding Series,,11600154611,,Conference Proceeding,,,3394787,167-180,,,2,0,repositoryvor,Green,,,
26,2-s2.0-85085939806,10.1145/3373718.3394792,,,A calculus of expandable stores: Continuation-and-environment-passing style translations,cp,Conference Paper,Herbelin H.,,INRIA Institut National de Recherche en Informatique et en Automatique,Le Chesnay,France,,,,,2020-07-08,8 July 2020,ACM International Conference Proceeding Series,,11600154611,,Conference Proceeding,,,3394792,564-577,,,1,0,repositoryam,Green,,,
27,2-s2.0-85085915265,10.1145/3373718.3394746,,,Universal equivalence and majority of probabilistic programs over finite fields,cp,Conference Paper,Barthe G.,,IMDEA Software Institute,Pozuelo de Alarcon,Spain,,,,,2020-07-08,8 July 2020,ACM International Conference Proceeding Series,,11600154611,,Conference Proceeding,,,3394746,155-166,,,1,1,repositoryam,Green,,,
28,2-s2.0-85090471753,10.1109/CSF49147.2020.00020,,,A Method for Proving Unlinkability of Stateful Protocols,cp,Conference Paper,Baelde D.,,Universite Paris-Saclay,Saint-Aubin,France,,,,,2020-06-01,June 2020,Proceedings - IEEE Computer Security Foundations Symposium,19401434,8000153145,,Conference Proceeding,2020-June,,9155091,169-183,,,2,0,repositoryam,Green,,,
29,2-s2.0-85089399083,10.4230/LIPIcs.FSCD.2020.31,,,Encoding Agda programs using rewriting,cp,Conference Paper,Genestier G.,,Universite Paris-Saclay;Mines ParisTech,Saint-Aubin;Paris,France;France,,,,,2020-06-01,1 June 2020,"Leibniz International Proceedings in Informatics, LIPIcs",18688969,21100244929,,Conference Proceeding,167,,31,,,,1,0,,,,,
30,2-s2.0-85089365600,10.4230/LIPIcs.FSCD.2020.13,,,Type safety of rewrite rules in dependent types,cp,Conference Paper,Blanqui F.,,Universite Paris-Saclay;Laboratoire Spécification et Vérification,Saint-Aubin;Gif-sur-Yvette,France;France,,,,,2020-06-01,1 June 2020,"Leibniz International Proceedings in Informatics, LIPIcs",18688969,21100244929,,Conference Proceeding,167,,13,,,,2,0,,,,,
31,2-s2.0-85089361709,10.4230/LIPIcs.FSCD.2020.35,,,The new rewriting engine of Dedukti,cp,Conference Paper,Hondet G.,,Universite Paris-Saclay,Saint-Aubin,France,,,,,2020-06-01,1 June 2020,"Leibniz International Proceedings in Informatics, LIPIcs",18688969,21100244929,,Conference Proceeding,167,,35,,,,3,0,,,,,
32,2-s2.0-85076842323,10.1016/j.ic.2019.104505,S089054011930121X,,On the termination of dynamics in sequential games,ar,Article,Brihaye T.,,Université de Mons,Mons,Belgium,,,,,2020-06-01,June 2020,Information and Computation,08905401,25509,10902651,Journal,272,,104505,,,,1,0,,,,,
33,2-s2.0-85075343021,10.1007/s11334-019-00357-z,,,How to be sure a faulty system does not always appear healthy?: Fault manifestability analysis for discrete event and timed systems,ar,Article,Dague P.,,Universite Paris-Saclay,Saint-Aubin,France,,,,,2020-06-01,1 June 2020,Innovations in Systems and Software Engineering,16145046,300147006,16145054,Journal,16,2,,121-142,,,1,0,repositoryam,Green,,,
34,2-s2.0-85044503356,10.1016/j.tcs.2018.01.010,S0304397518300306,,"Corrigendum to “Inductive-data-type systems” [Theoret. Comput. Sci. 272 (1–2) (2002) 41–68] (Theoretical Computer Science (2002) 272(1–2) (41–68), (S0304397500003479), (10.1016/S0304-3975(00)00347-9))",er,Erratum,Blanqui F.,,Laboratoire Spécification et Vérification,Gif-sur-Yvette,France,,,,,2020-05-12,12 May 2020,Theoretical Computer Science,03043975,20571,,Journal,817,,,81-82,,,3,1,publisherfree2read,Bronze,,,
35,2-s2.0-85091991804,10.1109/ASYNC49171.2020.00013,,,PALS: Plesiochronous and Locally Synchronous Systems,cp,Conference Paper,Bund J.,,Max Planck Institute for Informatics;Saarbrücken Graduate School of Computer Science,Saarbrucken;Saarbrucken,Germany;Germany,,,,,2020-05-01,May 2020,Proceedings - International Symposium on Asynchronous Circuits and Systems,15228681,700147014,,Conference Proceeding,2020-May,,9179361,36-43,,,1,0,repositoryam,Green,,,
36,2-s2.0-85091558511,10.1109/SP40000.2020.00028,,,The last mile: High-assurance and high-speed cryptographic implementations,cp,Conference Paper,Almeida J.B.,,Universidade do Minho,Braga,Portugal,,,,,2020-05-01,May 2020,Proceedings - IEEE Symposium on Security and Privacy,10816011,84156,,Conference Proceeding,2020-May,,9152665,965-982,,,8,1,repositoryam,Green,,,
37,2-s2.0-85085545323,10.1145/3373276,,,Linking Focusing and Resolution with Selection,ar,Article,Burel G.,,"Services répartis, architecture modélisation validation administration de réseaux;Universite Paris-Saclay",Evry;Saint-Aubin,France;France,,,,,2020-05-01,May 2020,ACM Transactions on Computational Logic,15293785,23051,1557945X,Journal,21,3,18,,,,0,0,repositoryam,Green,,,
38,2-s2.0-85077747759,10.1016/j.nahs.2020.100860,S1751570X20300078,,Probabilistic reachability and control synthesis for stochastic switched systems using the tamed Euler method,ar,Article,Le Coënt A.,,Aalborg University,Aalborg,Denmark,,,,,2020-05-01,May 2020,Nonlinear Analysis: Hybrid Systems,1751570X,9000153105,,Journal,36,,100860,,,,0,0,repositoryam,Green,,,
39,2-s2.0-85088030992,10.1007/978-981-15-0081-7_9,,,Digital circuit design for biological and silicon computers,ch,Book Chapter,Függer M.,,Universite Paris-Saclay,Saint-Aubin,France,,,,,2020-04-13,13 April 2020,Advances in Synthetic Biology,,21101017480,,Book,,,,153-171,,,2,0,repositoryam,Green,,,
40,2-s2.0-85077544640,10.1007/s00224-019-09926-y,,,Dependences in Strategy Logic,ar,Article,Gardy P.,,Laboratoire Spécification et Vérification;East China Normal University,Gif-sur-Yvette;Shanghai,France;China,,,,,2020-04-01,1 April 2020,Theory of Computing Systems,14324350,20573,14330490,Journal,64,3,,467-507,,,0,0,repositoryam,Green,,,
41,2-s2.0-85083028751,10.1145/3341105.3374020,,,TRIDEnT: Towards a decentralized threat indicator marketplace,cp,Conference Paper,Alexopoulos N.,,Technische Universität Darmstadt,Darmstadt,Germany,,,,,2020-03-30,30 March 2020,Proceedings of the ACM Symposium on Applied Computing,,89358,,Conference Proceeding,,,,332-341,,,2,0,,,,,
42,2-s2.0-85082127020,10.4230/LIPIcs.STACS.2020.48,,,Observation and distinction. Representing information in infinite games,cp,Conference Paper,Berwanger D.,,Laboratoire Spécification et Vérification,Gif-sur-Yvette,France,,,,,2020-03-01,March 2020,"Leibniz International Proceedings in Informatics, LIPIcs",18688969,21100244929,,Conference Proceeding,154,,LIPIcs-STACS-2020-48,,,,1,0,,,,,
43,2-s2.0-85078304019,10.1007/s11128-019-2555-4,,,A quantum cellular automaton for one-dimensional QED,ar,Article,Arrighi P.,,Aix Marseille Université,Marseille,France,,,,,2020-03-01,1 March 2020,Quantum Information Processing,15700755,24831,15731332,Journal,19,3,88,,,,15,0,repositoryam,Green,,,
44,2-s2.0-85074784879,10.1007/s11047-019-09768-0,,,"Reversible causal graph dynamics: invertibility, block representation, vertex-preservation",ar,Article,Arrighi P.,,Laboratoire d’Informatique et Systèmes;École Normale Supérieure Paris-Saclay,Marseille;Cachan,France;France,,,,,2020-03-01,1 March 2020,Natural Computing,15677818,22206,15729796,Journal,19,1,,157-178,,,0,0,,,,,
45,2-s2.0-85067300273,10.1007/s11047-019-09748-4,,,Concurrency in Boolean networks,ar,Article,Chatain T.,,Universite Paris-Saclay,Saint-Aubin,France,,,,,2020-03-01,1 March 2020,Natural Computing,15677818,22206,15729796,Journal,19,1,,91-109,,,8,0,repositoryam,Green,,,
46,2-s2.0-85064335841,10.1007/s13235-019-00301-7,,,A Semi-Potential for Finite and Infinite Games in Extensive Form,ar,Article,Le Roux S.,,Universite Paris-Saclay,Saint-Aubin,France,,,,,2020-03-01,1 March 2020,Dynamic Games and Applications,21530785,19700177406,21530793,Journal,10,1,,120-144,,,1,1,repositoryvor,Green,,,
47,2-s2.0-85076496834,10.1007/s11128-019-2549-2,,,A quantum walk with both a continuous-time limit and a continuous-spacetime limit,ar,Article,Di Molfetta G.,,Laboratoire d’Informatique et Systèmes,Marseille,France,,,,,2020-02-01,1 February 2020,Quantum Information Processing,15700755,24831,15731332,Journal,19,2,47,,,,14,0,,,,,
48,2-s2.0-85071319315,10.1016/j.jcss.2019.08.003,S0022000019300649,,On decidability and complexity of low-dimensional robot games,ar,Article,Niskanen R.,,University of Oxford,Oxford,United Kingdom,,,,,2020-02-01,February 2020,Journal of Computer and System Sciences,00220000,12370,10902724,Journal,107,,,124-141,,,3,0,repositoryam,Green,,,
49,2-s2.0-85106641469,,,,Parameterised resource-bounded atl,cp,Conference Paper,Alechina N.,,Universiteit Utrecht,Utrecht,Netherlands,,,,,2020-01-01,2020,AAAI 2020 - 34th AAAI Conference on Artificial Intelligence,,21101046626,,Conference Proceeding,,,,7040-7046,,,3,0,,,,,
50,2-s2.0-85106057477,10.1007/978-3-030-30229-0_2,,,On Ordinal Invariants in Well Quasi Orders and Finite Antichain Orders,ch,Book Chapter,Džamonja M.,,University of East Anglia,Norwich,United Kingdom,,,,,2020-01-01,2020,Trends in Logic,15726126,21101045731,22127313,Book Series,53,,,29-54,,,0,0,repositoryam,Green,,,
51,2-s2.0-85101385632,10.1016/j.entcs.2011.02.001,,,Preface,ed,Editorial,Pichardie D.,,Institut de Recherche en Informatique et Systèmes Aléatoires,Rennes,France,,,,,2020-01-01,2020,Lecture Notes in Computer Science (including subseries Lecture Notes in Artificial Intelligence and Lecture Notes in Bioinformatics),03029743,25674,16113349,Book Series,12389 LNCS,,,v-vi,,,0,1,publisherfree2read,Bronze,,,
52,2-s2.0-85101332713,10.1007/978-3-030-66498-5_21,,,Prototype Selection Using Clustering and Conformance Metrics for Process Discovery,cp,Conference Paper,Fani Sani M.,,Rheinisch-Westfälische Technische Hochschule Aachen,Aachen,Germany,,,,,2020-01-01,2020,Lecture Notes in Business Information Processing,18651348,17500155101,18651356,Book Series,397,,,281-294,,,0,0,repositoryam,Green,,,
53,2-s2.0-85097346925,,,,A framework for reasoning about dynamic axioms in description logics,cp,Conference Paper,Bednarczyk B.,,Technische Universität Dresden;University of Wroclaw,Dresden;Wroclaw,Germany;Poland,,,,,2020-01-01,2020,IJCAI International Joint Conference on Artificial Intelligence,10450823,19400157504,,Conference Proceeding,2021-January,,,1681-1687,,,0,0,,,,,
54,2-s2.0-85096069770,,,,Convergence without points,ar,Article,Goubault-Larrecq J.,,Laboratoire Spécification et Vérification,Gif-sur-Yvette,France,,,,,2020-01-01,2020,Houston Journal of Mathematics,03621588,23131,,Journal,46,1,,227-282,,,0,0,,,,,
55,2-s2.0-85095555849,10.1007/978-3-030-30229-0_3,,,The Ideal Approach to Computing Closed Subsets in Well-Quasi-orderings,ch,Book Chapter,Goubault-Larrecq J.,,École Normale Supérieure Paris-Saclay,Cachan,France,,,,,2020-01-01,2020,Trends in Logic,15726126,21101045731,22127313,Book Series,53,,,55-105,,,1,0,repositoryam,Green,,,
56,2-s2.0-85094102917,10.23638/LMCS-16(4:4)2020,,,Verification of flat FIFO machines,ar,Article,Finkel A.,,Universite Paris-Saclay;Institut Universitaire de France,Saint-Aubin;Paris,France;France,,,,,2020-01-01,2020,Logical Methods in Computer Science,,19700175752,18605974,Journal,16,4,,4:1-4:29,,,3,0,,,,,
57,2-s2.0-85093090904,10.1007/978-3-030-60327-4_17,,,Drawing the Line: Basin Boundaries in Safe Petri Nets,cp,Conference Paper,Haar S.,,Universite Paris-Saclay,Saint-Aubin,France,,,,,2020-01-01,2020,Lecture Notes in Computer Science (including subseries Lecture Notes in Artificial Intelligence and Lecture Notes in Bioinformatics),03029743,25674,16113349,Book Series,12314 LNBI,,,321-336,,,0,0,repositoryam,Green,,,
58,2-s2.0-85090178584,10.1007/978-3-030-57628-8_13,,,Guarded Autonomous Transitions Increase Conciseness and Expressiveness of Timed Automata,cp,Conference Paper,Donatelli S.,,Università degli Studi di Torino,Turin,Italy,,,,,2020-01-01,2020,Lecture Notes in Computer Science (including subseries Lecture Notes in Artificial Intelligence and Lecture Notes in Bioinformatics),03029743,25674,16113349,Book Series,12288 LNCS,,,215-230,,,0,0,repositoryam,Green,,,
59,2-s2.0-85088255314,10.1007/978-3-030-51831-8_17,,,Dynamic Recursive Petri Nets,cp,Conference Paper,Haddad S.,,Universite Paris-Saclay,Saint-Aubin,France,,,,,2020-01-01,2020,Lecture Notes in Computer Science (including subseries Lecture Notes in Artificial Intelligence and Lecture Notes in Bioinformatics),03029743,25674,16113349,Book Series,12152 LNCS,,,345-366,,,0,1,repositoryam,Green,,,
60,2-s2.0-85088233110,,,,Preface,ed,Editorial,Janicki R.,,McMaster University,Hamilton,Canada,,,,,2020-01-01,2020,Lecture Notes in Computer Science (including subseries Lecture Notes in Artificial Intelligence and Lecture Notes in Bioinformatics),03029743,25674,16113349,Book Series,12152 LNCS,,,v-vi,,,0,0,,,,,
61,2-s2.0-85088210245,10.1007/978-3-030-51466-2_17,,,Time-Aware Uniformization of Winning Strategies,cp,Conference Paper,Le Roux S.,,Universite Paris-Saclay,Saint-Aubin,France,,,,,2020-01-01,2020,Lecture Notes in Computer Science (including subseries Lecture Notes in Artificial Intelligence and Lecture Notes in Bioinformatics),03029743,25674,16113349,Book Series,12098 LNCS,,,193-204,,,3,1,publisherfree2read,Bronze,,,
62,2-s2.0-85087104598,10.23638/LMCS-16(2:13)2020,,,"Forward analysis for wsts, part iii: Karp-miller trees",ar,Article,Blondin M.,,Université de Sherbrooke,Sherbrooke,Canada,,,,,2020-01-01,2020,Logical Methods in Computer Science,,19700175752,18605974,Journal,16,2,13,1-33,,,1,0,,,,,
63,2-s2.0-85084113421,10.1007/978-3-030-45231-5_13,,,Minimal Coverability Tree Construction Made Complete and Efficient,cp,Conference Paper,Finkel A.,,École Normale Supérieure Paris-Saclay,Cachan,France,,,,,2020-01-01,2020,Lecture Notes in Computer Science (including subseries Lecture Notes in Artificial Intelligence and Lecture Notes in Bioinformatics),03029743,25674,16113349,Book Series,12077 LNCS,,,237-256,,,1,1,repositoryam,Green,,,
64,2-s2.0-85084112912,10.1007/978-3-030-45231-5_24,,,An Auxiliary Logic on Trees: on the Tower-Hardness of Logics Featuring Reachability and Submodel Reasoning,cp,Conference Paper,Mansutti A.,,École Normale Supérieure Paris-Saclay,Cachan,France,,,,,2020-01-01,2020,Lecture Notes in Computer Science (including subseries Lecture Notes in Artificial Intelligence and Lecture Notes in Bioinformatics),03029743,25674,16113349,Book Series,12077 LNCS,,,462-481,,,1,1,repositoryvor,Green,,,
65,2-s2.0-85084112803,10.1007/978-3-030-45231-5_6,,,Parameterized Synthesis for Fragments of First-Order Logic Over Data Words,cp,Conference Paper,Bérard B.,,Sorbonne Universite,Paris,France,,,,,2020-01-01,2020,Lecture Notes in Computer Science (including subseries Lecture Notes in Artificial Intelligence and Lecture Notes in Bioinformatics),03029743,25674,16113349,Book Series,12077 LNCS,,,97-118,,,1,1,repositoryam,Green,,,
66,2-s2.0-85083991430,10.1007/978-3-030-45190-5_11,,,Relational differential dynamic logic,cp,Conference Paper,Kolčák J.,,École Normale Supérieure Paris-Saclay,Cachan,France,,,,,2020-01-01,2020,Lecture Notes in Computer Science (including subseries Lecture Notes in Artificial Intelligence and Lecture Notes in Bioinformatics),03029743,25674,16113349,Book Series,12078 LNCS,,,191-208,,,1,1,repositoryam,Green,,,
67,2-s2.0-85081610679,10.1007/978-3-030-40608-0_11,,,Expressiveness and conciseness of timed automata for the verification of stochastic models,cp,Conference Paper,Donatelli S.,,Università degli Studi di Torino,Turin,Italy,,,,,2020-01-01,2020,Lecture Notes in Computer Science (including subseries Lecture Notes in Artificial Intelligence and Lecture Notes in Bioinformatics),03029743,25674,16113349,Book Series,12038 LNCS,,,170-183,,,3,1,publisherfree2read,Bronze,,,
68,2-s2.0-85081181940,10.1007/978-3-030-41131-2_9,,,Guaranteed Optimal Reachability Control of Reaction-Diffusion Equations Using One-Sided Lipschitz Constants and Model Reduction,cp,Conference Paper,Le Coënt A.,,Aalborg University,Aalborg,Denmark,,,,,2020-01-01,2020,Lecture Notes in Computer Science (including subseries Lecture Notes in Artificial Intelligence and Lecture Notes in Bioinformatics),03029743,25674,16113349,Book Series,11971 LNCS,,,181-202,,,2,0,repositoryam,Green,,,
