,eid,doi,pii,pubmed_id,title,subtype,subtypeDescription,creator,afid,affilname,affiliation_city,affiliation_country,author_count,author_names,author_ids,author_afids,coverDate,coverDisplayDate,publicationName,issn,source_id,eIssn,aggregationType,volume,issueIdentifier,article_number,pageRange,description,authkeywords,citedby_count,openaccess,freetoread,freetoreadLabel,fund_acr,fund_no,fund_sponsor
69,2-s2.0-85078014832,10.4230/LIPIcs.CSL.2020.19,,,Internal calculi for separation logics,cp,Conference Paper,Demri S.,,Universite Paris-Saclay,Saint-Aubin,France,,,,,2020-01-01,January 2020,"Leibniz International Proceedings in Informatics, LIPIcs",18688969,21100244929,,Conference Proceeding,152,,19,,,,2,0,,,,,
70,2-s2.0-85085948811,10.1093/logcom/exz019,,,The power of modal separation logics,ar,Article,Demri S.,,Universite Paris-Saclay,Saint-Aubin,France,,,,,2019-12-31,31 December 2019,Journal of Logic and Computation,0955792X,25620,1465363X,Journal,29,8,,1139-1184,,,6,0,repositoryam,Green,,,
71,2-s2.0-85066267137,10.1016/j.tcs.2019.04.019,S030439751930307X,,Site-directed insertion: Language equations and decision problems,ar,Article,Cho D.J.,,Laboratoire de Recherche en Informatique;CNRS Centre National de la Recherche Scientifique,Gif-sur-Yvette;Paris,France;France,,,,,2019-12-17,17 December 2019,Theoretical Computer Science,03043975,20571,,Journal,798,,,40-51,,,0,0,repositoryam,Green,,,
72,2-s2.0-85081176542,10.1109/CDC40024.2019.9029376,,,Guaranteed Control of Sampled Switched Systems using Semi-Lagrangian Schemes and One-Sided Lipschitz Constants,cp,Conference Paper,Coent A.L.,,Aalborg University,Aalborg,Denmark,,,,,2019-12-01,December 2019,Proceedings of the IEEE Conference on Decision and Control,07431546,87424,25762370,Conference Proceeding,2019-December,,9029376,599-604,,,2,0,repositoryam,Green,,,
73,2-s2.0-85077469292,10.4230/LIPIcs.FSTTCS.2019.41,,,The well structured problem for presburger counter machines,cp,Conference Paper,Finkel A.,,Universite Paris-Saclay,Saint-Aubin,France,,,,,2019-12-01,December 2019,"Leibniz International Proceedings in Informatics, LIPIcs",18688969,21100244929,,Conference Proceeding,150,,41,,,,1,0,,,,,
74,2-s2.0-85077434636,10.4230/LIPIcs.FSTTCS.2019.31,,,Concurrent parameterized games,cp,Conference Paper,Bertrand N.,,CNRS Centre National de la Recherche Scientifique,Paris,France,,,,,2019-12-01,December 2019,"Leibniz International Proceedings in Informatics, LIPIcs",18688969,21100244929,,Conference Proceeding,150,,31,,,,2,0,,,,,
75,2-s2.0-85075903223,10.1016/j.biosystems.2019.104012,S0303264718301102,31757589,Two linearities for quantum computing in the lambda calculus,ar,Article,Díaz-Caro A.,,Universidad Nacional de Quilmes;Consejo Nacional de Investigaciones Científicas y Técnicas,Bernal;Buenos Aires,Argentina;Argentina,,,,,2019-12-01,December 2019,BioSystems,03032647,13794,18728324,Journal,186,,104012,,,,2,0,repositoryam,Green,,,
76,2-s2.0-85074044708,10.1007/s11047-019-09762-6,,,An overview of quantum cellular automata,ar,Article,Arrighi P.,,Aix Marseille Université,Marseille,France,,,,,2019-12-01,1 December 2019,Natural Computing,15677818,22206,15729796,Journal,18,4,,885-899,,,26,0,repositoryam,Green,,,
77,2-s2.0-85071589541,10.1016/j.ic.2019.104441,S0890540119300586,,A tale of two diagnoses in probabilistic systems,ar,Article,Bertrand N.,,INRIA Institut National de Recherche en Informatique et en Automatique,Le Chesnay,France,,,,,2019-12-01,December 2019,Information and Computation,08905401,25509,10902651,Journal,269,,104441,,,,4,1,repositoryam,Green,,,
78,2-s2.0-85068481402,10.1016/j.tcs.2019.06.018,S0304397519304050,,Bound-decreasing duplication system,ar,Article,Cho D.J.,,Laboratoire de Recherche en Informatique;Laboratoire Spécification et Vérification,Gif-sur-Yvette;Gif-sur-Yvette,France;France,,,,,2019-11-12,12 November 2019,Theoretical Computer Science,03043975,20571,,Journal,793,,,152-168,,,2,0,,,,,
79,2-s2.0-85078889649,10.23638/LMCS-15(4:15)2019,,,On functions weakly computable by pushdown petri nets and related systems,ar,Article,Leroux J.,,Université de Bordeaux,Bordeaux,France,,,,,2019-10-01,October 2019,Logical Methods in Computer Science,,19700175752,18605974,Journal,15,4,,15:1-15:26,,,1,0,,,,,
80,2-s2.0-85078703604,10.23638/LMCS-15(4:10)2019,,,Computing the width of non-deterministic automata,ar,Article,Kuperberg D.,,Laboratoire de l'Informatique du Parallélisme,Lyon,France,,,,,2019-10-01,October 2019,Logical Methods in Computer Science,,19700175752,18605974,Journal,15,4,,10:1-10:31,,,4,0,,,,,
81,2-s2.0-85073564398,10.4230/LIPIcs.TIME.2019.3,,,On the computation of Nash equilibria in games on graphs,cp,Conference Paper,Bouyer P.,,Universite Paris-Saclay,Saint-Aubin,France,,,,,2019-10-01,October 2019,"Leibniz International Proceedings in Informatics, LIPIcs",18688969,21100244929,,Conference Proceeding,147,,,31-33,,,0,0,,,,,
82,2-s2.0-85067867636,10.1109/LCSYS.2019.2921616,,,A Symbolic Approach to the Self-Triggered Design for Networked Control Systems,ar,Article,Hashimoto K.,,Osaka University,Suita,Japan,,,,,2019-10-01,October 2019,IEEE Control Systems Letters,,21100885366,24751456,Journal,3,4,8733077,1050-1055,,,3,0,repositoryam,Green,,,
83,2-s2.0-85073183892,10.1109/TCBB.2019.2914383,,31056515,Algorithms for the sequential reprogramming of boolean networks,ar,Article,Mandon H.,,Universite Paris-Saclay,Saint-Aubin,France,,,,,2019-09-01,September 2019,IEEE/ACM Transactions on Computational Biology and Bioinformatics,15455963,17971,15579964,Journal,16,5,3370701,1610-1619,,,7,0,repositoryam,Green,,,
84,2-s2.0-85072520712,10.1145/3343507,,,Typing messages for free in security protocols,ar,Article,Chrétien R.,,École Normale Supérieure Paris-Saclay,Cachan,France,,,,,2019-09-01,September 2019,ACM Transactions on Computational Logic,15293785,23051,1557945X,Journal,21,1,1,,,,2,1,repositoryam,Green,,,
85,2-s2.0-85045635220,10.1017/S0960129518000063,S0960129518000063,,A semantics for nabla,ar,Article,Goubault-Larrecq J.,,École Normale Supérieure Paris-Saclay,Cachan,France,,,,,2019-09-01,1 September 2019,Mathematical Structures in Computer Science,09601295,5000157801,,Journal,29,8,,1250-1274,,,0,0,,,,,
86,2-s2.0-85072194197,10.4204/EPTCS.301.5,,,EKSTRAKTO A tool to reconstruct Dedukti proofs from TSTP files (extended abstract),cp,Conference Paper,El Haddad M.Y.,,Universite Paris-Saclay;CNRS Centre National de la Recherche Scientifique,Saint-Aubin;Paris,France;France,,,,,2019-08-23,23 August 2019,"Electronic Proceedings in Theoretical Computer Science, EPTCS",20752180,21100244944,,Conference Proceeding,301,,,27-35,,,1,1,repositoryam,Green,,,
87,2-s2.0-85067878464,10.1016/j.topol.2019.06.044,S0166864119302160,,Formal ball monads,ar,Article,Goubault-Larrecq J.,,École Normale Supérieure Paris-Saclay,Cachan,France,,,,,2019-08-15,15 August 2019,Topology and its Applications,01668641,27416,,Journal,263,,,372-391,,,4,1,repositoryvor,Green,,,
88,2-s2.0-85074926708,10.1109/DSD.2019.00047,,,LAOCOÖN: A Run-Time Monitoring and Verification Approach for Hardware Trojan Detection,cp,Conference Paper,Danger J.L.,,Institut Polytechnique de Paris,Palaiseau,France,,,,,2019-08-01,August 2019,"Proceedings - Euromicro Conference on Digital System Design, DSD 2019",,21100935209,,Conference Proceeding,,,8875250,269-276,,,2,0,,,,,
89,2-s2.0-85071777401,10.4230/LIPIcs.MFCS.2019.76,,,Aperiodic weighted automata and weighted first-order logic,cp,Conference Paper,Droste M.,,Universität Leipzig,Leipzig,Germany,,,,,2019-08-01,August 2019,"Leibniz International Proceedings in Informatics, LIPIcs",18688969,21100244929,,Conference Proceeding,138,,76,,,,4,0,,,,,
90,2-s2.0-85071774695,10.4230/LIPIcs.MFCS.2019.9,,,Nash equilibria in games over graphs equipped with a communication mechanism,cp,Conference Paper,Bouyer P.,,Universite Paris-Saclay,Saint-Aubin,France,,,,,2019-08-01,August 2019,"Leibniz International Proceedings in Informatics, LIPIcs",18688969,21100244929,,Conference Proceeding,138,,9,,,,1,0,,,,,
91,2-s2.0-85071630617,10.4230/LIPIcs.CONCUR.2019.12,,,Verification of flat FIFO systems,cp,Conference Paper,Finkel A.,,"ReLaX, Research Lab in Computer Science;Universite Paris-Saclay",Siruseri;Saint-Aubin,India;France,,,,,2019-08-01,August 2019,"Leibniz International Proceedings in Informatics, LIPIcs",18688969,21100244929,,Conference Proceeding,140,,12,,,,3,0,,,,,
92,2-s2.0-85071623914,10.4230/LIPIcs.CONCUR.2019.32,,,Reconfiguration and message losses in parameterized broadcast networks,cp,Conference Paper,Bertrand N.,,CNRS Centre National de la Recherche Scientifique,Paris,France,,,,,2019-08-01,August 2019,"Leibniz International Proceedings in Informatics, LIPIcs",18688969,21100244929,,Conference Proceeding,140,,32,,,,3,0,,,,,
93,2-s2.0-85073875423,10.1109/PATMOS.2019.8862165,,,The Involution Tool for Accurate Digital Timingand Power Analysis,cp,Conference Paper,Öhlinger D.,,Technische Universität Wien,Vienna,Austria,,,,,2019-07-01,July 2019,"2019 IEEE 29th International Symposium on Power and Timing Modeling, Optimization and Simulation, PATMOS 2019",,21100933699,,Conference Proceeding,,,8862165,1-8,,,1,0,repositoryam,Green,,,
94,2-s2.0-85069222103,10.4230/LIPIcs.ICALP.2019.129,,,The parametric complexity of lossy counter machines,cp,Conference Paper,Schmitz S.,,Universite Paris-Saclay,Saint-Aubin,France,,,,,2019-07-01,1 July 2019,"Leibniz International Proceedings in Informatics, LIPIcs",18688969,21100244929,,Conference Proceeding,132,,129,,,,3,0,,,,,
95,2-s2.0-85069167752,10.4230/LIPIcs.ICALP.2019.116,,,FO = FO<sup>3</sup> for linear orders with monotone binary relations,cp,Conference Paper,Fortin M.,,Universite Paris-Saclay,Saint-Aubin,France,,,,,2019-07-01,1 July 2019,"Leibniz International Proceedings in Informatics, LIPIcs",18688969,21100244929,,Conference Proceeding,132,,116,,,,1,0,,,,,
96,2-s2.0-85073052905,10.1109/ACSD.2019.00006,,,Parametric schedulability analysis of a launcher flight control system under reactivity constraints,cp,Conference Paper,Andre E.,,Research Organization of Information and Systems National Institute of Informatics;University Sorbonne Paris Nord,Tokyo;Villetaneuse,Japan;France,,,,,2019-06-01,June 2019,"Proceedings - International Conference on Application of Concurrency to System Design, ACSD",15504808,11700154632,,Conference Proceeding,2019-June,,8843623,13-22,,,1,0,repositoryam,Green,,,
97,2-s2.0-85072615516,10.1109/CSF.2019.00011,,,Decidability of a sound set of inference rules for computational indistinguishability,cp,Conference Paper,Koutsos A.,,École Normale Supérieure Paris-Saclay,Cachan,France,,,,,2019-06-01,June 2019,Proceedings - IEEE Computer Security Foundations Symposium,19401434,8000153145,,Conference Proceeding,2019-June,,8823745,48-61,,,1,1,repositoryam,Green,,,
98,2-s2.0-85072602783,10.1109/CSF.2019.00017,,,Symbolic methods in computational cryptography proofs,cp,Conference Paper,Barthe G.,,IMDEA Software Institute,Pozuelo de Alarcon,Spain,,,,,2019-06-01,June 2019,Proceedings - IEEE Computer Security Foundations Symposium,19401434,8000153145,,Conference Proceeding,2019-June,,8823706,136-151,,,3,1,repositoryam,Green,,,
99,2-s2.0-85072038125,10.1109/EuroSP.2019.00041,,,The 5G-AKA authentication protocol privacy,cp,Conference Paper,Koutsos A.,,École Normale Supérieure Paris-Saclay,Cachan,France,,,,,2019-06-01,June 2019,"Proceedings - 4th IEEE European Symposium on Security and Privacy, EURO S and P 2019",,21100928210,,Conference Proceeding,,,8806761,464-479,,,32,1,repositoryam,Green,,,
100,2-s2.0-85071546243,10.23919/ECC.2019.8796232,,,Safety controller design for incrementally stable switched systems using event-based symbolic models,cp,Conference Paper,Kader Z.,,CNRS Centre National de la Recherche Scientifique,Paris,France,,,,,2019-06-01,June 2019,"2019 18th European Control Conference, ECC 2019",,21100926603,,Conference Proceeding,,,8796232,1269-1274,,,2,0,repositoryam,Green,,,
101,2-s2.0-85071535440,10.23919/ECC.2019.8796095,,,A symbolic approach to voltage stability and power sharing in time-varying dc microgrids,cp,Conference Paper,Zonetti D.,,Laboratoire Spécification et Vérification,Gif-sur-Yvette,France,,,,,2019-06-01,June 2019,"2019 18th European Control Conference, ECC 2019",,21100926603,,Conference Proceeding,,,8796095,903-909,,,7,0,repositoryam,Green,,,
102,2-s2.0-85070783292,10.1109/LICS.2019.8785706,,,Graph planning with expected finite horizon,cp,Conference Paper,Chatterjee K.,,Institute of Science and Technology Austria (ISTA),Klosterneuburg,Austria,,,,,2019-06-01,June 2019,Proceedings - Symposium on Logic in Computer Science,10436871,25562,,Conference Proceeding,2019-June,,8785706,,,,1,0,repositoryam,Green,,,
103,2-s2.0-85070779129,10.1109/LICS.2019.8785684,,,Timed systems through the lens of logic,cp,Conference Paper,Akshay S.,,Indian Institute of Technology Bombay,Mumbai,India,,,,,2019-06-01,June 2019,Proceedings - Symposium on Logic in Computer Science,10436871,25562,,Conference Proceeding,2019-June,,8785684,,,,3,0,repositoryam,Green,,,
104,2-s2.0-85070768456,10.1109/LICS.2019.8785809,,,A probabilistic and non-deterministic call-by-push-value language,cp,Conference Paper,Goubault-Larrecq J.,,Universite Paris-Saclay,Saint-Aubin,France,,,,,2019-06-01,June 2019,Proceedings - Symposium on Logic in Computer Science,10436871,25562,,Conference Proceeding,2019-June,,8785809,,,,5,0,repositoryam,Green,,,
105,2-s2.0-85070745829,10.1109/LICS.2019.8785656,,,Why propositional quantification makes modal logics on trees robustly hard?,cp,Conference Paper,Bednarczyk B.,,University of Wroclaw,Wroclaw,Poland,,,,,2019-06-01,June 2019,Proceedings - Symposium on Logic in Computer Science,10436871,25562,,Conference Proceeding,2019-June,,8785656,,,,4,0,repositoryam,Green,,,
106,2-s2.0-85069213525,10.1109/LICS.2019.8785848,,,Bisimulation equivalence of first-order grammars is ACKERMANN-Complete,cp,Conference Paper,Jancar P.,,Univerzita Palackého v Olomouci,Olomouc,Czech Republic,,,,,2019-06-01,June 2019,Proceedings - Symposium on Logic in Computer Science,10436871,25562,,Conference Proceeding,2019-June,,8785848,,,,6,0,repositoryam,Green,,,
107,2-s2.0-85068782807,10.1109/LICS.2019.8785796,,,Reachability in vector addition systems is primitive-recursive in fixed dimension,cp,Conference Paper,Leroux J.,,Université de Bordeaux,Bordeaux,France,,,,,2019-06-01,June 2019,Proceedings - Symposium on Logic in Computer Science,10436871,25562,,Conference Proceeding,2019-June,,8785796,,,,26,0,repositoryam,Green,,,
108,2-s2.0-85068087371,10.4230/LIPIcs.FSCD.2019.9,,,Dependency pairs termination in dependent type theory modulo rewriting,cp,Conference Paper,Blanqui F.,,Universite Paris-Saclay;INRIA Institut National de Recherche en Informatique et en Automatique,Saint-Aubin;Le Chesnay,France;France,,,,,2019-06-01,1 June 2019,"Leibniz International Proceedings in Informatics, LIPIcs",18688969,21100244929,,Conference Proceeding,131,,9,,,,1,0,,,,,
109,2-s2.0-85068085804,10.4230/LIPIcs.FSCD.2019.14,,,Proof normalisation in a logic identifying isomorphic propositions,cp,Conference Paper,Díaz-Caro A.,,Universidad Nacional de Quilmes;Universidad de Buenos Aires;Autónoma de Buenos,Bernal;Buenos Aires;,Argentina;Argentina;Argentina,,,,,2019-06-01,1 June 2019,"Leibniz International Proceedings in Informatics, LIPIcs",18688969,21100244929,,Conference Proceeding,131,,14,,,,3,0,,,,,
110,2-s2.0-85060055476,10.1142/S0219061319500041,,,Connected choice and the Brouwer fixed point theorem,ar,Article,Brattka V.,,Universität der Bundeswehr München;University of Cape Town,Neubiberg;Cape Town,Germany;South Africa,,,,,2019-06-01,1 June 2019,Journal of Mathematical Logic,02190613,12000154480,,Journal,19,1,1950004,,,,6,0,repositoryam,Green,,,
111,2-s2.0-85073340424,10.1109/ASYNC.2019.00019,,,Transistor-level analysis of dynamic delay models,cp,Conference Paper,Maier J.,,Technische Universität Wien,Vienna,Austria,,,,,2019-05-01,May 2019,Proceedings - International Symposium on Asynchronous Circuits and Systems,15228681,700147014,,Conference Proceeding,2019-May,,8850670,76-85,,,0,0,repositoryam,Green,,,
112,2-s2.0-85049004467,10.1016/j.tcs.2018.03.009,S0304397518301701,,Parameter space abstraction and unfolding semantics of discrete regulatory networks,ar,Article,Kolčák J.,,Masaryk University;École Normale Supérieure Paris-Saclay,Brno;Cachan,Czech Republic;France,,,,,2019-04-18,18 April 2019,Theoretical Computer Science,03043975,20571,,Journal,765,,,120-144,,,3,1,repositoryam,Green,,,
113,2-s2.0-85064980218,10.1145/3302504.3313362,,,Relational differential dynamic logic: Poster abstract,cp,Conference Paper,Kolčák J.,,Universite Paris-Saclay;Research Organization of Information and Systems National Institute of Informatics,Saint-Aubin;Tokyo,France;Japan,,,,,2019-04-16,16 April 2019,HSCC 2019 - Proceedings of the 2019 22nd ACM International Conference on Hybrid Systems: Computation and Control,,21100904767,,Conference Proceeding,,,,284-285,,,0,0,repositoryam,Green,,,
114,2-s2.0-85054459552,10.1016/j.jcss.2018.09.004,S0022000018308468,,The complexity of synchronizing Markov decision processes,ar,Article,Doyen L.,,Laboratoire Spécification et Vérification,Gif-sur-Yvette,France,,,,,2019-03-01,March 2019,Journal of Computer and System Sciences,00220000,12370,10902724,Journal,100,,,96-129,,,4,0,repositoryam,Green,,,
115,2-s2.0-85061541701,10.1109/FAS-W.2018.00009,,,ECAS 2018 Foreword: 3rd Workshop on Engineering Collective Adaptive Systems,ed,Editorial,Cabri G.,,Università degli Studi di Modena e Reggio Emilia,Modena,Italy,,,,,2019-01-02,2 January 2019,"Proceedings - 2018 IEEE 3rd International Workshops on Foundations and Applications of Self* Systems, FAS*W 2018",,21100898503,,Conference Proceeding,,,8599156,XVII-XVIII,,,0,1,publisherfree2read,Bronze,,,
116,2-s2.0-85091992592,,,,SMTCoq: Expressive and extensible automation in Coq,cp,Conference Paper,Blot V.,,Institut de Recherche en Informatique Fondamentale (IRIF);Laboratoire de Recherche en Informatique;Universite Paris-Saclay,Paris;Gif-sur-Yvette;Saint-Aubin,France;France;France,,,,,2019-01-01,2019,JFLA 2019 - Journees Francophones des Langages Applicatifs,,21101022806,,Conference Proceeding,,,,77-92,,,0,0,,,,,
117,2-s2.0-85084243074,,,,Spaces with no infinite discrete subspace,ar,Article,Goubault-Larrecq J.,,Universite Paris-Saclay,Saint-Aubin,France,,,,,2019-01-01,2019,Topology Proceedings,01464124,19900191943,23311290,Journal,53,,,27-36,,,1,0,,,,,
118,2-s2.0-85082687007,10.1016/j.ifacol.2019.12.148,S2405896319319986,,Decentralized monotonicity-based voltage control of DC microgrids with ZIP loads,cp,Conference Paper,Zonetti D.,,CNRS Centre National de la Recherche Scientifique,Paris,France,,,,,2019-01-01,2019,IFAC-PapersOnLine,,21100456158,24058963,Conference Proceeding,52,20,,139-144,,,3,1,repositoryam,Green,,,
119,2-s2.0-85078535878,10.1007/978-3-030-37453-2_14,,,Encoding Conformance Checking Artefacts in SAT,cp,Conference Paper,Boltenhagen M.,,École Normale Supérieure Paris-Saclay,Cachan,France,,,,,2019-01-01,2019,Lecture Notes in Business Information Processing,18651348,17500155101,18651356,Book Series,362 LNBIP,,,160-171,,,3,0,repositoryam,Green,,,
120,2-s2.0-85077117990,10.1007/978-3-030-29026-9_10,,,A Hypersequent Calculus with Clusters for Data Logic over Ordinals,cp,Conference Paper,Lick A.,,École Normale Supérieure Paris-Saclay,Cachan,France,,,,,2019-01-01,2019,Lecture Notes in Computer Science (including subseries Lecture Notes in Artificial Intelligence and Lecture Notes in Bioinformatics),03029743,25674,16113349,Book Series,11714 LNAI,,,166-184,,,1,0,repositoryam,Green,,,
121,2-s2.0-85077035247,,,,Resource-bounded ATL: The quest for tractable fragments,cp,Conference Paper,Belardinelli F.,,Universite d' Evry Val d'Essonne;Imperial College London,Evry;London,France;United Kingdom,,,,,2019-01-01,2019,"Proceedings of the International Joint Conference on Autonomous Agents and Multiagent Systems, AAMAS",15488403,21100310020,15582914,Conference Proceeding,1,,,206-214,,,3,0,,,,,
122,2-s2.0-85076488855,10.1007/978-3-662-60651-3_1,,,A Tour in Process Mining: From Practice to Algorithmic Challenges,cp,Conference Paper,van der Aalst W.,,Rheinisch-Westfälische Technische Hochschule Aachen,Aachen,Germany,,,,,2019-01-01,2019,Lecture Notes in Computer Science (including subseries Lecture Notes in Artificial Intelligence and Lecture Notes in Bioinformatics),03029743,25674,16113349,Book Series,11790 LNCS,,,1-35,,,0,0,repositoryam,Green,,,
123,2-s2.0-85075240358,10.1007/978-3-030-31304-3_1,,,Sequential Reprogramming of Boolean Networks Made Practical,cp,Conference Paper,Mandon H.,,École Normale Supérieure Paris-Saclay,Cachan,France,,,,,2019-01-01,2019,Lecture Notes in Computer Science (including subseries Lecture Notes in Artificial Intelligence and Lecture Notes in Bioinformatics),03029743,25674,16113349,Book Series,11773 LNBI,,,3-19,,,10,0,repositoryam,Green,,,
124,2-s2.0-85075164958,10.1016/j.entcs.2019.07.015,S1571066119300349,,Algebras of the Extended Probabilistic Powerdomain Monad,cp,Conference Paper,Goubault-Larrecq J.,,Universite Paris-Saclay,Saint-Aubin,France,,,,,2019-01-01,2019,Electronic Notes in Theoretical Computer Science,15710661,20569,,Journal,345,,,37-61,,,1,1,repositoryam,Green,,,
125,2-s2.0-85075144746,10.1016/j.entcs.2019.07.014,S1571066119300337,,Domain-complete and LCS-complete Spaces,cp,Conference Paper,De Brecht M.,,Kyoto University,Kyoto,Japan,,,,,2019-01-01,2019,Electronic Notes in Theoretical Computer Science,15710661,20569,,Journal,345,,,3-35,,,7,1,repositoryam,Green,,,
126,2-s2.0-85075129180,10.1016/j.entcs.2019.07.022,S1571066119300416,,A Cartesian Closed Category of Domains with Almost Algebraic Bases,cp,Conference Paper,Lyu Z.,,CNRS Centre National de la Recherche Scientifique,Paris,France,,,,,2019-01-01,2019,Electronic Notes in Theoretical Computer Science,15710661,20569,,Journal,345,,,143-168,,,0,1,publisherfullgold,Gold,,,
127,2-s2.0-85075078828,10.1007/978-3-030-31175-9_18,,,Fooling the Parallel or Tester with Probability 8/27,ch,Book Chapter,Goubault-Larrecq J.,,École Normale Supérieure Paris-Saclay,Cachan,France,,,,,2019-01-01,2019,Lecture Notes in Computer Science (including subseries Lecture Notes in Artificial Intelligence and Lecture Notes in Bioinformatics),03029743,25674,16113349,Book Series,11760 LNCS,,,313-328,,,0,0,repositoryam,Green,,,
128,2-s2.0-85074922709,10.24963/ijcai.2019/220,,,Reasoning about quality and fuzziness of strategic behaviours,cp,Conference Paper,Bouyer P.,,Universite Paris-Saclay,Saint-Aubin,France,,,,,2019-01-01,2019,IJCAI International Joint Conference on Artificial Intelligence,10450823,19400157504,,Conference Proceeding,2019-August,,,1588-1594,,,5,1,repositoryam,Green,,,
129,2-s2.0-85074563855,,,,Unboxing mutually recursive type definitions in ocaml,cp,Conference Paper,Colin S.,,,,,,,,,2019-01-01,2019,JFLA 2019 - Journees Francophones des Langages Applicatifs,,21101022806,,Conference Proceeding,,,,173-192,,,1,0,,,,,
130,2-s2.0-85074157688,10.23638/LMCS-15(3:33)2019,,,The complexity of flat freeze LTL,ar,Article,Bollig B.,,Universite Paris-Saclay,Saint-Aubin,France,,,,,2019-01-01,2019,Logical Methods in Computer Science,,19700175752,18605974,Journal,15,3,33,,,,4,0,,,,,
131,2-s2.0-85073900959,10.1007/978-3-030-24886-4_13,,,Logics for reversible regular languages and semigroups with involution,cp,Conference Paper,Gastin P.,,École Normale Supérieure Paris-Saclay,Cachan,France,,,,,2019-01-01,2019,Lecture Notes in Computer Science (including subseries Lecture Notes in Artificial Intelligence and Lecture Notes in Bioinformatics),03029743,25674,16113349,Book Series,11647 LNCS,,,182-191,,,2,0,repositoryam,Green,,,
132,2-s2.0-85073541123,10.1007/978-3-030-31784-3_1,,,A Note on Game Theory and Verification,cp,Conference Paper,Bouyer P.,,École Normale Supérieure Paris-Saclay,Cachan,France,,,,,2019-01-01,2019,Lecture Notes in Computer Science (including subseries Lecture Notes in Artificial Intelligence and Lecture Notes in Bioinformatics),03029743,25674,16113349,Book Series,11781 LNCS,,,3-22,,,1,0,repositoryam,Green,,,
133,2-s2.0-85072855831,10.1007/978-3-030-30806-3_15,,,Coverability Is Undecidable in One-Dimensional Pushdown Vector Addition Systems with Resets,cp,Conference Paper,Schmitz S.,,École Normale Supérieure Paris-Saclay;IUF,Cachan;Paris,France;France,,,,,2019-01-01,2019,Lecture Notes in Computer Science (including subseries Lecture Notes in Artificial Intelligence and Lecture Notes in Bioinformatics),03029743,25674,16113349,Book Series,11674 LNCS,,,193-201,,,2,0,repositoryam,Green,,,
134,2-s2.0-85070395272,10.23638/LMCS-15(2:6)2019,,,The height of Piecewise-Testable languages and the complexity of the logic of subwords,ar,Article,Karandikar P.,,Laboratoire Spécification et Vérification;CMI,Gif-sur-Yvette;Chennai,France;India,,,,,2019-01-01,2019,Logical Methods in Computer Science,,19700175752,18605974,Journal,15,2,,6:1-6:27,,,8,0,,,,,
135,2-s2.0-85069839244,10.1007/978-3-030-25540-4_3,,,Fast Algorithms for Handling Diagonal Constraints in Timed Automata,cp,Conference Paper,Gastin P.,,École Normale Supérieure Paris-Saclay,Cachan,France,,,,,2019-01-01,2019,Lecture Notes in Computer Science (including subseries Lecture Notes in Artificial Intelligence and Lecture Notes in Bioinformatics),03029743,25674,16113349,Book Series,11561 LNCS,,,41-59,,,4,1,repositoryam,Green,,,
136,2-s2.0-85069195029,10.1007/978-3-030-23703-5_8,,,Controlled recurrence of a biped with torso,cp,Conference Paper,Le Coënt A.,,Aalborg University,Aalborg,Denmark,,,,,2019-01-01,2019,Lecture Notes in Computer Science (including subseries Lecture Notes in Artificial Intelligence and Lecture Notes in Bioinformatics),03029743,25674,16113349,Book Series,11615 LNCS,,,154-169,,,0,0,repositoryam,Green,,,
