,eid,doi,pii,pubmed_id,title,subtype,subtypeDescription,creator,afid,affilname,affiliation_city,affiliation_country,author_count,author_names,author_ids,author_afids,coverDate,coverDisplayDate,publicationName,issn,source_id,eIssn,aggregationType,volume,issueIdentifier,article_number,pageRange,description,authkeywords,citedby_count,openaccess,freetoread,freetoreadLabel,fund_acr,fund_no,fund_sponsor
137,2-s2.0-85068363075,10.1007/978-3-030-03769-7_12,,,Efficient timed diagnosis using automata with timed domains,cp,Conference Paper,Bouyer P.,,École Normale Supérieure Paris-Saclay,Cachan,France,,,,,2019-01-01,2019,Lecture Notes in Computer Science (including subseries Lecture Notes in Artificial Intelligence and Lecture Notes in Bioinformatics),03029743,25674,16113349,Book Series,11237,,,205-221,,,3,0,repositoryam,Green,,,
138,2-s2.0-85068239721,10.1007/978-3-030-21363-3_1,,,Modular descriptions of regular functions,cp,Conference Paper,Gastin P.,,École Normale Supérieure Paris-Saclay,Cachan,France,,,,,2019-01-01,2019,Lecture Notes in Computer Science (including subseries Lecture Notes in Artificial Intelligence and Lecture Notes in Bioinformatics),03029743,25674,16113349,Book Series,11545 LNCS,,,3-9,,,1,0,repositoryam,Green,,,
139,2-s2.0-85067825559,10.1007/978-3-030-21571-2_23,,,Coverability and Termination in Recursive Petri Nets,cp,Conference Paper,Finkel A.,,École Normale Supérieure Paris-Saclay,Cachan,France,,,,,2019-01-01,2019,Lecture Notes in Computer Science (including subseries Lecture Notes in Artificial Intelligence and Lecture Notes in Bioinformatics),03029743,25674,16113349,Book Series,11522 LNCS,,,429-448,,,2,0,repositoryam,Green,,,
140,2-s2.0-85067818180,10.1007/978-3-030-21571-2_14,,,Generalized Alignment-Based Trace Clustering of Process Behavior,cp,Conference Paper,Boltenhagen M.,,École Normale Supérieure Paris-Saclay,Cachan,France,,,,,2019-01-01,2019,Lecture Notes in Computer Science (including subseries Lecture Notes in Artificial Intelligence and Lecture Notes in Bioinformatics),03029743,25674,16113349,Book Series,11522 LNCS,,,237-257,,,9,0,repositoryam,Green,,,
141,2-s2.0-85067806082,,,,Preface,ed,Editorial,Donatelli S.,,Università degli Studi di Torino,Turin,Italy,,,,,2019-01-01,2019,Lecture Notes in Computer Science (including subseries Lecture Notes in Artificial Intelligence and Lecture Notes in Bioinformatics),03029743,25674,16113349,Book Series,11522 LNCS,,,vii-viii,,,0,0,,,,,
142,2-s2.0-85067437080,10.3233/JCS-171070,,,A method for unbounded verification of privacy-type properties,ar,Article,Hirschi L.,,INRIA Institut National de Recherche en Informatique et en Automatique,Le Chesnay,France,,,,,2019-01-01,2019,Journal of Computer Security,0926227X,28931,,Journal,27,3,,277-342,,,6,0,repositoryam,Green,,,
143,2-s2.0-85065997651,10.1007/978-3-030-19570-0_45,,,Axiomatising Logics with Separating Conjunction and Modalities,cp,Conference Paper,Demri S.,,École Normale Supérieure Paris-Saclay,Cachan,France,,,,,2019-01-01,2019,Lecture Notes in Computer Science (including subseries Lecture Notes in Artificial Intelligence and Lecture Notes in Bioinformatics),03029743,25674,16113349,Book Series,11468 LNAI,,,692-708,,,7,0,repositoryam,Green,,,
144,2-s2.0-85064948450,10.1007/978-3-030-17127-8_7,,,Identifiers in Registers: Describing Network Algorithms with Logic,cp,Conference Paper,Bollig B.,,École Normale Supérieure Paris-Saclay,Cachan,France,,,,,2019-01-01,2019,Lecture Notes in Computer Science (including subseries Lecture Notes in Artificial Intelligence and Lecture Notes in Bioinformatics),03029743,25674,16113349,Book Series,11425 LNCS,,,115-132,,,2,1,repositoryam,Green,,,
145,2-s2.0-85061088989,10.1007/978-3-030-11245-5_19,,,Verification of an industrial asynchronous leader election algorithm using abstractions and parametric model checking,cp,Conference Paper,André É.,,Japanese-French Laboratory for Informatics;Research Organization of Information and Systems National Institute of Informatics;University Sorbonne Paris Nord,Tokyo;Tokyo;Villetaneuse,Japan;Japan;France,,,,,2019-01-01,2019,Lecture Notes in Computer Science (including subseries Lecture Notes in Artificial Intelligence and Lecture Notes in Bioinformatics),03029743,25674,16113349,Book Series,11388 LNCS,,,409-424,,,3,0,repositoryam,Green,,,
146,2-s2.0-85061075293,10.1007/978-3-030-11245-5_26,,,Combining refinement of parametric models with goal-oriented reduction of dynamics,cp,Conference Paper,Haar S.,,École Normale Supérieure Paris-Saclay,Cachan,France,,,,,2019-01-01,2019,Lecture Notes in Computer Science (including subseries Lecture Notes in Artificial Intelligence and Lecture Notes in Bioinformatics),03029743,25674,16113349,Book Series,11388 LNCS,,,555-576,,,0,0,repositoryam,Green,,,
147,2-s2.0-85059030464,10.1109/JESTPE.2018.2889152,,,PI Passivity-Based Control and Performance Analysis of MMC Multiterminal HVDC Systems,ar,Article,Bergna-Diaz G.,,Norges Teknisk-Naturvitenskapelige Universitet,Trondheim,Norway,,,,,2019-01-01,2019,IEEE Journal of Emerging and Selected Topics in Power Electronics,21686777,21100338359,21686785,Journal,7,4,8585134,2453-2466,,,24,0,repositoryam,Green,,,
148,2-s2.0-85061122206,10.1109/ASYNC.2018.00025,,,Fast all-digital clock frequency adaptation circuit for voltage droop tolerance,cp,Conference Paper,Fuegger M.,,INRIA Institut National de Recherche en Informatique et en Automatique,Le Chesnay,France,,,,,2018-12-26,26 December 2018,Proceedings - International Symposium on Asynchronous Circuits and Systems,15228681,700147014,,Conference Proceeding,2018-May,,8589986,68-77,,,3,0,repositoryam,Green,,,
149,2-s2.0-85079487623,10.4230/LIPIcs.FSTTCS.2018.31,,,Reachability for two-counter machines with one test and one reset,cp,Conference Paper,Finkel A.,,Universite Paris-Saclay,Saint-Aubin,France,,,,,2018-12-01,December 2018,"Leibniz International Proceedings in Informatics, LIPIcs",18688969,21100244929,,Conference Proceeding,122,,31,,,,3,0,,,,,
150,2-s2.0-85079483050,10.4230/LIPIcs.FSTTCS.2018.20,,,Hyper partial order logic,cp,Conference Paper,Bérard B.,,Sorbonne Universite,Paris,France,,,,,2018-12-01,December 2018,"Leibniz International Proceedings in Informatics, LIPIcs",18688969,21100244929,,Conference Proceeding,122,,20,,,,1,0,,,,,
151,2-s2.0-85078044502,10.4230/LIPIcs.FSTTCS.2018.42,,,Extending propositional separation logic for robustness properties,cp,Conference Paper,Mansutti A.,,École Normale Supérieure Paris-Saclay,Cachan,France,,,,,2018-12-01,December 2018,"Leibniz International Proceedings in Informatics, LIPIcs",18688969,21100244929,,Conference Proceeding,122,,42,,,,3,0,,,,,
152,2-s2.0-85077132818,10.4230/LIPIcs.FSTTCS.2018.15,,,A hypersequent calculus with clusters for tense logic over ordinals,cp,Conference Paper,Baelde D.,,Universite Paris-Saclay,Saint-Aubin,France,,,,,2018-12-01,December 2018,"Leibniz International Proceedings in Informatics, LIPIcs",18688969,21100244929,,Conference Proceeding,122,,15,,,,1,0,,,,,
153,2-s2.0-85071624567,10.4230/LIPIcs.FSTTCS.2018.38,,,Extending finite-memory determinacy by Boolean combination of winning conditions,cp,Conference Paper,Le Roux S.,,École Normale Supérieure Paris-Saclay,Cachan,France,,,,,2018-12-01,December 2018,"Leibniz International Proceedings in Informatics, LIPIcs",18688969,21100244929,,Conference Proceeding,122,,38,,,,9,0,,,,,
154,2-s2.0-85053757772,10.1016/j.automatica.2018.09.005,S0005109818304308,,Optimal multirate sampling in symbolic models for incrementally stable switched systems,ar,Article,Saoud A.,,CNRS Centre National de la Recherche Scientifique;Laboratoire des Signaux et Systèmes,Paris;Gif-sur-Yvette,France;France,,,,,2018-12-01,December 2018,Automatica,00051098,24909,,Journal,98,,,58-65,,,8,0,repositoryam,Green,,,
155,2-s2.0-85033462243,10.1007/s10703-017-0305-8,,,An improved algorithm for the control synthesis of nonlinear sampled switched systems,ar,Article,Le Coënt A.,,Universite Paris-Saclay,Saint-Aubin,France,,,,,2018-12-01,1 December 2018,Formal Methods in System Design,09259856,12262,15728102,Journal,53,3,,363-383,,,5,0,repositoryam,Green,,,
156,2-s2.0-85031500360,10.1007/s00236-017-0306-5,,,Hierarchical information and the synthesis of distributed strategies,ar,Article,Berwanger D.,,Universite Paris-Saclay,Saint-Aubin,France,,,,,2018-12-01,1 December 2018,Acta Informatica,00015903,15012,14320525,Journal,55,8,,669-701,,,8,1,repositoryam,Green,,,
157,2-s2.0-85025645370,10.1007/s10703-017-0282-y,,,Realizability of concurrent recursive programs,ar,Article,Bollig B.,,CNRS Centre National de la Recherche Scientifique,Paris,France,,,,,2018-12-01,1 December 2018,Formal Methods in System Design,09259856,12262,15728102,Journal,53,3,,339-362,,,1,0,repositoryam,Green,,,
158,2-s2.0-85044539173,10.1016/j.tcs.2018.01.021,S0304397518300689,,Compositional synthesis of state-dependent switching control,ar,Article,Le Coënt A.,,Centre Borelli,Gif-sur-Yvette,France,,,,,2018-11-30,30 November 2018,Theoretical Computer Science,03043975,20571,,Journal,750,,,53-68,,,3,0,,,,,
159,2-s2.0-85044503027,10.1016/j.tcs.2018.01.019,S0304397518300665,,On the complexity of resource-bounded logics,ar,Article,Alechina N.,,University of Nottingham,Nottingham,United Kingdom,,,,,2018-11-30,30 November 2018,Theoretical Computer Science,03043975,20571,,Journal,750,,,69-100,,,8,1,repositoryam,Green,,,
160,2-s2.0-85049465969,10.23919/ECC.2018.8550622,,,On the Composition of Discrete and Continuous-time Assume-Guarantee Contracts for Invariance,cp,Conference Paper,Saoud A.,,Universite Paris-Saclay;CNRS Centre National de la Recherche Scientifique,Saint-Aubin;Paris,France;France,,,,,2018-11-27,27 November 2018,"2018 European Control Conference, ECC 2018",,21100894519,,Conference Proceeding,,,8550622,435-440,,,16,0,repositoryam,Green,,,
161,2-s2.0-85056907792,10.1145/3243734.3243825,,,Symbolic proofs for lattice-based cryptography,cp,Conference Paper,Barthe G.,,IMDEA Software Institute,Pozuelo de Alarcon,Spain,,,,,2018-10-15,15 October 2018,Proceedings of the ACM Conference on Computer and Communications Security,15437221,110362,,Conference Proceeding,,,,538-555,,,7,0,repositoryvor,Green,,,
162,2-s2.0-85083020081,10.1016/j.jlamp.2018.03.004,S2352220817300548,,When are stochastic transition systems tameable?,ar,Article,Bertrand N.,,INRIA Institut National de Recherche en Informatique et en Automatique,Le Chesnay,France,,,,,2018-10-01,October 2018,Journal of Logical and Algebraic Methods in Programming,,21100403130,23522216,Journal,99,,,41-96,,,4,0,repositoryam,Green,,,
163,2-s2.0-85059610807,10.4230/LIPIcs.DISC.2018.27,,,Fast multidimensional asymptotic and approximate consensus,cp,Conference Paper,Függer M.,,Universite Paris-Saclay,Saint-Aubin,France,,,,,2018-10-01,1 October 2018,"Leibniz International Proceedings in Informatics, LIPIcs",18688969,21100244929,,Conference Proceeding,121,,27,,,,4,0,,,,,
164,2-s2.0-85055593875,10.4230/LIPIcs.TIME.2018.1,,,On temporal and separation logics,cp,Conference Paper,Demri S.,,Universite Paris-Saclay,Saint-Aubin,France,,,,,2018-10-01,1 October 2018,"Leibniz International Proceedings in Informatics, LIPIcs",18688969,21100244929,,Conference Proceeding,120,,,,,,1,0,,,,,
165,2-s2.0-85056258764,10.4204/EPTCS.277.18,,,Multi-weighted Markov decision processes with reachability objectives,cp,Conference Paper,Bouyer P.,,École Normale Supérieure Paris-Saclay,Cachan,France,,,,,2018-09-07,7 September 2018,"Electronic Proceedings in Theoretical Computer Science, EPTCS",20752180,21100244944,,Conference Proceeding,277,,,250-264,,,4,1,repositoryam,Green,,,
166,2-s2.0-85053640008,10.4230/LIPIcs.CONCUR.2018.28,,,Reachability in timed automata with diagonal constraints,cp,Conference Paper,Gastin P.,,Universite Paris-Saclay,Saint-Aubin,France,,,,,2018-08-01,1 August 2018,"Leibniz International Proceedings in Informatics, LIPIcs",18688969,21100244929,,Conference Proceeding,118,,28,,,,10,0,,,,,
167,2-s2.0-85053608594,10.4230/LIPIcs.CONCUR.2018.7,,,It is easy to be wise after the event: Communicating finite-state machines capture first-order logic with “happened before”,cp,Conference Paper,Bollig B.,,École Normale Supérieure Paris-Saclay,Cachan,France,,,,,2018-08-01,1 August 2018,"Leibniz International Proceedings in Informatics, LIPIcs",18688969,21100244929,,Conference Proceeding,118,,7,,,,1,0,,,,,
168,2-s2.0-85053189587,10.4230/LIPIcs.MFCS.2018.9,,,Linking focusing and resolution with selection,cp,Conference Paper,Burel G.,,Universite Paris-Saclay;École Normale Supérieure Paris-Saclay,Saint-Aubin;Cachan,France;France,,,,,2018-08-01,1 August 2018,"Leibniz International Proceedings in Informatics, LIPIcs",18688969,21100244929,,Conference Proceeding,117,,9,,,,1,0,,,,,
169,2-s2.0-85053067373,10.4230/LIPIcs.CSL.2018.26,,,Finite bisimulations for dynamical systems with overlapping trajectories,cp,Conference Paper,Bérard B.,,Sorbonne Universite,Paris,France,,,,,2018-08-01,1 August 2018,"Leibniz International Proceedings in Informatics, LIPIcs",18688969,21100244929,,Conference Proceeding,119,,26,,,,0,0,,,,,
170,2-s2.0-85050233788,10.1007/s00165-018-0460-8,,,Parameterized verification of monotone information systems,ar,Article,Chane-Yack-Fa R.,,Université de Sherbrooke,Sherbrooke,Canada,,,,,2018-08-01,1 August 2018,Formal Aspects of Computing,09345043,24980,1433299X,Journal,30,3-4,,463-489,,,0,0,repositoryam,Green,,,
171,2-s2.0-85043469872,10.1109/TC.2018.2808185,,,Metastability-Containing Circuits,ar,Article,Friedrichs S.,,Max Planck Institute for Informatics,Saarbrucken,Germany,,,,,2018-08-01,1 August 2018,IEEE Transactions on Computers,00189340,25033,,Journal,67,8,,1167-1183,,,9,1,repositoryam,Green,,,
172,2-s2.0-85032365939,10.1007/s10703-017-0303-x,,,"On the complexity of monitoring Orchids signatures, and recurrence equations",ar,Article,Goubault-Larrecq J.,,École Normale Supérieure Paris-Saclay,Cachan,France,,,,,2018-08-01,1 August 2018,Formal Methods in System Design,09259856,12262,15728102,Journal,53,1,,6-32,,,1,0,repositoryam,Green,,,
173,2-s2.0-85027164185,10.1016/j.tcs.2017.07.007,S0304397517305455,,Equivalence between model-checking flat counter systems and Presburger arithmetic,ar,Article,Demri S.,,Laboratoire Spécification et Vérification,Gif-sur-Yvette,France,,,,,2018-07-29,29 July 2018,Theoretical Computer Science,03043975,20571,,Journal,735,,,2-23,,,0,0,repositoryam,Green,,,
174,2-s2.0-85009349958,10.1016/j.tcs.2016.12.003,S0304397516307095,,Interval iteration algorithm for MDPs and IMDPs,ar,Article,Haddad S.,,INRIA Institut National de Recherche en Informatique et en Automatique,Le Chesnay,France,,,,,2018-07-29,29 July 2018,Theoretical Computer Science,03043975,20571,,Journal,735,,,111-131,,,29,0,repositoryam,Green,,,
175,2-s2.0-84977074382,10.1016/j.tcs.2016.06.017,S0304397516302535,,Context-free commutative grammars with integer counters and resets,ar,Article,Chistikov D.,,University of Oxford;Max Planck Institute for Software Systems,Oxford;Saarbrucken,United Kingdom;Germany,,,,,2018-07-29,29 July 2018,Theoretical Computer Science,03043975,20571,,Journal,735,,,147-161,,,8,0,repositoryam,Green,,,
176,2-s2.0-85052457539,10.1145/3212734.3212762,,,Tight bounds for asymptotic and approximate consensus,cp,Conference Paper,Függer M.,,INRIA Institut National de Recherche en Informatique et en Automatique,Le Chesnay,France,,,,,2018-07-23,23 July 2018,Proceedings of the Annual ACM Symposium on Principles of Distributed Computing,,94067,,Conference Proceeding,,,,325-334,,,5,0,repositoryam,Green,,,
177,2-s2.0-85051104378,10.1145/3209108.3209182,,,Regular transducer expressions for regular transformations,cp,Conference Paper,Dave V.,,Indian Institute of Technology Bombay,Mumbai,India,,,,,2018-07-09,9 July 2018,Proceedings - Symposium on Logic in Computer Science,10436871,25562,,Conference Proceeding,,,,315-324,,,10,0,repositoryam,Green,,,
178,2-s2.0-85056201464,10.4204/EPTCS.274.4,,,Abstract representation of binders in OCaml using the bindlib library,cp,Conference Paper,Lepigre R.,,Universite Paris-Saclay,Saint-Aubin,France,,,,,2018-07-03,3 July 2018,"Electronic Proceedings in Theoretical Computer Science, EPTCS",20752180,21100244944,,Conference Proceeding,274,,,42-56,,,1,1,repositoryam,Green,,,
179,2-s2.0-85056154159,10.4204/EPTCS.274.5,,,Sharing a library between proof assistants: Reaching out to the HOL family,cp,Conference Paper,Thiré F.,,Universite Paris-Saclay,Saint-Aubin,France,,,,,2018-07-03,3 July 2018,"Electronic Proceedings in Theoretical Computer Science, EPTCS",20752180,21100244944,,Conference Proceeding,274,,,57-71,,,6,1,repositoryam,Green,,,
180,2-s2.0-85062177754,10.1109/CDC.2018.8619415,,,On Physical Modeling of Lithium-Ion Cells and Adaptive Estimation of their State-of-Charge,cp,Conference Paper,Zonetti D.,,CNRS Centre National de la Recherche Scientifique,Paris,France,,,,,2018-07-02,2 July 2018,Proceedings of the IEEE Conference on Decision and Control,07431546,87424,25762370,Conference Proceeding,2018-December,,8619415,2176-2181,,,0,0,,,,,
181,2-s2.0-85062169304,10.1109/CDC.2018.8619099,,,Contract Based Design of Symbolic Controllers for Interconnected Multiperiodic Sampled-Data Systems,cp,Conference Paper,Saoud A.,,CNRS Centre National de la Recherche Scientifique,Paris,France,,,,,2018-07-02,2 July 2018,Proceedings of the IEEE Conference on Decision and Control,07431546,87424,25762370,Conference Proceeding,2018-December,,8619099,773-779,,,15,0,repositoryam,Green,,,
182,2-s2.0-85054045003,10.1007/978-3-319-10575-8_30,,,Verification of hybrid systems,ch,Book Chapter,Doyen L.,,CNRS Centre National de la Recherche Scientifique,Paris,France,,,,,2018-05-18,18 May 2018,Handbook of Model Checking,,21100878585,,Book,,,,1047-1110,,,31,0,,,,,
183,2-s2.0-85054044575,10.1007/978-3-319-10575-8_29,,,Model checking real-time systems,ch,Book Chapter,Bouyer P.,,CNRS Centre National de la Recherche Scientifique,Paris,France,,,,,2018-05-18,18 May 2018,Handbook of Model Checking,,21100878585,,Book,,,,1001-1046,,,17,0,repositoryam,Green,,,
184,2-s2.0-85055790440,10.23638/LMCS-14(2:8)2018,,,Analyzing timed systems using tree automata,ar,Article,Akshay S.,,Indian Institute of Technology Bombay,Mumbai,India,,,,,2018-05-09,9 May 2018,Logical Methods in Computer Science,,19700175752,18605974,Journal,14,2,8,,,,5,0,,,,,
185,2-s2.0-85048813984,10.23919/DATE.2018.8342219,,,A faithful binary circuit model with adversarial noise,cp,Conference Paper,Fugger M.,,Laboratoire Spécification et Vérification,Gif-sur-Yvette,France,,,,,2018-04-19,19 April 2018,"Proceedings of the 2018 Design, Automation and Test in Europe Conference and Exhibition, DATE 2018",,21100865105,,Conference Proceeding,2018-January,,,1327-1332,,,1,0,repositoryam,Green,,,
186,2-s2.0-85045695713,10.1017/S0956796818000072,S0956796818000072,,Size-based termination of higher-order rewriting,undefined,,BLANQUI F.,,Universite Paris-Saclay,Saint-Aubin,France,,,,,2018-04-19,19 April 2018,Journal of Functional Programming,09567968,28345,14697653,Journal,,,,,,,4,0,repositoryam,Green,,,
187,2-s2.0-85049437884,10.1145/3178126.3187001,,,Poster: Contract based design of symbolic controllers for vehicle platooning,cp,Conference Paper,Saoud A.,,Laboratoire des Signaux et Systèmes,Gif-sur-Yvette,France,,,,,2018-04-11,11 April 2018,HSCC 2018 - Proceedings of the 21st International Conference on Hybrid Systems: Computation and Control (part of CPS Week),,21100866820,,Conference Proceeding,,,,277-278,,,3,0,repositoryvor,Green,,,
188,2-s2.0-85045239193,10.1016/j.entcs.2018.03.009,S1571066118300112,,Unfolding of Parametric Boolean Networks,ar,Article,Kolčák J.,,Masaryk University;INRIA Institut National de Recherche en Informatique et en Automatique,Brno;Le Chesnay,Czech Republic;France,,,,,2018-04-10,10 April 2018,Electronic Notes in Theoretical Computer Science,15710661,20569,,Journal,335,,,67-90,,,2,1,repositoryam,Green,,,
189,2-s2.0-85037527103,10.1016/j.ipl.2017.11.012,S0020019017302065,,Memoryless determinacy of finite parity games: Another simple proof,ar,Article,Haddad S.,,École Normale Supérieure Paris-Saclay,Cachan,France,,,,,2018-04-01,April 2018,Information Processing Letters,00200190,14388,,Journal,132,,,19-21,,,1,0,repositoryam,Green,,,
190,2-s2.0-85029509003,10.1016/j.ic.2017.05.006,S0890540117301475,,An automata-theoretic approach to the verification of distributed algorithms,ar,Article,Aiswarya C.,,Chennai Mathematical Institute,Kelambakkam,India,,,,,2018-04-01,April 2018,Information and Computation,08905401,25509,10902651,Journal,259,,,305-327,,,5,1,repositoryam,Green,,,
191,2-s2.0-85026811276,10.1007/s10626-017-0259-4,,,Opacity for linear constraint Markov chains,ar,Article,Bérard B.,,Laboratoire Spécification et Vérification;Sorbonne Universite,Gif-sur-Yvette;Paris,France;France,,,,,2018-03-01,1 March 2018,Discrete Event Dynamic Systems: Theory and Applications,09246703,28967,15737594,Journal,28,1,,83-108,,,0,0,repositoryam,Green,,,
192,2-s2.0-85020071703,10.1017/S0960129517000044,S0960129517000044,,Cellular automata over generalized Cayley graphs,ar,Article,Arrighi P.,,Laboratoire d’Informatique et Systèmes,Marseille,France,,,,,2018-03-01,1 March 2018,Mathematical Structures in Computer Science,09601295,5000157801,,Journal,28,3,,340-383,,,6,0,repositoryam,Green,,,
193,2-s2.0-84978803469,10.1007/s00236-016-0274-1,,,Average-energy games,ar,Article,Bouyer P.,,Laboratoire Spécification et Vérification,Gif-sur-Yvette,France,,,,,2018-03-01,1 March 2018,Acta Informatica,00015903,15012,14320525,Journal,55,2,,91-127,,,23,0,repositoryam,Green,,,
194,2-s2.0-85044538237,10.4230/LIPIcs.STACS.2018.34,,,Dependences in strategy logic,cp,Conference Paper,Gardy P.,,Universite Paris-Saclay,Saint-Aubin,France,,,,,2018-02-02,2 February 2018,"Leibniz International Proceedings in Informatics, LIPIcs",18688969,21100244929,,Conference Proceeding,96,,34,,,,3,0,,,,,
195,2-s2.0-85044536799,10.4230/LIPIcs.STACS.2018.32,,,Knapsack problems for wreath products,cp,Conference Paper,Ganardi M.,,Universität Siegen,Siegen,Germany,,,,,2018-02-02,2 February 2018,"Leibniz International Proceedings in Informatics, LIPIcs",18688969,21100244929,,Conference Proceeding,96,,32,,,,8,0,,,,,
196,2-s2.0-85044513956,10.4230/LIPIcs.STACS.2018.17,,,Communicating finite-state machines and two-variable logic,cp,Conference Paper,Bollig B.,,Universite Paris-Saclay,Saint-Aubin,France,,,,,2018-02-02,2 February 2018,"Leibniz International Proceedings in Informatics, LIPIcs",18688969,21100244929,,Conference Proceeding,96,,17,,,,2,0,,,,,
197,2-s2.0-85045200954,10.1142/S0129054118400026,,,Consensus Game Acceptors and Iterated Transductions,cp,Conference Paper,Berwanger D.,,Universite Paris-Saclay,Saint-Aubin,France,,,,,2018-02-01,1 February 2018,International Journal of Foundations of Computer Science,01290541,4700152641,,Journal,29,2,,165-185,,,0,0,repositoryam,Green,,,
198,2-s2.0-85033576011,10.1016/j.ic.2017.11.001,S089054011730216X,,Handling infinitely branching well-structured transition systems,ar,Article,Blondin M.,,University of Montreal;École Normale Supérieure Paris-Saclay,Montreal;Cachan,Canada;France,,,,,2018-02-01,February 2018,Information and Computation,08905401,25509,10902651,Journal,258,,,28-49,,,4,1,publisherfree2read,Bronze,,,
199,2-s2.0-84952015897,10.1007/s00500-015-1952-6,,,A unifying survey on weighted logics and weighted automata: Core weighted logic: minimal and versatile specification of quantitative properties,ar,Article,Gastin P.,,Universite Paris-Saclay,Saint-Aubin,France,,,,,2018-02-01,1 February 2018,Soft Computing,14327643,28554,14337479,Journal,22,4,,1047-1065,,,7,0,repositoryam,Green,,,
200,2-s2.0-85055793962,10.23638/LMCS-14(1:7)2018,,,The Ho-Zhao problem,ar,Article,Ho W.,,National Institute of Education,Singapore City,Singapore,,,,,2018-01-17,17 January 2018,Logical Methods in Computer Science,,19700175752,18605974,Journal,14,1,7,,,,13,0,,,,,
201,2-s2.0-85055790282,10.23638/LMCS-14(1:1)2018,,,Compatibility properties of synchronously and asynchronously communicating components,ar,Article,Hennicker R.,,Ludwig-Maximilians-Universität München,Munich,Germany,,,,,2018-01-09,9 January 2018,Logical Methods in Computer Science,,19700175752,18605974,Journal,14,1,1,,,,5,0,,,,,
202,2-s2.0-85071920598,,,,A hypersequent calculus with clusters for linear frames,cp,Conference Paper,Baelde D.,,Universite Paris-Saclay,Saint-Aubin,France,,,,,2018-01-01,2018,Advances in Modal Logic,,21100332237,,Conference Proceeding,12,,,43-62,,,4,0,,,,,
203,2-s2.0-85068006578,10.1007/978-3-319-97879-6_17,,,Reasoning About Reversal-Bounded Counter Machines,ch,Book Chapter,Demri S.,,École Normale Supérieure Paris-Saclay,Cachan,France,,,,,2018-01-01,2018,Outstanding Contributions to Logic,22112758,21100913603,22112766,Book Series,17,,,441-479,,,0,0,repositoryam,Green,,,
204,2-s2.0-85060209502,10.23638/LMCS-14(4:5)2018,,,The complexity of bisimulation and simulation on finite systems,ar,Article,Ganardi M.,,Universität Siegen,Siegen,Germany,,,,,2018-01-01,2018,Logical Methods in Computer Science,,19700175752,18605974,Journal,14,4-5,,1-29,,,0,0,,,,,
205,2-s2.0-85057201447,10.1007/978-3-662-58381-4_9,,,MCC’2017 – The Seventh Model Checking Contest,ch,Book Chapter,Kordon F.,,Sorbonne Universite,Paris,France,,,,,2018-01-01,2018,Lecture Notes in Computer Science (including subseries Lecture Notes in Artificial Intelligence and Lecture Notes in Bioinformatics),03029743,25674,16113349,Book Series,11090 LNCS,,,181-209,,,7,0,repositoryam,Green,,,
206,2-s2.0-85056894319,,,,Deciding hedged bisimilarity,cp,Conference Paper,Mansutti A.,,Universite Paris-Saclay;Università degli Studi di Udine,Saint-Aubin;Udine,France;Italy,,,,,2018-01-01,2018,CEUR Workshop Proceedings,16130073,21100218356,,Conference Proceeding,2243,,,218-229,,,0,0,,,,,
207,2-s2.0-85055499008,,,,On the complexity of modal separation logics,cp,Conference Paper,Demri S.,,Universite Paris-Saclay,Saint-Aubin,France,,,,,2018-01-01,2018,Advances in Modal Logic,,21100332237,,Conference Proceeding,12,,,179-198,,,7,0,,,,,
